[32m[I 2023-05-31 00:14:46,207][0m Trial 67 finished with values: [0.9595345449682441, 0.3751236925740018, 0.6622440848155516] and parameters: {'learning_rate': 0.006051196638551918, 'norm': 'minmax', 'weight_decay': 9.333614979831433e-12, 'train_batch_size': 19, 'training_loss': 'logcosh', 'model_name': 'unet'}. [0m
INFO:echo.src.base_objective:Attempting to automatically update the model configuration using optuna's suggested parameters
INFO:echo.src.base_objective:	data:norm : zscore
INFO:echo.src.base_objective:	model:name : fpn
INFO:echo.src.base_objective:	optimizer:learning_rate : 0.0038114665976858738
INFO:echo.src.base_objective:	trainer:train_batch_size : 26
INFO:echo.src.base_objective:	trainer:weight_decay : 3.029566961319655e-07
INFO:echo.src.base_objective:	trainer:training_loss : xsigmoid
INFO:echo.src.base_objective:Beginning trial 68
INFO:root:Loading model fpn with settings {'in_channels': 4, 'classes': 1, 'activation': 'sigmoid'}
INFO:root:Loading loss smooth
INFO:root:Loading loss smooth
INFO:echo.src.base_objective:Saving trial 68 results to local file /glade/work/kdagon/s2sml/results_week3_SH_530/trial_results/trial_results_31824.gusched01.csv
INFO:echo.src.base_objective:Merging trial results and saving to /glade/work/kdagon/s2sml/results_week3_SH_530/trial_results.csv
[32m[I 2023-05-31 00:20:58,915][0m Trial 68 finished with values: [1.1497227781143442, 3.7169787588797947, 2.1086239344550974] and parameters: {'learning_rate': 0.0038114665976858738, 'norm': 'zscore', 'weight_decay': 3.029566961319655e-07, 'train_batch_size': 26, 'training_loss': 'xsigmoid', 'model_name': 'fpn'}. [0m
INFO:echo.src.base_objective:Attempting to automatically update the model configuration using optuna's suggested parameters
INFO:echo.src.base_objective:	data:norm : negone
INFO:echo.src.base_objective:	model:name : fpn
INFO:echo.src.base_objective:	optimizer:learning_rate : 0.00032231148642782444
INFO:echo.src.base_objective:	trainer:train_batch_size : 102
INFO:echo.src.base_objective:	trainer:weight_decay : 2.0853356425761826e-10
INFO:echo.src.base_objective:	trainer:training_loss : xsigmoid
INFO:echo.src.base_objective:Beginning trial 69
INFO:root:Loading model fpn with settings {'in_channels': 4, 'classes': 1, 'activation': 'sigmoid'}
INFO:root:Loading loss smooth
INFO:root:Loading loss smooth
INFO:echo.src.base_objective:Saving trial 66 results to local file /glade/work/kdagon/s2sml/results_week3_SH_530/trial_results/trial_results_31823.gusched01.csv
INFO:echo.src.base_objective:Merging trial results and saving to /glade/work/kdagon/s2sml/results_week3_SH_530/trial_results.csv
[32m[I 2023-05-31 00:21:32,771][0m Trial 66 finished with values: [1.0364037701495064, 3.395332632018668, 2.2545345485328876] and parameters: {'learning_rate': 1.532929296334742e-05, 'norm': 'negone', 'weight_decay': 2.2925092021508307e-11, 'train_batch_size': 72, 'training_loss': 'logcosh', 'model_name': 'manet'}. [0m
INFO:echo.src.base_objective:Attempting to automatically update the model configuration using optuna's suggested parameters
INFO:echo.src.base_objective:	data:norm : negone
INFO:echo.src.base_objective:	model:name : unet++
INFO:echo.src.base_objective:	optimizer:learning_rate : 3.330214868719811e-06
INFO:echo.src.base_objective:	trainer:train_batch_size : 7
INFO:echo.src.base_objective:	trainer:weight_decay : 3.244944872607671e-11
INFO:echo.src.base_objective:	trainer:training_loss : xsigmoid
INFO:echo.src.base_objective:Beginning trial 70
INFO:root:Loading model unet++ with settings {'in_channels': 4, 'classes': 1, 'activation': 'sigmoid'}
INFO:root:Loading loss smooth
INFO:root:Loading loss smooth
INFO:echo.src.base_objective:Saving trial 69 results to local file /glade/work/kdagon/s2sml/results_week3_SH_530/trial_results/trial_results_31824.gusched01.csv
INFO:echo.src.base_objective:Merging trial results and saving to /glade/work/kdagon/s2sml/results_week3_SH_530/trial_results.csv
[32m[I 2023-05-31 00:36:13,773][0m Trial 69 finished with values: [1.0531174757049022, 1.347397944476837, 1.1602708166610778] and parameters: {'learning_rate': 0.00032231148642782444, 'norm': 'negone', 'weight_decay': 2.0853356425761826e-10, 'train_batch_size': 102, 'training_loss': 'xsigmoid', 'model_name': 'fpn'}. [0m
INFO:echo.src.base_objective:Attempting to automatically update the model configuration using optuna's suggested parameters
INFO:echo.src.base_objective:	data:norm : minmax
INFO:echo.src.base_objective:	model:name : fpn
INFO:echo.src.base_objective:	optimizer:learning_rate : 0.0009493527918429322
INFO:echo.src.base_objective:	trainer:train_batch_size : 115
INFO:echo.src.base_objective:	trainer:weight_decay : 1.4117491961052773e-10
INFO:echo.src.base_objective:	trainer:training_loss : mse
INFO:echo.src.base_objective:Beginning trial 71
INFO:root:Loading model fpn with settings {'in_channels': 4, 'classes': 1, 'activation': 'sigmoid'}
INFO:root:Loading loss smooth
INFO:root:Loading loss smooth
INFO:echo.src.base_objective:Saving trial 71 results to local file /glade/work/kdagon/s2sml/results_week3_SH_530/trial_results/trial_results_31824.gusched01.csv
INFO:echo.src.base_objective:Merging trial results and saving to /glade/work/kdagon/s2sml/results_week3_SH_530/trial_results.csv
[32m[I 2023-05-31 00:39:06,385][0m Trial 71 finished with values: [9.466070796855576, 84.24811021130631, 13.045999107815362] and parameters: {'learning_rate': 0.0009493527918429322, 'norm': 'minmax', 'weight_decay': 1.4117491961052773e-10, 'train_batch_size': 115, 'training_loss': 'mse', 'model_name': 'fpn'}. [0m
INFO:echo.src.base_objective:Attempting to automatically update the model configuration using optuna's suggested parameters
INFO:echo.src.base_objective:	data:norm : zscore
INFO:echo.src.base_objective:	model:name : unet++
INFO:echo.src.base_objective:	optimizer:learning_rate : 3.5580408583870545e-06
INFO:echo.src.base_objective:	trainer:train_batch_size : 24
INFO:echo.src.base_objective:	trainer:weight_decay : 9.043315591572403e-08
INFO:echo.src.base_objective:	trainer:training_loss : xtanh
INFO:echo.src.base_objective:Beginning trial 72
INFO:root:Loading model unet++ with settings {'in_channels': 4, 'classes': 1, 'activation': 'sigmoid'}
INFO:root:Loading loss smooth
INFO:root:Loading loss smooth
INFO:echo.src.base_objective:Saving trial 70 results to local file /glade/work/kdagon/s2sml/results_week3_SH_530/trial_results/trial_results_31823.gusched01.csv
INFO:echo.src.base_objective:Merging trial results and saving to /glade/work/kdagon/s2sml/results_week3_SH_530/trial_results.csv
[32m[I 2023-05-31 00:52:12,928][0m Trial 70 finished with values: [1.0225016544358103, 1.9200018167988289, 1.5368984948369102] and parameters: {'learning_rate': 3.330214868719811e-06, 'norm': 'negone', 'weight_decay': 3.244944872607671e-11, 'train_batch_size': 7, 'training_loss': 'xsigmoid', 'model_name': 'unet++'}. [0m
WARNING:root:Stopping early since the longest observed run-time in the study exceeds the time remaining on this node.
INFO:root:Saving trial details to /glade/work/kdagon/s2sml/results_week3_SH_530/
INFO:root:Running on PBS/SLURM batch id: 31825.gusched01
INFO:root:Importing custom objective from /glade/work/kdagon/s2sml/applications/train.py
INFO:echo.src.reporting:Using device 0
INFO:root:Direction of optimization: ['minimize', 'minimize', 'minimize']
INFO:root:Using metric ['valid_custom', 'valid_custom_second', 'valid_custom_third']
[32m[I 2023-05-31 00:52:34,709][0m Using an existing study with name 'vanilla' instead of creating a new one.[0m
INFO:root:Loaded study vanilla located at sqlite:////glade/work/kdagon/s2sml/results_week3_SH_530/s2s.db
INFO:echo.src.base_objective:Worker 31825.gusched01 is summoned.
INFO:echo.src.base_objective:	initializing an objective to be optimized with metric ['valid_custom', 'valid_custom_second', 'valid_custom_third']
INFO:echo.src.base_objective:	using device(s) cuda:0
INFO:echo.src.base_objective:	saving study/trial results to local file /glade/work/kdagon/s2sml/results_week3_SH_530/trial_results/trial_results_31825.gusched01.csv
INFO:root:Running optimization for 1000 trials
INFO:root:Running trials for a maximum PBS wall-time 2:00:00
WARNING:root:Attempting to run trials and stop before hitting the wall-time
WARNING:root:Some trials may not complete if the wall-time is reached. Optuna will start over.
INFO:echo.src.base_objective:Attempting to automatically update the model configuration using optuna's suggested parameters
INFO:echo.src.base_objective:	data:norm : zscore
INFO:echo.src.base_objective:	model:name : pspnet
INFO:echo.src.base_objective:	optimizer:learning_rate : 3.340745336605778e-06
INFO:echo.src.base_objective:	trainer:train_batch_size : 113
INFO:echo.src.base_objective:	trainer:weight_decay : 2.0819451176856854e-12
INFO:echo.src.base_objective:	trainer:training_loss : huber
INFO:echo.src.base_objective:Beginning trial 73
INFO:root:Loading model pspnet with settings {'in_channels': 4, 'classes': 1, 'activation': 'sigmoid'}
INFO:root:Loading loss smooth
INFO:root:Loading loss smooth
INFO:echo.src.base_objective:Saving trial 72 results to local file /glade/work/kdagon/s2sml/results_week3_SH_530/trial_results/trial_results_31824.gusched01.csv
INFO:echo.src.base_objective:Merging trial results and saving to /glade/work/kdagon/s2sml/results_week3_SH_530/trial_results.csv
[32m[I 2023-05-31 01:08:40,394][0m Trial 72 finished with values: [1.0442531681635654, 4.5491546045337525, 2.465701458219517] and parameters: {'learning_rate': 3.5580408583870545e-06, 'norm': 'zscore', 'weight_decay': 9.043315591572403e-08, 'train_batch_size': 24, 'training_loss': 'xtanh', 'model_name': 'unet++'}. [0m
WARNING:root:Stopping early since the longest observed run-time in the study exceeds the time remaining on this node.
INFO:root:Saving trial details to /glade/work/kdagon/s2sml/results_week3_SH_530/
INFO:root:Running on PBS/SLURM batch id: 31826.gusched01
INFO:root:Importing custom objective from /glade/work/kdagon/s2sml/applications/train.py
INFO:echo.src.reporting:Using device 0
INFO:root:Direction of optimization: ['minimize', 'minimize', 'minimize']
INFO:root:Using metric ['valid_custom', 'valid_custom_second', 'valid_custom_third']
[32m[I 2023-05-31 01:09:03,531][0m Using an existing study with name 'vanilla' instead of creating a new one.[0m
INFO:root:Loaded study vanilla located at sqlite:////glade/work/kdagon/s2sml/results_week3_SH_530/s2s.db
INFO:echo.src.base_objective:Worker 31826.gusched01 is summoned.
INFO:echo.src.base_objective:	initializing an objective to be optimized with metric ['valid_custom', 'valid_custom_second', 'valid_custom_third']
INFO:echo.src.base_objective:	using device(s) cuda:0
INFO:echo.src.base_objective:	saving study/trial results to local file /glade/work/kdagon/s2sml/results_week3_SH_530/trial_results/trial_results_31826.gusched01.csv
INFO:root:Running optimization for 1000 trials
INFO:root:Running trials for a maximum PBS wall-time 2:00:00
WARNING:root:Attempting to run trials and stop before hitting the wall-time
WARNING:root:Some trials may not complete if the wall-time is reached. Optuna will start over.
INFO:echo.src.base_objective:Attempting to automatically update the model configuration using optuna's suggested parameters
INFO:echo.src.base_objective:	data:norm : zscore
INFO:echo.src.base_objective:	model:name : unet
INFO:echo.src.base_objective:	optimizer:learning_rate : 2.837455961218e-05
INFO:echo.src.base_objective:	trainer:train_batch_size : 32
INFO:echo.src.base_objective:	trainer:weight_decay : 5.556032879084199e-05
INFO:echo.src.base_objective:	trainer:training_loss : mse
INFO:echo.src.base_objective:Beginning trial 74
INFO:root:Loading model unet with settings {'in_channels': 4, 'classes': 1, 'activation': 'sigmoid'}
INFO:root:Loading loss smooth
INFO:root:Loading loss smooth
INFO:echo.src.base_objective:Saving trial 73 results to local file /glade/work/kdagon/s2sml/results_week3_SH_530/trial_results/trial_results_31825.gusched01.csv
INFO:echo.src.base_objective:Merging trial results and saving to /glade/work/kdagon/s2sml/results_week3_SH_530/trial_results.csv
[32m[I 2023-05-31 01:16:45,963][0m Trial 73 finished with values: [1.1890190471736661, 4.105359786936511, 2.280225898469162] and parameters: {'learning_rate': 3.340745336605778e-06, 'norm': 'zscore', 'weight_decay': 2.0819451176856854e-12, 'train_batch_size': 113, 'training_loss': 'huber', 'model_name': 'pspnet'}. [0m
INFO:echo.src.base_objective:Attempting to automatically update the model configuration using optuna's suggested parameters
INFO:echo.src.base_objective:	data:norm : zscore
INFO:echo.src.base_objective:	model:name : deeplabv3+
INFO:echo.src.base_objective:	optimizer:learning_rate : 1.527595290079141e-06
INFO:echo.src.base_objective:	trainer:train_batch_size : 109
INFO:echo.src.base_objective:	trainer:weight_decay : 3.532782093351768e-12
INFO:echo.src.base_objective:	trainer:training_loss : mae
INFO:echo.src.base_objective:Beginning trial 75
INFO:root:Loading model deeplabv3+ with settings {'in_channels': 4, 'classes': 1, 'activation': 'sigmoid'}
INFO:root:Loading loss smooth
INFO:root:Loading loss smooth
INFO:echo.src.base_objective:Saving trial 74 results to local file /glade/work/kdagon/s2sml/results_week3_SH_530/trial_results/trial_results_31826.gusched01.csv
INFO:echo.src.base_objective:Merging trial results and saving to /glade/work/kdagon/s2sml/results_week3_SH_530/trial_results.csv
[32m[I 2023-05-31 01:17:10,339][0m Trial 74 finished with values: [1.0523018217757574, 4.214404048200536, 2.344921365258586] and parameters: {'learning_rate': 2.837455961218e-05, 'norm': 'zscore', 'weight_decay': 5.556032879084199e-05, 'train_batch_size': 32, 'training_loss': 'mse', 'model_name': 'unet'}. [0m
INFO:echo.src.base_objective:Attempting to automatically update the model configuration using optuna's suggested parameters
INFO:echo.src.base_objective:	data:norm : negone
INFO:echo.src.base_objective:	model:name : deeplabv3+
INFO:echo.src.base_objective:	optimizer:learning_rate : 0.00037277713845134286
INFO:echo.src.base_objective:	trainer:train_batch_size : 91
INFO:echo.src.base_objective:	trainer:weight_decay : 2.836638916561599e-11
INFO:echo.src.base_objective:	trainer:training_loss : smooth
INFO:echo.src.base_objective:Beginning trial 76
INFO:root:Loading model deeplabv3+ with settings {'in_channels': 4, 'classes': 1, 'activation': 'sigmoid'}
INFO:root:Loading loss smooth
INFO:root:Loading loss smooth
INFO:echo.src.base_objective:Saving trial 76 results to local file /glade/work/kdagon/s2sml/results_week3_SH_530/trial_results/trial_results_31826.gusched01.csv
INFO:echo.src.base_objective:Merging trial results and saving to /glade/work/kdagon/s2sml/results_week3_SH_530/trial_results.csv
[32m[I 2023-05-31 01:27:45,444][0m Trial 76 finished with values: [1.0372163863372217, 1.3945820375272542, 1.18462892719803] and parameters: {'learning_rate': 0.00037277713845134286, 'norm': 'negone', 'weight_decay': 2.836638916561599e-11, 'train_batch_size': 91, 'training_loss': 'smooth', 'model_name': 'deeplabv3+'}. [0m
INFO:echo.src.base_objective:Attempting to automatically update the model configuration using optuna's suggested parameters
INFO:echo.src.base_objective:	data:norm : negone
INFO:echo.src.base_objective:	model:name : linknet
INFO:echo.src.base_objective:	optimizer:learning_rate : 1.7112257263443811e-06
INFO:echo.src.base_objective:	trainer:train_batch_size : 114
INFO:echo.src.base_objective:	trainer:weight_decay : 8.040818088092283e-10
INFO:echo.src.base_objective:	trainer:training_loss : xtanh
INFO:echo.src.base_objective:Beginning trial 77
INFO:root:Loading model linknet with settings {'in_channels': 4, 'classes': 1, 'activation': 'sigmoid'}
INFO:root:Loading loss smooth
INFO:root:Loading loss smooth
INFO:echo.src.base_objective:Saving trial 77 results to local file /glade/work/kdagon/s2sml/results_week3_SH_530/trial_results/trial_results_31826.gusched01.csv
INFO:echo.src.base_objective:Merging trial results and saving to /glade/work/kdagon/s2sml/results_week3_SH_530/trial_results.csv
[32m[I 2023-05-31 01:30:50,525][0m Trial 77 finished with values: [6.191016993778459, 13.576409451098671, 4.582213175024649] and parameters: {'learning_rate': 1.7112257263443811e-06, 'norm': 'negone', 'weight_decay': 8.040818088092283e-10, 'train_batch_size': 114, 'training_loss': 'xtanh', 'model_name': 'linknet'}. [0m
INFO:echo.src.base_objective:Attempting to automatically update the model configuration using optuna's suggested parameters
INFO:echo.src.base_objective:	data:norm : minmax
INFO:echo.src.base_objective:	model:name : deeplabv3+
INFO:echo.src.base_objective:	optimizer:learning_rate : 0.001131867566466488
INFO:echo.src.base_objective:	trainer:train_batch_size : 39
INFO:echo.src.base_objective:	trainer:weight_decay : 5.5324738960814896e-05
INFO:echo.src.base_objective:	trainer:training_loss : xsigmoid
INFO:echo.src.base_objective:Beginning trial 78
INFO:root:Loading model deeplabv3+ with settings {'in_channels': 4, 'classes': 1, 'activation': 'sigmoid'}
INFO:root:Loading loss smooth
INFO:root:Loading loss smooth
INFO:echo.src.base_objective:Saving trial 78 results to local file /glade/work/kdagon/s2sml/results_week3_SH_530/trial_results/trial_results_31826.gusched01.csv
INFO:echo.src.base_objective:Merging trial results and saving to /glade/work/kdagon/s2sml/results_week3_SH_530/trial_results.csv
[32m[I 2023-05-31 01:37:34,739][0m Trial 78 finished with values: [1.0162761703382326, 0.9681555335875981, 0.9378150816224331] and parameters: {'learning_rate': 0.001131867566466488, 'norm': 'minmax', 'weight_decay': 5.5324738960814896e-05, 'train_batch_size': 39, 'training_loss': 'xsigmoid', 'model_name': 'deeplabv3+'}. [0m
INFO:echo.src.base_objective:Attempting to automatically update the model configuration using optuna's suggested parameters
INFO:echo.src.base_objective:	data:norm : negone
INFO:echo.src.base_objective:	model:name : pspnet
INFO:echo.src.base_objective:	optimizer:learning_rate : 0.00012809519414264678
INFO:echo.src.base_objective:	trainer:train_batch_size : 39
INFO:echo.src.base_objective:	trainer:weight_decay : 6.598102030103962e-09
INFO:echo.src.base_objective:	trainer:training_loss : mae
INFO:echo.src.base_objective:Beginning trial 79
INFO:root:Loading model pspnet with settings {'in_channels': 4, 'classes': 1, 'activation': 'sigmoid'}
INFO:root:Loading loss smooth
INFO:root:Loading loss smooth
INFO:echo.src.base_objective:Saving trial 79 results to local file /glade/work/kdagon/s2sml/results_week3_SH_530/trial_results/trial_results_31826.gusched01.csv
INFO:echo.src.base_objective:Merging trial results and saving to /glade/work/kdagon/s2sml/results_week3_SH_530/trial_results.csv
[32m[I 2023-05-31 01:47:15,462][0m Trial 79 finished with values: [1.0874440767472817, 1.6268459144195957, 1.2967926993660492] and parameters: {'learning_rate': 0.00012809519414264678, 'norm': 'negone', 'weight_decay': 6.598102030103962e-09, 'train_batch_size': 39, 'training_loss': 'mae', 'model_name': 'pspnet'}. [0m
INFO:echo.src.base_objective:Attempting to automatically update the model configuration using optuna's suggested parameters
INFO:echo.src.base_objective:	data:norm : zscore
INFO:echo.src.base_objective:	model:name : manet
INFO:echo.src.base_objective:	optimizer:learning_rate : 0.00014458221650132124
INFO:echo.src.base_objective:	trainer:train_batch_size : 124
INFO:echo.src.base_objective:	trainer:weight_decay : 2.714886376211366e-11
INFO:echo.src.base_objective:	trainer:training_loss : mse
INFO:echo.src.base_objective:Beginning trial 80
INFO:root:Loading model manet with settings {'in_channels': 4, 'classes': 1, 'activation': 'sigmoid'}
INFO:root:Loading loss smooth
INFO:root:Loading loss smooth
INFO:echo.src.base_objective:Saving trial 75 results to local file /glade/work/kdagon/s2sml/results_week3_SH_530/trial_results/trial_results_31825.gusched01.csv
INFO:echo.src.base_objective:Merging trial results and saving to /glade/work/kdagon/s2sml/results_week3_SH_530/trial_results.csv
[32m[I 2023-05-31 01:52:09,626][0m Trial 75 finished with values: [1.2238200504989116, 5.669273088077395, 2.8108862660019596] and parameters: {'learning_rate': 1.527595290079141e-06, 'norm': 'zscore', 'weight_decay': 3.532782093351768e-12, 'train_batch_size': 109, 'training_loss': 'mae', 'model_name': 'deeplabv3+'}. [0m
INFO:echo.src.base_objective:Attempting to automatically update the model configuration using optuna's suggested parameters
INFO:echo.src.base_objective:	data:norm : minmax
INFO:echo.src.base_objective:	model:name : pspnet
INFO:echo.src.base_objective:	optimizer:learning_rate : 0.006583977767849602
INFO:echo.src.base_objective:	trainer:train_batch_size : 59
INFO:echo.src.base_objective:	trainer:weight_decay : 2.648961371411233e-07
INFO:echo.src.base_objective:	trainer:training_loss : xtanh
INFO:echo.src.base_objective:Beginning trial 81
INFO:root:Loading model pspnet with settings {'in_channels': 4, 'classes': 1, 'activation': 'sigmoid'}
INFO:root:Loading loss smooth
INFO:root:Loading loss smooth
INFO:echo.src.base_objective:Saving trial 80 results to local file /glade/work/kdagon/s2sml/results_week3_SH_530/trial_results/trial_results_31826.gusched01.csv
INFO:echo.src.base_objective:Merging trial results and saving to /glade/work/kdagon/s2sml/results_week3_SH_530/trial_results.csv
