[32m[I 2023-05-30 19:31:39,286][0m Trial 25 finished with values: [1.1674363366156548, 4.8380124594746565, 2.5459437246841645] and parameters: {'learning_rate': 3.646490568252378e-06, 'norm': 'zscore', 'weight_decay': 3.3060213667953846e-05, 'train_batch_size': 78, 'training_loss': 'logcosh', 'model_name': 'deeplabv3+'}. [0m
INFO:echo.src.base_objective:Attempting to automatically update the model configuration using optuna's suggested parameters
INFO:echo.src.base_objective:	data:norm : minmax
INFO:echo.src.base_objective:	model:name : deeplabv3+
INFO:echo.src.base_objective:	optimizer:learning_rate : 5.282986358782595e-06
INFO:echo.src.base_objective:	trainer:train_batch_size : 73
INFO:echo.src.base_objective:	trainer:weight_decay : 7.332317769012572e-10
INFO:echo.src.base_objective:	trainer:training_loss : logcosh
INFO:echo.src.base_objective:Beginning trial 26
INFO:root:Loading model deeplabv3+ with settings {'in_channels': 4, 'classes': 1, 'activation': 'sigmoid'}
INFO:root:Loading loss smooth
INFO:root:Loading loss smooth
INFO:echo.src.base_objective:Saving trial 24 results to local file /glade/work/kdagon/s2sml/results_week3_SH_530/trial_results/trial_results_31817.gusched01.csv
INFO:echo.src.base_objective:Merging trial results and saving to /glade/work/kdagon/s2sml/results_week3_SH_530/trial_results.csv
[32m[I 2023-05-30 19:35:44,167][0m Trial 24 finished with values: [1.0665515783214816, 5.261536093584677, 2.934363333044286] and parameters: {'learning_rate': 2.3899838645133014e-06, 'norm': 'negone', 'weight_decay': 8.716236047182032e-08, 'train_batch_size': 27, 'training_loss': 'huber', 'model_name': 'unet++'}. [0m
INFO:echo.src.base_objective:Attempting to automatically update the model configuration using optuna's suggested parameters
INFO:echo.src.base_objective:	data:norm : negone
INFO:echo.src.base_objective:	model:name : manet
INFO:echo.src.base_objective:	optimizer:learning_rate : 0.001781361518944176
INFO:echo.src.base_objective:	trainer:train_batch_size : 71
INFO:echo.src.base_objective:	trainer:weight_decay : 0.0002711198826646007
INFO:echo.src.base_objective:	trainer:training_loss : logcosh
INFO:echo.src.base_objective:Beginning trial 27
INFO:root:Loading model manet with settings {'in_channels': 4, 'classes': 1, 'activation': 'sigmoid'}
INFO:root:Loading loss smooth
INFO:root:Loading loss smooth
INFO:echo.src.base_objective:Saving trial 26 results to local file /glade/work/kdagon/s2sml/results_week3_SH_530/trial_results/trial_results_31818.gusched01.csv
INFO:echo.src.base_objective:Merging trial results and saving to /glade/work/kdagon/s2sml/results_week3_SH_530/trial_results.csv
[32m[I 2023-05-30 19:45:58,046][0m Trial 26 finished with values: [1.1641966635510774, 3.6878823265686633, 2.2761839843330223] and parameters: {'learning_rate': 5.282986358782595e-06, 'norm': 'minmax', 'weight_decay': 7.332317769012572e-10, 'train_batch_size': 73, 'training_loss': 'logcosh', 'model_name': 'deeplabv3+'}. [0m
INFO:echo.src.base_objective:Attempting to automatically update the model configuration using optuna's suggested parameters
INFO:echo.src.base_objective:	data:norm : negone
INFO:echo.src.base_objective:	model:name : unet++
INFO:echo.src.base_objective:	optimizer:learning_rate : 0.0013094836497821302
INFO:echo.src.base_objective:	trainer:train_batch_size : 98
INFO:echo.src.base_objective:	trainer:weight_decay : 1.222894191963587e-09
INFO:echo.src.base_objective:	trainer:training_loss : mae
INFO:echo.src.base_objective:Beginning trial 28
INFO:root:Loading model unet++ with settings {'in_channels': 4, 'classes': 1, 'activation': 'sigmoid'}
INFO:root:Loading loss smooth
INFO:root:Loading loss smooth
INFO:echo.src.base_objective:Saving trial 27 results to local file /glade/work/kdagon/s2sml/results_week3_SH_530/trial_results/trial_results_31817.gusched01.csv
INFO:echo.src.base_objective:Merging trial results and saving to /glade/work/kdagon/s2sml/results_week3_SH_530/trial_results.csv
[32m[I 2023-05-30 19:51:46,568][0m Trial 27 finished with values: [0.99342068004128, 0.8883657966117572, 0.8964990811538683] and parameters: {'learning_rate': 0.001781361518944176, 'norm': 'negone', 'weight_decay': 0.0002711198826646007, 'train_batch_size': 71, 'training_loss': 'logcosh', 'model_name': 'manet'}. [0m
INFO:echo.src.base_objective:Attempting to automatically update the model configuration using optuna's suggested parameters
INFO:echo.src.base_objective:	data:norm : minmax
INFO:echo.src.base_objective:	model:name : unet
INFO:echo.src.base_objective:	optimizer:learning_rate : 1.6611776610434647e-06
INFO:echo.src.base_objective:	trainer:train_batch_size : 57
INFO:echo.src.base_objective:	trainer:weight_decay : 2.475873765999659e-07
INFO:echo.src.base_objective:	trainer:training_loss : huber
INFO:echo.src.base_objective:Beginning trial 29
INFO:root:Loading model unet with settings {'in_channels': 4, 'classes': 1, 'activation': 'sigmoid'}
INFO:root:Loading loss smooth
INFO:root:Loading loss smooth
INFO:echo.src.base_objective:Saving trial 28 results to local file /glade/work/kdagon/s2sml/results_week3_SH_530/trial_results/trial_results_31818.gusched01.csv
INFO:echo.src.base_objective:Merging trial results and saving to /glade/work/kdagon/s2sml/results_week3_SH_530/trial_results.csv
[32m[I 2023-05-30 20:03:39,167][0m Trial 28 finished with values: [0.9956951741717728, 0.9466701048854639, 0.9417486123244216] and parameters: {'learning_rate': 0.0013094836497821302, 'norm': 'negone', 'weight_decay': 1.222894191963587e-09, 'train_batch_size': 98, 'training_loss': 'mae', 'model_name': 'unet++'}. [0m
INFO:echo.src.base_objective:Attempting to automatically update the model configuration using optuna's suggested parameters
INFO:echo.src.base_objective:	data:norm : minmax
INFO:echo.src.base_objective:	model:name : manet
INFO:echo.src.base_objective:	optimizer:learning_rate : 5.299623455282825e-06
INFO:echo.src.base_objective:	trainer:train_batch_size : 50
INFO:echo.src.base_objective:	trainer:weight_decay : 0.0007315142105763939
INFO:echo.src.base_objective:	trainer:training_loss : smooth
INFO:echo.src.base_objective:Beginning trial 30
INFO:root:Loading model manet with settings {'in_channels': 4, 'classes': 1, 'activation': 'sigmoid'}
INFO:root:Loading loss smooth
INFO:root:Loading loss smooth
INFO:echo.src.base_objective:Saving trial 29 results to local file /glade/work/kdagon/s2sml/results_week3_SH_530/trial_results/trial_results_31817.gusched01.csv
INFO:echo.src.base_objective:Merging trial results and saving to /glade/work/kdagon/s2sml/results_week3_SH_530/trial_results.csv
[32m[I 2023-05-30 20:17:22,070][0m Trial 29 finished with values: [1.3322703518948495, 5.906290150829533, 2.719290639111556] and parameters: {'learning_rate': 1.6611776610434647e-06, 'norm': 'minmax', 'weight_decay': 2.475873765999659e-07, 'train_batch_size': 57, 'training_loss': 'huber', 'model_name': 'unet'}. [0m
WARNING:root:Stopping early since the longest observed run-time in the study exceeds the time remaining on this node.
INFO:root:Saving trial details to /glade/work/kdagon/s2sml/results_week3_SH_530/
INFO:root:Running on PBS/SLURM batch id: 31819.gusched01
INFO:root:Importing custom objective from /glade/work/kdagon/s2sml/applications/train.py
INFO:echo.src.reporting:Using device 0
INFO:root:Direction of optimization: ['minimize', 'minimize', 'minimize']
INFO:root:Using metric ['valid_custom', 'valid_custom_second', 'valid_custom_third']
[32m[I 2023-05-30 20:18:19,734][0m Using an existing study with name 'vanilla' instead of creating a new one.[0m
INFO:root:Loaded study vanilla located at sqlite:////glade/work/kdagon/s2sml/results_week3_SH_530/s2s.db
INFO:echo.src.base_objective:Worker 31819.gusched01 is summoned.
INFO:echo.src.base_objective:	initializing an objective to be optimized with metric ['valid_custom', 'valid_custom_second', 'valid_custom_third']
INFO:echo.src.base_objective:	using device(s) cuda:0
INFO:echo.src.base_objective:	saving study/trial results to local file /glade/work/kdagon/s2sml/results_week3_SH_530/trial_results/trial_results_31819.gusched01.csv
INFO:root:Running optimization for 1000 trials
INFO:root:Running trials for a maximum PBS wall-time 2:00:00
WARNING:root:Attempting to run trials and stop before hitting the wall-time
WARNING:root:Some trials may not complete if the wall-time is reached. Optuna will start over.
INFO:echo.src.base_objective:Attempting to automatically update the model configuration using optuna's suggested parameters
INFO:echo.src.base_objective:	data:norm : minmax
INFO:echo.src.base_objective:	model:name : fpn
INFO:echo.src.base_objective:	optimizer:learning_rate : 0.00010306973723711302
INFO:echo.src.base_objective:	trainer:train_batch_size : 17
INFO:echo.src.base_objective:	trainer:weight_decay : 1.0878403360852277e-11
INFO:echo.src.base_objective:	trainer:training_loss : xsigmoid
INFO:echo.src.base_objective:Beginning trial 31
INFO:root:Loading model fpn with settings {'in_channels': 4, 'classes': 1, 'activation': 'sigmoid'}
INFO:root:Loading loss smooth
INFO:root:Loading loss smooth
INFO:echo.src.base_objective:Saving trial 30 results to local file /glade/work/kdagon/s2sml/results_week3_SH_530/trial_results/trial_results_31818.gusched01.csv
INFO:echo.src.base_objective:Merging trial results and saving to /glade/work/kdagon/s2sml/results_week3_SH_530/trial_results.csv
[32m[I 2023-05-30 20:27:46,955][0m Trial 30 finished with values: [1.0319915392198697, 1.1301308969589434, 1.1917007713504506] and parameters: {'learning_rate': 5.299623455282825e-06, 'norm': 'minmax', 'weight_decay': 0.0007315142105763939, 'train_batch_size': 50, 'training_loss': 'smooth', 'model_name': 'manet'}. [0m
WARNING:root:Stopping early since the longest observed run-time in the study exceeds the time remaining on this node.
INFO:root:Saving trial details to /glade/work/kdagon/s2sml/results_week3_SH_530/
INFO:root:Running on PBS/SLURM batch id: 31820.gusched01
INFO:root:Importing custom objective from /glade/work/kdagon/s2sml/applications/train.py
INFO:echo.src.reporting:Using device 0
INFO:root:Direction of optimization: ['minimize', 'minimize', 'minimize']
INFO:root:Using metric ['valid_custom', 'valid_custom_second', 'valid_custom_third']
[32m[I 2023-05-30 20:28:17,116][0m Using an existing study with name 'vanilla' instead of creating a new one.[0m
INFO:root:Loaded study vanilla located at sqlite:////glade/work/kdagon/s2sml/results_week3_SH_530/s2s.db
INFO:echo.src.base_objective:Worker 31820.gusched01 is summoned.
INFO:echo.src.base_objective:	initializing an objective to be optimized with metric ['valid_custom', 'valid_custom_second', 'valid_custom_third']
INFO:echo.src.base_objective:	using device(s) cuda:0
INFO:echo.src.base_objective:	saving study/trial results to local file /glade/work/kdagon/s2sml/results_week3_SH_530/trial_results/trial_results_31820.gusched01.csv
INFO:root:Running optimization for 1000 trials
INFO:root:Running trials for a maximum PBS wall-time 2:00:00
WARNING:root:Attempting to run trials and stop before hitting the wall-time
WARNING:root:Some trials may not complete if the wall-time is reached. Optuna will start over.
INFO:echo.src.base_objective:Attempting to automatically update the model configuration using optuna's suggested parameters
INFO:echo.src.base_objective:	data:norm : negone
INFO:echo.src.base_objective:	model:name : manet
INFO:echo.src.base_objective:	optimizer:learning_rate : 0.000978479118035451
INFO:echo.src.base_objective:	trainer:train_batch_size : 29
INFO:echo.src.base_objective:	trainer:weight_decay : 3.488269796037184e-12
INFO:echo.src.base_objective:	trainer:training_loss : mae
INFO:echo.src.base_objective:Beginning trial 32
INFO:root:Loading model manet with settings {'in_channels': 4, 'classes': 1, 'activation': 'sigmoid'}
INFO:root:Loading loss smooth
INFO:root:Loading loss smooth
INFO:echo.src.base_objective:Saving trial 31 results to local file /glade/work/kdagon/s2sml/results_week3_SH_530/trial_results/trial_results_31819.gusched01.csv
INFO:echo.src.base_objective:Merging trial results and saving to /glade/work/kdagon/s2sml/results_week3_SH_530/trial_results.csv
[32m[I 2023-05-30 20:31:06,918][0m Trial 31 finished with values: [1.029219865432779, 1.2844367136921968, 1.171919424639207] and parameters: {'learning_rate': 0.00010306973723711302, 'norm': 'minmax', 'weight_decay': 1.0878403360852277e-11, 'train_batch_size': 17, 'training_loss': 'xsigmoid', 'model_name': 'fpn'}. [0m
INFO:echo.src.base_objective:Attempting to automatically update the model configuration using optuna's suggested parameters
INFO:echo.src.base_objective:	data:norm : negone
INFO:echo.src.base_objective:	model:name : deeplabv3+
INFO:echo.src.base_objective:	optimizer:learning_rate : 0.00018922739139132024
INFO:echo.src.base_objective:	trainer:train_batch_size : 16
INFO:echo.src.base_objective:	trainer:weight_decay : 1.133405124256192e-06
INFO:echo.src.base_objective:	trainer:training_loss : xtanh
INFO:echo.src.base_objective:Beginning trial 33
INFO:root:Loading model deeplabv3+ with settings {'in_channels': 4, 'classes': 1, 'activation': 'sigmoid'}
INFO:root:Loading loss smooth
INFO:root:Loading loss smooth
INFO:echo.src.base_objective:Saving trial 32 results to local file /glade/work/kdagon/s2sml/results_week3_SH_530/trial_results/trial_results_31820.gusched01.csv
INFO:echo.src.base_objective:Merging trial results and saving to /glade/work/kdagon/s2sml/results_week3_SH_530/trial_results.csv
[32m[I 2023-05-30 20:36:32,477][0m Trial 32 finished with values: [0.9935847770152858, 0.9214548207509137, 0.9295442112451741] and parameters: {'learning_rate': 0.000978479118035451, 'norm': 'negone', 'weight_decay': 3.488269796037184e-12, 'train_batch_size': 29, 'training_loss': 'mae', 'model_name': 'manet'}. [0m
INFO:echo.src.base_objective:Attempting to automatically update the model configuration using optuna's suggested parameters
INFO:echo.src.base_objective:	data:norm : negone
INFO:echo.src.base_objective:	model:name : unet++
INFO:echo.src.base_objective:	optimizer:learning_rate : 0.0014001327980386854
INFO:echo.src.base_objective:	trainer:train_batch_size : 119
INFO:echo.src.base_objective:	trainer:weight_decay : 9.237588428281613e-07
INFO:echo.src.base_objective:	trainer:training_loss : smooth
INFO:echo.src.base_objective:Beginning trial 34
INFO:root:Loading model unet++ with settings {'in_channels': 4, 'classes': 1, 'activation': 'sigmoid'}
INFO:root:Loading loss smooth
INFO:root:Loading loss smooth
INFO:echo.src.base_objective:Saving trial 33 results to local file /glade/work/kdagon/s2sml/results_week3_SH_530/trial_results/trial_results_31819.gusched01.csv
INFO:echo.src.base_objective:Merging trial results and saving to /glade/work/kdagon/s2sml/results_week3_SH_530/trial_results.csv
[32m[I 2023-05-30 20:39:15,938][0m Trial 33 finished with values: [1.0397922071117573, 1.3312917365282941, 1.1370189993467859] and parameters: {'learning_rate': 0.00018922739139132024, 'norm': 'negone', 'weight_decay': 1.133405124256192e-06, 'train_batch_size': 16, 'training_loss': 'xtanh', 'model_name': 'deeplabv3+'}. [0m
INFO:echo.src.base_objective:Attempting to automatically update the model configuration using optuna's suggested parameters
INFO:echo.src.base_objective:	data:norm : zscore
INFO:echo.src.base_objective:	model:name : deeplabv3
INFO:echo.src.base_objective:	optimizer:learning_rate : 1.1266701878877728e-05
INFO:echo.src.base_objective:	trainer:train_batch_size : 121
INFO:echo.src.base_objective:	trainer:weight_decay : 4.643518833972741e-05
INFO:echo.src.base_objective:	trainer:training_loss : mse
INFO:echo.src.base_objective:Beginning trial 35
INFO:root:Loading model deeplabv3 with settings {'in_channels': 4, 'classes': 1, 'activation': 'sigmoid'}
INFO:root:Loading loss smooth
INFO:root:Loading loss smooth
INFO:echo.src.base_objective:Saving trial 34 results to local file /glade/work/kdagon/s2sml/results_week3_SH_530/trial_results/trial_results_31820.gusched01.csv
INFO:echo.src.base_objective:Merging trial results and saving to /glade/work/kdagon/s2sml/results_week3_SH_530/trial_results.csv
[32m[I 2023-05-30 20:40:39,594][0m Trial 34 finished with values: [1.0796497251485122, 2.3691710797796595, 1.7400751718033118] and parameters: {'learning_rate': 0.0014001327980386854, 'norm': 'negone', 'weight_decay': 9.237588428281613e-07, 'train_batch_size': 119, 'training_loss': 'smooth', 'model_name': 'unet++'}. [0m
INFO:echo.src.base_objective:Attempting to automatically update the model configuration using optuna's suggested parameters
INFO:echo.src.base_objective:	data:norm : minmax
INFO:echo.src.base_objective:	model:name : pspnet
INFO:echo.src.base_objective:	optimizer:learning_rate : 0.0008269910775268467
INFO:echo.src.base_objective:	trainer:train_batch_size : 51
INFO:echo.src.base_objective:	trainer:weight_decay : 1.8322777602606757e-10
INFO:echo.src.base_objective:	trainer:training_loss : xtanh
INFO:echo.src.base_objective:Beginning trial 36
INFO:root:Loading model pspnet with settings {'in_channels': 4, 'classes': 1, 'activation': 'sigmoid'}
INFO:root:Loading loss smooth
INFO:root:Loading loss smooth
INFO:echo.src.base_objective:Saving trial 35 results to local file /glade/work/kdagon/s2sml/results_week3_SH_530/trial_results/trial_results_31819.gusched01.csv
INFO:echo.src.base_objective:Merging trial results and saving to /glade/work/kdagon/s2sml/results_week3_SH_530/trial_results.csv
[32m[I 2023-05-30 20:45:17,110][0m Trial 35 finished with values: [1.2264102326467283, 5.539308812249543, 2.7641950350395055] and parameters: {'learning_rate': 1.1266701878877728e-05, 'norm': 'zscore', 'weight_decay': 4.643518833972741e-05, 'train_batch_size': 121, 'training_loss': 'mse', 'model_name': 'deeplabv3'}. [0m
INFO:echo.src.base_objective:Attempting to automatically update the model configuration using optuna's suggested parameters
INFO:echo.src.base_objective:	data:norm : minmax
INFO:echo.src.base_objective:	model:name : manet
INFO:echo.src.base_objective:	optimizer:learning_rate : 9.902934666895363e-06
INFO:echo.src.base_objective:	trainer:train_batch_size : 87
INFO:echo.src.base_objective:	trainer:weight_decay : 4.147714246227241e-08
INFO:echo.src.base_objective:	trainer:training_loss : huber
INFO:echo.src.base_objective:Beginning trial 37
INFO:root:Loading model manet with settings {'in_channels': 4, 'classes': 1, 'activation': 'sigmoid'}
INFO:root:Loading loss smooth
INFO:root:Loading loss smooth
INFO:echo.src.base_objective:Saving trial 36 results to local file /glade/work/kdagon/s2sml/results_week3_SH_530/trial_results/trial_results_31820.gusched01.csv
INFO:echo.src.base_objective:Merging trial results and saving to /glade/work/kdagon/s2sml/results_week3_SH_530/trial_results.csv
[32m[I 2023-05-30 20:51:25,169][0m Trial 36 finished with values: [1.0608939671405464, 1.3713967565958225, 1.1640830927623707] and parameters: {'learning_rate': 0.0008269910775268467, 'norm': 'minmax', 'weight_decay': 1.8322777602606757e-10, 'train_batch_size': 51, 'training_loss': 'xtanh', 'model_name': 'pspnet'}. [0m
INFO:echo.src.base_objective:Attempting to automatically update the model configuration using optuna's suggested parameters
INFO:echo.src.base_objective:	data:norm : minmax
INFO:echo.src.base_objective:	model:name : deeplabv3+
INFO:echo.src.base_objective:	optimizer:learning_rate : 2.0928715282204056e-05
INFO:echo.src.base_objective:	trainer:train_batch_size : 94
INFO:echo.src.base_objective:	trainer:weight_decay : 8.020150331421993e-05
INFO:echo.src.base_objective:	trainer:training_loss : smooth
INFO:echo.src.base_objective:Beginning trial 38
INFO:root:Loading model deeplabv3+ with settings {'in_channels': 4, 'classes': 1, 'activation': 'sigmoid'}
INFO:root:Loading loss smooth
INFO:root:Loading loss smooth
INFO:echo.src.base_objective:Saving trial 37 results to local file /glade/work/kdagon/s2sml/results_week3_SH_530/trial_results/trial_results_31819.gusched01.csv
INFO:echo.src.base_objective:Merging trial results and saving to /glade/work/kdagon/s2sml/results_week3_SH_530/trial_results.csv
[32m[I 2023-05-30 21:03:34,073][0m Trial 37 finished with values: [1.0444938317585037, 1.260292181506456, 1.271368340777632] and parameters: {'learning_rate': 9.902934666895363e-06, 'norm': 'minmax', 'weight_decay': 4.147714246227241e-08, 'train_batch_size': 87, 'training_loss': 'huber', 'model_name': 'manet'}. [0m
INFO:echo.src.base_objective:Attempting to automatically update the model configuration using optuna's suggested parameters
INFO:echo.src.base_objective:	data:norm : minmax
INFO:echo.src.base_objective:	model:name : unet
INFO:echo.src.base_objective:	optimizer:learning_rate : 1.5634132381752595e-06
INFO:echo.src.base_objective:	trainer:train_batch_size : 79
INFO:echo.src.base_objective:	trainer:weight_decay : 2.4023823359072413e-05
INFO:echo.src.base_objective:	trainer:training_loss : logcosh
INFO:echo.src.base_objective:Beginning trial 39
INFO:root:Loading model unet with settings {'in_channels': 4, 'classes': 1, 'activation': 'sigmoid'}
INFO:root:Loading loss smooth
INFO:root:Loading loss smooth
INFO:echo.src.base_objective:Saving trial 38 results to local file /glade/work/kdagon/s2sml/results_week3_SH_530/trial_results/trial_results_31820.gusched01.csv
INFO:echo.src.base_objective:Merging trial results and saving to /glade/work/kdagon/s2sml/results_week3_SH_530/trial_results.csv
