[32m[I 2023-05-31 07:58:44,699][0m Trial 136 finished with values: [0.9596491860829509, 0.37109970914516094, 0.6584888216656958] and parameters: {'learning_rate': 0.002453934273189493, 'norm': 'minmax', 'weight_decay': 2.304085939043224e-12, 'train_batch_size': 7, 'training_loss': 'logcosh', 'model_name': 'unet'}. [0m
INFO:echo.src.base_objective:Attempting to automatically update the model configuration using optuna's suggested parameters
INFO:echo.src.base_objective:	data:norm : minmax
INFO:echo.src.base_objective:	model:name : unet
INFO:echo.src.base_objective:	optimizer:learning_rate : 0.0006639519950818423
INFO:echo.src.base_objective:	trainer:train_batch_size : 4
INFO:echo.src.base_objective:	trainer:weight_decay : 6.1096597321236416e-06
INFO:echo.src.base_objective:	trainer:training_loss : logcosh
INFO:echo.src.base_objective:Beginning trial 137
INFO:root:Loading model unet with settings {'in_channels': 4, 'classes': 1, 'activation': 'sigmoid'}
INFO:root:Loading loss smooth
INFO:root:Loading loss smooth
INFO:echo.src.base_objective:Saving trial 135 results to local file /glade/work/kdagon/s2sml/results_week3_SH_530/trial_results/trial_results_31833.gusched01.csv
INFO:echo.src.base_objective:Merging trial results and saving to /glade/work/kdagon/s2sml/results_week3_SH_530/trial_results.csv
[32m[I 2023-05-31 07:59:22,078][0m Trial 135 finished with values: [0.957039389444604, 0.3413637764476763, 0.6300920467295692] and parameters: {'learning_rate': 0.002149769011411973, 'norm': 'minmax', 'weight_decay': 5.806863630170559e-06, 'train_batch_size': 4, 'training_loss': 'logcosh', 'model_name': 'unet'}. [0m
INFO:echo.src.base_objective:Attempting to automatically update the model configuration using optuna's suggested parameters
INFO:echo.src.base_objective:	data:norm : minmax
INFO:echo.src.base_objective:	model:name : unet
INFO:echo.src.base_objective:	optimizer:learning_rate : 0.0026174987502185568
INFO:echo.src.base_objective:	trainer:train_batch_size : 4
INFO:echo.src.base_objective:	trainer:weight_decay : 1.1383851090533845e-05
INFO:echo.src.base_objective:	trainer:training_loss : logcosh
INFO:echo.src.base_objective:Beginning trial 138
INFO:root:Loading model unet with settings {'in_channels': 4, 'classes': 1, 'activation': 'sigmoid'}
INFO:root:Loading loss smooth
INFO:root:Loading loss smooth
INFO:echo.src.base_objective:Saving trial 138 results to local file /glade/work/kdagon/s2sml/results_week3_SH_530/trial_results/trial_results_31833.gusched01.csv
INFO:echo.src.base_objective:Merging trial results and saving to /glade/work/kdagon/s2sml/results_week3_SH_530/trial_results.csv
[32m[I 2023-05-31 08:10:35,179][0m Trial 138 finished with values: [0.9588630842297355, 0.37803193919428085, 0.678037579731554] and parameters: {'learning_rate': 0.0026174987502185568, 'norm': 'minmax', 'weight_decay': 1.1383851090533845e-05, 'train_batch_size': 4, 'training_loss': 'logcosh', 'model_name': 'unet'}. [0m
WARNING:root:Stopping early since the longest observed run-time in the study exceeds the time remaining on this node.
INFO:root:Saving trial details to /glade/work/kdagon/s2sml/results_week3_SH_530/
INFO:root:Running on PBS/SLURM batch id: 31835.gusched01
INFO:root:Importing custom objective from /glade/work/kdagon/s2sml/applications/train.py
INFO:echo.src.reporting:Using device 0
INFO:root:Direction of optimization: ['minimize', 'minimize', 'minimize']
INFO:root:Using metric ['valid_custom', 'valid_custom_second', 'valid_custom_third']
[32m[I 2023-05-31 08:10:58,093][0m Using an existing study with name 'vanilla' instead of creating a new one.[0m
INFO:root:Loaded study vanilla located at sqlite:////glade/work/kdagon/s2sml/results_week3_SH_530/s2s.db
INFO:echo.src.base_objective:Worker 31835.gusched01 is summoned.
INFO:echo.src.base_objective:	initializing an objective to be optimized with metric ['valid_custom', 'valid_custom_second', 'valid_custom_third']
INFO:echo.src.base_objective:	using device(s) cuda:0
INFO:echo.src.base_objective:	saving study/trial results to local file /glade/work/kdagon/s2sml/results_week3_SH_530/trial_results/trial_results_31835.gusched01.csv
INFO:root:Running optimization for 1000 trials
INFO:root:Running trials for a maximum PBS wall-time 2:00:00
WARNING:root:Attempting to run trials and stop before hitting the wall-time
WARNING:root:Some trials may not complete if the wall-time is reached. Optuna will start over.
INFO:echo.src.base_objective:Attempting to automatically update the model configuration using optuna's suggested parameters
INFO:echo.src.base_objective:	data:norm : minmax
INFO:echo.src.base_objective:	model:name : unet
INFO:echo.src.base_objective:	optimizer:learning_rate : 0.00201665085711744
INFO:echo.src.base_objective:	trainer:train_batch_size : 4
INFO:echo.src.base_objective:	trainer:weight_decay : 2.471777062474563e-12
INFO:echo.src.base_objective:	trainer:training_loss : logcosh
INFO:echo.src.base_objective:Beginning trial 139
INFO:root:Loading model unet with settings {'in_channels': 4, 'classes': 1, 'activation': 'sigmoid'}
INFO:root:Loading loss smooth
INFO:root:Loading loss smooth
INFO:echo.src.base_objective:Saving trial 139 results to local file /glade/work/kdagon/s2sml/results_week3_SH_530/trial_results/trial_results_31835.gusched01.csv
INFO:echo.src.base_objective:Merging trial results and saving to /glade/work/kdagon/s2sml/results_week3_SH_530/trial_results.csv
[32m[I 2023-05-31 08:16:22,593][0m Trial 139 finished with values: [0.9626476094733891, 0.41969906378015176, 0.7152065458248176] and parameters: {'learning_rate': 0.00201665085711744, 'norm': 'minmax', 'weight_decay': 2.471777062474563e-12, 'train_batch_size': 4, 'training_loss': 'logcosh', 'model_name': 'unet'}. [0m
INFO:echo.src.base_objective:Attempting to automatically update the model configuration using optuna's suggested parameters
INFO:echo.src.base_objective:	data:norm : minmax
INFO:echo.src.base_objective:	model:name : unet
INFO:echo.src.base_objective:	optimizer:learning_rate : 0.0025304900973197974
INFO:echo.src.base_objective:	trainer:train_batch_size : 14
INFO:echo.src.base_objective:	trainer:weight_decay : 1.414834171291395e-12
INFO:echo.src.base_objective:	trainer:training_loss : logcosh
INFO:echo.src.base_objective:Beginning trial 140
INFO:root:Loading model unet with settings {'in_channels': 4, 'classes': 1, 'activation': 'sigmoid'}
INFO:root:Loading loss smooth
INFO:root:Loading loss smooth
INFO:echo.src.base_objective:Saving trial 137 results to local file /glade/work/kdagon/s2sml/results_week3_SH_530/trial_results/trial_results_31834.gusched01.csv
INFO:echo.src.base_objective:Merging trial results and saving to /glade/work/kdagon/s2sml/results_week3_SH_530/trial_results.csv
[32m[I 2023-05-31 08:17:46,563][0m Trial 137 finished with values: [0.9597710444319197, 0.3763973044847463, 0.6675272496955251] and parameters: {'learning_rate': 0.0006639519950818423, 'norm': 'minmax', 'weight_decay': 6.1096597321236416e-06, 'train_batch_size': 4, 'training_loss': 'logcosh', 'model_name': 'unet'}. [0m
WARNING:root:Stopping early since the longest observed run-time in the study exceeds the time remaining on this node.
INFO:root:Saving trial details to /glade/work/kdagon/s2sml/results_week3_SH_530/
INFO:root:Running on PBS/SLURM batch id: 31836.gusched01
INFO:root:Importing custom objective from /glade/work/kdagon/s2sml/applications/train.py
INFO:echo.src.reporting:Using device 0
INFO:root:Direction of optimization: ['minimize', 'minimize', 'minimize']
INFO:root:Using metric ['valid_custom', 'valid_custom_second', 'valid_custom_third']
[32m[I 2023-05-31 08:18:08,832][0m Using an existing study with name 'vanilla' instead of creating a new one.[0m
INFO:root:Loaded study vanilla located at sqlite:////glade/work/kdagon/s2sml/results_week3_SH_530/s2s.db
INFO:echo.src.base_objective:Worker 31836.gusched01 is summoned.
INFO:echo.src.base_objective:	initializing an objective to be optimized with metric ['valid_custom', 'valid_custom_second', 'valid_custom_third']
INFO:echo.src.base_objective:	using device(s) cuda:0
INFO:echo.src.base_objective:	saving study/trial results to local file /glade/work/kdagon/s2sml/results_week3_SH_530/trial_results/trial_results_31836.gusched01.csv
INFO:root:Running optimization for 1000 trials
INFO:root:Running trials for a maximum PBS wall-time 2:00:00
WARNING:root:Attempting to run trials and stop before hitting the wall-time
WARNING:root:Some trials may not complete if the wall-time is reached. Optuna will start over.
INFO:echo.src.base_objective:Attempting to automatically update the model configuration using optuna's suggested parameters
INFO:echo.src.base_objective:	data:norm : minmax
INFO:echo.src.base_objective:	model:name : unet
INFO:echo.src.base_objective:	optimizer:learning_rate : 0.002766399640176228
INFO:echo.src.base_objective:	trainer:train_batch_size : 8
INFO:echo.src.base_objective:	trainer:weight_decay : 4.0950296422362953e-10
INFO:echo.src.base_objective:	trainer:training_loss : logcosh
INFO:echo.src.base_objective:Beginning trial 141
INFO:root:Loading model unet with settings {'in_channels': 4, 'classes': 1, 'activation': 'sigmoid'}
INFO:root:Loading loss smooth
INFO:root:Loading loss smooth
INFO:echo.src.base_objective:Saving trial 140 results to local file /glade/work/kdagon/s2sml/results_week3_SH_530/trial_results/trial_results_31835.gusched01.csv
INFO:echo.src.base_objective:Merging trial results and saving to /glade/work/kdagon/s2sml/results_week3_SH_530/trial_results.csv
[32m[I 2023-05-31 08:25:59,997][0m Trial 140 finished with values: [0.9589494433074415, 0.36968849689975714, 0.6608885225004411] and parameters: {'learning_rate': 0.0025304900973197974, 'norm': 'minmax', 'weight_decay': 1.414834171291395e-12, 'train_batch_size': 14, 'training_loss': 'logcosh', 'model_name': 'unet'}. [0m
INFO:echo.src.base_objective:Attempting to automatically update the model configuration using optuna's suggested parameters
INFO:echo.src.base_objective:	data:norm : minmax
INFO:echo.src.base_objective:	model:name : unet
INFO:echo.src.base_objective:	optimizer:learning_rate : 0.002853537949062037
INFO:echo.src.base_objective:	trainer:train_batch_size : 7
INFO:echo.src.base_objective:	trainer:weight_decay : 1.4686364102287553e-12
INFO:echo.src.base_objective:	trainer:training_loss : logcosh
INFO:echo.src.base_objective:Beginning trial 142
INFO:root:Loading model unet with settings {'in_channels': 4, 'classes': 1, 'activation': 'sigmoid'}
INFO:root:Loading loss smooth
INFO:root:Loading loss smooth
INFO:echo.src.base_objective:Saving trial 141 results to local file /glade/work/kdagon/s2sml/results_week3_SH_530/trial_results/trial_results_31836.gusched01.csv
INFO:echo.src.base_objective:Merging trial results and saving to /glade/work/kdagon/s2sml/results_week3_SH_530/trial_results.csv
[32m[I 2023-05-31 08:35:26,685][0m Trial 141 finished with values: [0.9583679694250586, 0.3613800880560734, 0.6497990800075601] and parameters: {'learning_rate': 0.002766399640176228, 'norm': 'minmax', 'weight_decay': 4.0950296422362953e-10, 'train_batch_size': 8, 'training_loss': 'logcosh', 'model_name': 'unet'}. [0m
INFO:echo.src.base_objective:Attempting to automatically update the model configuration using optuna's suggested parameters
INFO:echo.src.base_objective:	data:norm : minmax
INFO:echo.src.base_objective:	model:name : unet
INFO:echo.src.base_objective:	optimizer:learning_rate : 0.0027630208928928184
INFO:echo.src.base_objective:	trainer:train_batch_size : 14
INFO:echo.src.base_objective:	trainer:weight_decay : 1.596658123271853e-12
INFO:echo.src.base_objective:	trainer:training_loss : logcosh
INFO:echo.src.base_objective:Beginning trial 143
INFO:root:Loading model unet with settings {'in_channels': 4, 'classes': 1, 'activation': 'sigmoid'}
INFO:root:Loading loss smooth
INFO:root:Loading loss smooth
INFO:echo.src.base_objective:Saving trial 142 results to local file /glade/work/kdagon/s2sml/results_week3_SH_530/trial_results/trial_results_31835.gusched01.csv
INFO:echo.src.base_objective:Merging trial results and saving to /glade/work/kdagon/s2sml/results_week3_SH_530/trial_results.csv
[32m[I 2023-05-31 08:39:02,254][0m Trial 142 finished with values: [0.958211089268373, 0.3583882299507568, 0.6470050068259777] and parameters: {'learning_rate': 0.002853537949062037, 'norm': 'minmax', 'weight_decay': 1.4686364102287553e-12, 'train_batch_size': 7, 'training_loss': 'logcosh', 'model_name': 'unet'}. [0m
INFO:echo.src.base_objective:Attempting to automatically update the model configuration using optuna's suggested parameters
INFO:echo.src.base_objective:	data:norm : minmax
INFO:echo.src.base_objective:	model:name : unet
INFO:echo.src.base_objective:	optimizer:learning_rate : 0.0029103926847481565
INFO:echo.src.base_objective:	trainer:train_batch_size : 13
INFO:echo.src.base_objective:	trainer:weight_decay : 1.4706185755416692e-12
INFO:echo.src.base_objective:	trainer:training_loss : logcosh
INFO:echo.src.base_objective:Beginning trial 144
INFO:root:Loading model unet with settings {'in_channels': 4, 'classes': 1, 'activation': 'sigmoid'}
INFO:root:Loading loss smooth
INFO:root:Loading loss smooth
INFO:echo.src.base_objective:Saving trial 144 results to local file /glade/work/kdagon/s2sml/results_week3_SH_530/trial_results/trial_results_31835.gusched01.csv
INFO:echo.src.base_objective:Merging trial results and saving to /glade/work/kdagon/s2sml/results_week3_SH_530/trial_results.csv
[32m[I 2023-05-31 08:42:59,551][0m Trial 144 finished with values: [0.9675903999648656, 0.46211952686370206, 0.7314960231727251] and parameters: {'learning_rate': 0.0029103926847481565, 'norm': 'minmax', 'weight_decay': 1.4706185755416692e-12, 'train_batch_size': 13, 'training_loss': 'logcosh', 'model_name': 'unet'}. [0m
INFO:echo.src.base_objective:Attempting to automatically update the model configuration using optuna's suggested parameters
INFO:echo.src.base_objective:	data:norm : minmax
INFO:echo.src.base_objective:	model:name : unet
INFO:echo.src.base_objective:	optimizer:learning_rate : 0.0005866788964706443
INFO:echo.src.base_objective:	trainer:train_batch_size : 8
INFO:echo.src.base_objective:	trainer:weight_decay : 4.491191649526317e-06
INFO:echo.src.base_objective:	trainer:training_loss : logcosh
INFO:echo.src.base_objective:Beginning trial 145
INFO:root:Loading model unet with settings {'in_channels': 4, 'classes': 1, 'activation': 'sigmoid'}
INFO:root:Loading loss smooth
INFO:root:Loading loss smooth
INFO:echo.src.base_objective:Saving trial 143 results to local file /glade/work/kdagon/s2sml/results_week3_SH_530/trial_results/trial_results_31836.gusched01.csv
INFO:echo.src.base_objective:Merging trial results and saving to /glade/work/kdagon/s2sml/results_week3_SH_530/trial_results.csv
[32m[I 2023-05-31 08:43:44,823][0m Trial 143 finished with values: [0.963563870514687, 0.45148191286515477, 0.7345158797402375] and parameters: {'learning_rate': 0.0027630208928928184, 'norm': 'minmax', 'weight_decay': 1.596658123271853e-12, 'train_batch_size': 14, 'training_loss': 'logcosh', 'model_name': 'unet'}. [0m
INFO:echo.src.base_objective:Attempting to automatically update the model configuration using optuna's suggested parameters
INFO:echo.src.base_objective:	data:norm : minmax
INFO:echo.src.base_objective:	model:name : unet
INFO:echo.src.base_objective:	optimizer:learning_rate : 0.0019203517479944826
INFO:echo.src.base_objective:	trainer:train_batch_size : 7
INFO:echo.src.base_objective:	trainer:weight_decay : 2.958796934802357e-12
INFO:echo.src.base_objective:	trainer:training_loss : logcosh
INFO:echo.src.base_objective:Beginning trial 146
INFO:root:Loading model unet with settings {'in_channels': 4, 'classes': 1, 'activation': 'sigmoid'}
INFO:root:Loading loss smooth
INFO:root:Loading loss smooth
INFO:echo.src.base_objective:Saving trial 145 results to local file /glade/work/kdagon/s2sml/results_week3_SH_530/trial_results/trial_results_31835.gusched01.csv
INFO:echo.src.base_objective:Merging trial results and saving to /glade/work/kdagon/s2sml/results_week3_SH_530/trial_results.csv
[32m[I 2023-05-31 08:52:52,814][0m Trial 145 finished with values: [0.9583396185750053, 0.36634560249415715, 0.6582524674434119] and parameters: {'learning_rate': 0.0005866788964706443, 'norm': 'minmax', 'weight_decay': 4.491191649526317e-06, 'train_batch_size': 8, 'training_loss': 'logcosh', 'model_name': 'unet'}. [0m
INFO:echo.src.base_objective:Attempting to automatically update the model configuration using optuna's suggested parameters
INFO:echo.src.base_objective:	data:norm : minmax
INFO:echo.src.base_objective:	model:name : unet
INFO:echo.src.base_objective:	optimizer:learning_rate : 0.0018014974466788955
INFO:echo.src.base_objective:	trainer:train_batch_size : 9
INFO:echo.src.base_objective:	trainer:weight_decay : 3.3247849348337202e-06
INFO:echo.src.base_objective:	trainer:training_loss : logcosh
INFO:echo.src.base_objective:Beginning trial 147
INFO:root:Loading model unet with settings {'in_channels': 4, 'classes': 1, 'activation': 'sigmoid'}
INFO:root:Loading loss smooth
INFO:root:Loading loss smooth
INFO:echo.src.base_objective:Saving trial 146 results to local file /glade/work/kdagon/s2sml/results_week3_SH_530/trial_results/trial_results_31836.gusched01.csv
INFO:echo.src.base_objective:Merging trial results and saving to /glade/work/kdagon/s2sml/results_week3_SH_530/trial_results.csv
[32m[I 2023-05-31 08:58:41,921][0m Trial 146 finished with values: [0.9578322366739975, 0.352749528666044, 0.6406098625509989] and parameters: {'learning_rate': 0.0019203517479944826, 'norm': 'minmax', 'weight_decay': 2.958796934802357e-12, 'train_batch_size': 7, 'training_loss': 'logcosh', 'model_name': 'unet'}. [0m
INFO:echo.src.base_objective:Attempting to automatically update the model configuration using optuna's suggested parameters
INFO:echo.src.base_objective:	data:norm : minmax
INFO:echo.src.base_objective:	model:name : linknet
INFO:echo.src.base_objective:	optimizer:learning_rate : 0.0019847277963806545
INFO:echo.src.base_objective:	trainer:train_batch_size : 83
INFO:echo.src.base_objective:	trainer:weight_decay : 2.6159140561111363e-12
INFO:echo.src.base_objective:	trainer:training_loss : logcosh
INFO:echo.src.base_objective:Beginning trial 148
INFO:root:Loading model linknet with settings {'in_channels': 4, 'classes': 1, 'activation': 'sigmoid'}
INFO:root:Loading loss smooth
INFO:root:Loading loss smooth
INFO:echo.src.base_objective:Saving trial 147 results to local file /glade/work/kdagon/s2sml/results_week3_SH_530/trial_results/trial_results_31835.gusched01.csv
INFO:echo.src.base_objective:Merging trial results and saving to /glade/work/kdagon/s2sml/results_week3_SH_530/trial_results.csv
[32m[I 2023-05-31 09:03:45,422][0m Trial 147 finished with values: [0.9579999068929153, 0.3510424900878563, 0.6394574447920303] and parameters: {'learning_rate': 0.0018014974466788955, 'norm': 'minmax', 'weight_decay': 3.3247849348337202e-06, 'train_batch_size': 9, 'training_loss': 'logcosh', 'model_name': 'unet'}. [0m
INFO:echo.src.base_objective:Attempting to automatically update the model configuration using optuna's suggested parameters
INFO:echo.src.base_objective:	data:norm : minmax
INFO:echo.src.base_objective:	model:name : linknet
INFO:echo.src.base_objective:	optimizer:learning_rate : 0.0033897985687028442
INFO:echo.src.base_objective:	trainer:train_batch_size : 11
INFO:echo.src.base_objective:	trainer:weight_decay : 3.85500351297123e-12
INFO:echo.src.base_objective:	trainer:training_loss : logcosh
INFO:echo.src.base_objective:Beginning trial 149
INFO:root:Loading model linknet with settings {'in_channels': 4, 'classes': 1, 'activation': 'sigmoid'}
INFO:root:Loading loss smooth
INFO:root:Loading loss smooth
INFO:echo.src.base_objective:Saving trial 148 results to local file /glade/work/kdagon/s2sml/results_week3_SH_530/trial_results/trial_results_31836.gusched01.csv
INFO:echo.src.base_objective:Merging trial results and saving to /glade/work/kdagon/s2sml/results_week3_SH_530/trial_results.csv
[32m[I 2023-05-31 09:13:26,722][0m Trial 148 finished with values: [0.95954708803985, 0.3693360780694626, 0.6613258889642374] and parameters: {'learning_rate': 0.0019847277963806545, 'norm': 'minmax', 'weight_decay': 2.6159140561111363e-12, 'train_batch_size': 83, 'training_loss': 'logcosh', 'model_name': 'linknet'}. [0m
INFO:echo.src.base_objective:Attempting to automatically update the model configuration using optuna's suggested parameters
INFO:echo.src.base_objective:	data:norm : minmax
INFO:echo.src.base_objective:	model:name : unet
INFO:echo.src.base_objective:	optimizer:learning_rate : 0.0034525313330260607
INFO:echo.src.base_objective:	trainer:train_batch_size : 10
INFO:echo.src.base_objective:	trainer:weight_decay : 2.7118807483266776e-06
INFO:echo.src.base_objective:	trainer:training_loss : logcosh
INFO:echo.src.base_objective:Beginning trial 150
INFO:root:Loading model unet with settings {'in_channels': 4, 'classes': 1, 'activation': 'sigmoid'}
INFO:root:Loading loss smooth
INFO:root:Loading loss smooth
INFO:echo.src.base_objective:Saving trial 149 results to local file /glade/work/kdagon/s2sml/results_week3_SH_530/trial_results/trial_results_31835.gusched01.csv
INFO:echo.src.base_objective:Merging trial results and saving to /glade/work/kdagon/s2sml/results_week3_SH_530/trial_results.csv
