[32m[I 2023-05-30 21:17:31,262][0m Trial 38 finished with values: [1.0418691358629952, 1.3533761446032633, 1.242392544121446] and parameters: {'learning_rate': 2.0928715282204056e-05, 'norm': 'minmax', 'weight_decay': 8.020150331421993e-05, 'train_batch_size': 94, 'training_loss': 'smooth', 'model_name': 'deeplabv3+'}. [0m
INFO:echo.src.base_objective:Attempting to automatically update the model configuration using optuna's suggested parameters
INFO:echo.src.base_objective:	data:norm : minmax
INFO:echo.src.base_objective:	model:name : deeplabv3
INFO:echo.src.base_objective:	optimizer:learning_rate : 0.0002508633780518012
INFO:echo.src.base_objective:	trainer:train_batch_size : 77
INFO:echo.src.base_objective:	trainer:weight_decay : 6.194011908018905e-10
INFO:echo.src.base_objective:	trainer:training_loss : mae
INFO:echo.src.base_objective:Beginning trial 40
INFO:root:Loading model deeplabv3 with settings {'in_channels': 4, 'classes': 1, 'activation': 'sigmoid'}
INFO:root:Loading loss smooth
INFO:root:Loading loss smooth
INFO:echo.src.base_objective:Saving trial 40 results to local file /glade/work/kdagon/s2sml/results_week3_SH_530/trial_results/trial_results_31820.gusched01.csv
INFO:echo.src.base_objective:Merging trial results and saving to /glade/work/kdagon/s2sml/results_week3_SH_530/trial_results.csv
[32m[I 2023-05-30 21:23:30,262][0m Trial 40 finished with values: [1.0650964885286802, 1.452371441095807, 1.238176610274859] and parameters: {'learning_rate': 0.0002508633780518012, 'norm': 'minmax', 'weight_decay': 6.194011908018905e-10, 'train_batch_size': 77, 'training_loss': 'mae', 'model_name': 'deeplabv3'}. [0m
INFO:echo.src.base_objective:Attempting to automatically update the model configuration using optuna's suggested parameters
INFO:echo.src.base_objective:	data:norm : minmax
INFO:echo.src.base_objective:	model:name : deeplabv3
INFO:echo.src.base_objective:	optimizer:learning_rate : 3.0296310278983887e-06
INFO:echo.src.base_objective:	trainer:train_batch_size : 90
INFO:echo.src.base_objective:	trainer:weight_decay : 7.812797491890647e-05
INFO:echo.src.base_objective:	trainer:training_loss : xsigmoid
INFO:echo.src.base_objective:Beginning trial 41
INFO:root:Loading model deeplabv3 with settings {'in_channels': 4, 'classes': 1, 'activation': 'sigmoid'}
INFO:root:Loading loss smooth
INFO:root:Loading loss smooth
INFO:echo.src.base_objective:Saving trial 39 results to local file /glade/work/kdagon/s2sml/results_week3_SH_530/trial_results/trial_results_31819.gusched01.csv
INFO:echo.src.base_objective:Merging trial results and saving to /glade/work/kdagon/s2sml/results_week3_SH_530/trial_results.csv
[32m[I 2023-05-30 21:34:20,203][0m Trial 39 finished with values: [1.2900491792723814, 4.994480701586399, 2.641689569893387] and parameters: {'learning_rate': 1.5634132381752595e-06, 'norm': 'minmax', 'weight_decay': 2.4023823359072413e-05, 'train_batch_size': 79, 'training_loss': 'logcosh', 'model_name': 'unet'}. [0m
INFO:echo.src.base_objective:Attempting to automatically update the model configuration using optuna's suggested parameters
INFO:echo.src.base_objective:	data:norm : zscore
INFO:echo.src.base_objective:	model:name : fpn
INFO:echo.src.base_objective:	optimizer:learning_rate : 1.4970578200769323e-05
INFO:echo.src.base_objective:	trainer:train_batch_size : 94
INFO:echo.src.base_objective:	trainer:weight_decay : 2.0474336944226856e-10
INFO:echo.src.base_objective:	trainer:training_loss : xtanh
INFO:echo.src.base_objective:Beginning trial 42
INFO:root:Loading model fpn with settings {'in_channels': 4, 'classes': 1, 'activation': 'sigmoid'}
INFO:root:Loading loss smooth
INFO:root:Loading loss smooth
INFO:echo.src.base_objective:Saving trial 41 results to local file /glade/work/kdagon/s2sml/results_week3_SH_530/trial_results/trial_results_31820.gusched01.csv
INFO:echo.src.base_objective:Merging trial results and saving to /glade/work/kdagon/s2sml/results_week3_SH_530/trial_results.csv
[32m[I 2023-05-30 21:39:05,110][0m Trial 41 finished with values: [1.2502276228900613, 5.3761155210075575, 2.484337392907522] and parameters: {'learning_rate': 3.0296310278983887e-06, 'norm': 'minmax', 'weight_decay': 7.812797491890647e-05, 'train_batch_size': 90, 'training_loss': 'xsigmoid', 'model_name': 'deeplabv3'}. [0m
INFO:echo.src.base_objective:Attempting to automatically update the model configuration using optuna's suggested parameters
INFO:echo.src.base_objective:	data:norm : minmax
INFO:echo.src.base_objective:	model:name : manet
INFO:echo.src.base_objective:	optimizer:learning_rate : 0.0020806786154491134
INFO:echo.src.base_objective:	trainer:train_batch_size : 96
INFO:echo.src.base_objective:	trainer:weight_decay : 8.278383992889147e-12
INFO:echo.src.base_objective:	trainer:training_loss : xtanh
INFO:echo.src.base_objective:Beginning trial 43
INFO:root:Loading model manet with settings {'in_channels': 4, 'classes': 1, 'activation': 'sigmoid'}
INFO:root:Loading loss smooth
INFO:root:Loading loss smooth
INFO:echo.src.base_objective:Saving trial 42 results to local file /glade/work/kdagon/s2sml/results_week3_SH_530/trial_results/trial_results_31819.gusched01.csv
INFO:echo.src.base_objective:Merging trial results and saving to /glade/work/kdagon/s2sml/results_week3_SH_530/trial_results.csv
[32m[I 2023-05-30 21:51:27,838][0m Trial 42 finished with values: [1.197497498778922, 3.8283993218421575, 2.173734165243554] and parameters: {'learning_rate': 1.4970578200769323e-05, 'norm': 'zscore', 'weight_decay': 2.0474336944226856e-10, 'train_batch_size': 94, 'training_loss': 'xtanh', 'model_name': 'fpn'}. [0m
WARNING:root:Stopping early since the longest observed run-time in the study exceeds the time remaining on this node.
INFO:root:Saving trial details to /glade/work/kdagon/s2sml/results_week3_SH_530/
INFO:root:Running on PBS/SLURM batch id: 31821.gusched01
INFO:root:Importing custom objective from /glade/work/kdagon/s2sml/applications/train.py
INFO:echo.src.reporting:Using device 0
INFO:root:Direction of optimization: ['minimize', 'minimize', 'minimize']
INFO:root:Using metric ['valid_custom', 'valid_custom_second', 'valid_custom_third']
[32m[I 2023-05-30 21:51:51,461][0m Using an existing study with name 'vanilla' instead of creating a new one.[0m
INFO:root:Loaded study vanilla located at sqlite:////glade/work/kdagon/s2sml/results_week3_SH_530/s2s.db
INFO:echo.src.base_objective:Worker 31821.gusched01 is summoned.
INFO:echo.src.base_objective:	initializing an objective to be optimized with metric ['valid_custom', 'valid_custom_second', 'valid_custom_third']
INFO:echo.src.base_objective:	using device(s) cuda:0
INFO:echo.src.base_objective:	saving study/trial results to local file /glade/work/kdagon/s2sml/results_week3_SH_530/trial_results/trial_results_31821.gusched01.csv
INFO:root:Running optimization for 1000 trials
INFO:root:Running trials for a maximum PBS wall-time 2:00:00
WARNING:root:Attempting to run trials and stop before hitting the wall-time
WARNING:root:Some trials may not complete if the wall-time is reached. Optuna will start over.
INFO:echo.src.base_objective:Attempting to automatically update the model configuration using optuna's suggested parameters
INFO:echo.src.base_objective:	data:norm : negone
INFO:echo.src.base_objective:	model:name : fpn
INFO:echo.src.base_objective:	optimizer:learning_rate : 1.484078444679139e-06
INFO:echo.src.base_objective:	trainer:train_batch_size : 94
INFO:echo.src.base_objective:	trainer:weight_decay : 0.00037374237771707587
INFO:echo.src.base_objective:	trainer:training_loss : mae
INFO:echo.src.base_objective:Beginning trial 44
INFO:root:Loading model fpn with settings {'in_channels': 4, 'classes': 1, 'activation': 'sigmoid'}
INFO:root:Loading loss smooth
INFO:root:Loading loss smooth
INFO:echo.src.base_objective:Saving trial 44 results to local file /glade/work/kdagon/s2sml/results_week3_SH_530/trial_results/trial_results_31821.gusched01.csv
INFO:echo.src.base_objective:Merging trial results and saving to /glade/work/kdagon/s2sml/results_week3_SH_530/trial_results.csv
[32m[I 2023-05-30 21:57:45,714][0m Trial 44 finished with values: [3.361707313781307, 8.217590742006383, 3.3273253276664376] and parameters: {'learning_rate': 1.484078444679139e-06, 'norm': 'negone', 'weight_decay': 0.00037374237771707587, 'train_batch_size': 94, 'training_loss': 'mae', 'model_name': 'fpn'}. [0m
INFO:echo.src.base_objective:Attempting to automatically update the model configuration using optuna's suggested parameters
INFO:echo.src.base_objective:	data:norm : negone
INFO:echo.src.base_objective:	model:name : linknet
INFO:echo.src.base_objective:	optimizer:learning_rate : 0.00042912064940773875
INFO:echo.src.base_objective:	trainer:train_batch_size : 53
INFO:echo.src.base_objective:	trainer:weight_decay : 0.00019095185233813626
INFO:echo.src.base_objective:	trainer:training_loss : mse
INFO:echo.src.base_objective:Beginning trial 45
INFO:root:Loading model linknet with settings {'in_channels': 4, 'classes': 1, 'activation': 'sigmoid'}
INFO:root:Loading loss smooth
INFO:root:Loading loss smooth
INFO:echo.src.base_objective:Saving trial 43 results to local file /glade/work/kdagon/s2sml/results_week3_SH_530/trial_results/trial_results_31820.gusched01.csv
INFO:echo.src.base_objective:Merging trial results and saving to /glade/work/kdagon/s2sml/results_week3_SH_530/trial_results.csv
[32m[I 2023-05-30 21:58:28,222][0m Trial 43 finished with values: [0.9599522579925722, 0.37642779032417917, 0.6621015524369589] and parameters: {'learning_rate': 0.0020806786154491134, 'norm': 'minmax', 'weight_decay': 8.278383992889147e-12, 'train_batch_size': 96, 'training_loss': 'xtanh', 'model_name': 'manet'}. [0m
WARNING:root:Stopping early since the longest observed run-time in the study exceeds the time remaining on this node.
INFO:root:Saving trial details to /glade/work/kdagon/s2sml/results_week3_SH_530/
INFO:root:Running on PBS/SLURM batch id: 31822.gusched01
INFO:root:Importing custom objective from /glade/work/kdagon/s2sml/applications/train.py
INFO:echo.src.reporting:Using device 0
INFO:root:Direction of optimization: ['minimize', 'minimize', 'minimize']
INFO:root:Using metric ['valid_custom', 'valid_custom_second', 'valid_custom_third']
[32m[I 2023-05-30 21:58:52,383][0m Using an existing study with name 'vanilla' instead of creating a new one.[0m
INFO:root:Loaded study vanilla located at sqlite:////glade/work/kdagon/s2sml/results_week3_SH_530/s2s.db
INFO:echo.src.base_objective:Worker 31822.gusched01 is summoned.
INFO:echo.src.base_objective:	initializing an objective to be optimized with metric ['valid_custom', 'valid_custom_second', 'valid_custom_third']
INFO:echo.src.base_objective:	using device(s) cuda:0
INFO:echo.src.base_objective:	saving study/trial results to local file /glade/work/kdagon/s2sml/results_week3_SH_530/trial_results/trial_results_31822.gusched01.csv
INFO:root:Running optimization for 1000 trials
INFO:root:Running trials for a maximum PBS wall-time 2:00:00
WARNING:root:Attempting to run trials and stop before hitting the wall-time
WARNING:root:Some trials may not complete if the wall-time is reached. Optuna will start over.
INFO:echo.src.base_objective:Attempting to automatically update the model configuration using optuna's suggested parameters
INFO:echo.src.base_objective:	data:norm : zscore
INFO:echo.src.base_objective:	model:name : manet
INFO:echo.src.base_objective:	optimizer:learning_rate : 3.4854841504132265e-06
INFO:echo.src.base_objective:	trainer:train_batch_size : 105
INFO:echo.src.base_objective:	trainer:weight_decay : 0.00021769839714347184
INFO:echo.src.base_objective:	trainer:training_loss : logcosh
INFO:echo.src.base_objective:Beginning trial 46
INFO:root:Loading model manet with settings {'in_channels': 4, 'classes': 1, 'activation': 'sigmoid'}
INFO:root:Loading loss smooth
INFO:root:Loading loss smooth
INFO:echo.src.base_objective:Saving trial 45 results to local file /glade/work/kdagon/s2sml/results_week3_SH_530/trial_results/trial_results_31821.gusched01.csv
INFO:echo.src.base_objective:Merging trial results and saving to /glade/work/kdagon/s2sml/results_week3_SH_530/trial_results.csv
[32m[I 2023-05-30 22:26:57,681][0m Trial 45 finished with values: [0.9966763966640967, 1.1717390148832234, 1.106336488987593] and parameters: {'learning_rate': 0.00042912064940773875, 'norm': 'negone', 'weight_decay': 0.00019095185233813626, 'train_batch_size': 53, 'training_loss': 'mse', 'model_name': 'linknet'}. [0m
INFO:echo.src.base_objective:Attempting to automatically update the model configuration using optuna's suggested parameters
INFO:echo.src.base_objective:	data:norm : minmax
INFO:echo.src.base_objective:	model:name : linknet
INFO:echo.src.base_objective:	optimizer:learning_rate : 0.0001262786392436874
INFO:echo.src.base_objective:	trainer:train_batch_size : 59
INFO:echo.src.base_objective:	trainer:weight_decay : 0.0001683527032353388
INFO:echo.src.base_objective:	trainer:training_loss : xtanh
INFO:echo.src.base_objective:Beginning trial 47
INFO:root:Loading model linknet with settings {'in_channels': 4, 'classes': 1, 'activation': 'sigmoid'}
INFO:root:Loading loss smooth
INFO:root:Loading loss smooth
INFO:echo.src.base_objective:Saving trial 46 results to local file /glade/work/kdagon/s2sml/results_week3_SH_530/trial_results/trial_results_31822.gusched01.csv
INFO:echo.src.base_objective:Merging trial results and saving to /glade/work/kdagon/s2sml/results_week3_SH_530/trial_results.csv
[32m[I 2023-05-30 22:32:52,076][0m Trial 46 finished with values: [1.0966858501836594, 4.92242459541109, 2.5982594619190644] and parameters: {'learning_rate': 3.4854841504132265e-06, 'norm': 'zscore', 'weight_decay': 0.00021769839714347184, 'train_batch_size': 105, 'training_loss': 'logcosh', 'model_name': 'manet'}. [0m
INFO:echo.src.base_objective:Attempting to automatically update the model configuration using optuna's suggested parameters
INFO:echo.src.base_objective:	data:norm : minmax
INFO:echo.src.base_objective:	model:name : manet
INFO:echo.src.base_objective:	optimizer:learning_rate : 2.4896632824992464e-06
INFO:echo.src.base_objective:	trainer:train_batch_size : 47
INFO:echo.src.base_objective:	trainer:weight_decay : 0.0009998546784309845
INFO:echo.src.base_objective:	trainer:training_loss : mae
INFO:echo.src.base_objective:Beginning trial 48
INFO:root:Loading model manet with settings {'in_channels': 4, 'classes': 1, 'activation': 'sigmoid'}
INFO:root:Loading loss smooth
INFO:root:Loading loss smooth
INFO:echo.src.base_objective:Saving trial 47 results to local file /glade/work/kdagon/s2sml/results_week3_SH_530/trial_results/trial_results_31821.gusched01.csv
INFO:echo.src.base_objective:Merging trial results and saving to /glade/work/kdagon/s2sml/results_week3_SH_530/trial_results.csv
[32m[I 2023-05-30 22:36:40,227][0m Trial 47 finished with values: [1.0469580991883851, 1.3167977270027607, 1.2098569313669623] and parameters: {'learning_rate': 0.0001262786392436874, 'norm': 'minmax', 'weight_decay': 0.0001683527032353388, 'train_batch_size': 59, 'training_loss': 'xtanh', 'model_name': 'linknet'}. [0m
INFO:echo.src.base_objective:Attempting to automatically update the model configuration using optuna's suggested parameters
INFO:echo.src.base_objective:	data:norm : zscore
INFO:echo.src.base_objective:	model:name : linknet
INFO:echo.src.base_objective:	optimizer:learning_rate : 0.0009917124867738617
INFO:echo.src.base_objective:	trainer:train_batch_size : 15
INFO:echo.src.base_objective:	trainer:weight_decay : 1.374716954864566e-06
INFO:echo.src.base_objective:	trainer:training_loss : mae
INFO:echo.src.base_objective:Beginning trial 49
INFO:root:Loading model linknet with settings {'in_channels': 4, 'classes': 1, 'activation': 'sigmoid'}
INFO:root:Loading loss smooth
INFO:root:Loading loss smooth
INFO:echo.src.base_objective:Saving trial 49 results to local file /glade/work/kdagon/s2sml/results_week3_SH_530/trial_results/trial_results_31821.gusched01.csv
INFO:echo.src.base_objective:Merging trial results and saving to /glade/work/kdagon/s2sml/results_week3_SH_530/trial_results.csv
[32m[I 2023-05-30 22:39:49,617][0m Trial 49 finished with values: [1.0967530513075785, 3.80706826326901, 2.152742868101721] and parameters: {'learning_rate': 0.0009917124867738617, 'norm': 'zscore', 'weight_decay': 1.374716954864566e-06, 'train_batch_size': 15, 'training_loss': 'mae', 'model_name': 'linknet'}. [0m
INFO:echo.src.base_objective:Attempting to automatically update the model configuration using optuna's suggested parameters
INFO:echo.src.base_objective:	data:norm : minmax
INFO:echo.src.base_objective:	model:name : unet
INFO:echo.src.base_objective:	optimizer:learning_rate : 7.623902689829396e-05
INFO:echo.src.base_objective:	trainer:train_batch_size : 76
INFO:echo.src.base_objective:	trainer:weight_decay : 0.00028355475960317077
INFO:echo.src.base_objective:	trainer:training_loss : mse
INFO:echo.src.base_objective:Beginning trial 50
INFO:root:Loading model unet with settings {'in_channels': 4, 'classes': 1, 'activation': 'sigmoid'}
INFO:root:Loading loss smooth
INFO:root:Loading loss smooth
INFO:echo.src.base_objective:Saving trial 50 results to local file /glade/work/kdagon/s2sml/results_week3_SH_530/trial_results/trial_results_31821.gusched01.csv
INFO:echo.src.base_objective:Merging trial results and saving to /glade/work/kdagon/s2sml/results_week3_SH_530/trial_results.csv
[32m[I 2023-05-30 22:52:34,125][0m Trial 50 finished with values: [0.9804792393298294, 0.6123768185059376, 0.8731884059066869] and parameters: {'learning_rate': 7.623902689829396e-05, 'norm': 'minmax', 'weight_decay': 0.00028355475960317077, 'train_batch_size': 76, 'training_loss': 'mse', 'model_name': 'unet'}. [0m
INFO:echo.src.base_objective:Attempting to automatically update the model configuration using optuna's suggested parameters
INFO:echo.src.base_objective:	data:norm : minmax
INFO:echo.src.base_objective:	model:name : deeplabv3
INFO:echo.src.base_objective:	optimizer:learning_rate : 0.006889530478335835
INFO:echo.src.base_objective:	trainer:train_batch_size : 55
INFO:echo.src.base_objective:	trainer:weight_decay : 5.388578193125046e-09
INFO:echo.src.base_objective:	trainer:training_loss : xsigmoid
INFO:echo.src.base_objective:Beginning trial 51
INFO:root:Loading model deeplabv3 with settings {'in_channels': 4, 'classes': 1, 'activation': 'sigmoid'}
INFO:root:Loading loss smooth
INFO:root:Loading loss smooth
INFO:echo.src.base_objective:Saving trial 48 results to local file /glade/work/kdagon/s2sml/results_week3_SH_530/trial_results/trial_results_31822.gusched01.csv
INFO:echo.src.base_objective:Merging trial results and saving to /glade/work/kdagon/s2sml/results_week3_SH_530/trial_results.csv
[32m[I 2023-05-30 23:01:19,304][0m Trial 48 finished with values: [1.1198611630613406, 2.0717794703781576, 1.534847298900273] and parameters: {'learning_rate': 2.4896632824992464e-06, 'norm': 'minmax', 'weight_decay': 0.0009998546784309845, 'train_batch_size': 47, 'training_loss': 'mae', 'model_name': 'manet'}. [0m
INFO:echo.src.base_objective:Attempting to automatically update the model configuration using optuna's suggested parameters
INFO:echo.src.base_objective:	data:norm : minmax
INFO:echo.src.base_objective:	model:name : unet
INFO:echo.src.base_objective:	optimizer:learning_rate : 2.5687181468915415e-05
INFO:echo.src.base_objective:	trainer:train_batch_size : 87
INFO:echo.src.base_objective:	trainer:weight_decay : 7.012471876925735e-05
INFO:echo.src.base_objective:	trainer:training_loss : xtanh
INFO:echo.src.base_objective:Beginning trial 52
INFO:root:Loading model unet with settings {'in_channels': 4, 'classes': 1, 'activation': 'sigmoid'}
INFO:root:Loading loss smooth
INFO:root:Loading loss smooth
INFO:echo.src.base_objective:Saving trial 51 results to local file /glade/work/kdagon/s2sml/results_week3_SH_530/trial_results/trial_results_31821.gusched01.csv
INFO:echo.src.base_objective:Merging trial results and saving to /glade/work/kdagon/s2sml/results_week3_SH_530/trial_results.csv
[32m[I 2023-05-30 23:03:36,972][0m Trial 51 finished with values: [1.0695379186893748, 1.43734144503693, 1.216368112877054] and parameters: {'learning_rate': 0.006889530478335835, 'norm': 'minmax', 'weight_decay': 5.388578193125046e-09, 'train_batch_size': 55, 'training_loss': 'xsigmoid', 'model_name': 'deeplabv3'}. [0m
INFO:echo.src.base_objective:Attempting to automatically update the model configuration using optuna's suggested parameters
INFO:echo.src.base_objective:	data:norm : minmax
INFO:echo.src.base_objective:	model:name : fpn
INFO:echo.src.base_objective:	optimizer:learning_rate : 0.0003324808851699029
INFO:echo.src.base_objective:	trainer:train_batch_size : 51
INFO:echo.src.base_objective:	trainer:weight_decay : 6.935648296133043e-11
INFO:echo.src.base_objective:	trainer:training_loss : xsigmoid
INFO:echo.src.base_objective:Beginning trial 53
INFO:root:Loading model fpn with settings {'in_channels': 4, 'classes': 1, 'activation': 'sigmoid'}
INFO:root:Loading loss smooth
INFO:root:Loading loss smooth
INFO:echo.src.base_objective:Saving trial 52 results to local file /glade/work/kdagon/s2sml/results_week3_SH_530/trial_results/trial_results_31822.gusched01.csv
INFO:echo.src.base_objective:Merging trial results and saving to /glade/work/kdagon/s2sml/results_week3_SH_530/trial_results.csv
