[32m[I 2023-05-30 23:07:57,113][0m Trial 52 finished with values: [1.1647056063011387, 3.2373672513280813, 1.9722661178260203] and parameters: {'learning_rate': 2.5687181468915415e-05, 'norm': 'minmax', 'weight_decay': 7.012471876925735e-05, 'train_batch_size': 87, 'training_loss': 'xtanh', 'model_name': 'unet'}. [0m
INFO:echo.src.base_objective:Attempting to automatically update the model configuration using optuna's suggested parameters
INFO:echo.src.base_objective:	data:norm : minmax
INFO:echo.src.base_objective:	model:name : pspnet
INFO:echo.src.base_objective:	optimizer:learning_rate : 4.324830640708608e-06
INFO:echo.src.base_objective:	trainer:train_batch_size : 19
INFO:echo.src.base_objective:	trainer:weight_decay : 5.095545050211428e-09
INFO:echo.src.base_objective:	trainer:training_loss : xtanh
INFO:echo.src.base_objective:Beginning trial 54
INFO:root:Loading model pspnet with settings {'in_channels': 4, 'classes': 1, 'activation': 'sigmoid'}
INFO:root:Loading loss smooth
INFO:root:Loading loss smooth
INFO:echo.src.base_objective:Saving trial 53 results to local file /glade/work/kdagon/s2sml/results_week3_SH_530/trial_results/trial_results_31821.gusched01.csv
INFO:echo.src.base_objective:Merging trial results and saving to /glade/work/kdagon/s2sml/results_week3_SH_530/trial_results.csv
[32m[I 2023-05-30 23:14:52,889][0m Trial 53 finished with values: [1.0294691558728157, 1.3868161348635148, 1.2143821869399933] and parameters: {'learning_rate': 0.0003324808851699029, 'norm': 'minmax', 'weight_decay': 6.935648296133043e-11, 'train_batch_size': 51, 'training_loss': 'xsigmoid', 'model_name': 'fpn'}. [0m
WARNING:root:Stopping early since the longest observed run-time in the study exceeds the time remaining on this node.
INFO:root:Saving trial details to /glade/work/kdagon/s2sml/results_week3_SH_530/
INFO:root:Running on PBS/SLURM batch id: 31823.gusched01
INFO:root:Importing custom objective from /glade/work/kdagon/s2sml/applications/train.py
INFO:echo.src.reporting:Using device 0
INFO:root:Direction of optimization: ['minimize', 'minimize', 'minimize']
INFO:root:Using metric ['valid_custom', 'valid_custom_second', 'valid_custom_third']
[32m[I 2023-05-30 23:15:14,998][0m Using an existing study with name 'vanilla' instead of creating a new one.[0m
INFO:root:Loaded study vanilla located at sqlite:////glade/work/kdagon/s2sml/results_week3_SH_530/s2s.db
INFO:echo.src.base_objective:Worker 31823.gusched01 is summoned.
INFO:echo.src.base_objective:	initializing an objective to be optimized with metric ['valid_custom', 'valid_custom_second', 'valid_custom_third']
INFO:echo.src.base_objective:	using device(s) cuda:0
INFO:echo.src.base_objective:	saving study/trial results to local file /glade/work/kdagon/s2sml/results_week3_SH_530/trial_results/trial_results_31823.gusched01.csv
INFO:root:Running optimization for 1000 trials
INFO:root:Running trials for a maximum PBS wall-time 2:00:00
WARNING:root:Attempting to run trials and stop before hitting the wall-time
WARNING:root:Some trials may not complete if the wall-time is reached. Optuna will start over.
INFO:echo.src.base_objective:Attempting to automatically update the model configuration using optuna's suggested parameters
INFO:echo.src.base_objective:	data:norm : negone
INFO:echo.src.base_objective:	model:name : deeplabv3
INFO:echo.src.base_objective:	optimizer:learning_rate : 0.00014454804492687528
INFO:echo.src.base_objective:	trainer:train_batch_size : 49
INFO:echo.src.base_objective:	trainer:weight_decay : 3.274720014209478e-07
INFO:echo.src.base_objective:	trainer:training_loss : logcosh
INFO:echo.src.base_objective:Beginning trial 55
INFO:root:Loading model deeplabv3 with settings {'in_channels': 4, 'classes': 1, 'activation': 'sigmoid'}
INFO:root:Loading loss smooth
INFO:root:Loading loss smooth
INFO:echo.src.base_objective:Saving trial 55 results to local file /glade/work/kdagon/s2sml/results_week3_SH_530/trial_results/trial_results_31823.gusched01.csv
INFO:echo.src.base_objective:Merging trial results and saving to /glade/work/kdagon/s2sml/results_week3_SH_530/trial_results.csv
[32m[I 2023-05-30 23:22:05,966][0m Trial 55 finished with values: [1.0943625601156097, 1.8408990358263775, 1.389524159018891] and parameters: {'learning_rate': 0.00014454804492687528, 'norm': 'negone', 'weight_decay': 3.274720014209478e-07, 'train_batch_size': 49, 'training_loss': 'logcosh', 'model_name': 'deeplabv3'}. [0m
INFO:echo.src.base_objective:Attempting to automatically update the model configuration using optuna's suggested parameters
INFO:echo.src.base_objective:	data:norm : zscore
INFO:echo.src.base_objective:	model:name : linknet
INFO:echo.src.base_objective:	optimizer:learning_rate : 2.0757083763175643e-06
INFO:echo.src.base_objective:	trainer:train_batch_size : 93
INFO:echo.src.base_objective:	trainer:weight_decay : 3.302292379117967e-09
INFO:echo.src.base_objective:	trainer:training_loss : logcosh
INFO:echo.src.base_objective:Beginning trial 56
INFO:root:Loading model linknet with settings {'in_channels': 4, 'classes': 1, 'activation': 'sigmoid'}
INFO:root:Loading loss smooth
INFO:root:Loading loss smooth
INFO:echo.src.base_objective:Saving trial 56 results to local file /glade/work/kdagon/s2sml/results_week3_SH_530/trial_results/trial_results_31823.gusched01.csv
INFO:echo.src.base_objective:Merging trial results and saving to /glade/work/kdagon/s2sml/results_week3_SH_530/trial_results.csv
[32m[I 2023-05-30 23:25:02,547][0m Trial 56 finished with values: [3.875515803047658, 7.394089847349712, 3.274113344090803] and parameters: {'learning_rate': 2.0757083763175643e-06, 'norm': 'zscore', 'weight_decay': 3.302292379117967e-09, 'train_batch_size': 93, 'training_loss': 'logcosh', 'model_name': 'linknet'}. [0m
INFO:echo.src.base_objective:Attempting to automatically update the model configuration using optuna's suggested parameters
INFO:echo.src.base_objective:	data:norm : zscore
INFO:echo.src.base_objective:	model:name : fpn
INFO:echo.src.base_objective:	optimizer:learning_rate : 0.0015059371119989465
INFO:echo.src.base_objective:	trainer:train_batch_size : 10
INFO:echo.src.base_objective:	trainer:weight_decay : 1.0899722277560529e-11
INFO:echo.src.base_objective:	trainer:training_loss : smooth
INFO:echo.src.base_objective:Beginning trial 57
INFO:root:Loading model fpn with settings {'in_channels': 4, 'classes': 1, 'activation': 'sigmoid'}
INFO:root:Loading loss smooth
INFO:root:Loading loss smooth
INFO:echo.src.base_objective:Saving trial 54 results to local file /glade/work/kdagon/s2sml/results_week3_SH_530/trial_results/trial_results_31822.gusched01.csv
INFO:echo.src.base_objective:Merging trial results and saving to /glade/work/kdagon/s2sml/results_week3_SH_530/trial_results.csv
[32m[I 2023-05-30 23:28:09,655][0m Trial 54 finished with values: [1.0768921835975005, 1.5416426531028822, 1.2854698667194473] and parameters: {'learning_rate': 4.324830640708608e-06, 'norm': 'minmax', 'weight_decay': 5.095545050211428e-09, 'train_batch_size': 19, 'training_loss': 'xtanh', 'model_name': 'pspnet'}. [0m
WARNING:root:Stopping early since the longest observed run-time in the study exceeds the time remaining on this node.
INFO:root:Saving trial details to /glade/work/kdagon/s2sml/results_week3_SH_530/
INFO:root:Running on PBS/SLURM batch id: 31824.gusched01
INFO:root:Importing custom objective from /glade/work/kdagon/s2sml/applications/train.py
INFO:echo.src.reporting:Using device 0
INFO:root:Direction of optimization: ['minimize', 'minimize', 'minimize']
INFO:root:Using metric ['valid_custom', 'valid_custom_second', 'valid_custom_third']
[32m[I 2023-05-30 23:28:31,743][0m Using an existing study with name 'vanilla' instead of creating a new one.[0m
INFO:root:Loaded study vanilla located at sqlite:////glade/work/kdagon/s2sml/results_week3_SH_530/s2s.db
INFO:echo.src.base_objective:Worker 31824.gusched01 is summoned.
INFO:echo.src.base_objective:	initializing an objective to be optimized with metric ['valid_custom', 'valid_custom_second', 'valid_custom_third']
INFO:echo.src.base_objective:	using device(s) cuda:0
INFO:echo.src.base_objective:	saving study/trial results to local file /glade/work/kdagon/s2sml/results_week3_SH_530/trial_results/trial_results_31824.gusched01.csv
INFO:root:Running optimization for 1000 trials
INFO:root:Running trials for a maximum PBS wall-time 2:00:00
WARNING:root:Attempting to run trials and stop before hitting the wall-time
WARNING:root:Some trials may not complete if the wall-time is reached. Optuna will start over.
INFO:echo.src.base_objective:Attempting to automatically update the model configuration using optuna's suggested parameters
INFO:echo.src.base_objective:	data:norm : minmax
INFO:echo.src.base_objective:	model:name : deeplabv3+
INFO:echo.src.base_objective:	optimizer:learning_rate : 0.00013080358547894368
INFO:echo.src.base_objective:	trainer:train_batch_size : 5
INFO:echo.src.base_objective:	trainer:weight_decay : 0.00015069134280088208
INFO:echo.src.base_objective:	trainer:training_loss : mse
INFO:echo.src.base_objective:Beginning trial 58
INFO:root:Loading model deeplabv3+ with settings {'in_channels': 4, 'classes': 1, 'activation': 'sigmoid'}
INFO:root:Loading loss smooth
INFO:root:Loading loss smooth
INFO:echo.src.base_objective:Saving trial 57 results to local file /glade/work/kdagon/s2sml/results_week3_SH_530/trial_results/trial_results_31823.gusched01.csv
INFO:echo.src.base_objective:Merging trial results and saving to /glade/work/kdagon/s2sml/results_week3_SH_530/trial_results.csv
[32m[I 2023-05-30 23:30:41,561][0m Trial 57 finished with values: [1.1489944703261634, 3.7303745617543727, 2.1306790674224128] and parameters: {'learning_rate': 0.0015059371119989465, 'norm': 'zscore', 'weight_decay': 1.0899722277560529e-11, 'train_batch_size': 10, 'training_loss': 'smooth', 'model_name': 'fpn'}. [0m
INFO:echo.src.base_objective:Attempting to automatically update the model configuration using optuna's suggested parameters
INFO:echo.src.base_objective:	data:norm : zscore
INFO:echo.src.base_objective:	model:name : deeplabv3
INFO:echo.src.base_objective:	optimizer:learning_rate : 2.636449793841918e-06
INFO:echo.src.base_objective:	trainer:train_batch_size : 50
INFO:echo.src.base_objective:	trainer:weight_decay : 3.9025666277166716e-11
INFO:echo.src.base_objective:	trainer:training_loss : huber
INFO:echo.src.base_objective:Beginning trial 59
INFO:root:Loading model deeplabv3 with settings {'in_channels': 4, 'classes': 1, 'activation': 'sigmoid'}
INFO:root:Loading loss smooth
INFO:root:Loading loss smooth
INFO:echo.src.base_objective:Saving trial 59 results to local file /glade/work/kdagon/s2sml/results_week3_SH_530/trial_results/trial_results_31823.gusched01.csv
INFO:echo.src.base_objective:Merging trial results and saving to /glade/work/kdagon/s2sml/results_week3_SH_530/trial_results.csv
[32m[I 2023-05-30 23:39:09,222][0m Trial 59 finished with values: [1.2282700735085537, 5.152753276363091, 2.642312409113098] and parameters: {'learning_rate': 2.636449793841918e-06, 'norm': 'zscore', 'weight_decay': 3.9025666277166716e-11, 'train_batch_size': 50, 'training_loss': 'huber', 'model_name': 'deeplabv3'}. [0m
INFO:echo.src.base_objective:Attempting to automatically update the model configuration using optuna's suggested parameters
INFO:echo.src.base_objective:	data:norm : negone
INFO:echo.src.base_objective:	model:name : unet++
INFO:echo.src.base_objective:	optimizer:learning_rate : 2.186621091854318e-06
INFO:echo.src.base_objective:	trainer:train_batch_size : 90
INFO:echo.src.base_objective:	trainer:weight_decay : 1.7497141572062836e-06
INFO:echo.src.base_objective:	trainer:training_loss : mse
INFO:echo.src.base_objective:Beginning trial 60
INFO:root:Loading model unet++ with settings {'in_channels': 4, 'classes': 1, 'activation': 'sigmoid'}
INFO:root:Loading loss smooth
INFO:root:Loading loss smooth
INFO:echo.src.base_objective:Saving trial 60 results to local file /glade/work/kdagon/s2sml/results_week3_SH_530/trial_results/trial_results_31823.gusched01.csv
INFO:echo.src.base_objective:Merging trial results and saving to /glade/work/kdagon/s2sml/results_week3_SH_530/trial_results.csv
[32m[I 2023-05-30 23:42:45,872][0m Trial 60 finished with values: [2.3782837929576828, 27.944710533515806, 6.919860266549008] and parameters: {'learning_rate': 2.186621091854318e-06, 'norm': 'negone', 'weight_decay': 1.7497141572062836e-06, 'train_batch_size': 90, 'training_loss': 'mse', 'model_name': 'unet++'}. [0m
INFO:echo.src.base_objective:Attempting to automatically update the model configuration using optuna's suggested parameters
INFO:echo.src.base_objective:	data:norm : minmax
INFO:echo.src.base_objective:	model:name : unet
INFO:echo.src.base_objective:	optimizer:learning_rate : 0.00025072713441067965
INFO:echo.src.base_objective:	trainer:train_batch_size : 55
INFO:echo.src.base_objective:	trainer:weight_decay : 9.007889186180289e-07
INFO:echo.src.base_objective:	trainer:training_loss : xsigmoid
INFO:echo.src.base_objective:Beginning trial 61
INFO:root:Loading model unet with settings {'in_channels': 4, 'classes': 1, 'activation': 'sigmoid'}
INFO:root:Loading loss smooth
INFO:root:Loading loss smooth
INFO:echo.src.base_objective:Saving trial 58 results to local file /glade/work/kdagon/s2sml/results_week3_SH_530/trial_results/trial_results_31824.gusched01.csv
INFO:echo.src.base_objective:Merging trial results and saving to /glade/work/kdagon/s2sml/results_week3_SH_530/trial_results.csv
[32m[I 2023-05-30 23:44:42,262][0m Trial 58 finished with values: [1.0135501740212425, 0.9403919168003826, 0.923076976588365] and parameters: {'learning_rate': 0.00013080358547894368, 'norm': 'minmax', 'weight_decay': 0.00015069134280088208, 'train_batch_size': 5, 'training_loss': 'mse', 'model_name': 'deeplabv3+'}. [0m
INFO:echo.src.base_objective:Attempting to automatically update the model configuration using optuna's suggested parameters
INFO:echo.src.base_objective:	data:norm : minmax
INFO:echo.src.base_objective:	model:name : fpn
INFO:echo.src.base_objective:	optimizer:learning_rate : 4.661121999173718e-05
INFO:echo.src.base_objective:	trainer:train_batch_size : 38
INFO:echo.src.base_objective:	trainer:weight_decay : 0.00012488540012829387
INFO:echo.src.base_objective:	trainer:training_loss : smooth
INFO:echo.src.base_objective:Beginning trial 62
INFO:root:Loading model fpn with settings {'in_channels': 4, 'classes': 1, 'activation': 'sigmoid'}
INFO:root:Loading loss smooth
INFO:root:Loading loss smooth
INFO:echo.src.base_objective:Saving trial 61 results to local file /glade/work/kdagon/s2sml/results_week3_SH_530/trial_results/trial_results_31823.gusched01.csv
INFO:echo.src.base_objective:Merging trial results and saving to /glade/work/kdagon/s2sml/results_week3_SH_530/trial_results.csv
[32m[I 2023-05-30 23:47:35,347][0m Trial 61 finished with values: [0.9794511834549422, 0.5963234414504085, 0.8500278244374931] and parameters: {'learning_rate': 0.00025072713441067965, 'norm': 'minmax', 'weight_decay': 9.007889186180289e-07, 'train_batch_size': 55, 'training_loss': 'xsigmoid', 'model_name': 'unet'}. [0m
INFO:echo.src.base_objective:Attempting to automatically update the model configuration using optuna's suggested parameters
INFO:echo.src.base_objective:	data:norm : zscore
INFO:echo.src.base_objective:	model:name : unet
INFO:echo.src.base_objective:	optimizer:learning_rate : 0.0010109401466960669
INFO:echo.src.base_objective:	trainer:train_batch_size : 75
INFO:echo.src.base_objective:	trainer:weight_decay : 4.241290503552329e-08
INFO:echo.src.base_objective:	trainer:training_loss : xsigmoid
INFO:echo.src.base_objective:Beginning trial 63
INFO:root:Loading model unet with settings {'in_channels': 4, 'classes': 1, 'activation': 'sigmoid'}
INFO:root:Loading loss smooth
INFO:root:Loading loss smooth
INFO:echo.src.base_objective:Saving trial 63 results to local file /glade/work/kdagon/s2sml/results_week3_SH_530/trial_results/trial_results_31823.gusched01.csv
INFO:echo.src.base_objective:Merging trial results and saving to /glade/work/kdagon/s2sml/results_week3_SH_530/trial_results.csv
[32m[I 2023-05-30 23:51:21,327][0m Trial 63 finished with values: [1.0825414100612258, 3.8205670310605955, 2.1663487433788817] and parameters: {'learning_rate': 0.0010109401466960669, 'norm': 'zscore', 'weight_decay': 4.241290503552329e-08, 'train_batch_size': 75, 'training_loss': 'xsigmoid', 'model_name': 'unet'}. [0m
INFO:echo.src.base_objective:Attempting to automatically update the model configuration using optuna's suggested parameters
INFO:echo.src.base_objective:	data:norm : zscore
INFO:echo.src.base_objective:	model:name : deeplabv3
INFO:echo.src.base_objective:	optimizer:learning_rate : 6.582471301178855e-05
INFO:echo.src.base_objective:	trainer:train_batch_size : 60
INFO:echo.src.base_objective:	trainer:weight_decay : 7.627689075454885e-09
INFO:echo.src.base_objective:	trainer:training_loss : mse
INFO:echo.src.base_objective:Beginning trial 64
INFO:root:Loading model deeplabv3 with settings {'in_channels': 4, 'classes': 1, 'activation': 'sigmoid'}
INFO:root:Loading loss smooth
INFO:root:Loading loss smooth
INFO:echo.src.base_objective:Saving trial 62 results to local file /glade/work/kdagon/s2sml/results_week3_SH_530/trial_results/trial_results_31824.gusched01.csv
INFO:echo.src.base_objective:Merging trial results and saving to /glade/work/kdagon/s2sml/results_week3_SH_530/trial_results.csv
[32m[I 2023-05-30 23:56:58,957][0m Trial 62 finished with values: [1.046226298508629, 1.7792873227626351, 1.4502784303853564] and parameters: {'learning_rate': 4.661121999173718e-05, 'norm': 'minmax', 'weight_decay': 0.00012488540012829387, 'train_batch_size': 38, 'training_loss': 'smooth', 'model_name': 'fpn'}. [0m
INFO:echo.src.base_objective:Attempting to automatically update the model configuration using optuna's suggested parameters
INFO:echo.src.base_objective:	data:norm : minmax
INFO:echo.src.base_objective:	model:name : deeplabv3
INFO:echo.src.base_objective:	optimizer:learning_rate : 3.124831471831867e-05
INFO:echo.src.base_objective:	trainer:train_batch_size : 41
INFO:echo.src.base_objective:	trainer:weight_decay : 8.979427848776178e-12
INFO:echo.src.base_objective:	trainer:training_loss : logcosh
INFO:echo.src.base_objective:Beginning trial 65
INFO:root:Loading model deeplabv3 with settings {'in_channels': 4, 'classes': 1, 'activation': 'sigmoid'}
INFO:root:Loading loss smooth
INFO:root:Loading loss smooth
INFO:echo.src.base_objective:Saving trial 64 results to local file /glade/work/kdagon/s2sml/results_week3_SH_530/trial_results/trial_results_31823.gusched01.csv
INFO:echo.src.base_objective:Merging trial results and saving to /glade/work/kdagon/s2sml/results_week3_SH_530/trial_results.csv
[32m[I 2023-05-30 23:59:17,076][0m Trial 64 finished with values: [1.160218047208851, 4.086234509411634, 2.256285342420898] and parameters: {'learning_rate': 6.582471301178855e-05, 'norm': 'zscore', 'weight_decay': 7.627689075454885e-09, 'train_batch_size': 60, 'training_loss': 'mse', 'model_name': 'deeplabv3'}. [0m
INFO:echo.src.base_objective:Attempting to automatically update the model configuration using optuna's suggested parameters
INFO:echo.src.base_objective:	data:norm : negone
INFO:echo.src.base_objective:	model:name : manet
INFO:echo.src.base_objective:	optimizer:learning_rate : 1.532929296334742e-05
INFO:echo.src.base_objective:	trainer:train_batch_size : 72
INFO:echo.src.base_objective:	trainer:weight_decay : 2.2925092021508307e-11
INFO:echo.src.base_objective:	trainer:training_loss : logcosh
INFO:echo.src.base_objective:Beginning trial 66
INFO:root:Loading model manet with settings {'in_channels': 4, 'classes': 1, 'activation': 'sigmoid'}
INFO:root:Loading loss smooth
INFO:root:Loading loss smooth
INFO:echo.src.base_objective:Saving trial 65 results to local file /glade/work/kdagon/s2sml/results_week3_SH_530/trial_results/trial_results_31824.gusched01.csv
INFO:echo.src.base_objective:Merging trial results and saving to /glade/work/kdagon/s2sml/results_week3_SH_530/trial_results.csv
[32m[I 2023-05-31 00:01:02,645][0m Trial 65 finished with values: [1.126131033596005, 2.502090687147312, 1.8287370258106554] and parameters: {'learning_rate': 3.124831471831867e-05, 'norm': 'minmax', 'weight_decay': 8.979427848776178e-12, 'train_batch_size': 41, 'training_loss': 'logcosh', 'model_name': 'deeplabv3'}. [0m
INFO:echo.src.base_objective:Attempting to automatically update the model configuration using optuna's suggested parameters
INFO:echo.src.base_objective:	data:norm : minmax
INFO:echo.src.base_objective:	model:name : unet
INFO:echo.src.base_objective:	optimizer:learning_rate : 0.006051196638551918
INFO:echo.src.base_objective:	trainer:train_batch_size : 19
INFO:echo.src.base_objective:	trainer:weight_decay : 9.333614979831433e-12
INFO:echo.src.base_objective:	trainer:training_loss : logcosh
INFO:echo.src.base_objective:Beginning trial 67
INFO:root:Loading model unet with settings {'in_channels': 4, 'classes': 1, 'activation': 'sigmoid'}
INFO:root:Loading loss smooth
INFO:root:Loading loss smooth
INFO:echo.src.base_objective:Saving trial 67 results to local file /glade/work/kdagon/s2sml/results_week3_SH_530/trial_results/trial_results_31824.gusched01.csv
INFO:echo.src.base_objective:Merging trial results and saving to /glade/work/kdagon/s2sml/results_week3_SH_530/trial_results.csv
