[32m[I 2023-05-31 13:25:44,524][0m Trial 191 finished with values: [0.9580135278042068, 0.3557721533275469, 0.6453203421636061] and parameters: {'learning_rate': 0.0007993860340302303, 'norm': 'minmax', 'weight_decay': 1.3775084607525263e-07, 'train_batch_size': 6, 'training_loss': 'logcosh', 'model_name': 'unet'}. [0m
INFO:echo.src.base_objective:Attempting to automatically update the model configuration using optuna's suggested parameters
INFO:echo.src.base_objective:	data:norm : minmax
INFO:echo.src.base_objective:	model:name : unet
INFO:echo.src.base_objective:	optimizer:learning_rate : 2.4585072754405e-05
INFO:echo.src.base_objective:	trainer:train_batch_size : 8
INFO:echo.src.base_objective:	trainer:weight_decay : 2.795609543900149e-06
INFO:echo.src.base_objective:	trainer:training_loss : logcosh
INFO:echo.src.base_objective:Beginning trial 193
INFO:root:Loading model unet with settings {'in_channels': 4, 'classes': 1, 'activation': 'sigmoid'}
INFO:root:Loading loss smooth
INFO:root:Loading loss smooth
INFO:echo.src.base_objective:Saving trial 192 results to local file /glade/work/kdagon/s2sml/results_week3_SH_530/trial_results/trial_results_31842.gusched01.csv
INFO:echo.src.base_objective:Merging trial results and saving to /glade/work/kdagon/s2sml/results_week3_SH_530/trial_results.csv
[32m[I 2023-05-31 13:25:54,432][0m Trial 192 finished with values: [0.9588724120292217, 0.3609678204139272, 0.6559832612394229] and parameters: {'learning_rate': 0.0008172970875376057, 'norm': 'minmax', 'weight_decay': 0.0006157214088354671, 'train_batch_size': 8, 'training_loss': 'logcosh', 'model_name': 'unet'}. [0m
INFO:echo.src.base_objective:Attempting to automatically update the model configuration using optuna's suggested parameters
INFO:echo.src.base_objective:	data:norm : zscore
INFO:echo.src.base_objective:	model:name : deeplabv3+
INFO:echo.src.base_objective:	optimizer:learning_rate : 4.1987228779804464e-05
INFO:echo.src.base_objective:	trainer:train_batch_size : 80
INFO:echo.src.base_objective:	trainer:weight_decay : 7.831226100754759e-06
INFO:echo.src.base_objective:	trainer:training_loss : huber
INFO:echo.src.base_objective:Beginning trial 194
INFO:root:Loading model deeplabv3+ with settings {'in_channels': 4, 'classes': 1, 'activation': 'sigmoid'}
INFO:root:Loading loss smooth
INFO:root:Loading loss smooth
INFO:echo.src.base_objective:Saving trial 194 results to local file /glade/work/kdagon/s2sml/results_week3_SH_530/trial_results/trial_results_31842.gusched01.csv
INFO:echo.src.base_objective:Merging trial results and saving to /glade/work/kdagon/s2sml/results_week3_SH_530/trial_results.csv
[32m[I 2023-05-31 13:30:19,513][0m Trial 194 finished with values: [1.1605628642855903, 5.494729801177672, 2.752426686744443] and parameters: {'learning_rate': 4.1987228779804464e-05, 'norm': 'zscore', 'weight_decay': 7.831226100754759e-06, 'train_batch_size': 80, 'training_loss': 'huber', 'model_name': 'deeplabv3+'}. [0m
INFO:echo.src.base_objective:Attempting to automatically update the model configuration using optuna's suggested parameters
INFO:echo.src.base_objective:	data:norm : minmax
INFO:echo.src.base_objective:	model:name : pspnet
INFO:echo.src.base_objective:	optimizer:learning_rate : 0.00010972901985830312
INFO:echo.src.base_objective:	trainer:train_batch_size : 10
INFO:echo.src.base_objective:	trainer:weight_decay : 3.503504201365828e-09
INFO:echo.src.base_objective:	trainer:training_loss : xtanh
INFO:echo.src.base_objective:Beginning trial 195
INFO:root:Loading model pspnet with settings {'in_channels': 4, 'classes': 1, 'activation': 'sigmoid'}
INFO:root:Loading loss smooth
INFO:root:Loading loss smooth
INFO:echo.src.base_objective:Saving trial 193 results to local file /glade/work/kdagon/s2sml/results_week3_SH_530/trial_results/trial_results_31841.gusched01.csv
INFO:echo.src.base_objective:Merging trial results and saving to /glade/work/kdagon/s2sml/results_week3_SH_530/trial_results.csv
[32m[I 2023-05-31 13:32:45,703][0m Trial 193 finished with values: [1.0087587616030578, 0.9191810852265467, 1.0169501470586322] and parameters: {'learning_rate': 2.4585072754405e-05, 'norm': 'minmax', 'weight_decay': 2.795609543900149e-06, 'train_batch_size': 8, 'training_loss': 'logcosh', 'model_name': 'unet'}. [0m
INFO:echo.src.base_objective:Attempting to automatically update the model configuration using optuna's suggested parameters
INFO:echo.src.base_objective:	data:norm : minmax
INFO:echo.src.base_objective:	model:name : deeplabv3
INFO:echo.src.base_objective:	optimizer:learning_rate : 2.9318377562909163e-05
INFO:echo.src.base_objective:	trainer:train_batch_size : 14
INFO:echo.src.base_objective:	trainer:weight_decay : 1.4967700288418465e-05
INFO:echo.src.base_objective:	trainer:training_loss : xtanh
INFO:echo.src.base_objective:Beginning trial 196
INFO:root:Loading model deeplabv3 with settings {'in_channels': 4, 'classes': 1, 'activation': 'sigmoid'}
INFO:root:Loading loss smooth
INFO:root:Loading loss smooth
INFO:echo.src.base_objective:Saving trial 195 results to local file /glade/work/kdagon/s2sml/results_week3_SH_530/trial_results/trial_results_31842.gusched01.csv
INFO:echo.src.base_objective:Merging trial results and saving to /glade/work/kdagon/s2sml/results_week3_SH_530/trial_results.csv
[32m[I 2023-05-31 13:40:24,344][0m Trial 195 finished with values: [1.0616312825139502, 1.3774495150919854, 1.1798804288692657] and parameters: {'learning_rate': 0.00010972901985830312, 'norm': 'minmax', 'weight_decay': 3.503504201365828e-09, 'train_batch_size': 10, 'training_loss': 'xtanh', 'model_name': 'pspnet'}. [0m
INFO:echo.src.base_objective:Attempting to automatically update the model configuration using optuna's suggested parameters
INFO:echo.src.base_objective:	data:norm : minmax
INFO:echo.src.base_objective:	model:name : deeplabv3
INFO:echo.src.base_objective:	optimizer:learning_rate : 1.384824705572855e-05
INFO:echo.src.base_objective:	trainer:train_batch_size : 14
INFO:echo.src.base_objective:	trainer:weight_decay : 1.0258678736157487e-12
INFO:echo.src.base_objective:	trainer:training_loss : smooth
INFO:echo.src.base_objective:Beginning trial 197
INFO:root:Loading model deeplabv3 with settings {'in_channels': 4, 'classes': 1, 'activation': 'sigmoid'}
INFO:root:Loading loss smooth
INFO:root:Loading loss smooth
INFO:echo.src.base_objective:Saving trial 196 results to local file /glade/work/kdagon/s2sml/results_week3_SH_530/trial_results/trial_results_31841.gusched01.csv
INFO:echo.src.base_objective:Merging trial results and saving to /glade/work/kdagon/s2sml/results_week3_SH_530/trial_results.csv
[32m[I 2023-05-31 13:43:04,908][0m Trial 196 finished with values: [1.066663987207938, 1.4823041281658376, 1.2603867087173226] and parameters: {'learning_rate': 2.9318377562909163e-05, 'norm': 'minmax', 'weight_decay': 1.4967700288418465e-05, 'train_batch_size': 14, 'training_loss': 'xtanh', 'model_name': 'deeplabv3'}. [0m
INFO:echo.src.base_objective:Attempting to automatically update the model configuration using optuna's suggested parameters
INFO:echo.src.base_objective:	data:norm : minmax
INFO:echo.src.base_objective:	model:name : unet
INFO:echo.src.base_objective:	optimizer:learning_rate : 7.931363768611642e-06
INFO:echo.src.base_objective:	trainer:train_batch_size : 4
INFO:echo.src.base_objective:	trainer:weight_decay : 4.375294003379231e-06
INFO:echo.src.base_objective:	trainer:training_loss : smooth
INFO:echo.src.base_objective:Beginning trial 198
INFO:root:Loading model unet with settings {'in_channels': 4, 'classes': 1, 'activation': 'sigmoid'}
INFO:root:Loading loss smooth
INFO:root:Loading loss smooth
INFO:echo.src.base_objective:Saving trial 197 results to local file /glade/work/kdagon/s2sml/results_week3_SH_530/trial_results/trial_results_31842.gusched01.csv
INFO:echo.src.base_objective:Merging trial results and saving to /glade/work/kdagon/s2sml/results_week3_SH_530/trial_results.csv
[32m[I 2023-05-31 13:45:33,702][0m Trial 197 finished with values: [1.098881002058121, 2.0125641800959104, 1.5138845289019822] and parameters: {'learning_rate': 1.384824705572855e-05, 'norm': 'minmax', 'weight_decay': 1.0258678736157487e-12, 'train_batch_size': 14, 'training_loss': 'smooth', 'model_name': 'deeplabv3'}. [0m
INFO:echo.src.base_objective:Attempting to automatically update the model configuration using optuna's suggested parameters
INFO:echo.src.base_objective:	data:norm : zscore
INFO:echo.src.base_objective:	model:name : unet
INFO:echo.src.base_objective:	optimizer:learning_rate : 1.0497238722934015e-06
INFO:echo.src.base_objective:	trainer:train_batch_size : 98
INFO:echo.src.base_objective:	trainer:weight_decay : 1.7747707549760112e-09
INFO:echo.src.base_objective:	trainer:training_loss : mse
INFO:echo.src.base_objective:Beginning trial 199
INFO:root:Loading model unet with settings {'in_channels': 4, 'classes': 1, 'activation': 'sigmoid'}
INFO:root:Loading loss smooth
INFO:root:Loading loss smooth
INFO:echo.src.base_objective:Saving trial 199 results to local file /glade/work/kdagon/s2sml/results_week3_SH_530/trial_results/trial_results_31842.gusched01.csv
INFO:echo.src.base_objective:Merging trial results and saving to /glade/work/kdagon/s2sml/results_week3_SH_530/trial_results.csv
[32m[I 2023-05-31 13:48:34,900][0m Trial 199 finished with values: [4.706292170685545, 7.465791333726977, 3.296495221839883] and parameters: {'learning_rate': 1.0497238722934015e-06, 'norm': 'zscore', 'weight_decay': 1.7747707549760112e-09, 'train_batch_size': 98, 'training_loss': 'mse', 'model_name': 'unet'}. [0m
INFO:echo.src.base_objective:Attempting to automatically update the model configuration using optuna's suggested parameters
INFO:echo.src.base_objective:	data:norm : negone
INFO:echo.src.base_objective:	model:name : unet
INFO:echo.src.base_objective:	optimizer:learning_rate : 4.478467610483252e-05
INFO:echo.src.base_objective:	trainer:train_batch_size : 4
INFO:echo.src.base_objective:	trainer:weight_decay : 1.65324487953333e-05
INFO:echo.src.base_objective:	trainer:training_loss : logcosh
INFO:echo.src.base_objective:Beginning trial 200
INFO:root:Loading model unet with settings {'in_channels': 4, 'classes': 1, 'activation': 'sigmoid'}
INFO:root:Loading loss smooth
INFO:root:Loading loss smooth
INFO:echo.src.base_objective:Saving trial 200 results to local file /glade/work/kdagon/s2sml/results_week3_SH_530/trial_results/trial_results_31842.gusched01.csv
INFO:echo.src.base_objective:Merging trial results and saving to /glade/work/kdagon/s2sml/results_week3_SH_530/trial_results.csv
[32m[I 2023-05-31 13:54:25,260][0m Trial 200 finished with values: [1.0001231682904423, 1.1154672081917416, 1.091284222931468] and parameters: {'learning_rate': 4.478467610483252e-05, 'norm': 'negone', 'weight_decay': 1.65324487953333e-05, 'train_batch_size': 4, 'training_loss': 'logcosh', 'model_name': 'unet'}. [0m
INFO:echo.src.base_objective:Attempting to automatically update the model configuration using optuna's suggested parameters
INFO:echo.src.base_objective:	data:norm : minmax
INFO:echo.src.base_objective:	model:name : unet
INFO:echo.src.base_objective:	optimizer:learning_rate : 0.00048427634259172486
INFO:echo.src.base_objective:	trainer:train_batch_size : 11
INFO:echo.src.base_objective:	trainer:weight_decay : 9.911066506209192e-05
INFO:echo.src.base_objective:	trainer:training_loss : logcosh
INFO:echo.src.base_objective:Beginning trial 201
INFO:root:Loading model unet with settings {'in_channels': 4, 'classes': 1, 'activation': 'sigmoid'}
INFO:root:Loading loss smooth
INFO:root:Loading loss smooth
INFO:echo.src.base_objective:Saving trial 201 results to local file /glade/work/kdagon/s2sml/results_week3_SH_530/trial_results/trial_results_31842.gusched01.csv
INFO:echo.src.base_objective:Merging trial results and saving to /glade/work/kdagon/s2sml/results_week3_SH_530/trial_results.csv
[32m[I 2023-05-31 13:58:28,271][0m Trial 201 finished with values: [0.9668052014580668, 0.45158902034246234, 0.7413344472585285] and parameters: {'learning_rate': 0.00048427634259172486, 'norm': 'minmax', 'weight_decay': 9.911066506209192e-05, 'train_batch_size': 11, 'training_loss': 'logcosh', 'model_name': 'unet'}. [0m
INFO:echo.src.base_objective:Attempting to automatically update the model configuration using optuna's suggested parameters
INFO:echo.src.base_objective:	data:norm : minmax
INFO:echo.src.base_objective:	model:name : unet
INFO:echo.src.base_objective:	optimizer:learning_rate : 4.329822130309638e-06
INFO:echo.src.base_objective:	trainer:train_batch_size : 7
INFO:echo.src.base_objective:	trainer:weight_decay : 0.0005432203403377585
INFO:echo.src.base_objective:	trainer:training_loss : logcosh
INFO:echo.src.base_objective:Beginning trial 202
INFO:root:Loading model unet with settings {'in_channels': 4, 'classes': 1, 'activation': 'sigmoid'}
INFO:root:Loading loss smooth
INFO:root:Loading loss smooth
INFO:echo.src.base_objective:Saving trial 198 results to local file /glade/work/kdagon/s2sml/results_week3_SH_530/trial_results/trial_results_31841.gusched01.csv
INFO:echo.src.base_objective:Merging trial results and saving to /glade/work/kdagon/s2sml/results_week3_SH_530/trial_results.csv
[32m[I 2023-05-31 13:58:47,350][0m Trial 198 finished with values: [0.9748871433847676, 0.5401893543982063, 0.7983352248425967] and parameters: {'learning_rate': 7.931363768611642e-06, 'norm': 'minmax', 'weight_decay': 4.375294003379231e-06, 'train_batch_size': 4, 'training_loss': 'smooth', 'model_name': 'unet'}. [0m
WARNING:root:Stopping early since the longest observed run-time in the study exceeds the time remaining on this node.
INFO:echo.src.base_objective:Saving trial 202 results to local file /glade/work/kdagon/s2sml/results_week3_SH_530/trial_results/trial_results_31842.gusched01.csv
INFO:echo.src.base_objective:Merging trial results and saving to /glade/work/kdagon/s2sml/results_week3_SH_530/trial_results.csv
[32m[I 2023-05-31 14:18:56,761][0m Trial 202 finished with values: [0.9855842408049147, 0.6665735809911977, 0.8838896310318379] and parameters: {'learning_rate': 4.329822130309638e-06, 'norm': 'minmax', 'weight_decay': 0.0005432203403377585, 'train_batch_size': 7, 'training_loss': 'logcosh', 'model_name': 'unet'}. [0m
WARNING:root:Stopping early since the longest observed run-time in the study exceeds the time remaining on this node.
