[32m[I 2023-05-31 01:57:09,586][0m Trial 80 finished with values: [1.0606582183628679, 3.961633141614353, 2.2319230322832846] and parameters: {'learning_rate': 0.00014458221650132124, 'norm': 'zscore', 'weight_decay': 2.714886376211366e-11, 'train_batch_size': 124, 'training_loss': 'mse', 'model_name': 'manet'}. [0m
INFO:echo.src.base_objective:Attempting to automatically update the model configuration using optuna's suggested parameters
INFO:echo.src.base_objective:	data:norm : minmax
INFO:echo.src.base_objective:	model:name : manet
INFO:echo.src.base_objective:	optimizer:learning_rate : 1.852129245411683e-05
INFO:echo.src.base_objective:	trainer:train_batch_size : 76
INFO:echo.src.base_objective:	trainer:weight_decay : 1.0150948162844007e-09
INFO:echo.src.base_objective:	trainer:training_loss : xsigmoid
INFO:echo.src.base_objective:Beginning trial 82
INFO:root:Loading model manet with settings {'in_channels': 4, 'classes': 1, 'activation': 'sigmoid'}
INFO:root:Loading loss smooth
INFO:root:Loading loss smooth
INFO:echo.src.base_objective:Saving trial 81 results to local file /glade/work/kdagon/s2sml/results_week3_SH_530/trial_results/trial_results_31825.gusched01.csv
INFO:echo.src.base_objective:Merging trial results and saving to /glade/work/kdagon/s2sml/results_week3_SH_530/trial_results.csv
[32m[I 2023-05-31 01:59:01,522][0m Trial 81 finished with values: [1.0751242049825702, 1.525392886606587, 1.2631414777448506] and parameters: {'learning_rate': 0.006583977767849602, 'norm': 'minmax', 'weight_decay': 2.648961371411233e-07, 'train_batch_size': 59, 'training_loss': 'xtanh', 'model_name': 'pspnet'}. [0m
INFO:echo.src.base_objective:Attempting to automatically update the model configuration using optuna's suggested parameters
INFO:echo.src.base_objective:	data:norm : minmax
INFO:echo.src.base_objective:	model:name : linknet
INFO:echo.src.base_objective:	optimizer:learning_rate : 7.956133989952879e-05
INFO:echo.src.base_objective:	trainer:train_batch_size : 82
INFO:echo.src.base_objective:	trainer:weight_decay : 1.968006717900019e-05
INFO:echo.src.base_objective:	trainer:training_loss : smooth
INFO:echo.src.base_objective:Beginning trial 83
INFO:root:Loading model linknet with settings {'in_channels': 4, 'classes': 1, 'activation': 'sigmoid'}
INFO:root:Loading loss smooth
INFO:root:Loading loss smooth
INFO:echo.src.base_objective:Saving trial 82 results to local file /glade/work/kdagon/s2sml/results_week3_SH_530/trial_results/trial_results_31826.gusched01.csv
INFO:echo.src.base_objective:Merging trial results and saving to /glade/work/kdagon/s2sml/results_week3_SH_530/trial_results.csv
[32m[I 2023-05-31 02:12:55,510][0m Trial 82 finished with values: [1.0359254557166604, 1.1757096270393002, 1.183787434182177] and parameters: {'learning_rate': 1.852129245411683e-05, 'norm': 'minmax', 'weight_decay': 1.0150948162844007e-09, 'train_batch_size': 76, 'training_loss': 'xsigmoid', 'model_name': 'manet'}. [0m
INFO:echo.src.base_objective:Attempting to automatically update the model configuration using optuna's suggested parameters
INFO:echo.src.base_objective:	data:norm : minmax
INFO:echo.src.base_objective:	model:name : fpn
INFO:echo.src.base_objective:	optimizer:learning_rate : 0.00016586604113801758
INFO:echo.src.base_objective:	trainer:train_batch_size : 15
INFO:echo.src.base_objective:	trainer:weight_decay : 4.865733864219255e-11
INFO:echo.src.base_objective:	trainer:training_loss : smooth
INFO:echo.src.base_objective:Beginning trial 84
INFO:root:Loading model fpn with settings {'in_channels': 4, 'classes': 1, 'activation': 'sigmoid'}
INFO:root:Loading loss smooth
INFO:root:Loading loss smooth
INFO:echo.src.base_objective:Saving trial 83 results to local file /glade/work/kdagon/s2sml/results_week3_SH_530/trial_results/trial_results_31825.gusched01.csv
INFO:echo.src.base_objective:Merging trial results and saving to /glade/work/kdagon/s2sml/results_week3_SH_530/trial_results.csv
[32m[I 2023-05-31 02:18:37,055][0m Trial 83 finished with values: [1.0610381870463488, 1.4407384546146909, 1.3538886144773032] and parameters: {'learning_rate': 7.956133989952879e-05, 'norm': 'minmax', 'weight_decay': 1.968006717900019e-05, 'train_batch_size': 82, 'training_loss': 'smooth', 'model_name': 'linknet'}. [0m
WARNING:root:Stopping early since the longest observed run-time in the study exceeds the time remaining on this node.
INFO:root:Saving trial details to /glade/work/kdagon/s2sml/results_week3_SH_530/
INFO:root:Running on PBS/SLURM batch id: 31827.gusched01
INFO:root:Importing custom objective from /glade/work/kdagon/s2sml/applications/train.py
INFO:echo.src.reporting:Using device 0
INFO:root:Direction of optimization: ['minimize', 'minimize', 'minimize']
INFO:root:Using metric ['valid_custom', 'valid_custom_second', 'valid_custom_third']
[32m[I 2023-05-31 02:19:32,836][0m Using an existing study with name 'vanilla' instead of creating a new one.[0m
INFO:root:Loaded study vanilla located at sqlite:////glade/work/kdagon/s2sml/results_week3_SH_530/s2s.db
INFO:echo.src.base_objective:Worker 31827.gusched01 is summoned.
INFO:echo.src.base_objective:	initializing an objective to be optimized with metric ['valid_custom', 'valid_custom_second', 'valid_custom_third']
INFO:echo.src.base_objective:	using device(s) cuda:0
INFO:echo.src.base_objective:	saving study/trial results to local file /glade/work/kdagon/s2sml/results_week3_SH_530/trial_results/trial_results_31827.gusched01.csv
INFO:root:Running optimization for 1000 trials
INFO:root:Running trials for a maximum PBS wall-time 2:00:00
WARNING:root:Attempting to run trials and stop before hitting the wall-time
WARNING:root:Some trials may not complete if the wall-time is reached. Optuna will start over.
INFO:echo.src.base_objective:Attempting to automatically update the model configuration using optuna's suggested parameters
INFO:echo.src.base_objective:	data:norm : zscore
INFO:echo.src.base_objective:	model:name : fpn
INFO:echo.src.base_objective:	optimizer:learning_rate : 0.0003946773286857703
INFO:echo.src.base_objective:	trainer:train_batch_size : 23
INFO:echo.src.base_objective:	trainer:weight_decay : 8.009559198975481e-10
INFO:echo.src.base_objective:	trainer:training_loss : xsigmoid
INFO:echo.src.base_objective:Beginning trial 85
INFO:root:Loading model fpn with settings {'in_channels': 4, 'classes': 1, 'activation': 'sigmoid'}
INFO:root:Loading loss smooth
INFO:root:Loading loss smooth
INFO:echo.src.base_objective:Saving trial 84 results to local file /glade/work/kdagon/s2sml/results_week3_SH_530/trial_results/trial_results_31826.gusched01.csv
INFO:echo.src.base_objective:Merging trial results and saving to /glade/work/kdagon/s2sml/results_week3_SH_530/trial_results.csv
[32m[I 2023-05-31 02:21:42,744][0m Trial 84 finished with values: [1.027861827830531, 1.528264843568554, 1.2891267711859749] and parameters: {'learning_rate': 0.00016586604113801758, 'norm': 'minmax', 'weight_decay': 4.865733864219255e-11, 'train_batch_size': 15, 'training_loss': 'smooth', 'model_name': 'fpn'}. [0m
INFO:echo.src.base_objective:Attempting to automatically update the model configuration using optuna's suggested parameters
INFO:echo.src.base_objective:	data:norm : zscore
INFO:echo.src.base_objective:	model:name : manet
INFO:echo.src.base_objective:	optimizer:learning_rate : 0.003969331220138575
INFO:echo.src.base_objective:	trainer:train_batch_size : 87
INFO:echo.src.base_objective:	trainer:weight_decay : 3.7985900641744e-07
INFO:echo.src.base_objective:	trainer:training_loss : smooth
INFO:echo.src.base_objective:Beginning trial 86
INFO:root:Loading model manet with settings {'in_channels': 4, 'classes': 1, 'activation': 'sigmoid'}
INFO:root:Loading loss smooth
INFO:root:Loading loss smooth
INFO:echo.src.base_objective:Saving trial 85 results to local file /glade/work/kdagon/s2sml/results_week3_SH_530/trial_results/trial_results_31827.gusched01.csv
INFO:echo.src.base_objective:Merging trial results and saving to /glade/work/kdagon/s2sml/results_week3_SH_530/trial_results.csv
[32m[I 2023-05-31 02:26:18,779][0m Trial 85 finished with values: [1.1505982260016037, 3.689958144953156, 2.0957341799507043] and parameters: {'learning_rate': 0.0003946773286857703, 'norm': 'zscore', 'weight_decay': 8.009559198975481e-10, 'train_batch_size': 23, 'training_loss': 'xsigmoid', 'model_name': 'fpn'}. [0m
INFO:echo.src.base_objective:Attempting to automatically update the model configuration using optuna's suggested parameters
INFO:echo.src.base_objective:	data:norm : zscore
INFO:echo.src.base_objective:	model:name : deeplabv3
INFO:echo.src.base_objective:	optimizer:learning_rate : 2.6543805846519704e-06
INFO:echo.src.base_objective:	trainer:train_batch_size : 37
INFO:echo.src.base_objective:	trainer:weight_decay : 3.1312708182079855e-10
INFO:echo.src.base_objective:	trainer:training_loss : mae
INFO:echo.src.base_objective:Beginning trial 87
INFO:root:Loading model deeplabv3 with settings {'in_channels': 4, 'classes': 1, 'activation': 'sigmoid'}
INFO:root:Loading loss smooth
INFO:root:Loading loss smooth
INFO:echo.src.base_objective:Saving trial 86 results to local file /glade/work/kdagon/s2sml/results_week3_SH_530/trial_results/trial_results_31826.gusched01.csv
INFO:echo.src.base_objective:Merging trial results and saving to /glade/work/kdagon/s2sml/results_week3_SH_530/trial_results.csv
[32m[I 2023-05-31 02:30:13,290][0m Trial 86 finished with values: [1.1020252373728798, 3.583485607618118, 2.037434282316383] and parameters: {'learning_rate': 0.003969331220138575, 'norm': 'zscore', 'weight_decay': 3.7985900641744e-07, 'train_batch_size': 87, 'training_loss': 'smooth', 'model_name': 'manet'}. [0m
WARNING:root:Stopping early since the longest observed run-time in the study exceeds the time remaining on this node.
INFO:root:Saving trial details to /glade/work/kdagon/s2sml/results_week3_SH_530/
INFO:root:Running on PBS/SLURM batch id: 31828.gusched01
INFO:root:Importing custom objective from /glade/work/kdagon/s2sml/applications/train.py
INFO:echo.src.reporting:Using device 0
INFO:root:Direction of optimization: ['minimize', 'minimize', 'minimize']
INFO:root:Using metric ['valid_custom', 'valid_custom_second', 'valid_custom_third']
[32m[I 2023-05-31 02:31:02,864][0m Using an existing study with name 'vanilla' instead of creating a new one.[0m
INFO:root:Loaded study vanilla located at sqlite:////glade/work/kdagon/s2sml/results_week3_SH_530/s2s.db
INFO:echo.src.base_objective:Worker 31828.gusched01 is summoned.
INFO:echo.src.base_objective:	initializing an objective to be optimized with metric ['valid_custom', 'valid_custom_second', 'valid_custom_third']
INFO:echo.src.base_objective:	using device(s) cuda:0
INFO:echo.src.base_objective:	saving study/trial results to local file /glade/work/kdagon/s2sml/results_week3_SH_530/trial_results/trial_results_31828.gusched01.csv
INFO:root:Running optimization for 1000 trials
INFO:root:Running trials for a maximum PBS wall-time 2:00:00
WARNING:root:Attempting to run trials and stop before hitting the wall-time
WARNING:root:Some trials may not complete if the wall-time is reached. Optuna will start over.
INFO:echo.src.base_objective:Attempting to automatically update the model configuration using optuna's suggested parameters
INFO:echo.src.base_objective:	data:norm : zscore
INFO:echo.src.base_objective:	model:name : unet++
INFO:echo.src.base_objective:	optimizer:learning_rate : 1.0586362473765991e-06
INFO:echo.src.base_objective:	trainer:train_batch_size : 20
INFO:echo.src.base_objective:	trainer:weight_decay : 8.137840406239931e-10
INFO:echo.src.base_objective:	trainer:training_loss : huber
INFO:echo.src.base_objective:Beginning trial 88
INFO:root:Loading model unet++ with settings {'in_channels': 4, 'classes': 1, 'activation': 'sigmoid'}
INFO:root:Loading loss smooth
INFO:root:Loading loss smooth
INFO:echo.src.base_objective:Saving trial 87 results to local file /glade/work/kdagon/s2sml/results_week3_SH_530/trial_results/trial_results_31827.gusched01.csv
INFO:echo.src.base_objective:Merging trial results and saving to /glade/work/kdagon/s2sml/results_week3_SH_530/trial_results.csv
[32m[I 2023-05-31 02:33:18,865][0m Trial 87 finished with values: [1.2287062315584885, 5.139516670876505, 2.636573544963071] and parameters: {'learning_rate': 2.6543805846519704e-06, 'norm': 'zscore', 'weight_decay': 3.1312708182079855e-10, 'train_batch_size': 37, 'training_loss': 'mae', 'model_name': 'deeplabv3'}. [0m
INFO:echo.src.base_objective:Attempting to automatically update the model configuration using optuna's suggested parameters
INFO:echo.src.base_objective:	data:norm : negone
INFO:echo.src.base_objective:	model:name : unet++
INFO:echo.src.base_objective:	optimizer:learning_rate : 0.0003508227442225313
INFO:echo.src.base_objective:	trainer:train_batch_size : 6
INFO:echo.src.base_objective:	trainer:weight_decay : 1.3609153490521479e-06
INFO:echo.src.base_objective:	trainer:training_loss : smooth
INFO:echo.src.base_objective:Beginning trial 89
INFO:root:Loading model unet++ with settings {'in_channels': 4, 'classes': 1, 'activation': 'sigmoid'}
INFO:root:Loading loss smooth
INFO:root:Loading loss smooth
INFO:echo.src.base_objective:Saving trial 89 results to local file /glade/work/kdagon/s2sml/results_week3_SH_530/trial_results/trial_results_31827.gusched01.csv
INFO:echo.src.base_objective:Merging trial results and saving to /glade/work/kdagon/s2sml/results_week3_SH_530/trial_results.csv
[32m[I 2023-05-31 02:45:59,987][0m Trial 89 finished with values: [0.992467607979988, 0.869565978072681, 0.8781121169822286] and parameters: {'learning_rate': 0.0003508227442225313, 'norm': 'negone', 'weight_decay': 1.3609153490521479e-06, 'train_batch_size': 6, 'training_loss': 'smooth', 'model_name': 'unet++'}. [0m
INFO:echo.src.base_objective:Attempting to automatically update the model configuration using optuna's suggested parameters
INFO:echo.src.base_objective:	data:norm : minmax
INFO:echo.src.base_objective:	model:name : fpn
INFO:echo.src.base_objective:	optimizer:learning_rate : 6.425013353453088e-05
INFO:echo.src.base_objective:	trainer:train_batch_size : 122
INFO:echo.src.base_objective:	trainer:weight_decay : 1.09473998979853e-08
INFO:echo.src.base_objective:	trainer:training_loss : huber
INFO:echo.src.base_objective:Beginning trial 90
INFO:root:Loading model fpn with settings {'in_channels': 4, 'classes': 1, 'activation': 'sigmoid'}
INFO:root:Loading loss smooth
INFO:root:Loading loss smooth
INFO:echo.src.base_objective:Saving trial 90 results to local file /glade/work/kdagon/s2sml/results_week3_SH_530/trial_results/trial_results_31827.gusched01.csv
INFO:echo.src.base_objective:Merging trial results and saving to /glade/work/kdagon/s2sml/results_week3_SH_530/trial_results.csv
[32m[I 2023-05-31 03:05:56,866][0m Trial 90 finished with values: [1.0511877996863952, 2.6585815188749806, 1.8591777074944025] and parameters: {'learning_rate': 6.425013353453088e-05, 'norm': 'minmax', 'weight_decay': 1.09473998979853e-08, 'train_batch_size': 122, 'training_loss': 'huber', 'model_name': 'fpn'}. [0m
INFO:echo.src.base_objective:Attempting to automatically update the model configuration using optuna's suggested parameters
INFO:echo.src.base_objective:	data:norm : zscore
INFO:echo.src.base_objective:	model:name : linknet
INFO:echo.src.base_objective:	optimizer:learning_rate : 0.0013676710199540638
INFO:echo.src.base_objective:	trainer:train_batch_size : 118
INFO:echo.src.base_objective:	trainer:weight_decay : 2.7881897975664305e-12
INFO:echo.src.base_objective:	trainer:training_loss : xtanh
INFO:echo.src.base_objective:Beginning trial 91
INFO:root:Loading model linknet with settings {'in_channels': 4, 'classes': 1, 'activation': 'sigmoid'}
INFO:root:Loading loss smooth
INFO:root:Loading loss smooth
INFO:echo.src.base_objective:Saving trial 88 results to local file /glade/work/kdagon/s2sml/results_week3_SH_530/trial_results/trial_results_31828.gusched01.csv
INFO:echo.src.base_objective:Merging trial results and saving to /glade/work/kdagon/s2sml/results_week3_SH_530/trial_results.csv
[32m[I 2023-05-31 03:06:59,431][0m Trial 88 finished with values: [1.0593434756530726, 4.894882295770275, 2.5751581640745873] and parameters: {'learning_rate': 1.0586362473765991e-06, 'norm': 'zscore', 'weight_decay': 8.137840406239931e-10, 'train_batch_size': 20, 'training_loss': 'huber', 'model_name': 'unet++'}. [0m
INFO:echo.src.base_objective:Attempting to automatically update the model configuration using optuna's suggested parameters
INFO:echo.src.base_objective:	data:norm : minmax
INFO:echo.src.base_objective:	model:name : deeplabv3+
INFO:echo.src.base_objective:	optimizer:learning_rate : 0.0009317098777839183
INFO:echo.src.base_objective:	trainer:train_batch_size : 100
INFO:echo.src.base_objective:	trainer:weight_decay : 8.439996815851246e-07
INFO:echo.src.base_objective:	trainer:training_loss : mse
INFO:echo.src.base_objective:Beginning trial 92
INFO:root:Loading model deeplabv3+ with settings {'in_channels': 4, 'classes': 1, 'activation': 'sigmoid'}
INFO:root:Loading loss smooth
INFO:root:Loading loss smooth
INFO:echo.src.base_objective:Saving trial 91 results to local file /glade/work/kdagon/s2sml/results_week3_SH_530/trial_results/trial_results_31827.gusched01.csv
INFO:echo.src.base_objective:Merging trial results and saving to /glade/work/kdagon/s2sml/results_week3_SH_530/trial_results.csv
[32m[I 2023-05-31 03:10:08,830][0m Trial 91 finished with values: [1.0809495376537852, 4.232301183609549, 2.337707759813898] and parameters: {'learning_rate': 0.0013676710199540638, 'norm': 'zscore', 'weight_decay': 2.7881897975664305e-12, 'train_batch_size': 118, 'training_loss': 'xtanh', 'model_name': 'linknet'}. [0m
INFO:echo.src.base_objective:Attempting to automatically update the model configuration using optuna's suggested parameters
INFO:echo.src.base_objective:	data:norm : zscore
INFO:echo.src.base_objective:	model:name : deeplabv3
INFO:echo.src.base_objective:	optimizer:learning_rate : 0.0016696220841575834
INFO:echo.src.base_objective:	trainer:train_batch_size : 55
INFO:echo.src.base_objective:	trainer:weight_decay : 9.617924557537815e-12
INFO:echo.src.base_objective:	trainer:training_loss : logcosh
INFO:echo.src.base_objective:Beginning trial 93
INFO:root:Loading model deeplabv3 with settings {'in_channels': 4, 'classes': 1, 'activation': 'sigmoid'}
INFO:root:Loading loss smooth
INFO:root:Loading loss smooth
INFO:echo.src.base_objective:Saving trial 92 results to local file /glade/work/kdagon/s2sml/results_week3_SH_530/trial_results/trial_results_31828.gusched01.csv
INFO:echo.src.base_objective:Merging trial results and saving to /glade/work/kdagon/s2sml/results_week3_SH_530/trial_results.csv
[32m[I 2023-05-31 03:14:17,039][0m Trial 92 finished with values: [1.0172078920849001, 0.9758008403340231, 0.9442760705633421] and parameters: {'learning_rate': 0.0009317098777839183, 'norm': 'minmax', 'weight_decay': 8.439996815851246e-07, 'train_batch_size': 100, 'training_loss': 'mse', 'model_name': 'deeplabv3+'}. [0m
INFO:echo.src.base_objective:Attempting to automatically update the model configuration using optuna's suggested parameters
INFO:echo.src.base_objective:	data:norm : minmax
INFO:echo.src.base_objective:	model:name : unet
INFO:echo.src.base_objective:	optimizer:learning_rate : 1.606113688000892e-06
INFO:echo.src.base_objective:	trainer:train_batch_size : 4
INFO:echo.src.base_objective:	trainer:weight_decay : 1.2976238273274063e-09
INFO:echo.src.base_objective:	trainer:training_loss : xtanh
INFO:echo.src.base_objective:Beginning trial 94
INFO:root:Loading model unet with settings {'in_channels': 4, 'classes': 1, 'activation': 'sigmoid'}
INFO:root:Loading loss smooth
INFO:root:Loading loss smooth
INFO:echo.src.base_objective:Saving trial 93 results to local file /glade/work/kdagon/s2sml/results_week3_SH_530/trial_results/trial_results_31827.gusched01.csv
INFO:echo.src.base_objective:Merging trial results and saving to /glade/work/kdagon/s2sml/results_week3_SH_530/trial_results.csv
[32m[I 2023-05-31 03:17:44,972][0m Trial 93 finished with values: [1.1962558881605625, 3.824883305027977, 2.190630276032795] and parameters: {'learning_rate': 0.0016696220841575834, 'norm': 'zscore', 'weight_decay': 9.617924557537815e-12, 'train_batch_size': 55, 'training_loss': 'logcosh', 'model_name': 'deeplabv3'}. [0m
INFO:echo.src.base_objective:Attempting to automatically update the model configuration using optuna's suggested parameters
INFO:echo.src.base_objective:	data:norm : negone
INFO:echo.src.base_objective:	model:name : unet
INFO:echo.src.base_objective:	optimizer:learning_rate : 0.0016407106434980878
INFO:echo.src.base_objective:	trainer:train_batch_size : 5
INFO:echo.src.base_objective:	trainer:weight_decay : 3.9165563580021015e-08
INFO:echo.src.base_objective:	trainer:training_loss : mae
INFO:echo.src.base_objective:Beginning trial 95
INFO:root:Loading model unet with settings {'in_channels': 4, 'classes': 1, 'activation': 'sigmoid'}
INFO:root:Loading loss smooth
INFO:root:Loading loss smooth
INFO:echo.src.base_objective:Saving trial 95 results to local file /glade/work/kdagon/s2sml/results_week3_SH_530/trial_results/trial_results_31827.gusched01.csv
INFO:echo.src.base_objective:Merging trial results and saving to /glade/work/kdagon/s2sml/results_week3_SH_530/trial_results.csv
