[32m[I 2023-05-31 09:16:58,096][0m Trial 149 finished with values: [0.9575525297163185, 0.3534859399434858, 0.6438084857230042] and parameters: {'learning_rate': 0.0033897985687028442, 'norm': 'minmax', 'weight_decay': 3.85500351297123e-12, 'train_batch_size': 11, 'training_loss': 'logcosh', 'model_name': 'linknet'}. [0m
INFO:echo.src.base_objective:Attempting to automatically update the model configuration using optuna's suggested parameters
INFO:echo.src.base_objective:	data:norm : minmax
INFO:echo.src.base_objective:	model:name : unet
INFO:echo.src.base_objective:	optimizer:learning_rate : 0.0004770225249677838
INFO:echo.src.base_objective:	trainer:train_batch_size : 10
INFO:echo.src.base_objective:	trainer:weight_decay : 1.5123172122770682e-09
INFO:echo.src.base_objective:	trainer:training_loss : logcosh
INFO:echo.src.base_objective:Beginning trial 151
INFO:root:Loading model unet with settings {'in_channels': 4, 'classes': 1, 'activation': 'sigmoid'}
INFO:root:Loading loss smooth
INFO:root:Loading loss smooth
INFO:echo.src.base_objective:Saving trial 150 results to local file /glade/work/kdagon/s2sml/results_week3_SH_530/trial_results/trial_results_31836.gusched01.csv
INFO:echo.src.base_objective:Merging trial results and saving to /glade/work/kdagon/s2sml/results_week3_SH_530/trial_results.csv
[32m[I 2023-05-31 09:25:14,471][0m Trial 150 finished with values: [0.9609899260958499, 0.3969814569600933, 0.6855166657325817] and parameters: {'learning_rate': 0.0034525313330260607, 'norm': 'minmax', 'weight_decay': 2.7118807483266776e-06, 'train_batch_size': 10, 'training_loss': 'logcosh', 'model_name': 'unet'}. [0m
INFO:echo.src.base_objective:Attempting to automatically update the model configuration using optuna's suggested parameters
INFO:echo.src.base_objective:	data:norm : minmax
INFO:echo.src.base_objective:	model:name : unet
INFO:echo.src.base_objective:	optimizer:learning_rate : 0.004525851821940642
INFO:echo.src.base_objective:	trainer:train_batch_size : 9
INFO:echo.src.base_objective:	trainer:weight_decay : 1.684018781844657e-09
INFO:echo.src.base_objective:	trainer:training_loss : logcosh
INFO:echo.src.base_objective:Beginning trial 152
INFO:root:Loading model unet with settings {'in_channels': 4, 'classes': 1, 'activation': 'sigmoid'}
INFO:root:Loading loss smooth
INFO:root:Loading loss smooth
INFO:echo.src.base_objective:Saving trial 151 results to local file /glade/work/kdagon/s2sml/results_week3_SH_530/trial_results/trial_results_31835.gusched01.csv
INFO:echo.src.base_objective:Merging trial results and saving to /glade/work/kdagon/s2sml/results_week3_SH_530/trial_results.csv
[32m[I 2023-05-31 09:25:23,396][0m Trial 151 finished with values: [0.9607809495748797, 0.3850637254400386, 0.6701429343425845] and parameters: {'learning_rate': 0.0004770225249677838, 'norm': 'minmax', 'weight_decay': 1.5123172122770682e-09, 'train_batch_size': 10, 'training_loss': 'logcosh', 'model_name': 'unet'}. [0m
INFO:echo.src.base_objective:Attempting to automatically update the model configuration using optuna's suggested parameters
INFO:echo.src.base_objective:	data:norm : minmax
INFO:echo.src.base_objective:	model:name : unet
INFO:echo.src.base_objective:	optimizer:learning_rate : 0.0018158368280116238
INFO:echo.src.base_objective:	trainer:train_batch_size : 7
INFO:echo.src.base_objective:	trainer:weight_decay : 1.184181725368026e-12
INFO:echo.src.base_objective:	trainer:training_loss : logcosh
INFO:echo.src.base_objective:Beginning trial 153
INFO:root:Loading model unet with settings {'in_channels': 4, 'classes': 1, 'activation': 'sigmoid'}
INFO:root:Loading loss smooth
INFO:root:Loading loss smooth
INFO:echo.src.base_objective:Saving trial 153 results to local file /glade/work/kdagon/s2sml/results_week3_SH_530/trial_results/trial_results_31835.gusched01.csv
INFO:echo.src.base_objective:Merging trial results and saving to /glade/work/kdagon/s2sml/results_week3_SH_530/trial_results.csv
[32m[I 2023-05-31 09:30:00,461][0m Trial 153 finished with values: [0.966480181693817, 0.49834337113282673, 0.7745365217556734] and parameters: {'learning_rate': 0.0018158368280116238, 'norm': 'minmax', 'weight_decay': 1.184181725368026e-12, 'train_batch_size': 7, 'training_loss': 'logcosh', 'model_name': 'unet'}. [0m
INFO:echo.src.base_objective:Attempting to automatically update the model configuration using optuna's suggested parameters
INFO:echo.src.base_objective:	data:norm : minmax
INFO:echo.src.base_objective:	model:name : unet
INFO:echo.src.base_objective:	optimizer:learning_rate : 0.004502535639597442
INFO:echo.src.base_objective:	trainer:train_batch_size : 7
INFO:echo.src.base_objective:	trainer:weight_decay : 1.6088313557649467e-09
INFO:echo.src.base_objective:	trainer:training_loss : logcosh
INFO:echo.src.base_objective:Beginning trial 154
INFO:root:Loading model unet with settings {'in_channels': 4, 'classes': 1, 'activation': 'sigmoid'}
INFO:root:Loading loss smooth
INFO:root:Loading loss smooth
INFO:echo.src.base_objective:Saving trial 152 results to local file /glade/work/kdagon/s2sml/results_week3_SH_530/trial_results/trial_results_31836.gusched01.csv
INFO:echo.src.base_objective:Merging trial results and saving to /glade/work/kdagon/s2sml/results_week3_SH_530/trial_results.csv
[32m[I 2023-05-31 09:36:18,050][0m Trial 152 finished with values: [0.9588428819876258, 0.35960484934261683, 0.6421173938711471] and parameters: {'learning_rate': 0.004525851821940642, 'norm': 'minmax', 'weight_decay': 1.684018781844657e-09, 'train_batch_size': 9, 'training_loss': 'logcosh', 'model_name': 'unet'}. [0m
INFO:echo.src.base_objective:Attempting to automatically update the model configuration using optuna's suggested parameters
INFO:echo.src.base_objective:	data:norm : minmax
INFO:echo.src.base_objective:	model:name : linknet
INFO:echo.src.base_objective:	optimizer:learning_rate : 0.004385488753870315
INFO:echo.src.base_objective:	trainer:train_batch_size : 17
INFO:echo.src.base_objective:	trainer:weight_decay : 3.9994451503147256e-12
INFO:echo.src.base_objective:	trainer:training_loss : logcosh
INFO:echo.src.base_objective:Beginning trial 155
INFO:root:Loading model linknet with settings {'in_channels': 4, 'classes': 1, 'activation': 'sigmoid'}
INFO:root:Loading loss smooth
INFO:root:Loading loss smooth
INFO:echo.src.base_objective:Saving trial 155 results to local file /glade/work/kdagon/s2sml/results_week3_SH_530/trial_results/trial_results_31836.gusched01.csv
INFO:echo.src.base_objective:Merging trial results and saving to /glade/work/kdagon/s2sml/results_week3_SH_530/trial_results.csv
[32m[I 2023-05-31 09:42:12,510][0m Trial 155 finished with values: [0.9612907946255608, 0.39173192032871146, 0.6762122579176396] and parameters: {'learning_rate': 0.004385488753870315, 'norm': 'minmax', 'weight_decay': 3.9994451503147256e-12, 'train_batch_size': 17, 'training_loss': 'logcosh', 'model_name': 'linknet'}. [0m
WARNING:root:Stopping early since the longest observed run-time in the study exceeds the time remaining on this node.
INFO:root:Saving trial details to /glade/work/kdagon/s2sml/results_week3_SH_530/
INFO:root:Running on PBS/SLURM batch id: 31837.gusched01
INFO:root:Importing custom objective from /glade/work/kdagon/s2sml/applications/train.py
INFO:echo.src.reporting:Using device 0
INFO:root:Direction of optimization: ['minimize', 'minimize', 'minimize']
INFO:root:Using metric ['valid_custom', 'valid_custom_second', 'valid_custom_third']
[32m[I 2023-05-31 09:42:34,140][0m Using an existing study with name 'vanilla' instead of creating a new one.[0m
INFO:root:Loaded study vanilla located at sqlite:////glade/work/kdagon/s2sml/results_week3_SH_530/s2s.db
INFO:echo.src.base_objective:Worker 31837.gusched01 is summoned.
INFO:echo.src.base_objective:	initializing an objective to be optimized with metric ['valid_custom', 'valid_custom_second', 'valid_custom_third']
INFO:echo.src.base_objective:	using device(s) cuda:0
INFO:echo.src.base_objective:	saving study/trial results to local file /glade/work/kdagon/s2sml/results_week3_SH_530/trial_results/trial_results_31837.gusched01.csv
INFO:root:Running optimization for 1000 trials
INFO:root:Running trials for a maximum PBS wall-time 2:00:00
WARNING:root:Attempting to run trials and stop before hitting the wall-time
WARNING:root:Some trials may not complete if the wall-time is reached. Optuna will start over.
INFO:echo.src.base_objective:Attempting to automatically update the model configuration using optuna's suggested parameters
INFO:echo.src.base_objective:	data:norm : minmax
INFO:echo.src.base_objective:	model:name : unet
INFO:echo.src.base_objective:	optimizer:learning_rate : 0.0012173347302145917
INFO:echo.src.base_objective:	trainer:train_batch_size : 12
INFO:echo.src.base_objective:	trainer:weight_decay : 6.131520133028907e-07
INFO:echo.src.base_objective:	trainer:training_loss : logcosh
INFO:echo.src.base_objective:Beginning trial 156
INFO:root:Loading model unet with settings {'in_channels': 4, 'classes': 1, 'activation': 'sigmoid'}
INFO:root:Loading loss smooth
INFO:root:Loading loss smooth
INFO:echo.src.base_objective:Saving trial 154 results to local file /glade/work/kdagon/s2sml/results_week3_SH_530/trial_results/trial_results_31835.gusched01.csv
INFO:echo.src.base_objective:Merging trial results and saving to /glade/work/kdagon/s2sml/results_week3_SH_530/trial_results.csv
[32m[I 2023-05-31 09:48:00,694][0m Trial 154 finished with values: [0.9572346548381344, 0.34696347915740566, 0.6372800339766945] and parameters: {'learning_rate': 0.004502535639597442, 'norm': 'minmax', 'weight_decay': 1.6088313557649467e-09, 'train_batch_size': 7, 'training_loss': 'logcosh', 'model_name': 'unet'}. [0m
WARNING:root:Stopping early since the longest observed run-time in the study exceeds the time remaining on this node.
INFO:root:Saving trial details to /glade/work/kdagon/s2sml/results_week3_SH_530/
INFO:root:Running on PBS/SLURM batch id: 31838.gusched01
INFO:root:Importing custom objective from /glade/work/kdagon/s2sml/applications/train.py
INFO:echo.src.reporting:Using device 0
INFO:root:Direction of optimization: ['minimize', 'minimize', 'minimize']
INFO:root:Using metric ['valid_custom', 'valid_custom_second', 'valid_custom_third']
[32m[I 2023-05-31 09:48:23,016][0m Using an existing study with name 'vanilla' instead of creating a new one.[0m
INFO:root:Loaded study vanilla located at sqlite:////glade/work/kdagon/s2sml/results_week3_SH_530/s2s.db
INFO:echo.src.base_objective:Worker 31838.gusched01 is summoned.
INFO:echo.src.base_objective:	initializing an objective to be optimized with metric ['valid_custom', 'valid_custom_second', 'valid_custom_third']
INFO:echo.src.base_objective:	using device(s) cuda:0
INFO:echo.src.base_objective:	saving study/trial results to local file /glade/work/kdagon/s2sml/results_week3_SH_530/trial_results/trial_results_31838.gusched01.csv
INFO:root:Running optimization for 1000 trials
INFO:root:Running trials for a maximum PBS wall-time 2:00:00
WARNING:root:Attempting to run trials and stop before hitting the wall-time
WARNING:root:Some trials may not complete if the wall-time is reached. Optuna will start over.
INFO:echo.src.base_objective:Attempting to automatically update the model configuration using optuna's suggested parameters
INFO:echo.src.base_objective:	data:norm : minmax
INFO:echo.src.base_objective:	model:name : unet
INFO:echo.src.base_objective:	optimizer:learning_rate : 0.0007678345060351943
INFO:echo.src.base_objective:	trainer:train_batch_size : 11
INFO:echo.src.base_objective:	trainer:weight_decay : 1.0541871375440072e-10
INFO:echo.src.base_objective:	trainer:training_loss : logcosh
INFO:echo.src.base_objective:Beginning trial 157
INFO:root:Loading model unet with settings {'in_channels': 4, 'classes': 1, 'activation': 'sigmoid'}
INFO:root:Loading loss smooth
INFO:root:Loading loss smooth
INFO:echo.src.base_objective:Saving trial 156 results to local file /glade/work/kdagon/s2sml/results_week3_SH_530/trial_results/trial_results_31837.gusched01.csv
INFO:echo.src.base_objective:Merging trial results and saving to /glade/work/kdagon/s2sml/results_week3_SH_530/trial_results.csv
[32m[I 2023-05-31 09:53:21,244][0m Trial 156 finished with values: [0.9578793801782669, 0.3519853123941654, 0.6409863899952645] and parameters: {'learning_rate': 0.0012173347302145917, 'norm': 'minmax', 'weight_decay': 6.131520133028907e-07, 'train_batch_size': 12, 'training_loss': 'logcosh', 'model_name': 'unet'}. [0m
INFO:echo.src.base_objective:Attempting to automatically update the model configuration using optuna's suggested parameters
INFO:echo.src.base_objective:	data:norm : minmax
INFO:echo.src.base_objective:	model:name : unet
INFO:echo.src.base_objective:	optimizer:learning_rate : 0.0006253015001732662
INFO:echo.src.base_objective:	trainer:train_batch_size : 12
INFO:echo.src.base_objective:	trainer:weight_decay : 3.738394479460187e-06
INFO:echo.src.base_objective:	trainer:training_loss : logcosh
INFO:echo.src.base_objective:Beginning trial 158
INFO:root:Loading model unet with settings {'in_channels': 4, 'classes': 1, 'activation': 'sigmoid'}
INFO:root:Loading loss smooth
INFO:root:Loading loss smooth
INFO:echo.src.base_objective:Saving trial 157 results to local file /glade/work/kdagon/s2sml/results_week3_SH_530/trial_results/trial_results_31838.gusched01.csv
INFO:echo.src.base_objective:Merging trial results and saving to /glade/work/kdagon/s2sml/results_week3_SH_530/trial_results.csv
[32m[I 2023-05-31 09:54:50,720][0m Trial 157 finished with values: [0.9618072746594845, 0.39629071128053117, 0.6860340620475731] and parameters: {'learning_rate': 0.0007678345060351943, 'norm': 'minmax', 'weight_decay': 1.0541871375440072e-10, 'train_batch_size': 11, 'training_loss': 'logcosh', 'model_name': 'unet'}. [0m
INFO:echo.src.base_objective:Attempting to automatically update the model configuration using optuna's suggested parameters
INFO:echo.src.base_objective:	data:norm : minmax
INFO:echo.src.base_objective:	model:name : unet
INFO:echo.src.base_objective:	optimizer:learning_rate : 0.0011791591345042677
INFO:echo.src.base_objective:	trainer:train_batch_size : 15
INFO:echo.src.base_objective:	trainer:weight_decay : 6.037678050892907e-07
INFO:echo.src.base_objective:	trainer:training_loss : logcosh
INFO:echo.src.base_objective:Beginning trial 159
INFO:root:Loading model unet with settings {'in_channels': 4, 'classes': 1, 'activation': 'sigmoid'}
INFO:root:Loading loss smooth
INFO:root:Loading loss smooth
INFO:echo.src.base_objective:Saving trial 158 results to local file /glade/work/kdagon/s2sml/results_week3_SH_530/trial_results/trial_results_31837.gusched01.csv
INFO:echo.src.base_objective:Merging trial results and saving to /glade/work/kdagon/s2sml/results_week3_SH_530/trial_results.csv
[32m[I 2023-05-31 10:03:35,576][0m Trial 158 finished with values: [0.9591865243930335, 0.3658807636219945, 0.6575724707958339] and parameters: {'learning_rate': 0.0006253015001732662, 'norm': 'minmax', 'weight_decay': 3.738394479460187e-06, 'train_batch_size': 12, 'training_loss': 'logcosh', 'model_name': 'unet'}. [0m
INFO:echo.src.base_objective:Attempting to automatically update the model configuration using optuna's suggested parameters
INFO:echo.src.base_objective:	data:norm : minmax
INFO:echo.src.base_objective:	model:name : unet
INFO:echo.src.base_objective:	optimizer:learning_rate : 0.0033486835404030347
INFO:echo.src.base_objective:	trainer:train_batch_size : 15
INFO:echo.src.base_objective:	trainer:weight_decay : 1.2590668058547814e-08
INFO:echo.src.base_objective:	trainer:training_loss : huber
INFO:echo.src.base_objective:Beginning trial 160
INFO:root:Loading model unet with settings {'in_channels': 4, 'classes': 1, 'activation': 'sigmoid'}
INFO:root:Loading loss smooth
INFO:root:Loading loss smooth
INFO:echo.src.base_objective:Saving trial 159 results to local file /glade/work/kdagon/s2sml/results_week3_SH_530/trial_results/trial_results_31838.gusched01.csv
INFO:echo.src.base_objective:Merging trial results and saving to /glade/work/kdagon/s2sml/results_week3_SH_530/trial_results.csv
[32m[I 2023-05-31 10:08:31,978][0m Trial 159 finished with values: [0.9594819856861674, 0.37757488319410976, 0.6651643728758327] and parameters: {'learning_rate': 0.0011791591345042677, 'norm': 'minmax', 'weight_decay': 6.037678050892907e-07, 'train_batch_size': 15, 'training_loss': 'logcosh', 'model_name': 'unet'}. [0m
INFO:echo.src.base_objective:Attempting to automatically update the model configuration using optuna's suggested parameters
INFO:echo.src.base_objective:	data:norm : minmax
INFO:echo.src.base_objective:	model:name : unet
INFO:echo.src.base_objective:	optimizer:learning_rate : 4.035990431348589e-05
INFO:echo.src.base_objective:	trainer:train_batch_size : 6
INFO:echo.src.base_objective:	trainer:weight_decay : 4.063731536373118e-10
INFO:echo.src.base_objective:	trainer:training_loss : logcosh
INFO:echo.src.base_objective:Beginning trial 161
INFO:root:Loading model unet with settings {'in_channels': 4, 'classes': 1, 'activation': 'sigmoid'}
INFO:root:Loading loss smooth
INFO:root:Loading loss smooth
INFO:echo.src.base_objective:Saving trial 160 results to local file /glade/work/kdagon/s2sml/results_week3_SH_530/trial_results/trial_results_31837.gusched01.csv
INFO:echo.src.base_objective:Merging trial results and saving to /glade/work/kdagon/s2sml/results_week3_SH_530/trial_results.csv
[32m[I 2023-05-31 10:15:03,153][0m Trial 160 finished with values: [0.9604104698841874, 0.3936545634094442, 0.6824478869109848] and parameters: {'learning_rate': 0.0033486835404030347, 'norm': 'minmax', 'weight_decay': 1.2590668058547814e-08, 'train_batch_size': 15, 'training_loss': 'huber', 'model_name': 'unet'}. [0m
INFO:echo.src.base_objective:Attempting to automatically update the model configuration using optuna's suggested parameters
INFO:echo.src.base_objective:	data:norm : minmax
INFO:echo.src.base_objective:	model:name : unet
INFO:echo.src.base_objective:	optimizer:learning_rate : 3.69436786424634e-05
INFO:echo.src.base_objective:	trainer:train_batch_size : 70
INFO:echo.src.base_objective:	trainer:weight_decay : 4.2199646691880505e-11
INFO:echo.src.base_objective:	trainer:training_loss : logcosh
INFO:echo.src.base_objective:Beginning trial 162
INFO:root:Loading model unet with settings {'in_channels': 4, 'classes': 1, 'activation': 'sigmoid'}
INFO:root:Loading loss smooth
INFO:root:Loading loss smooth
INFO:echo.src.base_objective:Saving trial 161 results to local file /glade/work/kdagon/s2sml/results_week3_SH_530/trial_results/trial_results_31838.gusched01.csv
INFO:echo.src.base_objective:Merging trial results and saving to /glade/work/kdagon/s2sml/results_week3_SH_530/trial_results.csv
[32m[I 2023-05-31 10:18:07,523][0m Trial 161 finished with values: [0.9718977294924233, 0.5047611456235984, 0.7707915118633971] and parameters: {'learning_rate': 4.035990431348589e-05, 'norm': 'minmax', 'weight_decay': 4.063731536373118e-10, 'train_batch_size': 6, 'training_loss': 'logcosh', 'model_name': 'unet'}. [0m
INFO:echo.src.base_objective:Attempting to automatically update the model configuration using optuna's suggested parameters
INFO:echo.src.base_objective:	data:norm : minmax
INFO:echo.src.base_objective:	model:name : linknet
INFO:echo.src.base_objective:	optimizer:learning_rate : 0.0001923040522312849
INFO:echo.src.base_objective:	trainer:train_batch_size : 109
INFO:echo.src.base_objective:	trainer:weight_decay : 5.309189071239094e-07
INFO:echo.src.base_objective:	trainer:training_loss : logcosh
INFO:echo.src.base_objective:Beginning trial 163
INFO:root:Loading model linknet with settings {'in_channels': 4, 'classes': 1, 'activation': 'sigmoid'}
INFO:root:Loading loss smooth
INFO:root:Loading loss smooth
INFO:echo.src.base_objective:Saving trial 162 results to local file /glade/work/kdagon/s2sml/results_week3_SH_530/trial_results/trial_results_31837.gusched01.csv
INFO:echo.src.base_objective:Merging trial results and saving to /glade/work/kdagon/s2sml/results_week3_SH_530/trial_results.csv
[32m[I 2023-05-31 10:39:43,817][0m Trial 162 finished with values: [0.997519641196588, 0.8369746577196061, 1.024478427524123] and parameters: {'learning_rate': 3.69436786424634e-05, 'norm': 'minmax', 'weight_decay': 4.2199646691880505e-11, 'train_batch_size': 70, 'training_loss': 'logcosh', 'model_name': 'unet'}. [0m
INFO:echo.src.base_objective:Attempting to automatically update the model configuration using optuna's suggested parameters
INFO:echo.src.base_objective:	data:norm : minmax
INFO:echo.src.base_objective:	model:name : linknet
INFO:echo.src.base_objective:	optimizer:learning_rate : 5.08680558840684e-05
INFO:echo.src.base_objective:	trainer:train_batch_size : 110
INFO:echo.src.base_objective:	trainer:weight_decay : 2.7260853565230342e-06
INFO:echo.src.base_objective:	trainer:training_loss : logcosh
INFO:echo.src.base_objective:Beginning trial 164
INFO:root:Loading model linknet with settings {'in_channels': 4, 'classes': 1, 'activation': 'sigmoid'}
INFO:root:Loading loss smooth
INFO:root:Loading loss smooth
INFO:echo.src.base_objective:Saving trial 163 results to local file /glade/work/kdagon/s2sml/results_week3_SH_530/trial_results/trial_results_31838.gusched01.csv
INFO:echo.src.base_objective:Merging trial results and saving to /glade/work/kdagon/s2sml/results_week3_SH_530/trial_results.csv
