INFO:root:Saving trial details to /glade/work/kdagon/s2sml/results_week3_SH_530/
INFO:root:Saving trial details to /glade/work/kdagon/s2sml/results_week3_SH_530/
INFO:root:Running on PBS/SLURM batch id: 31814.gusched01
INFO:root:Running on PBS/SLURM batch id: 31813.gusched01
INFO:root:Importing custom objective from /glade/work/kdagon/s2sml/applications/train.py
INFO:root:Importing custom objective from /glade/work/kdagon/s2sml/applications/train.py
INFO:echo.src.reporting:Using device 0
INFO:root:Direction of optimization: ['minimize', 'minimize', 'minimize']
INFO:root:Using metric ['valid_custom', 'valid_custom_second', 'valid_custom_third']
INFO:echo.src.reporting:Using device 0
INFO:root:Direction of optimization: ['minimize', 'minimize', 'minimize']
INFO:root:Using metric ['valid_custom', 'valid_custom_second', 'valid_custom_third']
[32m[I 2023-05-30 15:46:46,698][0m Using an existing study with name 'vanilla' instead of creating a new one.[0m
INFO:root:Loaded study vanilla located at sqlite:////glade/work/kdagon/s2sml/results_week3_SH_530/s2s.db
INFO:echo.src.base_objective:Worker 31813.gusched01 is summoned.
INFO:echo.src.base_objective:	initializing an objective to be optimized with metric ['valid_custom', 'valid_custom_second', 'valid_custom_third']
INFO:echo.src.base_objective:	using device(s) cuda:0
INFO:echo.src.base_objective:	saving study/trial results to local file /glade/work/kdagon/s2sml/results_week3_SH_530/trial_results/trial_results_31813.gusched01.csv
INFO:root:Running optimization for 1000 trials
INFO:root:Running trials for a maximum PBS wall-time 2:00:00
WARNING:root:Attempting to run trials and stop before hitting the wall-time
WARNING:root:Some trials may not complete if the wall-time is reached. Optuna will start over.
INFO:echo.src.base_objective:Attempting to automatically update the model configuration using optuna's suggested parameters
[32m[I 2023-05-30 15:46:46,781][0m Using an existing study with name 'vanilla' instead of creating a new one.[0m
INFO:root:Loaded study vanilla located at sqlite:////glade/work/kdagon/s2sml/results_week3_SH_530/s2s.db
INFO:echo.src.base_objective:Worker 31814.gusched01 is summoned.
INFO:echo.src.base_objective:	initializing an objective to be optimized with metric ['valid_custom', 'valid_custom_second', 'valid_custom_third']
INFO:echo.src.base_objective:	using device(s) cuda:0
INFO:echo.src.base_objective:	saving study/trial results to local file /glade/work/kdagon/s2sml/results_week3_SH_530/trial_results/trial_results_31814.gusched01.csv
INFO:root:Running optimization for 1000 trials
INFO:root:Running trials for a maximum PBS wall-time 2:00:00
WARNING:root:Attempting to run trials and stop before hitting the wall-time
WARNING:root:Some trials may not complete if the wall-time is reached. Optuna will start over.
INFO:echo.src.base_objective:	data:norm : zscore
INFO:echo.src.base_objective:	model:name : deeplabv3+
INFO:echo.src.base_objective:	optimizer:learning_rate : 1.2871644037468007e-05
INFO:echo.src.base_objective:	trainer:train_batch_size : 49
INFO:echo.src.base_objective:	trainer:weight_decay : 2.3534289524959783e-10
INFO:echo.src.base_objective:	trainer:training_loss : smooth
INFO:echo.src.base_objective:Beginning trial 0
INFO:echo.src.base_objective:Attempting to automatically update the model configuration using optuna's suggested parameters
INFO:echo.src.base_objective:	data:norm : negone
INFO:echo.src.base_objective:	model:name : fpn
INFO:echo.src.base_objective:	optimizer:learning_rate : 0.0037491208546242116
INFO:echo.src.base_objective:	trainer:train_batch_size : 67
INFO:echo.src.base_objective:	trainer:weight_decay : 2.07706808759448e-10
INFO:echo.src.base_objective:	trainer:training_loss : logcosh
INFO:echo.src.base_objective:Beginning trial 1
INFO:root:Loading model fpn with settings {'in_channels': 4, 'classes': 1, 'activation': 'sigmoid'}
INFO:root:Loading model deeplabv3+ with settings {'in_channels': 4, 'classes': 1, 'activation': 'sigmoid'}
INFO:root:Loading loss smooth
INFO:root:Loading loss smooth
INFO:root:Loading loss smooth
INFO:root:Loading loss smooth
INFO:echo.src.base_objective:Saving trial 1 results to local file /glade/work/kdagon/s2sml/results_week3_SH_530/trial_results/trial_results_31814.gusched01.csv
[32m[I 2023-05-30 15:51:19,905][0m Trial 1 finished with values: [13.70943072423721, 11.082099839355626, 3.911683399489025] and parameters: {'learning_rate': 0.0037491208546242116, 'norm': 'negone', 'weight_decay': 2.07706808759448e-10, 'train_batch_size': 67, 'training_loss': 'logcosh', 'model_name': 'fpn'}. [0m
INFO:echo.src.base_objective:Attempting to automatically update the model configuration using optuna's suggested parameters
INFO:echo.src.base_objective:	data:norm : negone
INFO:echo.src.base_objective:	model:name : pspnet
INFO:echo.src.base_objective:	optimizer:learning_rate : 3.6067010350850016e-06
INFO:echo.src.base_objective:	trainer:train_batch_size : 76
INFO:echo.src.base_objective:	trainer:weight_decay : 7.61953912109223e-05
INFO:echo.src.base_objective:	trainer:training_loss : mse
INFO:echo.src.base_objective:Beginning trial 2
INFO:root:Loading model pspnet with settings {'in_channels': 4, 'classes': 1, 'activation': 'sigmoid'}
INFO:root:Loading loss smooth
INFO:root:Loading loss smooth
INFO:echo.src.base_objective:Saving trial 0 results to local file /glade/work/kdagon/s2sml/results_week3_SH_530/trial_results/trial_results_31813.gusched01.csv
INFO:echo.src.base_objective:Merging trial results and saving to /glade/work/kdagon/s2sml/results_week3_SH_530/trial_results.csv
[32m[I 2023-05-30 15:56:19,310][0m Trial 0 finished with values: [1.1670307542993081, 4.718692817676456, 2.5057486922170127] and parameters: {'learning_rate': 1.2871644037468007e-05, 'norm': 'zscore', 'weight_decay': 2.3534289524959783e-10, 'train_batch_size': 49, 'training_loss': 'smooth', 'model_name': 'deeplabv3+'}. [0m
INFO:echo.src.base_objective:Attempting to automatically update the model configuration using optuna's suggested parameters
INFO:echo.src.base_objective:	data:norm : minmax
INFO:echo.src.base_objective:	model:name : deeplabv3+
INFO:echo.src.base_objective:	optimizer:learning_rate : 0.004812909607380071
INFO:echo.src.base_objective:	trainer:train_batch_size : 6
INFO:echo.src.base_objective:	trainer:weight_decay : 1.769209457899457e-06
INFO:echo.src.base_objective:	trainer:training_loss : huber
INFO:echo.src.base_objective:Beginning trial 3
INFO:root:Loading model deeplabv3+ with settings {'in_channels': 4, 'classes': 1, 'activation': 'sigmoid'}
INFO:root:Loading loss smooth
INFO:root:Loading loss smooth
INFO:echo.src.base_objective:Saving trial 3 results to local file /glade/work/kdagon/s2sml/results_week3_SH_530/trial_results/trial_results_31813.gusched01.csv
INFO:echo.src.base_objective:Merging trial results and saving to /glade/work/kdagon/s2sml/results_week3_SH_530/trial_results.csv
[32m[I 2023-05-30 16:01:29,707][0m Trial 3 finished with values: [1.0188607527965086, 1.09110444680181, 1.014967351540921] and parameters: {'learning_rate': 0.004812909607380071, 'norm': 'minmax', 'weight_decay': 1.769209457899457e-06, 'train_batch_size': 6, 'training_loss': 'huber', 'model_name': 'deeplabv3+'}. [0m
INFO:echo.src.base_objective:Attempting to automatically update the model configuration using optuna's suggested parameters
INFO:echo.src.base_objective:	data:norm : minmax
INFO:echo.src.base_objective:	model:name : manet
INFO:echo.src.base_objective:	optimizer:learning_rate : 1.8465638594377956e-05
INFO:echo.src.base_objective:	trainer:train_batch_size : 116
INFO:echo.src.base_objective:	trainer:weight_decay : 6.387046286223154e-11
INFO:echo.src.base_objective:	trainer:training_loss : huber
INFO:echo.src.base_objective:Beginning trial 4
INFO:root:Loading model manet with settings {'in_channels': 4, 'classes': 1, 'activation': 'sigmoid'}
INFO:root:Loading loss smooth
INFO:root:Loading loss smooth
INFO:echo.src.base_objective:Saving trial 4 results to local file /glade/work/kdagon/s2sml/results_week3_SH_530/trial_results/trial_results_31813.gusched01.csv
INFO:echo.src.base_objective:Merging trial results and saving to /glade/work/kdagon/s2sml/results_week3_SH_530/trial_results.csv
[32m[I 2023-05-30 16:11:16,167][0m Trial 4 finished with values: [1.10223481335141, 1.805638906207943, 1.5343633088478081] and parameters: {'learning_rate': 1.8465638594377956e-05, 'norm': 'minmax', 'weight_decay': 6.387046286223154e-11, 'train_batch_size': 116, 'training_loss': 'huber', 'model_name': 'manet'}. [0m
INFO:echo.src.base_objective:Attempting to automatically update the model configuration using optuna's suggested parameters
INFO:echo.src.base_objective:	data:norm : minmax
INFO:echo.src.base_objective:	model:name : pspnet
INFO:echo.src.base_objective:	optimizer:learning_rate : 4.01233423196055e-06
INFO:echo.src.base_objective:	trainer:train_batch_size : 58
INFO:echo.src.base_objective:	trainer:weight_decay : 2.7021539912439333e-05
INFO:echo.src.base_objective:	trainer:training_loss : mse
INFO:echo.src.base_objective:Beginning trial 5
INFO:root:Loading model pspnet with settings {'in_channels': 4, 'classes': 1, 'activation': 'sigmoid'}
INFO:root:Loading loss smooth
INFO:root:Loading loss smooth
INFO:echo.src.base_objective:Saving trial 2 results to local file /glade/work/kdagon/s2sml/results_week3_SH_530/trial_results/trial_results_31814.gusched01.csv
INFO:echo.src.base_objective:Merging trial results and saving to /glade/work/kdagon/s2sml/results_week3_SH_530/trial_results.csv
[32m[I 2023-05-30 16:28:41,810][0m Trial 2 finished with values: [1.1066033071676344, 1.7825956819896327, 1.4031935358624923] and parameters: {'learning_rate': 3.6067010350850016e-06, 'norm': 'negone', 'weight_decay': 7.61953912109223e-05, 'train_batch_size': 76, 'training_loss': 'mse', 'model_name': 'pspnet'}. [0m
INFO:echo.src.base_objective:Attempting to automatically update the model configuration using optuna's suggested parameters
INFO:echo.src.base_objective:	data:norm : zscore
INFO:echo.src.base_objective:	model:name : unet++
INFO:echo.src.base_objective:	optimizer:learning_rate : 6.886914959777775e-06
INFO:echo.src.base_objective:	trainer:train_batch_size : 41
INFO:echo.src.base_objective:	trainer:weight_decay : 7.817452910118118e-10
INFO:echo.src.base_objective:	trainer:training_loss : mse
INFO:echo.src.base_objective:Beginning trial 6
INFO:root:Loading model unet++ with settings {'in_channels': 4, 'classes': 1, 'activation': 'sigmoid'}
INFO:root:Loading loss smooth
INFO:root:Loading loss smooth
INFO:echo.src.base_objective:Saving trial 5 results to local file /glade/work/kdagon/s2sml/results_week3_SH_530/trial_results/trial_results_31813.gusched01.csv
INFO:echo.src.base_objective:Merging trial results and saving to /glade/work/kdagon/s2sml/results_week3_SH_530/trial_results.csv
[32m[I 2023-05-30 16:32:30,206][0m Trial 5 finished with values: [1.0865227315656576, 1.6954600507566768, 1.3586882278659769] and parameters: {'learning_rate': 4.01233423196055e-06, 'norm': 'minmax', 'weight_decay': 2.7021539912439333e-05, 'train_batch_size': 58, 'training_loss': 'mse', 'model_name': 'pspnet'}. [0m
INFO:echo.src.base_objective:Attempting to automatically update the model configuration using optuna's suggested parameters
INFO:echo.src.base_objective:	data:norm : negone
INFO:echo.src.base_objective:	model:name : deeplabv3
INFO:echo.src.base_objective:	optimizer:learning_rate : 1.1833052953083575e-05
INFO:echo.src.base_objective:	trainer:train_batch_size : 4
INFO:echo.src.base_objective:	trainer:weight_decay : 9.967021327088652e-07
INFO:echo.src.base_objective:	trainer:training_loss : huber
INFO:echo.src.base_objective:Beginning trial 7
INFO:root:Loading model deeplabv3 with settings {'in_channels': 4, 'classes': 1, 'activation': 'sigmoid'}
INFO:root:Loading loss smooth
INFO:root:Loading loss smooth
INFO:echo.src.base_objective:Saving trial 7 results to local file /glade/work/kdagon/s2sml/results_week3_SH_530/trial_results/trial_results_31813.gusched01.csv
INFO:echo.src.base_objective:Merging trial results and saving to /glade/work/kdagon/s2sml/results_week3_SH_530/trial_results.csv
[32m[I 2023-05-30 16:44:59,889][0m Trial 7 finished with values: [1.0798595650064549, 2.0580574459606567, 1.502823290428844] and parameters: {'learning_rate': 1.1833052953083575e-05, 'norm': 'negone', 'weight_decay': 9.967021327088652e-07, 'train_batch_size': 4, 'training_loss': 'huber', 'model_name': 'deeplabv3'}. [0m
INFO:echo.src.base_objective:Attempting to automatically update the model configuration using optuna's suggested parameters
INFO:echo.src.base_objective:	data:norm : negone
INFO:echo.src.base_objective:	model:name : unet++
INFO:echo.src.base_objective:	optimizer:learning_rate : 1.4154197602568483e-06
INFO:echo.src.base_objective:	trainer:train_batch_size : 128
INFO:echo.src.base_objective:	trainer:weight_decay : 0.0003686327726084976
INFO:echo.src.base_objective:	trainer:training_loss : smooth
INFO:echo.src.base_objective:Beginning trial 8
INFO:root:Loading model unet++ with settings {'in_channels': 4, 'classes': 1, 'activation': 'sigmoid'}
INFO:root:Loading loss smooth
INFO:root:Loading loss smooth
INFO:echo.src.base_objective:Saving trial 8 results to local file /glade/work/kdagon/s2sml/results_week3_SH_530/trial_results/trial_results_31813.gusched01.csv
INFO:echo.src.base_objective:Merging trial results and saving to /glade/work/kdagon/s2sml/results_week3_SH_530/trial_results.csv
[32m[I 2023-05-30 16:49:20,006][0m Trial 8 finished with values: [2.319122406941369, 31.126042510088926, 7.26448755806512] and parameters: {'learning_rate': 1.4154197602568483e-06, 'norm': 'negone', 'weight_decay': 0.0003686327726084976, 'train_batch_size': 128, 'training_loss': 'smooth', 'model_name': 'unet++'}. [0m
INFO:echo.src.base_objective:Attempting to automatically update the model configuration using optuna's suggested parameters
INFO:echo.src.base_objective:	data:norm : minmax
INFO:echo.src.base_objective:	model:name : fpn
INFO:echo.src.base_objective:	optimizer:learning_rate : 1.5824633856569872e-05
INFO:echo.src.base_objective:	trainer:train_batch_size : 38
INFO:echo.src.base_objective:	trainer:weight_decay : 5.727108431158585e-10
INFO:echo.src.base_objective:	trainer:training_loss : smooth
INFO:echo.src.base_objective:Beginning trial 9
INFO:root:Loading model fpn with settings {'in_channels': 4, 'classes': 1, 'activation': 'sigmoid'}
INFO:root:Loading loss smooth
INFO:root:Loading loss smooth
INFO:echo.src.base_objective:Saving trial 6 results to local file /glade/work/kdagon/s2sml/results_week3_SH_530/trial_results/trial_results_31814.gusched01.csv
INFO:echo.src.base_objective:Merging trial results and saving to /glade/work/kdagon/s2sml/results_week3_SH_530/trial_results.csv
[32m[I 2023-05-30 16:55:17,505][0m Trial 6 finished with values: [1.043991112219754, 4.507088206124441, 2.4483307482581322] and parameters: {'learning_rate': 6.886914959777775e-06, 'norm': 'zscore', 'weight_decay': 7.817452910118118e-10, 'train_batch_size': 41, 'training_loss': 'mse', 'model_name': 'unet++'}. [0m
INFO:echo.src.base_objective:Attempting to automatically update the model configuration using optuna's suggested parameters
INFO:echo.src.base_objective:	data:norm : negone
INFO:echo.src.base_objective:	model:name : unet++
INFO:echo.src.base_objective:	optimizer:learning_rate : 1.5182552524185592e-06
INFO:echo.src.base_objective:	trainer:train_batch_size : 35
INFO:echo.src.base_objective:	trainer:weight_decay : 1.7783298198852854e-07
INFO:echo.src.base_objective:	trainer:training_loss : xtanh
INFO:echo.src.base_objective:Beginning trial 10
INFO:root:Loading model unet++ with settings {'in_channels': 4, 'classes': 1, 'activation': 'sigmoid'}
INFO:root:Loading loss smooth
INFO:root:Loading loss smooth
INFO:echo.src.base_objective:Saving trial 9 results to local file /glade/work/kdagon/s2sml/results_week3_SH_530/trial_results/trial_results_31813.gusched01.csv
INFO:echo.src.base_objective:Merging trial results and saving to /glade/work/kdagon/s2sml/results_week3_SH_530/trial_results.csv
[32m[I 2023-05-30 17:05:20,396][0m Trial 9 finished with values: [1.0610244561422166, 2.358765976450138, 1.7649497259189315] and parameters: {'learning_rate': 1.5824633856569872e-05, 'norm': 'minmax', 'weight_decay': 5.727108431158585e-10, 'train_batch_size': 38, 'training_loss': 'smooth', 'model_name': 'fpn'}. [0m
INFO:echo.src.base_objective:Attempting to automatically update the model configuration using optuna's suggested parameters
INFO:echo.src.base_objective:	data:norm : minmax
INFO:echo.src.base_objective:	model:name : pspnet
INFO:echo.src.base_objective:	optimizer:learning_rate : 3.202435330388445e-05
INFO:echo.src.base_objective:	trainer:train_batch_size : 30
INFO:echo.src.base_objective:	trainer:weight_decay : 3.156322519289736e-12
INFO:echo.src.base_objective:	trainer:training_loss : huber
INFO:echo.src.base_objective:Beginning trial 11
INFO:root:Loading model pspnet with settings {'in_channels': 4, 'classes': 1, 'activation': 'sigmoid'}
INFO:root:Loading loss smooth
INFO:root:Loading loss smooth
INFO:echo.src.base_objective:Saving trial 11 results to local file /glade/work/kdagon/s2sml/results_week3_SH_530/trial_results/trial_results_31813.gusched01.csv
INFO:echo.src.base_objective:Merging trial results and saving to /glade/work/kdagon/s2sml/results_week3_SH_530/trial_results.csv
[32m[I 2023-05-30 17:18:19,989][0m Trial 11 finished with values: [1.0668391479584003, 1.437859114802106, 1.2160765755619867] and parameters: {'learning_rate': 3.202435330388445e-05, 'norm': 'minmax', 'weight_decay': 3.156322519289736e-12, 'train_batch_size': 30, 'training_loss': 'huber', 'model_name': 'pspnet'}. [0m
WARNING:root:Stopping early since the longest observed run-time in the study exceeds the time remaining on this node.
INFO:root:Saving trial details to /glade/work/kdagon/s2sml/results_week3_SH_530/
INFO:root:Running on PBS/SLURM batch id: 31815.gusched01
INFO:root:Importing custom objective from /glade/work/kdagon/s2sml/applications/train.py
INFO:echo.src.reporting:Using device 0
INFO:root:Direction of optimization: ['minimize', 'minimize', 'minimize']
INFO:root:Using metric ['valid_custom', 'valid_custom_second', 'valid_custom_third']
[32m[I 2023-05-30 17:18:48,029][0m Using an existing study with name 'vanilla' instead of creating a new one.[0m
INFO:root:Loaded study vanilla located at sqlite:////glade/work/kdagon/s2sml/results_week3_SH_530/s2s.db
INFO:echo.src.base_objective:Worker 31815.gusched01 is summoned.
INFO:echo.src.base_objective:	initializing an objective to be optimized with metric ['valid_custom', 'valid_custom_second', 'valid_custom_third']
INFO:echo.src.base_objective:	using device(s) cuda:0
INFO:echo.src.base_objective:	saving study/trial results to local file /glade/work/kdagon/s2sml/results_week3_SH_530/trial_results/trial_results_31815.gusched01.csv
INFO:root:Running optimization for 1000 trials
INFO:root:Running trials for a maximum PBS wall-time 2:00:00
WARNING:root:Attempting to run trials and stop before hitting the wall-time
WARNING:root:Some trials may not complete if the wall-time is reached. Optuna will start over.
INFO:echo.src.base_objective:Attempting to automatically update the model configuration using optuna's suggested parameters
INFO:echo.src.base_objective:	data:norm : negone
INFO:echo.src.base_objective:	model:name : fpn
INFO:echo.src.base_objective:	optimizer:learning_rate : 0.0003659508224469902
INFO:echo.src.base_objective:	trainer:train_batch_size : 30
INFO:echo.src.base_objective:	trainer:weight_decay : 4.209618424348185e-12
INFO:echo.src.base_objective:	trainer:training_loss : logcosh
INFO:echo.src.base_objective:Beginning trial 12
INFO:root:Loading model fpn with settings {'in_channels': 4, 'classes': 1, 'activation': 'sigmoid'}
INFO:root:Loading loss smooth
INFO:root:Loading loss smooth
INFO:echo.src.base_objective:Saving trial 10 results to local file /glade/work/kdagon/s2sml/results_week3_SH_530/trial_results/trial_results_31814.gusched01.csv
INFO:echo.src.base_objective:Merging trial results and saving to /glade/work/kdagon/s2sml/results_week3_SH_530/trial_results.csv
