[32m[I 2023-05-31 03:26:30,560][0m Trial 95 finished with values: [0.9914558933978521, 0.8949943051694004, 0.9167611816386357] and parameters: {'learning_rate': 0.0016407106434980878, 'norm': 'negone', 'weight_decay': 3.9165563580021015e-08, 'train_batch_size': 5, 'training_loss': 'mae', 'model_name': 'unet'}. [0m
INFO:echo.src.base_objective:Attempting to automatically update the model configuration using optuna's suggested parameters
INFO:echo.src.base_objective:	data:norm : minmax
INFO:echo.src.base_objective:	model:name : linknet
INFO:echo.src.base_objective:	optimizer:learning_rate : 4.230320004691067e-05
INFO:echo.src.base_objective:	trainer:train_batch_size : 124
INFO:echo.src.base_objective:	trainer:weight_decay : 2.712562718153424e-08
INFO:echo.src.base_objective:	trainer:training_loss : mse
INFO:echo.src.base_objective:Beginning trial 96
INFO:root:Loading model linknet with settings {'in_channels': 4, 'classes': 1, 'activation': 'sigmoid'}
INFO:root:Loading loss smooth
INFO:root:Loading loss smooth
INFO:echo.src.base_objective:Saving trial 94 results to local file /glade/work/kdagon/s2sml/results_week3_SH_530/trial_results/trial_results_31828.gusched01.csv
INFO:echo.src.base_objective:Merging trial results and saving to /glade/work/kdagon/s2sml/results_week3_SH_530/trial_results.csv
[32m[I 2023-05-31 03:35:53,190][0m Trial 94 finished with values: [1.0139112044391052, 1.0524976401195218, 1.1568781377350035] and parameters: {'learning_rate': 1.606113688000892e-06, 'norm': 'minmax', 'weight_decay': 1.2976238273274063e-09, 'train_batch_size': 4, 'training_loss': 'xtanh', 'model_name': 'unet'}. [0m
INFO:echo.src.base_objective:Attempting to automatically update the model configuration using optuna's suggested parameters
INFO:echo.src.base_objective:	data:norm : minmax
INFO:echo.src.base_objective:	model:name : pspnet
INFO:echo.src.base_objective:	optimizer:learning_rate : 1.4728282439801808e-06
INFO:echo.src.base_objective:	trainer:train_batch_size : 42
INFO:echo.src.base_objective:	trainer:weight_decay : 4.8910419338314606e-05
INFO:echo.src.base_objective:	trainer:training_loss : mae
INFO:echo.src.base_objective:Beginning trial 97
INFO:root:Loading model pspnet with settings {'in_channels': 4, 'classes': 1, 'activation': 'sigmoid'}
INFO:root:Loading loss smooth
INFO:root:Loading loss smooth
INFO:echo.src.base_objective:Saving trial 96 results to local file /glade/work/kdagon/s2sml/results_week3_SH_530/trial_results/trial_results_31827.gusched01.csv
INFO:echo.src.base_objective:Merging trial results and saving to /glade/work/kdagon/s2sml/results_week3_SH_530/trial_results.csv
[32m[I 2023-05-31 03:50:50,287][0m Trial 96 finished with values: [1.9603529314938746, 6.895757868774827, 3.033741776940351] and parameters: {'learning_rate': 4.230320004691067e-05, 'norm': 'minmax', 'weight_decay': 2.712562718153424e-08, 'train_batch_size': 124, 'training_loss': 'mse', 'model_name': 'linknet'}. [0m
WARNING:root:Stopping early since the longest observed run-time in the study exceeds the time remaining on this node.
INFO:root:Saving trial details to /glade/work/kdagon/s2sml/results_week3_SH_530/
INFO:root:Running on PBS/SLURM batch id: 31829.gusched01
INFO:root:Importing custom objective from /glade/work/kdagon/s2sml/applications/train.py
INFO:echo.src.reporting:Using device 0
INFO:root:Direction of optimization: ['minimize', 'minimize', 'minimize']
INFO:root:Using metric ['valid_custom', 'valid_custom_second', 'valid_custom_third']
[32m[I 2023-05-31 03:51:56,893][0m Using an existing study with name 'vanilla' instead of creating a new one.[0m
INFO:root:Loaded study vanilla located at sqlite:////glade/work/kdagon/s2sml/results_week3_SH_530/s2s.db
INFO:echo.src.base_objective:Worker 31829.gusched01 is summoned.
INFO:echo.src.base_objective:	initializing an objective to be optimized with metric ['valid_custom', 'valid_custom_second', 'valid_custom_third']
INFO:echo.src.base_objective:	using device(s) cuda:0
INFO:echo.src.base_objective:	saving study/trial results to local file /glade/work/kdagon/s2sml/results_week3_SH_530/trial_results/trial_results_31829.gusched01.csv
INFO:root:Running optimization for 1000 trials
INFO:root:Running trials for a maximum PBS wall-time 2:00:00
WARNING:root:Attempting to run trials and stop before hitting the wall-time
WARNING:root:Some trials may not complete if the wall-time is reached. Optuna will start over.
INFO:echo.src.base_objective:Attempting to automatically update the model configuration using optuna's suggested parameters
INFO:echo.src.base_objective:	data:norm : negone
INFO:echo.src.base_objective:	model:name : manet
INFO:echo.src.base_objective:	optimizer:learning_rate : 5.474640296383836e-05
INFO:echo.src.base_objective:	trainer:train_batch_size : 19
INFO:echo.src.base_objective:	trainer:weight_decay : 3.709145271220513e-05
INFO:echo.src.base_objective:	trainer:training_loss : huber
INFO:echo.src.base_objective:Beginning trial 98
INFO:root:Loading model manet with settings {'in_channels': 4, 'classes': 1, 'activation': 'sigmoid'}
INFO:root:Loading loss smooth
INFO:root:Loading loss smooth
INFO:echo.src.base_objective:Saving trial 98 results to local file /glade/work/kdagon/s2sml/results_week3_SH_530/trial_results/trial_results_31829.gusched01.csv
INFO:echo.src.base_objective:Merging trial results and saving to /glade/work/kdagon/s2sml/results_week3_SH_530/trial_results.csv
[32m[I 2023-05-31 03:58:55,679][0m Trial 98 finished with values: [1.011860937319177, 1.772796084697466, 1.480017504942055] and parameters: {'learning_rate': 5.474640296383836e-05, 'norm': 'negone', 'weight_decay': 3.709145271220513e-05, 'train_batch_size': 19, 'training_loss': 'huber', 'model_name': 'manet'}. [0m
INFO:echo.src.base_objective:Attempting to automatically update the model configuration using optuna's suggested parameters
INFO:echo.src.base_objective:	data:norm : minmax
INFO:echo.src.base_objective:	model:name : deeplabv3
INFO:echo.src.base_objective:	optimizer:learning_rate : 6.20863396957602e-06
INFO:echo.src.base_objective:	trainer:train_batch_size : 53
INFO:echo.src.base_objective:	trainer:weight_decay : 0.0004059839081280171
INFO:echo.src.base_objective:	trainer:training_loss : xsigmoid
INFO:echo.src.base_objective:Beginning trial 99
INFO:root:Loading model deeplabv3 with settings {'in_channels': 4, 'classes': 1, 'activation': 'sigmoid'}
INFO:root:Loading loss smooth
INFO:root:Loading loss smooth
INFO:echo.src.base_objective:Saving trial 97 results to local file /glade/work/kdagon/s2sml/results_week3_SH_530/trial_results/trial_results_31828.gusched01.csv
INFO:echo.src.base_objective:Merging trial results and saving to /glade/work/kdagon/s2sml/results_week3_SH_530/trial_results.csv
[32m[I 2023-05-31 04:00:13,410][0m Trial 97 finished with values: [1.1035535403034349, 1.8362119924077909, 1.4274816278410485] and parameters: {'learning_rate': 1.4728282439801808e-06, 'norm': 'minmax', 'weight_decay': 4.8910419338314606e-05, 'train_batch_size': 42, 'training_loss': 'mae', 'model_name': 'pspnet'}. [0m
WARNING:root:Stopping early since the longest observed run-time in the study exceeds the time remaining on this node.
INFO:root:Saving trial details to /glade/work/kdagon/s2sml/results_week3_SH_530/
INFO:root:Running on PBS/SLURM batch id: 31830.gusched01
INFO:root:Importing custom objective from /glade/work/kdagon/s2sml/applications/train.py
INFO:echo.src.reporting:Using device 0
INFO:root:Direction of optimization: ['minimize', 'minimize', 'minimize']
INFO:root:Using metric ['valid_custom', 'valid_custom_second', 'valid_custom_third']
[32m[I 2023-05-31 04:00:37,632][0m Using an existing study with name 'vanilla' instead of creating a new one.[0m
INFO:root:Loaded study vanilla located at sqlite:////glade/work/kdagon/s2sml/results_week3_SH_530/s2s.db
INFO:echo.src.base_objective:Worker 31830.gusched01 is summoned.
INFO:echo.src.base_objective:	initializing an objective to be optimized with metric ['valid_custom', 'valid_custom_second', 'valid_custom_third']
INFO:echo.src.base_objective:	using device(s) cuda:0
INFO:echo.src.base_objective:	saving study/trial results to local file /glade/work/kdagon/s2sml/results_week3_SH_530/trial_results/trial_results_31830.gusched01.csv
INFO:root:Running optimization for 1000 trials
INFO:root:Running trials for a maximum PBS wall-time 2:00:00
WARNING:root:Attempting to run trials and stop before hitting the wall-time
WARNING:root:Some trials may not complete if the wall-time is reached. Optuna will start over.
INFO:echo.src.base_objective:Attempting to automatically update the model configuration using optuna's suggested parameters
INFO:echo.src.base_objective:	data:norm : negone
INFO:echo.src.base_objective:	model:name : unet
INFO:echo.src.base_objective:	optimizer:learning_rate : 1.8349667290697234e-06
INFO:echo.src.base_objective:	trainer:train_batch_size : 119
INFO:echo.src.base_objective:	trainer:weight_decay : 2.650425196286833e-10
INFO:echo.src.base_objective:	trainer:training_loss : logcosh
INFO:echo.src.base_objective:Beginning trial 100
INFO:root:Loading model unet with settings {'in_channels': 4, 'classes': 1, 'activation': 'sigmoid'}
INFO:root:Loading loss smooth
INFO:root:Loading loss smooth
INFO:echo.src.base_objective:Saving trial 99 results to local file /glade/work/kdagon/s2sml/results_week3_SH_530/trial_results/trial_results_31829.gusched01.csv
INFO:echo.src.base_objective:Merging trial results and saving to /glade/work/kdagon/s2sml/results_week3_SH_530/trial_results.csv
[32m[I 2023-05-31 04:09:18,854][0m Trial 99 finished with values: [1.2019696091043963, 3.9426325277478336, 1.9491568177675223] and parameters: {'learning_rate': 6.20863396957602e-06, 'norm': 'minmax', 'weight_decay': 0.0004059839081280171, 'train_batch_size': 53, 'training_loss': 'xsigmoid', 'model_name': 'deeplabv3'}. [0m
INFO:echo.src.base_objective:Attempting to automatically update the model configuration using optuna's suggested parameters
INFO:echo.src.base_objective:	data:norm : minmax
INFO:echo.src.base_objective:	model:name : unet
INFO:echo.src.base_objective:	optimizer:learning_rate : 0.00971042024673141
INFO:echo.src.base_objective:	trainer:train_batch_size : 13
INFO:echo.src.base_objective:	trainer:weight_decay : 2.5233875632000216e-09
INFO:echo.src.base_objective:	trainer:training_loss : logcosh
INFO:echo.src.base_objective:Beginning trial 101
INFO:root:Loading model unet with settings {'in_channels': 4, 'classes': 1, 'activation': 'sigmoid'}
INFO:root:Loading loss smooth
INFO:root:Loading loss smooth
INFO:echo.src.base_objective:Saving trial 101 results to local file /glade/work/kdagon/s2sml/results_week3_SH_530/trial_results/trial_results_31829.gusched01.csv
INFO:echo.src.base_objective:Merging trial results and saving to /glade/work/kdagon/s2sml/results_week3_SH_530/trial_results.csv
[32m[I 2023-05-31 04:19:04,462][0m Trial 101 finished with values: [0.962530483897412, 0.4129024550125787, 0.696719045286824] and parameters: {'learning_rate': 0.00971042024673141, 'norm': 'minmax', 'weight_decay': 2.5233875632000216e-09, 'train_batch_size': 13, 'training_loss': 'logcosh', 'model_name': 'unet'}. [0m
INFO:echo.src.base_objective:Attempting to automatically update the model configuration using optuna's suggested parameters
INFO:echo.src.base_objective:	data:norm : minmax
INFO:echo.src.base_objective:	model:name : unet
INFO:echo.src.base_objective:	optimizer:learning_rate : 0.009713683773869579
INFO:echo.src.base_objective:	trainer:train_batch_size : 11
INFO:echo.src.base_objective:	trainer:weight_decay : 2.772094423806634e-09
INFO:echo.src.base_objective:	trainer:training_loss : logcosh
INFO:echo.src.base_objective:Beginning trial 102
INFO:root:Loading model unet with settings {'in_channels': 4, 'classes': 1, 'activation': 'sigmoid'}
INFO:root:Loading loss smooth
INFO:root:Loading loss smooth
INFO:echo.src.base_objective:Saving trial 102 results to local file /glade/work/kdagon/s2sml/results_week3_SH_530/trial_results/trial_results_31829.gusched01.csv
INFO:echo.src.base_objective:Merging trial results and saving to /glade/work/kdagon/s2sml/results_week3_SH_530/trial_results.csv
[32m[I 2023-05-31 04:26:05,409][0m Trial 102 finished with values: [0.963288941472889, 0.4160159617230355, 0.7012280438511562] and parameters: {'learning_rate': 0.009713683773869579, 'norm': 'minmax', 'weight_decay': 2.772094423806634e-09, 'train_batch_size': 11, 'training_loss': 'logcosh', 'model_name': 'unet'}. [0m
INFO:echo.src.base_objective:Attempting to automatically update the model configuration using optuna's suggested parameters
INFO:echo.src.base_objective:	data:norm : minmax
INFO:echo.src.base_objective:	model:name : unet
INFO:echo.src.base_objective:	optimizer:learning_rate : 0.008622113424665874
INFO:echo.src.base_objective:	trainer:train_batch_size : 65
INFO:echo.src.base_objective:	trainer:weight_decay : 5.695580605083572e-12
INFO:echo.src.base_objective:	trainer:training_loss : logcosh
INFO:echo.src.base_objective:Beginning trial 103
INFO:root:Loading model unet with settings {'in_channels': 4, 'classes': 1, 'activation': 'sigmoid'}
INFO:root:Loading loss smooth
INFO:root:Loading loss smooth
INFO:echo.src.base_objective:Saving trial 100 results to local file /glade/work/kdagon/s2sml/results_week3_SH_530/trial_results/trial_results_31830.gusched01.csv
INFO:echo.src.base_objective:Merging trial results and saving to /glade/work/kdagon/s2sml/results_week3_SH_530/trial_results.csv
[32m[I 2023-05-31 04:37:59,631][0m Trial 100 finished with values: [1.2754297900041822, 7.736859371559684, 3.485277274852301] and parameters: {'learning_rate': 1.8349667290697234e-06, 'norm': 'negone', 'weight_decay': 2.650425196286833e-10, 'train_batch_size': 119, 'training_loss': 'logcosh', 'model_name': 'unet'}. [0m
INFO:echo.src.base_objective:Attempting to automatically update the model configuration using optuna's suggested parameters
INFO:echo.src.base_objective:	data:norm : minmax
INFO:echo.src.base_objective:	model:name : unet
INFO:echo.src.base_objective:	optimizer:learning_rate : 0.00868893855558684
INFO:echo.src.base_objective:	trainer:train_batch_size : 66
INFO:echo.src.base_objective:	trainer:weight_decay : 8.76148179847864e-11
INFO:echo.src.base_objective:	trainer:training_loss : logcosh
INFO:echo.src.base_objective:Beginning trial 104
INFO:root:Loading model unet with settings {'in_channels': 4, 'classes': 1, 'activation': 'sigmoid'}
INFO:root:Loading loss smooth
INFO:root:Loading loss smooth
INFO:echo.src.base_objective:Saving trial 103 results to local file /glade/work/kdagon/s2sml/results_week3_SH_530/trial_results/trial_results_31829.gusched01.csv
INFO:echo.src.base_objective:Merging trial results and saving to /glade/work/kdagon/s2sml/results_week3_SH_530/trial_results.csv
[32m[I 2023-05-31 04:45:50,874][0m Trial 103 finished with values: [0.9624420831378052, 0.40542595728588615, 0.6848519884801778] and parameters: {'learning_rate': 0.008622113424665874, 'norm': 'minmax', 'weight_decay': 5.695580605083572e-12, 'train_batch_size': 65, 'training_loss': 'logcosh', 'model_name': 'unet'}. [0m
INFO:echo.src.base_objective:Attempting to automatically update the model configuration using optuna's suggested parameters
INFO:echo.src.base_objective:	data:norm : minmax
INFO:echo.src.base_objective:	model:name : unet
INFO:echo.src.base_objective:	optimizer:learning_rate : 0.009619114514636052
INFO:echo.src.base_objective:	trainer:train_batch_size : 62
INFO:echo.src.base_objective:	trainer:weight_decay : 2.841303251265314e-09
INFO:echo.src.base_objective:	trainer:training_loss : logcosh
INFO:echo.src.base_objective:Beginning trial 105
INFO:root:Loading model unet with settings {'in_channels': 4, 'classes': 1, 'activation': 'sigmoid'}
INFO:root:Loading loss smooth
INFO:root:Loading loss smooth
INFO:echo.src.base_objective:Saving trial 104 results to local file /glade/work/kdagon/s2sml/results_week3_SH_530/trial_results/trial_results_31830.gusched01.csv
INFO:echo.src.base_objective:Merging trial results and saving to /glade/work/kdagon/s2sml/results_week3_SH_530/trial_results.csv
[32m[I 2023-05-31 04:54:59,879][0m Trial 104 finished with values: [0.9646141078745799, 0.432253152108773, 0.7035916011967941] and parameters: {'learning_rate': 0.00868893855558684, 'norm': 'minmax', 'weight_decay': 8.76148179847864e-11, 'train_batch_size': 66, 'training_loss': 'logcosh', 'model_name': 'unet'}. [0m
INFO:echo.src.base_objective:Attempting to automatically update the model configuration using optuna's suggested parameters
INFO:echo.src.base_objective:	data:norm : minmax
INFO:echo.src.base_objective:	model:name : unet
INFO:echo.src.base_objective:	optimizer:learning_rate : 0.009583882654459
INFO:echo.src.base_objective:	trainer:train_batch_size : 45
INFO:echo.src.base_objective:	trainer:weight_decay : 6.198466043813422e-12
INFO:echo.src.base_objective:	trainer:training_loss : logcosh
INFO:echo.src.base_objective:Beginning trial 106
INFO:root:Loading model unet with settings {'in_channels': 4, 'classes': 1, 'activation': 'sigmoid'}
INFO:root:Loading loss smooth
INFO:root:Loading loss smooth
INFO:echo.src.base_objective:Saving trial 105 results to local file /glade/work/kdagon/s2sml/results_week3_SH_530/trial_results/trial_results_31829.gusched01.csv
INFO:echo.src.base_objective:Merging trial results and saving to /glade/work/kdagon/s2sml/results_week3_SH_530/trial_results.csv
[32m[I 2023-05-31 04:58:10,599][0m Trial 105 finished with values: [0.9666790193732674, 0.45418472394728515, 0.7289582360622313] and parameters: {'learning_rate': 0.009619114514636052, 'norm': 'minmax', 'weight_decay': 2.841303251265314e-09, 'train_batch_size': 62, 'training_loss': 'logcosh', 'model_name': 'unet'}. [0m
INFO:echo.src.base_objective:Attempting to automatically update the model configuration using optuna's suggested parameters
INFO:echo.src.base_objective:	data:norm : minmax
INFO:echo.src.base_objective:	model:name : unet
INFO:echo.src.base_objective:	optimizer:learning_rate : 0.00883282961252089
INFO:echo.src.base_objective:	trainer:train_batch_size : 64
INFO:echo.src.base_objective:	trainer:weight_decay : 6.0695364385597524e-12
INFO:echo.src.base_objective:	trainer:training_loss : logcosh
INFO:echo.src.base_objective:Beginning trial 107
INFO:root:Loading model unet with settings {'in_channels': 4, 'classes': 1, 'activation': 'sigmoid'}
INFO:root:Loading loss smooth
INFO:root:Loading loss smooth
INFO:echo.src.base_objective:Saving trial 106 results to local file /glade/work/kdagon/s2sml/results_week3_SH_530/trial_results/trial_results_31830.gusched01.csv
INFO:echo.src.base_objective:Merging trial results and saving to /glade/work/kdagon/s2sml/results_week3_SH_530/trial_results.csv
[32m[I 2023-05-31 05:11:54,101][0m Trial 106 finished with values: [0.9626311088877908, 0.40738411103593986, 0.6877490176759204] and parameters: {'learning_rate': 0.009583882654459, 'norm': 'minmax', 'weight_decay': 6.198466043813422e-12, 'train_batch_size': 45, 'training_loss': 'logcosh', 'model_name': 'unet'}. [0m
INFO:echo.src.base_objective:Attempting to automatically update the model configuration using optuna's suggested parameters
INFO:echo.src.base_objective:	data:norm : minmax
INFO:echo.src.base_objective:	model:name : unet
INFO:echo.src.base_objective:	optimizer:learning_rate : 0.00887349458267775
INFO:echo.src.base_objective:	trainer:train_batch_size : 12
INFO:echo.src.base_objective:	trainer:weight_decay : 7.426821178904178e-12
INFO:echo.src.base_objective:	trainer:training_loss : logcosh
INFO:echo.src.base_objective:Beginning trial 108
INFO:root:Loading model unet with settings {'in_channels': 4, 'classes': 1, 'activation': 'sigmoid'}
INFO:root:Loading loss smooth
INFO:root:Loading loss smooth
INFO:echo.src.base_objective:Saving trial 107 results to local file /glade/work/kdagon/s2sml/results_week3_SH_530/trial_results/trial_results_31829.gusched01.csv
INFO:echo.src.base_objective:Merging trial results and saving to /glade/work/kdagon/s2sml/results_week3_SH_530/trial_results.csv
