[32m[I 2023-05-11 02:13:05,742][0m Trial 55 finished with values: [8.121399511168045, 12101.465822217835, 162.63786009555776] and parameters: {'learning_rate': 2.1883997969026672e-05, 'norm': 'None', 'weight_decay': 0.0001031486182584722, 'train_batch_size': 55, 'training_loss': 'mse', 'model_name': 'deeplabv3+'}. [0m
INFO:echo.src.base_objective:Attempting to automatically update the model configuration using optuna's suggested parameters
INFO:echo.src.base_objective:	data:norm : negone
INFO:echo.src.base_objective:	model:name : pspnet
INFO:echo.src.base_objective:	optimizer:learning_rate : 0.00028230705715962
INFO:echo.src.base_objective:	trainer:train_batch_size : 24
INFO:echo.src.base_objective:	trainer:weight_decay : 2.986112205500461e-07
INFO:echo.src.base_objective:	trainer:training_loss : smooth
INFO:echo.src.base_objective:Beginning trial 56
INFO:root:Loading model pspnet with settings {'in_channels': 4, 'classes': 1, 'activation': 'sigmoid'}
INFO:root:Loading loss smooth
INFO:root:Loading loss smooth
INFO:echo.src.base_objective:Saving trial 56 results to local file /glade/work/kdagon/s2sml/results_week3_SH_510/trial_results/trial_results_29300.gusched01.csv
INFO:echo.src.base_objective:Merging trial results and saving to /glade/work/kdagon/s2sml/results_week3_SH_510/trial_results.csv
[32m[I 2023-05-11 02:22:41,547][0m Trial 56 finished with values: [1.0817644416562386, 1.6031011509625503, 1.2700036594148512] and parameters: {'learning_rate': 0.00028230705715962, 'norm': 'negone', 'weight_decay': 2.986112205500461e-07, 'train_batch_size': 24, 'training_loss': 'smooth', 'model_name': 'pspnet'}. [0m
INFO:echo.src.base_objective:Attempting to automatically update the model configuration using optuna's suggested parameters
INFO:echo.src.base_objective:	data:norm : minmax
INFO:echo.src.base_objective:	model:name : deeplabv3+
INFO:echo.src.base_objective:	optimizer:learning_rate : 2.196358909902674e-05
INFO:echo.src.base_objective:	trainer:train_batch_size : 42
INFO:echo.src.base_objective:	trainer:weight_decay : 4.3571121360021945e-10
INFO:echo.src.base_objective:	trainer:training_loss : smooth
INFO:echo.src.base_objective:Beginning trial 57
INFO:root:Loading model deeplabv3+ with settings {'in_channels': 4, 'classes': 1, 'activation': 'sigmoid'}
INFO:root:Loading loss smooth
INFO:root:Loading loss smooth
INFO:echo.src.base_objective:Saving trial 57 results to local file /glade/work/kdagon/s2sml/results_week3_SH_510/trial_results/trial_results_29300.gusched01.csv
INFO:echo.src.base_objective:Merging trial results and saving to /glade/work/kdagon/s2sml/results_week3_SH_510/trial_results.csv
[32m[I 2023-05-11 02:37:57,253][0m Trial 57 finished with values: [1.030510891935001, 1.2289270249148612, 1.1517781855623668] and parameters: {'learning_rate': 2.196358909902674e-05, 'norm': 'minmax', 'weight_decay': 4.3571121360021945e-10, 'train_batch_size': 42, 'training_loss': 'smooth', 'model_name': 'deeplabv3+'}. [0m
INFO:echo.src.base_objective:Attempting to automatically update the model configuration using optuna's suggested parameters
INFO:echo.src.base_objective:	data:norm : negone
INFO:echo.src.base_objective:	model:name : deeplabv3
INFO:echo.src.base_objective:	optimizer:learning_rate : 0.007048579992028126
INFO:echo.src.base_objective:	trainer:train_batch_size : 6
INFO:echo.src.base_objective:	trainer:weight_decay : 4.0946315456983936e-08
INFO:echo.src.base_objective:	trainer:training_loss : mae
INFO:echo.src.base_objective:Beginning trial 58
INFO:root:Loading model deeplabv3 with settings {'in_channels': 4, 'classes': 1, 'activation': 'sigmoid'}
INFO:root:Loading loss smooth
INFO:root:Loading loss smooth
INFO:echo.src.base_objective:Saving trial 58 results to local file /glade/work/kdagon/s2sml/results_week3_SH_510/trial_results/trial_results_29300.gusched01.csv
INFO:echo.src.base_objective:Merging trial results and saving to /glade/work/kdagon/s2sml/results_week3_SH_510/trial_results.csv
[32m[I 2023-05-11 02:51:04,983][0m Trial 58 finished with values: [1.0768776304003835, 1.6066917708852178, 1.2637269115315968] and parameters: {'learning_rate': 0.007048579992028126, 'norm': 'negone', 'weight_decay': 4.0946315456983936e-08, 'train_batch_size': 6, 'training_loss': 'mae', 'model_name': 'deeplabv3'}. [0m
INFO:echo.src.base_objective:Attempting to automatically update the model configuration using optuna's suggested parameters
INFO:echo.src.base_objective:	data:norm : None
INFO:echo.src.base_objective:	model:name : pspnet
INFO:echo.src.base_objective:	optimizer:learning_rate : 0.00030771930257469276
INFO:echo.src.base_objective:	trainer:train_batch_size : 45
INFO:echo.src.base_objective:	trainer:weight_decay : 1.00438766639592e-08
INFO:echo.src.base_objective:	trainer:training_loss : xtanh
INFO:echo.src.base_objective:Beginning trial 59
INFO:root:Loading model pspnet with settings {'in_channels': 4, 'classes': 1, 'activation': 'sigmoid'}
INFO:root:Loading loss smooth
INFO:root:Loading loss smooth
INFO:echo.src.base_objective:Saving trial 59 results to local file /glade/work/kdagon/s2sml/results_week3_SH_510/trial_results/trial_results_29300.gusched01.csv
INFO:echo.src.base_objective:Merging trial results and saving to /glade/work/kdagon/s2sml/results_week3_SH_510/trial_results.csv
[32m[I 2023-05-11 02:53:33,028][0m Trial 59 finished with values: [9.03882885982357, 12056.697417321948, 162.33658588461248] and parameters: {'learning_rate': 0.00030771930257469276, 'norm': 'None', 'weight_decay': 1.00438766639592e-08, 'train_batch_size': 45, 'training_loss': 'xtanh', 'model_name': 'pspnet'}. [0m
INFO:echo.src.base_objective:Attempting to automatically update the model configuration using optuna's suggested parameters
INFO:echo.src.base_objective:	data:norm : None
INFO:echo.src.base_objective:	model:name : deeplabv3+
INFO:echo.src.base_objective:	optimizer:learning_rate : 0.004959492953216965
INFO:echo.src.base_objective:	trainer:train_batch_size : 62
INFO:echo.src.base_objective:	trainer:weight_decay : 0.00021879272338152107
INFO:echo.src.base_objective:	trainer:training_loss : xtanh
INFO:echo.src.base_objective:Beginning trial 60
INFO:root:Loading model deeplabv3+ with settings {'in_channels': 4, 'classes': 1, 'activation': 'sigmoid'}
INFO:root:Loading loss smooth
INFO:root:Loading loss smooth
INFO:echo.src.base_objective:Saving trial 60 results to local file /glade/work/kdagon/s2sml/results_week3_SH_510/trial_results/trial_results_29300.gusched01.csv
INFO:echo.src.base_objective:Merging trial results and saving to /glade/work/kdagon/s2sml/results_week3_SH_510/trial_results.csv
[32m[I 2023-05-11 02:57:40,679][0m Trial 60 finished with values: [2.486072760469984, 12056.508767331969, 162.33531448401033] and parameters: {'learning_rate': 0.004959492953216965, 'norm': 'None', 'weight_decay': 0.00021879272338152107, 'train_batch_size': 62, 'training_loss': 'xtanh', 'model_name': 'deeplabv3+'}. [0m
INFO:echo.src.base_objective:Attempting to automatically update the model configuration using optuna's suggested parameters
INFO:echo.src.base_objective:	data:norm : zscore
INFO:echo.src.base_objective:	model:name : unet++
INFO:echo.src.base_objective:	optimizer:learning_rate : 1.0408588226170338e-05
INFO:echo.src.base_objective:	trainer:train_batch_size : 108
INFO:echo.src.base_objective:	trainer:weight_decay : 1.011708817690221e-09
INFO:echo.src.base_objective:	trainer:training_loss : xsigmoid
INFO:echo.src.base_objective:Beginning trial 61
INFO:root:Loading model unet++ with settings {'in_channels': 4, 'classes': 1, 'activation': 'sigmoid'}
INFO:root:Loading loss smooth
INFO:root:Loading loss smooth
INFO:echo.src.base_objective:Saving trial 61 results to local file /glade/work/kdagon/s2sml/results_week3_SH_510/trial_results/trial_results_29300.gusched01.csv
INFO:echo.src.base_objective:Merging trial results and saving to /glade/work/kdagon/s2sml/results_week3_SH_510/trial_results.csv
[32m[I 2023-05-11 03:31:50,896][0m Trial 61 finished with values: [1.0442012287706763, 4.592138331110943, 2.47503965967543] and parameters: {'learning_rate': 1.0408588226170338e-05, 'norm': 'zscore', 'weight_decay': 1.011708817690221e-09, 'train_batch_size': 108, 'training_loss': 'xsigmoid', 'model_name': 'unet++'}. [0m
INFO:echo.src.base_objective:Attempting to automatically update the model configuration using optuna's suggested parameters
INFO:echo.src.base_objective:	data:norm : minmax
INFO:echo.src.base_objective:	model:name : deeplabv3+
INFO:echo.src.base_objective:	optimizer:learning_rate : 1.2820408239553284e-05
INFO:echo.src.base_objective:	trainer:train_batch_size : 102
INFO:echo.src.base_objective:	trainer:weight_decay : 0.0006839597384025426
INFO:echo.src.base_objective:	trainer:training_loss : xtanh
INFO:echo.src.base_objective:Beginning trial 62
INFO:root:Loading model deeplabv3+ with settings {'in_channels': 4, 'classes': 1, 'activation': 'sigmoid'}
INFO:root:Loading loss smooth
INFO:root:Loading loss smooth
INFO:echo.src.base_objective:Saving trial 62 results to local file /glade/work/kdagon/s2sml/results_week3_SH_510/trial_results/trial_results_29300.gusched01.csv
INFO:echo.src.base_objective:Merging trial results and saving to /glade/work/kdagon/s2sml/results_week3_SH_510/trial_results.csv
[32m[I 2023-05-11 03:44:49,976][0m Trial 62 finished with values: [1.0925063650875468, 2.333544586726199, 1.757947628114529] and parameters: {'learning_rate': 1.2820408239553284e-05, 'norm': 'minmax', 'weight_decay': 0.0006839597384025426, 'train_batch_size': 102, 'training_loss': 'xtanh', 'model_name': 'deeplabv3+'}. [0m
WARNING:root:Stopping early since the longest observed run-time in the study exceeds the time remaining on this node.
INFO:root:Saving trial details to /glade/work/kdagon/s2sml/results_week3_SH_510/
INFO:root:Running on PBS/SLURM batch id: 29301.gusched01
INFO:root:Importing custom objective from /glade/work/kdagon/s2sml/applications/train.py
INFO:echo.src.reporting:Using device 0
INFO:root:Direction of optimization: ['minimize', 'minimize', 'minimize']
INFO:root:Using metric ['valid_custom', 'valid_custom_second', 'valid_custom_third']
[32m[I 2023-05-11 03:45:48,486][0m Using an existing study with name 'vanilla' instead of creating a new one.[0m
INFO:root:Loaded study vanilla located at sqlite:////glade/work/kdagon/s2sml/results_week3_SH_510/s2s.db
INFO:echo.src.base_objective:Worker 29301.gusched01 is summoned.
INFO:echo.src.base_objective:	initializing an objective to be optimized with metric ['valid_custom', 'valid_custom_second', 'valid_custom_third']
INFO:echo.src.base_objective:	using device(s) cuda:0
INFO:echo.src.base_objective:	saving study/trial results to local file /glade/work/kdagon/s2sml/results_week3_SH_510/trial_results/trial_results_29301.gusched01.csv
INFO:root:Running optimization for 1000 trials
INFO:root:Running trials for a maximum PBS wall-time 2:00:00
WARNING:root:Attempting to run trials and stop before hitting the wall-time
WARNING:root:Some trials may not complete if the wall-time is reached. Optuna will start over.
INFO:echo.src.base_objective:Attempting to automatically update the model configuration using optuna's suggested parameters
INFO:echo.src.base_objective:	data:norm : None
INFO:echo.src.base_objective:	model:name : manet
INFO:echo.src.base_objective:	optimizer:learning_rate : 0.0008052474331700542
INFO:echo.src.base_objective:	trainer:train_batch_size : 127
INFO:echo.src.base_objective:	trainer:weight_decay : 6.806193434353103e-09
INFO:echo.src.base_objective:	trainer:training_loss : huber
INFO:echo.src.base_objective:Beginning trial 63
INFO:root:Loading model manet with settings {'in_channels': 4, 'classes': 1, 'activation': 'sigmoid'}
INFO:root:Loading loss smooth
INFO:root:Loading loss smooth
INFO:echo.src.base_objective:Saving trial 63 results to local file /glade/work/kdagon/s2sml/results_week3_SH_510/trial_results/trial_results_29301.gusched01.csv
INFO:echo.src.base_objective:Merging trial results and saving to /glade/work/kdagon/s2sml/results_week3_SH_510/trial_results.csv
[32m[I 2023-05-11 03:50:10,686][0m Trial 63 finished with values: [36217.91492135772, 12100.211140890919, 162.62757173095815] and parameters: {'learning_rate': 0.0008052474331700542, 'norm': 'None', 'weight_decay': 6.806193434353103e-09, 'train_batch_size': 127, 'training_loss': 'huber', 'model_name': 'manet'}. [0m
INFO:echo.src.base_objective:Attempting to automatically update the model configuration using optuna's suggested parameters
INFO:echo.src.base_objective:	data:norm : None
INFO:echo.src.base_objective:	model:name : fpn
INFO:echo.src.base_objective:	optimizer:learning_rate : 1.423438134327314e-06
INFO:echo.src.base_objective:	trainer:train_batch_size : 46
INFO:echo.src.base_objective:	trainer:weight_decay : 7.578711901169819e-09
INFO:echo.src.base_objective:	trainer:training_loss : smooth
INFO:echo.src.base_objective:Beginning trial 64
INFO:root:Loading model fpn with settings {'in_channels': 4, 'classes': 1, 'activation': 'sigmoid'}
INFO:root:Loading loss smooth
INFO:root:Loading loss smooth
INFO:echo.src.base_objective:Saving trial 64 results to local file /glade/work/kdagon/s2sml/results_week3_SH_510/trial_results/trial_results_29301.gusched01.csv
INFO:echo.src.base_objective:Merging trial results and saving to /glade/work/kdagon/s2sml/results_week3_SH_510/trial_results.csv
[32m[I 2023-05-11 03:52:39,290][0m Trial 64 finished with values: [6.755134882008502, 12133.838796072358, 162.85550825734077] and parameters: {'learning_rate': 1.423438134327314e-06, 'norm': 'None', 'weight_decay': 7.578711901169819e-09, 'train_batch_size': 46, 'training_loss': 'smooth', 'model_name': 'fpn'}. [0m
INFO:echo.src.base_objective:Attempting to automatically update the model configuration using optuna's suggested parameters
INFO:echo.src.base_objective:	data:norm : zscore
INFO:echo.src.base_objective:	model:name : fpn
INFO:echo.src.base_objective:	optimizer:learning_rate : 2.5381430615836986e-06
INFO:echo.src.base_objective:	trainer:train_batch_size : 78
INFO:echo.src.base_objective:	trainer:weight_decay : 7.473596556792399e-11
INFO:echo.src.base_objective:	trainer:training_loss : xtanh
INFO:echo.src.base_objective:Beginning trial 65
INFO:root:Loading model fpn with settings {'in_channels': 4, 'classes': 1, 'activation': 'sigmoid'}
INFO:root:Loading loss smooth
INFO:root:Loading loss smooth
INFO:echo.src.base_objective:Saving trial 65 results to local file /glade/work/kdagon/s2sml/results_week3_SH_510/trial_results/trial_results_29301.gusched01.csv
INFO:echo.src.base_objective:Merging trial results and saving to /glade/work/kdagon/s2sml/results_week3_SH_510/trial_results.csv
[32m[I 2023-05-11 04:26:22,294][0m Trial 65 finished with values: [1.2257703048214537, 3.91123834000882, 2.2006562464551505] and parameters: {'learning_rate': 2.5381430615836986e-06, 'norm': 'zscore', 'weight_decay': 7.473596556792399e-11, 'train_batch_size': 78, 'training_loss': 'xtanh', 'model_name': 'fpn'}. [0m
INFO:echo.src.base_objective:Attempting to automatically update the model configuration using optuna's suggested parameters
INFO:echo.src.base_objective:	data:norm : None
INFO:echo.src.base_objective:	model:name : unet
INFO:echo.src.base_objective:	optimizer:learning_rate : 0.0032241365564022522
INFO:echo.src.base_objective:	trainer:train_batch_size : 66
INFO:echo.src.base_objective:	trainer:weight_decay : 3.2650410508867e-11
INFO:echo.src.base_objective:	trainer:training_loss : xsigmoid
INFO:echo.src.base_objective:Beginning trial 66
INFO:root:Loading model unet with settings {'in_channels': 4, 'classes': 1, 'activation': 'sigmoid'}
INFO:root:Loading loss smooth
INFO:root:Loading loss smooth
INFO:echo.src.base_objective:Saving trial 66 results to local file /glade/work/kdagon/s2sml/results_week3_SH_510/trial_results/trial_results_29301.gusched01.csv
INFO:echo.src.base_objective:Merging trial results and saving to /glade/work/kdagon/s2sml/results_week3_SH_510/trial_results.csv
[32m[I 2023-05-11 04:30:19,437][0m Trial 66 finished with values: [127.91340588588837, 12056.537079275335, 162.3355054110632] and parameters: {'learning_rate': 0.0032241365564022522, 'norm': 'None', 'weight_decay': 3.2650410508867e-11, 'train_batch_size': 66, 'training_loss': 'xsigmoid', 'model_name': 'unet'}. [0m
INFO:echo.src.base_objective:Attempting to automatically update the model configuration using optuna's suggested parameters
INFO:echo.src.base_objective:	data:norm : minmax
INFO:echo.src.base_objective:	model:name : manet
INFO:echo.src.base_objective:	optimizer:learning_rate : 3.808535096663436e-06
INFO:echo.src.base_objective:	trainer:train_batch_size : 75
INFO:echo.src.base_objective:	trainer:weight_decay : 7.940965071491093e-12
INFO:echo.src.base_objective:	trainer:training_loss : mse
INFO:echo.src.base_objective:Beginning trial 67
INFO:root:Loading model manet with settings {'in_channels': 4, 'classes': 1, 'activation': 'sigmoid'}
INFO:root:Loading loss smooth
INFO:root:Loading loss smooth
INFO:echo.src.base_objective:Saving trial 67 results to local file /glade/work/kdagon/s2sml/results_week3_SH_510/trial_results/trial_results_29301.gusched01.csv
INFO:echo.src.base_objective:Merging trial results and saving to /glade/work/kdagon/s2sml/results_week3_SH_510/trial_results.csv
[32m[I 2023-05-11 04:37:53,848][0m Trial 67 finished with values: [12.663014732855684, 24.600871403753462, 5.525497205110187] and parameters: {'learning_rate': 3.808535096663436e-06, 'norm': 'minmax', 'weight_decay': 7.940965071491093e-12, 'train_batch_size': 75, 'training_loss': 'mse', 'model_name': 'manet'}. [0m
INFO:echo.src.base_objective:Attempting to automatically update the model configuration using optuna's suggested parameters
INFO:echo.src.base_objective:	data:norm : minmax
INFO:echo.src.base_objective:	model:name : unet++
INFO:echo.src.base_objective:	optimizer:learning_rate : 0.004508363943049777
INFO:echo.src.base_objective:	trainer:train_batch_size : 62
INFO:echo.src.base_objective:	trainer:weight_decay : 4.0161504968463736e-07
INFO:echo.src.base_objective:	trainer:training_loss : mse
INFO:echo.src.base_objective:Beginning trial 68
INFO:root:Loading model unet++ with settings {'in_channels': 4, 'classes': 1, 'activation': 'sigmoid'}
INFO:root:Loading loss smooth
INFO:root:Loading loss smooth
INFO:echo.src.base_objective:Saving trial 68 results to local file /glade/work/kdagon/s2sml/results_week3_SH_510/trial_results/trial_results_29301.gusched01.csv
INFO:echo.src.base_objective:Merging trial results and saving to /glade/work/kdagon/s2sml/results_week3_SH_510/trial_results.csv
[32m[I 2023-05-11 04:57:29,484][0m Trial 68 finished with values: [0.9598975411793804, 0.37476556817569184, 0.6604199577027416] and parameters: {'learning_rate': 0.004508363943049777, 'norm': 'minmax', 'weight_decay': 4.0161504968463736e-07, 'train_batch_size': 62, 'training_loss': 'mse', 'model_name': 'unet++'}. [0m
INFO:echo.src.base_objective:Attempting to automatically update the model configuration using optuna's suggested parameters
INFO:echo.src.base_objective:	data:norm : None
INFO:echo.src.base_objective:	model:name : fpn
INFO:echo.src.base_objective:	optimizer:learning_rate : 9.612327184800803e-06
INFO:echo.src.base_objective:	trainer:train_batch_size : 29
INFO:echo.src.base_objective:	trainer:weight_decay : 3.735083479733766e-10
INFO:echo.src.base_objective:	trainer:training_loss : logcosh
INFO:echo.src.base_objective:Beginning trial 69
INFO:root:Loading model fpn with settings {'in_channels': 4, 'classes': 1, 'activation': 'sigmoid'}
INFO:root:Loading loss smooth
INFO:root:Loading loss smooth
INFO:echo.src.base_objective:Saving trial 69 results to local file /glade/work/kdagon/s2sml/results_week3_SH_510/trial_results/trial_results_29301.gusched01.csv
INFO:echo.src.base_objective:Merging trial results and saving to /glade/work/kdagon/s2sml/results_week3_SH_510/trial_results.csv
[32m[I 2023-05-11 04:59:59,982][0m Trial 69 finished with values: [3.636560598982861, 12065.635324504106, 162.39730936593133] and parameters: {'learning_rate': 9.612327184800803e-06, 'norm': 'None', 'weight_decay': 3.735083479733766e-10, 'train_batch_size': 29, 'training_loss': 'logcosh', 'model_name': 'fpn'}. [0m
INFO:echo.src.base_objective:Attempting to automatically update the model configuration using optuna's suggested parameters
INFO:echo.src.base_objective:	data:norm : minmax
INFO:echo.src.base_objective:	model:name : manet
INFO:echo.src.base_objective:	optimizer:learning_rate : 1.2311762612224088e-05
INFO:echo.src.base_objective:	trainer:train_batch_size : 99
INFO:echo.src.base_objective:	trainer:weight_decay : 5.233445223836726e-12
INFO:echo.src.base_objective:	trainer:training_loss : logcosh
INFO:echo.src.base_objective:Beginning trial 70
INFO:root:Loading model manet with settings {'in_channels': 4, 'classes': 1, 'activation': 'sigmoid'}
INFO:root:Loading loss smooth
INFO:root:Loading loss smooth
INFO:echo.src.base_objective:Saving trial 70 results to local file /glade/work/kdagon/s2sml/results_week3_SH_510/trial_results/trial_results_29301.gusched01.csv
INFO:echo.src.base_objective:Merging trial results and saving to /glade/work/kdagon/s2sml/results_week3_SH_510/trial_results.csv
