[32m[I 2023-05-11 05:28:44,964][0m Trial 70 finished with values: [1.3964520099391493, 3.9182448948535398, 2.236579914933047] and parameters: {'learning_rate': 1.2311762612224088e-05, 'norm': 'minmax', 'weight_decay': 5.233445223836726e-12, 'train_batch_size': 99, 'training_loss': 'logcosh', 'model_name': 'manet'}. [0m
WARNING:root:Stopping early since the longest observed run-time in the study exceeds the time remaining on this node.
INFO:root:Saving trial details to /glade/work/kdagon/s2sml/results_week3_SH_510/
INFO:root:Running on PBS/SLURM batch id: 29302.gusched01
INFO:root:Importing custom objective from /glade/work/kdagon/s2sml/applications/train.py
INFO:echo.src.reporting:Using device 0
INFO:root:Direction of optimization: ['minimize', 'minimize', 'minimize']
INFO:root:Using metric ['valid_custom', 'valid_custom_second', 'valid_custom_third']
[32m[I 2023-05-11 05:29:10,762][0m Using an existing study with name 'vanilla' instead of creating a new one.[0m
INFO:root:Loaded study vanilla located at sqlite:////glade/work/kdagon/s2sml/results_week3_SH_510/s2s.db
INFO:echo.src.base_objective:Worker 29302.gusched01 is summoned.
INFO:echo.src.base_objective:	initializing an objective to be optimized with metric ['valid_custom', 'valid_custom_second', 'valid_custom_third']
INFO:echo.src.base_objective:	using device(s) cuda:0
INFO:echo.src.base_objective:	saving study/trial results to local file /glade/work/kdagon/s2sml/results_week3_SH_510/trial_results/trial_results_29302.gusched01.csv
INFO:root:Running optimization for 1000 trials
INFO:root:Running trials for a maximum PBS wall-time 2:00:00
WARNING:root:Attempting to run trials and stop before hitting the wall-time
WARNING:root:Some trials may not complete if the wall-time is reached. Optuna will start over.
INFO:echo.src.base_objective:Attempting to automatically update the model configuration using optuna's suggested parameters
INFO:echo.src.base_objective:	data:norm : zscore
INFO:echo.src.base_objective:	model:name : unet++
INFO:echo.src.base_objective:	optimizer:learning_rate : 3.1292614347148496e-05
INFO:echo.src.base_objective:	trainer:train_batch_size : 21
INFO:echo.src.base_objective:	trainer:weight_decay : 1.6168982555379746e-06
INFO:echo.src.base_objective:	trainer:training_loss : mse
INFO:echo.src.base_objective:Beginning trial 71
INFO:root:Loading model unet++ with settings {'in_channels': 4, 'classes': 1, 'activation': 'sigmoid'}
INFO:root:Loading loss smooth
INFO:root:Loading loss smooth
INFO:echo.src.base_objective:Saving trial 71 results to local file /glade/work/kdagon/s2sml/results_week3_SH_510/trial_results/trial_results_29302.gusched01.csv
INFO:echo.src.base_objective:Merging trial results and saving to /glade/work/kdagon/s2sml/results_week3_SH_510/trial_results.csv
[32m[I 2023-05-11 05:35:10,233][0m Trial 71 finished with values: [1.0438399630819108, 4.395071828465246, 2.4070528669198366] and parameters: {'learning_rate': 3.1292614347148496e-05, 'norm': 'zscore', 'weight_decay': 1.6168982555379746e-06, 'train_batch_size': 21, 'training_loss': 'mse', 'model_name': 'unet++'}. [0m
INFO:echo.src.base_objective:Attempting to automatically update the model configuration using optuna's suggested parameters
INFO:echo.src.base_objective:	data:norm : negone
INFO:echo.src.base_objective:	model:name : unet++
INFO:echo.src.base_objective:	optimizer:learning_rate : 4.8239065605886275e-06
INFO:echo.src.base_objective:	trainer:train_batch_size : 74
INFO:echo.src.base_objective:	trainer:weight_decay : 0.0007853091153196584
INFO:echo.src.base_objective:	trainer:training_loss : mae
INFO:echo.src.base_objective:Beginning trial 72
INFO:root:Loading model unet++ with settings {'in_channels': 4, 'classes': 1, 'activation': 'sigmoid'}
INFO:root:Loading loss smooth
INFO:root:Loading loss smooth
INFO:echo.src.base_objective:Saving trial 72 results to local file /glade/work/kdagon/s2sml/results_week3_SH_510/trial_results/trial_results_29302.gusched01.csv
INFO:echo.src.base_objective:Merging trial results and saving to /glade/work/kdagon/s2sml/results_week3_SH_510/trial_results.csv
[32m[I 2023-05-11 06:11:06,816][0m Trial 72 finished with values: [1.0809631725061333, 6.264962620529071, 3.2419612418999644] and parameters: {'learning_rate': 4.8239065605886275e-06, 'norm': 'negone', 'weight_decay': 0.0007853091153196584, 'train_batch_size': 74, 'training_loss': 'mae', 'model_name': 'unet++'}. [0m
INFO:echo.src.base_objective:Attempting to automatically update the model configuration using optuna's suggested parameters
INFO:echo.src.base_objective:	data:norm : zscore
INFO:echo.src.base_objective:	model:name : deeplabv3
INFO:echo.src.base_objective:	optimizer:learning_rate : 0.00017778964355196058
INFO:echo.src.base_objective:	trainer:train_batch_size : 126
INFO:echo.src.base_objective:	trainer:weight_decay : 3.0409159527147e-09
INFO:echo.src.base_objective:	trainer:training_loss : huber
INFO:echo.src.base_objective:Beginning trial 73
INFO:root:Loading model deeplabv3 with settings {'in_channels': 4, 'classes': 1, 'activation': 'sigmoid'}
INFO:root:Loading loss smooth
INFO:root:Loading loss smooth
INFO:echo.src.base_objective:Saving trial 73 results to local file /glade/work/kdagon/s2sml/results_week3_SH_510/trial_results/trial_results_29302.gusched01.csv
INFO:echo.src.base_objective:Merging trial results and saving to /glade/work/kdagon/s2sml/results_week3_SH_510/trial_results.csv
[32m[I 2023-05-11 06:16:12,381][0m Trial 73 finished with values: [1.164304197030964, 4.609601440127016, 2.4710455779891785] and parameters: {'learning_rate': 0.00017778964355196058, 'norm': 'zscore', 'weight_decay': 3.0409159527147e-09, 'train_batch_size': 126, 'training_loss': 'huber', 'model_name': 'deeplabv3'}. [0m
INFO:echo.src.base_objective:Attempting to automatically update the model configuration using optuna's suggested parameters
INFO:echo.src.base_objective:	data:norm : negone
INFO:echo.src.base_objective:	model:name : pspnet
INFO:echo.src.base_objective:	optimizer:learning_rate : 0.0003279398944665208
INFO:echo.src.base_objective:	trainer:train_batch_size : 61
INFO:echo.src.base_objective:	trainer:weight_decay : 3.0890784593504974e-09
INFO:echo.src.base_objective:	trainer:training_loss : huber
INFO:echo.src.base_objective:Beginning trial 74
INFO:root:Loading model pspnet with settings {'in_channels': 4, 'classes': 1, 'activation': 'sigmoid'}
INFO:root:Loading loss smooth
INFO:root:Loading loss smooth
INFO:echo.src.base_objective:Saving trial 74 results to local file /glade/work/kdagon/s2sml/results_week3_SH_510/trial_results/trial_results_29302.gusched01.csv
INFO:echo.src.base_objective:Merging trial results and saving to /glade/work/kdagon/s2sml/results_week3_SH_510/trial_results.csv
[32m[I 2023-05-11 06:24:20,404][0m Trial 74 finished with values: [1.0836390861996608, 1.6005705175011948, 1.2820609761530704] and parameters: {'learning_rate': 0.0003279398944665208, 'norm': 'negone', 'weight_decay': 3.0890784593504974e-09, 'train_batch_size': 61, 'training_loss': 'huber', 'model_name': 'pspnet'}. [0m
INFO:echo.src.base_objective:Attempting to automatically update the model configuration using optuna's suggested parameters
INFO:echo.src.base_objective:	data:norm : zscore
INFO:echo.src.base_objective:	model:name : manet
INFO:echo.src.base_objective:	optimizer:learning_rate : 0.004152059092265649
INFO:echo.src.base_objective:	trainer:train_batch_size : 113
INFO:echo.src.base_objective:	trainer:weight_decay : 1.2660158119643377e-08
INFO:echo.src.base_objective:	trainer:training_loss : xtanh
INFO:echo.src.base_objective:Beginning trial 75
INFO:root:Loading model manet with settings {'in_channels': 4, 'classes': 1, 'activation': 'sigmoid'}
INFO:root:Loading loss smooth
INFO:root:Loading loss smooth
INFO:echo.src.base_objective:Saving trial 75 results to local file /glade/work/kdagon/s2sml/results_week3_SH_510/trial_results/trial_results_29302.gusched01.csv
INFO:echo.src.base_objective:Merging trial results and saving to /glade/work/kdagon/s2sml/results_week3_SH_510/trial_results.csv
[32m[I 2023-05-11 06:36:36,737][0m Trial 75 finished with values: [1.1037427044773174, 3.588163026473811, 2.0388950434304096] and parameters: {'learning_rate': 0.004152059092265649, 'norm': 'zscore', 'weight_decay': 1.2660158119643377e-08, 'train_batch_size': 113, 'training_loss': 'xtanh', 'model_name': 'manet'}. [0m
INFO:echo.src.base_objective:Attempting to automatically update the model configuration using optuna's suggested parameters
INFO:echo.src.base_objective:	data:norm : zscore
INFO:echo.src.base_objective:	model:name : deeplabv3
INFO:echo.src.base_objective:	optimizer:learning_rate : 0.00014220681054283568
INFO:echo.src.base_objective:	trainer:train_batch_size : 33
INFO:echo.src.base_objective:	trainer:weight_decay : 1.8111673670835495e-11
INFO:echo.src.base_objective:	trainer:training_loss : smooth
INFO:echo.src.base_objective:Beginning trial 76
INFO:root:Loading model deeplabv3 with settings {'in_channels': 4, 'classes': 1, 'activation': 'sigmoid'}
INFO:root:Loading loss smooth
INFO:root:Loading loss smooth
INFO:echo.src.base_objective:Saving trial 76 results to local file /glade/work/kdagon/s2sml/results_week3_SH_510/trial_results/trial_results_29302.gusched01.csv
INFO:echo.src.base_objective:Merging trial results and saving to /glade/work/kdagon/s2sml/results_week3_SH_510/trial_results.csv
[32m[I 2023-05-11 06:44:43,637][0m Trial 76 finished with values: [1.16432175235691, 3.910844424832384, 2.19997228009784] and parameters: {'learning_rate': 0.00014220681054283568, 'norm': 'zscore', 'weight_decay': 1.8111673670835495e-11, 'train_batch_size': 33, 'training_loss': 'smooth', 'model_name': 'deeplabv3'}. [0m
INFO:echo.src.base_objective:Attempting to automatically update the model configuration using optuna's suggested parameters
INFO:echo.src.base_objective:	data:norm : negone
INFO:echo.src.base_objective:	model:name : deeplabv3+
INFO:echo.src.base_objective:	optimizer:learning_rate : 1.2493049468216726e-05
INFO:echo.src.base_objective:	trainer:train_batch_size : 31
INFO:echo.src.base_objective:	trainer:weight_decay : 1.4247715464603723e-09
INFO:echo.src.base_objective:	trainer:training_loss : mse
INFO:echo.src.base_objective:Beginning trial 77
INFO:root:Loading model deeplabv3+ with settings {'in_channels': 4, 'classes': 1, 'activation': 'sigmoid'}
INFO:root:Loading loss smooth
INFO:root:Loading loss smooth
INFO:echo.src.base_objective:Saving trial 77 results to local file /glade/work/kdagon/s2sml/results_week3_SH_510/trial_results/trial_results_29302.gusched01.csv
INFO:echo.src.base_objective:Merging trial results and saving to /glade/work/kdagon/s2sml/results_week3_SH_510/trial_results.csv
[32m[I 2023-05-11 06:55:52,787][0m Trial 77 finished with values: [1.0864858754193372, 4.679731308590762, 2.700621483514501] and parameters: {'learning_rate': 1.2493049468216726e-05, 'norm': 'negone', 'weight_decay': 1.4247715464603723e-09, 'train_batch_size': 31, 'training_loss': 'mse', 'model_name': 'deeplabv3+'}. [0m
WARNING:root:Stopping early since the longest observed run-time in the study exceeds the time remaining on this node.
INFO:root:Saving trial details to /glade/work/kdagon/s2sml/results_week3_SH_510/
INFO:root:Running on PBS/SLURM batch id: 29303.gusched01
INFO:root:Importing custom objective from /glade/work/kdagon/s2sml/applications/train.py
INFO:echo.src.reporting:Using device 0
INFO:root:Direction of optimization: ['minimize', 'minimize', 'minimize']
INFO:root:Using metric ['valid_custom', 'valid_custom_second', 'valid_custom_third']
[32m[I 2023-05-11 06:56:18,292][0m Using an existing study with name 'vanilla' instead of creating a new one.[0m
INFO:root:Loaded study vanilla located at sqlite:////glade/work/kdagon/s2sml/results_week3_SH_510/s2s.db
INFO:echo.src.base_objective:Worker 29303.gusched01 is summoned.
INFO:echo.src.base_objective:	initializing an objective to be optimized with metric ['valid_custom', 'valid_custom_second', 'valid_custom_third']
INFO:echo.src.base_objective:	using device(s) cuda:0
INFO:echo.src.base_objective:	saving study/trial results to local file /glade/work/kdagon/s2sml/results_week3_SH_510/trial_results/trial_results_29303.gusched01.csv
INFO:root:Running optimization for 1000 trials
INFO:root:Running trials for a maximum PBS wall-time 2:00:00
WARNING:root:Attempting to run trials and stop before hitting the wall-time
WARNING:root:Some trials may not complete if the wall-time is reached. Optuna will start over.
INFO:echo.src.base_objective:Attempting to automatically update the model configuration using optuna's suggested parameters
INFO:echo.src.base_objective:	data:norm : None
INFO:echo.src.base_objective:	model:name : unet++
INFO:echo.src.base_objective:	optimizer:learning_rate : 0.005063107619297649
INFO:echo.src.base_objective:	trainer:train_batch_size : 84
INFO:echo.src.base_objective:	trainer:weight_decay : 3.943862478784006e-10
INFO:echo.src.base_objective:	trainer:training_loss : mae
INFO:echo.src.base_objective:Beginning trial 78
INFO:root:Loading model unet++ with settings {'in_channels': 4, 'classes': 1, 'activation': 'sigmoid'}
INFO:root:Loading loss smooth
INFO:root:Loading loss smooth
INFO:echo.src.base_objective:Saving trial 78 results to local file /glade/work/kdagon/s2sml/results_week3_SH_510/trial_results/trial_results_29303.gusched01.csv
INFO:echo.src.base_objective:Merging trial results and saving to /glade/work/kdagon/s2sml/results_week3_SH_510/trial_results.csv
[32m[I 2023-05-11 06:59:56,741][0m Trial 78 finished with values: [32.50837859742976, 12056.570013576802, 162.3357223736233] and parameters: {'learning_rate': 0.005063107619297649, 'norm': 'None', 'weight_decay': 3.943862478784006e-10, 'train_batch_size': 84, 'training_loss': 'mae', 'model_name': 'unet++'}. [0m
INFO:echo.src.base_objective:Attempting to automatically update the model configuration using optuna's suggested parameters
INFO:echo.src.base_objective:	data:norm : None
INFO:echo.src.base_objective:	model:name : pspnet
INFO:echo.src.base_objective:	optimizer:learning_rate : 0.0003266921352040603
INFO:echo.src.base_objective:	trainer:train_batch_size : 93
INFO:echo.src.base_objective:	trainer:weight_decay : 1.9800097972386807e-06
INFO:echo.src.base_objective:	trainer:training_loss : huber
INFO:echo.src.base_objective:Beginning trial 79
INFO:root:Loading model pspnet with settings {'in_channels': 4, 'classes': 1, 'activation': 'sigmoid'}
INFO:root:Loading loss smooth
INFO:root:Loading loss smooth
INFO:echo.src.base_objective:Saving trial 79 results to local file /glade/work/kdagon/s2sml/results_week3_SH_510/trial_results/trial_results_29303.gusched01.csv
INFO:echo.src.base_objective:Merging trial results and saving to /glade/work/kdagon/s2sml/results_week3_SH_510/trial_results.csv
[32m[I 2023-05-11 07:02:18,666][0m Trial 79 finished with values: [3.416676744753702, 12057.274345392372, 162.34050422844774] and parameters: {'learning_rate': 0.0003266921352040603, 'norm': 'None', 'weight_decay': 1.9800097972386807e-06, 'train_batch_size': 93, 'training_loss': 'huber', 'model_name': 'pspnet'}. [0m
INFO:echo.src.base_objective:Attempting to automatically update the model configuration using optuna's suggested parameters
INFO:echo.src.base_objective:	data:norm : minmax
INFO:echo.src.base_objective:	model:name : manet
INFO:echo.src.base_objective:	optimizer:learning_rate : 0.007480966246918205
INFO:echo.src.base_objective:	trainer:train_batch_size : 49
INFO:echo.src.base_objective:	trainer:weight_decay : 5.172674160325877e-06
INFO:echo.src.base_objective:	trainer:training_loss : huber
INFO:echo.src.base_objective:Beginning trial 80
INFO:root:Loading model manet with settings {'in_channels': 4, 'classes': 1, 'activation': 'sigmoid'}
INFO:root:Loading loss smooth
INFO:root:Loading loss smooth
INFO:echo.src.base_objective:Saving trial 80 results to local file /glade/work/kdagon/s2sml/results_week3_SH_510/trial_results/trial_results_29303.gusched01.csv
INFO:echo.src.base_objective:Merging trial results and saving to /glade/work/kdagon/s2sml/results_week3_SH_510/trial_results.csv
[32m[I 2023-05-11 07:23:46,710][0m Trial 80 finished with values: [0.9618690303631297, 0.3985078613253062, 0.6830091695880637] and parameters: {'learning_rate': 0.007480966246918205, 'norm': 'minmax', 'weight_decay': 5.172674160325877e-06, 'train_batch_size': 49, 'training_loss': 'huber', 'model_name': 'manet'}. [0m
INFO:echo.src.base_objective:Attempting to automatically update the model configuration using optuna's suggested parameters
INFO:echo.src.base_objective:	data:norm : zscore
INFO:echo.src.base_objective:	model:name : unet++
INFO:echo.src.base_objective:	optimizer:learning_rate : 9.828151627432369e-06
INFO:echo.src.base_objective:	trainer:train_batch_size : 83
INFO:echo.src.base_objective:	trainer:weight_decay : 2.732128729400272e-09
INFO:echo.src.base_objective:	trainer:training_loss : mse
INFO:echo.src.base_objective:Beginning trial 81
INFO:root:Loading model unet++ with settings {'in_channels': 4, 'classes': 1, 'activation': 'sigmoid'}
INFO:root:Loading loss smooth
INFO:root:Loading loss smooth
INFO:echo.src.base_objective:Saving trial 81 results to local file /glade/work/kdagon/s2sml/results_week3_SH_510/trial_results/trial_results_29303.gusched01.csv
INFO:echo.src.base_objective:Merging trial results and saving to /glade/work/kdagon/s2sml/results_week3_SH_510/trial_results.csv
[32m[I 2023-05-11 07:57:01,341][0m Trial 81 finished with values: [1.0428655317292164, 4.50829106282033, 2.4470361276107533] and parameters: {'learning_rate': 9.828151627432369e-06, 'norm': 'zscore', 'weight_decay': 2.732128729400272e-09, 'train_batch_size': 83, 'training_loss': 'mse', 'model_name': 'unet++'}. [0m
INFO:echo.src.base_objective:Attempting to automatically update the model configuration using optuna's suggested parameters
INFO:echo.src.base_objective:	data:norm : minmax
INFO:echo.src.base_objective:	model:name : fpn
INFO:echo.src.base_objective:	optimizer:learning_rate : 0.001516989299684817
INFO:echo.src.base_objective:	trainer:train_batch_size : 99
INFO:echo.src.base_objective:	trainer:weight_decay : 9.064274968687644e-05
INFO:echo.src.base_objective:	trainer:training_loss : huber
INFO:echo.src.base_objective:Beginning trial 82
INFO:root:Loading model fpn with settings {'in_channels': 4, 'classes': 1, 'activation': 'sigmoid'}
INFO:root:Loading loss smooth
INFO:root:Loading loss smooth
INFO:echo.src.base_objective:Saving trial 82 results to local file /glade/work/kdagon/s2sml/results_week3_SH_510/trial_results/trial_results_29303.gusched01.csv
INFO:echo.src.base_objective:Merging trial results and saving to /glade/work/kdagon/s2sml/results_week3_SH_510/trial_results.csv
[32m[I 2023-05-11 08:00:12,660][0m Trial 82 finished with values: [10.543798673087215, 84.2483725130408, 13.046016045350006] and parameters: {'learning_rate': 0.001516989299684817, 'norm': 'minmax', 'weight_decay': 9.064274968687644e-05, 'train_batch_size': 99, 'training_loss': 'huber', 'model_name': 'fpn'}. [0m
INFO:echo.src.base_objective:Attempting to automatically update the model configuration using optuna's suggested parameters
INFO:echo.src.base_objective:	data:norm : zscore
INFO:echo.src.base_objective:	model:name : pspnet
INFO:echo.src.base_objective:	optimizer:learning_rate : 7.891025767227172e-05
INFO:echo.src.base_objective:	trainer:train_batch_size : 37
INFO:echo.src.base_objective:	trainer:weight_decay : 5.336046030288526e-06
INFO:echo.src.base_objective:	trainer:training_loss : mse
INFO:echo.src.base_objective:Beginning trial 83
INFO:root:Loading model pspnet with settings {'in_channels': 4, 'classes': 1, 'activation': 'sigmoid'}
INFO:root:Loading loss smooth
INFO:root:Loading loss smooth
INFO:echo.src.base_objective:Saving trial 83 results to local file /glade/work/kdagon/s2sml/results_week3_SH_510/trial_results/trial_results_29303.gusched01.csv
INFO:echo.src.base_objective:Merging trial results and saving to /glade/work/kdagon/s2sml/results_week3_SH_510/trial_results.csv
[32m[I 2023-05-11 08:03:33,216][0m Trial 83 finished with values: [1.1821589763998757, 3.929216465529627, 2.2150776975101047] and parameters: {'learning_rate': 7.891025767227172e-05, 'norm': 'zscore', 'weight_decay': 5.336046030288526e-06, 'train_batch_size': 37, 'training_loss': 'mse', 'model_name': 'pspnet'}. [0m
INFO:echo.src.base_objective:Attempting to automatically update the model configuration using optuna's suggested parameters
INFO:echo.src.base_objective:	data:norm : zscore
INFO:echo.src.base_objective:	model:name : manet
INFO:echo.src.base_objective:	optimizer:learning_rate : 0.0002597260194933242
INFO:echo.src.base_objective:	trainer:train_batch_size : 90
INFO:echo.src.base_objective:	trainer:weight_decay : 2.8968496567313772e-05
INFO:echo.src.base_objective:	trainer:training_loss : smooth
INFO:echo.src.base_objective:Beginning trial 84
INFO:root:Loading model manet with settings {'in_channels': 4, 'classes': 1, 'activation': 'sigmoid'}
INFO:root:Loading loss smooth
INFO:root:Loading loss smooth
INFO:echo.src.base_objective:Saving trial 84 results to local file /glade/work/kdagon/s2sml/results_week3_SH_510/trial_results/trial_results_29303.gusched01.csv
INFO:echo.src.base_objective:Merging trial results and saving to /glade/work/kdagon/s2sml/results_week3_SH_510/trial_results.csv
