[32m[I 2023-05-11 08:11:06,378][0m Trial 84 finished with values: [1.064438514355781, 3.905288061748051, 2.201860946580695] and parameters: {'learning_rate': 0.0002597260194933242, 'norm': 'zscore', 'weight_decay': 2.8968496567313772e-05, 'train_batch_size': 90, 'training_loss': 'smooth', 'model_name': 'manet'}. [0m
INFO:echo.src.base_objective:Attempting to automatically update the model configuration using optuna's suggested parameters
INFO:echo.src.base_objective:	data:norm : zscore
INFO:echo.src.base_objective:	model:name : unet++
INFO:echo.src.base_objective:	optimizer:learning_rate : 6.046143842792285e-06
INFO:echo.src.base_objective:	trainer:train_batch_size : 110
INFO:echo.src.base_objective:	trainer:weight_decay : 1.2446154003273245e-08
INFO:echo.src.base_objective:	trainer:training_loss : logcosh
INFO:echo.src.base_objective:Beginning trial 85
INFO:root:Loading model unet++ with settings {'in_channels': 4, 'classes': 1, 'activation': 'sigmoid'}
INFO:root:Loading loss smooth
INFO:root:Loading loss smooth
INFO:echo.src.base_objective:Saving trial 85 results to local file /glade/work/kdagon/s2sml/results_week3_SH_510/trial_results/trial_results_29303.gusched01.csv
INFO:echo.src.base_objective:Merging trial results and saving to /glade/work/kdagon/s2sml/results_week3_SH_510/trial_results.csv
[32m[I 2023-05-11 08:45:31,585][0m Trial 85 finished with values: [1.0554896119894555, 4.877259461587045, 2.5701261937781092] and parameters: {'learning_rate': 6.046143842792285e-06, 'norm': 'zscore', 'weight_decay': 1.2446154003273245e-08, 'train_batch_size': 110, 'training_loss': 'logcosh', 'model_name': 'unet++'}. [0m
WARNING:root:Stopping early since the longest observed run-time in the study exceeds the time remaining on this node.
INFO:root:Saving trial details to /glade/work/kdagon/s2sml/results_week3_SH_510/
INFO:root:Running on PBS/SLURM batch id: 29304.gusched01
INFO:root:Importing custom objective from /glade/work/kdagon/s2sml/applications/train.py
INFO:echo.src.reporting:Using device 0
INFO:root:Direction of optimization: ['minimize', 'minimize', 'minimize']
INFO:root:Using metric ['valid_custom', 'valid_custom_second', 'valid_custom_third']
[32m[I 2023-05-11 08:46:36,253][0m Using an existing study with name 'vanilla' instead of creating a new one.[0m
INFO:root:Loaded study vanilla located at sqlite:////glade/work/kdagon/s2sml/results_week3_SH_510/s2s.db
INFO:echo.src.base_objective:Worker 29304.gusched01 is summoned.
INFO:echo.src.base_objective:	initializing an objective to be optimized with metric ['valid_custom', 'valid_custom_second', 'valid_custom_third']
INFO:echo.src.base_objective:	using device(s) cuda:0
INFO:echo.src.base_objective:	saving study/trial results to local file /glade/work/kdagon/s2sml/results_week3_SH_510/trial_results/trial_results_29304.gusched01.csv
INFO:root:Running optimization for 1000 trials
INFO:root:Running trials for a maximum PBS wall-time 2:00:00
WARNING:root:Attempting to run trials and stop before hitting the wall-time
WARNING:root:Some trials may not complete if the wall-time is reached. Optuna will start over.
INFO:echo.src.base_objective:Attempting to automatically update the model configuration using optuna's suggested parameters
INFO:echo.src.base_objective:	data:norm : negone
INFO:echo.src.base_objective:	model:name : deeplabv3+
INFO:echo.src.base_objective:	optimizer:learning_rate : 7.293883255701389e-05
INFO:echo.src.base_objective:	trainer:train_batch_size : 9
INFO:echo.src.base_objective:	trainer:weight_decay : 3.9863254111285986e-12
INFO:echo.src.base_objective:	trainer:training_loss : logcosh
INFO:echo.src.base_objective:Beginning trial 86
INFO:root:Loading model deeplabv3+ with settings {'in_channels': 4, 'classes': 1, 'activation': 'sigmoid'}
INFO:root:Loading loss smooth
INFO:root:Loading loss smooth
INFO:echo.src.base_objective:Saving trial 86 results to local file /glade/work/kdagon/s2sml/results_week3_SH_510/trial_results/trial_results_29304.gusched01.csv
INFO:echo.src.base_objective:Merging trial results and saving to /glade/work/kdagon/s2sml/results_week3_SH_510/trial_results.csv
[32m[I 2023-05-11 08:52:30,407][0m Trial 86 finished with values: [1.039486784950891, 1.5363719434103658, 1.2772897028893286] and parameters: {'learning_rate': 7.293883255701389e-05, 'norm': 'negone', 'weight_decay': 3.9863254111285986e-12, 'train_batch_size': 9, 'training_loss': 'logcosh', 'model_name': 'deeplabv3+'}. [0m
INFO:echo.src.base_objective:Attempting to automatically update the model configuration using optuna's suggested parameters
INFO:echo.src.base_objective:	data:norm : zscore
INFO:echo.src.base_objective:	model:name : deeplabv3+
INFO:echo.src.base_objective:	optimizer:learning_rate : 4.560638978759699e-06
INFO:echo.src.base_objective:	trainer:train_batch_size : 76
INFO:echo.src.base_objective:	trainer:weight_decay : 3.436289606289613e-05
INFO:echo.src.base_objective:	trainer:training_loss : mae
INFO:echo.src.base_objective:Beginning trial 87
INFO:root:Loading model deeplabv3+ with settings {'in_channels': 4, 'classes': 1, 'activation': 'sigmoid'}
INFO:root:Loading loss smooth
INFO:root:Loading loss smooth
INFO:echo.src.base_objective:Saving trial 87 results to local file /glade/work/kdagon/s2sml/results_week3_SH_510/trial_results/trial_results_29304.gusched01.csv
INFO:echo.src.base_objective:Merging trial results and saving to /glade/work/kdagon/s2sml/results_week3_SH_510/trial_results.csv
[32m[I 2023-05-11 09:18:00,524][0m Trial 87 finished with values: [1.1663251185511145, 4.794776790316289, 2.5303052150239855] and parameters: {'learning_rate': 4.560638978759699e-06, 'norm': 'zscore', 'weight_decay': 3.436289606289613e-05, 'train_batch_size': 76, 'training_loss': 'mae', 'model_name': 'deeplabv3+'}. [0m
INFO:echo.src.base_objective:Attempting to automatically update the model configuration using optuna's suggested parameters
INFO:echo.src.base_objective:	data:norm : None
INFO:echo.src.base_objective:	model:name : linknet
INFO:echo.src.base_objective:	optimizer:learning_rate : 0.0015900333284344548
INFO:echo.src.base_objective:	trainer:train_batch_size : 40
INFO:echo.src.base_objective:	trainer:weight_decay : 3.3465294689368225e-06
INFO:echo.src.base_objective:	trainer:training_loss : logcosh
INFO:echo.src.base_objective:Beginning trial 88
INFO:root:Loading model linknet with settings {'in_channels': 4, 'classes': 1, 'activation': 'sigmoid'}
INFO:root:Loading loss smooth
INFO:root:Loading loss smooth
INFO:echo.src.base_objective:Saving trial 88 results to local file /glade/work/kdagon/s2sml/results_week3_SH_510/trial_results/trial_results_29304.gusched01.csv
INFO:echo.src.base_objective:Merging trial results and saving to /glade/work/kdagon/s2sml/results_week3_SH_510/trial_results.csv
[32m[I 2023-05-11 09:22:36,068][0m Trial 88 finished with values: [41.278596846718834, 12058.032989915622, 162.34557681310272] and parameters: {'learning_rate': 0.0015900333284344548, 'norm': 'None', 'weight_decay': 3.3465294689368225e-06, 'train_batch_size': 40, 'training_loss': 'logcosh', 'model_name': 'linknet'}. [0m
INFO:echo.src.base_objective:Attempting to automatically update the model configuration using optuna's suggested parameters
INFO:echo.src.base_objective:	data:norm : None
INFO:echo.src.base_objective:	model:name : unet++
INFO:echo.src.base_objective:	optimizer:learning_rate : 0.00014827007638569404
INFO:echo.src.base_objective:	trainer:train_batch_size : 19
INFO:echo.src.base_objective:	trainer:weight_decay : 7.260787765373819e-09
INFO:echo.src.base_objective:	trainer:training_loss : xtanh
INFO:echo.src.base_objective:Beginning trial 89
INFO:root:Loading model unet++ with settings {'in_channels': 4, 'classes': 1, 'activation': 'sigmoid'}
INFO:root:Loading loss smooth
INFO:root:Loading loss smooth
INFO:echo.src.base_objective:Saving trial 89 results to local file /glade/work/kdagon/s2sml/results_week3_SH_510/trial_results/trial_results_29304.gusched01.csv
INFO:echo.src.base_objective:Merging trial results and saving to /glade/work/kdagon/s2sml/results_week3_SH_510/trial_results.csv
[32m[I 2023-05-11 09:26:23,985][0m Trial 89 finished with values: [15.071987933012506, 12065.513120911824, 162.39601626907316] and parameters: {'learning_rate': 0.00014827007638569404, 'norm': 'None', 'weight_decay': 7.260787765373819e-09, 'train_batch_size': 19, 'training_loss': 'xtanh', 'model_name': 'unet++'}. [0m
INFO:echo.src.base_objective:Attempting to automatically update the model configuration using optuna's suggested parameters
INFO:echo.src.base_objective:	data:norm : negone
INFO:echo.src.base_objective:	model:name : pspnet
INFO:echo.src.base_objective:	optimizer:learning_rate : 3.7683681148160743e-06
INFO:echo.src.base_objective:	trainer:train_batch_size : 29
INFO:echo.src.base_objective:	trainer:weight_decay : 2.5754128362219433e-09
INFO:echo.src.base_objective:	trainer:training_loss : smooth
INFO:echo.src.base_objective:Beginning trial 90
INFO:root:Loading model pspnet with settings {'in_channels': 4, 'classes': 1, 'activation': 'sigmoid'}
INFO:root:Loading loss smooth
INFO:root:Loading loss smooth
INFO:echo.src.base_objective:Saving trial 90 results to local file /glade/work/kdagon/s2sml/results_week3_SH_510/trial_results/trial_results_29304.gusched01.csv
INFO:echo.src.base_objective:Merging trial results and saving to /glade/work/kdagon/s2sml/results_week3_SH_510/trial_results.csv
[32m[I 2023-05-11 09:58:50,280][0m Trial 90 finished with values: [1.098901517145578, 1.7152711864899224, 1.3582913148889428] and parameters: {'learning_rate': 3.7683681148160743e-06, 'norm': 'negone', 'weight_decay': 2.5754128362219433e-09, 'train_batch_size': 29, 'training_loss': 'smooth', 'model_name': 'pspnet'}. [0m
INFO:echo.src.base_objective:Attempting to automatically update the model configuration using optuna's suggested parameters
INFO:echo.src.base_objective:	data:norm : minmax
INFO:echo.src.base_objective:	model:name : unet++
INFO:echo.src.base_objective:	optimizer:learning_rate : 1.3112678511467874e-05
INFO:echo.src.base_objective:	trainer:train_batch_size : 27
INFO:echo.src.base_objective:	trainer:weight_decay : 7.93892501078798e-09
INFO:echo.src.base_objective:	trainer:training_loss : logcosh
INFO:echo.src.base_objective:Beginning trial 91
INFO:root:Loading model unet++ with settings {'in_channels': 4, 'classes': 1, 'activation': 'sigmoid'}
INFO:root:Loading loss smooth
INFO:root:Loading loss smooth
INFO:echo.src.base_objective:Saving trial 91 results to local file /glade/work/kdagon/s2sml/results_week3_SH_510/trial_results/trial_results_29304.gusched01.csv
INFO:echo.src.base_objective:Merging trial results and saving to /glade/work/kdagon/s2sml/results_week3_SH_510/trial_results.csv
[32m[I 2023-05-11 10:21:12,906][0m Trial 91 finished with values: [0.9662844037620776, 0.4473834693174413, 0.7487878245016139] and parameters: {'learning_rate': 1.3112678511467874e-05, 'norm': 'minmax', 'weight_decay': 7.93892501078798e-09, 'train_batch_size': 27, 'training_loss': 'logcosh', 'model_name': 'unet++'}. [0m
WARNING:root:Stopping early since the longest observed run-time in the study exceeds the time remaining on this node.
INFO:root:Saving trial details to /glade/work/kdagon/s2sml/results_week3_SH_510/
INFO:root:Running on PBS/SLURM batch id: 29305.gusched01
INFO:root:Importing custom objective from /glade/work/kdagon/s2sml/applications/train.py
INFO:echo.src.reporting:Using device 0
INFO:root:Direction of optimization: ['minimize', 'minimize', 'minimize']
INFO:root:Using metric ['valid_custom', 'valid_custom_second', 'valid_custom_third']
[32m[I 2023-05-11 10:22:09,434][0m Using an existing study with name 'vanilla' instead of creating a new one.[0m
INFO:root:Loaded study vanilla located at sqlite:////glade/work/kdagon/s2sml/results_week3_SH_510/s2s.db
INFO:echo.src.base_objective:Worker 29305.gusched01 is summoned.
INFO:echo.src.base_objective:	initializing an objective to be optimized with metric ['valid_custom', 'valid_custom_second', 'valid_custom_third']
INFO:echo.src.base_objective:	using device(s) cuda:0
INFO:echo.src.base_objective:	saving study/trial results to local file /glade/work/kdagon/s2sml/results_week3_SH_510/trial_results/trial_results_29305.gusched01.csv
INFO:root:Running optimization for 1000 trials
INFO:root:Running trials for a maximum PBS wall-time 2:00:00
WARNING:root:Attempting to run trials and stop before hitting the wall-time
WARNING:root:Some trials may not complete if the wall-time is reached. Optuna will start over.
INFO:echo.src.base_objective:Attempting to automatically update the model configuration using optuna's suggested parameters
INFO:echo.src.base_objective:	data:norm : negone
INFO:echo.src.base_objective:	model:name : unet++
INFO:echo.src.base_objective:	optimizer:learning_rate : 1.8434662032708008e-06
INFO:echo.src.base_objective:	trainer:train_batch_size : 92
INFO:echo.src.base_objective:	trainer:weight_decay : 1.2296631251932242e-07
INFO:echo.src.base_objective:	trainer:training_loss : xtanh
INFO:echo.src.base_objective:Beginning trial 92
INFO:root:Loading model unet++ with settings {'in_channels': 4, 'classes': 1, 'activation': 'sigmoid'}
INFO:root:Loading loss smooth
INFO:root:Loading loss smooth
INFO:echo.src.base_objective:Saving trial 92 results to local file /glade/work/kdagon/s2sml/results_week3_SH_510/trial_results/trial_results_29305.gusched01.csv
INFO:echo.src.base_objective:Merging trial results and saving to /glade/work/kdagon/s2sml/results_week3_SH_510/trial_results.csv
[32m[I 2023-05-11 10:26:06,150][0m Trial 92 finished with values: [2.4059399005427875, 27.9761234119555, 6.930457598046473] and parameters: {'learning_rate': 1.8434662032708008e-06, 'norm': 'negone', 'weight_decay': 1.2296631251932242e-07, 'train_batch_size': 92, 'training_loss': 'xtanh', 'model_name': 'unet++'}. [0m
INFO:echo.src.base_objective:Attempting to automatically update the model configuration using optuna's suggested parameters
INFO:echo.src.base_objective:	data:norm : None
INFO:echo.src.base_objective:	model:name : pspnet
INFO:echo.src.base_objective:	optimizer:learning_rate : 3.5218923506442593e-06
INFO:echo.src.base_objective:	trainer:train_batch_size : 6
INFO:echo.src.base_objective:	trainer:weight_decay : 0.00039926934486922096
INFO:echo.src.base_objective:	trainer:training_loss : xsigmoid
INFO:echo.src.base_objective:Beginning trial 93
INFO:root:Loading model pspnet with settings {'in_channels': 4, 'classes': 1, 'activation': 'sigmoid'}
INFO:root:Loading loss smooth
INFO:root:Loading loss smooth
INFO:echo.src.base_objective:Saving trial 93 results to local file /glade/work/kdagon/s2sml/results_week3_SH_510/trial_results/trial_results_29305.gusched01.csv
INFO:echo.src.base_objective:Merging trial results and saving to /glade/work/kdagon/s2sml/results_week3_SH_510/trial_results.csv
[32m[I 2023-05-11 10:28:42,856][0m Trial 93 finished with values: [21.673036089654822, 12065.742794329944, 162.3974916144818] and parameters: {'learning_rate': 3.5218923506442593e-06, 'norm': 'None', 'weight_decay': 0.00039926934486922096, 'train_batch_size': 6, 'training_loss': 'xsigmoid', 'model_name': 'pspnet'}. [0m
INFO:echo.src.base_objective:Attempting to automatically update the model configuration using optuna's suggested parameters
INFO:echo.src.base_objective:	data:norm : minmax
INFO:echo.src.base_objective:	model:name : deeplabv3
INFO:echo.src.base_objective:	optimizer:learning_rate : 0.0031253150244401765
INFO:echo.src.base_objective:	trainer:train_batch_size : 114
INFO:echo.src.base_objective:	trainer:weight_decay : 1.1981139745365596e-10
INFO:echo.src.base_objective:	trainer:training_loss : huber
INFO:echo.src.base_objective:Beginning trial 94
INFO:root:Loading model deeplabv3 with settings {'in_channels': 4, 'classes': 1, 'activation': 'sigmoid'}
INFO:root:Loading loss smooth
INFO:root:Loading loss smooth
INFO:echo.src.base_objective:Saving trial 94 results to local file /glade/work/kdagon/s2sml/results_week3_SH_510/trial_results/trial_results_29305.gusched01.csv
INFO:echo.src.base_objective:Merging trial results and saving to /glade/work/kdagon/s2sml/results_week3_SH_510/trial_results.csv
[32m[I 2023-05-11 10:49:46,880][0m Trial 94 finished with values: [1.070913669545951, 1.45247120783001, 1.2222953123890836] and parameters: {'learning_rate': 0.0031253150244401765, 'norm': 'minmax', 'weight_decay': 1.1981139745365596e-10, 'train_batch_size': 114, 'training_loss': 'huber', 'model_name': 'deeplabv3'}. [0m
INFO:echo.src.base_objective:Attempting to automatically update the model configuration using optuna's suggested parameters
INFO:echo.src.base_objective:	data:norm : zscore
INFO:echo.src.base_objective:	model:name : unet
INFO:echo.src.base_objective:	optimizer:learning_rate : 0.0008309573354251212
INFO:echo.src.base_objective:	trainer:train_batch_size : 106
INFO:echo.src.base_objective:	trainer:weight_decay : 1.3453287745905944e-07
INFO:echo.src.base_objective:	trainer:training_loss : huber
INFO:echo.src.base_objective:Beginning trial 95
INFO:root:Loading model unet with settings {'in_channels': 4, 'classes': 1, 'activation': 'sigmoid'}
INFO:root:Loading loss smooth
INFO:root:Loading loss smooth
INFO:echo.src.base_objective:Saving trial 95 results to local file /glade/work/kdagon/s2sml/results_week3_SH_510/trial_results/trial_results_29305.gusched01.csv
INFO:echo.src.base_objective:Merging trial results and saving to /glade/work/kdagon/s2sml/results_week3_SH_510/trial_results.csv
[32m[I 2023-05-11 10:54:53,797][0m Trial 95 finished with values: [1.0786845588220548, 3.7403192646520074, 2.1210721109740027] and parameters: {'learning_rate': 0.0008309573354251212, 'norm': 'zscore', 'weight_decay': 1.3453287745905944e-07, 'train_batch_size': 106, 'training_loss': 'huber', 'model_name': 'unet'}. [0m
INFO:echo.src.base_objective:Attempting to automatically update the model configuration using optuna's suggested parameters
INFO:echo.src.base_objective:	data:norm : zscore
INFO:echo.src.base_objective:	model:name : manet
INFO:echo.src.base_objective:	optimizer:learning_rate : 3.920820387290148e-06
INFO:echo.src.base_objective:	trainer:train_batch_size : 12
INFO:echo.src.base_objective:	trainer:weight_decay : 1.0099803364918285e-11
INFO:echo.src.base_objective:	trainer:training_loss : huber
INFO:echo.src.base_objective:Beginning trial 96
INFO:root:Loading model manet with settings {'in_channels': 4, 'classes': 1, 'activation': 'sigmoid'}
INFO:root:Loading loss smooth
INFO:root:Loading loss smooth
INFO:echo.src.base_objective:Saving trial 96 results to local file /glade/work/kdagon/s2sml/results_week3_SH_510/trial_results/trial_results_29305.gusched01.csv
INFO:echo.src.base_objective:Merging trial results and saving to /glade/work/kdagon/s2sml/results_week3_SH_510/trial_results.csv
[32m[I 2023-05-11 11:12:36,821][0m Trial 96 finished with values: [1.06644919905303, 4.10384342941689, 2.2975030530617477] and parameters: {'learning_rate': 3.920820387290148e-06, 'norm': 'zscore', 'weight_decay': 1.0099803364918285e-11, 'train_batch_size': 12, 'training_loss': 'huber', 'model_name': 'manet'}. [0m
INFO:echo.src.base_objective:Attempting to automatically update the model configuration using optuna's suggested parameters
INFO:echo.src.base_objective:	data:norm : minmax
INFO:echo.src.base_objective:	model:name : fpn
INFO:echo.src.base_objective:	optimizer:learning_rate : 0.0001904524195090763
INFO:echo.src.base_objective:	trainer:train_batch_size : 102
INFO:echo.src.base_objective:	trainer:weight_decay : 1.9705492780477393e-07
INFO:echo.src.base_objective:	trainer:training_loss : huber
INFO:echo.src.base_objective:Beginning trial 97
INFO:root:Loading model fpn with settings {'in_channels': 4, 'classes': 1, 'activation': 'sigmoid'}
INFO:root:Loading loss smooth
INFO:root:Loading loss smooth
INFO:echo.src.base_objective:Saving trial 97 results to local file /glade/work/kdagon/s2sml/results_week3_SH_510/trial_results/trial_results_29305.gusched01.csv
INFO:echo.src.base_objective:Merging trial results and saving to /glade/work/kdagon/s2sml/results_week3_SH_510/trial_results.csv
[32m[I 2023-05-11 11:26:22,341][0m Trial 97 finished with values: [1.0330190279438731, 2.135183840629913, 1.6185306973004565] and parameters: {'learning_rate': 0.0001904524195090763, 'norm': 'minmax', 'weight_decay': 1.9705492780477393e-07, 'train_batch_size': 102, 'training_loss': 'huber', 'model_name': 'fpn'}. [0m
INFO:echo.src.base_objective:Attempting to automatically update the model configuration using optuna's suggested parameters
INFO:echo.src.base_objective:	data:norm : negone
INFO:echo.src.base_objective:	model:name : deeplabv3+
INFO:echo.src.base_objective:	optimizer:learning_rate : 1.443262446132864e-05
INFO:echo.src.base_objective:	trainer:train_batch_size : 50
INFO:echo.src.base_objective:	trainer:weight_decay : 2.6798261635092496e-06
INFO:echo.src.base_objective:	trainer:training_loss : xsigmoid
INFO:echo.src.base_objective:Beginning trial 98
INFO:root:Loading model deeplabv3+ with settings {'in_channels': 4, 'classes': 1, 'activation': 'sigmoid'}
INFO:root:Loading loss smooth
INFO:root:Loading loss smooth
INFO:echo.src.base_objective:Saving trial 98 results to local file /glade/work/kdagon/s2sml/results_week3_SH_510/trial_results/trial_results_29305.gusched01.csv
INFO:echo.src.base_objective:Merging trial results and saving to /glade/work/kdagon/s2sml/results_week3_SH_510/trial_results.csv
