INFO:root:Saving trial details to /glade/work/kdagon/s2sml/results_week3_SH_510/
INFO:root:Running on PBS/SLURM batch id: 29293.gusched01
INFO:root:Importing custom objective from /glade/work/kdagon/s2sml/applications/train.py
INFO:echo.src.reporting:Using device 0
INFO:root:Direction of optimization: ['minimize', 'minimize', 'minimize']
INFO:root:Using metric ['valid_custom', 'valid_custom_second', 'valid_custom_third']
[32m[I 2023-05-10 14:56:19,706][0m Using an existing study with name 'vanilla' instead of creating a new one.[0m
INFO:root:Loaded study vanilla located at sqlite:////glade/work/kdagon/s2sml/results_week3_SH_510/s2s.db
INFO:echo.src.base_objective:Worker 29293.gusched01 is summoned.
INFO:echo.src.base_objective:	initializing an objective to be optimized with metric ['valid_custom', 'valid_custom_second', 'valid_custom_third']
INFO:echo.src.base_objective:	using device(s) cuda:0
INFO:echo.src.base_objective:	saving study/trial results to local file /glade/work/kdagon/s2sml/results_week3_SH_510/trial_results/trial_results_29293.gusched01.csv
INFO:root:Running optimization for 1000 trials
INFO:root:Running trials for a maximum PBS wall-time 2:00:00
WARNING:root:Attempting to run trials and stop before hitting the wall-time
WARNING:root:Some trials may not complete if the wall-time is reached. Optuna will start over.
INFO:echo.src.base_objective:Attempting to automatically update the model configuration using optuna's suggested parameters
INFO:echo.src.base_objective:	data:norm : zscore
INFO:echo.src.base_objective:	model:name : linknet
INFO:echo.src.base_objective:	optimizer:learning_rate : 1.3548983981573254e-05
INFO:echo.src.base_objective:	trainer:train_batch_size : 20
INFO:echo.src.base_objective:	trainer:weight_decay : 3.4613408493270094e-06
INFO:echo.src.base_objective:	trainer:training_loss : xsigmoid
INFO:echo.src.base_objective:Beginning trial 0
INFO:root:Loading model linknet with settings {'in_channels': 4, 'classes': 1, 'activation': 'sigmoid'}
INFO:root:Loading loss smooth
INFO:root:Loading loss smooth
INFO:echo.src.base_objective:Saving trial 0 results to local file /glade/work/kdagon/s2sml/results_week3_SH_510/trial_results/trial_results_29293.gusched01.csv
[32m[I 2023-05-10 15:14:11,478][0m Trial 0 finished with values: [1.083511178019095, 4.211939991221113, 2.3411359797088305] and parameters: {'learning_rate': 1.3548983981573254e-05, 'norm': 'zscore', 'weight_decay': 3.4613408493270094e-06, 'train_batch_size': 20, 'training_loss': 'xsigmoid', 'model_name': 'linknet'}. [0m
INFO:echo.src.base_objective:Attempting to automatically update the model configuration using optuna's suggested parameters
INFO:echo.src.base_objective:	data:norm : minmax
INFO:echo.src.base_objective:	model:name : manet
INFO:echo.src.base_objective:	optimizer:learning_rate : 3.5669352369174383e-06
INFO:echo.src.base_objective:	trainer:train_batch_size : 49
INFO:echo.src.base_objective:	trainer:weight_decay : 6.120061875024669e-09
INFO:echo.src.base_objective:	trainer:training_loss : smooth
INFO:echo.src.base_objective:Beginning trial 1
INFO:root:Loading model manet with settings {'in_channels': 4, 'classes': 1, 'activation': 'sigmoid'}
INFO:root:Loading loss smooth
INFO:root:Loading loss smooth
INFO:echo.src.base_objective:Saving trial 1 results to local file /glade/work/kdagon/s2sml/results_week3_SH_510/trial_results/trial_results_29293.gusched01.csv
[32m[I 2023-05-10 15:37:51,775][0m Trial 1 finished with values: [1.0986838446794442, 1.8811997154711129, 1.4529551960167273] and parameters: {'learning_rate': 3.5669352369174383e-06, 'norm': 'minmax', 'weight_decay': 6.120061875024669e-09, 'train_batch_size': 49, 'training_loss': 'smooth', 'model_name': 'manet'}. [0m
INFO:echo.src.base_objective:Attempting to automatically update the model configuration using optuna's suggested parameters
INFO:echo.src.base_objective:	data:norm : minmax
INFO:echo.src.base_objective:	model:name : pspnet
INFO:echo.src.base_objective:	optimizer:learning_rate : 4.6344195535612443e-05
INFO:echo.src.base_objective:	trainer:train_batch_size : 4
INFO:echo.src.base_objective:	trainer:weight_decay : 1.0447417914055498e-07
INFO:echo.src.base_objective:	trainer:training_loss : xtanh
INFO:echo.src.base_objective:Beginning trial 2
INFO:root:Loading model pspnet with settings {'in_channels': 4, 'classes': 1, 'activation': 'sigmoid'}
INFO:root:Loading loss smooth
INFO:root:Loading loss smooth
INFO:echo.src.base_objective:Saving trial 2 results to local file /glade/work/kdagon/s2sml/results_week3_SH_510/trial_results/trial_results_29293.gusched01.csv
[32m[I 2023-05-10 15:52:08,955][0m Trial 2 finished with values: [1.0612703671027754, 1.3856854639236653, 1.1955605027943454] and parameters: {'learning_rate': 4.6344195535612443e-05, 'norm': 'minmax', 'weight_decay': 1.0447417914055498e-07, 'train_batch_size': 4, 'training_loss': 'xtanh', 'model_name': 'pspnet'}. [0m
INFO:echo.src.base_objective:Attempting to automatically update the model configuration using optuna's suggested parameters
INFO:echo.src.base_objective:	data:norm : zscore
INFO:echo.src.base_objective:	model:name : pspnet
INFO:echo.src.base_objective:	optimizer:learning_rate : 0.004026600968340341
INFO:echo.src.base_objective:	trainer:train_batch_size : 36
INFO:echo.src.base_objective:	trainer:weight_decay : 1.688680100888438e-10
INFO:echo.src.base_objective:	trainer:training_loss : mse
INFO:echo.src.base_objective:Beginning trial 3
INFO:root:Loading model pspnet with settings {'in_channels': 4, 'classes': 1, 'activation': 'sigmoid'}
INFO:root:Loading loss smooth
INFO:root:Loading loss smooth
INFO:echo.src.base_objective:Saving trial 3 results to local file /glade/work/kdagon/s2sml/results_week3_SH_510/trial_results/trial_results_29293.gusched01.csv
[32m[I 2023-05-10 16:00:51,735][0m Trial 3 finished with values: [1.1948350099210727, 3.8002859171653958, 2.1802256663981634] and parameters: {'learning_rate': 0.004026600968340341, 'norm': 'zscore', 'weight_decay': 1.688680100888438e-10, 'train_batch_size': 36, 'training_loss': 'mse', 'model_name': 'pspnet'}. [0m
INFO:echo.src.base_objective:Attempting to automatically update the model configuration using optuna's suggested parameters
INFO:echo.src.base_objective:	data:norm : minmax
INFO:echo.src.base_objective:	model:name : unet++
INFO:echo.src.base_objective:	optimizer:learning_rate : 0.001547676565813708
INFO:echo.src.base_objective:	trainer:train_batch_size : 52
INFO:echo.src.base_objective:	trainer:weight_decay : 1.4854758080407468e-10
INFO:echo.src.base_objective:	trainer:training_loss : xsigmoid
INFO:echo.src.base_objective:Beginning trial 4
INFO:root:Loading model unet++ with settings {'in_channels': 4, 'classes': 1, 'activation': 'sigmoid'}
INFO:root:Loading loss smooth
INFO:root:Loading loss smooth
INFO:echo.src.base_objective:Saving trial 4 results to local file /glade/work/kdagon/s2sml/results_week3_SH_510/trial_results/trial_results_29293.gusched01.csv
[32m[I 2023-05-10 16:13:01,447][0m Trial 4 finished with values: [0.9570071098348536, 0.3439020664584843, 0.6406596770502122] and parameters: {'learning_rate': 0.001547676565813708, 'norm': 'minmax', 'weight_decay': 1.4854758080407468e-10, 'train_batch_size': 52, 'training_loss': 'xsigmoid', 'model_name': 'unet++'}. [0m
INFO:echo.src.base_objective:Attempting to automatically update the model configuration using optuna's suggested parameters
INFO:echo.src.base_objective:	data:norm : minmax
INFO:echo.src.base_objective:	model:name : linknet
INFO:echo.src.base_objective:	optimizer:learning_rate : 0.0002807388496760832
INFO:echo.src.base_objective:	trainer:train_batch_size : 41
INFO:echo.src.base_objective:	trainer:weight_decay : 0.00017240598667379932
INFO:echo.src.base_objective:	trainer:training_loss : smooth
INFO:echo.src.base_objective:Beginning trial 5
INFO:root:Loading model linknet with settings {'in_channels': 4, 'classes': 1, 'activation': 'sigmoid'}
INFO:root:Loading loss smooth
INFO:root:Loading loss smooth
INFO:echo.src.base_objective:Saving trial 5 results to local file /glade/work/kdagon/s2sml/results_week3_SH_510/trial_results/trial_results_29293.gusched01.csv
[32m[I 2023-05-10 16:27:41,324][0m Trial 5 finished with values: [0.9656692974660082, 0.4381996944033206, 0.7270406954212975] and parameters: {'learning_rate': 0.0002807388496760832, 'norm': 'minmax', 'weight_decay': 0.00017240598667379932, 'train_batch_size': 41, 'training_loss': 'smooth', 'model_name': 'linknet'}. [0m
INFO:echo.src.base_objective:Attempting to automatically update the model configuration using optuna's suggested parameters
INFO:echo.src.base_objective:	data:norm : minmax
INFO:echo.src.base_objective:	model:name : fpn
INFO:echo.src.base_objective:	optimizer:learning_rate : 1.4010690805632776e-06
INFO:echo.src.base_objective:	trainer:train_batch_size : 52
INFO:echo.src.base_objective:	trainer:weight_decay : 3.66615242098248e-10
INFO:echo.src.base_objective:	trainer:training_loss : mse
INFO:echo.src.base_objective:Beginning trial 6
INFO:root:Loading model fpn with settings {'in_channels': 4, 'classes': 1, 'activation': 'sigmoid'}
INFO:root:Loading loss smooth
INFO:root:Loading loss smooth
INFO:echo.src.base_objective:Saving trial 6 results to local file /glade/work/kdagon/s2sml/results_week3_SH_510/trial_results/trial_results_29293.gusched01.csv
[32m[I 2023-05-10 16:45:04,033][0m Trial 6 finished with values: [1.478399632524736, 16.427225072924248, 4.998763106286992] and parameters: {'learning_rate': 1.4010690805632776e-06, 'norm': 'minmax', 'weight_decay': 3.66615242098248e-10, 'train_batch_size': 52, 'training_loss': 'mse', 'model_name': 'fpn'}. [0m
WARNING:root:Stopping early since the longest observed run-time in the study exceeds the time remaining on this node.
INFO:root:Saving trial details to /glade/work/kdagon/s2sml/results_week3_SH_510/
INFO:root:Running on PBS/SLURM batch id: 29294.gusched01
INFO:root:Importing custom objective from /glade/work/kdagon/s2sml/applications/train.py
INFO:echo.src.reporting:Using device 0
INFO:root:Direction of optimization: ['minimize', 'minimize', 'minimize']
INFO:root:Using metric ['valid_custom', 'valid_custom_second', 'valid_custom_third']
[32m[I 2023-05-10 16:46:03,037][0m Using an existing study with name 'vanilla' instead of creating a new one.[0m
INFO:root:Loaded study vanilla located at sqlite:////glade/work/kdagon/s2sml/results_week3_SH_510/s2s.db
INFO:echo.src.base_objective:Worker 29294.gusched01 is summoned.
INFO:echo.src.base_objective:	initializing an objective to be optimized with metric ['valid_custom', 'valid_custom_second', 'valid_custom_third']
INFO:echo.src.base_objective:	using device(s) cuda:0
INFO:echo.src.base_objective:	saving study/trial results to local file /glade/work/kdagon/s2sml/results_week3_SH_510/trial_results/trial_results_29294.gusched01.csv
INFO:root:Running optimization for 1000 trials
INFO:root:Running trials for a maximum PBS wall-time 2:00:00
WARNING:root:Attempting to run trials and stop before hitting the wall-time
WARNING:root:Some trials may not complete if the wall-time is reached. Optuna will start over.
INFO:echo.src.base_objective:Attempting to automatically update the model configuration using optuna's suggested parameters
INFO:echo.src.base_objective:	data:norm : minmax
INFO:echo.src.base_objective:	model:name : pspnet
INFO:echo.src.base_objective:	optimizer:learning_rate : 0.001258746498138382
INFO:echo.src.base_objective:	trainer:train_batch_size : 20
INFO:echo.src.base_objective:	trainer:weight_decay : 1.242582641464375e-12
INFO:echo.src.base_objective:	trainer:training_loss : smooth
INFO:echo.src.base_objective:Beginning trial 7
INFO:root:Loading model pspnet with settings {'in_channels': 4, 'classes': 1, 'activation': 'sigmoid'}
INFO:root:Loading loss smooth
INFO:root:Loading loss smooth
INFO:echo.src.base_objective:Saving trial 7 results to local file /glade/work/kdagon/s2sml/results_week3_SH_510/trial_results/trial_results_29294.gusched01.csv
INFO:echo.src.base_objective:Merging trial results and saving to /glade/work/kdagon/s2sml/results_week3_SH_510/trial_results.csv
[32m[I 2023-05-10 16:55:41,067][0m Trial 7 finished with values: [1.0602752806182012, 1.3651128559248071, 1.168475963354797] and parameters: {'learning_rate': 0.001258746498138382, 'norm': 'minmax', 'weight_decay': 1.242582641464375e-12, 'train_batch_size': 20, 'training_loss': 'smooth', 'model_name': 'pspnet'}. [0m
INFO:echo.src.base_objective:Attempting to automatically update the model configuration using optuna's suggested parameters
INFO:echo.src.base_objective:	data:norm : zscore
INFO:echo.src.base_objective:	model:name : deeplabv3+
INFO:echo.src.base_objective:	optimizer:learning_rate : 0.00011975993884522177
INFO:echo.src.base_objective:	trainer:train_batch_size : 12
INFO:echo.src.base_objective:	trainer:weight_decay : 0.0004903908171456615
INFO:echo.src.base_objective:	trainer:training_loss : xtanh
INFO:echo.src.base_objective:Beginning trial 8
INFO:root:Loading model deeplabv3+ with settings {'in_channels': 4, 'classes': 1, 'activation': 'sigmoid'}
INFO:root:Loading loss smooth
INFO:root:Loading loss smooth
INFO:echo.src.base_objective:Saving trial 8 results to local file /glade/work/kdagon/s2sml/results_week3_SH_510/trial_results/trial_results_29294.gusched01.csv
INFO:echo.src.base_objective:Merging trial results and saving to /glade/work/kdagon/s2sml/results_week3_SH_510/trial_results.csv
[32m[I 2023-05-10 17:00:07,704][0m Trial 8 finished with values: [1.131751189303451, 3.8038640679812192, 2.149307322592137] and parameters: {'learning_rate': 0.00011975993884522177, 'norm': 'zscore', 'weight_decay': 0.0004903908171456615, 'train_batch_size': 12, 'training_loss': 'xtanh', 'model_name': 'deeplabv3+'}. [0m
INFO:echo.src.base_objective:Attempting to automatically update the model configuration using optuna's suggested parameters
INFO:echo.src.base_objective:	data:norm : minmax
INFO:echo.src.base_objective:	model:name : deeplabv3+
INFO:echo.src.base_objective:	optimizer:learning_rate : 0.0002554403241695504
INFO:echo.src.base_objective:	trainer:train_batch_size : 26
INFO:echo.src.base_objective:	trainer:weight_decay : 4.408748847385961e-10
INFO:echo.src.base_objective:	trainer:training_loss : mae
INFO:echo.src.base_objective:Beginning trial 9
INFO:root:Loading model deeplabv3+ with settings {'in_channels': 4, 'classes': 1, 'activation': 'sigmoid'}
INFO:root:Loading loss smooth
INFO:root:Loading loss smooth
INFO:echo.src.base_objective:Saving trial 9 results to local file /glade/work/kdagon/s2sml/results_week3_SH_510/trial_results/trial_results_29294.gusched01.csv
INFO:echo.src.base_objective:Merging trial results and saving to /glade/work/kdagon/s2sml/results_week3_SH_510/trial_results.csv
[32m[I 2023-05-10 17:10:00,155][0m Trial 9 finished with values: [1.0173762263889683, 0.974762679600298, 0.9416313350198077] and parameters: {'learning_rate': 0.0002554403241695504, 'norm': 'minmax', 'weight_decay': 4.408748847385961e-10, 'train_batch_size': 26, 'training_loss': 'mae', 'model_name': 'deeplabv3+'}. [0m
INFO:echo.src.base_objective:Attempting to automatically update the model configuration using optuna's suggested parameters
INFO:echo.src.base_objective:	data:norm : zscore
INFO:echo.src.base_objective:	model:name : fpn
INFO:echo.src.base_objective:	optimizer:learning_rate : 0.00655709277514773
INFO:echo.src.base_objective:	trainer:train_batch_size : 47
INFO:echo.src.base_objective:	trainer:weight_decay : 5.68747731148446e-06
INFO:echo.src.base_objective:	trainer:training_loss : huber
INFO:echo.src.base_objective:Beginning trial 10
INFO:root:Loading model fpn with settings {'in_channels': 4, 'classes': 1, 'activation': 'sigmoid'}
INFO:root:Loading loss smooth
INFO:root:Loading loss smooth
INFO:echo.src.base_objective:Saving trial 10 results to local file /glade/work/kdagon/s2sml/results_week3_SH_510/trial_results/trial_results_29294.gusched01.csv
INFO:echo.src.base_objective:Merging trial results and saving to /glade/work/kdagon/s2sml/results_week3_SH_510/trial_results.csv
[32m[I 2023-05-10 17:17:46,173][0m Trial 10 finished with values: [1.1546579330422124, 3.718474341092303, 2.1059878875155786] and parameters: {'learning_rate': 0.00655709277514773, 'norm': 'zscore', 'weight_decay': 5.68747731148446e-06, 'train_batch_size': 47, 'training_loss': 'huber', 'model_name': 'fpn'}. [0m
INFO:echo.src.base_objective:Attempting to automatically update the model configuration using optuna's suggested parameters
INFO:echo.src.base_objective:	data:norm : negone
INFO:echo.src.base_objective:	model:name : fpn
INFO:echo.src.base_objective:	optimizer:learning_rate : 5.876499352538339e-05
INFO:echo.src.base_objective:	trainer:train_batch_size : 108
INFO:echo.src.base_objective:	trainer:weight_decay : 0.00022842975844502254
INFO:echo.src.base_objective:	trainer:training_loss : mse
INFO:echo.src.base_objective:Beginning trial 11
INFO:root:Loading model fpn with settings {'in_channels': 4, 'classes': 1, 'activation': 'sigmoid'}
INFO:root:Loading loss smooth
INFO:root:Loading loss smooth
INFO:echo.src.base_objective:Saving trial 11 results to local file /glade/work/kdagon/s2sml/results_week3_SH_510/trial_results/trial_results_29294.gusched01.csv
INFO:echo.src.base_objective:Merging trial results and saving to /glade/work/kdagon/s2sml/results_week3_SH_510/trial_results.csv
[32m[I 2023-05-10 17:47:58,884][0m Trial 11 finished with values: [1.115062384039545, 1.868601989723156, 1.514441017651845] and parameters: {'learning_rate': 5.876499352538339e-05, 'norm': 'negone', 'weight_decay': 0.00022842975844502254, 'train_batch_size': 108, 'training_loss': 'mse', 'model_name': 'fpn'}. [0m
INFO:echo.src.base_objective:Attempting to automatically update the model configuration using optuna's suggested parameters
INFO:echo.src.base_objective:	data:norm : None
INFO:echo.src.base_objective:	model:name : manet
INFO:echo.src.base_objective:	optimizer:learning_rate : 3.9484567155587445e-05
INFO:echo.src.base_objective:	trainer:train_batch_size : 50
INFO:echo.src.base_objective:	trainer:weight_decay : 1.418165093097668e-05
INFO:echo.src.base_objective:	trainer:training_loss : smooth
INFO:echo.src.base_objective:Beginning trial 12
INFO:root:Loading model manet with settings {'in_channels': 4, 'classes': 1, 'activation': 'sigmoid'}
INFO:root:Loading loss smooth
INFO:root:Loading loss smooth
INFO:echo.src.base_objective:Saving trial 12 results to local file /glade/work/kdagon/s2sml/results_week3_SH_510/trial_results/trial_results_29294.gusched01.csv
INFO:echo.src.base_objective:Merging trial results and saving to /glade/work/kdagon/s2sml/results_week3_SH_510/trial_results.csv
[32m[I 2023-05-10 17:50:55,849][0m Trial 12 finished with values: [12.115047625911009, 12089.610340382089, 162.55816974723555] and parameters: {'learning_rate': 3.9484567155587445e-05, 'norm': 'None', 'weight_decay': 1.418165093097668e-05, 'train_batch_size': 50, 'training_loss': 'smooth', 'model_name': 'manet'}. [0m
INFO:echo.src.base_objective:Attempting to automatically update the model configuration using optuna's suggested parameters
INFO:echo.src.base_objective:	data:norm : negone
INFO:echo.src.base_objective:	model:name : deeplabv3+
INFO:echo.src.base_objective:	optimizer:learning_rate : 2.951154740309098e-06
INFO:echo.src.base_objective:	trainer:train_batch_size : 67
INFO:echo.src.base_objective:	trainer:weight_decay : 1.9335257469934938e-08
INFO:echo.src.base_objective:	trainer:training_loss : huber
INFO:echo.src.base_objective:Beginning trial 13
INFO:root:Loading model deeplabv3+ with settings {'in_channels': 4, 'classes': 1, 'activation': 'sigmoid'}
INFO:root:Loading loss smooth
INFO:root:Loading loss smooth
INFO:echo.src.base_objective:Saving trial 13 results to local file /glade/work/kdagon/s2sml/results_week3_SH_510/trial_results/trial_results_29294.gusched01.csv
INFO:echo.src.base_objective:Merging trial results and saving to /glade/work/kdagon/s2sml/results_week3_SH_510/trial_results.csv
