[32m[I 2023-05-10 18:20:12,967][0m Trial 13 finished with values: [1.1653507089250148, 8.602262860557335, 3.7891356180232667] and parameters: {'learning_rate': 2.951154740309098e-06, 'norm': 'negone', 'weight_decay': 1.9335257469934938e-08, 'train_batch_size': 67, 'training_loss': 'huber', 'model_name': 'deeplabv3+'}. [0m
WARNING:root:Stopping early since the longest observed run-time in the study exceeds the time remaining on this node.
INFO:root:Saving trial details to /glade/work/kdagon/s2sml/results_week3_SH_510/
INFO:root:Running on PBS/SLURM batch id: 29295.gusched01
INFO:root:Importing custom objective from /glade/work/kdagon/s2sml/applications/train.py
INFO:echo.src.reporting:Using device 0
INFO:root:Direction of optimization: ['minimize', 'minimize', 'minimize']
INFO:root:Using metric ['valid_custom', 'valid_custom_second', 'valid_custom_third']
[32m[I 2023-05-10 18:21:12,272][0m Using an existing study with name 'vanilla' instead of creating a new one.[0m
INFO:root:Loaded study vanilla located at sqlite:////glade/work/kdagon/s2sml/results_week3_SH_510/s2s.db
INFO:echo.src.base_objective:Worker 29295.gusched01 is summoned.
INFO:echo.src.base_objective:	initializing an objective to be optimized with metric ['valid_custom', 'valid_custom_second', 'valid_custom_third']
INFO:echo.src.base_objective:	using device(s) cuda:0
INFO:echo.src.base_objective:	saving study/trial results to local file /glade/work/kdagon/s2sml/results_week3_SH_510/trial_results/trial_results_29295.gusched01.csv
INFO:root:Running optimization for 1000 trials
INFO:root:Running trials for a maximum PBS wall-time 2:00:00
WARNING:root:Attempting to run trials and stop before hitting the wall-time
WARNING:root:Some trials may not complete if the wall-time is reached. Optuna will start over.
INFO:echo.src.base_objective:Attempting to automatically update the model configuration using optuna's suggested parameters
INFO:echo.src.base_objective:	data:norm : negone
INFO:echo.src.base_objective:	model:name : unet
INFO:echo.src.base_objective:	optimizer:learning_rate : 0.0008602458776901623
INFO:echo.src.base_objective:	trainer:train_batch_size : 65
INFO:echo.src.base_objective:	trainer:weight_decay : 4.1386239986853106e-07
INFO:echo.src.base_objective:	trainer:training_loss : huber
INFO:echo.src.base_objective:Beginning trial 14
INFO:root:Loading model unet with settings {'in_channels': 4, 'classes': 1, 'activation': 'sigmoid'}
INFO:root:Loading loss smooth
INFO:root:Loading loss smooth
INFO:echo.src.base_objective:Saving trial 14 results to local file /glade/work/kdagon/s2sml/results_week3_SH_510/trial_results/trial_results_29295.gusched01.csv
INFO:echo.src.base_objective:Merging trial results and saving to /glade/work/kdagon/s2sml/results_week3_SH_510/trial_results.csv
[32m[I 2023-05-10 18:34:23,828][0m Trial 14 finished with values: [0.9916059620507224, 0.8723889710149144, 0.8846414609736669] and parameters: {'learning_rate': 0.0008602458776901623, 'norm': 'negone', 'weight_decay': 4.1386239986853106e-07, 'train_batch_size': 65, 'training_loss': 'huber', 'model_name': 'unet'}. [0m
INFO:echo.src.base_objective:Attempting to automatically update the model configuration using optuna's suggested parameters
INFO:echo.src.base_objective:	data:norm : None
INFO:echo.src.base_objective:	model:name : fpn
INFO:echo.src.base_objective:	optimizer:learning_rate : 2.108931132428922e-06
INFO:echo.src.base_objective:	trainer:train_batch_size : 68
INFO:echo.src.base_objective:	trainer:weight_decay : 2.47945056408929e-08
INFO:echo.src.base_objective:	trainer:training_loss : xtanh
INFO:echo.src.base_objective:Beginning trial 15
INFO:root:Loading model fpn with settings {'in_channels': 4, 'classes': 1, 'activation': 'sigmoid'}
INFO:root:Loading loss smooth
INFO:root:Loading loss smooth
INFO:echo.src.base_objective:Saving trial 15 results to local file /glade/work/kdagon/s2sml/results_week3_SH_510/trial_results/trial_results_29295.gusched01.csv
INFO:echo.src.base_objective:Merging trial results and saving to /glade/work/kdagon/s2sml/results_week3_SH_510/trial_results.csv
[32m[I 2023-05-10 18:37:09,084][0m Trial 15 finished with values: [2.9256425798008103, 12131.921673050158, 162.84276821581213] and parameters: {'learning_rate': 2.108931132428922e-06, 'norm': 'None', 'weight_decay': 2.47945056408929e-08, 'train_batch_size': 68, 'training_loss': 'xtanh', 'model_name': 'fpn'}. [0m
INFO:echo.src.base_objective:Attempting to automatically update the model configuration using optuna's suggested parameters
INFO:echo.src.base_objective:	data:norm : minmax
INFO:echo.src.base_objective:	model:name : manet
INFO:echo.src.base_objective:	optimizer:learning_rate : 0.0008893855368110295
INFO:echo.src.base_objective:	trainer:train_batch_size : 75
INFO:echo.src.base_objective:	trainer:weight_decay : 1.4832865686309087e-09
INFO:echo.src.base_objective:	trainer:training_loss : mse
INFO:echo.src.base_objective:Beginning trial 16
INFO:root:Loading model manet with settings {'in_channels': 4, 'classes': 1, 'activation': 'sigmoid'}
INFO:root:Loading loss smooth
INFO:root:Loading loss smooth
INFO:echo.src.base_objective:Saving trial 16 results to local file /glade/work/kdagon/s2sml/results_week3_SH_510/trial_results/trial_results_29295.gusched01.csv
INFO:echo.src.base_objective:Merging trial results and saving to /glade/work/kdagon/s2sml/results_week3_SH_510/trial_results.csv
[32m[I 2023-05-10 18:49:30,168][0m Trial 16 finished with values: [0.9602456937599414, 0.37555441734269224, 0.6605959265894583] and parameters: {'learning_rate': 0.0008893855368110295, 'norm': 'minmax', 'weight_decay': 1.4832865686309087e-09, 'train_batch_size': 75, 'training_loss': 'mse', 'model_name': 'manet'}. [0m
INFO:echo.src.base_objective:Attempting to automatically update the model configuration using optuna's suggested parameters
INFO:echo.src.base_objective:	data:norm : zscore
INFO:echo.src.base_objective:	model:name : unet++
INFO:echo.src.base_objective:	optimizer:learning_rate : 2.3653519472297794e-06
INFO:echo.src.base_objective:	trainer:train_batch_size : 70
INFO:echo.src.base_objective:	trainer:weight_decay : 8.081280317380018e-06
INFO:echo.src.base_objective:	trainer:training_loss : xsigmoid
INFO:echo.src.base_objective:Beginning trial 17
INFO:root:Loading model unet++ with settings {'in_channels': 4, 'classes': 1, 'activation': 'sigmoid'}
INFO:root:Loading loss smooth
INFO:root:Loading loss smooth
INFO:echo.src.base_objective:Saving trial 17 results to local file /glade/work/kdagon/s2sml/results_week3_SH_510/trial_results/trial_results_29295.gusched01.csv
INFO:echo.src.base_objective:Merging trial results and saving to /glade/work/kdagon/s2sml/results_week3_SH_510/trial_results.csv
[32m[I 2023-05-10 19:22:44,650][0m Trial 17 finished with values: [1.0797157126957706, 5.196142193398869, 2.6674931190249933] and parameters: {'learning_rate': 2.3653519472297794e-06, 'norm': 'zscore', 'weight_decay': 8.081280317380018e-06, 'train_batch_size': 70, 'training_loss': 'xsigmoid', 'model_name': 'unet++'}. [0m
INFO:echo.src.base_objective:Attempting to automatically update the model configuration using optuna's suggested parameters
INFO:echo.src.base_objective:	data:norm : negone
INFO:echo.src.base_objective:	model:name : unet++
INFO:echo.src.base_objective:	optimizer:learning_rate : 0.00037808941820237607
INFO:echo.src.base_objective:	trainer:train_batch_size : 48
INFO:echo.src.base_objective:	trainer:weight_decay : 6.157290656030438e-11
INFO:echo.src.base_objective:	trainer:training_loss : huber
INFO:echo.src.base_objective:Beginning trial 18
INFO:root:Loading model unet++ with settings {'in_channels': 4, 'classes': 1, 'activation': 'sigmoid'}
INFO:root:Loading loss smooth
INFO:root:Loading loss smooth
INFO:echo.src.base_objective:Saving trial 18 results to local file /glade/work/kdagon/s2sml/results_week3_SH_510/trial_results/trial_results_29295.gusched01.csv
INFO:echo.src.base_objective:Merging trial results and saving to /glade/work/kdagon/s2sml/results_week3_SH_510/trial_results.csv
[32m[I 2023-05-10 19:39:26,772][0m Trial 18 finished with values: [0.9907953848155664, 0.9738114919347339, 0.9646407489922999] and parameters: {'learning_rate': 0.00037808941820237607, 'norm': 'negone', 'weight_decay': 6.157290656030438e-11, 'train_batch_size': 48, 'training_loss': 'huber', 'model_name': 'unet++'}. [0m
INFO:echo.src.base_objective:Attempting to automatically update the model configuration using optuna's suggested parameters
INFO:echo.src.base_objective:	data:norm : None
INFO:echo.src.base_objective:	model:name : manet
INFO:echo.src.base_objective:	optimizer:learning_rate : 2.506917968256088e-06
INFO:echo.src.base_objective:	trainer:train_batch_size : 39
INFO:echo.src.base_objective:	trainer:weight_decay : 4.412270593386939e-06
INFO:echo.src.base_objective:	trainer:training_loss : xtanh
INFO:echo.src.base_objective:Beginning trial 19
INFO:root:Loading model manet with settings {'in_channels': 4, 'classes': 1, 'activation': 'sigmoid'}
INFO:root:Loading loss smooth
INFO:root:Loading loss smooth
INFO:echo.src.base_objective:Saving trial 19 results to local file /glade/work/kdagon/s2sml/results_week3_SH_510/trial_results/trial_results_29295.gusched01.csv
INFO:echo.src.base_objective:Merging trial results and saving to /glade/work/kdagon/s2sml/results_week3_SH_510/trial_results.csv
[32m[I 2023-05-10 19:42:01,749][0m Trial 19 finished with values: [15.51499533270836, 12091.872406877543, 162.5734395722149] and parameters: {'learning_rate': 2.506917968256088e-06, 'norm': 'None', 'weight_decay': 4.412270593386939e-06, 'train_batch_size': 39, 'training_loss': 'xtanh', 'model_name': 'manet'}. [0m
INFO:echo.src.base_objective:Attempting to automatically update the model configuration using optuna's suggested parameters
INFO:echo.src.base_objective:	data:norm : zscore
INFO:echo.src.base_objective:	model:name : deeplabv3+
INFO:echo.src.base_objective:	optimizer:learning_rate : 0.004409058769438447
INFO:echo.src.base_objective:	trainer:train_batch_size : 108
INFO:echo.src.base_objective:	trainer:weight_decay : 2.95940885560841e-06
INFO:echo.src.base_objective:	trainer:training_loss : xtanh
INFO:echo.src.base_objective:Beginning trial 20
INFO:root:Loading model deeplabv3+ with settings {'in_channels': 4, 'classes': 1, 'activation': 'sigmoid'}
INFO:root:Loading loss smooth
INFO:root:Loading loss smooth
INFO:echo.src.base_objective:Saving trial 20 results to local file /glade/work/kdagon/s2sml/results_week3_SH_510/trial_results/trial_results_29295.gusched01.csv
INFO:echo.src.base_objective:Merging trial results and saving to /glade/work/kdagon/s2sml/results_week3_SH_510/trial_results.csv
[32m[I 2023-05-10 19:52:22,020][0m Trial 20 finished with values: [1.1401703786512243, 3.6934916744396142, 2.095031619953151] and parameters: {'learning_rate': 0.004409058769438447, 'norm': 'zscore', 'weight_decay': 2.95940885560841e-06, 'train_batch_size': 108, 'training_loss': 'xtanh', 'model_name': 'deeplabv3+'}. [0m
WARNING:root:Stopping early since the longest observed run-time in the study exceeds the time remaining on this node.
INFO:root:Saving trial details to /glade/work/kdagon/s2sml/results_week3_SH_510/
INFO:root:Running on PBS/SLURM batch id: 29296.gusched01
INFO:root:Importing custom objective from /glade/work/kdagon/s2sml/applications/train.py
INFO:echo.src.reporting:Using device 0
INFO:root:Direction of optimization: ['minimize', 'minimize', 'minimize']
INFO:root:Using metric ['valid_custom', 'valid_custom_second', 'valid_custom_third']
[32m[I 2023-05-10 19:53:28,717][0m Using an existing study with name 'vanilla' instead of creating a new one.[0m
INFO:root:Loaded study vanilla located at sqlite:////glade/work/kdagon/s2sml/results_week3_SH_510/s2s.db
INFO:echo.src.base_objective:Worker 29296.gusched01 is summoned.
INFO:echo.src.base_objective:	initializing an objective to be optimized with metric ['valid_custom', 'valid_custom_second', 'valid_custom_third']
INFO:echo.src.base_objective:	using device(s) cuda:0
INFO:echo.src.base_objective:	saving study/trial results to local file /glade/work/kdagon/s2sml/results_week3_SH_510/trial_results/trial_results_29296.gusched01.csv
INFO:root:Running optimization for 1000 trials
INFO:root:Running trials for a maximum PBS wall-time 2:00:00
WARNING:root:Attempting to run trials and stop before hitting the wall-time
WARNING:root:Some trials may not complete if the wall-time is reached. Optuna will start over.
INFO:echo.src.base_objective:Attempting to automatically update the model configuration using optuna's suggested parameters
INFO:echo.src.base_objective:	data:norm : zscore
INFO:echo.src.base_objective:	model:name : deeplabv3+
INFO:echo.src.base_objective:	optimizer:learning_rate : 0.002303407577307165
INFO:echo.src.base_objective:	trainer:train_batch_size : 19
INFO:echo.src.base_objective:	trainer:weight_decay : 2.218964152196667e-08
INFO:echo.src.base_objective:	trainer:training_loss : mae
INFO:echo.src.base_objective:Beginning trial 21
INFO:root:Loading model deeplabv3+ with settings {'in_channels': 4, 'classes': 1, 'activation': 'sigmoid'}
INFO:root:Loading loss smooth
INFO:root:Loading loss smooth
INFO:echo.src.base_objective:Saving trial 21 results to local file /glade/work/kdagon/s2sml/results_week3_SH_510/trial_results/trial_results_29296.gusched01.csv
INFO:echo.src.base_objective:Merging trial results and saving to /glade/work/kdagon/s2sml/results_week3_SH_510/trial_results.csv
[32m[I 2023-05-10 20:03:01,073][0m Trial 21 finished with values: [1.1388554874953616, 3.667701841524662, 2.0843159233390645] and parameters: {'learning_rate': 0.002303407577307165, 'norm': 'zscore', 'weight_decay': 2.218964152196667e-08, 'train_batch_size': 19, 'training_loss': 'mae', 'model_name': 'deeplabv3+'}. [0m
INFO:echo.src.base_objective:Attempting to automatically update the model configuration using optuna's suggested parameters
INFO:echo.src.base_objective:	data:norm : None
INFO:echo.src.base_objective:	model:name : fpn
INFO:echo.src.base_objective:	optimizer:learning_rate : 0.004668813412492273
INFO:echo.src.base_objective:	trainer:train_batch_size : 89
INFO:echo.src.base_objective:	trainer:weight_decay : 4.8373003391961337e-08
INFO:echo.src.base_objective:	trainer:training_loss : mae
INFO:echo.src.base_objective:Beginning trial 22
INFO:root:Loading model fpn with settings {'in_channels': 4, 'classes': 1, 'activation': 'sigmoid'}
INFO:root:Loading loss smooth
INFO:root:Loading loss smooth
INFO:echo.src.base_objective:Saving trial 22 results to local file /glade/work/kdagon/s2sml/results_week3_SH_510/trial_results/trial_results_29296.gusched01.csv
INFO:echo.src.base_objective:Merging trial results and saving to /glade/work/kdagon/s2sml/results_week3_SH_510/trial_results.csv
[32m[I 2023-05-10 20:05:20,888][0m Trial 22 finished with values: [26.20750019741562, 12056.507611742445, 162.33530580550791] and parameters: {'learning_rate': 0.004668813412492273, 'norm': 'None', 'weight_decay': 4.8373003391961337e-08, 'train_batch_size': 89, 'training_loss': 'mae', 'model_name': 'fpn'}. [0m
INFO:echo.src.base_objective:Attempting to automatically update the model configuration using optuna's suggested parameters
INFO:echo.src.base_objective:	data:norm : None
INFO:echo.src.base_objective:	model:name : pspnet
INFO:echo.src.base_objective:	optimizer:learning_rate : 3.243206692723839e-05
INFO:echo.src.base_objective:	trainer:train_batch_size : 91
INFO:echo.src.base_objective:	trainer:weight_decay : 0.0004384422270597085
INFO:echo.src.base_objective:	trainer:training_loss : huber
INFO:echo.src.base_objective:Beginning trial 23
INFO:root:Loading model pspnet with settings {'in_channels': 4, 'classes': 1, 'activation': 'sigmoid'}
INFO:root:Loading loss smooth
INFO:root:Loading loss smooth
INFO:echo.src.base_objective:Saving trial 23 results to local file /glade/work/kdagon/s2sml/results_week3_SH_510/trial_results/trial_results_29296.gusched01.csv
INFO:echo.src.base_objective:Merging trial results and saving to /glade/work/kdagon/s2sml/results_week3_SH_510/trial_results.csv
[32m[I 2023-05-10 20:07:41,284][0m Trial 23 finished with values: [1.5687348452309964, 12079.09043114002, 162.48817328609832] and parameters: {'learning_rate': 3.243206692723839e-05, 'norm': 'None', 'weight_decay': 0.0004384422270597085, 'train_batch_size': 91, 'training_loss': 'huber', 'model_name': 'pspnet'}. [0m
INFO:echo.src.base_objective:Attempting to automatically update the model configuration using optuna's suggested parameters
INFO:echo.src.base_objective:	data:norm : negone
INFO:echo.src.base_objective:	model:name : unet++
INFO:echo.src.base_objective:	optimizer:learning_rate : 0.0028365952354959907
INFO:echo.src.base_objective:	trainer:train_batch_size : 55
INFO:echo.src.base_objective:	trainer:weight_decay : 3.870820376340573e-06
INFO:echo.src.base_objective:	trainer:training_loss : logcosh
INFO:echo.src.base_objective:Beginning trial 24
INFO:root:Loading model unet++ with settings {'in_channels': 4, 'classes': 1, 'activation': 'sigmoid'}
INFO:root:Loading loss smooth
INFO:root:Loading loss smooth
INFO:echo.src.base_objective:Saving trial 24 results to local file /glade/work/kdagon/s2sml/results_week3_SH_510/trial_results/trial_results_29296.gusched01.csv
INFO:echo.src.base_objective:Merging trial results and saving to /glade/work/kdagon/s2sml/results_week3_SH_510/trial_results.csv
[32m[I 2023-05-10 20:18:27,919][0m Trial 24 finished with values: [0.9927522128695282, 0.9063513049742883, 0.9214278353803503] and parameters: {'learning_rate': 0.0028365952354959907, 'norm': 'negone', 'weight_decay': 3.870820376340573e-06, 'train_batch_size': 55, 'training_loss': 'logcosh', 'model_name': 'unet++'}. [0m
INFO:echo.src.base_objective:Attempting to automatically update the model configuration using optuna's suggested parameters
INFO:echo.src.base_objective:	data:norm : minmax
INFO:echo.src.base_objective:	model:name : manet
INFO:echo.src.base_objective:	optimizer:learning_rate : 0.00019534907387375866
INFO:echo.src.base_objective:	trainer:train_batch_size : 104
INFO:echo.src.base_objective:	trainer:weight_decay : 7.943170672947882e-05
INFO:echo.src.base_objective:	trainer:training_loss : smooth
INFO:echo.src.base_objective:Beginning trial 25
INFO:root:Loading model manet with settings {'in_channels': 4, 'classes': 1, 'activation': 'sigmoid'}
INFO:root:Loading loss smooth
INFO:root:Loading loss smooth
INFO:echo.src.base_objective:Saving trial 25 results to local file /glade/work/kdagon/s2sml/results_week3_SH_510/trial_results/trial_results_29296.gusched01.csv
INFO:echo.src.base_objective:Merging trial results and saving to /glade/work/kdagon/s2sml/results_week3_SH_510/trial_results.csv
[32m[I 2023-05-10 20:37:54,354][0m Trial 25 finished with values: [0.9613712960476408, 0.3872332027621462, 0.6779033044011005] and parameters: {'learning_rate': 0.00019534907387375866, 'norm': 'minmax', 'weight_decay': 7.943170672947882e-05, 'train_batch_size': 104, 'training_loss': 'smooth', 'model_name': 'manet'}. [0m
INFO:echo.src.base_objective:Attempting to automatically update the model configuration using optuna's suggested parameters
INFO:echo.src.base_objective:	data:norm : minmax
INFO:echo.src.base_objective:	model:name : pspnet
INFO:echo.src.base_objective:	optimizer:learning_rate : 0.0027569193269758557
INFO:echo.src.base_objective:	trainer:train_batch_size : 74
INFO:echo.src.base_objective:	trainer:weight_decay : 7.271017544806836e-09
INFO:echo.src.base_objective:	trainer:training_loss : logcosh
INFO:echo.src.base_objective:Beginning trial 26
INFO:root:Loading model pspnet with settings {'in_channels': 4, 'classes': 1, 'activation': 'sigmoid'}
INFO:root:Loading loss smooth
INFO:root:Loading loss smooth
INFO:echo.src.base_objective:Saving trial 26 results to local file /glade/work/kdagon/s2sml/results_week3_SH_510/trial_results/trial_results_29296.gusched01.csv
INFO:echo.src.base_objective:Merging trial results and saving to /glade/work/kdagon/s2sml/results_week3_SH_510/trial_results.csv
[32m[I 2023-05-10 20:44:28,759][0m Trial 26 finished with values: [1.0763274439328396, 1.5603077065465099, 1.2681775512153997] and parameters: {'learning_rate': 0.0027569193269758557, 'norm': 'minmax', 'weight_decay': 7.271017544806836e-09, 'train_batch_size': 74, 'training_loss': 'logcosh', 'model_name': 'pspnet'}. [0m
INFO:echo.src.base_objective:Attempting to automatically update the model configuration using optuna's suggested parameters
INFO:echo.src.base_objective:	data:norm : minmax
INFO:echo.src.base_objective:	model:name : deeplabv3+
INFO:echo.src.base_objective:	optimizer:learning_rate : 2.6120174161463345e-05
INFO:echo.src.base_objective:	trainer:train_batch_size : 48
INFO:echo.src.base_objective:	trainer:weight_decay : 8.761710225656118e-08
INFO:echo.src.base_objective:	trainer:training_loss : xsigmoid
INFO:echo.src.base_objective:Beginning trial 27
INFO:root:Loading model deeplabv3+ with settings {'in_channels': 4, 'classes': 1, 'activation': 'sigmoid'}
INFO:root:Loading loss smooth
INFO:root:Loading loss smooth
INFO:echo.src.base_objective:Saving trial 27 results to local file /glade/work/kdagon/s2sml/results_week3_SH_510/trial_results/trial_results_29296.gusched01.csv
INFO:echo.src.base_objective:Merging trial results and saving to /glade/work/kdagon/s2sml/results_week3_SH_510/trial_results.csv
