[32m[I 2023-05-11 20:45:48,048][0m Trial 140 finished with values: [0.9573700909133677, 0.3454926216197966, 0.6390579004480068] and parameters: {'learning_rate': 0.0013253323499503216, 'norm': 'minmax', 'weight_decay': 0.0002915569169651037, 'train_batch_size': 29, 'training_loss': 'logcosh', 'model_name': 'unet++'}. [0m
INFO:echo.src.base_objective:Attempting to automatically update the model configuration using optuna's suggested parameters
INFO:echo.src.base_objective:	data:norm : minmax
INFO:echo.src.base_objective:	model:name : unet++
INFO:echo.src.base_objective:	optimizer:learning_rate : 0.0009458715450642753
INFO:echo.src.base_objective:	trainer:train_batch_size : 35
INFO:echo.src.base_objective:	trainer:weight_decay : 0.0009839149043112223
INFO:echo.src.base_objective:	trainer:training_loss : logcosh
INFO:echo.src.base_objective:Beginning trial 141
INFO:root:Loading model unet++ with settings {'in_channels': 4, 'classes': 1, 'activation': 'sigmoid'}
INFO:root:Loading loss smooth
INFO:root:Loading loss smooth
INFO:echo.src.base_objective:Saving trial 141 results to local file /glade/work/kdagon/s2sml/results_week3_SH_510/trial_results/trial_results_29311.gusched01.csv
INFO:echo.src.base_objective:Merging trial results and saving to /glade/work/kdagon/s2sml/results_week3_SH_510/trial_results.csv
[32m[I 2023-05-11 20:56:34,669][0m Trial 141 finished with values: [0.957530487028661, 0.3517313619830887, 0.6473359087862947] and parameters: {'learning_rate': 0.0009458715450642753, 'norm': 'minmax', 'weight_decay': 0.0009839149043112223, 'train_batch_size': 35, 'training_loss': 'logcosh', 'model_name': 'unet++'}. [0m
INFO:echo.src.base_objective:Attempting to automatically update the model configuration using optuna's suggested parameters
INFO:echo.src.base_objective:	data:norm : minmax
INFO:echo.src.base_objective:	model:name : unet++
INFO:echo.src.base_objective:	optimizer:learning_rate : 0.0012170641713974176
INFO:echo.src.base_objective:	trainer:train_batch_size : 24
INFO:echo.src.base_objective:	trainer:weight_decay : 0.00014508263030182906
INFO:echo.src.base_objective:	trainer:training_loss : logcosh
INFO:echo.src.base_objective:Beginning trial 142
INFO:root:Loading model unet++ with settings {'in_channels': 4, 'classes': 1, 'activation': 'sigmoid'}
INFO:root:Loading loss smooth
INFO:root:Loading loss smooth
INFO:echo.src.base_objective:Saving trial 142 results to local file /glade/work/kdagon/s2sml/results_week3_SH_510/trial_results/trial_results_29311.gusched01.csv
INFO:echo.src.base_objective:Merging trial results and saving to /glade/work/kdagon/s2sml/results_week3_SH_510/trial_results.csv
[32m[I 2023-05-11 21:09:12,038][0m Trial 142 finished with values: [0.9570085189947349, 0.3448728972788764, 0.6372500303438958] and parameters: {'learning_rate': 0.0012170641713974176, 'norm': 'minmax', 'weight_decay': 0.00014508263030182906, 'train_batch_size': 24, 'training_loss': 'logcosh', 'model_name': 'unet++'}. [0m
WARNING:root:Stopping early since the longest observed run-time in the study exceeds the time remaining on this node.
INFO:root:Saving trial details to /glade/work/kdagon/s2sml/results_week3_SH_510/
INFO:root:Running on PBS/SLURM batch id: 29312.gusched01
INFO:root:Importing custom objective from /glade/work/kdagon/s2sml/applications/train.py
INFO:echo.src.reporting:Using device 0
INFO:root:Direction of optimization: ['minimize', 'minimize', 'minimize']
INFO:root:Using metric ['valid_custom', 'valid_custom_second', 'valid_custom_third']
[32m[I 2023-05-11 21:09:35,028][0m Using an existing study with name 'vanilla' instead of creating a new one.[0m
INFO:root:Loaded study vanilla located at sqlite:////glade/work/kdagon/s2sml/results_week3_SH_510/s2s.db
INFO:echo.src.base_objective:Worker 29312.gusched01 is summoned.
INFO:echo.src.base_objective:	initializing an objective to be optimized with metric ['valid_custom', 'valid_custom_second', 'valid_custom_third']
INFO:echo.src.base_objective:	using device(s) cuda:0
INFO:echo.src.base_objective:	saving study/trial results to local file /glade/work/kdagon/s2sml/results_week3_SH_510/trial_results/trial_results_29312.gusched01.csv
INFO:root:Running optimization for 1000 trials
INFO:root:Running trials for a maximum PBS wall-time 2:00:00
WARNING:root:Attempting to run trials and stop before hitting the wall-time
WARNING:root:Some trials may not complete if the wall-time is reached. Optuna will start over.
INFO:echo.src.base_objective:Attempting to automatically update the model configuration using optuna's suggested parameters
INFO:echo.src.base_objective:	data:norm : minmax
INFO:echo.src.base_objective:	model:name : unet++
INFO:echo.src.base_objective:	optimizer:learning_rate : 0.0007830040537547258
INFO:echo.src.base_objective:	trainer:train_batch_size : 41
INFO:echo.src.base_objective:	trainer:weight_decay : 0.00041775646515502943
INFO:echo.src.base_objective:	trainer:training_loss : logcosh
INFO:echo.src.base_objective:Beginning trial 143
INFO:root:Loading model unet++ with settings {'in_channels': 4, 'classes': 1, 'activation': 'sigmoid'}
INFO:root:Loading loss smooth
INFO:root:Loading loss smooth
INFO:echo.src.base_objective:Saving trial 143 results to local file /glade/work/kdagon/s2sml/results_week3_SH_510/trial_results/trial_results_29312.gusched01.csv
INFO:echo.src.base_objective:Merging trial results and saving to /glade/work/kdagon/s2sml/results_week3_SH_510/trial_results.csv
[32m[I 2023-05-11 21:22:11,977][0m Trial 143 finished with values: [0.9569470482530434, 0.3395270362024817, 0.6354976609113429] and parameters: {'learning_rate': 0.0007830040537547258, 'norm': 'minmax', 'weight_decay': 0.00041775646515502943, 'train_batch_size': 41, 'training_loss': 'logcosh', 'model_name': 'unet++'}. [0m
INFO:echo.src.base_objective:Attempting to automatically update the model configuration using optuna's suggested parameters
INFO:echo.src.base_objective:	data:norm : minmax
INFO:echo.src.base_objective:	model:name : unet++
INFO:echo.src.base_objective:	optimizer:learning_rate : 0.0010726531674515136
INFO:echo.src.base_objective:	trainer:train_batch_size : 24
INFO:echo.src.base_objective:	trainer:weight_decay : 0.0005689157970995411
INFO:echo.src.base_objective:	trainer:training_loss : logcosh
INFO:echo.src.base_objective:Beginning trial 144
INFO:root:Loading model unet++ with settings {'in_channels': 4, 'classes': 1, 'activation': 'sigmoid'}
INFO:root:Loading loss smooth
INFO:root:Loading loss smooth
INFO:echo.src.base_objective:Saving trial 144 results to local file /glade/work/kdagon/s2sml/results_week3_SH_510/trial_results/trial_results_29312.gusched01.csv
INFO:echo.src.base_objective:Merging trial results and saving to /glade/work/kdagon/s2sml/results_week3_SH_510/trial_results.csv
[32m[I 2023-05-11 21:38:29,360][0m Trial 144 finished with values: [0.9565769963438612, 0.33177635891366153, 0.6229792349152274] and parameters: {'learning_rate': 0.0010726531674515136, 'norm': 'minmax', 'weight_decay': 0.0005689157970995411, 'train_batch_size': 24, 'training_loss': 'logcosh', 'model_name': 'unet++'}. [0m
INFO:echo.src.base_objective:Attempting to automatically update the model configuration using optuna's suggested parameters
INFO:echo.src.base_objective:	data:norm : minmax
INFO:echo.src.base_objective:	model:name : linknet
INFO:echo.src.base_objective:	optimizer:learning_rate : 1.787519835459144e-05
INFO:echo.src.base_objective:	trainer:train_batch_size : 14
INFO:echo.src.base_objective:	trainer:weight_decay : 3.103041550976799e-08
INFO:echo.src.base_objective:	trainer:training_loss : logcosh
INFO:echo.src.base_objective:Beginning trial 145
INFO:root:Loading model linknet with settings {'in_channels': 4, 'classes': 1, 'activation': 'sigmoid'}
INFO:root:Loading loss smooth
INFO:root:Loading loss smooth
INFO:echo.src.base_objective:Saving trial 145 results to local file /glade/work/kdagon/s2sml/results_week3_SH_510/trial_results/trial_results_29312.gusched01.csv
INFO:echo.src.base_objective:Merging trial results and saving to /glade/work/kdagon/s2sml/results_week3_SH_510/trial_results.csv
[32m[I 2023-05-11 21:45:46,492][0m Trial 145 finished with values: [1.185257380557157, 2.62881010357985, 1.8041512566607234] and parameters: {'learning_rate': 1.787519835459144e-05, 'norm': 'minmax', 'weight_decay': 3.103041550976799e-08, 'train_batch_size': 14, 'training_loss': 'logcosh', 'model_name': 'linknet'}. [0m
INFO:echo.src.base_objective:Attempting to automatically update the model configuration using optuna's suggested parameters
INFO:echo.src.base_objective:	data:norm : minmax
INFO:echo.src.base_objective:	model:name : linknet
INFO:echo.src.base_objective:	optimizer:learning_rate : 5.5871983375504115e-05
INFO:echo.src.base_objective:	trainer:train_batch_size : 16
INFO:echo.src.base_objective:	trainer:weight_decay : 0.00012872002645525896
INFO:echo.src.base_objective:	trainer:training_loss : logcosh
INFO:echo.src.base_objective:Beginning trial 146
INFO:root:Loading model linknet with settings {'in_channels': 4, 'classes': 1, 'activation': 'sigmoid'}
INFO:root:Loading loss smooth
INFO:root:Loading loss smooth
INFO:echo.src.base_objective:Saving trial 146 results to local file /glade/work/kdagon/s2sml/results_week3_SH_510/trial_results/trial_results_29312.gusched01.csv
INFO:echo.src.base_objective:Merging trial results and saving to /glade/work/kdagon/s2sml/results_week3_SH_510/trial_results.csv
[32m[I 2023-05-11 22:03:26,128][0m Trial 146 finished with values: [0.9749773881471544, 0.5408263779090624, 0.8117412532680747] and parameters: {'learning_rate': 5.5871983375504115e-05, 'norm': 'minmax', 'weight_decay': 0.00012872002645525896, 'train_batch_size': 16, 'training_loss': 'logcosh', 'model_name': 'linknet'}. [0m
INFO:echo.src.base_objective:Attempting to automatically update the model configuration using optuna's suggested parameters
INFO:echo.src.base_objective:	data:norm : minmax
INFO:echo.src.base_objective:	model:name : unet
INFO:echo.src.base_objective:	optimizer:learning_rate : 0.0007252204333117963
INFO:echo.src.base_objective:	trainer:train_batch_size : 11
INFO:echo.src.base_objective:	trainer:weight_decay : 1.1047959970484158e-12
INFO:echo.src.base_objective:	trainer:training_loss : logcosh
INFO:echo.src.base_objective:Beginning trial 147
INFO:root:Loading model unet with settings {'in_channels': 4, 'classes': 1, 'activation': 'sigmoid'}
INFO:root:Loading loss smooth
INFO:root:Loading loss smooth
INFO:echo.src.base_objective:Saving trial 147 results to local file /glade/work/kdagon/s2sml/results_week3_SH_510/trial_results/trial_results_29312.gusched01.csv
INFO:echo.src.base_objective:Merging trial results and saving to /glade/work/kdagon/s2sml/results_week3_SH_510/trial_results.csv
[32m[I 2023-05-11 22:08:55,309][0m Trial 147 finished with values: [0.9647653345803944, 0.44499379777386844, 0.7371637457031214] and parameters: {'learning_rate': 0.0007252204333117963, 'norm': 'minmax', 'weight_decay': 1.1047959970484158e-12, 'train_batch_size': 11, 'training_loss': 'logcosh', 'model_name': 'unet'}. [0m
INFO:echo.src.base_objective:Attempting to automatically update the model configuration using optuna's suggested parameters
INFO:echo.src.base_objective:	data:norm : minmax
INFO:echo.src.base_objective:	model:name : deeplabv3
INFO:echo.src.base_objective:	optimizer:learning_rate : 4.325506782049963e-05
INFO:echo.src.base_objective:	trainer:train_batch_size : 7
INFO:echo.src.base_objective:	trainer:weight_decay : 0.00023340188229107722
INFO:echo.src.base_objective:	trainer:training_loss : logcosh
INFO:echo.src.base_objective:Beginning trial 148
INFO:root:Loading model deeplabv3 with settings {'in_channels': 4, 'classes': 1, 'activation': 'sigmoid'}
INFO:root:Loading loss smooth
INFO:root:Loading loss smooth
INFO:echo.src.base_objective:Saving trial 148 results to local file /glade/work/kdagon/s2sml/results_week3_SH_510/trial_results/trial_results_29312.gusched01.csv
INFO:echo.src.base_objective:Merging trial results and saving to /glade/work/kdagon/s2sml/results_week3_SH_510/trial_results.csv
[32m[I 2023-05-11 22:23:30,167][0m Trial 148 finished with values: [1.0627180372122407, 1.4080805131580856, 1.207747421918192] and parameters: {'learning_rate': 4.325506782049963e-05, 'norm': 'minmax', 'weight_decay': 0.00023340188229107722, 'train_batch_size': 7, 'training_loss': 'logcosh', 'model_name': 'deeplabv3'}. [0m
INFO:echo.src.base_objective:Attempting to automatically update the model configuration using optuna's suggested parameters
INFO:echo.src.base_objective:	data:norm : minmax
INFO:echo.src.base_objective:	model:name : unet
INFO:echo.src.base_objective:	optimizer:learning_rate : 0.0008575881475295273
INFO:echo.src.base_objective:	trainer:train_batch_size : 17
INFO:echo.src.base_objective:	trainer:weight_decay : 0.0003942414957412481
INFO:echo.src.base_objective:	trainer:training_loss : logcosh
INFO:echo.src.base_objective:Beginning trial 149
INFO:root:Loading model unet with settings {'in_channels': 4, 'classes': 1, 'activation': 'sigmoid'}
INFO:root:Loading loss smooth
INFO:root:Loading loss smooth
INFO:echo.src.base_objective:Saving trial 149 results to local file /glade/work/kdagon/s2sml/results_week3_SH_510/trial_results/trial_results_29312.gusched01.csv
INFO:echo.src.base_objective:Merging trial results and saving to /glade/work/kdagon/s2sml/results_week3_SH_510/trial_results.csv
[32m[I 2023-05-11 22:27:24,164][0m Trial 149 finished with values: [0.9667991941804872, 0.4530689801208045, 0.7387008118493057] and parameters: {'learning_rate': 0.0008575881475295273, 'norm': 'minmax', 'weight_decay': 0.0003942414957412481, 'train_batch_size': 17, 'training_loss': 'logcosh', 'model_name': 'unet'}. [0m
INFO:echo.src.base_objective:Attempting to automatically update the model configuration using optuna's suggested parameters
INFO:echo.src.base_objective:	data:norm : minmax
INFO:echo.src.base_objective:	model:name : unet++
INFO:echo.src.base_objective:	optimizer:learning_rate : 0.0010748279727402954
INFO:echo.src.base_objective:	trainer:train_batch_size : 22
INFO:echo.src.base_objective:	trainer:weight_decay : 0.000572774199384401
INFO:echo.src.base_objective:	trainer:training_loss : logcosh
INFO:echo.src.base_objective:Beginning trial 150
INFO:root:Loading model unet++ with settings {'in_channels': 4, 'classes': 1, 'activation': 'sigmoid'}
INFO:root:Loading loss smooth
INFO:root:Loading loss smooth
INFO:echo.src.base_objective:Saving trial 150 results to local file /glade/work/kdagon/s2sml/results_week3_SH_510/trial_results/trial_results_29312.gusched01.csv
INFO:echo.src.base_objective:Merging trial results and saving to /glade/work/kdagon/s2sml/results_week3_SH_510/trial_results.csv
[32m[I 2023-05-11 22:44:00,169][0m Trial 150 finished with values: [0.9563385355289835, 0.3300474103928613, 0.6180548886821368] and parameters: {'learning_rate': 0.0010748279727402954, 'norm': 'minmax', 'weight_decay': 0.000572774199384401, 'train_batch_size': 22, 'training_loss': 'logcosh', 'model_name': 'unet++'}. [0m
WARNING:root:Stopping early since the longest observed run-time in the study exceeds the time remaining on this node.
