[32m[I 2023-05-11 11:48:57,913][0m Trial 98 finished with values: [1.0581501464130147, 2.7739093933061096, 1.9567348824866284] and parameters: {'learning_rate': 1.443262446132864e-05, 'norm': 'negone', 'weight_decay': 2.6798261635092496e-06, 'train_batch_size': 50, 'training_loss': 'xsigmoid', 'model_name': 'deeplabv3+'}. [0m
WARNING:root:Stopping early since the longest observed run-time in the study exceeds the time remaining on this node.
INFO:root:Saving trial details to /glade/work/kdagon/s2sml/results_week3_SH_510/
INFO:root:Running on PBS/SLURM batch id: 29306.gusched01
INFO:root:Importing custom objective from /glade/work/kdagon/s2sml/applications/train.py
INFO:echo.src.reporting:Using device 0
INFO:root:Direction of optimization: ['minimize', 'minimize', 'minimize']
INFO:root:Using metric ['valid_custom', 'valid_custom_second', 'valid_custom_third']
[32m[I 2023-05-11 11:50:00,790][0m Using an existing study with name 'vanilla' instead of creating a new one.[0m
INFO:root:Loaded study vanilla located at sqlite:////glade/work/kdagon/s2sml/results_week3_SH_510/s2s.db
INFO:echo.src.base_objective:Worker 29306.gusched01 is summoned.
INFO:echo.src.base_objective:	initializing an objective to be optimized with metric ['valid_custom', 'valid_custom_second', 'valid_custom_third']
INFO:echo.src.base_objective:	using device(s) cuda:0
INFO:echo.src.base_objective:	saving study/trial results to local file /glade/work/kdagon/s2sml/results_week3_SH_510/trial_results/trial_results_29306.gusched01.csv
INFO:root:Running optimization for 1000 trials
INFO:root:Running trials for a maximum PBS wall-time 2:00:00
WARNING:root:Attempting to run trials and stop before hitting the wall-time
WARNING:root:Some trials may not complete if the wall-time is reached. Optuna will start over.
INFO:echo.src.base_objective:Attempting to automatically update the model configuration using optuna's suggested parameters
INFO:echo.src.base_objective:	data:norm : negone
INFO:echo.src.base_objective:	model:name : deeplabv3+
INFO:echo.src.base_objective:	optimizer:learning_rate : 0.003877142404604691
INFO:echo.src.base_objective:	trainer:train_batch_size : 117
INFO:echo.src.base_objective:	trainer:weight_decay : 2.2718076157350836e-07
INFO:echo.src.base_objective:	trainer:training_loss : logcosh
INFO:echo.src.base_objective:Beginning trial 99
INFO:root:Loading model deeplabv3+ with settings {'in_channels': 4, 'classes': 1, 'activation': 'sigmoid'}
INFO:root:Loading loss smooth
INFO:root:Loading loss smooth
INFO:echo.src.base_objective:Saving trial 99 results to local file /glade/work/kdagon/s2sml/results_week3_SH_510/trial_results/trial_results_29306.gusched01.csv
INFO:echo.src.base_objective:Merging trial results and saving to /glade/work/kdagon/s2sml/results_week3_SH_510/trial_results.csv
[32m[I 2023-05-11 12:04:08,893][0m Trial 99 finished with values: [1.0404345061182558, 1.2714339698122537, 1.0995020122849755] and parameters: {'learning_rate': 0.003877142404604691, 'norm': 'negone', 'weight_decay': 2.2718076157350836e-07, 'train_batch_size': 117, 'training_loss': 'logcosh', 'model_name': 'deeplabv3+'}. [0m
INFO:echo.src.base_objective:Attempting to automatically update the model configuration using optuna's suggested parameters
INFO:echo.src.base_objective:	data:norm : minmax
INFO:echo.src.base_objective:	model:name : unet++
INFO:echo.src.base_objective:	optimizer:learning_rate : 0.00048068489537828426
INFO:echo.src.base_objective:	trainer:train_batch_size : 41
INFO:echo.src.base_objective:	trainer:weight_decay : 4.802596202763959e-11
INFO:echo.src.base_objective:	trainer:training_loss : logcosh
INFO:echo.src.base_objective:Beginning trial 100
INFO:root:Loading model unet++ with settings {'in_channels': 4, 'classes': 1, 'activation': 'sigmoid'}
INFO:root:Loading loss smooth
INFO:root:Loading loss smooth
INFO:echo.src.base_objective:Saving trial 100 results to local file /glade/work/kdagon/s2sml/results_week3_SH_510/trial_results/trial_results_29306.gusched01.csv
INFO:echo.src.base_objective:Merging trial results and saving to /glade/work/kdagon/s2sml/results_week3_SH_510/trial_results.csv
[32m[I 2023-05-11 12:14:49,246][0m Trial 100 finished with values: [0.9577603980744976, 0.3547400736204951, 0.65522185856596] and parameters: {'learning_rate': 0.00048068489537828426, 'norm': 'minmax', 'weight_decay': 4.802596202763959e-11, 'train_batch_size': 41, 'training_loss': 'logcosh', 'model_name': 'unet++'}. [0m
INFO:echo.src.base_objective:Attempting to automatically update the model configuration using optuna's suggested parameters
INFO:echo.src.base_objective:	data:norm : minmax
INFO:echo.src.base_objective:	model:name : unet++
INFO:echo.src.base_objective:	optimizer:learning_rate : 0.0005255729344740429
INFO:echo.src.base_objective:	trainer:train_batch_size : 43
INFO:echo.src.base_objective:	trainer:weight_decay : 2.9598315432876316e-11
INFO:echo.src.base_objective:	trainer:training_loss : logcosh
INFO:echo.src.base_objective:Beginning trial 101
INFO:root:Loading model unet++ with settings {'in_channels': 4, 'classes': 1, 'activation': 'sigmoid'}
INFO:root:Loading loss smooth
INFO:root:Loading loss smooth
INFO:echo.src.base_objective:Saving trial 101 results to local file /glade/work/kdagon/s2sml/results_week3_SH_510/trial_results/trial_results_29306.gusched01.csv
INFO:echo.src.base_objective:Merging trial results and saving to /glade/work/kdagon/s2sml/results_week3_SH_510/trial_results.csv
[32m[I 2023-05-11 12:27:17,786][0m Trial 101 finished with values: [0.9571673843365893, 0.3392425824071751, 0.6357225520521441] and parameters: {'learning_rate': 0.0005255729344740429, 'norm': 'minmax', 'weight_decay': 2.9598315432876316e-11, 'train_batch_size': 43, 'training_loss': 'logcosh', 'model_name': 'unet++'}. [0m
INFO:echo.src.base_objective:Attempting to automatically update the model configuration using optuna's suggested parameters
INFO:echo.src.base_objective:	data:norm : minmax
INFO:echo.src.base_objective:	model:name : unet++
INFO:echo.src.base_objective:	optimizer:learning_rate : 0.0005261176328814102
INFO:echo.src.base_objective:	trainer:train_batch_size : 44
INFO:echo.src.base_objective:	trainer:weight_decay : 3.8227658332100756e-11
INFO:echo.src.base_objective:	trainer:training_loss : logcosh
INFO:echo.src.base_objective:Beginning trial 102
INFO:root:Loading model unet++ with settings {'in_channels': 4, 'classes': 1, 'activation': 'sigmoid'}
INFO:root:Loading loss smooth
INFO:root:Loading loss smooth
INFO:echo.src.base_objective:Saving trial 102 results to local file /glade/work/kdagon/s2sml/results_week3_SH_510/trial_results/trial_results_29306.gusched01.csv
INFO:echo.src.base_objective:Merging trial results and saving to /glade/work/kdagon/s2sml/results_week3_SH_510/trial_results.csv
[32m[I 2023-05-11 12:39:00,136][0m Trial 102 finished with values: [0.9573143167485197, 0.3409533825898599, 0.6375017342069512] and parameters: {'learning_rate': 0.0005261176328814102, 'norm': 'minmax', 'weight_decay': 3.8227658332100756e-11, 'train_batch_size': 44, 'training_loss': 'logcosh', 'model_name': 'unet++'}. [0m
INFO:echo.src.base_objective:Attempting to automatically update the model configuration using optuna's suggested parameters
INFO:echo.src.base_objective:	data:norm : minmax
INFO:echo.src.base_objective:	model:name : unet++
INFO:echo.src.base_objective:	optimizer:learning_rate : 0.00047394641243643385
INFO:echo.src.base_objective:	trainer:train_batch_size : 44
INFO:echo.src.base_objective:	trainer:weight_decay : 2.7740578990108866e-11
INFO:echo.src.base_objective:	trainer:training_loss : logcosh
INFO:echo.src.base_objective:Beginning trial 103
INFO:root:Loading model unet++ with settings {'in_channels': 4, 'classes': 1, 'activation': 'sigmoid'}
INFO:root:Loading loss smooth
INFO:root:Loading loss smooth
INFO:echo.src.base_objective:Saving trial 103 results to local file /glade/work/kdagon/s2sml/results_week3_SH_510/trial_results/trial_results_29306.gusched01.csv
INFO:echo.src.base_objective:Merging trial results and saving to /glade/work/kdagon/s2sml/results_week3_SH_510/trial_results.csv
[32m[I 2023-05-11 12:50:43,204][0m Trial 103 finished with values: [0.9578639249498845, 0.34761069970433367, 0.6412049598061716] and parameters: {'learning_rate': 0.00047394641243643385, 'norm': 'minmax', 'weight_decay': 2.7740578990108866e-11, 'train_batch_size': 44, 'training_loss': 'logcosh', 'model_name': 'unet++'}. [0m
INFO:echo.src.base_objective:Attempting to automatically update the model configuration using optuna's suggested parameters
INFO:echo.src.base_objective:	data:norm : minmax
INFO:echo.src.base_objective:	model:name : unet++
INFO:echo.src.base_objective:	optimizer:learning_rate : 0.0004828020210797112
INFO:echo.src.base_objective:	trainer:train_batch_size : 43
INFO:echo.src.base_objective:	trainer:weight_decay : 3.997693652757779e-11
INFO:echo.src.base_objective:	trainer:training_loss : logcosh
INFO:echo.src.base_objective:Beginning trial 104
INFO:root:Loading model unet++ with settings {'in_channels': 4, 'classes': 1, 'activation': 'sigmoid'}
INFO:root:Loading loss smooth
INFO:root:Loading loss smooth
INFO:echo.src.base_objective:Saving trial 104 results to local file /glade/work/kdagon/s2sml/results_week3_SH_510/trial_results/trial_results_29306.gusched01.csv
INFO:echo.src.base_objective:Merging trial results and saving to /glade/work/kdagon/s2sml/results_week3_SH_510/trial_results.csv
[32m[I 2023-05-11 13:02:30,573][0m Trial 104 finished with values: [0.9580598506265613, 0.34918269948823794, 0.6444614428063462] and parameters: {'learning_rate': 0.0004828020210797112, 'norm': 'minmax', 'weight_decay': 3.997693652757779e-11, 'train_batch_size': 43, 'training_loss': 'logcosh', 'model_name': 'unet++'}. [0m
INFO:echo.src.base_objective:Attempting to automatically update the model configuration using optuna's suggested parameters
INFO:echo.src.base_objective:	data:norm : minmax
INFO:echo.src.base_objective:	model:name : unet++
INFO:echo.src.base_objective:	optimizer:learning_rate : 0.0004574670457733144
INFO:echo.src.base_objective:	trainer:train_batch_size : 43
INFO:echo.src.base_objective:	trainer:weight_decay : 2.8309463706789842e-11
INFO:echo.src.base_objective:	trainer:training_loss : logcosh
INFO:echo.src.base_objective:Beginning trial 105
INFO:root:Loading model unet++ with settings {'in_channels': 4, 'classes': 1, 'activation': 'sigmoid'}
INFO:root:Loading loss smooth
INFO:root:Loading loss smooth
INFO:echo.src.base_objective:Saving trial 105 results to local file /glade/work/kdagon/s2sml/results_week3_SH_510/trial_results/trial_results_29306.gusched01.csv
INFO:echo.src.base_objective:Merging trial results and saving to /glade/work/kdagon/s2sml/results_week3_SH_510/trial_results.csv
[32m[I 2023-05-11 13:11:49,893][0m Trial 105 finished with values: [0.9582975958682012, 0.35271760064428986, 0.6461364440002912] and parameters: {'learning_rate': 0.0004574670457733144, 'norm': 'minmax', 'weight_decay': 2.8309463706789842e-11, 'train_batch_size': 43, 'training_loss': 'logcosh', 'model_name': 'unet++'}. [0m
INFO:echo.src.base_objective:Attempting to automatically update the model configuration using optuna's suggested parameters
INFO:echo.src.base_objective:	data:norm : minmax
INFO:echo.src.base_objective:	model:name : unet++
INFO:echo.src.base_objective:	optimizer:learning_rate : 0.0005028347921566055
INFO:echo.src.base_objective:	trainer:train_batch_size : 43
INFO:echo.src.base_objective:	trainer:weight_decay : 2.6095887762866386e-11
INFO:echo.src.base_objective:	trainer:training_loss : logcosh
INFO:echo.src.base_objective:Beginning trial 106
INFO:root:Loading model unet++ with settings {'in_channels': 4, 'classes': 1, 'activation': 'sigmoid'}
INFO:root:Loading loss smooth
INFO:root:Loading loss smooth
INFO:echo.src.base_objective:Saving trial 106 results to local file /glade/work/kdagon/s2sml/results_week3_SH_510/trial_results/trial_results_29306.gusched01.csv
INFO:echo.src.base_objective:Merging trial results and saving to /glade/work/kdagon/s2sml/results_week3_SH_510/trial_results.csv
[32m[I 2023-05-11 13:22:54,082][0m Trial 106 finished with values: [0.9578491907436397, 0.35011535984806935, 0.6442425251710668] and parameters: {'learning_rate': 0.0005028347921566055, 'norm': 'minmax', 'weight_decay': 2.6095887762866386e-11, 'train_batch_size': 43, 'training_loss': 'logcosh', 'model_name': 'unet++'}. [0m
WARNING:root:Stopping early since the longest observed run-time in the study exceeds the time remaining on this node.
INFO:root:Saving trial details to /glade/work/kdagon/s2sml/results_week3_SH_510/
INFO:root:Running on PBS/SLURM batch id: 29307.gusched01
INFO:root:Importing custom objective from /glade/work/kdagon/s2sml/applications/train.py
INFO:echo.src.reporting:Using device 0
INFO:root:Direction of optimization: ['minimize', 'minimize', 'minimize']
INFO:root:Using metric ['valid_custom', 'valid_custom_second', 'valid_custom_third']
[32m[I 2023-05-11 13:24:08,826][0m Using an existing study with name 'vanilla' instead of creating a new one.[0m
INFO:root:Loaded study vanilla located at sqlite:////glade/work/kdagon/s2sml/results_week3_SH_510/s2s.db
INFO:echo.src.base_objective:Worker 29307.gusched01 is summoned.
INFO:echo.src.base_objective:	initializing an objective to be optimized with metric ['valid_custom', 'valid_custom_second', 'valid_custom_third']
INFO:echo.src.base_objective:	using device(s) cuda:0
INFO:echo.src.base_objective:	saving study/trial results to local file /glade/work/kdagon/s2sml/results_week3_SH_510/trial_results/trial_results_29307.gusched01.csv
INFO:root:Running optimization for 1000 trials
INFO:root:Running trials for a maximum PBS wall-time 2:00:00
WARNING:root:Attempting to run trials and stop before hitting the wall-time
WARNING:root:Some trials may not complete if the wall-time is reached. Optuna will start over.
INFO:echo.src.base_objective:Attempting to automatically update the model configuration using optuna's suggested parameters
INFO:echo.src.base_objective:	data:norm : minmax
INFO:echo.src.base_objective:	model:name : unet++
INFO:echo.src.base_objective:	optimizer:learning_rate : 0.0005012112448330442
INFO:echo.src.base_objective:	trainer:train_batch_size : 55
INFO:echo.src.base_objective:	trainer:weight_decay : 4.0817348662476314e-11
INFO:echo.src.base_objective:	trainer:training_loss : logcosh
INFO:echo.src.base_objective:Beginning trial 107
INFO:root:Loading model unet++ with settings {'in_channels': 4, 'classes': 1, 'activation': 'sigmoid'}
INFO:root:Loading loss smooth
INFO:root:Loading loss smooth
INFO:echo.src.base_objective:Saving trial 107 results to local file /glade/work/kdagon/s2sml/results_week3_SH_510/trial_results/trial_results_29307.gusched01.csv
INFO:echo.src.base_objective:Merging trial results and saving to /glade/work/kdagon/s2sml/results_week3_SH_510/trial_results.csv
[32m[I 2023-05-11 13:35:56,632][0m Trial 107 finished with values: [0.957223288234943, 0.34712525271350286, 0.6417891686462158] and parameters: {'learning_rate': 0.0005012112448330442, 'norm': 'minmax', 'weight_decay': 4.0817348662476314e-11, 'train_batch_size': 55, 'training_loss': 'logcosh', 'model_name': 'unet++'}. [0m
INFO:echo.src.base_objective:Attempting to automatically update the model configuration using optuna's suggested parameters
INFO:echo.src.base_objective:	data:norm : minmax
INFO:echo.src.base_objective:	model:name : unet++
INFO:echo.src.base_objective:	optimizer:learning_rate : 0.00048371597430271523
INFO:echo.src.base_objective:	trainer:train_batch_size : 44
INFO:echo.src.base_objective:	trainer:weight_decay : 2.4459247992038762e-11
INFO:echo.src.base_objective:	trainer:training_loss : logcosh
INFO:echo.src.base_objective:Beginning trial 108
INFO:root:Loading model unet++ with settings {'in_channels': 4, 'classes': 1, 'activation': 'sigmoid'}
INFO:root:Loading loss smooth
INFO:root:Loading loss smooth
INFO:echo.src.base_objective:Saving trial 108 results to local file /glade/work/kdagon/s2sml/results_week3_SH_510/trial_results/trial_results_29307.gusched01.csv
INFO:echo.src.base_objective:Merging trial results and saving to /glade/work/kdagon/s2sml/results_week3_SH_510/trial_results.csv
[32m[I 2023-05-11 13:46:43,033][0m Trial 108 finished with values: [0.9578611015938194, 0.3474784680775856, 0.6440686129849855] and parameters: {'learning_rate': 0.00048371597430271523, 'norm': 'minmax', 'weight_decay': 2.4459247992038762e-11, 'train_batch_size': 44, 'training_loss': 'logcosh', 'model_name': 'unet++'}. [0m
INFO:echo.src.base_objective:Attempting to automatically update the model configuration using optuna's suggested parameters
INFO:echo.src.base_objective:	data:norm : minmax
INFO:echo.src.base_objective:	model:name : unet++
INFO:echo.src.base_objective:	optimizer:learning_rate : 0.0005294480607932845
INFO:echo.src.base_objective:	trainer:train_batch_size : 54
INFO:echo.src.base_objective:	trainer:weight_decay : 4.1800813998166126e-11
INFO:echo.src.base_objective:	trainer:training_loss : logcosh
INFO:echo.src.base_objective:Beginning trial 109
INFO:root:Loading model unet++ with settings {'in_channels': 4, 'classes': 1, 'activation': 'sigmoid'}
INFO:root:Loading loss smooth
INFO:root:Loading loss smooth
INFO:echo.src.base_objective:Saving trial 109 results to local file /glade/work/kdagon/s2sml/results_week3_SH_510/trial_results/trial_results_29307.gusched01.csv
INFO:echo.src.base_objective:Merging trial results and saving to /glade/work/kdagon/s2sml/results_week3_SH_510/trial_results.csv
[32m[I 2023-05-11 13:55:56,486][0m Trial 109 finished with values: [0.9581758612159696, 0.34882954728542476, 0.6412925813023591] and parameters: {'learning_rate': 0.0005294480607932845, 'norm': 'minmax', 'weight_decay': 4.1800813998166126e-11, 'train_batch_size': 54, 'training_loss': 'logcosh', 'model_name': 'unet++'}. [0m
INFO:echo.src.base_objective:Attempting to automatically update the model configuration using optuna's suggested parameters
INFO:echo.src.base_objective:	data:norm : minmax
INFO:echo.src.base_objective:	model:name : unet++
INFO:echo.src.base_objective:	optimizer:learning_rate : 0.0005368007769889669
INFO:echo.src.base_objective:	trainer:train_batch_size : 44
INFO:echo.src.base_objective:	trainer:weight_decay : 5.153022870767592e-11
INFO:echo.src.base_objective:	trainer:training_loss : logcosh
INFO:echo.src.base_objective:Beginning trial 110
INFO:root:Loading model unet++ with settings {'in_channels': 4, 'classes': 1, 'activation': 'sigmoid'}
INFO:root:Loading loss smooth
INFO:root:Loading loss smooth
INFO:echo.src.base_objective:Saving trial 110 results to local file /glade/work/kdagon/s2sml/results_week3_SH_510/trial_results/trial_results_29307.gusched01.csv
INFO:echo.src.base_objective:Merging trial results and saving to /glade/work/kdagon/s2sml/results_week3_SH_510/trial_results.csv
[32m[I 2023-05-11 14:08:08,160][0m Trial 110 finished with values: [0.9571626562265144, 0.34072478441058596, 0.6379957809206113] and parameters: {'learning_rate': 0.0005368007769889669, 'norm': 'minmax', 'weight_decay': 5.153022870767592e-11, 'train_batch_size': 44, 'training_loss': 'logcosh', 'model_name': 'unet++'}. [0m
INFO:echo.src.base_objective:Attempting to automatically update the model configuration using optuna's suggested parameters
INFO:echo.src.base_objective:	data:norm : minmax
INFO:echo.src.base_objective:	model:name : unet++
INFO:echo.src.base_objective:	optimizer:learning_rate : 0.0005650323374495693
INFO:echo.src.base_objective:	trainer:train_batch_size : 54
INFO:echo.src.base_objective:	trainer:weight_decay : 1.9424138884105735e-11
INFO:echo.src.base_objective:	trainer:training_loss : logcosh
INFO:echo.src.base_objective:Beginning trial 111
INFO:root:Loading model unet++ with settings {'in_channels': 4, 'classes': 1, 'activation': 'sigmoid'}
INFO:root:Loading loss smooth
INFO:root:Loading loss smooth
INFO:echo.src.base_objective:Saving trial 111 results to local file /glade/work/kdagon/s2sml/results_week3_SH_510/trial_results/trial_results_29307.gusched01.csv
INFO:echo.src.base_objective:Merging trial results and saving to /glade/work/kdagon/s2sml/results_week3_SH_510/trial_results.csv
[32m[I 2023-05-11 14:19:12,796][0m Trial 111 finished with values: [0.9567633729479434, 0.3402024582562608, 0.6371989304067854] and parameters: {'learning_rate': 0.0005650323374495693, 'norm': 'minmax', 'weight_decay': 1.9424138884105735e-11, 'train_batch_size': 54, 'training_loss': 'logcosh', 'model_name': 'unet++'}. [0m
INFO:echo.src.base_objective:Attempting to automatically update the model configuration using optuna's suggested parameters
INFO:echo.src.base_objective:	data:norm : minmax
INFO:echo.src.base_objective:	model:name : unet++
INFO:echo.src.base_objective:	optimizer:learning_rate : 0.0005476792814002746
INFO:echo.src.base_objective:	trainer:train_batch_size : 56
INFO:echo.src.base_objective:	trainer:weight_decay : 4.9320270837502616e-11
INFO:echo.src.base_objective:	trainer:training_loss : logcosh
INFO:echo.src.base_objective:Beginning trial 112
INFO:root:Loading model unet++ with settings {'in_channels': 4, 'classes': 1, 'activation': 'sigmoid'}
INFO:root:Loading loss smooth
INFO:root:Loading loss smooth
INFO:echo.src.base_objective:Saving trial 112 results to local file /glade/work/kdagon/s2sml/results_week3_SH_510/trial_results/trial_results_29307.gusched01.csv
INFO:echo.src.base_objective:Merging trial results and saving to /glade/work/kdagon/s2sml/results_week3_SH_510/trial_results.csv
