[32m[I 2023-05-10 23:39:07,347][0m Trial 41 finished with values: [1.1750445181283957, 2.278344107452871, 1.7023107303849059] and parameters: {'learning_rate': 2.560555723321865e-06, 'norm': 'negone', 'weight_decay': 3.1213742246874556e-10, 'train_batch_size': 35, 'training_loss': 'xsigmoid', 'model_name': 'fpn'}. [0m
INFO:echo.src.base_objective:Attempting to automatically update the model configuration using optuna's suggested parameters
INFO:echo.src.base_objective:	data:norm : None
INFO:echo.src.base_objective:	model:name : linknet
INFO:echo.src.base_objective:	optimizer:learning_rate : 0.0014553995022737968
INFO:echo.src.base_objective:	trainer:train_batch_size : 26
INFO:echo.src.base_objective:	trainer:weight_decay : 4.544515838616384e-05
INFO:echo.src.base_objective:	trainer:training_loss : huber
INFO:echo.src.base_objective:Beginning trial 42
INFO:root:Loading model linknet with settings {'in_channels': 4, 'classes': 1, 'activation': 'sigmoid'}
INFO:root:Loading loss smooth
INFO:root:Loading loss smooth
INFO:echo.src.base_objective:Saving trial 42 results to local file /glade/work/kdagon/s2sml/results_week3_SH_510/trial_results/trial_results_29298.gusched01.csv
INFO:echo.src.base_objective:Merging trial results and saving to /glade/work/kdagon/s2sml/results_week3_SH_510/trial_results.csv
[32m[I 2023-05-10 23:42:29,785][0m Trial 42 finished with values: [8.00923257390426, 12063.968386614099, 162.38600995580168] and parameters: {'learning_rate': 0.0014553995022737968, 'norm': 'None', 'weight_decay': 4.544515838616384e-05, 'train_batch_size': 26, 'training_loss': 'huber', 'model_name': 'linknet'}. [0m
INFO:echo.src.base_objective:Attempting to automatically update the model configuration using optuna's suggested parameters
INFO:echo.src.base_objective:	data:norm : None
INFO:echo.src.base_objective:	model:name : unet++
INFO:echo.src.base_objective:	optimizer:learning_rate : 4.756235974445481e-06
INFO:echo.src.base_objective:	trainer:train_batch_size : 97
INFO:echo.src.base_objective:	trainer:weight_decay : 4.31011899628292e-10
INFO:echo.src.base_objective:	trainer:training_loss : mse
INFO:echo.src.base_objective:Beginning trial 43
INFO:root:Loading model unet++ with settings {'in_channels': 4, 'classes': 1, 'activation': 'sigmoid'}
INFO:root:Loading loss smooth
INFO:root:Loading loss smooth
INFO:echo.src.base_objective:Saving trial 43 results to local file /glade/work/kdagon/s2sml/results_week3_SH_510/trial_results/trial_results_29298.gusched01.csv
INFO:echo.src.base_objective:Merging trial results and saving to /glade/work/kdagon/s2sml/results_week3_SH_510/trial_results.csv
[32m[I 2023-05-10 23:45:00,268][0m Trial 43 finished with values: [3.063593433406798, 12104.942124406823, 162.66178238743365] and parameters: {'learning_rate': 4.756235974445481e-06, 'norm': 'None', 'weight_decay': 4.31011899628292e-10, 'train_batch_size': 97, 'training_loss': 'mse', 'model_name': 'unet++'}. [0m
INFO:echo.src.base_objective:Attempting to automatically update the model configuration using optuna's suggested parameters
INFO:echo.src.base_objective:	data:norm : zscore
INFO:echo.src.base_objective:	model:name : unet++
INFO:echo.src.base_objective:	optimizer:learning_rate : 0.0015260563568063028
INFO:echo.src.base_objective:	trainer:train_batch_size : 100
INFO:echo.src.base_objective:	trainer:weight_decay : 1.3616285900262955e-08
INFO:echo.src.base_objective:	trainer:training_loss : mae
INFO:echo.src.base_objective:Beginning trial 44
INFO:root:Loading model unet++ with settings {'in_channels': 4, 'classes': 1, 'activation': 'sigmoid'}
INFO:root:Loading loss smooth
INFO:root:Loading loss smooth
INFO:echo.src.base_objective:Saving trial 44 results to local file /glade/work/kdagon/s2sml/results_week3_SH_510/trial_results/trial_results_29298.gusched01.csv
INFO:echo.src.base_objective:Merging trial results and saving to /glade/work/kdagon/s2sml/results_week3_SH_510/trial_results.csv
[32m[I 2023-05-10 23:49:02,526][0m Trial 44 finished with values: [1.0920944097722924, 3.6995077811561776, 2.111026512378038] and parameters: {'learning_rate': 0.0015260563568063028, 'norm': 'zscore', 'weight_decay': 1.3616285900262955e-08, 'train_batch_size': 100, 'training_loss': 'mae', 'model_name': 'unet++'}. [0m
INFO:echo.src.base_objective:Attempting to automatically update the model configuration using optuna's suggested parameters
INFO:echo.src.base_objective:	data:norm : minmax
INFO:echo.src.base_objective:	model:name : unet++
INFO:echo.src.base_objective:	optimizer:learning_rate : 0.00043486736435603934
INFO:echo.src.base_objective:	trainer:train_batch_size : 32
INFO:echo.src.base_objective:	trainer:weight_decay : 2.416197256975403e-11
INFO:echo.src.base_objective:	trainer:training_loss : logcosh
INFO:echo.src.base_objective:Beginning trial 45
INFO:root:Loading model unet++ with settings {'in_channels': 4, 'classes': 1, 'activation': 'sigmoid'}
INFO:root:Loading loss smooth
INFO:root:Loading loss smooth
INFO:echo.src.base_objective:Saving trial 45 results to local file /glade/work/kdagon/s2sml/results_week3_SH_510/trial_results/trial_results_29298.gusched01.csv
INFO:echo.src.base_objective:Merging trial results and saving to /glade/work/kdagon/s2sml/results_week3_SH_510/trial_results.csv
[32m[I 2023-05-11 00:01:40,548][0m Trial 45 finished with values: [0.957387102078354, 0.3446952176097325, 0.6363686131392381] and parameters: {'learning_rate': 0.00043486736435603934, 'norm': 'minmax', 'weight_decay': 2.416197256975403e-11, 'train_batch_size': 32, 'training_loss': 'logcosh', 'model_name': 'unet++'}. [0m
INFO:echo.src.base_objective:Attempting to automatically update the model configuration using optuna's suggested parameters
INFO:echo.src.base_objective:	data:norm : negone
INFO:echo.src.base_objective:	model:name : deeplabv3+
INFO:echo.src.base_objective:	optimizer:learning_rate : 0.0017235933650785339
INFO:echo.src.base_objective:	trainer:train_batch_size : 101
INFO:echo.src.base_objective:	trainer:weight_decay : 9.213343344190401e-11
INFO:echo.src.base_objective:	trainer:training_loss : mae
INFO:echo.src.base_objective:Beginning trial 46
INFO:root:Loading model deeplabv3+ with settings {'in_channels': 4, 'classes': 1, 'activation': 'sigmoid'}
INFO:root:Loading loss smooth
INFO:root:Loading loss smooth
INFO:echo.src.base_objective:Saving trial 46 results to local file /glade/work/kdagon/s2sml/results_week3_SH_510/trial_results/trial_results_29298.gusched01.csv
INFO:echo.src.base_objective:Merging trial results and saving to /glade/work/kdagon/s2sml/results_week3_SH_510/trial_results.csv
[32m[I 2023-05-11 00:19:56,928][0m Trial 46 finished with values: [1.040936357506005, 1.2634817554391995, 1.0916361607049014] and parameters: {'learning_rate': 0.0017235933650785339, 'norm': 'negone', 'weight_decay': 9.213343344190401e-11, 'train_batch_size': 101, 'training_loss': 'mae', 'model_name': 'deeplabv3+'}. [0m
INFO:echo.src.base_objective:Attempting to automatically update the model configuration using optuna's suggested parameters
INFO:echo.src.base_objective:	data:norm : zscore
INFO:echo.src.base_objective:	model:name : deeplabv3
INFO:echo.src.base_objective:	optimizer:learning_rate : 2.7446477800418518e-05
INFO:echo.src.base_objective:	trainer:train_batch_size : 73
INFO:echo.src.base_objective:	trainer:weight_decay : 1.451122759800014e-09
INFO:echo.src.base_objective:	trainer:training_loss : huber
INFO:echo.src.base_objective:Beginning trial 47
INFO:root:Loading model deeplabv3 with settings {'in_channels': 4, 'classes': 1, 'activation': 'sigmoid'}
INFO:root:Loading loss smooth
INFO:root:Loading loss smooth
INFO:echo.src.base_objective:Saving trial 47 results to local file /glade/work/kdagon/s2sml/results_week3_SH_510/trial_results/trial_results_29298.gusched01.csv
INFO:echo.src.base_objective:Merging trial results and saving to /glade/work/kdagon/s2sml/results_week3_SH_510/trial_results.csv
[32m[I 2023-05-11 00:32:25,397][0m Trial 47 finished with values: [1.179026534859718, 4.161479313179862, 2.286701685900739] and parameters: {'learning_rate': 2.7446477800418518e-05, 'norm': 'zscore', 'weight_decay': 1.451122759800014e-09, 'train_batch_size': 73, 'training_loss': 'huber', 'model_name': 'deeplabv3'}. [0m
WARNING:root:Stopping early since the longest observed run-time in the study exceeds the time remaining on this node.
INFO:root:Saving trial details to /glade/work/kdagon/s2sml/results_week3_SH_510/
INFO:root:Running on PBS/SLURM batch id: 29299.gusched01
INFO:root:Importing custom objective from /glade/work/kdagon/s2sml/applications/train.py
INFO:echo.src.reporting:Using device 0
INFO:root:Direction of optimization: ['minimize', 'minimize', 'minimize']
INFO:root:Using metric ['valid_custom', 'valid_custom_second', 'valid_custom_third']
[32m[I 2023-05-11 00:32:48,274][0m Using an existing study with name 'vanilla' instead of creating a new one.[0m
INFO:root:Loaded study vanilla located at sqlite:////glade/work/kdagon/s2sml/results_week3_SH_510/s2s.db
INFO:echo.src.base_objective:Worker 29299.gusched01 is summoned.
INFO:echo.src.base_objective:	initializing an objective to be optimized with metric ['valid_custom', 'valid_custom_second', 'valid_custom_third']
INFO:echo.src.base_objective:	using device(s) cuda:0
INFO:echo.src.base_objective:	saving study/trial results to local file /glade/work/kdagon/s2sml/results_week3_SH_510/trial_results/trial_results_29299.gusched01.csv
INFO:root:Running optimization for 1000 trials
INFO:root:Running trials for a maximum PBS wall-time 2:00:00
WARNING:root:Attempting to run trials and stop before hitting the wall-time
WARNING:root:Some trials may not complete if the wall-time is reached. Optuna will start over.
INFO:echo.src.base_objective:Attempting to automatically update the model configuration using optuna's suggested parameters
INFO:echo.src.base_objective:	data:norm : negone
INFO:echo.src.base_objective:	model:name : pspnet
INFO:echo.src.base_objective:	optimizer:learning_rate : 0.00026950999511929277
INFO:echo.src.base_objective:	trainer:train_batch_size : 66
INFO:echo.src.base_objective:	trainer:weight_decay : 6.040018439812538e-09
INFO:echo.src.base_objective:	trainer:training_loss : mae
INFO:echo.src.base_objective:Beginning trial 48
INFO:root:Loading model pspnet with settings {'in_channels': 4, 'classes': 1, 'activation': 'sigmoid'}
INFO:root:Loading loss smooth
INFO:root:Loading loss smooth
INFO:echo.src.base_objective:Saving trial 48 results to local file /glade/work/kdagon/s2sml/results_week3_SH_510/trial_results/trial_results_29299.gusched01.csv
INFO:echo.src.base_objective:Merging trial results and saving to /glade/work/kdagon/s2sml/results_week3_SH_510/trial_results.csv
[32m[I 2023-05-11 00:40:57,142][0m Trial 48 finished with values: [1.0853920769972059, 1.6204964944583073, 1.2970570458888928] and parameters: {'learning_rate': 0.00026950999511929277, 'norm': 'negone', 'weight_decay': 6.040018439812538e-09, 'train_batch_size': 66, 'training_loss': 'mae', 'model_name': 'pspnet'}. [0m
INFO:echo.src.base_objective:Attempting to automatically update the model configuration using optuna's suggested parameters
INFO:echo.src.base_objective:	data:norm : zscore
INFO:echo.src.base_objective:	model:name : manet
INFO:echo.src.base_objective:	optimizer:learning_rate : 0.0028952674594194643
INFO:echo.src.base_objective:	trainer:train_batch_size : 128
INFO:echo.src.base_objective:	trainer:weight_decay : 4.620624798136605e-11
INFO:echo.src.base_objective:	trainer:training_loss : xtanh
INFO:echo.src.base_objective:Beginning trial 49
INFO:root:Loading model manet with settings {'in_channels': 4, 'classes': 1, 'activation': 'sigmoid'}
INFO:root:Loading loss smooth
INFO:root:Loading loss smooth
INFO:echo.src.base_objective:Saving trial 49 results to local file /glade/work/kdagon/s2sml/results_week3_SH_510/trial_results/trial_results_29299.gusched01.csv
INFO:echo.src.base_objective:Merging trial results and saving to /glade/work/kdagon/s2sml/results_week3_SH_510/trial_results.csv
[32m[I 2023-05-11 00:47:44,640][0m Trial 49 finished with values: [1.1033863689291674, 3.6030756666672503, 2.0492147094875124] and parameters: {'learning_rate': 0.0028952674594194643, 'norm': 'zscore', 'weight_decay': 4.620624798136605e-11, 'train_batch_size': 128, 'training_loss': 'xtanh', 'model_name': 'manet'}. [0m
INFO:echo.src.base_objective:Attempting to automatically update the model configuration using optuna's suggested parameters
INFO:echo.src.base_objective:	data:norm : zscore
INFO:echo.src.base_objective:	model:name : deeplabv3
INFO:echo.src.base_objective:	optimizer:learning_rate : 7.257098472707323e-05
INFO:echo.src.base_objective:	trainer:train_batch_size : 121
INFO:echo.src.base_objective:	trainer:weight_decay : 2.1059078664356417e-08
INFO:echo.src.base_objective:	trainer:training_loss : xsigmoid
INFO:echo.src.base_objective:Beginning trial 50
INFO:root:Loading model deeplabv3 with settings {'in_channels': 4, 'classes': 1, 'activation': 'sigmoid'}
INFO:root:Loading loss smooth
INFO:root:Loading loss smooth
INFO:echo.src.base_objective:Saving trial 50 results to local file /glade/work/kdagon/s2sml/results_week3_SH_510/trial_results/trial_results_29299.gusched01.csv
INFO:echo.src.base_objective:Merging trial results and saving to /glade/work/kdagon/s2sml/results_week3_SH_510/trial_results.csv
[32m[I 2023-05-11 00:53:07,775][0m Trial 50 finished with values: [1.1864437391214149, 4.725716598757882, 2.5087276450271085] and parameters: {'learning_rate': 7.257098472707323e-05, 'norm': 'zscore', 'weight_decay': 2.1059078664356417e-08, 'train_batch_size': 121, 'training_loss': 'xsigmoid', 'model_name': 'deeplabv3'}. [0m
INFO:echo.src.base_objective:Attempting to automatically update the model configuration using optuna's suggested parameters
INFO:echo.src.base_objective:	data:norm : negone
INFO:echo.src.base_objective:	model:name : unet
INFO:echo.src.base_objective:	optimizer:learning_rate : 9.889190670322e-05
INFO:echo.src.base_objective:	trainer:train_batch_size : 118
INFO:echo.src.base_objective:	trainer:weight_decay : 5.563319961596876e-08
INFO:echo.src.base_objective:	trainer:training_loss : xsigmoid
INFO:echo.src.base_objective:Beginning trial 51
INFO:root:Loading model unet with settings {'in_channels': 4, 'classes': 1, 'activation': 'sigmoid'}
INFO:root:Loading loss smooth
INFO:root:Loading loss smooth
INFO:echo.src.base_objective:Saving trial 51 results to local file /glade/work/kdagon/s2sml/results_week3_SH_510/trial_results/trial_results_29299.gusched01.csv
INFO:echo.src.base_objective:Merging trial results and saving to /glade/work/kdagon/s2sml/results_week3_SH_510/trial_results.csv
[32m[I 2023-05-11 01:11:27,942][0m Trial 51 finished with values: [0.998524838696792, 1.549943433468789, 1.3671500084551569] and parameters: {'learning_rate': 9.889190670322e-05, 'norm': 'negone', 'weight_decay': 5.563319961596876e-08, 'train_batch_size': 118, 'training_loss': 'xsigmoid', 'model_name': 'unet'}. [0m
INFO:echo.src.base_objective:Attempting to automatically update the model configuration using optuna's suggested parameters
INFO:echo.src.base_objective:	data:norm : minmax
INFO:echo.src.base_objective:	model:name : deeplabv3+
INFO:echo.src.base_objective:	optimizer:learning_rate : 0.007455690702098068
INFO:echo.src.base_objective:	trainer:train_batch_size : 26
INFO:echo.src.base_objective:	trainer:weight_decay : 5.07155115456202e-12
INFO:echo.src.base_objective:	trainer:training_loss : huber
INFO:echo.src.base_objective:Beginning trial 52
INFO:root:Loading model deeplabv3+ with settings {'in_channels': 4, 'classes': 1, 'activation': 'sigmoid'}
INFO:root:Loading loss smooth
INFO:root:Loading loss smooth
INFO:echo.src.base_objective:Saving trial 52 results to local file /glade/work/kdagon/s2sml/results_week3_SH_510/trial_results/trial_results_29299.gusched01.csv
INFO:echo.src.base_objective:Merging trial results and saving to /glade/work/kdagon/s2sml/results_week3_SH_510/trial_results.csv
[32m[I 2023-05-11 01:21:29,192][0m Trial 52 finished with values: [1.01463580290188, 0.9476014809661479, 0.9212238288246776] and parameters: {'learning_rate': 0.007455690702098068, 'norm': 'minmax', 'weight_decay': 5.07155115456202e-12, 'train_batch_size': 26, 'training_loss': 'huber', 'model_name': 'deeplabv3+'}. [0m
INFO:echo.src.base_objective:Attempting to automatically update the model configuration using optuna's suggested parameters
INFO:echo.src.base_objective:	data:norm : minmax
INFO:echo.src.base_objective:	model:name : deeplabv3+
INFO:echo.src.base_objective:	optimizer:learning_rate : 0.0001890055198273664
INFO:echo.src.base_objective:	trainer:train_batch_size : 101
INFO:echo.src.base_objective:	trainer:weight_decay : 5.834621475620575e-06
INFO:echo.src.base_objective:	trainer:training_loss : xsigmoid
INFO:echo.src.base_objective:Beginning trial 53
INFO:root:Loading model deeplabv3+ with settings {'in_channels': 4, 'classes': 1, 'activation': 'sigmoid'}
INFO:root:Loading loss smooth
INFO:root:Loading loss smooth
INFO:echo.src.base_objective:Saving trial 53 results to local file /glade/work/kdagon/s2sml/results_week3_SH_510/trial_results/trial_results_29299.gusched01.csv
INFO:echo.src.base_objective:Merging trial results and saving to /glade/work/kdagon/s2sml/results_week3_SH_510/trial_results.csv
[32m[I 2023-05-11 01:34:47,311][0m Trial 53 finished with values: [1.015907002944075, 0.964318991753005, 0.9383776043690129] and parameters: {'learning_rate': 0.0001890055198273664, 'norm': 'minmax', 'weight_decay': 5.834621475620575e-06, 'train_batch_size': 101, 'training_loss': 'xsigmoid', 'model_name': 'deeplabv3+'}. [0m
INFO:echo.src.base_objective:Attempting to automatically update the model configuration using optuna's suggested parameters
INFO:echo.src.base_objective:	data:norm : zscore
INFO:echo.src.base_objective:	model:name : manet
INFO:echo.src.base_objective:	optimizer:learning_rate : 3.6039757860759994e-06
INFO:echo.src.base_objective:	trainer:train_batch_size : 125
INFO:echo.src.base_objective:	trainer:weight_decay : 1.0074397369802193e-09
INFO:echo.src.base_objective:	trainer:training_loss : logcosh
INFO:echo.src.base_objective:Beginning trial 54
INFO:root:Loading model manet with settings {'in_channels': 4, 'classes': 1, 'activation': 'sigmoid'}
INFO:root:Loading loss smooth
INFO:root:Loading loss smooth
INFO:echo.src.base_objective:Saving trial 54 results to local file /glade/work/kdagon/s2sml/results_week3_SH_510/trial_results/trial_results_29299.gusched01.csv
INFO:echo.src.base_objective:Merging trial results and saving to /glade/work/kdagon/s2sml/results_week3_SH_510/trial_results.csv
[32m[I 2023-05-11 02:09:00,990][0m Trial 54 finished with values: [1.107820580566006, 5.0187712576552865, 2.6275076774258976] and parameters: {'learning_rate': 3.6039757860759994e-06, 'norm': 'zscore', 'weight_decay': 1.0074397369802193e-09, 'train_batch_size': 125, 'training_loss': 'logcosh', 'model_name': 'manet'}. [0m
WARNING:root:Stopping early since the longest observed run-time in the study exceeds the time remaining on this node.
INFO:root:Saving trial details to /glade/work/kdagon/s2sml/results_week3_SH_510/
INFO:root:Running on PBS/SLURM batch id: 29300.gusched01
INFO:root:Importing custom objective from /glade/work/kdagon/s2sml/applications/train.py
INFO:echo.src.reporting:Using device 0
INFO:root:Direction of optimization: ['minimize', 'minimize', 'minimize']
INFO:root:Using metric ['valid_custom', 'valid_custom_second', 'valid_custom_third']
[32m[I 2023-05-11 02:10:05,553][0m Using an existing study with name 'vanilla' instead of creating a new one.[0m
INFO:root:Loaded study vanilla located at sqlite:////glade/work/kdagon/s2sml/results_week3_SH_510/s2s.db
INFO:echo.src.base_objective:Worker 29300.gusched01 is summoned.
INFO:echo.src.base_objective:	initializing an objective to be optimized with metric ['valid_custom', 'valid_custom_second', 'valid_custom_third']
INFO:echo.src.base_objective:	using device(s) cuda:0
INFO:echo.src.base_objective:	saving study/trial results to local file /glade/work/kdagon/s2sml/results_week3_SH_510/trial_results/trial_results_29300.gusched01.csv
INFO:root:Running optimization for 1000 trials
INFO:root:Running trials for a maximum PBS wall-time 2:00:00
WARNING:root:Attempting to run trials and stop before hitting the wall-time
WARNING:root:Some trials may not complete if the wall-time is reached. Optuna will start over.
INFO:echo.src.base_objective:Attempting to automatically update the model configuration using optuna's suggested parameters
INFO:echo.src.base_objective:	data:norm : None
INFO:echo.src.base_objective:	model:name : deeplabv3+
INFO:echo.src.base_objective:	optimizer:learning_rate : 2.1883997969026672e-05
INFO:echo.src.base_objective:	trainer:train_batch_size : 55
INFO:echo.src.base_objective:	trainer:weight_decay : 0.0001031486182584722
INFO:echo.src.base_objective:	trainer:training_loss : mse
INFO:echo.src.base_objective:Beginning trial 55
INFO:root:Loading model deeplabv3+ with settings {'in_channels': 4, 'classes': 1, 'activation': 'sigmoid'}
INFO:root:Loading loss smooth
INFO:root:Loading loss smooth
INFO:echo.src.base_objective:Saving trial 55 results to local file /glade/work/kdagon/s2sml/results_week3_SH_510/trial_results/trial_results_29300.gusched01.csv
INFO:echo.src.base_objective:Merging trial results and saving to /glade/work/kdagon/s2sml/results_week3_SH_510/trial_results.csv
