[32m[I 2023-05-10 20:58:29,158][0m Trial 27 finished with values: [1.0250473399889317, 1.0960719402930061, 1.0547501875453893] and parameters: {'learning_rate': 2.6120174161463345e-05, 'norm': 'minmax', 'weight_decay': 8.761710225656118e-08, 'train_batch_size': 48, 'training_loss': 'xsigmoid', 'model_name': 'deeplabv3+'}. [0m
INFO:echo.src.base_objective:Attempting to automatically update the model configuration using optuna's suggested parameters
INFO:echo.src.base_objective:	data:norm : zscore
INFO:echo.src.base_objective:	model:name : unet++
INFO:echo.src.base_objective:	optimizer:learning_rate : 3.2598608965307476e-05
INFO:echo.src.base_objective:	trainer:train_batch_size : 98
INFO:echo.src.base_objective:	trainer:weight_decay : 5.7463562467015685e-09
INFO:echo.src.base_objective:	trainer:training_loss : smooth
INFO:echo.src.base_objective:Beginning trial 28
INFO:root:Loading model unet++ with settings {'in_channels': 4, 'classes': 1, 'activation': 'sigmoid'}
INFO:root:Loading loss smooth
INFO:root:Loading loss smooth
INFO:echo.src.base_objective:Saving trial 28 results to local file /glade/work/kdagon/s2sml/results_week3_SH_510/trial_results/trial_results_29296.gusched01.csv
INFO:echo.src.base_objective:Merging trial results and saving to /glade/work/kdagon/s2sml/results_week3_SH_510/trial_results.csv
[32m[I 2023-05-10 21:13:51,507][0m Trial 28 finished with values: [1.0434219198587977, 4.513229156603377, 2.450455903476583] and parameters: {'learning_rate': 3.2598608965307476e-05, 'norm': 'zscore', 'weight_decay': 5.7463562467015685e-09, 'train_batch_size': 98, 'training_loss': 'smooth', 'model_name': 'unet++'}. [0m
INFO:echo.src.base_objective:Attempting to automatically update the model configuration using optuna's suggested parameters
INFO:echo.src.base_objective:	data:norm : zscore
INFO:echo.src.base_objective:	model:name : pspnet
INFO:echo.src.base_objective:	optimizer:learning_rate : 0.006902008135543711
INFO:echo.src.base_objective:	trainer:train_batch_size : 70
INFO:echo.src.base_objective:	trainer:weight_decay : 1.3430497319346132e-05
INFO:echo.src.base_objective:	trainer:training_loss : smooth
INFO:echo.src.base_objective:Beginning trial 29
INFO:root:Loading model pspnet with settings {'in_channels': 4, 'classes': 1, 'activation': 'sigmoid'}
INFO:root:Loading loss smooth
INFO:root:Loading loss smooth
INFO:echo.src.base_objective:Saving trial 29 results to local file /glade/work/kdagon/s2sml/results_week3_SH_510/trial_results/trial_results_29296.gusched01.csv
INFO:echo.src.base_objective:Merging trial results and saving to /glade/work/kdagon/s2sml/results_week3_SH_510/trial_results.csv
[32m[I 2023-05-10 21:22:01,576][0m Trial 29 finished with values: [1.1985431276346166, 3.810236425633841, 2.183038534662334] and parameters: {'learning_rate': 0.006902008135543711, 'norm': 'zscore', 'weight_decay': 1.3430497319346132e-05, 'train_batch_size': 70, 'training_loss': 'smooth', 'model_name': 'pspnet'}. [0m
WARNING:root:Stopping early since the longest observed run-time in the study exceeds the time remaining on this node.
INFO:root:Saving trial details to /glade/work/kdagon/s2sml/results_week3_SH_510/
INFO:root:Running on PBS/SLURM batch id: 29297.gusched01
INFO:root:Importing custom objective from /glade/work/kdagon/s2sml/applications/train.py
INFO:echo.src.reporting:Using device 0
INFO:root:Direction of optimization: ['minimize', 'minimize', 'minimize']
INFO:root:Using metric ['valid_custom', 'valid_custom_second', 'valid_custom_third']
[32m[I 2023-05-10 21:22:31,935][0m Using an existing study with name 'vanilla' instead of creating a new one.[0m
INFO:root:Loaded study vanilla located at sqlite:////glade/work/kdagon/s2sml/results_week3_SH_510/s2s.db
INFO:echo.src.base_objective:Worker 29297.gusched01 is summoned.
INFO:echo.src.base_objective:	initializing an objective to be optimized with metric ['valid_custom', 'valid_custom_second', 'valid_custom_third']
INFO:echo.src.base_objective:	using device(s) cuda:0
INFO:echo.src.base_objective:	saving study/trial results to local file /glade/work/kdagon/s2sml/results_week3_SH_510/trial_results/trial_results_29297.gusched01.csv
INFO:root:Running optimization for 1000 trials
INFO:root:Running trials for a maximum PBS wall-time 2:00:00
WARNING:root:Attempting to run trials and stop before hitting the wall-time
WARNING:root:Some trials may not complete if the wall-time is reached. Optuna will start over.
INFO:echo.src.base_objective:Attempting to automatically update the model configuration using optuna's suggested parameters
INFO:echo.src.base_objective:	data:norm : None
INFO:echo.src.base_objective:	model:name : unet
INFO:echo.src.base_objective:	optimizer:learning_rate : 1.3350598805998322e-06
INFO:echo.src.base_objective:	trainer:train_batch_size : 102
INFO:echo.src.base_objective:	trainer:weight_decay : 3.5689189882705246e-05
INFO:echo.src.base_objective:	trainer:training_loss : xtanh
INFO:echo.src.base_objective:Beginning trial 30
INFO:root:Loading model unet with settings {'in_channels': 4, 'classes': 1, 'activation': 'sigmoid'}
INFO:root:Loading loss smooth
INFO:root:Loading loss smooth
INFO:echo.src.base_objective:Saving trial 30 results to local file /glade/work/kdagon/s2sml/results_week3_SH_510/trial_results/trial_results_29297.gusched01.csv
INFO:echo.src.base_objective:Merging trial results and saving to /glade/work/kdagon/s2sml/results_week3_SH_510/trial_results.csv
[32m[I 2023-05-10 21:25:04,994][0m Trial 30 finished with values: [9.668377981368685, 12099.916176664628, 162.62759342721415] and parameters: {'learning_rate': 1.3350598805998322e-06, 'norm': 'None', 'weight_decay': 3.5689189882705246e-05, 'train_batch_size': 102, 'training_loss': 'xtanh', 'model_name': 'unet'}. [0m
INFO:echo.src.base_objective:Attempting to automatically update the model configuration using optuna's suggested parameters
INFO:echo.src.base_objective:	data:norm : minmax
INFO:echo.src.base_objective:	model:name : unet++
INFO:echo.src.base_objective:	optimizer:learning_rate : 0.003429011616458314
INFO:echo.src.base_objective:	trainer:train_batch_size : 81
INFO:echo.src.base_objective:	trainer:weight_decay : 2.423478407526899e-07
INFO:echo.src.base_objective:	trainer:training_loss : huber
INFO:echo.src.base_objective:Beginning trial 31
INFO:root:Loading model unet++ with settings {'in_channels': 4, 'classes': 1, 'activation': 'sigmoid'}
INFO:root:Loading loss smooth
INFO:root:Loading loss smooth
INFO:echo.src.base_objective:Saving trial 31 results to local file /glade/work/kdagon/s2sml/results_week3_SH_510/trial_results/trial_results_29297.gusched01.csv
INFO:echo.src.base_objective:Merging trial results and saving to /glade/work/kdagon/s2sml/results_week3_SH_510/trial_results.csv
[32m[I 2023-05-10 21:39:26,829][0m Trial 31 finished with values: [0.9597936037993839, 0.3742766438060768, 0.6638993356342773] and parameters: {'learning_rate': 0.003429011616458314, 'norm': 'minmax', 'weight_decay': 2.423478407526899e-07, 'train_batch_size': 81, 'training_loss': 'huber', 'model_name': 'unet++'}. [0m
INFO:echo.src.base_objective:Attempting to automatically update the model configuration using optuna's suggested parameters
INFO:echo.src.base_objective:	data:norm : minmax
INFO:echo.src.base_objective:	model:name : deeplabv3
INFO:echo.src.base_objective:	optimizer:learning_rate : 0.001200900352834607
INFO:echo.src.base_objective:	trainer:train_batch_size : 66
INFO:echo.src.base_objective:	trainer:weight_decay : 2.1681180923603377e-09
INFO:echo.src.base_objective:	trainer:training_loss : logcosh
INFO:echo.src.base_objective:Beginning trial 32
INFO:root:Loading model deeplabv3 with settings {'in_channels': 4, 'classes': 1, 'activation': 'sigmoid'}
INFO:root:Loading loss smooth
INFO:root:Loading loss smooth
INFO:echo.src.base_objective:Saving trial 32 results to local file /glade/work/kdagon/s2sml/results_week3_SH_510/trial_results/trial_results_29297.gusched01.csv
INFO:echo.src.base_objective:Merging trial results and saving to /glade/work/kdagon/s2sml/results_week3_SH_510/trial_results.csv
[32m[I 2023-05-10 21:52:55,122][0m Trial 32 finished with values: [1.063874441481388, 1.3950535714939885, 1.1891412981464924] and parameters: {'learning_rate': 0.001200900352834607, 'norm': 'minmax', 'weight_decay': 2.1681180923603377e-09, 'train_batch_size': 66, 'training_loss': 'logcosh', 'model_name': 'deeplabv3'}. [0m
INFO:echo.src.base_objective:Attempting to automatically update the model configuration using optuna's suggested parameters
INFO:echo.src.base_objective:	data:norm : zscore
INFO:echo.src.base_objective:	model:name : manet
INFO:echo.src.base_objective:	optimizer:learning_rate : 0.00024940856210925797
INFO:echo.src.base_objective:	trainer:train_batch_size : 92
INFO:echo.src.base_objective:	trainer:weight_decay : 4.358413390331373e-05
INFO:echo.src.base_objective:	trainer:training_loss : huber
INFO:echo.src.base_objective:Beginning trial 33
INFO:root:Loading model manet with settings {'in_channels': 4, 'classes': 1, 'activation': 'sigmoid'}
INFO:root:Loading loss smooth
INFO:root:Loading loss smooth
INFO:echo.src.base_objective:Saving trial 33 results to local file /glade/work/kdagon/s2sml/results_week3_SH_510/trial_results/trial_results_29297.gusched01.csv
INFO:echo.src.base_objective:Merging trial results and saving to /glade/work/kdagon/s2sml/results_week3_SH_510/trial_results.csv
[32m[I 2023-05-10 21:58:48,715][0m Trial 33 finished with values: [1.0631863795583842, 3.9438254407837654, 2.2270286828849626] and parameters: {'learning_rate': 0.00024940856210925797, 'norm': 'zscore', 'weight_decay': 4.358413390331373e-05, 'train_batch_size': 92, 'training_loss': 'huber', 'model_name': 'manet'}. [0m
INFO:echo.src.base_objective:Attempting to automatically update the model configuration using optuna's suggested parameters
INFO:echo.src.base_objective:	data:norm : zscore
INFO:echo.src.base_objective:	model:name : fpn
INFO:echo.src.base_objective:	optimizer:learning_rate : 6.945872191253874e-05
INFO:echo.src.base_objective:	trainer:train_batch_size : 15
INFO:echo.src.base_objective:	trainer:weight_decay : 1.2133550032632996e-05
INFO:echo.src.base_objective:	trainer:training_loss : logcosh
INFO:echo.src.base_objective:Beginning trial 34
INFO:root:Loading model fpn with settings {'in_channels': 4, 'classes': 1, 'activation': 'sigmoid'}
INFO:root:Loading loss smooth
INFO:root:Loading loss smooth
INFO:echo.src.base_objective:Saving trial 34 results to local file /glade/work/kdagon/s2sml/results_week3_SH_510/trial_results/trial_results_29297.gusched01.csv
INFO:echo.src.base_objective:Merging trial results and saving to /glade/work/kdagon/s2sml/results_week3_SH_510/trial_results.csv
[32m[I 2023-05-10 22:09:21,543][0m Trial 34 finished with values: [1.15913191293403, 3.6987314659850767, 2.0955733799130583] and parameters: {'learning_rate': 6.945872191253874e-05, 'norm': 'zscore', 'weight_decay': 1.2133550032632996e-05, 'train_batch_size': 15, 'training_loss': 'logcosh', 'model_name': 'fpn'}. [0m
INFO:echo.src.base_objective:Attempting to automatically update the model configuration using optuna's suggested parameters
INFO:echo.src.base_objective:	data:norm : negone
INFO:echo.src.base_objective:	model:name : unet
INFO:echo.src.base_objective:	optimizer:learning_rate : 6.158606568456797e-06
INFO:echo.src.base_objective:	trainer:train_batch_size : 71
INFO:echo.src.base_objective:	trainer:weight_decay : 1.4441551544094618e-11
INFO:echo.src.base_objective:	trainer:training_loss : xtanh
INFO:echo.src.base_objective:Beginning trial 35
INFO:root:Loading model unet with settings {'in_channels': 4, 'classes': 1, 'activation': 'sigmoid'}
INFO:root:Loading loss smooth
INFO:root:Loading loss smooth
INFO:echo.src.base_objective:Saving trial 35 results to local file /glade/work/kdagon/s2sml/results_week3_SH_510/trial_results/trial_results_29297.gusched01.csv
INFO:echo.src.base_objective:Merging trial results and saving to /glade/work/kdagon/s2sml/results_week3_SH_510/trial_results.csv
[32m[I 2023-05-10 22:31:21,183][0m Trial 35 finished with values: [1.0799132246027359, 4.829458101712185, 2.7487424712280437] and parameters: {'learning_rate': 6.158606568456797e-06, 'norm': 'negone', 'weight_decay': 1.4441551544094618e-11, 'train_batch_size': 71, 'training_loss': 'xtanh', 'model_name': 'unet'}. [0m
INFO:echo.src.base_objective:Attempting to automatically update the model configuration using optuna's suggested parameters
INFO:echo.src.base_objective:	data:norm : None
INFO:echo.src.base_objective:	model:name : manet
INFO:echo.src.base_objective:	optimizer:learning_rate : 0.005242076961473581
INFO:echo.src.base_objective:	trainer:train_batch_size : 15
INFO:echo.src.base_objective:	trainer:weight_decay : 1.2240232255734478e-10
INFO:echo.src.base_objective:	trainer:training_loss : xsigmoid
INFO:echo.src.base_objective:Beginning trial 36
INFO:root:Loading model manet with settings {'in_channels': 4, 'classes': 1, 'activation': 'sigmoid'}
INFO:root:Loading loss smooth
INFO:root:Loading loss smooth
INFO:echo.src.base_objective:Saving trial 36 results to local file /glade/work/kdagon/s2sml/results_week3_SH_510/trial_results/trial_results_29297.gusched01.csv
INFO:echo.src.base_objective:Merging trial results and saving to /glade/work/kdagon/s2sml/results_week3_SH_510/trial_results.csv
[32m[I 2023-05-10 22:34:25,642][0m Trial 36 finished with values: [19.429500324321914, 12056.524078893177, 162.33541862603917] and parameters: {'learning_rate': 0.005242076961473581, 'norm': 'None', 'weight_decay': 1.2240232255734478e-10, 'train_batch_size': 15, 'training_loss': 'xsigmoid', 'model_name': 'manet'}. [0m
INFO:echo.src.base_objective:Attempting to automatically update the model configuration using optuna's suggested parameters
INFO:echo.src.base_objective:	data:norm : negone
INFO:echo.src.base_objective:	model:name : manet
INFO:echo.src.base_objective:	optimizer:learning_rate : 1.0512151950645914e-05
INFO:echo.src.base_objective:	trainer:train_batch_size : 49
INFO:echo.src.base_objective:	trainer:weight_decay : 2.526939604259813e-10
INFO:echo.src.base_objective:	trainer:training_loss : xsigmoid
INFO:echo.src.base_objective:Beginning trial 37
INFO:root:Loading model manet with settings {'in_channels': 4, 'classes': 1, 'activation': 'sigmoid'}
INFO:root:Loading loss smooth
INFO:root:Loading loss smooth
INFO:echo.src.base_objective:Saving trial 37 results to local file /glade/work/kdagon/s2sml/results_week3_SH_510/trial_results/trial_results_29297.gusched01.csv
INFO:echo.src.base_objective:Merging trial results and saving to /glade/work/kdagon/s2sml/results_week3_SH_510/trial_results.csv
[32m[I 2023-05-10 22:46:25,679][0m Trial 37 finished with values: [1.1121720940232809, 5.4061445219957225, 2.90211251283661] and parameters: {'learning_rate': 1.0512151950645914e-05, 'norm': 'negone', 'weight_decay': 2.526939604259813e-10, 'train_batch_size': 49, 'training_loss': 'xsigmoid', 'model_name': 'manet'}. [0m
INFO:echo.src.base_objective:Attempting to automatically update the model configuration using optuna's suggested parameters
INFO:echo.src.base_objective:	data:norm : negone
INFO:echo.src.base_objective:	model:name : deeplabv3
INFO:echo.src.base_objective:	optimizer:learning_rate : 7.287067182953151e-05
INFO:echo.src.base_objective:	trainer:train_batch_size : 100
INFO:echo.src.base_objective:	trainer:weight_decay : 1.3346395095121e-08
INFO:echo.src.base_objective:	trainer:training_loss : logcosh
INFO:echo.src.base_objective:Beginning trial 38
INFO:root:Loading model deeplabv3 with settings {'in_channels': 4, 'classes': 1, 'activation': 'sigmoid'}
INFO:root:Loading loss smooth
INFO:root:Loading loss smooth
INFO:echo.src.base_objective:Saving trial 38 results to local file /glade/work/kdagon/s2sml/results_week3_SH_510/trial_results/trial_results_29297.gusched01.csv
INFO:echo.src.base_objective:Merging trial results and saving to /glade/work/kdagon/s2sml/results_week3_SH_510/trial_results.csv
[32m[I 2023-05-10 22:58:41,939][0m Trial 38 finished with values: [1.0956184093352206, 1.8592967907772981, 1.4323860724709319] and parameters: {'learning_rate': 7.287067182953151e-05, 'norm': 'negone', 'weight_decay': 1.3346395095121e-08, 'train_batch_size': 100, 'training_loss': 'logcosh', 'model_name': 'deeplabv3'}. [0m
WARNING:root:Stopping early since the longest observed run-time in the study exceeds the time remaining on this node.
INFO:root:Saving trial details to /glade/work/kdagon/s2sml/results_week3_SH_510/
INFO:root:Running on PBS/SLURM batch id: 29298.gusched01
INFO:root:Importing custom objective from /glade/work/kdagon/s2sml/applications/train.py
INFO:echo.src.reporting:Using device 0
INFO:root:Direction of optimization: ['minimize', 'minimize', 'minimize']
INFO:root:Using metric ['valid_custom', 'valid_custom_second', 'valid_custom_third']
[32m[I 2023-05-10 22:59:05,123][0m Using an existing study with name 'vanilla' instead of creating a new one.[0m
INFO:root:Loaded study vanilla located at sqlite:////glade/work/kdagon/s2sml/results_week3_SH_510/s2s.db
INFO:echo.src.base_objective:Worker 29298.gusched01 is summoned.
INFO:echo.src.base_objective:	initializing an objective to be optimized with metric ['valid_custom', 'valid_custom_second', 'valid_custom_third']
INFO:echo.src.base_objective:	using device(s) cuda:0
INFO:echo.src.base_objective:	saving study/trial results to local file /glade/work/kdagon/s2sml/results_week3_SH_510/trial_results/trial_results_29298.gusched01.csv
INFO:root:Running optimization for 1000 trials
INFO:root:Running trials for a maximum PBS wall-time 2:00:00
WARNING:root:Attempting to run trials and stop before hitting the wall-time
WARNING:root:Some trials may not complete if the wall-time is reached. Optuna will start over.
INFO:echo.src.base_objective:Attempting to automatically update the model configuration using optuna's suggested parameters
INFO:echo.src.base_objective:	data:norm : zscore
INFO:echo.src.base_objective:	model:name : manet
INFO:echo.src.base_objective:	optimizer:learning_rate : 0.0072490196277495
INFO:echo.src.base_objective:	trainer:train_batch_size : 124
INFO:echo.src.base_objective:	trainer:weight_decay : 1.0353330777974389e-08
INFO:echo.src.base_objective:	trainer:training_loss : huber
INFO:echo.src.base_objective:Beginning trial 39
INFO:root:Loading model manet with settings {'in_channels': 4, 'classes': 1, 'activation': 'sigmoid'}
INFO:root:Loading loss smooth
INFO:root:Loading loss smooth
INFO:echo.src.base_objective:Saving trial 39 results to local file /glade/work/kdagon/s2sml/results_week3_SH_510/trial_results/trial_results_29298.gusched01.csv
INFO:echo.src.base_objective:Merging trial results and saving to /glade/work/kdagon/s2sml/results_week3_SH_510/trial_results.csv
[32m[I 2023-05-10 23:08:26,831][0m Trial 39 finished with values: [1.1040006720910274, 3.5915107776943542, 2.0439192407464555] and parameters: {'learning_rate': 0.0072490196277495, 'norm': 'zscore', 'weight_decay': 1.0353330777974389e-08, 'train_batch_size': 124, 'training_loss': 'huber', 'model_name': 'manet'}. [0m
INFO:echo.src.base_objective:Attempting to automatically update the model configuration using optuna's suggested parameters
INFO:echo.src.base_objective:	data:norm : zscore
INFO:echo.src.base_objective:	model:name : pspnet
INFO:echo.src.base_objective:	optimizer:learning_rate : 9.715863722653073e-05
INFO:echo.src.base_objective:	trainer:train_batch_size : 37
INFO:echo.src.base_objective:	trainer:weight_decay : 1.7150262270018178e-06
INFO:echo.src.base_objective:	trainer:training_loss : mse
INFO:echo.src.base_objective:Beginning trial 40
INFO:root:Loading model pspnet with settings {'in_channels': 4, 'classes': 1, 'activation': 'sigmoid'}
INFO:root:Loading loss smooth
INFO:root:Loading loss smooth
INFO:echo.src.base_objective:Saving trial 40 results to local file /glade/work/kdagon/s2sml/results_week3_SH_510/trial_results/trial_results_29298.gusched01.csv
INFO:echo.src.base_objective:Merging trial results and saving to /glade/work/kdagon/s2sml/results_week3_SH_510/trial_results.csv
[32m[I 2023-05-10 23:11:19,941][0m Trial 40 finished with values: [1.1821352349644012, 4.135949483473327, 2.2941864509289926] and parameters: {'learning_rate': 9.715863722653073e-05, 'norm': 'zscore', 'weight_decay': 1.7150262270018178e-06, 'train_batch_size': 37, 'training_loss': 'mse', 'model_name': 'pspnet'}. [0m
INFO:echo.src.base_objective:Attempting to automatically update the model configuration using optuna's suggested parameters
INFO:echo.src.base_objective:	data:norm : negone
INFO:echo.src.base_objective:	model:name : fpn
INFO:echo.src.base_objective:	optimizer:learning_rate : 2.560555723321865e-06
INFO:echo.src.base_objective:	trainer:train_batch_size : 35
INFO:echo.src.base_objective:	trainer:weight_decay : 3.1213742246874556e-10
INFO:echo.src.base_objective:	trainer:training_loss : xsigmoid
INFO:echo.src.base_objective:Beginning trial 41
INFO:root:Loading model fpn with settings {'in_channels': 4, 'classes': 1, 'activation': 'sigmoid'}
INFO:root:Loading loss smooth
INFO:root:Loading loss smooth
INFO:echo.src.base_objective:Saving trial 41 results to local file /glade/work/kdagon/s2sml/results_week3_SH_510/trial_results/trial_results_29298.gusched01.csv
INFO:echo.src.base_objective:Merging trial results and saving to /glade/work/kdagon/s2sml/results_week3_SH_510/trial_results.csv
