[32m[I 2023-06-08 18:04:53,558][0m Trial 137 finished with values: [0.020703290589153767, 0.0010015951411332935, 0.9603892704040837] and parameters: {'learning_rate': 0.0030262986994295665, 'weight_decay': 5.256137291022257e-10, 'train_batch_size': 8, 'training_loss': 'smooth', 'model_name': 'manet'}. [0m
INFO:echo.src.base_objective:Attempting to automatically update the model configuration using optuna's suggested parameters
INFO:echo.src.base_objective:	model:name : manet
INFO:echo.src.base_objective:	optimizer:learning_rate : 0.003026588932226017
INFO:echo.src.base_objective:	trainer:train_batch_size : 10
INFO:echo.src.base_objective:	trainer:weight_decay : 1.5377550024704376e-11
INFO:echo.src.base_objective:	trainer:training_loss : smooth
INFO:echo.src.base_objective:Beginning trial 147
INFO:root:Loading model manet with settings {'in_channels': 4, 'classes': 1, 'activation': 'sigmoid'}
INFO:root:Loading loss smooth
INFO:root:Loading loss smooth
INFO:echo.src.base_objective:Saving trial 138 results to local file /glade/work/kdagon/s2sml/results_wk3_608/trial_results/trial_results_1227857.desched1.csv
INFO:echo.src.base_objective:Merging trial results and saving to /glade/work/kdagon/s2sml/results_wk3_608/trial_results.csv
[32m[I 2023-06-08 18:05:11,487][0m Trial 138 finished with values: [0.02090164041146636, 0.0010645961010595784, 0.9608410931039438] and parameters: {'learning_rate': 0.0027609888620083495, 'weight_decay': 5.626385801081659e-07, 'train_batch_size': 9, 'training_loss': 'huber', 'model_name': 'manet'}. [0m
INFO:echo.src.base_objective:Attempting to automatically update the model configuration using optuna's suggested parameters
INFO:echo.src.base_objective:	model:name : manet
INFO:echo.src.base_objective:	optimizer:learning_rate : 0.003272754248162479
INFO:echo.src.base_objective:	trainer:train_batch_size : 4
INFO:echo.src.base_objective:	trainer:weight_decay : 1.3876242843371316e-11
INFO:echo.src.base_objective:	trainer:training_loss : smooth
INFO:echo.src.base_objective:Beginning trial 148
INFO:root:Loading model manet with settings {'in_channels': 4, 'classes': 1, 'activation': 'sigmoid'}
INFO:root:Loading loss smooth
INFO:root:Loading loss smooth
INFO:echo.src.base_objective:Saving trial 140 results to local file /glade/work/kdagon/s2sml/results_wk3_608/trial_results/trial_results_1227856.desched1.csv
INFO:echo.src.base_objective:Merging trial results and saving to /glade/work/kdagon/s2sml/results_wk3_608/trial_results.csv
[32m[I 2023-06-08 18:07:29,856][0m Trial 140 finished with values: [0.020746846683323383, 0.000978293246589601, 0.9605522478399272] and parameters: {'learning_rate': 0.002973683395917945, 'weight_decay': 1.4256500665949146e-07, 'train_batch_size': 6, 'training_loss': 'huber', 'model_name': 'manet'}. [0m
INFO:echo.src.base_objective:Attempting to automatically update the model configuration using optuna's suggested parameters
INFO:echo.src.base_objective:	model:name : manet
INFO:echo.src.base_objective:	optimizer:learning_rate : 0.0011759125420985196
INFO:echo.src.base_objective:	trainer:train_batch_size : 17
INFO:echo.src.base_objective:	trainer:weight_decay : 1.1516331489907541e-05
INFO:echo.src.base_objective:	trainer:training_loss : smooth
INFO:echo.src.base_objective:Beginning trial 149
INFO:root:Loading model manet with settings {'in_channels': 4, 'classes': 1, 'activation': 'sigmoid'}
INFO:root:Loading loss smooth
INFO:root:Loading loss smooth
INFO:echo.src.base_objective:Saving trial 139 results to local file /glade/work/kdagon/s2sml/results_wk3_608/trial_results/trial_results_1227860.desched1.csv
INFO:echo.src.base_objective:Merging trial results and saving to /glade/work/kdagon/s2sml/results_wk3_608/trial_results.csv
[32m[I 2023-06-08 18:07:56,424][0m Trial 139 finished with values: [0.02106274990364909, 0.0009632587025407702, 0.9610503400586706] and parameters: {'learning_rate': 0.0027212189435193127, 'weight_decay': 1.9427712647997994e-11, 'train_batch_size': 9, 'training_loss': 'huber', 'model_name': 'manet'}. [0m
INFO:echo.src.base_objective:Attempting to automatically update the model configuration using optuna's suggested parameters
INFO:echo.src.base_objective:	model:name : manet
INFO:echo.src.base_objective:	optimizer:learning_rate : 0.0012511179308117792
INFO:echo.src.base_objective:	trainer:train_batch_size : 4
INFO:echo.src.base_objective:	trainer:weight_decay : 5.101628716754301e-10
INFO:echo.src.base_objective:	trainer:training_loss : smooth
INFO:echo.src.base_objective:Beginning trial 150
INFO:root:Loading model manet with settings {'in_channels': 4, 'classes': 1, 'activation': 'sigmoid'}
INFO:root:Loading loss smooth
INFO:root:Loading loss smooth
INFO:echo.src.base_objective:Saving trial 141 results to local file /glade/work/kdagon/s2sml/results_wk3_608/trial_results/trial_results_1227858.desched1.csv
INFO:echo.src.base_objective:Merging trial results and saving to /glade/work/kdagon/s2sml/results_wk3_608/trial_results.csv
[32m[I 2023-06-08 18:09:01,426][0m Trial 141 finished with values: [0.02074634050950408, 0.0009459911234444007, 0.9612890166039587] and parameters: {'learning_rate': 0.002853367897371406, 'weight_decay': 1.607321499812686e-11, 'train_batch_size': 9, 'training_loss': 'huber', 'model_name': 'manet'}. [0m
INFO:echo.src.base_objective:Attempting to automatically update the model configuration using optuna's suggested parameters
INFO:echo.src.base_objective:	model:name : manet
INFO:echo.src.base_objective:	optimizer:learning_rate : 0.0018621135485014854
INFO:echo.src.base_objective:	trainer:train_batch_size : 4
INFO:echo.src.base_objective:	trainer:weight_decay : 5.145802810888341e-10
INFO:echo.src.base_objective:	trainer:training_loss : smooth
INFO:echo.src.base_objective:Beginning trial 151
INFO:root:Loading model manet with settings {'in_channels': 4, 'classes': 1, 'activation': 'sigmoid'}
INFO:root:Loading loss smooth
INFO:root:Loading loss smooth
INFO:echo.src.base_objective:Saving trial 143 results to local file /glade/work/kdagon/s2sml/results_wk3_608/trial_results/trial_results_1227853.desched1.csv
INFO:echo.src.base_objective:Merging trial results and saving to /glade/work/kdagon/s2sml/results_wk3_608/trial_results.csv
[32m[I 2023-06-08 18:09:55,885][0m Trial 143 finished with values: [0.02085451316088438, 0.0010151546448469162, 0.9590262598723813] and parameters: {'learning_rate': 0.0029732060673016347, 'weight_decay': 1.230409705757215e-07, 'train_batch_size': 10, 'training_loss': 'smooth', 'model_name': 'manet'}. [0m
INFO:echo.src.base_objective:Attempting to automatically update the model configuration using optuna's suggested parameters
INFO:echo.src.base_objective:	model:name : manet
INFO:echo.src.base_objective:	optimizer:learning_rate : 0.0011925852435259508
INFO:echo.src.base_objective:	trainer:train_batch_size : 16
INFO:echo.src.base_objective:	trainer:weight_decay : 1.4940978002689644e-11
INFO:echo.src.base_objective:	trainer:training_loss : smooth
INFO:echo.src.base_objective:Beginning trial 152
INFO:root:Loading model manet with settings {'in_channels': 4, 'classes': 1, 'activation': 'sigmoid'}
INFO:root:Loading loss smooth
INFO:root:Loading loss smooth
INFO:echo.src.base_objective:Saving trial 144 results to local file /glade/work/kdagon/s2sml/results_wk3_608/trial_results/trial_results_1227851.desched1.csv
INFO:echo.src.base_objective:Merging trial results and saving to /glade/work/kdagon/s2sml/results_wk3_608/trial_results.csv
[32m[I 2023-06-08 18:10:21,472][0m Trial 144 finished with values: [0.02075287001207471, 0.000994511297903955, 0.9587058923133656] and parameters: {'learning_rate': 0.0027259368921776837, 'weight_decay': 1.6305385165021606e-11, 'train_batch_size': 10, 'training_loss': 'smooth', 'model_name': 'manet'}. [0m
INFO:echo.src.base_objective:Attempting to automatically update the model configuration using optuna's suggested parameters
INFO:echo.src.base_objective:	model:name : manet
INFO:echo.src.base_objective:	optimizer:learning_rate : 0.0010360619374483549
INFO:echo.src.base_objective:	trainer:train_batch_size : 16
INFO:echo.src.base_objective:	trainer:weight_decay : 1.5437048470755094e-11
INFO:echo.src.base_objective:	trainer:training_loss : smooth
INFO:echo.src.base_objective:Beginning trial 153
INFO:root:Loading model manet with settings {'in_channels': 4, 'classes': 1, 'activation': 'sigmoid'}
INFO:root:Loading loss smooth
INFO:root:Loading loss smooth
INFO:echo.src.base_objective:Saving trial 142 results to local file /glade/work/kdagon/s2sml/results_wk3_608/trial_results/trial_results_1227855.desched1.csv
INFO:echo.src.base_objective:Merging trial results and saving to /glade/work/kdagon/s2sml/results_wk3_608/trial_results.csv
[32m[I 2023-06-08 18:10:56,677][0m Trial 142 finished with values: [0.020652434322983027, 0.0009269602887798101, 0.9616615967545161] and parameters: {'learning_rate': 0.0010424857025759266, 'weight_decay': 1.868711877350045e-11, 'train_batch_size': 6, 'training_loss': 'huber', 'model_name': 'manet'}. [0m
INFO:echo.src.base_objective:Attempting to automatically update the model configuration using optuna's suggested parameters
INFO:echo.src.base_objective:	model:name : manet
INFO:echo.src.base_objective:	optimizer:learning_rate : 0.001160580449057818
INFO:echo.src.base_objective:	trainer:train_batch_size : 15
INFO:echo.src.base_objective:	trainer:weight_decay : 1.4989427057531168e-11
INFO:echo.src.base_objective:	trainer:training_loss : smooth
INFO:echo.src.base_objective:Beginning trial 154
INFO:root:Loading model manet with settings {'in_channels': 4, 'classes': 1, 'activation': 'sigmoid'}
INFO:root:Loading loss smooth
INFO:root:Loading loss smooth
INFO:echo.src.base_objective:Saving trial 145 results to local file /glade/work/kdagon/s2sml/results_wk3_608/trial_results/trial_results_1227852.desched1.csv
INFO:echo.src.base_objective:Merging trial results and saving to /glade/work/kdagon/s2sml/results_wk3_608/trial_results.csv
[32m[I 2023-06-08 18:12:27,054][0m Trial 145 finished with values: [0.020773248746991158, 0.001023757693474181, 0.9597834474752105] and parameters: {'learning_rate': 0.0029045993212173434, 'weight_decay': 5.839753267066866e-10, 'train_batch_size': 16, 'training_loss': 'smooth', 'model_name': 'manet'}. [0m
INFO:echo.src.base_objective:Attempting to automatically update the model configuration using optuna's suggested parameters
INFO:echo.src.base_objective:	model:name : manet
INFO:echo.src.base_objective:	optimizer:learning_rate : 0.001025154113282433
INFO:echo.src.base_objective:	trainer:train_batch_size : 16
INFO:echo.src.base_objective:	trainer:weight_decay : 1.5915431117333545e-11
INFO:echo.src.base_objective:	trainer:training_loss : smooth
INFO:echo.src.base_objective:Beginning trial 155
INFO:root:Loading model manet with settings {'in_channels': 4, 'classes': 1, 'activation': 'sigmoid'}
INFO:root:Loading loss smooth
INFO:root:Loading loss smooth
INFO:echo.src.base_objective:Saving trial 147 results to local file /glade/work/kdagon/s2sml/results_wk3_608/trial_results/trial_results_1227859.desched1.csv
INFO:echo.src.base_objective:Merging trial results and saving to /glade/work/kdagon/s2sml/results_wk3_608/trial_results.csv
[32m[I 2023-06-08 18:12:38,903][0m Trial 147 finished with values: [0.020854714326560497, 0.0010081631771754473, 0.9589643303661861] and parameters: {'learning_rate': 0.003026588932226017, 'weight_decay': 1.5377550024704376e-11, 'train_batch_size': 10, 'training_loss': 'smooth', 'model_name': 'manet'}. [0m
INFO:echo.src.base_objective:Attempting to automatically update the model configuration using optuna's suggested parameters
INFO:echo.src.base_objective:	model:name : manet
INFO:echo.src.base_objective:	optimizer:learning_rate : 0.0013059519057116926
INFO:echo.src.base_objective:	trainer:train_batch_size : 16
INFO:echo.src.base_objective:	trainer:weight_decay : 3.099769470265509e-12
INFO:echo.src.base_objective:	trainer:training_loss : smooth
INFO:echo.src.base_objective:Beginning trial 156
INFO:root:Loading model manet with settings {'in_channels': 4, 'classes': 1, 'activation': 'sigmoid'}
INFO:root:Loading loss smooth
INFO:root:Loading loss smooth
INFO:echo.src.base_objective:Saving trial 146 results to local file /glade/work/kdagon/s2sml/results_wk3_608/trial_results/trial_results_1227854.desched1.csv
INFO:echo.src.base_objective:Merging trial results and saving to /glade/work/kdagon/s2sml/results_wk3_608/trial_results.csv
[32m[I 2023-06-08 18:14:31,824][0m Trial 146 finished with values: [0.020846533589065075, 0.0010072971344925463, 0.9619236034498662] and parameters: {'learning_rate': 0.0028768660265769477, 'weight_decay': 1.7932179611880344e-11, 'train_batch_size': 4, 'training_loss': 'smooth', 'model_name': 'manet'}. [0m
INFO:echo.src.base_objective:Attempting to automatically update the model configuration using optuna's suggested parameters
INFO:echo.src.base_objective:	model:name : manet
INFO:echo.src.base_objective:	optimizer:learning_rate : 0.00112612700742685
INFO:echo.src.base_objective:	trainer:train_batch_size : 15
INFO:echo.src.base_objective:	trainer:weight_decay : 2.6667347180602073e-10
INFO:echo.src.base_objective:	trainer:training_loss : smooth
INFO:echo.src.base_objective:Beginning trial 157
INFO:root:Loading model manet with settings {'in_channels': 4, 'classes': 1, 'activation': 'sigmoid'}
INFO:root:Loading loss smooth
INFO:root:Loading loss smooth
INFO:echo.src.base_objective:Saving trial 148 results to local file /glade/work/kdagon/s2sml/results_wk3_608/trial_results/trial_results_1227857.desched1.csv
INFO:echo.src.base_objective:Merging trial results and saving to /glade/work/kdagon/s2sml/results_wk3_608/trial_results.csv
[32m[I 2023-06-08 18:15:09,435][0m Trial 148 finished with values: [0.020615469198673964, 0.0009678527130745351, 0.9611419649759637] and parameters: {'learning_rate': 0.003272754248162479, 'weight_decay': 1.3876242843371316e-11, 'train_batch_size': 4, 'training_loss': 'smooth', 'model_name': 'manet'}. [0m
INFO:echo.src.base_objective:Attempting to automatically update the model configuration using optuna's suggested parameters
INFO:echo.src.base_objective:	model:name : manet
INFO:echo.src.base_objective:	optimizer:learning_rate : 0.0011675794947739804
INFO:echo.src.base_objective:	trainer:train_batch_size : 16
INFO:echo.src.base_objective:	trainer:weight_decay : 2.8994681309138304e-10
INFO:echo.src.base_objective:	trainer:training_loss : smooth
INFO:echo.src.base_objective:Beginning trial 158
INFO:root:Loading model manet with settings {'in_channels': 4, 'classes': 1, 'activation': 'sigmoid'}
INFO:root:Loading loss smooth
INFO:root:Loading loss smooth
INFO:echo.src.base_objective:Saving trial 154 results to local file /glade/work/kdagon/s2sml/results_wk3_608/trial_results/trial_results_1227855.desched1.csv
INFO:echo.src.base_objective:Merging trial results and saving to /glade/work/kdagon/s2sml/results_wk3_608/trial_results.csv
[32m[I 2023-06-08 18:16:34,476][0m Trial 154 finished with values: [0.021139798685908318, 0.0009876432013697922, 0.9616464420270842] and parameters: {'learning_rate': 0.001160580449057818, 'weight_decay': 1.4989427057531168e-11, 'train_batch_size': 15, 'training_loss': 'smooth', 'model_name': 'manet'}. [0m
INFO:echo.src.base_objective:Attempting to automatically update the model configuration using optuna's suggested parameters
INFO:echo.src.base_objective:	model:name : manet
INFO:echo.src.base_objective:	optimizer:learning_rate : 0.0012474199805856516
INFO:echo.src.base_objective:	trainer:train_batch_size : 12
INFO:echo.src.base_objective:	trainer:weight_decay : 3.856399730983778e-12
INFO:echo.src.base_objective:	trainer:training_loss : smooth
INFO:echo.src.base_objective:Beginning trial 159
INFO:root:Loading model manet with settings {'in_channels': 4, 'classes': 1, 'activation': 'sigmoid'}
INFO:root:Loading loss smooth
INFO:root:Loading loss smooth
INFO:echo.src.base_objective:Saving trial 149 results to local file /glade/work/kdagon/s2sml/results_wk3_608/trial_results/trial_results_1227856.desched1.csv
INFO:echo.src.base_objective:Merging trial results and saving to /glade/work/kdagon/s2sml/results_wk3_608/trial_results.csv
[32m[I 2023-06-08 18:16:50,424][0m Trial 149 finished with values: [0.020969705190509558, 0.0011101447162218392, 0.96040724585718] and parameters: {'learning_rate': 0.0011759125420985196, 'weight_decay': 1.1516331489907541e-05, 'train_batch_size': 17, 'training_loss': 'smooth', 'model_name': 'manet'}. [0m
INFO:echo.src.base_objective:Attempting to automatically update the model configuration using optuna's suggested parameters
INFO:echo.src.base_objective:	model:name : manet
INFO:echo.src.base_objective:	optimizer:learning_rate : 0.0018406210002055543
INFO:echo.src.base_objective:	trainer:train_batch_size : 11
INFO:echo.src.base_objective:	trainer:weight_decay : 4.906154037557111e-09
INFO:echo.src.base_objective:	trainer:training_loss : huber
INFO:echo.src.base_objective:Beginning trial 160
INFO:root:Loading model manet with settings {'in_channels': 4, 'classes': 1, 'activation': 'sigmoid'}
INFO:root:Loading loss smooth
INFO:root:Loading loss smooth
INFO:echo.src.base_objective:Saving trial 152 results to local file /glade/work/kdagon/s2sml/results_wk3_608/trial_results/trial_results_1227853.desched1.csv
INFO:echo.src.base_objective:Merging trial results and saving to /glade/work/kdagon/s2sml/results_wk3_608/trial_results.csv
INFO:echo.src.base_objective:Saving trial 151 results to local file /glade/work/kdagon/s2sml/results_wk3_608/trial_results/trial_results_1227858.desched1.csv
INFO:echo.src.base_objective:Merging trial results and saving to /glade/work/kdagon/s2sml/results_wk3_608/trial_results.csv
[32m[I 2023-06-08 18:18:55,439][0m Trial 152 finished with values: [0.02075478481128812, 0.001038586866343394, 0.9589897820786657] and parameters: {'learning_rate': 0.0011925852435259508, 'weight_decay': 1.4940978002689644e-11, 'train_batch_size': 16, 'training_loss': 'smooth', 'model_name': 'manet'}. [0m
[32m[I 2023-06-08 18:18:55,541][0m Trial 151 finished with values: [0.02064831182360649, 0.0009646482794778422, 0.9614360198214282] and parameters: {'learning_rate': 0.0018621135485014854, 'weight_decay': 5.145802810888341e-10, 'train_batch_size': 4, 'training_loss': 'smooth', 'model_name': 'manet'}. [0m
INFO:echo.src.base_objective:Attempting to automatically update the model configuration using optuna's suggested parameters
INFO:echo.src.base_objective:Attempting to automatically update the model configuration using optuna's suggested parameters
INFO:echo.src.base_objective:	model:name : manet
INFO:echo.src.base_objective:	optimizer:learning_rate : 0.0017036392743394477
INFO:echo.src.base_objective:	trainer:train_batch_size : 13
INFO:echo.src.base_objective:	trainer:weight_decay : 3.8212136837301234e-11
INFO:echo.src.base_objective:	trainer:training_loss : smooth
INFO:echo.src.base_objective:Beginning trial 161
INFO:echo.src.base_objective:	model:name : manet
INFO:echo.src.base_objective:	optimizer:learning_rate : 0.0017833820008749687
INFO:echo.src.base_objective:	trainer:train_batch_size : 12
INFO:echo.src.base_objective:	trainer:weight_decay : 4.140976456380296e-11
INFO:echo.src.base_objective:	trainer:training_loss : smooth
INFO:echo.src.base_objective:Beginning trial 162
INFO:root:Loading model manet with settings {'in_channels': 4, 'classes': 1, 'activation': 'sigmoid'}
INFO:root:Loading model manet with settings {'in_channels': 4, 'classes': 1, 'activation': 'sigmoid'}
INFO:root:Loading loss smooth
INFO:root:Loading loss smooth
INFO:root:Loading loss smooth
INFO:root:Loading loss smooth
INFO:echo.src.base_objective:Saving trial 150 results to local file /glade/work/kdagon/s2sml/results_wk3_608/trial_results/trial_results_1227860.desched1.csv
INFO:echo.src.base_objective:Merging trial results and saving to /glade/work/kdagon/s2sml/results_wk3_608/trial_results.csv
[32m[I 2023-06-08 18:19:16,057][0m Trial 150 finished with values: [0.020977730862796307, 0.00098895987321157, 0.9606094320292722] and parameters: {'learning_rate': 0.0012511179308117792, 'weight_decay': 5.101628716754301e-10, 'train_batch_size': 4, 'training_loss': 'smooth', 'model_name': 'manet'}. [0m
INFO:echo.src.base_objective:Attempting to automatically update the model configuration using optuna's suggested parameters
INFO:echo.src.base_objective:	model:name : manet
INFO:echo.src.base_objective:	optimizer:learning_rate : 0.0016567980870593865
INFO:echo.src.base_objective:	trainer:train_batch_size : 12
INFO:echo.src.base_objective:	trainer:weight_decay : 4.1560327972433823e-11
INFO:echo.src.base_objective:	trainer:training_loss : smooth
INFO:echo.src.base_objective:Beginning trial 163
INFO:root:Loading model manet with settings {'in_channels': 4, 'classes': 1, 'activation': 'sigmoid'}
INFO:root:Loading loss smooth
INFO:root:Loading loss smooth
INFO:echo.src.base_objective:Saving trial 153 results to local file /glade/work/kdagon/s2sml/results_wk3_608/trial_results/trial_results_1227851.desched1.csv
INFO:echo.src.base_objective:Merging trial results and saving to /glade/work/kdagon/s2sml/results_wk3_608/trial_results.csv
