[32m[I 2023-06-08 16:39:35,946][0m Trial 51 finished with values: [0.0368741387501359, 0.0032844878151081502, 1.054817865183122] and parameters: {'learning_rate': 0.00023768323099761736, 'weight_decay': 1.1778074951324545e-10, 'train_batch_size': 12, 'training_loss': 'huber', 'model_name': 'pspnet'}. [0m
INFO:echo.src.base_objective:Attempting to automatically update the model configuration using optuna's suggested parameters
INFO:echo.src.base_objective:	model:name : linknet
INFO:echo.src.base_objective:	optimizer:learning_rate : 2.047266464233125e-06
INFO:echo.src.base_objective:	trainer:train_batch_size : 96
INFO:echo.src.base_objective:	trainer:weight_decay : 1.2308631847712916e-08
INFO:echo.src.base_objective:	trainer:training_loss : mae
INFO:echo.src.base_objective:Beginning trial 62
INFO:root:Loading model linknet with settings {'in_channels': 4, 'classes': 1, 'activation': 'sigmoid'}
INFO:root:Loading loss smooth
INFO:root:Loading loss smooth
INFO:echo.src.base_objective:Saving trial 61 results to local file /glade/work/kdagon/s2sml/results_wk3_608/trial_results/trial_results_1227857.desched1.csv
INFO:echo.src.base_objective:Merging trial results and saving to /glade/work/kdagon/s2sml/results_wk3_608/trial_results.csv
[32m[I 2023-06-08 16:41:50,851][0m Trial 61 finished with values: [0.11554300785064697, 0.02381678018718958, 13.046858556590731] and parameters: {'learning_rate': 3.20425259951079e-05, 'weight_decay': 7.9874415464932e-11, 'train_batch_size': 121, 'training_loss': 'xtanh', 'model_name': 'unet++'}. [0m
INFO:echo.src.base_objective:Attempting to automatically update the model configuration using optuna's suggested parameters
INFO:echo.src.base_objective:	model:name : deeplabv3+
INFO:echo.src.base_objective:	optimizer:learning_rate : 1.3733655431071934e-06
INFO:echo.src.base_objective:	trainer:train_batch_size : 77
INFO:echo.src.base_objective:	trainer:weight_decay : 2.5214347794550276e-12
INFO:echo.src.base_objective:	trainer:training_loss : huber
INFO:echo.src.base_objective:Beginning trial 63
INFO:echo.src.base_objective:Saving trial 60 results to local file /glade/work/kdagon/s2sml/results_wk3_608/trial_results/trial_results_1227853.desched1.csv
INFO:echo.src.base_objective:Merging trial results and saving to /glade/work/kdagon/s2sml/results_wk3_608/trial_results.csv
[32m[I 2023-06-08 16:41:52,334][0m Trial 60 finished with values: [0.10187664441764355, 0.019950001500546932, 31.06836408382664] and parameters: {'learning_rate': 1.7858760880597546e-05, 'weight_decay': 4.879615129115278e-06, 'train_batch_size': 86, 'training_loss': 'smooth', 'model_name': 'manet'}. [0m
INFO:echo.src.base_objective:Attempting to automatically update the model configuration using optuna's suggested parameters
INFO:echo.src.base_objective:	model:name : fpn
INFO:echo.src.base_objective:	optimizer:learning_rate : 0.0004124882881377414
INFO:echo.src.base_objective:	trainer:train_batch_size : 68
INFO:echo.src.base_objective:	trainer:weight_decay : 7.093644524105084e-06
INFO:echo.src.base_objective:	trainer:training_loss : huber
INFO:echo.src.base_objective:Beginning trial 64
INFO:root:Loading model deeplabv3+ with settings {'in_channels': 4, 'classes': 1, 'activation': 'sigmoid'}
INFO:root:Loading loss smooth
INFO:root:Loading loss smooth
INFO:root:Loading model fpn with settings {'in_channels': 4, 'classes': 1, 'activation': 'sigmoid'}
INFO:root:Loading loss smooth
INFO:root:Loading loss smooth
INFO:echo.src.base_objective:Saving trial 52 results to local file /glade/work/kdagon/s2sml/results_wk3_608/trial_results/trial_results_1227860.desched1.csv
INFO:echo.src.base_objective:Merging trial results and saving to /glade/work/kdagon/s2sml/results_wk3_608/trial_results.csv
[32m[I 2023-06-08 16:42:05,557][0m Trial 52 finished with values: [0.036870538257062435, 0.0033093864331021905, 1.0555812866247436] and parameters: {'learning_rate': 0.003782363665301455, 'weight_decay': 1.8085214166819825e-08, 'train_batch_size': 79, 'training_loss': 'xtanh', 'model_name': 'deeplabv3'}. [0m
INFO:echo.src.base_objective:Attempting to automatically update the model configuration using optuna's suggested parameters
INFO:echo.src.base_objective:	model:name : unet
INFO:echo.src.base_objective:	optimizer:learning_rate : 3.411634678530076e-05
INFO:echo.src.base_objective:	trainer:train_batch_size : 85
INFO:echo.src.base_objective:	trainer:weight_decay : 1.0618988934365154e-07
INFO:echo.src.base_objective:	trainer:training_loss : smooth
INFO:echo.src.base_objective:Beginning trial 65
INFO:root:Loading model unet with settings {'in_channels': 4, 'classes': 1, 'activation': 'sigmoid'}
INFO:root:Loading loss smooth
INFO:root:Loading loss smooth
INFO:echo.src.base_objective:Saving trial 62 results to local file /glade/work/kdagon/s2sml/results_wk3_608/trial_results/trial_results_1227854.desched1.csv
INFO:echo.src.base_objective:Merging trial results and saving to /glade/work/kdagon/s2sml/results_wk3_608/trial_results.csv
[32m[I 2023-06-08 16:42:31,929][0m Trial 62 finished with values: [0.15585500746965408, 0.03879344463348389, 13.185835649561238] and parameters: {'learning_rate': 2.047266464233125e-06, 'weight_decay': 1.2308631847712916e-08, 'train_batch_size': 96, 'training_loss': 'mae', 'model_name': 'linknet'}. [0m
INFO:echo.src.base_objective:Attempting to automatically update the model configuration using optuna's suggested parameters
INFO:echo.src.base_objective:	model:name : fpn
INFO:echo.src.base_objective:	optimizer:learning_rate : 3.0042050750725865e-05
INFO:echo.src.base_objective:	trainer:train_batch_size : 81
INFO:echo.src.base_objective:	trainer:weight_decay : 6.059571366856606e-06
INFO:echo.src.base_objective:	trainer:training_loss : smooth
INFO:echo.src.base_objective:Beginning trial 66
INFO:root:Loading model fpn with settings {'in_channels': 4, 'classes': 1, 'activation': 'sigmoid'}
INFO:root:Loading loss smooth
INFO:root:Loading loss smooth
INFO:echo.src.base_objective:Saving trial 50 results to local file /glade/work/kdagon/s2sml/results_wk3_608/trial_results/trial_results_1227852.desched1.csv
INFO:echo.src.base_objective:Merging trial results and saving to /glade/work/kdagon/s2sml/results_wk3_608/trial_results.csv
[32m[I 2023-06-08 16:42:58,229][0m Trial 50 finished with values: [0.0318293422460556, 0.0026146130403503776, 1.0190937413409986] and parameters: {'learning_rate': 0.00012772738744818278, 'weight_decay': 1.3848519875684729e-12, 'train_batch_size': 54, 'training_loss': 'mse', 'model_name': 'deeplabv3+'}. [0m
INFO:echo.src.base_objective:Attempting to automatically update the model configuration using optuna's suggested parameters
INFO:echo.src.base_objective:	model:name : fpn
INFO:echo.src.base_objective:	optimizer:learning_rate : 0.0005287536954032255
INFO:echo.src.base_objective:	trainer:train_batch_size : 91
INFO:echo.src.base_objective:	trainer:weight_decay : 4.266673377639058e-08
INFO:echo.src.base_objective:	trainer:training_loss : smooth
INFO:echo.src.base_objective:Beginning trial 67
INFO:root:Loading model fpn with settings {'in_channels': 4, 'classes': 1, 'activation': 'sigmoid'}
INFO:root:Loading loss smooth
INFO:root:Loading loss smooth
INFO:echo.src.base_objective:Saving trial 63 results to local file /glade/work/kdagon/s2sml/results_wk3_608/trial_results/trial_results_1227857.desched1.csv
INFO:echo.src.base_objective:Merging trial results and saving to /glade/work/kdagon/s2sml/results_wk3_608/trial_results.csv
[32m[I 2023-06-08 16:45:42,846][0m Trial 63 finished with values: [0.10123642906546593, 0.020346287172287703, 4.321899977617125] and parameters: {'learning_rate': 1.3733655431071934e-06, 'weight_decay': 2.5214347794550276e-12, 'train_batch_size': 77, 'training_loss': 'huber', 'model_name': 'deeplabv3+'}. [0m
INFO:echo.src.base_objective:Attempting to automatically update the model configuration using optuna's suggested parameters
INFO:echo.src.base_objective:	model:name : linknet
INFO:echo.src.base_objective:	optimizer:learning_rate : 0.001746751913818587
INFO:echo.src.base_objective:	trainer:train_batch_size : 9
INFO:echo.src.base_objective:	trainer:weight_decay : 4.7407508722501757e-07
INFO:echo.src.base_objective:	trainer:training_loss : huber
INFO:echo.src.base_objective:Beginning trial 68
INFO:root:Loading model linknet with settings {'in_channels': 4, 'classes': 1, 'activation': 'sigmoid'}
INFO:root:Loading loss smooth
INFO:root:Loading loss smooth
INFO:echo.src.base_objective:Saving trial 66 results to local file /glade/work/kdagon/s2sml/results_wk3_608/trial_results/trial_results_1227854.desched1.csv
INFO:echo.src.base_objective:Merging trial results and saving to /glade/work/kdagon/s2sml/results_wk3_608/trial_results.csv
[32m[I 2023-06-08 16:46:27,759][0m Trial 66 finished with values: [0.10392040014266968, 0.016870349645614624, 1.6377018788970443] and parameters: {'learning_rate': 3.0042050750725865e-05, 'weight_decay': 6.059571366856606e-06, 'train_batch_size': 81, 'training_loss': 'smooth', 'model_name': 'fpn'}. [0m
INFO:echo.src.base_objective:Attempting to automatically update the model configuration using optuna's suggested parameters
INFO:echo.src.base_objective:	model:name : unet++
INFO:echo.src.base_objective:	optimizer:learning_rate : 8.183840056625046e-06
INFO:echo.src.base_objective:	trainer:train_batch_size : 109
INFO:echo.src.base_objective:	trainer:weight_decay : 7.854271079908103e-07
INFO:echo.src.base_objective:	trainer:training_loss : mse
INFO:echo.src.base_objective:Beginning trial 69
INFO:root:Loading model unet++ with settings {'in_channels': 4, 'classes': 1, 'activation': 'sigmoid'}
INFO:root:Loading loss smooth
INFO:root:Loading loss smooth
INFO:echo.src.base_objective:Saving trial 44 results to local file /glade/work/kdagon/s2sml/results_wk3_608/trial_results/trial_results_1227858.desched1.csv
INFO:echo.src.base_objective:Merging trial results and saving to /glade/work/kdagon/s2sml/results_wk3_608/trial_results.csv
[32m[I 2023-06-08 16:47:21,665][0m Trial 44 finished with values: [0.024419302586466074, 0.0011398867791285738, 0.9708038042687113] and parameters: {'learning_rate': 1.5563344734902252e-05, 'weight_decay': 1.6874157440634433e-06, 'train_batch_size': 11, 'training_loss': 'huber', 'model_name': 'unet++'}. [0m
INFO:echo.src.base_objective:Attempting to automatically update the model configuration using optuna's suggested parameters
INFO:echo.src.base_objective:	model:name : linknet
INFO:echo.src.base_objective:	optimizer:learning_rate : 0.004247374485720304
INFO:echo.src.base_objective:	trainer:train_batch_size : 60
INFO:echo.src.base_objective:	trainer:weight_decay : 1.2806586941070211e-08
INFO:echo.src.base_objective:	trainer:training_loss : logcosh
INFO:echo.src.base_objective:Beginning trial 70
INFO:root:Loading model linknet with settings {'in_channels': 4, 'classes': 1, 'activation': 'sigmoid'}
INFO:root:Loading loss smooth
INFO:root:Loading loss smooth
INFO:echo.src.base_objective:Saving trial 59 results to local file /glade/work/kdagon/s2sml/results_wk3_608/trial_results/trial_results_1227859.desched1.csv
INFO:echo.src.base_objective:Merging trial results and saving to /glade/work/kdagon/s2sml/results_wk3_608/trial_results.csv
[32m[I 2023-06-08 16:48:34,104][0m Trial 59 finished with values: [0.02295141387730837, 0.0010321668960386887, 0.964319411881795] and parameters: {'learning_rate': 0.006208688171186916, 'weight_decay': 3.947086515013227e-06, 'train_batch_size': 127, 'training_loss': 'huber', 'model_name': 'unet++'}. [0m
INFO:echo.src.base_objective:Attempting to automatically update the model configuration using optuna's suggested parameters
INFO:echo.src.base_objective:	model:name : unet
INFO:echo.src.base_objective:	optimizer:learning_rate : 1.3582524960592005e-05
INFO:echo.src.base_objective:	trainer:train_batch_size : 39
INFO:echo.src.base_objective:	trainer:weight_decay : 8.491756660774182e-07
INFO:echo.src.base_objective:	trainer:training_loss : mse
INFO:echo.src.base_objective:Beginning trial 71
INFO:root:Loading model unet with settings {'in_channels': 4, 'classes': 1, 'activation': 'sigmoid'}
INFO:root:Loading loss smooth
INFO:root:Loading loss smooth
INFO:echo.src.base_objective:Saving trial 64 results to local file /glade/work/kdagon/s2sml/results_wk3_608/trial_results/trial_results_1227853.desched1.csv
INFO:echo.src.base_objective:Merging trial results and saving to /glade/work/kdagon/s2sml/results_wk3_608/trial_results.csv
[32m[I 2023-06-08 16:49:06,242][0m Trial 64 finished with values: [0.04652421921491623, 0.0031517326133325696, 1.0515635616560104] and parameters: {'learning_rate': 0.0004124882881377414, 'weight_decay': 7.093644524105084e-06, 'train_batch_size': 68, 'training_loss': 'huber', 'model_name': 'fpn'}. [0m
INFO:echo.src.base_objective:Attempting to automatically update the model configuration using optuna's suggested parameters
INFO:echo.src.base_objective:	model:name : pspnet
INFO:echo.src.base_objective:	optimizer:learning_rate : 4.6957665138183766e-05
INFO:echo.src.base_objective:	trainer:train_batch_size : 11
INFO:echo.src.base_objective:	trainer:weight_decay : 0.00010860765044285564
INFO:echo.src.base_objective:	trainer:training_loss : mse
INFO:echo.src.base_objective:Beginning trial 72
INFO:root:Loading model pspnet with settings {'in_channels': 4, 'classes': 1, 'activation': 'sigmoid'}
INFO:root:Loading loss smooth
INFO:root:Loading loss smooth
INFO:echo.src.base_objective:Saving trial 69 results to local file /glade/work/kdagon/s2sml/results_wk3_608/trial_results/trial_results_1227854.desched1.csv
INFO:echo.src.base_objective:Merging trial results and saving to /glade/work/kdagon/s2sml/results_wk3_608/trial_results.csv
[32m[I 2023-06-08 16:49:23,401][0m Trial 69 finished with values: [0.1128252986818552, 0.023424028884619474, 15.37260875416077] and parameters: {'learning_rate': 8.183840056625046e-06, 'weight_decay': 7.854271079908103e-07, 'train_batch_size': 109, 'training_loss': 'mse', 'model_name': 'unet++'}. [0m
INFO:echo.src.base_objective:Attempting to automatically update the model configuration using optuna's suggested parameters
INFO:echo.src.base_objective:	model:name : fpn
INFO:echo.src.base_objective:	optimizer:learning_rate : 2.433480456854594e-06
INFO:echo.src.base_objective:	trainer:train_batch_size : 48
INFO:echo.src.base_objective:	trainer:weight_decay : 0.0004553440663539425
INFO:echo.src.base_objective:	trainer:training_loss : mse
INFO:echo.src.base_objective:Beginning trial 73
INFO:root:Loading model fpn with settings {'in_channels': 4, 'classes': 1, 'activation': 'sigmoid'}
INFO:root:Loading loss smooth
INFO:root:Loading loss smooth
INFO:echo.src.base_objective:Saving trial 55 results to local file /glade/work/kdagon/s2sml/results_wk3_608/trial_results/trial_results_1227856.desched1.csv
INFO:echo.src.base_objective:Merging trial results and saving to /glade/work/kdagon/s2sml/results_wk3_608/trial_results.csv
[32m[I 2023-06-08 16:50:11,718][0m Trial 55 finished with values: [0.034738706424832344, 0.0027128743240609765, 1.0242711154683093] and parameters: {'learning_rate': 0.0007224085556436474, 'weight_decay': 3.77711493465579e-10, 'train_batch_size': 115, 'training_loss': 'mae', 'model_name': 'fpn'}. [0m
INFO:echo.src.base_objective:Attempting to automatically update the model configuration using optuna's suggested parameters
INFO:echo.src.base_objective:	model:name : deeplabv3+
INFO:echo.src.base_objective:	optimizer:learning_rate : 3.4187355616309147e-06
INFO:echo.src.base_objective:	trainer:train_batch_size : 126
INFO:echo.src.base_objective:	trainer:weight_decay : 2.6687008631411714e-11
INFO:echo.src.base_objective:	trainer:training_loss : mse
INFO:echo.src.base_objective:Beginning trial 74
INFO:root:Loading model deeplabv3+ with settings {'in_channels': 4, 'classes': 1, 'activation': 'sigmoid'}
INFO:root:Loading loss smooth
INFO:root:Loading loss smooth
INFO:echo.src.base_objective:Saving trial 68 results to local file /glade/work/kdagon/s2sml/results_wk3_608/trial_results/trial_results_1227857.desched1.csv
INFO:echo.src.base_objective:Merging trial results and saving to /glade/work/kdagon/s2sml/results_wk3_608/trial_results.csv
[32m[I 2023-06-08 16:52:57,980][0m Trial 68 finished with values: [0.021582717075943947, 0.0008404204127145931, 0.962410357451114] and parameters: {'learning_rate': 0.001746751913818587, 'weight_decay': 4.7407508722501757e-07, 'train_batch_size': 9, 'training_loss': 'huber', 'model_name': 'linknet'}. [0m
INFO:echo.src.base_objective:Attempting to automatically update the model configuration using optuna's suggested parameters
INFO:echo.src.base_objective:	model:name : manet
INFO:echo.src.base_objective:	optimizer:learning_rate : 0.004674684734985958
INFO:echo.src.base_objective:	trainer:train_batch_size : 28
INFO:echo.src.base_objective:	trainer:weight_decay : 2.7082821738787484e-09
INFO:echo.src.base_objective:	trainer:training_loss : smooth
INFO:echo.src.base_objective:Beginning trial 75
INFO:root:Loading model manet with settings {'in_channels': 4, 'classes': 1, 'activation': 'sigmoid'}
INFO:root:Loading loss smooth
INFO:root:Loading loss smooth
INFO:echo.src.base_objective:Saving trial 39 results to local file /glade/work/kdagon/s2sml/results_wk3_608/trial_results/trial_results_1227855.desched1.csv
INFO:echo.src.base_objective:Merging trial results and saving to /glade/work/kdagon/s2sml/results_wk3_608/trial_results.csv
[32m[I 2023-06-08 16:53:18,278][0m Trial 39 finished with values: [0.04386067949235439, 0.0031156422337517142, 1.0522913655386013] and parameters: {'learning_rate': 1.6871883702273755e-06, 'weight_decay': 0.0006010358204149668, 'train_batch_size': 14, 'training_loss': 'xtanh', 'model_name': 'unet++'}. [0m
INFO:echo.src.base_objective:Attempting to automatically update the model configuration using optuna's suggested parameters
INFO:echo.src.base_objective:	model:name : linknet
INFO:echo.src.base_objective:	optimizer:learning_rate : 0.00029690203533769825
INFO:echo.src.base_objective:	trainer:train_batch_size : 55
INFO:echo.src.base_objective:	trainer:weight_decay : 3.975156819578084e-12
INFO:echo.src.base_objective:	trainer:training_loss : huber
INFO:echo.src.base_objective:Beginning trial 76
INFO:root:Loading model linknet with settings {'in_channels': 4, 'classes': 1, 'activation': 'sigmoid'}
INFO:root:Loading loss smooth
INFO:root:Loading loss smooth
INFO:echo.src.base_objective:Saving trial 70 results to local file /glade/work/kdagon/s2sml/results_wk3_608/trial_results/trial_results_1227858.desched1.csv
INFO:echo.src.base_objective:Merging trial results and saving to /glade/work/kdagon/s2sml/results_wk3_608/trial_results.csv
[32m[I 2023-06-08 16:54:18,344][0m Trial 70 finished with values: [0.023215389344841242, 0.0014109869371168315, 0.9669427226205989] and parameters: {'learning_rate': 0.004247374485720304, 'weight_decay': 1.2806586941070211e-08, 'train_batch_size': 60, 'training_loss': 'logcosh', 'model_name': 'linknet'}. [0m
INFO:echo.src.base_objective:Attempting to automatically update the model configuration using optuna's suggested parameters
INFO:echo.src.base_objective:	model:name : linknet
INFO:echo.src.base_objective:	optimizer:learning_rate : 0.00010303360216200571
INFO:echo.src.base_objective:	trainer:train_batch_size : 34
INFO:echo.src.base_objective:	trainer:weight_decay : 8.980857861185829e-05
INFO:echo.src.base_objective:	trainer:training_loss : smooth
INFO:echo.src.base_objective:Beginning trial 77
INFO:echo.src.base_objective:Saving trial 74 results to local file /glade/work/kdagon/s2sml/results_wk3_608/trial_results/trial_results_1227856.desched1.csv
INFO:echo.src.base_objective:Merging trial results and saving to /glade/work/kdagon/s2sml/results_wk3_608/trial_results.csv
[32m[I 2023-06-08 16:54:22,755][0m Trial 74 finished with values: [0.10006312467157841, 0.01963852532207966, 8.894741772109363] and parameters: {'learning_rate': 3.4187355616309147e-06, 'weight_decay': 2.6687008631411714e-11, 'train_batch_size': 126, 'training_loss': 'mse', 'model_name': 'deeplabv3+'}. [0m
INFO:echo.src.base_objective:Attempting to automatically update the model configuration using optuna's suggested parameters
INFO:echo.src.base_objective:	model:name : unet
INFO:echo.src.base_objective:	optimizer:learning_rate : 0.0005581886618149573
INFO:echo.src.base_objective:	trainer:train_batch_size : 59
INFO:echo.src.base_objective:	trainer:weight_decay : 2.9555224259851114e-08
INFO:echo.src.base_objective:	trainer:training_loss : logcosh
INFO:echo.src.base_objective:Beginning trial 78
INFO:root:Loading model linknet with settings {'in_channels': 4, 'classes': 1, 'activation': 'sigmoid'}
INFO:root:Loading loss smooth
INFO:root:Loading loss smooth
INFO:root:Loading model unet with settings {'in_channels': 4, 'classes': 1, 'activation': 'sigmoid'}
INFO:root:Loading loss smooth
INFO:root:Loading loss smooth
INFO:echo.src.base_objective:Saving trial 72 results to local file /glade/work/kdagon/s2sml/results_wk3_608/trial_results/trial_results_1227853.desched1.csv
INFO:echo.src.base_objective:Merging trial results and saving to /glade/work/kdagon/s2sml/results_wk3_608/trial_results.csv
