[32m[I 2023-06-08 16:23:47,836][0m Trial 43 finished with values: [0.11264575831592083, 0.0246279570274055, 18870.29131096046] and parameters: {'learning_rate': 1.014327211328555e-06, 'weight_decay': 1.2562024349073055e-10, 'train_batch_size': 111, 'training_loss': 'xsigmoid', 'model_name': 'deeplabv3'}. [0m
INFO:echo.src.base_objective:Attempting to automatically update the model configuration using optuna's suggested parameters
INFO:echo.src.base_objective:	model:name : deeplabv3
INFO:echo.src.base_objective:	optimizer:learning_rate : 0.0008912310279705456
INFO:echo.src.base_objective:	trainer:train_batch_size : 86
INFO:echo.src.base_objective:	trainer:weight_decay : 1.0344695641647238e-09
INFO:echo.src.base_objective:	trainer:training_loss : xsigmoid
INFO:echo.src.base_objective:Beginning trial 45
INFO:echo.src.base_objective:Saving trial 42 results to local file /glade/work/kdagon/s2sml/results_wk3_608/trial_results/trial_results_1227852.desched1.csv
INFO:echo.src.base_objective:Merging trial results and saving to /glade/work/kdagon/s2sml/results_wk3_608/trial_results.csv
INFO:root:Loading model deeplabv3 with settings {'in_channels': 4, 'classes': 1, 'activation': 'sigmoid'}
[32m[I 2023-06-08 16:23:54,074][0m Trial 42 finished with values: [0.10268809646368027, 0.020403297618031502, 3.511532212734379] and parameters: {'learning_rate': 9.65813332751984e-06, 'weight_decay': 4.811500123861099e-05, 'train_batch_size': 79, 'training_loss': 'mse', 'model_name': 'deeplabv3+'}. [0m
INFO:echo.src.base_objective:Attempting to automatically update the model configuration using optuna's suggested parameters
INFO:echo.src.base_objective:	model:name : pspnet
INFO:echo.src.base_objective:	optimizer:learning_rate : 1.9608170874610308e-05
INFO:echo.src.base_objective:	trainer:train_batch_size : 39
INFO:echo.src.base_objective:	trainer:weight_decay : 5.969705802467123e-07
INFO:echo.src.base_objective:	trainer:training_loss : xtanh
INFO:echo.src.base_objective:Beginning trial 46
INFO:root:Loading loss smooth
INFO:root:Loading loss smooth
INFO:root:Loading model pspnet with settings {'in_channels': 4, 'classes': 1, 'activation': 'sigmoid'}
INFO:root:Loading loss smooth
INFO:root:Loading loss smooth
INFO:echo.src.base_objective:Saving trial 33 results to local file /glade/work/kdagon/s2sml/results_wk3_608/trial_results/trial_results_1227856.desched1.csv
INFO:echo.src.base_objective:Merging trial results and saving to /glade/work/kdagon/s2sml/results_wk3_608/trial_results.csv
[32m[I 2023-06-08 16:24:27,622][0m Trial 33 finished with values: [0.023082260508090258, 0.0010762864258140326, 0.9653816282747394] and parameters: {'learning_rate': 0.0006759980644166411, 'weight_decay': 1.6764428354343468e-10, 'train_batch_size': 66, 'training_loss': 'mse', 'model_name': 'linknet'}. [0m
INFO:echo.src.base_objective:Attempting to automatically update the model configuration using optuna's suggested parameters
INFO:echo.src.base_objective:	model:name : fpn
INFO:echo.src.base_objective:	optimizer:learning_rate : 0.000239371125450341
INFO:echo.src.base_objective:	trainer:train_batch_size : 28
INFO:echo.src.base_objective:	trainer:weight_decay : 4.7770983522593715e-05
INFO:echo.src.base_objective:	trainer:training_loss : mse
INFO:echo.src.base_objective:Beginning trial 47
INFO:root:Loading model fpn with settings {'in_channels': 4, 'classes': 1, 'activation': 'sigmoid'}
INFO:root:Loading loss smooth
INFO:root:Loading loss smooth
INFO:echo.src.base_objective:Saving trial 35 results to local file /glade/work/kdagon/s2sml/results_wk3_608/trial_results/trial_results_1227853.desched1.csv
INFO:echo.src.base_objective:Merging trial results and saving to /glade/work/kdagon/s2sml/results_wk3_608/trial_results.csv
[32m[I 2023-06-08 16:26:10,852][0m Trial 35 finished with values: [0.02995676500722766, 0.0020364633819554, 0.9902985782258118] and parameters: {'learning_rate': 0.00014679593020226119, 'weight_decay': 1.85714696336856e-08, 'train_batch_size': 54, 'training_loss': 'xsigmoid', 'model_name': 'linknet'}. [0m
INFO:echo.src.base_objective:Attempting to automatically update the model configuration using optuna's suggested parameters
INFO:echo.src.base_objective:	model:name : deeplabv3+
INFO:echo.src.base_objective:	optimizer:learning_rate : 0.0003697683564567828
INFO:echo.src.base_objective:	trainer:train_batch_size : 67
INFO:echo.src.base_objective:	trainer:weight_decay : 2.0373702079844204e-07
INFO:echo.src.base_objective:	trainer:training_loss : smooth
INFO:echo.src.base_objective:Beginning trial 48
INFO:root:Loading model deeplabv3+ with settings {'in_channels': 4, 'classes': 1, 'activation': 'sigmoid'}
INFO:root:Loading loss smooth
INFO:root:Loading loss smooth
INFO:echo.src.base_objective:Saving trial 38 results to local file /glade/work/kdagon/s2sml/results_wk3_608/trial_results/trial_results_1227857.desched1.csv
INFO:echo.src.base_objective:Merging trial results and saving to /glade/work/kdagon/s2sml/results_wk3_608/trial_results.csv
[32m[I 2023-06-08 16:30:39,116][0m Trial 38 finished with values: [0.023501047398895025, 0.0013330980582395568, 0.9695296327758116] and parameters: {'learning_rate': 0.0002968710814333284, 'weight_decay': 6.577947914168997e-11, 'train_batch_size': 66, 'training_loss': 'logcosh', 'model_name': 'unet++'}. [0m
INFO:echo.src.base_objective:Attempting to automatically update the model configuration using optuna's suggested parameters
INFO:echo.src.base_objective:	model:name : pspnet
INFO:echo.src.base_objective:	optimizer:learning_rate : 0.003933977658916269
INFO:echo.src.base_objective:	trainer:train_batch_size : 26
INFO:echo.src.base_objective:	trainer:weight_decay : 0.0009095815770088346
INFO:echo.src.base_objective:	trainer:training_loss : smooth
INFO:echo.src.base_objective:Beginning trial 49
INFO:root:Loading model pspnet with settings {'in_channels': 4, 'classes': 1, 'activation': 'sigmoid'}
INFO:root:Loading loss smooth
INFO:root:Loading loss smooth
INFO:echo.src.base_objective:Saving trial 46 results to local file /glade/work/kdagon/s2sml/results_wk3_608/trial_results/trial_results_1227852.desched1.csv
INFO:echo.src.base_objective:Merging trial results and saving to /glade/work/kdagon/s2sml/results_wk3_608/trial_results.csv
[32m[I 2023-06-08 16:31:01,853][0m Trial 46 finished with values: [0.040761878713965416, 0.0037075168802402914, 1.0815335360582918] and parameters: {'learning_rate': 1.9608170874610308e-05, 'weight_decay': 5.969705802467123e-07, 'train_batch_size': 39, 'training_loss': 'xtanh', 'model_name': 'pspnet'}. [0m
INFO:echo.src.base_objective:Attempting to automatically update the model configuration using optuna's suggested parameters
INFO:echo.src.base_objective:	model:name : deeplabv3+
INFO:echo.src.base_objective:	optimizer:learning_rate : 0.00012772738744818278
INFO:echo.src.base_objective:	trainer:train_batch_size : 54
INFO:echo.src.base_objective:	trainer:weight_decay : 1.3848519875684729e-12
INFO:echo.src.base_objective:	trainer:training_loss : mse
INFO:echo.src.base_objective:Beginning trial 50
INFO:root:Loading model deeplabv3+ with settings {'in_channels': 4, 'classes': 1, 'activation': 'sigmoid'}
INFO:root:Loading loss smooth
INFO:root:Loading loss smooth
INFO:echo.src.base_objective:Saving trial 45 results to local file /glade/work/kdagon/s2sml/results_wk3_608/trial_results/trial_results_1227854.desched1.csv
INFO:echo.src.base_objective:Merging trial results and saving to /glade/work/kdagon/s2sml/results_wk3_608/trial_results.csv
[32m[I 2023-06-08 16:31:08,820][0m Trial 45 finished with values: [0.03772035147994757, 0.003485666704364121, 1.0560645936858468] and parameters: {'learning_rate': 0.0008912310279705456, 'weight_decay': 1.0344695641647238e-09, 'train_batch_size': 86, 'training_loss': 'xsigmoid', 'model_name': 'deeplabv3'}. [0m
INFO:echo.src.base_objective:Attempting to automatically update the model configuration using optuna's suggested parameters
INFO:echo.src.base_objective:	model:name : pspnet
INFO:echo.src.base_objective:	optimizer:learning_rate : 0.00023768323099761736
INFO:echo.src.base_objective:	trainer:train_batch_size : 12
INFO:echo.src.base_objective:	trainer:weight_decay : 1.1778074951324545e-10
INFO:echo.src.base_objective:	trainer:training_loss : huber
INFO:echo.src.base_objective:Beginning trial 51
INFO:root:Loading model pspnet with settings {'in_channels': 4, 'classes': 1, 'activation': 'sigmoid'}
INFO:root:Loading loss smooth
INFO:root:Loading loss smooth
INFO:echo.src.base_objective:Saving trial 36 results to local file /glade/work/kdagon/s2sml/results_wk3_608/trial_results/trial_results_1227860.desched1.csv
INFO:echo.src.base_objective:Merging trial results and saving to /glade/work/kdagon/s2sml/results_wk3_608/trial_results.csv
[32m[I 2023-06-08 16:32:10,082][0m Trial 36 finished with values: [0.025548534002155066, 0.0009636816830607131, 0.9731801916408418] and parameters: {'learning_rate': 5.496542536574128e-05, 'weight_decay': 1.2811353890127783e-09, 'train_batch_size': 64, 'training_loss': 'xsigmoid', 'model_name': 'unet++'}. [0m
INFO:echo.src.base_objective:Attempting to automatically update the model configuration using optuna's suggested parameters
INFO:echo.src.base_objective:	model:name : deeplabv3
INFO:echo.src.base_objective:	optimizer:learning_rate : 0.003782363665301455
INFO:echo.src.base_objective:	trainer:train_batch_size : 79
INFO:echo.src.base_objective:	trainer:weight_decay : 1.8085214166819825e-08
INFO:echo.src.base_objective:	trainer:training_loss : xtanh
INFO:echo.src.base_objective:Beginning trial 52
INFO:echo.src.base_objective:Saving trial 47 results to local file /glade/work/kdagon/s2sml/results_wk3_608/trial_results/trial_results_1227856.desched1.csv
INFO:echo.src.base_objective:Merging trial results and saving to /glade/work/kdagon/s2sml/results_wk3_608/trial_results.csv
[32m[I 2023-06-08 16:32:14,090][0m Trial 47 finished with values: [0.039633250795304775, 0.003043976495973766, 1.0283959424138456] and parameters: {'learning_rate': 0.000239371125450341, 'weight_decay': 4.7770983522593715e-05, 'train_batch_size': 28, 'training_loss': 'mse', 'model_name': 'fpn'}. [0m
INFO:echo.src.base_objective:Attempting to automatically update the model configuration using optuna's suggested parameters
INFO:echo.src.base_objective:	model:name : linknet
INFO:echo.src.base_objective:	optimizer:learning_rate : 1.1383180835057882e-06
INFO:echo.src.base_objective:	trainer:train_batch_size : 69
INFO:echo.src.base_objective:	trainer:weight_decay : 6.686718431146191e-05
INFO:echo.src.base_objective:	trainer:training_loss : huber
INFO:echo.src.base_objective:Beginning trial 53
INFO:root:Loading model deeplabv3 with settings {'in_channels': 4, 'classes': 1, 'activation': 'sigmoid'}
INFO:root:Loading model linknet with settings {'in_channels': 4, 'classes': 1, 'activation': 'sigmoid'}
INFO:root:Loading loss smooth
INFO:root:Loading loss smooth
INFO:root:Loading loss smooth
INFO:root:Loading loss smooth
INFO:echo.src.base_objective:Saving trial 37 results to local file /glade/work/kdagon/s2sml/results_wk3_608/trial_results/trial_results_1227851.desched1.csv
INFO:echo.src.base_objective:Merging trial results and saving to /glade/work/kdagon/s2sml/results_wk3_608/trial_results.csv
[32m[I 2023-06-08 16:33:02,726][0m Trial 37 finished with values: [0.033063205890357494, 0.0023931428440846503, 1.022770101081294] and parameters: {'learning_rate': 1.965874850554978e-05, 'weight_decay': 3.573175658419965e-07, 'train_batch_size': 12, 'training_loss': 'xsigmoid', 'model_name': 'deeplabv3+'}. [0m
INFO:echo.src.base_objective:Attempting to automatically update the model configuration using optuna's suggested parameters
INFO:echo.src.base_objective:	model:name : deeplabv3+
INFO:echo.src.base_objective:	optimizer:learning_rate : 1.3250884616687554e-06
INFO:echo.src.base_objective:	trainer:train_batch_size : 62
INFO:echo.src.base_objective:	trainer:weight_decay : 4.80680846469171e-06
INFO:echo.src.base_objective:	trainer:training_loss : mae
INFO:echo.src.base_objective:Beginning trial 54
INFO:root:Loading model deeplabv3+ with settings {'in_channels': 4, 'classes': 1, 'activation': 'sigmoid'}
INFO:root:Loading loss smooth
INFO:root:Loading loss smooth
INFO:echo.src.base_objective:Saving trial 53 results to local file /glade/work/kdagon/s2sml/results_wk3_608/trial_results/trial_results_1227856.desched1.csv
INFO:echo.src.base_objective:Merging trial results and saving to /glade/work/kdagon/s2sml/results_wk3_608/trial_results.csv
[32m[I 2023-06-08 16:35:42,986][0m Trial 53 finished with values: [0.15891463682055473, 0.0413828007876873, 785670.4870726219] and parameters: {'learning_rate': 1.1383180835057882e-06, 'weight_decay': 6.686718431146191e-05, 'train_batch_size': 69, 'training_loss': 'huber', 'model_name': 'linknet'}. [0m
INFO:echo.src.base_objective:Attempting to automatically update the model configuration using optuna's suggested parameters
INFO:echo.src.base_objective:	model:name : fpn
INFO:echo.src.base_objective:	optimizer:learning_rate : 0.0007224085556436474
INFO:echo.src.base_objective:	trainer:train_batch_size : 115
INFO:echo.src.base_objective:	trainer:weight_decay : 3.77711493465579e-10
INFO:echo.src.base_objective:	trainer:training_loss : mae
INFO:echo.src.base_objective:Beginning trial 55
INFO:root:Loading model fpn with settings {'in_channels': 4, 'classes': 1, 'activation': 'sigmoid'}
INFO:root:Loading loss smooth
INFO:root:Loading loss smooth
INFO:echo.src.base_objective:Saving trial 48 results to local file /glade/work/kdagon/s2sml/results_wk3_608/trial_results/trial_results_1227853.desched1.csv
INFO:echo.src.base_objective:Merging trial results and saving to /glade/work/kdagon/s2sml/results_wk3_608/trial_results.csv
[32m[I 2023-06-08 16:35:58,067][0m Trial 48 finished with values: [0.030573365278542042, 0.002404273778665811, 1.0167022669145942] and parameters: {'learning_rate': 0.0003697683564567828, 'weight_decay': 2.0373702079844204e-07, 'train_batch_size': 67, 'training_loss': 'smooth', 'model_name': 'deeplabv3+'}. [0m
INFO:echo.src.base_objective:Attempting to automatically update the model configuration using optuna's suggested parameters
INFO:echo.src.base_objective:	model:name : manet
INFO:echo.src.base_objective:	optimizer:learning_rate : 1.7493577014769216e-06
INFO:echo.src.base_objective:	trainer:train_batch_size : 84
INFO:echo.src.base_objective:	trainer:weight_decay : 5.756608097315066e-05
INFO:echo.src.base_objective:	trainer:training_loss : mae
INFO:echo.src.base_objective:Beginning trial 56
INFO:echo.src.base_objective:Saving trial 49 results to local file /glade/work/kdagon/s2sml/results_wk3_608/trial_results/trial_results_1227857.desched1.csv
INFO:echo.src.base_objective:Merging trial results and saving to /glade/work/kdagon/s2sml/results_wk3_608/trial_results.csv
[32m[I 2023-06-08 16:36:03,723][0m Trial 49 finished with values: [0.039324439130723476, 0.004024197638500482, 1.0599610766844123] and parameters: {'learning_rate': 0.003933977658916269, 'weight_decay': 0.0009095815770088346, 'train_batch_size': 26, 'training_loss': 'smooth', 'model_name': 'pspnet'}. [0m
INFO:echo.src.base_objective:Attempting to automatically update the model configuration using optuna's suggested parameters
INFO:echo.src.base_objective:	model:name : linknet
INFO:echo.src.base_objective:	optimizer:learning_rate : 3.4492895710390763e-06
INFO:echo.src.base_objective:	trainer:train_batch_size : 77
INFO:echo.src.base_objective:	trainer:weight_decay : 9.602385275384954e-08
INFO:echo.src.base_objective:	trainer:training_loss : logcosh
INFO:echo.src.base_objective:Beginning trial 57
INFO:root:Loading model manet with settings {'in_channels': 4, 'classes': 1, 'activation': 'sigmoid'}
INFO:root:Loading loss smooth
INFO:root:Loading loss smooth
INFO:root:Loading model linknet with settings {'in_channels': 4, 'classes': 1, 'activation': 'sigmoid'}
INFO:root:Loading loss smooth
INFO:root:Loading loss smooth
INFO:echo.src.base_objective:Saving trial 54 results to local file /glade/work/kdagon/s2sml/results_wk3_608/trial_results/trial_results_1227851.desched1.csv
INFO:echo.src.base_objective:Merging trial results and saving to /glade/work/kdagon/s2sml/results_wk3_608/trial_results.csv
[32m[I 2023-06-08 16:36:35,768][0m Trial 54 finished with values: [0.09910392202436924, 0.01895367680117488, 6.464110619828965] and parameters: {'learning_rate': 1.3250884616687554e-06, 'weight_decay': 4.80680846469171e-06, 'train_batch_size': 62, 'training_loss': 'mae', 'model_name': 'deeplabv3+'}. [0m
INFO:echo.src.base_objective:Attempting to automatically update the model configuration using optuna's suggested parameters
INFO:echo.src.base_objective:	model:name : unet++
INFO:echo.src.base_objective:	optimizer:learning_rate : 1.5863787278927462e-06
INFO:echo.src.base_objective:	trainer:train_batch_size : 8
INFO:echo.src.base_objective:	trainer:weight_decay : 2.19149536798907e-06
INFO:echo.src.base_objective:	trainer:training_loss : xsigmoid
INFO:echo.src.base_objective:Beginning trial 58
INFO:root:Loading model unet++ with settings {'in_channels': 4, 'classes': 1, 'activation': 'sigmoid'}
INFO:root:Loading loss smooth
INFO:root:Loading loss smooth
INFO:echo.src.base_objective:Saving trial 32 results to local file /glade/work/kdagon/s2sml/results_wk3_608/trial_results/trial_results_1227859.desched1.csv
INFO:echo.src.base_objective:Merging trial results and saving to /glade/work/kdagon/s2sml/results_wk3_608/trial_results.csv
[32m[I 2023-06-08 16:38:40,190][0m Trial 32 finished with values: [0.03929588943719864, 0.0035015230532735586, 1.0408591542384442] and parameters: {'learning_rate': 5.250740121711243e-05, 'weight_decay': 2.3923704488878766e-09, 'train_batch_size': 124, 'training_loss': 'xsigmoid', 'model_name': 'linknet'}. [0m
INFO:echo.src.base_objective:Attempting to automatically update the model configuration using optuna's suggested parameters
INFO:echo.src.base_objective:	model:name : unet++
INFO:echo.src.base_objective:	optimizer:learning_rate : 0.006208688171186916
INFO:echo.src.base_objective:	trainer:train_batch_size : 127
INFO:echo.src.base_objective:	trainer:weight_decay : 3.947086515013227e-06
INFO:echo.src.base_objective:	trainer:training_loss : huber
INFO:echo.src.base_objective:Beginning trial 59
INFO:root:Loading model unet++ with settings {'in_channels': 4, 'classes': 1, 'activation': 'sigmoid'}
INFO:root:Loading loss smooth
INFO:root:Loading loss smooth
INFO:echo.src.base_objective:Saving trial 56 results to local file /glade/work/kdagon/s2sml/results_wk3_608/trial_results/trial_results_1227853.desched1.csv
INFO:echo.src.base_objective:Merging trial results and saving to /glade/work/kdagon/s2sml/results_wk3_608/trial_results.csv
[32m[I 2023-06-08 16:38:54,167][0m Trial 56 finished with values: [0.10206389613449574, 0.020009846426546574, 35.625186290648685] and parameters: {'learning_rate': 1.7493577014769216e-06, 'weight_decay': 5.756608097315066e-05, 'train_batch_size': 84, 'training_loss': 'mae', 'model_name': 'manet'}. [0m
INFO:echo.src.base_objective:Attempting to automatically update the model configuration using optuna's suggested parameters
INFO:echo.src.base_objective:	model:name : manet
INFO:echo.src.base_objective:	optimizer:learning_rate : 1.7858760880597546e-05
INFO:echo.src.base_objective:	trainer:train_batch_size : 86
INFO:echo.src.base_objective:	trainer:weight_decay : 4.879615129115278e-06
INFO:echo.src.base_objective:	trainer:training_loss : smooth
INFO:echo.src.base_objective:Beginning trial 60
INFO:root:Loading model manet with settings {'in_channels': 4, 'classes': 1, 'activation': 'sigmoid'}
INFO:root:Loading loss smooth
INFO:root:Loading loss smooth
INFO:echo.src.base_objective:Saving trial 57 results to local file /glade/work/kdagon/s2sml/results_wk3_608/trial_results/trial_results_1227857.desched1.csv
INFO:echo.src.base_objective:Merging trial results and saving to /glade/work/kdagon/s2sml/results_wk3_608/trial_results.csv
[32m[I 2023-06-08 16:39:01,038][0m Trial 57 finished with values: [0.15940867364406586, 0.040139686316251755, 15.219807060771883] and parameters: {'learning_rate': 3.4492895710390763e-06, 'weight_decay': 9.602385275384954e-08, 'train_batch_size': 77, 'training_loss': 'logcosh', 'model_name': 'linknet'}. [0m
INFO:echo.src.base_objective:Attempting to automatically update the model configuration using optuna's suggested parameters
INFO:echo.src.base_objective:	model:name : unet++
INFO:echo.src.base_objective:	optimizer:learning_rate : 3.20425259951079e-05
INFO:echo.src.base_objective:	trainer:train_batch_size : 121
INFO:echo.src.base_objective:	trainer:weight_decay : 7.9874415464932e-11
INFO:echo.src.base_objective:	trainer:training_loss : xtanh
INFO:echo.src.base_objective:Beginning trial 61
INFO:root:Loading model unet++ with settings {'in_channels': 4, 'classes': 1, 'activation': 'sigmoid'}
INFO:root:Loading loss smooth
INFO:root:Loading loss smooth
INFO:echo.src.base_objective:Saving trial 51 results to local file /glade/work/kdagon/s2sml/results_wk3_608/trial_results/trial_results_1227854.desched1.csv
INFO:echo.src.base_objective:Merging trial results and saving to /glade/work/kdagon/s2sml/results_wk3_608/trial_results.csv
