INFO:root:Saving trial details to /glade/work/kdagon/s2sml/results_wk3_608/
INFO:root:Running on PBS/SLURM batch id: 1227851.desched1
INFO:root:Importing custom objective from /glade/work/kdagon/s2sml/applications/train_multi.py
INFO:echo.src.reporting:Using device [0, 1, 2, 3]
WARNING:echo.src.config:No pruner was supplied in the hyperparameter config file.
WARNING:echo.src.config:	Using the default NopPruner class (no pruning).
INFO:root:Direction of optimization: ['minimize', 'minimize', 'minimize']
INFO:root:Using metric ['valid_mae', 'vmse_extreme_outp', 'vcorr_cust']
[32m[I 2023-06-08 15:27:40,452][0m Using an existing study with name 'vanilla' instead of creating a new one.[0m
INFO:root:Loaded study vanilla located at sqlite:////glade/work/kdagon/s2sml/results_wk3_608/s2s.db
INFO:echo.src.base_objective:Worker 1227851.desched1 is summoned.
INFO:echo.src.base_objective:	initializing an objective to be optimized with metric ['valid_mae', 'vmse_extreme_outp', 'vcorr_cust']
INFO:echo.src.base_objective:	using device(s) ['cuda:0', 'cuda:1', 'cuda:2', 'cuda:3']
INFO:echo.src.base_objective:	saving study/trial results to local file /glade/work/kdagon/s2sml/results_wk3_608/trial_results/trial_results_1227851.desched1.csv
INFO:root:Running optimization for 1000 trials
INFO:root:Running trials for a maximum PBS wall-time 12:00:00
WARNING:root:Attempting to run trials and stop before hitting the wall-time
WARNING:root:Some trials may not complete if the wall-time is reached. Optuna will start over.
INFO:echo.src.base_objective:Attempting to automatically update the model configuration using optuna's suggested parameters
INFO:echo.src.base_objective:	model:name : linknet
INFO:echo.src.base_objective:	optimizer:learning_rate : 1.7703647655433445e-06
INFO:echo.src.base_objective:	trainer:train_batch_size : 53
INFO:echo.src.base_objective:	trainer:weight_decay : 5.33496290184721e-11
INFO:echo.src.base_objective:	trainer:training_loss : xsigmoid
INFO:echo.src.base_objective:Beginning trial 0
INFO:root:Loading model linknet with settings {'in_channels': 4, 'classes': 1, 'activation': 'sigmoid'}
INFO:root:Loading loss smooth
INFO:root:Loading loss smooth
INFO:echo.src.base_objective:Saving trial 0 results to local file /glade/work/kdagon/s2sml/results_wk3_608/trial_results/trial_results_1227851.desched1.csv
