[32m[I 2023-06-08 20:15:48,273][0m Trial 253 finished with values: [0.021917419973760843, 0.0009949297091225162, 0.9633073500826457] and parameters: {'learning_rate': 8.67810425895889e-05, 'weight_decay': 4.375765483857367e-08, 'train_batch_size': 4, 'training_loss': 'mae', 'model_name': 'manet'}. [0m
INFO:echo.src.base_objective:Attempting to automatically update the model configuration using optuna's suggested parameters
INFO:echo.src.base_objective:	model:name : manet
INFO:echo.src.base_objective:	optimizer:learning_rate : 3.5589059557402624e-05
INFO:echo.src.base_objective:	trainer:train_batch_size : 30
INFO:echo.src.base_objective:	trainer:weight_decay : 1.4072843063980855e-07
INFO:echo.src.base_objective:	trainer:training_loss : huber
INFO:echo.src.base_objective:Beginning trial 266
INFO:root:Loading model manet with settings {'in_channels': 4, 'classes': 1, 'activation': 'sigmoid'}
INFO:root:Loading loss smooth
INFO:root:Loading loss smooth
INFO:echo.src.base_objective:Saving trial 256 results to local file /glade/work/kdagon/s2sml/results_wk3_608/trial_results/trial_results_1227860.desched1.csv
INFO:echo.src.base_objective:Merging trial results and saving to /glade/work/kdagon/s2sml/results_wk3_608/trial_results.csv
[32m[I 2023-06-08 20:17:08,907][0m Trial 256 finished with values: [0.02305676694959402, 0.0011024900013580918, 0.9665369710957913] and parameters: {'learning_rate': 6.182855567347146e-05, 'weight_decay': 1.1335044655401979e-07, 'train_batch_size': 4, 'training_loss': 'huber', 'model_name': 'manet'}. [0m
INFO:echo.src.base_objective:Attempting to automatically update the model configuration using optuna's suggested parameters
INFO:echo.src.base_objective:	model:name : manet
INFO:echo.src.base_objective:	optimizer:learning_rate : 6.9601939934364545e-06
INFO:echo.src.base_objective:	trainer:train_batch_size : 33
INFO:echo.src.base_objective:	trainer:weight_decay : 1.871626476249031e-10
INFO:echo.src.base_objective:	trainer:training_loss : huber
INFO:echo.src.base_objective:Beginning trial 267
INFO:root:Loading model manet with settings {'in_channels': 4, 'classes': 1, 'activation': 'sigmoid'}
INFO:root:Loading loss smooth
INFO:root:Loading loss smooth
INFO:echo.src.base_objective:Saving trial 262 results to local file /glade/work/kdagon/s2sml/results_wk3_608/trial_results/trial_results_1227856.desched1.csv
INFO:echo.src.base_objective:Merging trial results and saving to /glade/work/kdagon/s2sml/results_wk3_608/trial_results.csv
[32m[I 2023-06-08 20:17:57,033][0m Trial 262 finished with values: [0.02534093474969268, 0.0013570203154813498, 0.9750497802409155] and parameters: {'learning_rate': 9.478283785894474e-05, 'weight_decay': 1.65356875451869e-07, 'train_batch_size': 33, 'training_loss': 'huber', 'model_name': 'manet'}. [0m
INFO:echo.src.base_objective:Attempting to automatically update the model configuration using optuna's suggested parameters
INFO:echo.src.base_objective:	model:name : manet
INFO:echo.src.base_objective:	optimizer:learning_rate : 0.00020488018033488158
INFO:echo.src.base_objective:	trainer:train_batch_size : 31
INFO:echo.src.base_objective:	trainer:weight_decay : 8.273076689748484e-11
INFO:echo.src.base_objective:	trainer:training_loss : huber
INFO:echo.src.base_objective:Beginning trial 268
INFO:root:Loading model manet with settings {'in_channels': 4, 'classes': 1, 'activation': 'sigmoid'}
INFO:root:Loading loss smooth
INFO:root:Loading loss smooth
INFO:echo.src.base_objective:Saving trial 258 results to local file /glade/work/kdagon/s2sml/results_wk3_608/trial_results/trial_results_1227851.desched1.csv
INFO:echo.src.base_objective:Merging trial results and saving to /glade/work/kdagon/s2sml/results_wk3_608/trial_results.csv
[32m[I 2023-06-08 20:18:40,252][0m Trial 258 finished with values: [0.02220054203644395, 0.0009987578814616427, 0.963451726021698] and parameters: {'learning_rate': 0.00017425119286798623, 'weight_decay': 0.0003141508266402712, 'train_batch_size': 37, 'training_loss': 'huber', 'model_name': 'manet'}. [0m
INFO:echo.src.base_objective:Attempting to automatically update the model configuration using optuna's suggested parameters
INFO:echo.src.base_objective:	model:name : manet
INFO:echo.src.base_objective:	optimizer:learning_rate : 3.65766654826526e-05
INFO:echo.src.base_objective:	trainer:train_batch_size : 32
INFO:echo.src.base_objective:	trainer:weight_decay : 0.0005694964842135983
INFO:echo.src.base_objective:	trainer:training_loss : huber
INFO:echo.src.base_objective:Beginning trial 269
INFO:root:Loading model manet with settings {'in_channels': 4, 'classes': 1, 'activation': 'sigmoid'}
INFO:root:Loading loss smooth
INFO:root:Loading loss smooth
INFO:echo.src.base_objective:Saving trial 263 results to local file /glade/work/kdagon/s2sml/results_wk3_608/trial_results/trial_results_1227857.desched1.csv
INFO:echo.src.base_objective:Merging trial results and saving to /glade/work/kdagon/s2sml/results_wk3_608/trial_results.csv
[32m[I 2023-06-08 20:19:23,188][0m Trial 263 finished with values: [0.022437510080635548, 0.0010597198706818745, 0.9641115252713802] and parameters: {'learning_rate': 0.0002784268234475895, 'weight_decay': 1.888450935061889e-07, 'train_batch_size': 32, 'training_loss': 'huber', 'model_name': 'manet'}. [0m
INFO:echo.src.base_objective:Attempting to automatically update the model configuration using optuna's suggested parameters
INFO:echo.src.base_objective:	model:name : manet
INFO:echo.src.base_objective:	optimizer:learning_rate : 7.0239153711716594e-06
INFO:echo.src.base_objective:	trainer:train_batch_size : 33
INFO:echo.src.base_objective:	trainer:weight_decay : 0.0005989478699535356
INFO:echo.src.base_objective:	trainer:training_loss : huber
INFO:echo.src.base_objective:Beginning trial 270
INFO:root:Loading model manet with settings {'in_channels': 4, 'classes': 1, 'activation': 'sigmoid'}
INFO:root:Loading loss smooth
INFO:root:Loading loss smooth
INFO:echo.src.base_objective:Saving trial 257 results to local file /glade/work/kdagon/s2sml/results_wk3_608/trial_results/trial_results_1227854.desched1.csv
INFO:echo.src.base_objective:Merging trial results and saving to /glade/work/kdagon/s2sml/results_wk3_608/trial_results.csv
[32m[I 2023-06-08 20:19:42,832][0m Trial 257 finished with values: [0.024180438369512558, 0.0012574961874634027, 0.9697197731997187] and parameters: {'learning_rate': 6.10444086699391e-05, 'weight_decay': 5.772748282375755e-08, 'train_batch_size': 32, 'training_loss': 'huber', 'model_name': 'manet'}. [0m
INFO:echo.src.base_objective:Attempting to automatically update the model configuration using optuna's suggested parameters
INFO:echo.src.base_objective:	model:name : manet
INFO:echo.src.base_objective:	optimizer:learning_rate : 4.659623798112093e-05
INFO:echo.src.base_objective:	trainer:train_batch_size : 34
INFO:echo.src.base_objective:	trainer:weight_decay : 0.0006190144341823603
INFO:echo.src.base_objective:	trainer:training_loss : huber
INFO:echo.src.base_objective:Beginning trial 271
INFO:root:Loading model manet with settings {'in_channels': 4, 'classes': 1, 'activation': 'sigmoid'}
INFO:root:Loading loss smooth
INFO:root:Loading loss smooth
INFO:echo.src.base_objective:Saving trial 252 results to local file /glade/work/kdagon/s2sml/results_wk3_608/trial_results/trial_results_1227859.desched1.csv
INFO:echo.src.base_objective:Merging trial results and saving to /glade/work/kdagon/s2sml/results_wk3_608/trial_results.csv
[32m[I 2023-06-08 20:20:07,835][0m Trial 252 finished with values: [0.021457618102431297, 0.0011027462896890938, 0.9613711840984289] and parameters: {'learning_rate': 0.00015730504149955485, 'weight_decay': 1.0349808337413048e-07, 'train_batch_size': 6, 'training_loss': 'mae', 'model_name': 'unet'}. [0m
INFO:echo.src.base_objective:Attempting to automatically update the model configuration using optuna's suggested parameters
INFO:echo.src.base_objective:	model:name : manet
INFO:echo.src.base_objective:	optimizer:learning_rate : 3.527197045389394e-05
INFO:echo.src.base_objective:	trainer:train_batch_size : 37
INFO:echo.src.base_objective:	trainer:weight_decay : 1.6256064982503427e-10
INFO:echo.src.base_objective:	trainer:training_loss : huber
INFO:echo.src.base_objective:Beginning trial 272
INFO:root:Loading model manet with settings {'in_channels': 4, 'classes': 1, 'activation': 'sigmoid'}
INFO:root:Loading loss smooth
INFO:root:Loading loss smooth
INFO:echo.src.base_objective:Saving trial 260 results to local file /glade/work/kdagon/s2sml/results_wk3_608/trial_results/trial_results_1227855.desched1.csv
INFO:echo.src.base_objective:Merging trial results and saving to /glade/work/kdagon/s2sml/results_wk3_608/trial_results.csv
[32m[I 2023-06-08 20:20:57,188][0m Trial 260 finished with values: [0.025414036121219397, 0.0013538592029362917, 0.9738067174172967] and parameters: {'learning_rate': 4.3023693370305085e-05, 'weight_decay': 0.0003138472101711191, 'train_batch_size': 32, 'training_loss': 'huber', 'model_name': 'manet'}. [0m
INFO:echo.src.base_objective:Attempting to automatically update the model configuration using optuna's suggested parameters
INFO:echo.src.base_objective:	model:name : manet
INFO:echo.src.base_objective:	optimizer:learning_rate : 6.7045362154782896e-06
INFO:echo.src.base_objective:	trainer:train_batch_size : 36
INFO:echo.src.base_objective:	trainer:weight_decay : 4.222078642263625e-09
INFO:echo.src.base_objective:	trainer:training_loss : huber
INFO:echo.src.base_objective:Beginning trial 273
INFO:root:Loading model manet with settings {'in_channels': 4, 'classes': 1, 'activation': 'sigmoid'}
INFO:root:Loading loss smooth
INFO:root:Loading loss smooth
INFO:echo.src.base_objective:Saving trial 264 results to local file /glade/work/kdagon/s2sml/results_wk3_608/trial_results/trial_results_1227853.desched1.csv
INFO:echo.src.base_objective:Merging trial results and saving to /glade/work/kdagon/s2sml/results_wk3_608/trial_results.csv
[32m[I 2023-06-08 20:22:49,489][0m Trial 264 finished with values: [0.024349110666662455, 0.0012176984455436468, 0.9685911487330852] and parameters: {'learning_rate': 9.562564942870745e-05, 'weight_decay': 1.8852116437896308e-07, 'train_batch_size': 33, 'training_loss': 'huber', 'model_name': 'manet'}. [0m
INFO:echo.src.base_objective:Attempting to automatically update the model configuration using optuna's suggested parameters
INFO:echo.src.base_objective:	model:name : manet
INFO:echo.src.base_objective:	optimizer:learning_rate : 2.506176142877385e-05
INFO:echo.src.base_objective:	trainer:train_batch_size : 37
INFO:echo.src.base_objective:	trainer:weight_decay : 0.0005589576409999777
INFO:echo.src.base_objective:	trainer:training_loss : huber
INFO:echo.src.base_objective:Beginning trial 274
INFO:root:Loading model manet with settings {'in_channels': 4, 'classes': 1, 'activation': 'sigmoid'}
INFO:root:Loading loss smooth
INFO:root:Loading loss smooth
INFO:echo.src.base_objective:Saving trial 268 results to local file /glade/work/kdagon/s2sml/results_wk3_608/trial_results/trial_results_1227856.desched1.csv
INFO:echo.src.base_objective:Merging trial results and saving to /glade/work/kdagon/s2sml/results_wk3_608/trial_results.csv
[32m[I 2023-06-08 20:24:12,126][0m Trial 268 finished with values: [0.02479478856548667, 0.0011624523322097957, 0.9715125863439296] and parameters: {'learning_rate': 0.00020488018033488158, 'weight_decay': 8.273076689748484e-11, 'train_batch_size': 31, 'training_loss': 'huber', 'model_name': 'manet'}. [0m
INFO:echo.src.base_objective:Attempting to automatically update the model configuration using optuna's suggested parameters
INFO:echo.src.base_objective:	model:name : manet
INFO:echo.src.base_objective:	optimizer:learning_rate : 2.5546948294073348e-05
INFO:echo.src.base_objective:	trainer:train_batch_size : 10
INFO:echo.src.base_objective:	trainer:weight_decay : 0.0005580045455686831
INFO:echo.src.base_objective:	trainer:training_loss : huber
INFO:echo.src.base_objective:Beginning trial 275
INFO:root:Loading model manet with settings {'in_channels': 4, 'classes': 1, 'activation': 'sigmoid'}
INFO:root:Loading loss smooth
INFO:root:Loading loss smooth
INFO:echo.src.base_objective:Saving trial 265 results to local file /glade/work/kdagon/s2sml/results_wk3_608/trial_results/trial_results_1227852.desched1.csv
INFO:echo.src.base_objective:Merging trial results and saving to /glade/work/kdagon/s2sml/results_wk3_608/trial_results.csv
[32m[I 2023-06-08 20:25:07,813][0m Trial 265 finished with values: [0.037271847017109394, 0.002305279078427702, 1.0353305734458726] and parameters: {'learning_rate': 1.6042923960394245e-05, 'weight_decay': 2.1665092592116204e-12, 'train_batch_size': 32, 'training_loss': 'huber', 'model_name': 'manet'}. [0m
INFO:echo.src.base_objective:Attempting to automatically update the model configuration using optuna's suggested parameters
INFO:echo.src.base_objective:	model:name : manet
INFO:echo.src.base_objective:	optimizer:learning_rate : 0.0008235887521415993
INFO:echo.src.base_objective:	trainer:train_batch_size : 36
INFO:echo.src.base_objective:	trainer:weight_decay : 4.28572815406164e-09
INFO:echo.src.base_objective:	trainer:training_loss : huber
INFO:echo.src.base_objective:Beginning trial 276
INFO:root:Loading model manet with settings {'in_channels': 4, 'classes': 1, 'activation': 'sigmoid'}
INFO:root:Loading loss smooth
INFO:root:Loading loss smooth
INFO:echo.src.base_objective:Saving trial 267 results to local file /glade/work/kdagon/s2sml/results_wk3_608/trial_results/trial_results_1227860.desched1.csv
INFO:echo.src.base_objective:Merging trial results and saving to /glade/work/kdagon/s2sml/results_wk3_608/trial_results.csv
[32m[I 2023-06-08 20:32:08,107][0m Trial 267 finished with values: [0.04582523833960295, 0.004201854579150677, 1.1033560038986228] and parameters: {'learning_rate': 6.9601939934364545e-06, 'weight_decay': 1.871626476249031e-10, 'train_batch_size': 33, 'training_loss': 'huber', 'model_name': 'manet'}. [0m
INFO:echo.src.base_objective:Attempting to automatically update the model configuration using optuna's suggested parameters
INFO:echo.src.base_objective:	model:name : manet
INFO:echo.src.base_objective:	optimizer:learning_rate : 2.512560752613976e-05
INFO:echo.src.base_objective:	trainer:train_batch_size : 36
INFO:echo.src.base_objective:	trainer:weight_decay : 6.189834864623898e-12
INFO:echo.src.base_objective:	trainer:training_loss : huber
INFO:echo.src.base_objective:Beginning trial 277
INFO:root:Loading model manet with settings {'in_channels': 4, 'classes': 1, 'activation': 'sigmoid'}
INFO:root:Loading loss smooth
INFO:root:Loading loss smooth
INFO:echo.src.base_objective:Saving trial 266 results to local file /glade/work/kdagon/s2sml/results_wk3_608/trial_results/trial_results_1227858.desched1.csv
INFO:echo.src.base_objective:Merging trial results and saving to /glade/work/kdagon/s2sml/results_wk3_608/trial_results.csv
[32m[I 2023-06-08 20:33:36,746][0m Trial 266 finished with values: [0.026791284326463938, 0.001483315194491297, 0.9761872644127343] and parameters: {'learning_rate': 3.5589059557402624e-05, 'weight_decay': 1.4072843063980855e-07, 'train_batch_size': 30, 'training_loss': 'huber', 'model_name': 'manet'}. [0m
INFO:echo.src.base_objective:Attempting to automatically update the model configuration using optuna's suggested parameters
INFO:echo.src.base_objective:	model:name : manet
INFO:echo.src.base_objective:	optimizer:learning_rate : 2.857862265992878e-05
INFO:echo.src.base_objective:	trainer:train_batch_size : 10
INFO:echo.src.base_objective:	trainer:weight_decay : 7.702458388267354e-10
INFO:echo.src.base_objective:	trainer:training_loss : huber
INFO:echo.src.base_objective:Beginning trial 278
INFO:root:Loading model manet with settings {'in_channels': 4, 'classes': 1, 'activation': 'sigmoid'}
INFO:root:Loading loss smooth
INFO:root:Loading loss smooth
INFO:echo.src.base_objective:Saving trial 276 results to local file /glade/work/kdagon/s2sml/results_wk3_608/trial_results/trial_results_1227852.desched1.csv
INFO:echo.src.base_objective:Merging trial results and saving to /glade/work/kdagon/s2sml/results_wk3_608/trial_results.csv
[32m[I 2023-06-08 20:34:23,386][0m Trial 276 finished with values: [0.02158338064327836, 0.0011088521569035947, 0.9619337966411383] and parameters: {'learning_rate': 0.0008235887521415993, 'weight_decay': 4.28572815406164e-09, 'train_batch_size': 36, 'training_loss': 'huber', 'model_name': 'manet'}. [0m
INFO:echo.src.base_objective:Attempting to automatically update the model configuration using optuna's suggested parameters
INFO:echo.src.base_objective:	model:name : manet
INFO:echo.src.base_objective:	optimizer:learning_rate : 3.2716030904955586e-05
INFO:echo.src.base_objective:	trainer:train_batch_size : 9
INFO:echo.src.base_objective:	trainer:weight_decay : 0.000642347936375332
INFO:echo.src.base_objective:	trainer:training_loss : huber
INFO:echo.src.base_objective:Beginning trial 279
INFO:root:Loading model manet with settings {'in_channels': 4, 'classes': 1, 'activation': 'sigmoid'}
INFO:root:Loading loss smooth
INFO:root:Loading loss smooth
INFO:echo.src.base_objective:Saving trial 270 results to local file /glade/work/kdagon/s2sml/results_wk3_608/trial_results/trial_results_1227857.desched1.csv
INFO:echo.src.base_objective:Merging trial results and saving to /glade/work/kdagon/s2sml/results_wk3_608/trial_results.csv
[32m[I 2023-06-08 20:34:41,095][0m Trial 270 finished with values: [0.045950211584568024, 0.004003302368801087, 1.1001335928721907] and parameters: {'learning_rate': 7.0239153711716594e-06, 'weight_decay': 0.0005989478699535356, 'train_batch_size': 33, 'training_loss': 'huber', 'model_name': 'manet'}. [0m
INFO:echo.src.base_objective:Attempting to automatically update the model configuration using optuna's suggested parameters
INFO:echo.src.base_objective:	model:name : manet
INFO:echo.src.base_objective:	optimizer:learning_rate : 0.0003998578644707747
INFO:echo.src.base_objective:	trainer:train_batch_size : 10
INFO:echo.src.base_objective:	trainer:weight_decay : 3.187565721661718e-07
INFO:echo.src.base_objective:	trainer:training_loss : huber
INFO:echo.src.base_objective:Beginning trial 280
INFO:root:Loading model manet with settings {'in_channels': 4, 'classes': 1, 'activation': 'sigmoid'}
INFO:root:Loading loss smooth
INFO:root:Loading loss smooth
INFO:echo.src.base_objective:Saving trial 269 results to local file /glade/work/kdagon/s2sml/results_wk3_608/trial_results/trial_results_1227851.desched1.csv
INFO:echo.src.base_objective:Merging trial results and saving to /glade/work/kdagon/s2sml/results_wk3_608/trial_results.csv
[32m[I 2023-06-08 20:34:57,951][0m Trial 269 finished with values: [0.027007057797163725, 0.0015226441319100559, 0.9797226003023269] and parameters: {'learning_rate': 3.65766654826526e-05, 'weight_decay': 0.0005694964842135983, 'train_batch_size': 32, 'training_loss': 'huber', 'model_name': 'manet'}. [0m
INFO:echo.src.base_objective:Attempting to automatically update the model configuration using optuna's suggested parameters
INFO:echo.src.base_objective:	model:name : manet
INFO:echo.src.base_objective:	optimizer:learning_rate : 2.835387127438797e-05
INFO:echo.src.base_objective:	trainer:train_batch_size : 10
INFO:echo.src.base_objective:	trainer:weight_decay : 8.603658744541084e-09
INFO:echo.src.base_objective:	trainer:training_loss : huber
INFO:echo.src.base_objective:Beginning trial 281
INFO:root:Loading model manet with settings {'in_channels': 4, 'classes': 1, 'activation': 'sigmoid'}
INFO:root:Loading loss smooth
INFO:root:Loading loss smooth
INFO:echo.src.base_objective:Saving trial 274 results to local file /glade/work/kdagon/s2sml/results_wk3_608/trial_results/trial_results_1227853.desched1.csv
INFO:echo.src.base_objective:Merging trial results and saving to /glade/work/kdagon/s2sml/results_wk3_608/trial_results.csv
[32m[I 2023-06-08 20:35:58,377][0m Trial 274 finished with values: [0.03143011126667261, 0.0017416321206837893, 1.0147782584865752] and parameters: {'learning_rate': 2.506176142877385e-05, 'weight_decay': 0.0005589576409999777, 'train_batch_size': 37, 'training_loss': 'huber', 'model_name': 'manet'}. [0m
INFO:echo.src.base_objective:Attempting to automatically update the model configuration using optuna's suggested parameters
INFO:echo.src.base_objective:	model:name : manet
INFO:echo.src.base_objective:	optimizer:learning_rate : 0.0006254442900900909
INFO:echo.src.base_objective:	trainer:train_batch_size : 11
INFO:echo.src.base_objective:	trainer:weight_decay : 1.6661341710366263e-06
INFO:echo.src.base_objective:	trainer:training_loss : huber
INFO:echo.src.base_objective:Beginning trial 282
INFO:root:Loading model manet with settings {'in_channels': 4, 'classes': 1, 'activation': 'sigmoid'}
INFO:root:Loading loss smooth
INFO:root:Loading loss smooth
INFO:echo.src.base_objective:Saving trial 271 results to local file /glade/work/kdagon/s2sml/results_wk3_608/trial_results/trial_results_1227854.desched1.csv
INFO:echo.src.base_objective:Merging trial results and saving to /glade/work/kdagon/s2sml/results_wk3_608/trial_results.csv
