[32m[I 2023-06-09 02:58:58,634][0m Trial 585 finished with values: [0.023580370005220175, 0.0011109535989817232, 0.9679732849512886] and parameters: {'learning_rate': 0.0004918182823381431, 'weight_decay': 4.29673755978675e-09, 'train_batch_size': 35, 'training_loss': 'huber', 'model_name': 'manet'}. [0m
WARNING:root:Stopping early since the longest observed run-time in the study exceeds the time remaining on this node.
INFO:echo.src.base_objective:Saving trial 582 results to local file /glade/work/kdagon/s2sml/results_wk3_608/trial_results/trial_results_1227856.desched1.csv
INFO:echo.src.base_objective:Merging trial results and saving to /glade/work/kdagon/s2sml/results_wk3_608/trial_results.csv
[32m[I 2023-06-09 03:01:57,846][0m Trial 582 finished with values: [0.028803169261664152, 0.0022200685925781727, 1.0117466506618538] and parameters: {'learning_rate': 0.0075276166802481816, 'weight_decay': 4.2874103142988805e-09, 'train_batch_size': 5, 'training_loss': 'huber', 'model_name': 'fpn'}. [0m
WARNING:root:Stopping early since the longest observed run-time in the study exceeds the time remaining on this node.
INFO:echo.src.base_objective:Saving trial 580 results to local file /glade/work/kdagon/s2sml/results_wk3_608/trial_results/trial_results_1227855.desched1.csv
INFO:echo.src.base_objective:Merging trial results and saving to /glade/work/kdagon/s2sml/results_wk3_608/trial_results.csv
[32m[I 2023-06-09 03:02:58,889][0m Trial 580 finished with values: [0.021511894650757313, 0.0010002290364354849, 0.9625067654539126] and parameters: {'learning_rate': 0.00021202226909562553, 'weight_decay': 1.2365140401077322e-10, 'train_batch_size': 34, 'training_loss': 'huber', 'model_name': 'manet'}. [0m
WARNING:root:Stopping early since the longest observed run-time in the study exceeds the time remaining on this node.
INFO:echo.src.base_objective:Saving trial 583 results to local file /glade/work/kdagon/s2sml/results_wk3_608/trial_results/trial_results_1227852.desched1.csv
INFO:echo.src.base_objective:Merging trial results and saving to /glade/work/kdagon/s2sml/results_wk3_608/trial_results.csv
[32m[I 2023-06-09 03:03:39,042][0m Trial 583 finished with values: [0.1549716554582119, 0.0221489064861089, 1.4842732755485073] and parameters: {'learning_rate': 2.668861548863803e-06, 'weight_decay': 4.505385052284686e-09, 'train_batch_size': 32, 'training_loss': 'huber', 'model_name': 'fpn'}. [0m
WARNING:root:Stopping early since the longest observed run-time in the study exceeds the time remaining on this node.
INFO:echo.src.base_objective:Saving trial 584 results to local file /glade/work/kdagon/s2sml/results_wk3_608/trial_results/trial_results_1227854.desched1.csv
INFO:echo.src.base_objective:Merging trial results and saving to /glade/work/kdagon/s2sml/results_wk3_608/trial_results.csv
[32m[I 2023-06-09 03:07:30,728][0m Trial 584 finished with values: [0.03562320955097675, 0.0025916393497027457, 1.0334044601121832] and parameters: {'learning_rate': 1.5496617125377132e-05, 'weight_decay': 2.8679552139264123e-08, 'train_batch_size': 34, 'training_loss': 'huber', 'model_name': 'manet'}. [0m
WARNING:root:Stopping early since the longest observed run-time in the study exceeds the time remaining on this node.
INFO:echo.src.base_objective:Saving trial 586 results to local file /glade/work/kdagon/s2sml/results_wk3_608/trial_results/trial_results_1227858.desched1.csv
INFO:echo.src.base_objective:Merging trial results and saving to /glade/work/kdagon/s2sml/results_wk3_608/trial_results.csv
[32m[I 2023-06-09 03:11:19,475][0m Trial 586 finished with values: [0.13615499436855316, 0.044990434776991606, 3.7156104222393895] and parameters: {'learning_rate': 1.1779258107561554e-06, 'weight_decay': 9.574436305885266e-12, 'train_batch_size': 34, 'training_loss': 'huber', 'model_name': 'manet'}. [0m
WARNING:root:Stopping early since the longest observed run-time in the study exceeds the time remaining on this node.
