[32m[I 2023-06-09 02:37:15,233][0m Trial 557 finished with values: [0.03964478708803654, 0.0031465747742913663, 1.0436354952009153] and parameters: {'learning_rate': 7.250255306894821e-06, 'weight_decay': 0.00019259749796133392, 'train_batch_size': 11, 'training_loss': 'huber', 'model_name': 'manet'}. [0m
INFO:echo.src.base_objective:Attempting to automatically update the model configuration using optuna's suggested parameters
INFO:echo.src.base_objective:	model:name : pspnet
INFO:echo.src.base_objective:	optimizer:learning_rate : 0.0018339395641199896
INFO:echo.src.base_objective:	trainer:train_batch_size : 34
INFO:echo.src.base_objective:	trainer:weight_decay : 4.0016068325287186e-11
INFO:echo.src.base_objective:	trainer:training_loss : huber
INFO:echo.src.base_objective:Beginning trial 572
INFO:root:Loading model pspnet with settings {'in_channels': 4, 'classes': 1, 'activation': 'sigmoid'}
INFO:root:Loading loss smooth
INFO:root:Loading loss smooth
INFO:echo.src.base_objective:Saving trial 565 results to local file /glade/work/kdagon/s2sml/results_wk3_608/trial_results/trial_results_1227854.desched1.csv
INFO:echo.src.base_objective:Merging trial results and saving to /glade/work/kdagon/s2sml/results_wk3_608/trial_results.csv
[32m[I 2023-06-09 02:37:35,780][0m Trial 565 finished with values: [0.022081175353378057, 0.0009373899520142004, 0.9632367092960826] and parameters: {'learning_rate': 0.0009390700161306826, 'weight_decay': 0.00024467999407306224, 'train_batch_size': 34, 'training_loss': 'huber', 'model_name': 'manet'}. [0m
INFO:echo.src.base_objective:Attempting to automatically update the model configuration using optuna's suggested parameters
INFO:echo.src.base_objective:	model:name : fpn
INFO:echo.src.base_objective:	optimizer:learning_rate : 0.0018765051381239499
INFO:echo.src.base_objective:	trainer:train_batch_size : 33
INFO:echo.src.base_objective:	trainer:weight_decay : 3.448841134721507e-11
INFO:echo.src.base_objective:	trainer:training_loss : huber
INFO:echo.src.base_objective:Beginning trial 573
INFO:root:Loading model fpn with settings {'in_channels': 4, 'classes': 1, 'activation': 'sigmoid'}
INFO:root:Loading loss smooth
INFO:root:Loading loss smooth
INFO:echo.src.base_objective:Saving trial 560 results to local file /glade/work/kdagon/s2sml/results_wk3_608/trial_results/trial_results_1227860.desched1.csv
INFO:echo.src.base_objective:Merging trial results and saving to /glade/work/kdagon/s2sml/results_wk3_608/trial_results.csv
[32m[I 2023-06-09 02:39:28,093][0m Trial 560 finished with values: [0.07015265990048647, 0.008779045194387436, 1.4327466783448934] and parameters: {'learning_rate': 3.836444658401276e-06, 'weight_decay': 0.00024642246673970287, 'train_batch_size': 32, 'training_loss': 'huber', 'model_name': 'manet'}. [0m
INFO:echo.src.base_objective:Attempting to automatically update the model configuration using optuna's suggested parameters
INFO:echo.src.base_objective:	model:name : fpn
INFO:echo.src.base_objective:	optimizer:learning_rate : 2.8119170006962064e-06
INFO:echo.src.base_objective:	trainer:train_batch_size : 32
INFO:echo.src.base_objective:	trainer:weight_decay : 3.880707073840474e-11
INFO:echo.src.base_objective:	trainer:training_loss : huber
INFO:echo.src.base_objective:Beginning trial 574
INFO:root:Loading model fpn with settings {'in_channels': 4, 'classes': 1, 'activation': 'sigmoid'}
INFO:root:Loading loss smooth
INFO:root:Loading loss smooth
INFO:echo.src.base_objective:Saving trial 569 results to local file /glade/work/kdagon/s2sml/results_wk3_608/trial_results/trial_results_1227859.desched1.csv
INFO:echo.src.base_objective:Merging trial results and saving to /glade/work/kdagon/s2sml/results_wk3_608/trial_results.csv
[32m[I 2023-06-09 02:40:09,269][0m Trial 569 finished with values: [0.022275416180491447, 0.0011134021333418787, 0.964328318811817] and parameters: {'learning_rate': 0.000902843429249003, 'weight_decay': 4.884365775347067e-12, 'train_batch_size': 34, 'training_loss': 'huber', 'model_name': 'manet'}. [0m
INFO:echo.src.base_objective:Attempting to automatically update the model configuration using optuna's suggested parameters
INFO:echo.src.base_objective:	model:name : fpn
INFO:echo.src.base_objective:	optimizer:learning_rate : 2.5454280061039474e-06
INFO:echo.src.base_objective:	trainer:train_batch_size : 33
INFO:echo.src.base_objective:	trainer:weight_decay : 2.7919192038977748e-08
INFO:echo.src.base_objective:	trainer:training_loss : huber
INFO:echo.src.base_objective:Beginning trial 575
INFO:root:Loading model fpn with settings {'in_channels': 4, 'classes': 1, 'activation': 'sigmoid'}
INFO:root:Loading loss smooth
INFO:root:Loading loss smooth
INFO:echo.src.base_objective:Saving trial 566 results to local file /glade/work/kdagon/s2sml/results_wk3_608/trial_results/trial_results_1227855.desched1.csv
INFO:echo.src.base_objective:Merging trial results and saving to /glade/work/kdagon/s2sml/results_wk3_608/trial_results.csv
[32m[I 2023-06-09 02:41:24,364][0m Trial 566 finished with values: [0.02139975316822529, 0.0010777534625958651, 0.961469185986314] and parameters: {'learning_rate': 0.00194192481545519, 'weight_decay': 0.0002630029690100316, 'train_batch_size': 33, 'training_loss': 'huber', 'model_name': 'manet'}. [0m
INFO:echo.src.base_objective:Attempting to automatically update the model configuration using optuna's suggested parameters
INFO:echo.src.base_objective:	model:name : pspnet
INFO:echo.src.base_objective:	optimizer:learning_rate : 0.0017992752582216623
INFO:echo.src.base_objective:	trainer:train_batch_size : 32
INFO:echo.src.base_objective:	trainer:weight_decay : 2.9723079945999462e-08
INFO:echo.src.base_objective:	trainer:training_loss : huber
INFO:echo.src.base_objective:Beginning trial 576
INFO:root:Loading model pspnet with settings {'in_channels': 4, 'classes': 1, 'activation': 'sigmoid'}
INFO:root:Loading loss smooth
INFO:root:Loading loss smooth
INFO:echo.src.base_objective:Saving trial 570 results to local file /glade/work/kdagon/s2sml/results_wk3_608/trial_results/trial_results_1227857.desched1.csv
INFO:echo.src.base_objective:Merging trial results and saving to /glade/work/kdagon/s2sml/results_wk3_608/trial_results.csv
[32m[I 2023-06-09 02:42:05,939][0m Trial 570 finished with values: [0.022071622777730227, 0.0010571206512395293, 0.9644740878401997] and parameters: {'learning_rate': 0.0008704981752609553, 'weight_decay': 0.00028822466551143785, 'train_batch_size': 34, 'training_loss': 'huber', 'model_name': 'manet'}. [0m
INFO:echo.src.base_objective:Attempting to automatically update the model configuration using optuna's suggested parameters
INFO:echo.src.base_objective:	model:name : fpn
INFO:echo.src.base_objective:	optimizer:learning_rate : 0.001746315122855271
INFO:echo.src.base_objective:	trainer:train_batch_size : 33
INFO:echo.src.base_objective:	trainer:weight_decay : 3.491180348983349e-08
INFO:echo.src.base_objective:	trainer:training_loss : huber
INFO:echo.src.base_objective:Beginning trial 577
INFO:root:Loading model fpn with settings {'in_channels': 4, 'classes': 1, 'activation': 'sigmoid'}
INFO:root:Loading loss smooth
INFO:root:Loading loss smooth
INFO:echo.src.base_objective:Saving trial 568 results to local file /glade/work/kdagon/s2sml/results_wk3_608/trial_results/trial_results_1227853.desched1.csv
INFO:echo.src.base_objective:Merging trial results and saving to /glade/work/kdagon/s2sml/results_wk3_608/trial_results.csv
[32m[I 2023-06-09 02:44:31,337][0m Trial 568 finished with values: [0.021719316486269236, 0.0009710277809062973, 0.9622577103426749] and parameters: {'learning_rate': 0.0008830666746133641, 'weight_decay': 0.00023839761164383272, 'train_batch_size': 33, 'training_loss': 'huber', 'model_name': 'manet'}. [0m
INFO:echo.src.base_objective:Attempting to automatically update the model configuration using optuna's suggested parameters
INFO:echo.src.base_objective:Saving trial 564 results to local file /glade/work/kdagon/s2sml/results_wk3_608/trial_results/trial_results_1227851.desched1.csv
INFO:echo.src.base_objective:Merging trial results and saving to /glade/work/kdagon/s2sml/results_wk3_608/trial_results.csv
[32m[I 2023-06-09 02:44:31,876][0m Trial 564 finished with values: [0.028297773096710443, 0.0015709116123616695, 0.9857489146291701] and parameters: {'learning_rate': 2.8909503552686172e-05, 'weight_decay': 0.0003043871390808665, 'train_batch_size': 33, 'training_loss': 'huber', 'model_name': 'manet'}. [0m
INFO:echo.src.base_objective:Attempting to automatically update the model configuration using optuna's suggested parameters
INFO:echo.src.base_objective:	model:name : pspnet
INFO:echo.src.base_objective:	optimizer:learning_rate : 6.184809580060323e-06
INFO:echo.src.base_objective:	trainer:train_batch_size : 32
INFO:echo.src.base_objective:	trainer:weight_decay : 2.98860084406874e-08
INFO:echo.src.base_objective:	trainer:training_loss : huber
INFO:echo.src.base_objective:Beginning trial 578
INFO:echo.src.base_objective:	model:name : pspnet
INFO:echo.src.base_objective:	optimizer:learning_rate : 1.703819565009225e-05
INFO:echo.src.base_objective:	trainer:train_batch_size : 5
INFO:echo.src.base_objective:	trainer:weight_decay : 2.5316958543658033e-08
INFO:echo.src.base_objective:	trainer:training_loss : huber
INFO:echo.src.base_objective:Beginning trial 579
INFO:root:Loading model pspnet with settings {'in_channels': 4, 'classes': 1, 'activation': 'sigmoid'}
INFO:root:Loading loss smooth
INFO:root:Loading loss smooth
INFO:root:Loading model pspnet with settings {'in_channels': 4, 'classes': 1, 'activation': 'sigmoid'}
INFO:root:Loading loss smooth
INFO:root:Loading loss smooth
INFO:echo.src.base_objective:Saving trial 576 results to local file /glade/work/kdagon/s2sml/results_wk3_608/trial_results/trial_results_1227855.desched1.csv
INFO:echo.src.base_objective:Merging trial results and saving to /glade/work/kdagon/s2sml/results_wk3_608/trial_results.csv
[32m[I 2023-06-09 02:45:56,404][0m Trial 576 finished with values: [0.03859302122145891, 0.0033642551861703396, 1.070107087228633] and parameters: {'learning_rate': 0.0017992752582216623, 'weight_decay': 2.9723079945999462e-08, 'train_batch_size': 32, 'training_loss': 'huber', 'model_name': 'pspnet'}. [0m
INFO:echo.src.base_objective:Attempting to automatically update the model configuration using optuna's suggested parameters
INFO:echo.src.base_objective:	model:name : manet
INFO:echo.src.base_objective:	optimizer:learning_rate : 0.00021202226909562553
INFO:echo.src.base_objective:	trainer:train_batch_size : 34
INFO:echo.src.base_objective:	trainer:weight_decay : 1.2365140401077322e-10
INFO:echo.src.base_objective:	trainer:training_loss : huber
INFO:echo.src.base_objective:Beginning trial 580
INFO:echo.src.base_objective:Saving trial 571 results to local file /glade/work/kdagon/s2sml/results_wk3_608/trial_results/trial_results_1227858.desched1.csv
INFO:echo.src.base_objective:Merging trial results and saving to /glade/work/kdagon/s2sml/results_wk3_608/trial_results.csv
[32m[I 2023-06-09 02:46:08,106][0m Trial 571 finished with values: [0.02135314978659153, 0.001087421493139118, 0.9613802081822089] and parameters: {'learning_rate': 0.0019083512867985554, 'weight_decay': 0.00026546724102236176, 'train_batch_size': 34, 'training_loss': 'huber', 'model_name': 'manet'}. [0m
INFO:echo.src.base_objective:Attempting to automatically update the model configuration using optuna's suggested parameters
INFO:root:Loading model manet with settings {'in_channels': 4, 'classes': 1, 'activation': 'sigmoid'}
INFO:root:Loading loss smooth
INFO:root:Loading loss smooth
INFO:echo.src.base_objective:	model:name : manet
INFO:echo.src.base_objective:	optimizer:learning_rate : 0.009285351924705285
INFO:echo.src.base_objective:	trainer:train_batch_size : 33
INFO:echo.src.base_objective:	trainer:weight_decay : 5.142284515816512e-09
INFO:echo.src.base_objective:	trainer:training_loss : huber
INFO:echo.src.base_objective:Beginning trial 581
INFO:root:Loading model manet with settings {'in_channels': 4, 'classes': 1, 'activation': 'sigmoid'}
INFO:root:Loading loss smooth
INFO:root:Loading loss smooth
INFO:echo.src.base_objective:Saving trial 572 results to local file /glade/work/kdagon/s2sml/results_wk3_608/trial_results/trial_results_1227856.desched1.csv
INFO:echo.src.base_objective:Merging trial results and saving to /glade/work/kdagon/s2sml/results_wk3_608/trial_results.csv
[32m[I 2023-06-09 02:46:27,906][0m Trial 572 finished with values: [0.03635851573199034, 0.0034726749290712178, 1.0541990153228034] and parameters: {'learning_rate': 0.0018339395641199896, 'weight_decay': 4.0016068325287186e-11, 'train_batch_size': 34, 'training_loss': 'huber', 'model_name': 'pspnet'}. [0m
INFO:echo.src.base_objective:Attempting to automatically update the model configuration using optuna's suggested parameters
INFO:echo.src.base_objective:	model:name : fpn
INFO:echo.src.base_objective:	optimizer:learning_rate : 0.0075276166802481816
INFO:echo.src.base_objective:	trainer:train_batch_size : 5
INFO:echo.src.base_objective:	trainer:weight_decay : 4.2874103142988805e-09
INFO:echo.src.base_objective:	trainer:training_loss : huber
INFO:echo.src.base_objective:Beginning trial 582
INFO:root:Loading model fpn with settings {'in_channels': 4, 'classes': 1, 'activation': 'sigmoid'}
INFO:root:Loading loss smooth
INFO:root:Loading loss smooth
INFO:echo.src.base_objective:Saving trial 567 results to local file /glade/work/kdagon/s2sml/results_wk3_608/trial_results/trial_results_1227852.desched1.csv
INFO:echo.src.base_objective:Merging trial results and saving to /glade/work/kdagon/s2sml/results_wk3_608/trial_results.csv
[32m[I 2023-06-09 02:50:11,199][0m Trial 567 finished with values: [0.06924059987068176, 0.00928877666592598, 1.3940552022601618] and parameters: {'learning_rate': 2.9458745700042956e-06, 'weight_decay': 0.00026388078781356105, 'train_batch_size': 33, 'training_loss': 'huber', 'model_name': 'manet'}. [0m
INFO:echo.src.base_objective:Attempting to automatically update the model configuration using optuna's suggested parameters
INFO:echo.src.base_objective:	model:name : fpn
INFO:echo.src.base_objective:	optimizer:learning_rate : 2.668861548863803e-06
INFO:echo.src.base_objective:	trainer:train_batch_size : 32
INFO:echo.src.base_objective:	trainer:weight_decay : 4.505385052284686e-09
INFO:echo.src.base_objective:	trainer:training_loss : huber
INFO:echo.src.base_objective:Beginning trial 583
INFO:root:Loading model fpn with settings {'in_channels': 4, 'classes': 1, 'activation': 'sigmoid'}
INFO:root:Loading loss smooth
INFO:root:Loading loss smooth
INFO:echo.src.base_objective:Saving trial 573 results to local file /glade/work/kdagon/s2sml/results_wk3_608/trial_results/trial_results_1227854.desched1.csv
INFO:echo.src.base_objective:Merging trial results and saving to /glade/work/kdagon/s2sml/results_wk3_608/trial_results.csv
[32m[I 2023-06-09 02:51:56,641][0m Trial 573 finished with values: [0.02962955879047513, 0.002356048673391342, 1.0144741391018999] and parameters: {'learning_rate': 0.0018765051381239499, 'weight_decay': 3.448841134721507e-11, 'train_batch_size': 33, 'training_loss': 'huber', 'model_name': 'fpn'}. [0m
INFO:echo.src.base_objective:Attempting to automatically update the model configuration using optuna's suggested parameters
INFO:echo.src.base_objective:	model:name : manet
INFO:echo.src.base_objective:	optimizer:learning_rate : 1.5496617125377132e-05
INFO:echo.src.base_objective:	trainer:train_batch_size : 34
INFO:echo.src.base_objective:	trainer:weight_decay : 2.8679552139264123e-08
INFO:echo.src.base_objective:	trainer:training_loss : huber
INFO:echo.src.base_objective:Beginning trial 584
INFO:root:Loading model manet with settings {'in_channels': 4, 'classes': 1, 'activation': 'sigmoid'}
INFO:root:Loading loss smooth
INFO:root:Loading loss smooth
INFO:echo.src.base_objective:Saving trial 574 results to local file /glade/work/kdagon/s2sml/results_wk3_608/trial_results/trial_results_1227860.desched1.csv
INFO:echo.src.base_objective:Merging trial results and saving to /glade/work/kdagon/s2sml/results_wk3_608/trial_results.csv
[32m[I 2023-06-09 02:53:22,282][0m Trial 574 finished with values: [0.15080997720360756, 0.029982505831867456, 1.531504187503118] and parameters: {'learning_rate': 2.8119170006962064e-06, 'weight_decay': 3.880707073840474e-11, 'train_batch_size': 32, 'training_loss': 'huber', 'model_name': 'fpn'}. [0m
INFO:echo.src.base_objective:Attempting to automatically update the model configuration using optuna's suggested parameters
INFO:echo.src.base_objective:	model:name : manet
INFO:echo.src.base_objective:	optimizer:learning_rate : 0.0004918182823381431
INFO:echo.src.base_objective:	trainer:train_batch_size : 35
INFO:echo.src.base_objective:	trainer:weight_decay : 4.29673755978675e-09
INFO:echo.src.base_objective:	trainer:training_loss : huber
INFO:echo.src.base_objective:Beginning trial 585
INFO:root:Loading model manet with settings {'in_channels': 4, 'classes': 1, 'activation': 'sigmoid'}
INFO:root:Loading loss smooth
INFO:root:Loading loss smooth
INFO:echo.src.base_objective:Saving trial 581 results to local file /glade/work/kdagon/s2sml/results_wk3_608/trial_results/trial_results_1227858.desched1.csv
INFO:echo.src.base_objective:Merging trial results and saving to /glade/work/kdagon/s2sml/results_wk3_608/trial_results.csv
[32m[I 2023-06-09 02:55:11,108][0m Trial 581 finished with values: [0.021544788498431444, 0.0009872327209450305, 0.961154909642816] and parameters: {'learning_rate': 0.009285351924705285, 'weight_decay': 5.142284515816512e-09, 'train_batch_size': 33, 'training_loss': 'huber', 'model_name': 'manet'}. [0m
INFO:echo.src.base_objective:Attempting to automatically update the model configuration using optuna's suggested parameters
INFO:echo.src.base_objective:	model:name : manet
INFO:echo.src.base_objective:	optimizer:learning_rate : 1.1779258107561554e-06
INFO:echo.src.base_objective:	trainer:train_batch_size : 34
INFO:echo.src.base_objective:	trainer:weight_decay : 9.574436305885266e-12
INFO:echo.src.base_objective:	trainer:training_loss : huber
INFO:echo.src.base_objective:Beginning trial 586
INFO:root:Loading model manet with settings {'in_channels': 4, 'classes': 1, 'activation': 'sigmoid'}
INFO:root:Loading loss smooth
INFO:root:Loading loss smooth
INFO:echo.src.base_objective:Saving trial 577 results to local file /glade/work/kdagon/s2sml/results_wk3_608/trial_results/trial_results_1227857.desched1.csv
INFO:echo.src.base_objective:Merging trial results and saving to /glade/work/kdagon/s2sml/results_wk3_608/trial_results.csv
[32m[I 2023-06-09 02:56:54,462][0m Trial 577 finished with values: [0.030775289051234722, 0.0024768602452240884, 1.019815306854598] and parameters: {'learning_rate': 0.001746315122855271, 'weight_decay': 3.491180348983349e-08, 'train_batch_size': 33, 'training_loss': 'huber', 'model_name': 'fpn'}. [0m
WARNING:root:Stopping early since the longest observed run-time in the study exceeds the time remaining on this node.
INFO:echo.src.base_objective:Saving trial 579 results to local file /glade/work/kdagon/s2sml/results_wk3_608/trial_results/trial_results_1227851.desched1.csv
INFO:echo.src.base_objective:Merging trial results and saving to /glade/work/kdagon/s2sml/results_wk3_608/trial_results.csv
[32m[I 2023-06-09 02:56:59,613][0m Trial 579 finished with values: [0.03874970134347677, 0.003258806944359094, 1.062445453586004] and parameters: {'learning_rate': 1.703819565009225e-05, 'weight_decay': 2.5316958543658033e-08, 'train_batch_size': 5, 'training_loss': 'huber', 'model_name': 'pspnet'}. [0m
WARNING:root:Stopping early since the longest observed run-time in the study exceeds the time remaining on this node.
INFO:echo.src.base_objective:Saving trial 575 results to local file /glade/work/kdagon/s2sml/results_wk3_608/trial_results/trial_results_1227859.desched1.csv
INFO:echo.src.base_objective:Merging trial results and saving to /glade/work/kdagon/s2sml/results_wk3_608/trial_results.csv
[32m[I 2023-06-09 02:57:19,464][0m Trial 575 finished with values: [0.15227283164858818, 0.028218244668096304, 1.547636264978972] and parameters: {'learning_rate': 2.5454280061039474e-06, 'weight_decay': 2.7919192038977748e-08, 'train_batch_size': 33, 'training_loss': 'huber', 'model_name': 'fpn'}. [0m
WARNING:root:Stopping early since the longest observed run-time in the study exceeds the time remaining on this node.
INFO:echo.src.base_objective:Saving trial 578 results to local file /glade/work/kdagon/s2sml/results_wk3_608/trial_results/trial_results_1227853.desched1.csv
INFO:echo.src.base_objective:Merging trial results and saving to /glade/work/kdagon/s2sml/results_wk3_608/trial_results.csv
[32m[I 2023-06-09 02:58:49,491][0m Trial 578 finished with values: [0.0427650548517704, 0.003917541005648673, 1.0816477868371805] and parameters: {'learning_rate': 6.184809580060323e-06, 'weight_decay': 2.98860084406874e-08, 'train_batch_size': 32, 'training_loss': 'huber', 'model_name': 'pspnet'}. [0m
WARNING:root:Stopping early since the longest observed run-time in the study exceeds the time remaining on this node.
INFO:echo.src.base_objective:Saving trial 585 results to local file /glade/work/kdagon/s2sml/results_wk3_608/trial_results/trial_results_1227860.desched1.csv
INFO:echo.src.base_objective:Merging trial results and saving to /glade/work/kdagon/s2sml/results_wk3_608/trial_results.csv
