[32m[I 2023-06-08 16:56:32,085][0m Trial 72 finished with values: [0.038426658138632774, 0.003329033264890313, 1.0624074827993044] and parameters: {'learning_rate': 4.6957665138183766e-05, 'weight_decay': 0.00010860765044285564, 'train_batch_size': 11, 'training_loss': 'mse', 'model_name': 'pspnet'}. [0m
INFO:echo.src.base_objective:Attempting to automatically update the model configuration using optuna's suggested parameters
INFO:echo.src.base_objective:	model:name : linknet
INFO:echo.src.base_objective:	optimizer:learning_rate : 2.2112519356720848e-06
INFO:echo.src.base_objective:	trainer:train_batch_size : 98
INFO:echo.src.base_objective:	trainer:weight_decay : 0.00025935143806886987
INFO:echo.src.base_objective:	trainer:training_loss : logcosh
INFO:echo.src.base_objective:Beginning trial 79
INFO:root:Loading model linknet with settings {'in_channels': 4, 'classes': 1, 'activation': 'sigmoid'}
INFO:root:Loading loss smooth
INFO:root:Loading loss smooth
INFO:echo.src.base_objective:Saving trial 79 results to local file /glade/work/kdagon/s2sml/results_wk3_608/trial_results/trial_results_1227853.desched1.csv
INFO:echo.src.base_objective:Merging trial results and saving to /glade/work/kdagon/s2sml/results_wk3_608/trial_results.csv
[32m[I 2023-06-08 16:59:30,279][0m Trial 79 finished with values: [0.1556468941271305, 0.03871632739901543, 13.122640017630678] and parameters: {'learning_rate': 2.2112519356720848e-06, 'weight_decay': 0.00025935143806886987, 'train_batch_size': 98, 'training_loss': 'logcosh', 'model_name': 'linknet'}. [0m
INFO:echo.src.base_objective:Attempting to automatically update the model configuration using optuna's suggested parameters
INFO:echo.src.base_objective:	model:name : manet
INFO:echo.src.base_objective:	optimizer:learning_rate : 1.0108741970240848e-06
INFO:echo.src.base_objective:	trainer:train_batch_size : 95
INFO:echo.src.base_objective:	trainer:weight_decay : 1.3681174055697668e-07
INFO:echo.src.base_objective:	trainer:training_loss : xsigmoid
INFO:echo.src.base_objective:Beginning trial 80
INFO:root:Loading model manet with settings {'in_channels': 4, 'classes': 1, 'activation': 'sigmoid'}
INFO:root:Loading loss smooth
INFO:root:Loading loss smooth
INFO:echo.src.base_objective:Saving trial 80 results to local file /glade/work/kdagon/s2sml/results_wk3_608/trial_results/trial_results_1227853.desched1.csv
INFO:echo.src.base_objective:Merging trial results and saving to /glade/work/kdagon/s2sml/results_wk3_608/trial_results.csv
[32m[I 2023-06-08 17:02:25,934][0m Trial 80 finished with values: [0.10324407927691936, 0.02055413741618395, 28.962300314061636] and parameters: {'learning_rate': 1.0108741970240848e-06, 'weight_decay': 1.3681174055697668e-07, 'train_batch_size': 95, 'training_loss': 'xsigmoid', 'model_name': 'manet'}. [0m
INFO:echo.src.base_objective:Attempting to automatically update the model configuration using optuna's suggested parameters
INFO:echo.src.base_objective:	model:name : unet
INFO:echo.src.base_objective:	optimizer:learning_rate : 6.074828783981395e-06
INFO:echo.src.base_objective:	trainer:train_batch_size : 50
INFO:echo.src.base_objective:	trainer:weight_decay : 5.935130516653174e-06
INFO:echo.src.base_objective:	trainer:training_loss : huber
INFO:echo.src.base_objective:Beginning trial 81
INFO:root:Loading model unet with settings {'in_channels': 4, 'classes': 1, 'activation': 'sigmoid'}
INFO:root:Loading loss smooth
INFO:root:Loading loss smooth
INFO:echo.src.base_objective:Saving trial 65 results to local file /glade/work/kdagon/s2sml/results_wk3_608/trial_results/trial_results_1227860.desched1.csv
INFO:echo.src.base_objective:Merging trial results and saving to /glade/work/kdagon/s2sml/results_wk3_608/trial_results.csv
[32m[I 2023-06-08 17:03:11,803][0m Trial 65 finished with values: [0.03155165817588568, 0.0021064033498987556, 0.9938138907172769] and parameters: {'learning_rate': 3.411634678530076e-05, 'weight_decay': 1.0618988934365154e-07, 'train_batch_size': 85, 'training_loss': 'smooth', 'model_name': 'unet'}. [0m
INFO:echo.src.base_objective:Attempting to automatically update the model configuration using optuna's suggested parameters
INFO:echo.src.base_objective:	model:name : pspnet
INFO:echo.src.base_objective:	optimizer:learning_rate : 2.1188662024536117e-06
INFO:echo.src.base_objective:	trainer:train_batch_size : 79
INFO:echo.src.base_objective:	trainer:weight_decay : 9.512306385158258e-12
INFO:echo.src.base_objective:	trainer:training_loss : xsigmoid
INFO:echo.src.base_objective:Beginning trial 82
INFO:root:Loading model pspnet with settings {'in_channels': 4, 'classes': 1, 'activation': 'sigmoid'}
INFO:root:Loading loss smooth
INFO:root:Loading loss smooth
INFO:echo.src.base_objective:Saving trial 71 results to local file /glade/work/kdagon/s2sml/results_wk3_608/trial_results/trial_results_1227859.desched1.csv
INFO:echo.src.base_objective:Merging trial results and saving to /glade/work/kdagon/s2sml/results_wk3_608/trial_results.csv
[32m[I 2023-06-08 17:04:39,222][0m Trial 71 finished with values: [0.04328856058418751, 0.0035760795581154525, 1.0405646655868974] and parameters: {'learning_rate': 1.3582524960592005e-05, 'weight_decay': 8.491756660774182e-07, 'train_batch_size': 39, 'training_loss': 'mse', 'model_name': 'unet'}. [0m
INFO:echo.src.base_objective:Attempting to automatically update the model configuration using optuna's suggested parameters
INFO:echo.src.base_objective:	model:name : manet
INFO:echo.src.base_objective:	optimizer:learning_rate : 9.397890798304064e-05
INFO:echo.src.base_objective:	trainer:train_batch_size : 43
INFO:echo.src.base_objective:	trainer:weight_decay : 7.975206205283559e-06
INFO:echo.src.base_objective:	trainer:training_loss : huber
INFO:echo.src.base_objective:Beginning trial 83
INFO:root:Loading model manet with settings {'in_channels': 4, 'classes': 1, 'activation': 'sigmoid'}
INFO:root:Loading loss smooth
INFO:root:Loading loss smooth
INFO:echo.src.base_objective:Saving trial 67 results to local file /glade/work/kdagon/s2sml/results_wk3_608/trial_results/trial_results_1227852.desched1.csv
INFO:echo.src.base_objective:Merging trial results and saving to /glade/work/kdagon/s2sml/results_wk3_608/trial_results.csv
[32m[I 2023-06-08 17:05:04,220][0m Trial 67 finished with values: [0.031147960107773542, 0.00253726402297616, 1.0176253834962068] and parameters: {'learning_rate': 0.0005287536954032255, 'weight_decay': 4.266673377639058e-08, 'train_batch_size': 91, 'training_loss': 'smooth', 'model_name': 'fpn'}. [0m
INFO:echo.src.base_objective:Attempting to automatically update the model configuration using optuna's suggested parameters
INFO:echo.src.base_objective:	model:name : deeplabv3+
INFO:echo.src.base_objective:	optimizer:learning_rate : 5.391315311954256e-06
INFO:echo.src.base_objective:	trainer:train_batch_size : 104
INFO:echo.src.base_objective:	trainer:weight_decay : 6.026209731715327e-12
INFO:echo.src.base_objective:	trainer:training_loss : xsigmoid
INFO:echo.src.base_objective:Beginning trial 84
INFO:root:Loading model deeplabv3+ with settings {'in_channels': 4, 'classes': 1, 'activation': 'sigmoid'}
INFO:root:Loading loss smooth
INFO:root:Loading loss smooth
INFO:echo.src.base_objective:Saving trial 73 results to local file /glade/work/kdagon/s2sml/results_wk3_608/trial_results/trial_results_1227854.desched1.csv
INFO:echo.src.base_objective:Merging trial results and saving to /glade/work/kdagon/s2sml/results_wk3_608/trial_results.csv
[32m[I 2023-06-08 17:06:39,236][0m Trial 73 finished with values: [0.14661353826522827, 0.02697415230795741, 1.5700305172244742] and parameters: {'learning_rate': 2.433480456854594e-06, 'weight_decay': 0.0004553440663539425, 'train_batch_size': 48, 'training_loss': 'mse', 'model_name': 'fpn'}. [0m
INFO:echo.src.base_objective:Attempting to automatically update the model configuration using optuna's suggested parameters
INFO:echo.src.base_objective:	model:name : unet
INFO:echo.src.base_objective:	optimizer:learning_rate : 2.7542790729671914e-05
INFO:echo.src.base_objective:	trainer:train_batch_size : 61
INFO:echo.src.base_objective:	trainer:weight_decay : 1.0794791727325559e-12
INFO:echo.src.base_objective:	trainer:training_loss : xsigmoid
INFO:echo.src.base_objective:Beginning trial 85
INFO:root:Loading model unet with settings {'in_channels': 4, 'classes': 1, 'activation': 'sigmoid'}
INFO:root:Loading loss smooth
INFO:root:Loading loss smooth
INFO:echo.src.base_objective:Saving trial 76 results to local file /glade/work/kdagon/s2sml/results_wk3_608/trial_results/trial_results_1227855.desched1.csv
INFO:echo.src.base_objective:Merging trial results and saving to /glade/work/kdagon/s2sml/results_wk3_608/trial_results.csv
[32m[I 2023-06-08 17:07:31,592][0m Trial 76 finished with values: [0.02586467145010829, 0.001388912001857534, 0.9742090995093132] and parameters: {'learning_rate': 0.00029690203533769825, 'weight_decay': 3.975156819578084e-12, 'train_batch_size': 55, 'training_loss': 'huber', 'model_name': 'linknet'}. [0m
INFO:echo.src.base_objective:Attempting to automatically update the model configuration using optuna's suggested parameters
INFO:echo.src.base_objective:	model:name : deeplabv3+
INFO:echo.src.base_objective:	optimizer:learning_rate : 0.00026197052640348963
INFO:echo.src.base_objective:	trainer:train_batch_size : 126
INFO:echo.src.base_objective:	trainer:weight_decay : 9.360647782742505e-09
INFO:echo.src.base_objective:	trainer:training_loss : xsigmoid
INFO:echo.src.base_objective:Beginning trial 86
INFO:root:Loading model deeplabv3+ with settings {'in_channels': 4, 'classes': 1, 'activation': 'sigmoid'}
INFO:root:Loading loss smooth
INFO:root:Loading loss smooth
INFO:echo.src.base_objective:Saving trial 58 results to local file /glade/work/kdagon/s2sml/results_wk3_608/trial_results/trial_results_1227851.desched1.csv
INFO:echo.src.base_objective:Merging trial results and saving to /glade/work/kdagon/s2sml/results_wk3_608/trial_results.csv
[32m[I 2023-06-08 17:08:11,936][0m Trial 58 finished with values: [0.04643738456070423, 0.0037447931827045977, 1.0705823744759606] and parameters: {'learning_rate': 1.5863787278927462e-06, 'weight_decay': 2.19149536798907e-06, 'train_batch_size': 8, 'training_loss': 'xsigmoid', 'model_name': 'unet++'}. [0m
INFO:echo.src.base_objective:Attempting to automatically update the model configuration using optuna's suggested parameters
INFO:echo.src.base_objective:	model:name : manet
INFO:echo.src.base_objective:	optimizer:learning_rate : 0.0017275786259208226
INFO:echo.src.base_objective:	trainer:train_batch_size : 40
INFO:echo.src.base_objective:	trainer:weight_decay : 8.845851767090052e-10
INFO:echo.src.base_objective:	trainer:training_loss : smooth
INFO:echo.src.base_objective:Beginning trial 87
INFO:root:Loading model manet with settings {'in_channels': 4, 'classes': 1, 'activation': 'sigmoid'}
INFO:root:Loading loss smooth
INFO:root:Loading loss smooth
INFO:echo.src.base_objective:Saving trial 84 results to local file /glade/work/kdagon/s2sml/results_wk3_608/trial_results/trial_results_1227852.desched1.csv
INFO:echo.src.base_objective:Merging trial results and saving to /glade/work/kdagon/s2sml/results_wk3_608/trial_results.csv
[32m[I 2023-06-08 17:09:10,222][0m Trial 84 finished with values: [0.10102563165128231, 0.01928850752301514, 4.756075934208766] and parameters: {'learning_rate': 5.391315311954256e-06, 'weight_decay': 6.026209731715327e-12, 'train_batch_size': 104, 'training_loss': 'xsigmoid', 'model_name': 'deeplabv3+'}. [0m
INFO:echo.src.base_objective:Attempting to automatically update the model configuration using optuna's suggested parameters
INFO:echo.src.base_objective:	model:name : deeplabv3
INFO:echo.src.base_objective:	optimizer:learning_rate : 1.3477802291525817e-05
INFO:echo.src.base_objective:	trainer:train_batch_size : 120
INFO:echo.src.base_objective:	trainer:weight_decay : 4.130439451167222e-07
INFO:echo.src.base_objective:	trainer:training_loss : mae
INFO:echo.src.base_objective:Beginning trial 88
INFO:root:Loading model deeplabv3 with settings {'in_channels': 4, 'classes': 1, 'activation': 'sigmoid'}
INFO:root:Loading loss smooth
INFO:root:Loading loss smooth
INFO:echo.src.base_objective:Saving trial 75 results to local file /glade/work/kdagon/s2sml/results_wk3_608/trial_results/trial_results_1227857.desched1.csv
INFO:echo.src.base_objective:Merging trial results and saving to /glade/work/kdagon/s2sml/results_wk3_608/trial_results.csv
[32m[I 2023-06-08 17:09:25,728][0m Trial 75 finished with values: [0.020492298528552055, 0.001084603602066636, 0.9605492479772635] and parameters: {'learning_rate': 0.004674684734985958, 'weight_decay': 2.7082821738787484e-09, 'train_batch_size': 28, 'training_loss': 'smooth', 'model_name': 'manet'}. [0m
INFO:echo.src.base_objective:Attempting to automatically update the model configuration using optuna's suggested parameters
INFO:echo.src.base_objective:	model:name : fpn
INFO:echo.src.base_objective:	optimizer:learning_rate : 0.0001005774028901676
INFO:echo.src.base_objective:	trainer:train_batch_size : 86
INFO:echo.src.base_objective:	trainer:weight_decay : 8.755425643498074e-08
INFO:echo.src.base_objective:	trainer:training_loss : xtanh
INFO:echo.src.base_objective:Beginning trial 89
INFO:root:Loading model fpn with settings {'in_channels': 4, 'classes': 1, 'activation': 'sigmoid'}
INFO:root:Loading loss smooth
INFO:root:Loading loss smooth
INFO:echo.src.base_objective:Saving trial 77 results to local file /glade/work/kdagon/s2sml/results_wk3_608/trial_results/trial_results_1227858.desched1.csv
INFO:echo.src.base_objective:Merging trial results and saving to /glade/work/kdagon/s2sml/results_wk3_608/trial_results.csv
[32m[I 2023-06-08 17:09:35,869][0m Trial 77 finished with values: [0.0315121253952384, 0.002190600032918155, 1.0023241689911793] and parameters: {'learning_rate': 0.00010303360216200571, 'weight_decay': 8.980857861185829e-05, 'train_batch_size': 34, 'training_loss': 'smooth', 'model_name': 'linknet'}. [0m
INFO:echo.src.base_objective:Attempting to automatically update the model configuration using optuna's suggested parameters
INFO:echo.src.base_objective:	model:name : deeplabv3+
INFO:echo.src.base_objective:	optimizer:learning_rate : 1.2587066259890458e-06
INFO:echo.src.base_objective:	trainer:train_batch_size : 48
INFO:echo.src.base_objective:	trainer:weight_decay : 0.00018231043715594622
INFO:echo.src.base_objective:	trainer:training_loss : smooth
INFO:echo.src.base_objective:Beginning trial 90
INFO:root:Loading model deeplabv3+ with settings {'in_channels': 4, 'classes': 1, 'activation': 'sigmoid'}
INFO:root:Loading loss smooth
INFO:root:Loading loss smooth
INFO:echo.src.base_objective:Saving trial 78 results to local file /glade/work/kdagon/s2sml/results_wk3_608/trial_results/trial_results_1227856.desched1.csv
INFO:echo.src.base_objective:Merging trial results and saving to /glade/work/kdagon/s2sml/results_wk3_608/trial_results.csv
[32m[I 2023-06-08 17:12:44,904][0m Trial 78 finished with values: [0.02099639642983675, 0.0010573904000921175, 0.961517078603217] and parameters: {'learning_rate': 0.0005581886618149573, 'weight_decay': 2.9555224259851114e-08, 'train_batch_size': 59, 'training_loss': 'logcosh', 'model_name': 'unet'}. [0m
INFO:echo.src.base_objective:Attempting to automatically update the model configuration using optuna's suggested parameters
INFO:echo.src.base_objective:	model:name : unet
INFO:echo.src.base_objective:	optimizer:learning_rate : 5.224824660266366e-06
INFO:echo.src.base_objective:	trainer:train_batch_size : 105
INFO:echo.src.base_objective:	trainer:weight_decay : 2.39993889021994e-12
INFO:echo.src.base_objective:	trainer:training_loss : xtanh
INFO:echo.src.base_objective:Beginning trial 91
INFO:root:Loading model unet with settings {'in_channels': 4, 'classes': 1, 'activation': 'sigmoid'}
INFO:root:Loading loss smooth
INFO:root:Loading loss smooth
INFO:echo.src.base_objective:Saving trial 90 results to local file /glade/work/kdagon/s2sml/results_wk3_608/trial_results/trial_results_1227858.desched1.csv
INFO:echo.src.base_objective:Merging trial results and saving to /glade/work/kdagon/s2sml/results_wk3_608/trial_results.csv
[32m[I 2023-06-08 17:13:09,452][0m Trial 90 finished with values: [0.10345525294542313, 0.020266018575057387, 2.903600309001302] and parameters: {'learning_rate': 1.2587066259890458e-06, 'weight_decay': 0.00018231043715594622, 'train_batch_size': 48, 'training_loss': 'smooth', 'model_name': 'deeplabv3+'}. [0m
INFO:echo.src.base_objective:Attempting to automatically update the model configuration using optuna's suggested parameters
INFO:echo.src.base_objective:	model:name : unet++
INFO:echo.src.base_objective:	optimizer:learning_rate : 2.0072140340390615e-05
INFO:echo.src.base_objective:	trainer:train_batch_size : 122
INFO:echo.src.base_objective:	trainer:weight_decay : 1.5094779239102253e-09
INFO:echo.src.base_objective:	trainer:training_loss : mae
INFO:echo.src.base_objective:Beginning trial 92
INFO:root:Loading model unet++ with settings {'in_channels': 4, 'classes': 1, 'activation': 'sigmoid'}
INFO:root:Loading loss smooth
INFO:root:Loading loss smooth
INFO:echo.src.base_objective:Saving trial 91 results to local file /glade/work/kdagon/s2sml/results_wk3_608/trial_results/trial_results_1227856.desched1.csv
INFO:echo.src.base_objective:Merging trial results and saving to /glade/work/kdagon/s2sml/results_wk3_608/trial_results.csv
[32m[I 2023-06-08 17:15:33,577][0m Trial 91 finished with values: [0.15506752207875252, 0.04114913195371628, 1896907.6293601652] and parameters: {'learning_rate': 5.224824660266366e-06, 'weight_decay': 2.39993889021994e-12, 'train_batch_size': 105, 'training_loss': 'xtanh', 'model_name': 'unet'}. [0m
INFO:echo.src.base_objective:Attempting to automatically update the model configuration using optuna's suggested parameters
INFO:echo.src.base_objective:	model:name : unet
INFO:echo.src.base_objective:	optimizer:learning_rate : 3.0351989412106995e-06
INFO:echo.src.base_objective:	trainer:train_batch_size : 23
INFO:echo.src.base_objective:	trainer:weight_decay : 0.0003066428783089245
INFO:echo.src.base_objective:	trainer:training_loss : huber
INFO:echo.src.base_objective:Beginning trial 93
INFO:root:Loading model unet with settings {'in_channels': 4, 'classes': 1, 'activation': 'sigmoid'}
INFO:root:Loading loss smooth
INFO:root:Loading loss smooth
INFO:echo.src.base_objective:Saving trial 92 results to local file /glade/work/kdagon/s2sml/results_wk3_608/trial_results/trial_results_1227858.desched1.csv
INFO:echo.src.base_objective:Merging trial results and saving to /glade/work/kdagon/s2sml/results_wk3_608/trial_results.csv
[32m[I 2023-06-08 17:16:00,333][0m Trial 92 finished with values: [0.11577038280665874, 0.023909499403089285, 14.230875367795992] and parameters: {'learning_rate': 2.0072140340390615e-05, 'weight_decay': 1.5094779239102253e-09, 'train_batch_size': 122, 'training_loss': 'mae', 'model_name': 'unet++'}. [0m
INFO:echo.src.base_objective:Attempting to automatically update the model configuration using optuna's suggested parameters
INFO:echo.src.base_objective:	model:name : unet
INFO:echo.src.base_objective:	optimizer:learning_rate : 2.9836746018571547e-05
INFO:echo.src.base_objective:	trainer:train_batch_size : 39
INFO:echo.src.base_objective:	trainer:weight_decay : 1.2114190364012455e-10
INFO:echo.src.base_objective:	trainer:training_loss : mae
INFO:echo.src.base_objective:Beginning trial 94
INFO:root:Loading model unet with settings {'in_channels': 4, 'classes': 1, 'activation': 'sigmoid'}
INFO:root:Loading loss smooth
INFO:root:Loading loss smooth
INFO:echo.src.base_objective:Saving trial 87 results to local file /glade/work/kdagon/s2sml/results_wk3_608/trial_results/trial_results_1227851.desched1.csv
INFO:echo.src.base_objective:Merging trial results and saving to /glade/work/kdagon/s2sml/results_wk3_608/trial_results.csv
[32m[I 2023-06-08 17:16:52,883][0m Trial 87 finished with values: [0.021600741893053055, 0.0010492436704225838, 0.9617352578543372] and parameters: {'learning_rate': 0.0017275786259208226, 'weight_decay': 8.845851767090052e-10, 'train_batch_size': 40, 'training_loss': 'smooth', 'model_name': 'manet'}. [0m
INFO:echo.src.base_objective:Attempting to automatically update the model configuration using optuna's suggested parameters
INFO:echo.src.base_objective:	model:name : fpn
INFO:echo.src.base_objective:	optimizer:learning_rate : 0.0010755161444345681
INFO:echo.src.base_objective:	trainer:train_batch_size : 50
INFO:echo.src.base_objective:	trainer:weight_decay : 9.48365876753998e-10
INFO:echo.src.base_objective:	trainer:training_loss : xsigmoid
INFO:echo.src.base_objective:Beginning trial 95
INFO:root:Loading model fpn with settings {'in_channels': 4, 'classes': 1, 'activation': 'sigmoid'}
INFO:root:Loading loss smooth
INFO:root:Loading loss smooth
INFO:echo.src.base_objective:Saving trial 83 results to local file /glade/work/kdagon/s2sml/results_wk3_608/trial_results/trial_results_1227859.desched1.csv
INFO:echo.src.base_objective:Merging trial results and saving to /glade/work/kdagon/s2sml/results_wk3_608/trial_results.csv
