[32m[I 2023-06-08 15:57:13,685][0m Trial 21 finished with values: [0.03671551961451769, 0.0031402172753587365, 1.055486715364853] and parameters: {'learning_rate': 0.001194075628346141, 'weight_decay': 1.9370481717273183e-07, 'train_batch_size': 83, 'training_loss': 'huber', 'model_name': 'deeplabv3'}. [0m
INFO:echo.src.base_objective:Attempting to automatically update the model configuration using optuna's suggested parameters
INFO:echo.src.base_objective:	model:name : unet++
INFO:echo.src.base_objective:	optimizer:learning_rate : 9.780358635036775e-05
INFO:echo.src.base_objective:	trainer:train_batch_size : 31
INFO:echo.src.base_objective:	trainer:weight_decay : 3.1747801340071636e-07
INFO:echo.src.base_objective:	trainer:training_loss : xsigmoid
INFO:echo.src.base_objective:Beginning trial 28
INFO:root:Loading model unet++ with settings {'in_channels': 4, 'classes': 1, 'activation': 'sigmoid'}
INFO:root:Loading loss smooth
INFO:root:Loading loss smooth
INFO:echo.src.base_objective:Saving trial 23 results to local file /glade/work/kdagon/s2sml/results_wk3_608/trial_results/trial_results_1227854.desched1.csv
INFO:echo.src.base_objective:Merging trial results and saving to /glade/work/kdagon/s2sml/results_wk3_608/trial_results.csv
[32m[I 2023-06-08 16:00:38,763][0m Trial 23 finished with values: [0.03709143865853548, 0.003386328578926623, 1.0533267619036821] and parameters: {'learning_rate': 0.0009497090312282512, 'weight_decay': 4.0756702890595044e-09, 'train_batch_size': 77, 'training_loss': 'mse', 'model_name': 'pspnet'}. [0m
INFO:echo.src.base_objective:Attempting to automatically update the model configuration using optuna's suggested parameters
INFO:echo.src.base_objective:	model:name : deeplabv3
INFO:echo.src.base_objective:	optimizer:learning_rate : 1.0396410542378559e-05
INFO:echo.src.base_objective:	trainer:train_batch_size : 89
INFO:echo.src.base_objective:	trainer:weight_decay : 0.00010442169817214107
INFO:echo.src.base_objective:	trainer:training_loss : xtanh
INFO:echo.src.base_objective:Beginning trial 29
INFO:root:Loading model deeplabv3 with settings {'in_channels': 4, 'classes': 1, 'activation': 'sigmoid'}
INFO:root:Loading loss smooth
INFO:root:Loading loss smooth
INFO:echo.src.base_objective:Saving trial 24 results to local file /glade/work/kdagon/s2sml/results_wk3_608/trial_results/trial_results_1227857.desched1.csv
INFO:echo.src.base_objective:Merging trial results and saving to /glade/work/kdagon/s2sml/results_wk3_608/trial_results.csv
[32m[I 2023-06-08 16:02:39,097][0m Trial 24 finished with values: [0.04534215107560158, 0.0035661380388773978, 1.0358034659790984] and parameters: {'learning_rate': 0.0001257039303485649, 'weight_decay': 2.2977181538360198e-10, 'train_batch_size': 71, 'training_loss': 'mae', 'model_name': 'fpn'}. [0m
INFO:echo.src.base_objective:Attempting to automatically update the model configuration using optuna's suggested parameters
INFO:echo.src.base_objective:	model:name : unet++
INFO:echo.src.base_objective:	optimizer:learning_rate : 5.439342099414414e-05
INFO:echo.src.base_objective:	trainer:train_batch_size : 42
INFO:echo.src.base_objective:	trainer:weight_decay : 5.69094690199488e-06
INFO:echo.src.base_objective:	trainer:training_loss : logcosh
INFO:echo.src.base_objective:Beginning trial 30
INFO:root:Loading model unet++ with settings {'in_channels': 4, 'classes': 1, 'activation': 'sigmoid'}
INFO:root:Loading loss smooth
INFO:root:Loading loss smooth
INFO:echo.src.base_objective:Saving trial 22 results to local file /glade/work/kdagon/s2sml/results_wk3_608/trial_results/trial_results_1227858.desched1.csv
INFO:echo.src.base_objective:Merging trial results and saving to /glade/work/kdagon/s2sml/results_wk3_608/trial_results.csv
[32m[I 2023-06-08 16:04:38,220][0m Trial 22 finished with values: [0.021661446895450354, 0.0010828687954926863, 0.9619174659466159] and parameters: {'learning_rate': 0.0008943110653181959, 'weight_decay': 2.3348796902256786e-08, 'train_batch_size': 28, 'training_loss': 'xsigmoid', 'model_name': 'linknet'}. [0m
INFO:echo.src.base_objective:Attempting to automatically update the model configuration using optuna's suggested parameters
INFO:echo.src.base_objective:	model:name : unet
INFO:echo.src.base_objective:	optimizer:learning_rate : 0.0001856596420017245
INFO:echo.src.base_objective:	trainer:train_batch_size : 81
INFO:echo.src.base_objective:	trainer:weight_decay : 7.806184609232721e-06
INFO:echo.src.base_objective:	trainer:training_loss : smooth
INFO:echo.src.base_objective:Beginning trial 31
INFO:root:Loading model unet with settings {'in_channels': 4, 'classes': 1, 'activation': 'sigmoid'}
INFO:root:Loading loss smooth
INFO:root:Loading loss smooth
INFO:echo.src.base_objective:Saving trial 27 results to local file /glade/work/kdagon/s2sml/results_wk3_608/trial_results/trial_results_1227859.desched1.csv
INFO:echo.src.base_objective:Merging trial results and saving to /glade/work/kdagon/s2sml/results_wk3_608/trial_results.csv
[32m[I 2023-06-08 16:05:49,505][0m Trial 27 finished with values: [0.020741344895213842, 0.000974015420069918, 0.961701541342348] and parameters: {'learning_rate': 0.0006053710374154719, 'weight_decay': 8.154406227605438e-12, 'train_batch_size': 4, 'training_loss': 'smooth', 'model_name': 'manet'}. [0m
INFO:echo.src.base_objective:Attempting to automatically update the model configuration using optuna's suggested parameters
INFO:echo.src.base_objective:	model:name : linknet
INFO:echo.src.base_objective:	optimizer:learning_rate : 5.250740121711243e-05
INFO:echo.src.base_objective:	trainer:train_batch_size : 124
INFO:echo.src.base_objective:	trainer:weight_decay : 2.3923704488878766e-09
INFO:echo.src.base_objective:	trainer:training_loss : xsigmoid
INFO:echo.src.base_objective:Beginning trial 32
INFO:root:Loading model linknet with settings {'in_channels': 4, 'classes': 1, 'activation': 'sigmoid'}
INFO:root:Loading loss smooth
INFO:root:Loading loss smooth
INFO:echo.src.base_objective:Saving trial 25 results to local file /glade/work/kdagon/s2sml/results_wk3_608/trial_results/trial_results_1227856.desched1.csv
INFO:echo.src.base_objective:Merging trial results and saving to /glade/work/kdagon/s2sml/results_wk3_608/trial_results.csv
[32m[I 2023-06-08 16:07:18,386][0m Trial 25 finished with values: [0.024212599731981754, 0.0014233999390853569, 0.9717515692404161] and parameters: {'learning_rate': 0.00011724552630449854, 'weight_decay': 1.0260284477688551e-10, 'train_batch_size': 54, 'training_loss': 'smooth', 'model_name': 'unet++'}. [0m
INFO:echo.src.base_objective:Attempting to automatically update the model configuration using optuna's suggested parameters
INFO:echo.src.base_objective:	model:name : linknet
INFO:echo.src.base_objective:	optimizer:learning_rate : 0.0006759980644166411
INFO:echo.src.base_objective:	trainer:train_batch_size : 66
INFO:echo.src.base_objective:	trainer:weight_decay : 1.6764428354343468e-10
INFO:echo.src.base_objective:	trainer:training_loss : mse
INFO:echo.src.base_objective:Beginning trial 33
INFO:root:Loading model linknet with settings {'in_channels': 4, 'classes': 1, 'activation': 'sigmoid'}
INFO:root:Loading loss smooth
INFO:root:Loading loss smooth
INFO:echo.src.base_objective:Saving trial 16 results to local file /glade/work/kdagon/s2sml/results_wk3_608/trial_results/trial_results_1227852.desched1.csv
INFO:echo.src.base_objective:Merging trial results and saving to /glade/work/kdagon/s2sml/results_wk3_608/trial_results.csv
[32m[I 2023-06-08 16:09:18,100][0m Trial 16 finished with values: [0.04852182511240244, 0.004032031632959843, 1.0713890997384163] and parameters: {'learning_rate': 4.191242632508705e-06, 'weight_decay': 6.393308843118069e-09, 'train_batch_size': 60, 'training_loss': 'xtanh', 'model_name': 'unet++'}. [0m
INFO:echo.src.base_objective:Attempting to automatically update the model configuration using optuna's suggested parameters
INFO:echo.src.base_objective:	model:name : deeplabv3+
INFO:echo.src.base_objective:	optimizer:learning_rate : 0.004452661678706445
INFO:echo.src.base_objective:	trainer:train_batch_size : 57
INFO:echo.src.base_objective:	trainer:weight_decay : 9.445993589038748e-12
INFO:echo.src.base_objective:	trainer:training_loss : logcosh
INFO:echo.src.base_objective:Beginning trial 34
INFO:root:Loading model deeplabv3+ with settings {'in_channels': 4, 'classes': 1, 'activation': 'sigmoid'}
INFO:root:Loading loss smooth
INFO:root:Loading loss smooth
INFO:echo.src.base_objective:Saving trial 12 results to local file /glade/work/kdagon/s2sml/results_wk3_608/trial_results/trial_results_1227853.desched1.csv
INFO:echo.src.base_objective:Merging trial results and saving to /glade/work/kdagon/s2sml/results_wk3_608/trial_results.csv
[32m[I 2023-06-08 16:09:37,126][0m Trial 12 finished with values: [0.13539555668830872, 0.021456339862197638, 1.372008522377585] and parameters: {'learning_rate': 2.2451664716613093e-06, 'weight_decay': 1.6744231573097668e-12, 'train_batch_size': 94, 'training_loss': 'xsigmoid', 'model_name': 'fpn'}. [0m
INFO:echo.src.base_objective:Attempting to automatically update the model configuration using optuna's suggested parameters
INFO:echo.src.base_objective:	model:name : linknet
INFO:echo.src.base_objective:	optimizer:learning_rate : 0.00014679593020226119
INFO:echo.src.base_objective:	trainer:train_batch_size : 54
INFO:echo.src.base_objective:	trainer:weight_decay : 1.85714696336856e-08
INFO:echo.src.base_objective:	trainer:training_loss : xsigmoid
INFO:echo.src.base_objective:Beginning trial 35
INFO:root:Loading model linknet with settings {'in_channels': 4, 'classes': 1, 'activation': 'sigmoid'}
INFO:root:Loading loss smooth
INFO:root:Loading loss smooth
INFO:echo.src.base_objective:Saving trial 28 results to local file /glade/work/kdagon/s2sml/results_wk3_608/trial_results/trial_results_1227860.desched1.csv
INFO:echo.src.base_objective:Merging trial results and saving to /glade/work/kdagon/s2sml/results_wk3_608/trial_results.csv
[32m[I 2023-06-08 16:10:49,887][0m Trial 28 finished with values: [0.023343230597674847, 0.0014022410614416003, 0.9692339383240312] and parameters: {'learning_rate': 9.780358635036775e-05, 'weight_decay': 3.1747801340071636e-07, 'train_batch_size': 31, 'training_loss': 'xsigmoid', 'model_name': 'unet++'}. [0m
INFO:echo.src.base_objective:Attempting to automatically update the model configuration using optuna's suggested parameters
INFO:echo.src.base_objective:	model:name : unet++
INFO:echo.src.base_objective:	optimizer:learning_rate : 5.496542536574128e-05
INFO:echo.src.base_objective:	trainer:train_batch_size : 64
INFO:echo.src.base_objective:	trainer:weight_decay : 1.2811353890127783e-09
INFO:echo.src.base_objective:	trainer:training_loss : xsigmoid
INFO:echo.src.base_objective:Beginning trial 36
INFO:root:Loading model unet++ with settings {'in_channels': 4, 'classes': 1, 'activation': 'sigmoid'}
INFO:root:Loading loss smooth
INFO:root:Loading loss smooth
INFO:echo.src.base_objective:Saving trial 26 results to local file /glade/work/kdagon/s2sml/results_wk3_608/trial_results/trial_results_1227851.desched1.csv
INFO:echo.src.base_objective:Merging trial results and saving to /glade/work/kdagon/s2sml/results_wk3_608/trial_results.csv
[32m[I 2023-06-08 16:12:59,717][0m Trial 26 finished with values: [0.03866701293736696, 0.0032917640637606382, 1.0629412801882407] and parameters: {'learning_rate': 7.073297412625923e-05, 'weight_decay': 1.5154321791397225e-12, 'train_batch_size': 102, 'training_loss': 'xsigmoid', 'model_name': 'pspnet'}. [0m
INFO:echo.src.base_objective:Attempting to automatically update the model configuration using optuna's suggested parameters
INFO:echo.src.base_objective:	model:name : deeplabv3+
INFO:echo.src.base_objective:	optimizer:learning_rate : 1.965874850554978e-05
INFO:echo.src.base_objective:	trainer:train_batch_size : 12
INFO:echo.src.base_objective:	trainer:weight_decay : 3.573175658419965e-07
INFO:echo.src.base_objective:	trainer:training_loss : xsigmoid
INFO:echo.src.base_objective:Beginning trial 37
INFO:root:Loading model deeplabv3+ with settings {'in_channels': 4, 'classes': 1, 'activation': 'sigmoid'}
INFO:root:Loading loss smooth
INFO:root:Loading loss smooth
INFO:echo.src.base_objective:Saving trial 30 results to local file /glade/work/kdagon/s2sml/results_wk3_608/trial_results/trial_results_1227857.desched1.csv
INFO:echo.src.base_objective:Merging trial results and saving to /glade/work/kdagon/s2sml/results_wk3_608/trial_results.csv
[32m[I 2023-06-08 16:16:03,527][0m Trial 30 finished with values: [0.0248544760979712, 0.0012033296370645985, 0.9723752185478686] and parameters: {'learning_rate': 5.439342099414414e-05, 'weight_decay': 5.69094690199488e-06, 'train_batch_size': 42, 'training_loss': 'logcosh', 'model_name': 'unet++'}. [0m
INFO:echo.src.base_objective:Attempting to automatically update the model configuration using optuna's suggested parameters
INFO:echo.src.base_objective:	model:name : unet++
INFO:echo.src.base_objective:	optimizer:learning_rate : 0.0002968710814333284
INFO:echo.src.base_objective:	trainer:train_batch_size : 66
INFO:echo.src.base_objective:	trainer:weight_decay : 6.577947914168997e-11
INFO:echo.src.base_objective:	trainer:training_loss : logcosh
INFO:echo.src.base_objective:Beginning trial 38
INFO:root:Loading model unet++ with settings {'in_channels': 4, 'classes': 1, 'activation': 'sigmoid'}
INFO:root:Loading loss smooth
INFO:root:Loading loss smooth
INFO:echo.src.base_objective:Saving trial 19 results to local file /glade/work/kdagon/s2sml/results_wk3_608/trial_results/trial_results_1227855.desched1.csv
INFO:echo.src.base_objective:Merging trial results and saving to /glade/work/kdagon/s2sml/results_wk3_608/trial_results.csv
[32m[I 2023-06-08 16:16:15,279][0m Trial 19 finished with values: [0.06573169305920601, 0.0067744244588539, 1.1418961776670387] and parameters: {'learning_rate': 1.872993387095021e-06, 'weight_decay': 5.009036091165445e-05, 'train_batch_size': 14, 'training_loss': 'mse', 'model_name': 'deeplabv3+'}. [0m
INFO:echo.src.base_objective:Attempting to automatically update the model configuration using optuna's suggested parameters
INFO:echo.src.base_objective:	model:name : unet++
INFO:echo.src.base_objective:	optimizer:learning_rate : 1.6871883702273755e-06
INFO:echo.src.base_objective:	trainer:train_batch_size : 14
INFO:echo.src.base_objective:	trainer:weight_decay : 0.0006010358204149668
INFO:echo.src.base_objective:	trainer:training_loss : xtanh
INFO:echo.src.base_objective:Beginning trial 39
INFO:root:Loading model unet++ with settings {'in_channels': 4, 'classes': 1, 'activation': 'sigmoid'}
INFO:root:Loading loss smooth
INFO:root:Loading loss smooth
INFO:echo.src.base_objective:Saving trial 34 results to local file /glade/work/kdagon/s2sml/results_wk3_608/trial_results/trial_results_1227852.desched1.csv
INFO:echo.src.base_objective:Merging trial results and saving to /glade/work/kdagon/s2sml/results_wk3_608/trial_results.csv
[32m[I 2023-06-08 16:17:01,899][0m Trial 34 finished with values: [0.029253742657601833, 0.0023776059388183057, 1.0138083936393278] and parameters: {'learning_rate': 0.004452661678706445, 'weight_decay': 9.445993589038748e-12, 'train_batch_size': 57, 'training_loss': 'logcosh', 'model_name': 'deeplabv3+'}. [0m
INFO:echo.src.base_objective:Attempting to automatically update the model configuration using optuna's suggested parameters
INFO:echo.src.base_objective:	model:name : fpn
INFO:echo.src.base_objective:	optimizer:learning_rate : 1.2732001042914773e-06
INFO:echo.src.base_objective:	trainer:train_batch_size : 79
INFO:echo.src.base_objective:	trainer:weight_decay : 0.00012701114832319233
INFO:echo.src.base_objective:	trainer:training_loss : huber
INFO:echo.src.base_objective:Beginning trial 40
INFO:root:Loading model fpn with settings {'in_channels': 4, 'classes': 1, 'activation': 'sigmoid'}
INFO:root:Loading loss smooth
INFO:root:Loading loss smooth
INFO:echo.src.base_objective:Saving trial 31 results to local file /glade/work/kdagon/s2sml/results_wk3_608/trial_results/trial_results_1227858.desched1.csv
INFO:echo.src.base_objective:Merging trial results and saving to /glade/work/kdagon/s2sml/results_wk3_608/trial_results.csv
[32m[I 2023-06-08 16:17:28,758][0m Trial 31 finished with values: [0.024433903396129608, 0.001354586536763236, 0.9689072316414435] and parameters: {'learning_rate': 0.0001856596420017245, 'weight_decay': 7.806184609232721e-06, 'train_batch_size': 81, 'training_loss': 'smooth', 'model_name': 'unet'}. [0m
INFO:echo.src.base_objective:Attempting to automatically update the model configuration using optuna's suggested parameters
INFO:echo.src.base_objective:	model:name : deeplabv3+
INFO:echo.src.base_objective:	optimizer:learning_rate : 9.372019748446655e-06
INFO:echo.src.base_objective:	trainer:train_batch_size : 108
INFO:echo.src.base_objective:	trainer:weight_decay : 1.5857839992045634e-09
INFO:echo.src.base_objective:	trainer:training_loss : smooth
INFO:echo.src.base_objective:Beginning trial 41
INFO:root:Loading model deeplabv3+ with settings {'in_channels': 4, 'classes': 1, 'activation': 'sigmoid'}
INFO:root:Loading loss smooth
INFO:root:Loading loss smooth
INFO:echo.src.base_objective:Saving trial 40 results to local file /glade/work/kdagon/s2sml/results_wk3_608/trial_results/trial_results_1227852.desched1.csv
INFO:echo.src.base_objective:Merging trial results and saving to /glade/work/kdagon/s2sml/results_wk3_608/trial_results.csv
[32m[I 2023-06-08 16:20:00,508][0m Trial 40 finished with values: [0.4265018403530121, 0.2079109102487564, 6.104322461391692] and parameters: {'learning_rate': 1.2732001042914773e-06, 'weight_decay': 0.00012701114832319233, 'train_batch_size': 79, 'training_loss': 'huber', 'model_name': 'fpn'}. [0m
INFO:echo.src.base_objective:Attempting to automatically update the model configuration using optuna's suggested parameters
INFO:echo.src.base_objective:	model:name : deeplabv3+
INFO:echo.src.base_objective:	optimizer:learning_rate : 9.65813332751984e-06
INFO:echo.src.base_objective:	trainer:train_batch_size : 79
INFO:echo.src.base_objective:	trainer:weight_decay : 4.811500123861099e-05
INFO:echo.src.base_objective:	trainer:training_loss : mse
INFO:echo.src.base_objective:Beginning trial 42
INFO:root:Loading model deeplabv3+ with settings {'in_channels': 4, 'classes': 1, 'activation': 'sigmoid'}
INFO:root:Loading loss smooth
INFO:root:Loading loss smooth
INFO:echo.src.base_objective:Saving trial 29 results to local file /glade/work/kdagon/s2sml/results_wk3_608/trial_results/trial_results_1227854.desched1.csv
INFO:echo.src.base_objective:Merging trial results and saving to /glade/work/kdagon/s2sml/results_wk3_608/trial_results.csv
[32m[I 2023-06-08 16:20:41,693][0m Trial 29 finished with values: [0.04507127683609724, 0.0036487163743004203, 1.1127621782488757] and parameters: {'learning_rate': 1.0396410542378559e-05, 'weight_decay': 0.00010442169817214107, 'train_batch_size': 89, 'training_loss': 'xtanh', 'model_name': 'deeplabv3'}. [0m
INFO:echo.src.base_objective:Attempting to automatically update the model configuration using optuna's suggested parameters
INFO:echo.src.base_objective:	model:name : deeplabv3
INFO:echo.src.base_objective:	optimizer:learning_rate : 1.014327211328555e-06
INFO:echo.src.base_objective:	trainer:train_batch_size : 111
INFO:echo.src.base_objective:	trainer:weight_decay : 1.2562024349073055e-10
INFO:echo.src.base_objective:	trainer:training_loss : xsigmoid
INFO:echo.src.base_objective:Beginning trial 43
INFO:root:Loading model deeplabv3 with settings {'in_channels': 4, 'classes': 1, 'activation': 'sigmoid'}
INFO:root:Loading loss smooth
INFO:root:Loading loss smooth
INFO:echo.src.base_objective:Saving trial 41 results to local file /glade/work/kdagon/s2sml/results_wk3_608/trial_results/trial_results_1227858.desched1.csv
INFO:echo.src.base_objective:Merging trial results and saving to /glade/work/kdagon/s2sml/results_wk3_608/trial_results.csv
[32m[I 2023-06-08 16:21:42,380][0m Trial 41 finished with values: [0.10091877728700638, 0.019445120822638273, 4.439393414970147] and parameters: {'learning_rate': 9.372019748446655e-06, 'weight_decay': 1.5857839992045634e-09, 'train_batch_size': 108, 'training_loss': 'smooth', 'model_name': 'deeplabv3+'}. [0m
INFO:echo.src.base_objective:Attempting to automatically update the model configuration using optuna's suggested parameters
INFO:echo.src.base_objective:	model:name : unet++
INFO:echo.src.base_objective:	optimizer:learning_rate : 1.5563344734902252e-05
INFO:echo.src.base_objective:	trainer:train_batch_size : 11
INFO:echo.src.base_objective:	trainer:weight_decay : 1.6874157440634433e-06
INFO:echo.src.base_objective:	trainer:training_loss : huber
INFO:echo.src.base_objective:Beginning trial 44
INFO:root:Loading model unet++ with settings {'in_channels': 4, 'classes': 1, 'activation': 'sigmoid'}
INFO:root:Loading loss smooth
INFO:root:Loading loss smooth
INFO:echo.src.base_objective:Saving trial 43 results to local file /glade/work/kdagon/s2sml/results_wk3_608/trial_results/trial_results_1227854.desched1.csv
INFO:echo.src.base_objective:Merging trial results and saving to /glade/work/kdagon/s2sml/results_wk3_608/trial_results.csv
