[32m[I 2023-06-08 18:36:16,742][0m Trial 166 finished with values: [0.020733850076794624, 0.0009755695500643924, 0.9588977718241936] and parameters: {'learning_rate': 0.001739722137103085, 'weight_decay': 3.2041189705581095e-10, 'train_batch_size': 12, 'training_loss': 'huber', 'model_name': 'linknet'}. [0m
INFO:echo.src.base_objective:Attempting to automatically update the model configuration using optuna's suggested parameters
INFO:echo.src.base_objective:	model:name : manet
INFO:echo.src.base_objective:	optimizer:learning_rate : 2.4975015176275117e-05
INFO:echo.src.base_objective:	trainer:train_batch_size : 22
INFO:echo.src.base_objective:	trainer:weight_decay : 9.776508199653368e-09
INFO:echo.src.base_objective:	trainer:training_loss : huber
INFO:echo.src.base_objective:Beginning trial 181
INFO:echo.src.base_objective:Saving trial 171 results to local file /glade/work/kdagon/s2sml/results_wk3_608/trial_results/trial_results_1227851.desched1.csv
INFO:echo.src.base_objective:Merging trial results and saving to /glade/work/kdagon/s2sml/results_wk3_608/trial_results.csv
[32m[I 2023-06-08 18:36:22,348][0m Trial 171 finished with values: [0.03237879788503051, 0.0018786123837344348, 1.0078307438962428] and parameters: {'learning_rate': 2.5102043073029004e-05, 'weight_decay': 5.963021673366312e-09, 'train_batch_size': 12, 'training_loss': 'huber', 'model_name': 'manet'}. [0m
INFO:echo.src.base_objective:Attempting to automatically update the model configuration using optuna's suggested parameters
INFO:echo.src.base_objective:	model:name : manet
INFO:echo.src.base_objective:	optimizer:learning_rate : 7.827919352367487e-05
INFO:echo.src.base_objective:	trainer:train_batch_size : 21
INFO:echo.src.base_objective:	trainer:weight_decay : 1.9656247843526834e-09
INFO:echo.src.base_objective:	trainer:training_loss : huber
INFO:echo.src.base_objective:Beginning trial 182
INFO:root:Loading model manet with settings {'in_channels': 4, 'classes': 1, 'activation': 'sigmoid'}
INFO:root:Loading loss smooth
INFO:root:Loading loss smooth
INFO:root:Loading model manet with settings {'in_channels': 4, 'classes': 1, 'activation': 'sigmoid'}
INFO:echo.src.base_objective:Saving trial 172 results to local file /glade/work/kdagon/s2sml/results_wk3_608/trial_results/trial_results_1227858.desched1.csv
INFO:echo.src.base_objective:Merging trial results and saving to /glade/work/kdagon/s2sml/results_wk3_608/trial_results.csv
INFO:root:Loading loss smooth
INFO:root:Loading loss smooth
[32m[I 2023-06-08 18:36:29,544][0m Trial 172 finished with values: [0.02100480441004038, 0.001011285639833659, 0.9625785920626095] and parameters: {'learning_rate': 0.006314952659401755, 'weight_decay': 5.21084786299919e-09, 'train_batch_size': 12, 'training_loss': 'huber', 'model_name': 'manet'}. [0m
INFO:echo.src.base_objective:Attempting to automatically update the model configuration using optuna's suggested parameters
INFO:echo.src.base_objective:	model:name : manet
INFO:echo.src.base_objective:	optimizer:learning_rate : 0.0001601988815913148
INFO:echo.src.base_objective:	trainer:train_batch_size : 20
INFO:echo.src.base_objective:	trainer:weight_decay : 8.110385926136841e-09
INFO:echo.src.base_objective:	trainer:training_loss : huber
INFO:echo.src.base_objective:Beginning trial 183
INFO:root:Loading model manet with settings {'in_channels': 4, 'classes': 1, 'activation': 'sigmoid'}
INFO:root:Loading loss smooth
INFO:root:Loading loss smooth
INFO:echo.src.base_objective:Saving trial 169 results to local file /glade/work/kdagon/s2sml/results_wk3_608/trial_results/trial_results_1227854.desched1.csv
INFO:echo.src.base_objective:Merging trial results and saving to /glade/work/kdagon/s2sml/results_wk3_608/trial_results.csv
[32m[I 2023-06-08 18:36:57,737][0m Trial 169 finished with values: [0.023048718459904194, 0.0011139473062939942, 0.9665664800605933] and parameters: {'learning_rate': 7.721093064425701e-05, 'weight_decay': 6.170330845931941e-09, 'train_batch_size': 12, 'training_loss': 'huber', 'model_name': 'manet'}. [0m
INFO:echo.src.base_objective:Attempting to automatically update the model configuration using optuna's suggested parameters
INFO:echo.src.base_objective:	model:name : manet
INFO:echo.src.base_objective:	optimizer:learning_rate : 4.506468709101715e-06
INFO:echo.src.base_objective:	trainer:train_batch_size : 10
INFO:echo.src.base_objective:	trainer:weight_decay : 9.63995595167876e-09
INFO:echo.src.base_objective:	trainer:training_loss : huber
INFO:echo.src.base_objective:Beginning trial 184
INFO:root:Loading model manet with settings {'in_channels': 4, 'classes': 1, 'activation': 'sigmoid'}
INFO:root:Loading loss smooth
INFO:root:Loading loss smooth
INFO:echo.src.base_objective:Saving trial 176 results to local file /glade/work/kdagon/s2sml/results_wk3_608/trial_results/trial_results_1227859.desched1.csv
INFO:echo.src.base_objective:Merging trial results and saving to /glade/work/kdagon/s2sml/results_wk3_608/trial_results.csv
[32m[I 2023-06-08 18:39:35,945][0m Trial 176 finished with values: [0.02156299026682973, 0.0014741642371518537, 0.9621534586530426] and parameters: {'learning_rate': 0.0007435378877007024, 'weight_decay': 5.650851911900378e-09, 'train_batch_size': 21, 'training_loss': 'huber', 'model_name': 'manet'}. [0m
INFO:echo.src.base_objective:Attempting to automatically update the model configuration using optuna's suggested parameters
INFO:echo.src.base_objective:	model:name : manet
INFO:echo.src.base_objective:	optimizer:learning_rate : 7.428919359540683e-05
INFO:echo.src.base_objective:	trainer:train_batch_size : 10
INFO:echo.src.base_objective:	trainer:weight_decay : 1.987944640495022e-09
INFO:echo.src.base_objective:	trainer:training_loss : huber
INFO:echo.src.base_objective:Beginning trial 185
INFO:root:Loading model manet with settings {'in_channels': 4, 'classes': 1, 'activation': 'sigmoid'}
INFO:root:Loading loss smooth
INFO:root:Loading loss smooth
INFO:echo.src.base_objective:Saving trial 178 results to local file /glade/work/kdagon/s2sml/results_wk3_608/trial_results/trial_results_1227856.desched1.csv
INFO:echo.src.base_objective:Merging trial results and saving to /glade/work/kdagon/s2sml/results_wk3_608/trial_results.csv
[32m[I 2023-06-08 18:39:50,785][0m Trial 178 finished with values: [0.021127292420715094, 0.0009734270424814895, 0.9596559413179065] and parameters: {'learning_rate': 0.0006305662888895862, 'weight_decay': 4.8257470482084725e-09, 'train_batch_size': 10, 'training_loss': 'huber', 'model_name': 'manet'}. [0m
INFO:echo.src.base_objective:Attempting to automatically update the model configuration using optuna's suggested parameters
INFO:echo.src.base_objective:	model:name : manet
INFO:echo.src.base_objective:	optimizer:learning_rate : 4.3710024322192965e-06
INFO:echo.src.base_objective:	trainer:train_batch_size : 7
INFO:echo.src.base_objective:	trainer:weight_decay : 2.102714374537546e-09
INFO:echo.src.base_objective:	trainer:training_loss : huber
INFO:echo.src.base_objective:Beginning trial 186
INFO:root:Loading model manet with settings {'in_channels': 4, 'classes': 1, 'activation': 'sigmoid'}
INFO:root:Loading loss smooth
INFO:root:Loading loss smooth
INFO:echo.src.base_objective:Saving trial 177 results to local file /glade/work/kdagon/s2sml/results_wk3_608/trial_results/trial_results_1227855.desched1.csv
INFO:echo.src.base_objective:Merging trial results and saving to /glade/work/kdagon/s2sml/results_wk3_608/trial_results.csv
[32m[I 2023-06-08 18:40:38,329][0m Trial 177 finished with values: [0.024855226278305054, 0.001320230367127806, 0.9719200145188691] and parameters: {'learning_rate': 7.206066560301607e-05, 'weight_decay': 5.155230423746788e-09, 'train_batch_size': 22, 'training_loss': 'huber', 'model_name': 'manet'}. [0m
INFO:echo.src.base_objective:Attempting to automatically update the model configuration using optuna's suggested parameters
INFO:echo.src.base_objective:	model:name : manet
INFO:echo.src.base_objective:	optimizer:learning_rate : 4.931171445277083e-06
INFO:echo.src.base_objective:	trainer:train_batch_size : 7
INFO:echo.src.base_objective:	trainer:weight_decay : 1.844778821029028e-09
INFO:echo.src.base_objective:	trainer:training_loss : huber
INFO:echo.src.base_objective:Beginning trial 187
INFO:root:Loading model manet with settings {'in_channels': 4, 'classes': 1, 'activation': 'sigmoid'}
INFO:root:Loading loss smooth
INFO:root:Loading loss smooth
INFO:echo.src.base_objective:Saving trial 180 results to local file /glade/work/kdagon/s2sml/results_wk3_608/trial_results/trial_results_1227860.desched1.csv
INFO:echo.src.base_objective:Merging trial results and saving to /glade/work/kdagon/s2sml/results_wk3_608/trial_results.csv
[32m[I 2023-06-08 18:43:53,522][0m Trial 180 finished with values: [0.02062031254172325, 0.0009602443751646206, 0.958561620025029] and parameters: {'learning_rate': 0.007249464480215844, 'weight_decay': 1.988773982777754e-09, 'train_batch_size': 10, 'training_loss': 'huber', 'model_name': 'manet'}. [0m
INFO:echo.src.base_objective:Attempting to automatically update the model configuration using optuna's suggested parameters
INFO:echo.src.base_objective:	model:name : manet
INFO:echo.src.base_objective:	optimizer:learning_rate : 3.9568951105745503e-05
INFO:echo.src.base_objective:	trainer:train_batch_size : 7
INFO:echo.src.base_objective:	trainer:weight_decay : 9.380786688430808e-09
INFO:echo.src.base_objective:	trainer:training_loss : huber
INFO:echo.src.base_objective:Beginning trial 188
INFO:root:Loading model manet with settings {'in_channels': 4, 'classes': 1, 'activation': 'sigmoid'}
INFO:root:Loading loss smooth
INFO:root:Loading loss smooth
INFO:echo.src.base_objective:Saving trial 183 results to local file /glade/work/kdagon/s2sml/results_wk3_608/trial_results/trial_results_1227858.desched1.csv
INFO:echo.src.base_objective:Merging trial results and saving to /glade/work/kdagon/s2sml/results_wk3_608/trial_results.csv
[32m[I 2023-06-08 18:45:26,987][0m Trial 183 finished with values: [0.02330388454720378, 0.0011529307521414012, 0.9671563851792762] and parameters: {'learning_rate': 0.0001601988815913148, 'weight_decay': 8.110385926136841e-09, 'train_batch_size': 20, 'training_loss': 'huber', 'model_name': 'manet'}. [0m
INFO:echo.src.base_objective:Attempting to automatically update the model configuration using optuna's suggested parameters
INFO:echo.src.base_objective:	model:name : manet
INFO:echo.src.base_objective:	optimizer:learning_rate : 2.3401947571492634e-05
INFO:echo.src.base_objective:	trainer:train_batch_size : 6
INFO:echo.src.base_objective:	trainer:weight_decay : 9.8798120745012e-09
INFO:echo.src.base_objective:	trainer:training_loss : huber
INFO:echo.src.base_objective:Beginning trial 189
INFO:echo.src.base_objective:Saving trial 181 results to local file /glade/work/kdagon/s2sml/results_wk3_608/trial_results/trial_results_1227852.desched1.csv
INFO:echo.src.base_objective:Merging trial results and saving to /glade/work/kdagon/s2sml/results_wk3_608/trial_results.csv
[32m[I 2023-06-08 18:45:33,103][0m Trial 181 finished with values: [0.03135782200843096, 0.0017433477914892137, 1.0048591766094712] and parameters: {'learning_rate': 2.4975015176275117e-05, 'weight_decay': 9.776508199653368e-09, 'train_batch_size': 22, 'training_loss': 'huber', 'model_name': 'manet'}. [0m
INFO:echo.src.base_objective:Attempting to automatically update the model configuration using optuna's suggested parameters
INFO:echo.src.base_objective:	model:name : manet
INFO:echo.src.base_objective:	optimizer:learning_rate : 0.00713808051606471
INFO:echo.src.base_objective:	trainer:train_batch_size : 7
INFO:echo.src.base_objective:	trainer:weight_decay : 2.0660776777013924e-09
INFO:echo.src.base_objective:	trainer:training_loss : huber
INFO:echo.src.base_objective:Beginning trial 190
INFO:root:Loading model manet with settings {'in_channels': 4, 'classes': 1, 'activation': 'sigmoid'}
INFO:root:Loading loss smooth
INFO:root:Loading loss smooth
INFO:root:Loading model manet with settings {'in_channels': 4, 'classes': 1, 'activation': 'sigmoid'}
INFO:root:Loading loss smooth
INFO:root:Loading loss smooth
INFO:echo.src.base_objective:Saving trial 182 results to local file /glade/work/kdagon/s2sml/results_wk3_608/trial_results/trial_results_1227851.desched1.csv
INFO:echo.src.base_objective:Merging trial results and saving to /glade/work/kdagon/s2sml/results_wk3_608/trial_results.csv
[32m[I 2023-06-08 18:46:15,913][0m Trial 182 finished with values: [0.024048791266977787, 0.0012301305250730366, 0.9691370147897634] and parameters: {'learning_rate': 7.827919352367487e-05, 'weight_decay': 1.9656247843526834e-09, 'train_batch_size': 21, 'training_loss': 'huber', 'model_name': 'manet'}. [0m
INFO:echo.src.base_objective:Attempting to automatically update the model configuration using optuna's suggested parameters
INFO:echo.src.base_objective:	model:name : manet
INFO:echo.src.base_objective:	optimizer:learning_rate : 0.0002206399529142222
INFO:echo.src.base_objective:	trainer:train_batch_size : 6
INFO:echo.src.base_objective:	trainer:weight_decay : 1.901071710563898e-09
INFO:echo.src.base_objective:	trainer:training_loss : huber
INFO:echo.src.base_objective:Beginning trial 191
INFO:echo.src.base_objective:Saving trial 174 results to local file /glade/work/kdagon/s2sml/results_wk3_608/trial_results/trial_results_1227853.desched1.csv
INFO:echo.src.base_objective:Merging trial results and saving to /glade/work/kdagon/s2sml/results_wk3_608/trial_results.csv
[32m[I 2023-06-08 18:46:18,763][0m Trial 174 finished with values: [0.021113696973770857, 0.0008917990198824555, 0.9615590270324631] and parameters: {'learning_rate': 0.00018664533913235527, 'weight_decay': 4.2226043095132806e-09, 'train_batch_size': 10, 'training_loss': 'huber', 'model_name': 'manet'}. [0m
INFO:echo.src.base_objective:Attempting to automatically update the model configuration using optuna's suggested parameters
INFO:echo.src.base_objective:	model:name : manet
INFO:echo.src.base_objective:	optimizer:learning_rate : 0.00021437885879351293
INFO:echo.src.base_objective:	trainer:train_batch_size : 7
INFO:echo.src.base_objective:	trainer:weight_decay : 3.4949117977547225e-09
INFO:echo.src.base_objective:	trainer:training_loss : huber
INFO:echo.src.base_objective:Beginning trial 192
INFO:root:Loading model manet with settings {'in_channels': 4, 'classes': 1, 'activation': 'sigmoid'}
INFO:root:Loading loss smooth
INFO:root:Loading loss smooth
INFO:root:Loading model manet with settings {'in_channels': 4, 'classes': 1, 'activation': 'sigmoid'}
INFO:root:Loading loss smooth
INFO:root:Loading loss smooth
INFO:echo.src.base_objective:Saving trial 179 results to local file /glade/work/kdagon/s2sml/results_wk3_608/trial_results/trial_results_1227857.desched1.csv
INFO:echo.src.base_objective:Merging trial results and saving to /glade/work/kdagon/s2sml/results_wk3_608/trial_results.csv
[32m[I 2023-06-08 18:46:57,724][0m Trial 179 finished with values: [0.024865681771188974, 0.0012334703642409295, 0.9697181226057472] and parameters: {'learning_rate': 8.451764778304036e-05, 'weight_decay': 1.9808122919128754e-09, 'train_batch_size': 22, 'training_loss': 'huber', 'model_name': 'manet'}. [0m
INFO:echo.src.base_objective:Attempting to automatically update the model configuration using optuna's suggested parameters
INFO:echo.src.base_objective:	model:name : manet
INFO:echo.src.base_objective:	optimizer:learning_rate : 0.0074353800985531475
INFO:echo.src.base_objective:	trainer:train_batch_size : 6
INFO:echo.src.base_objective:	trainer:weight_decay : 3.170119873766951e-09
INFO:echo.src.base_objective:	trainer:training_loss : huber
INFO:echo.src.base_objective:Beginning trial 193
INFO:root:Loading model manet with settings {'in_channels': 4, 'classes': 1, 'activation': 'sigmoid'}
INFO:root:Loading loss smooth
INFO:root:Loading loss smooth
INFO:echo.src.base_objective:Saving trial 190 results to local file /glade/work/kdagon/s2sml/results_wk3_608/trial_results/trial_results_1227852.desched1.csv
INFO:echo.src.base_objective:Merging trial results and saving to /glade/work/kdagon/s2sml/results_wk3_608/trial_results.csv
[32m[I 2023-06-08 18:51:31,920][0m Trial 190 finished with values: [0.020916651468724012, 0.0009980594331864268, 0.9611363430616258] and parameters: {'learning_rate': 0.00713808051606471, 'weight_decay': 2.0660776777013924e-09, 'train_batch_size': 7, 'training_loss': 'huber', 'model_name': 'manet'}. [0m
INFO:echo.src.base_objective:Attempting to automatically update the model configuration using optuna's suggested parameters
INFO:echo.src.base_objective:	model:name : manet
INFO:echo.src.base_objective:	optimizer:learning_rate : 0.0035855749270671256
INFO:echo.src.base_objective:	trainer:train_batch_size : 6
INFO:echo.src.base_objective:	trainer:weight_decay : 3.6741709309360592e-09
INFO:echo.src.base_objective:	trainer:training_loss : huber
INFO:echo.src.base_objective:Beginning trial 194
INFO:root:Loading model manet with settings {'in_channels': 4, 'classes': 1, 'activation': 'sigmoid'}
INFO:root:Loading loss smooth
INFO:root:Loading loss smooth
INFO:echo.src.base_objective:Saving trial 192 results to local file /glade/work/kdagon/s2sml/results_wk3_608/trial_results/trial_results_1227853.desched1.csv
INFO:echo.src.base_objective:Merging trial results and saving to /glade/work/kdagon/s2sml/results_wk3_608/trial_results.csv
[32m[I 2023-06-08 18:52:53,477][0m Trial 192 finished with values: [0.02268589846789837, 0.0011940316180698574, 0.9652288612855932] and parameters: {'learning_rate': 0.00021437885879351293, 'weight_decay': 3.4949117977547225e-09, 'train_batch_size': 7, 'training_loss': 'huber', 'model_name': 'manet'}. [0m
INFO:echo.src.base_objective:Attempting to automatically update the model configuration using optuna's suggested parameters
INFO:echo.src.base_objective:	model:name : manet
INFO:echo.src.base_objective:	optimizer:learning_rate : 4.8807365090109385e-06
INFO:echo.src.base_objective:	trainer:train_batch_size : 6
INFO:echo.src.base_objective:	trainer:weight_decay : 1.1907838687018541e-08
INFO:echo.src.base_objective:	trainer:training_loss : huber
INFO:echo.src.base_objective:Beginning trial 195
INFO:root:Loading model manet with settings {'in_channels': 4, 'classes': 1, 'activation': 'sigmoid'}
INFO:root:Loading loss smooth
INFO:root:Loading loss smooth
INFO:echo.src.base_objective:Saving trial 193 results to local file /glade/work/kdagon/s2sml/results_wk3_608/trial_results/trial_results_1227857.desched1.csv
INFO:echo.src.base_objective:Merging trial results and saving to /glade/work/kdagon/s2sml/results_wk3_608/trial_results.csv
[32m[I 2023-06-08 18:53:08,123][0m Trial 193 finished with values: [0.020827841944992542, 0.0009727755968924612, 0.9606922838976347] and parameters: {'learning_rate': 0.0074353800985531475, 'weight_decay': 3.170119873766951e-09, 'train_batch_size': 6, 'training_loss': 'huber', 'model_name': 'manet'}. [0m
INFO:echo.src.base_objective:Attempting to automatically update the model configuration using optuna's suggested parameters
INFO:echo.src.base_objective:	model:name : manet
INFO:echo.src.base_objective:	optimizer:learning_rate : 4.6689446312620696e-06
INFO:echo.src.base_objective:	trainer:train_batch_size : 10
INFO:echo.src.base_objective:	trainer:weight_decay : 3.2608561461261066e-05
INFO:echo.src.base_objective:	trainer:training_loss : huber
INFO:echo.src.base_objective:Beginning trial 196
INFO:root:Loading model manet with settings {'in_channels': 4, 'classes': 1, 'activation': 'sigmoid'}
INFO:root:Loading loss smooth
INFO:root:Loading loss smooth
INFO:echo.src.base_objective:Saving trial 191 results to local file /glade/work/kdagon/s2sml/results_wk3_608/trial_results/trial_results_1227851.desched1.csv
INFO:echo.src.base_objective:Merging trial results and saving to /glade/work/kdagon/s2sml/results_wk3_608/trial_results.csv
[32m[I 2023-06-08 18:55:35,707][0m Trial 191 finished with values: [0.02175674634054303, 0.001063052608515136, 0.9642763788889078] and parameters: {'learning_rate': 0.0002206399529142222, 'weight_decay': 1.901071710563898e-09, 'train_batch_size': 6, 'training_loss': 'huber', 'model_name': 'manet'}. [0m
INFO:echo.src.base_objective:Attempting to automatically update the model configuration using optuna's suggested parameters
INFO:echo.src.base_objective:	model:name : manet
INFO:echo.src.base_objective:	optimizer:learning_rate : 0.008482579130214867
INFO:echo.src.base_objective:	trainer:train_batch_size : 10
INFO:echo.src.base_objective:	trainer:weight_decay : 2.5972533342233704e-05
INFO:echo.src.base_objective:	trainer:training_loss : huber
INFO:echo.src.base_objective:Beginning trial 197
INFO:root:Loading model manet with settings {'in_channels': 4, 'classes': 1, 'activation': 'sigmoid'}
INFO:root:Loading loss smooth
INFO:root:Loading loss smooth
INFO:echo.src.base_objective:Saving trial 185 results to local file /glade/work/kdagon/s2sml/results_wk3_608/trial_results/trial_results_1227859.desched1.csv
INFO:echo.src.base_objective:Merging trial results and saving to /glade/work/kdagon/s2sml/results_wk3_608/trial_results.csv
