[32m[I 2023-06-08 15:31:35,433][0m Trial 0 finished with values: [0.16369257494807243, 0.042111482471227646, 32.70653512868307] and parameters: {'learning_rate': 1.7703647655433445e-06, 'weight_decay': 5.33496290184721e-11, 'train_batch_size': 53, 'training_loss': 'xsigmoid', 'model_name': 'linknet'}. [0m
INFO:echo.src.base_objective:Attempting to automatically update the model configuration using optuna's suggested parameters
INFO:echo.src.base_objective:	model:name : pspnet
INFO:echo.src.base_objective:	optimizer:learning_rate : 0.00046244051067864396
INFO:echo.src.base_objective:	trainer:train_batch_size : 32
INFO:echo.src.base_objective:	trainer:weight_decay : 3.1344276805647586e-10
INFO:echo.src.base_objective:	trainer:training_loss : smooth
INFO:echo.src.base_objective:Beginning trial 1
INFO:root:Loading model pspnet with settings {'in_channels': 4, 'classes': 1, 'activation': 'sigmoid'}
INFO:root:Loading loss smooth
INFO:root:Loading loss smooth
INFO:root:Saving trial details to /glade/work/kdagon/s2sml/results_wk3_608/
INFO:root:Running on PBS/SLURM batch id: 1227858.desched1
INFO:root:Importing custom objective from /glade/work/kdagon/s2sml/applications/train_multi.py
INFO:root:Saving trial details to /glade/work/kdagon/s2sml/results_wk3_608/
INFO:root:Saving trial details to /glade/work/kdagon/s2sml/results_wk3_608/
INFO:root:Running on PBS/SLURM batch id: 1227859.desched1
INFO:root:Running on PBS/SLURM batch id: 1227856.desched1
INFO:root:Importing custom objective from /glade/work/kdagon/s2sml/applications/train_multi.py
INFO:root:Importing custom objective from /glade/work/kdagon/s2sml/applications/train_multi.py
INFO:root:Saving trial details to /glade/work/kdagon/s2sml/results_wk3_608/
INFO:root:Running on PBS/SLURM batch id: 1227855.desched1
INFO:root:Importing custom objective from /glade/work/kdagon/s2sml/applications/train_multi.py
INFO:root:Saving trial details to /glade/work/kdagon/s2sml/results_wk3_608/
INFO:root:Running on PBS/SLURM batch id: 1227857.desched1
INFO:root:Importing custom objective from /glade/work/kdagon/s2sml/applications/train_multi.py
INFO:root:Saving trial details to /glade/work/kdagon/s2sml/results_wk3_608/
INFO:root:Running on PBS/SLURM batch id: 1227852.desched1
INFO:root:Importing custom objective from /glade/work/kdagon/s2sml/applications/train_multi.py
INFO:root:Saving trial details to /glade/work/kdagon/s2sml/results_wk3_608/
INFO:root:Running on PBS/SLURM batch id: 1227860.desched1
INFO:root:Importing custom objective from /glade/work/kdagon/s2sml/applications/train_multi.py
INFO:root:Saving trial details to /glade/work/kdagon/s2sml/results_wk3_608/
INFO:root:Running on PBS/SLURM batch id: 1227854.desched1
INFO:root:Importing custom objective from /glade/work/kdagon/s2sml/applications/train_multi.py
INFO:root:Saving trial details to /glade/work/kdagon/s2sml/results_wk3_608/
INFO:root:Running on PBS/SLURM batch id: 1227853.desched1
INFO:root:Importing custom objective from /glade/work/kdagon/s2sml/applications/train_multi.py
INFO:echo.src.reporting:Using device [0, 1, 2, 3]
WARNING:echo.src.config:No pruner was supplied in the hyperparameter config file.
WARNING:echo.src.config:	Using the default NopPruner class (no pruning).
INFO:root:Direction of optimization: ['minimize', 'minimize', 'minimize']
INFO:root:Using metric ['valid_mae', 'vmse_extreme_outp', 'vcorr_cust']
INFO:echo.src.reporting:Using device [0, 1, 2, 3]
WARNING:echo.src.config:No pruner was supplied in the hyperparameter config file.
WARNING:echo.src.config:	Using the default NopPruner class (no pruning).
INFO:root:Direction of optimization: ['minimize', 'minimize', 'minimize']
INFO:root:Using metric ['valid_mae', 'vmse_extreme_outp', 'vcorr_cust']
INFO:echo.src.reporting:Using device [0, 1, 2, 3]
WARNING:echo.src.config:No pruner was supplied in the hyperparameter config file.
WARNING:echo.src.config:	Using the default NopPruner class (no pruning).
INFO:root:Direction of optimization: ['minimize', 'minimize', 'minimize']
INFO:root:Using metric ['valid_mae', 'vmse_extreme_outp', 'vcorr_cust']
INFO:echo.src.reporting:Using device [0, 1, 2, 3]
WARNING:echo.src.config:No pruner was supplied in the hyperparameter config file.
WARNING:echo.src.config:	Using the default NopPruner class (no pruning).
INFO:root:Direction of optimization: ['minimize', 'minimize', 'minimize']
INFO:root:Using metric ['valid_mae', 'vmse_extreme_outp', 'vcorr_cust']
INFO:echo.src.reporting:Using device [0, 1, 2, 3]
WARNING:echo.src.config:No pruner was supplied in the hyperparameter config file.
WARNING:echo.src.config:	Using the default NopPruner class (no pruning).
INFO:root:Direction of optimization: ['minimize', 'minimize', 'minimize']
INFO:root:Using metric ['valid_mae', 'vmse_extreme_outp', 'vcorr_cust']
INFO:echo.src.reporting:Using device [0, 1, 2, 3]
WARNING:echo.src.config:No pruner was supplied in the hyperparameter config file.
WARNING:echo.src.config:	Using the default NopPruner class (no pruning).
INFO:root:Direction of optimization: ['minimize', 'minimize', 'minimize']
INFO:root:Using metric ['valid_mae', 'vmse_extreme_outp', 'vcorr_cust']
[32m[I 2023-06-08 15:34:13,657][0m Using an existing study with name 'vanilla' instead of creating a new one.[0m
[32m[I 2023-06-08 15:34:13,662][0m Using an existing study with name 'vanilla' instead of creating a new one.[0m
[32m[I 2023-06-08 15:34:13,661][0m Using an existing study with name 'vanilla' instead of creating a new one.[0m
[32m[I 2023-06-08 15:34:13,662][0m Using an existing study with name 'vanilla' instead of creating a new one.[0m
[32m[I 2023-06-08 15:34:13,661][0m Using an existing study with name 'vanilla' instead of creating a new one.[0m
INFO:root:Loaded study vanilla located at sqlite:////glade/work/kdagon/s2sml/results_wk3_608/s2s.db
INFO:root:Loaded study vanilla located at sqlite:////glade/work/kdagon/s2sml/results_wk3_608/s2s.db
INFO:root:Loaded study vanilla located at sqlite:////glade/work/kdagon/s2sml/results_wk3_608/s2s.db
INFO:root:Loaded study vanilla located at sqlite:////glade/work/kdagon/s2sml/results_wk3_608/s2s.db
INFO:root:Loaded study vanilla located at sqlite:////glade/work/kdagon/s2sml/results_wk3_608/s2s.db
INFO:echo.src.base_objective:Worker 1227858.desched1 is summoned.
INFO:echo.src.base_objective:Worker 1227859.desched1 is summoned.
INFO:echo.src.base_objective:Worker 1227855.desched1 is summoned.
INFO:echo.src.base_objective:Worker 1227856.desched1 is summoned.
[32m[I 2023-06-08 15:34:13,699][0m Using an existing study with name 'vanilla' instead of creating a new one.[0m
INFO:echo.src.base_objective:Worker 1227857.desched1 is summoned.
INFO:echo.src.base_objective:	initializing an objective to be optimized with metric ['valid_mae', 'vmse_extreme_outp', 'vcorr_cust']
INFO:echo.src.base_objective:	initializing an objective to be optimized with metric ['valid_mae', 'vmse_extreme_outp', 'vcorr_cust']
INFO:echo.src.base_objective:	initializing an objective to be optimized with metric ['valid_mae', 'vmse_extreme_outp', 'vcorr_cust']
INFO:echo.src.base_objective:	initializing an objective to be optimized with metric ['valid_mae', 'vmse_extreme_outp', 'vcorr_cust']
INFO:root:Loaded study vanilla located at sqlite:////glade/work/kdagon/s2sml/results_wk3_608/s2s.db
INFO:echo.src.base_objective:	initializing an objective to be optimized with metric ['valid_mae', 'vmse_extreme_outp', 'vcorr_cust']
INFO:echo.src.base_objective:	using device(s) ['cuda:0', 'cuda:1', 'cuda:2', 'cuda:3']
INFO:echo.src.base_objective:	using device(s) ['cuda:0', 'cuda:1', 'cuda:2', 'cuda:3']
INFO:echo.src.base_objective:	using device(s) ['cuda:0', 'cuda:1', 'cuda:2', 'cuda:3']
INFO:echo.src.base_objective:	using device(s) ['cuda:0', 'cuda:1', 'cuda:2', 'cuda:3']
INFO:echo.src.base_objective:Worker 1227852.desched1 is summoned.
INFO:echo.src.base_objective:	using device(s) ['cuda:0', 'cuda:1', 'cuda:2', 'cuda:3']
INFO:echo.src.base_objective:	saving study/trial results to local file /glade/work/kdagon/s2sml/results_wk3_608/trial_results/trial_results_1227858.desched1.csv
INFO:echo.src.base_objective:	saving study/trial results to local file /glade/work/kdagon/s2sml/results_wk3_608/trial_results/trial_results_1227859.desched1.csv
INFO:echo.src.base_objective:	saving study/trial results to local file /glade/work/kdagon/s2sml/results_wk3_608/trial_results/trial_results_1227855.desched1.csv
INFO:echo.src.base_objective:	saving study/trial results to local file /glade/work/kdagon/s2sml/results_wk3_608/trial_results/trial_results_1227856.desched1.csv
INFO:echo.src.base_objective:	initializing an objective to be optimized with metric ['valid_mae', 'vmse_extreme_outp', 'vcorr_cust']
INFO:echo.src.base_objective:	saving study/trial results to local file /glade/work/kdagon/s2sml/results_wk3_608/trial_results/trial_results_1227857.desched1.csv
INFO:root:Running optimization for 1000 trials
INFO:root:Running optimization for 1000 trials
INFO:root:Running optimization for 1000 trials
INFO:root:Running optimization for 1000 trials
INFO:echo.src.base_objective:	using device(s) ['cuda:0', 'cuda:1', 'cuda:2', 'cuda:3']
INFO:root:Running optimization for 1000 trials
INFO:root:Running trials for a maximum PBS wall-time 12:00:00
INFO:root:Running trials for a maximum PBS wall-time 12:00:00
INFO:root:Running trials for a maximum PBS wall-time 12:00:00
INFO:root:Running trials for a maximum PBS wall-time 12:00:00
INFO:echo.src.base_objective:	saving study/trial results to local file /glade/work/kdagon/s2sml/results_wk3_608/trial_results/trial_results_1227852.desched1.csv
INFO:root:Running trials for a maximum PBS wall-time 12:00:00
WARNING:root:Attempting to run trials and stop before hitting the wall-time
WARNING:root:Attempting to run trials and stop before hitting the wall-time
WARNING:root:Attempting to run trials and stop before hitting the wall-time
WARNING:root:Attempting to run trials and stop before hitting the wall-time
INFO:root:Running optimization for 1000 trials
WARNING:root:Attempting to run trials and stop before hitting the wall-time
WARNING:root:Some trials may not complete if the wall-time is reached. Optuna will start over.
WARNING:root:Some trials may not complete if the wall-time is reached. Optuna will start over.
WARNING:root:Some trials may not complete if the wall-time is reached. Optuna will start over.
WARNING:root:Some trials may not complete if the wall-time is reached. Optuna will start over.
INFO:root:Running trials for a maximum PBS wall-time 12:00:00
WARNING:root:Some trials may not complete if the wall-time is reached. Optuna will start over.
WARNING:root:Attempting to run trials and stop before hitting the wall-time
WARNING:root:Some trials may not complete if the wall-time is reached. Optuna will start over.
INFO:echo.src.base_objective:Attempting to automatically update the model configuration using optuna's suggested parameters
INFO:echo.src.base_objective:Attempting to automatically update the model configuration using optuna's suggested parameters
INFO:echo.src.base_objective:	model:name : linknet
INFO:echo.src.base_objective:	optimizer:learning_rate : 3.991384023693747e-05
INFO:echo.src.base_objective:	trainer:train_batch_size : 14
INFO:echo.src.base_objective:	trainer:weight_decay : 2.3901933799233432e-06
INFO:echo.src.base_objective:	trainer:training_loss : xtanh
INFO:echo.src.base_objective:Beginning trial 2
INFO:echo.src.base_objective:	model:name : deeplabv3
INFO:echo.src.base_objective:	optimizer:learning_rate : 0.003626544053921592
INFO:echo.src.base_objective:	trainer:train_batch_size : 116
INFO:echo.src.base_objective:	trainer:weight_decay : 0.0003705941320104994
INFO:echo.src.base_objective:	trainer:training_loss : smooth
INFO:echo.src.base_objective:Beginning trial 3
INFO:echo.src.base_objective:Attempting to automatically update the model configuration using optuna's suggested parameters
INFO:echo.src.base_objective:Attempting to automatically update the model configuration using optuna's suggested parameters
INFO:echo.src.reporting:Using device [0, 1, 2, 3]
WARNING:echo.src.config:No pruner was supplied in the hyperparameter config file.
WARNING:echo.src.config:	Using the default NopPruner class (no pruning).
INFO:root:Direction of optimization: ['minimize', 'minimize', 'minimize']
INFO:root:Using metric ['valid_mae', 'vmse_extreme_outp', 'vcorr_cust']
INFO:echo.src.base_objective:	model:name : unet++
INFO:echo.src.base_objective:	optimizer:learning_rate : 0.0008177660882969862
INFO:echo.src.base_objective:	trainer:train_batch_size : 104
INFO:echo.src.base_objective:	trainer:weight_decay : 2.576857222319481e-07
INFO:echo.src.base_objective:	trainer:training_loss : mae
INFO:echo.src.base_objective:Beginning trial 4
INFO:echo.src.reporting:Using device [0, 1, 2, 3]
WARNING:echo.src.config:No pruner was supplied in the hyperparameter config file.
WARNING:echo.src.config:	Using the default NopPruner class (no pruning).
INFO:root:Direction of optimization: ['minimize', 'minimize', 'minimize']
INFO:root:Using metric ['valid_mae', 'vmse_extreme_outp', 'vcorr_cust']
INFO:echo.src.base_objective:	model:name : unet++
INFO:echo.src.base_objective:	optimizer:learning_rate : 0.0011562648552964404
INFO:echo.src.base_objective:	trainer:train_batch_size : 101
INFO:echo.src.base_objective:	trainer:weight_decay : 3.3179258557680775e-11
INFO:echo.src.base_objective:	trainer:training_loss : mae
INFO:echo.src.base_objective:Beginning trial 5
INFO:echo.src.base_objective:Attempting to automatically update the model configuration using optuna's suggested parameters
[32m[I 2023-06-08 15:34:15,127][0m Using an existing study with name 'vanilla' instead of creating a new one.[0m
INFO:echo.src.reporting:Using device [0, 1, 2, 3]
INFO:echo.src.base_objective:	model:name : deeplabv3+
WARNING:echo.src.config:No pruner was supplied in the hyperparameter config file.
INFO:echo.src.base_objective:	optimizer:learning_rate : 8.584094975323017e-06
WARNING:echo.src.config:	Using the default NopPruner class (no pruning).
INFO:echo.src.base_objective:	trainer:train_batch_size : 76
INFO:root:Direction of optimization: ['minimize', 'minimize', 'minimize']
INFO:echo.src.base_objective:	trainer:weight_decay : 4.9732914668949905e-12
INFO:root:Using metric ['valid_mae', 'vmse_extreme_outp', 'vcorr_cust']
INFO:echo.src.base_objective:	trainer:training_loss : smooth
INFO:root:Loaded study vanilla located at sqlite:////glade/work/kdagon/s2sml/results_wk3_608/s2s.db
INFO:echo.src.base_objective:Beginning trial 6
INFO:echo.src.base_objective:Worker 1227860.desched1 is summoned.
INFO:echo.src.base_objective:	initializing an objective to be optimized with metric ['valid_mae', 'vmse_extreme_outp', 'vcorr_cust']
INFO:echo.src.base_objective:	using device(s) ['cuda:0', 'cuda:1', 'cuda:2', 'cuda:3']
INFO:echo.src.base_objective:	saving study/trial results to local file /glade/work/kdagon/s2sml/results_wk3_608/trial_results/trial_results_1227860.desched1.csv
INFO:root:Running optimization for 1000 trials
INFO:root:Running trials for a maximum PBS wall-time 12:00:00
WARNING:root:Attempting to run trials and stop before hitting the wall-time
WARNING:root:Some trials may not complete if the wall-time is reached. Optuna will start over.
INFO:echo.src.base_objective:Attempting to automatically update the model configuration using optuna's suggested parameters
INFO:echo.src.base_objective:	model:name : deeplabv3
INFO:echo.src.base_objective:	optimizer:learning_rate : 0.002520109161224812
INFO:echo.src.base_objective:	trainer:train_batch_size : 118
INFO:echo.src.base_objective:	trainer:weight_decay : 5.624006149998715e-06
INFO:echo.src.base_objective:	trainer:training_loss : mae
INFO:echo.src.base_objective:Beginning trial 7
INFO:echo.src.base_objective:Attempting to automatically update the model configuration using optuna's suggested parameters
INFO:echo.src.base_objective:	model:name : deeplabv3
INFO:echo.src.base_objective:	optimizer:learning_rate : 9.346577708330885e-06
INFO:echo.src.base_objective:	trainer:train_batch_size : 110
INFO:echo.src.base_objective:	trainer:weight_decay : 5.993660270140755e-11
INFO:echo.src.base_objective:	trainer:training_loss : mse
INFO:echo.src.base_objective:Beginning trial 8
[32m[I 2023-06-08 15:34:15,793][0m Using an existing study with name 'vanilla' instead of creating a new one.[0m
INFO:root:Loaded study vanilla located at sqlite:////glade/work/kdagon/s2sml/results_wk3_608/s2s.db
INFO:echo.src.base_objective:Worker 1227854.desched1 is summoned.
INFO:echo.src.base_objective:	initializing an objective to be optimized with metric ['valid_mae', 'vmse_extreme_outp', 'vcorr_cust']
INFO:echo.src.base_objective:	using device(s) ['cuda:0', 'cuda:1', 'cuda:2', 'cuda:3']
INFO:echo.src.base_objective:	saving study/trial results to local file /glade/work/kdagon/s2sml/results_wk3_608/trial_results/trial_results_1227854.desched1.csv
INFO:root:Running optimization for 1000 trials
INFO:root:Running trials for a maximum PBS wall-time 12:00:00
WARNING:root:Attempting to run trials and stop before hitting the wall-time
WARNING:root:Some trials may not complete if the wall-time is reached. Optuna will start over.
[32m[I 2023-06-08 15:34:15,819][0m Using an existing study with name 'vanilla' instead of creating a new one.[0m
INFO:root:Loaded study vanilla located at sqlite:////glade/work/kdagon/s2sml/results_wk3_608/s2s.db
INFO:echo.src.base_objective:Worker 1227853.desched1 is summoned.
INFO:echo.src.base_objective:	initializing an objective to be optimized with metric ['valid_mae', 'vmse_extreme_outp', 'vcorr_cust']
INFO:echo.src.base_objective:	using device(s) ['cuda:0', 'cuda:1', 'cuda:2', 'cuda:3']
INFO:echo.src.base_objective:	saving study/trial results to local file /glade/work/kdagon/s2sml/results_wk3_608/trial_results/trial_results_1227853.desched1.csv
INFO:root:Running optimization for 1000 trials
INFO:root:Running trials for a maximum PBS wall-time 12:00:00
WARNING:root:Attempting to run trials and stop before hitting the wall-time
WARNING:root:Some trials may not complete if the wall-time is reached. Optuna will start over.
INFO:echo.src.base_objective:Attempting to automatically update the model configuration using optuna's suggested parameters
INFO:echo.src.base_objective:	model:name : manet
INFO:echo.src.base_objective:	optimizer:learning_rate : 0.0001429722561936621
INFO:echo.src.base_objective:	trainer:train_batch_size : 56
INFO:echo.src.base_objective:	trainer:weight_decay : 6.557160000743048e-08
INFO:echo.src.base_objective:	trainer:training_loss : mse
INFO:echo.src.base_objective:Beginning trial 9
INFO:echo.src.base_objective:Attempting to automatically update the model configuration using optuna's suggested parameters
INFO:echo.src.base_objective:	model:name : fpn
INFO:echo.src.base_objective:	optimizer:learning_rate : 2.011352871125772e-06
INFO:echo.src.base_objective:	trainer:train_batch_size : 114
INFO:echo.src.base_objective:	trainer:weight_decay : 6.925919072590395e-10
INFO:echo.src.base_objective:	trainer:training_loss : mse
INFO:echo.src.base_objective:Beginning trial 10
INFO:root:Loading model unet++ with settings {'in_channels': 4, 'classes': 1, 'activation': 'sigmoid'}
INFO:root:Loading model deeplabv3 with settings {'in_channels': 4, 'classes': 1, 'activation': 'sigmoid'}
INFO:root:Loading model deeplabv3 with settings {'in_channels': 4, 'classes': 1, 'activation': 'sigmoid'}
INFO:root:Loading model deeplabv3 with settings {'in_channels': 4, 'classes': 1, 'activation': 'sigmoid'}
INFO:root:Loading model linknet with settings {'in_channels': 4, 'classes': 1, 'activation': 'sigmoid'}
INFO:root:Loading model unet++ with settings {'in_channels': 4, 'classes': 1, 'activation': 'sigmoid'}
INFO:root:Loading model manet with settings {'in_channels': 4, 'classes': 1, 'activation': 'sigmoid'}
INFO:root:Loading model fpn with settings {'in_channels': 4, 'classes': 1, 'activation': 'sigmoid'}
INFO:root:Loading model deeplabv3+ with settings {'in_channels': 4, 'classes': 1, 'activation': 'sigmoid'}
INFO:root:Loading loss smooth
INFO:root:Loading loss smooth
INFO:root:Loading loss smooth
INFO:root:Loading loss smooth
INFO:root:Loading loss smooth
INFO:root:Loading loss smooth
INFO:root:Loading loss smooth
INFO:root:Loading loss smooth
INFO:root:Loading loss smooth
INFO:root:Loading loss smooth
INFO:root:Loading loss smooth
INFO:root:Loading loss smooth
INFO:root:Loading loss smooth
INFO:root:Loading loss smooth
INFO:root:Loading loss smooth
INFO:root:Loading loss smooth
INFO:root:Loading loss smooth
INFO:root:Loading loss smooth
INFO:echo.src.base_objective:Saving trial 8 results to local file /glade/work/kdagon/s2sml/results_wk3_608/trial_results/trial_results_1227855.desched1.csv
INFO:echo.src.base_objective:Merging trial results and saving to /glade/work/kdagon/s2sml/results_wk3_608/trial_results.csv
