number,values_0,values_1,values_2,datetime_start,datetime_complete,duration,params_learning_rate,params_model_name,params_train_batch_size,params_training_loss,params_weight_decay,state
0,0.16369257494807243,0.042111482471227646,32.70653512868307,2023-06-08 15:27:40.465765,2023-06-08 15:31:35.419026,0 days 00:03:54.953261,1.7703647655433445e-06,linknet,53,xsigmoid,5.33496290184721e-11,COMPLETE
1,0.03658236376941204,0.0033425873843953013,1.0545609113392023,2023-06-08 15:31:35.445100,2023-06-08 15:42:30.766557,0 days 00:10:55.321457,0.00046244051067864396,pspnet,32,smooth,3.1344276805647586e-10,COMPLETE
2,0.03543385677039623,0.004779669281560928,1.0407254355846456,2023-06-08 15:34:13.878275,2023-06-08 15:49:02.079911,0 days 00:14:48.201636,3.991384023693747e-05,linknet,14,xtanh,2.3901933799233432e-06,COMPLETE
3,0.036569949239492416,0.0032770492834970355,1.0550878703187865,2023-06-08 15:34:13.884726,2023-06-08 15:46:50.394963,0 days 00:12:36.510237,0.003626544053921592,deeplabv3,116,smooth,0.0003705941320104994,COMPLETE
4,0.022810022346675396,0.0009913602116284892,0.962644620336346,2023-06-08 15:34:14.241122,2023-06-08 15:44:59.191218,0 days 00:10:44.950096,0.0008177660882969862,unet++,104,mae,2.576857222319481e-07,COMPLETE
5,0.022792536299675703,0.000981763267191127,0.9642896221905234,2023-06-08 15:34:14.415530,2023-06-08 15:43:19.889396,0 days 00:09:05.473866,0.0011562648552964404,unet++,101,mae,3.3179258557680775e-11,COMPLETE
6,0.10294064693152905,0.02038672473281622,3.803381011331325,2023-06-08 15:34:14.414090,2023-06-08 15:38:37.037654,0 days 00:04:22.623564,8.584094975323017e-06,deeplabv3+,76,smooth,4.9732914668949905e-12,COMPLETE
7,0.037409513257443905,0.003194405057001859,1.053825354594503,2023-06-08 15:34:15.477402,2023-06-08 15:43:29.484784,0 days 00:09:14.007382,0.002520109161224812,deeplabv3,118,mae,5.624006149998715e-06,COMPLETE
8,0.11266295053064823,0.024639821145683527,19318.393039270573,2023-06-08 15:34:13.973243,2023-06-08 15:37:48.352642,0 days 00:03:34.379399,9.346577708330885e-06,deeplabv3,110,mse,5.993660270140755e-11,COMPLETE
9,0.022671514190733433,0.0010961961233988404,0.9655392447583114,2023-06-08 15:34:15.824993,2023-06-08 15:51:17.119137,0 days 00:17:01.294144,0.0001429722561936621,manet,56,mse,6.557160000743048e-08,COMPLETE
10,0.39107540994882584,0.18739566951990128,29306.614210995343,2023-06-08 15:34:16.027469,2023-06-08 15:38:14.257376,0 days 00:03:58.229907,2.011352871125772e-06,fpn,114,mse,6.925919072590395e-10,COMPLETE
11,0.09990337491035461,0.013610715977847576,1.5210404572322955,2023-06-08 15:37:48.397314,2023-06-08 15:46:27.126816,0 days 00:08:38.729502,1.4215542754491978e-06,deeplabv3+,16,huber,4.648287649088613e-08,COMPLETE
12,0.13539555668830872,0.021456339862197638,1.372008522377585,2023-06-08 15:38:14.312375,2023-06-08 16:09:37.113602,0 days 00:31:22.801227,2.2451664716613093e-06,fpn,94,xsigmoid,1.6744231573097668e-12,COMPLETE
13,0.10364597849547863,0.02065599337220192,106.95482040446302,2023-06-08 15:38:37.080996,2023-06-08 15:41:42.743474,0 days 00:03:05.662478,8.066956589537661e-06,manet,80,logcosh,8.264301212496037e-05,COMPLETE
14,0.023850854486227036,0.0011216398561373353,0.9664704112016909,2023-06-08 15:41:42.782691,2023-06-08 15:52:37.679464,0 days 00:10:54.896773,0.0002901432735124119,unet++,98,mse,1.0995239588934702e-11,COMPLETE
15,0.03895190544426441,0.0033817918156273663,1.0637353745849674,2023-06-08 15:42:30.809734,2023-06-08 15:55:26.897808,0 days 00:12:56.088074,4.736797089106019e-05,pspnet,52,logcosh,1.18315656490378e-10,COMPLETE
16,0.04852182511240244,0.004032031632959843,1.0713890997384163,2023-06-08 15:43:19.934833,2023-06-08 16:09:18.087845,0 days 00:25:58.153012,4.191242632508705e-06,unet++,60,xtanh,6.393308843118069e-09,COMPLETE
17,0.3841036260128021,0.17698098346590996,66043.71701517381,2023-06-08 15:43:29.530473,2023-06-08 15:46:53.532852,0 days 00:03:24.002379,1.2182734275546983e-06,fpn,128,mse,0.00042539530976890407,COMPLETE
18,0.030840654391795397,0.002368426532484591,1.0189403723379375,2023-06-08 15:44:59.237042,2023-06-08 15:53:47.642828,0 days 00:08:48.405786,0.00035221891006010134,deeplabv3+,73,huber,1.0077547208745537e-12,COMPLETE
19,0.06573169305920601,0.0067744244588539,1.1418961776670387,2023-06-08 15:46:27.168667,2023-06-08 16:16:15.266095,0 days 00:29:48.097428,1.872993387095021e-06,deeplabv3+,14,mse,5.009036091165445e-05,COMPLETE
20,0.022053719498217106,0.0011248817900195718,0.9622564793952976,2023-06-08 15:46:50.440895,2023-06-08 15:55:59.786280,0 days 00:09:09.345385,0.0004077925116611022,unet++,14,mse,5.7418893048718154e-12,COMPLETE
21,0.03671551961451769,0.0031402172753587365,1.055486715364853,2023-06-08 15:46:53.574427,2023-06-08 15:57:13.672352,0 days 00:10:20.097925,0.001194075628346141,deeplabv3,83,huber,1.9370481717273183e-07,COMPLETE
22,0.021661446895450354,0.0010828687954926863,0.9619174659466159,2023-06-08 15:49:02.126554,2023-06-08 16:04:38.207407,0 days 00:15:36.080853,0.0008943110653181959,linknet,28,xsigmoid,2.3348796902256786e-08,COMPLETE
23,0.03709143865853548,0.003386328578926623,1.0533267619036821,2023-06-08 15:51:17.167746,2023-06-08 16:00:38.749874,0 days 00:09:21.582128,0.0009497090312282512,pspnet,77,mse,4.0756702890595044e-09,COMPLETE
24,0.04534215107560158,0.0035661380388773978,1.0358034659790984,2023-06-08 15:52:37.722205,2023-06-08 16:02:39.084967,0 days 00:10:01.362762,0.0001257039303485649,fpn,71,mae,2.2977181538360198e-10,COMPLETE
25,0.024212599731981754,0.0014233999390853569,0.9717515692404161,2023-06-08 15:53:47.684690,2023-06-08 16:07:18.375141,0 days 00:13:30.690451,0.00011724552630449854,unet++,54,smooth,1.0260284477688551e-10,COMPLETE
26,0.03866701293736696,0.0032917640637606382,1.0629412801882407,2023-06-08 15:55:26.939052,2023-06-08 16:12:59.704402,0 days 00:17:32.765350,7.073297412625923e-05,pspnet,102,xsigmoid,1.5154321791397225e-12,COMPLETE
27,0.020741344895213842,0.000974015420069918,0.961701541342348,2023-06-08 15:55:59.827957,2023-06-08 16:05:49.493185,0 days 00:09:49.665228,0.0006053710374154719,manet,4,smooth,8.154406227605438e-12,COMPLETE
28,0.023343230597674847,0.0014022410614416003,0.9692339383240312,2023-06-08 15:57:13.714271,2023-06-08 16:10:49.875454,0 days 00:13:36.161183,9.780358635036775e-05,unet++,31,xsigmoid,3.1747801340071636e-07,COMPLETE
29,0.04507127683609724,0.0036487163743004203,1.1127621782488757,2023-06-08 16:00:38.792418,2023-06-08 16:20:41.681005,0 days 00:20:02.888587,1.0396410542378559e-05,deeplabv3,89,xtanh,0.00010442169817214107,COMPLETE
30,0.0248544760979712,0.0012033296370645985,0.9723752185478686,2023-06-08 16:02:39.125923,2023-06-08 16:16:03.509747,0 days 00:13:24.383824,5.439342099414414e-05,unet++,42,logcosh,5.69094690199488e-06,COMPLETE
31,0.024433903396129608,0.001354586536763236,0.9689072316414435,2023-06-08 16:04:38.248729,2023-06-08 16:17:28.745594,0 days 00:12:50.496865,0.0001856596420017245,unet,81,smooth,7.806184609232721e-06,COMPLETE
32,0.03929588943719864,0.0035015230532735586,1.0408591542384442,2023-06-08 16:05:49.532470,2023-06-08 16:38:40.176134,0 days 00:32:50.643664,5.250740121711243e-05,linknet,124,xsigmoid,2.3923704488878766e-09,COMPLETE
33,0.023082260508090258,0.0010762864258140326,0.9653816282747394,2023-06-08 16:07:18.415750,2023-06-08 16:24:27.609186,0 days 00:17:09.193436,0.0006759980644166411,linknet,66,mse,1.6764428354343468e-10,COMPLETE
34,0.029253742657601833,0.0023776059388183057,1.0138083936393278,2023-06-08 16:09:18.132009,2023-06-08 16:17:01.887110,0 days 00:07:43.755101,0.004452661678706445,deeplabv3+,57,logcosh,9.445993589038748e-12,COMPLETE
35,0.02995676500722766,0.0020364633819554,0.9902985782258118,2023-06-08 16:09:37.176570,2023-06-08 16:26:10.840711,0 days 00:16:33.664141,0.00014679593020226119,linknet,54,xsigmoid,1.85714696336856e-08,COMPLETE
36,0.025548534002155066,0.0009636816830607131,0.9731801916408418,2023-06-08 16:10:49.917147,2023-06-08 16:32:10.070103,0 days 00:21:20.152956,5.496542536574128e-05,unet++,64,xsigmoid,1.2811353890127783e-09,COMPLETE
37,0.033063205890357494,0.0023931428440846503,1.022770101081294,2023-06-08 16:12:59.746991,2023-06-08 16:33:02.710009,0 days 00:20:02.963018,1.965874850554978e-05,deeplabv3+,12,xsigmoid,3.573175658419965e-07,COMPLETE
38,0.023501047398895025,0.0013330980582395568,0.9695296327758116,2023-06-08 16:16:03.556665,2023-06-08 16:30:39.103784,0 days 00:14:35.547119,0.0002968710814333284,unet++,66,logcosh,6.577947914168997e-11,COMPLETE
39,0.04386067949235439,0.0031156422337517142,1.0522913655386013,2023-06-08 16:16:15.309960,2023-06-08 16:53:18.264956,0 days 00:37:02.954996,1.6871883702273755e-06,unet++,14,xtanh,0.0006010358204149668,COMPLETE
40,0.4265018403530121,0.2079109102487564,6.104322461391692,2023-06-08 16:17:01.928159,2023-06-08 16:20:00.494955,0 days 00:02:58.566796,1.2732001042914773e-06,fpn,79,huber,0.00012701114832319233,COMPLETE
41,0.10091877728700638,0.019445120822638273,4.439393414970147,2023-06-08 16:17:28.788222,2023-06-08 16:21:42.367849,0 days 00:04:13.579627,9.372019748446655e-06,deeplabv3+,108,smooth,1.5857839992045634e-09,COMPLETE
42,0.10268809646368027,0.020403297618031502,3.511532212734379,2023-06-08 16:20:00.536970,2023-06-08 16:23:54.061686,0 days 00:03:53.524716,9.65813332751984e-06,deeplabv3+,79,mse,4.811500123861099e-05,COMPLETE
43,0.11264575831592083,0.0246279570274055,18870.29131096046,2023-06-08 16:20:41.724444,2023-06-08 16:23:47.822207,0 days 00:03:06.097763,1.014327211328555e-06,deeplabv3,111,xsigmoid,1.2562024349073055e-10,COMPLETE
44,0.024419302586466074,0.0011398867791285738,0.9708038042687113,2023-06-08 16:21:42.408945,2023-06-08 16:47:21.618410,0 days 00:25:39.209465,1.5563344734902252e-05,unet++,11,huber,1.6874157440634433e-06,COMPLETE
45,0.03772035147994757,0.003485666704364121,1.0560645936858468,2023-06-08 16:23:47.864791,2023-06-08 16:31:08.806843,0 days 00:07:20.942052,0.0008912310279705456,deeplabv3,86,xsigmoid,1.0344695641647238e-09,COMPLETE
46,0.040761878713965416,0.0037075168802402914,1.0815335360582918,2023-06-08 16:23:54.104804,2023-06-08 16:31:01.840846,0 days 00:07:07.736042,1.9608170874610308e-05,pspnet,39,xtanh,5.969705802467123e-07,COMPLETE
47,0.039633250795304775,0.003043976495973766,1.0283959424138456,2023-06-08 16:24:27.652280,2023-06-08 16:32:14.077535,0 days 00:07:46.425255,0.000239371125450341,fpn,28,mse,4.7770983522593715e-05,COMPLETE
48,0.030573365278542042,0.002404273778665811,1.0167022669145942,2023-06-08 16:26:10.883952,2023-06-08 16:35:58.053508,0 days 00:09:47.169556,0.0003697683564567828,deeplabv3+,67,smooth,2.0373702079844204e-07,COMPLETE
49,0.039324439130723476,0.004024197638500482,1.0599610766844123,2023-06-08 16:30:39.147418,2023-06-08 16:36:03.711092,0 days 00:05:24.563674,0.003933977658916269,pspnet,26,smooth,0.0009095815770088346,COMPLETE
50,0.0318293422460556,0.0026146130403503776,1.0190937413409986,2023-06-08 16:31:01.881863,2023-06-08 16:42:58.215869,0 days 00:11:56.334006,0.00012772738744818278,deeplabv3+,54,mse,1.3848519875684729e-12,COMPLETE
51,0.0368741387501359,0.0032844878151081502,1.054817865183122,2023-06-08 16:31:08.850300,2023-06-08 16:39:35.932610,0 days 00:08:27.082310,0.00023768323099761736,pspnet,12,huber,1.1778074951324545e-10,COMPLETE
52,0.036870538257062435,0.0033093864331021905,1.0555812866247436,2023-06-08 16:32:10.114299,2023-06-08 16:42:05.543919,0 days 00:09:55.429620,0.003782363665301455,deeplabv3,79,xtanh,1.8085214166819825e-08,COMPLETE
53,0.15891463682055473,0.0413828007876873,785670.4870726219,2023-06-08 16:32:14.120256,2023-06-08 16:35:42.973367,0 days 00:03:28.853111,1.1383180835057882e-06,linknet,69,huber,6.686718431146191e-05,COMPLETE
54,0.09910392202436924,0.01895367680117488,6.464110619828965,2023-06-08 16:33:02.758220,2023-06-08 16:36:35.754896,0 days 00:03:32.996676,1.3250884616687554e-06,deeplabv3+,62,mae,4.80680846469171e-06,COMPLETE
55,0.034738706424832344,0.0027128743240609765,1.0242711154683093,2023-06-08 16:35:43.014722,2023-06-08 16:50:11.704812,0 days 00:14:28.690090,0.0007224085556436474,fpn,115,mae,3.77711493465579e-10,COMPLETE
56,0.10206389613449574,0.020009846426546574,35.625186290648685,2023-06-08 16:35:58.097903,2023-06-08 16:38:54.154120,0 days 00:02:56.056217,1.7493577014769216e-06,manet,84,mae,5.756608097315066e-05,COMPLETE
57,0.15940867364406586,0.040139686316251755,15.219807060771883,2023-06-08 16:36:03.754735,2023-06-08 16:39:01.025525,0 days 00:02:57.270790,3.4492895710390763e-06,linknet,77,logcosh,9.602385275384954e-08,COMPLETE
58,0.04643738456070423,0.0037447931827045977,1.0705823744759606,2023-06-08 16:36:35.797647,2023-06-08 17:08:11.923636,0 days 00:31:36.125989,1.5863787278927462e-06,unet++,8,xsigmoid,2.19149536798907e-06,COMPLETE
59,0.02295141387730837,0.0010321668960386887,0.964319411881795,2023-06-08 16:38:40.223591,2023-06-08 16:48:34.090551,0 days 00:09:53.866960,0.006208688171186916,unet++,127,huber,3.947086515013227e-06,COMPLETE
60,0.10187664441764355,0.019950001500546932,31.06836408382664,2023-06-08 16:38:54.197017,2023-06-08 16:41:52.322483,0 days 00:02:58.125466,1.7858760880597546e-05,manet,86,smooth,4.879615129115278e-06,COMPLETE
61,0.11554300785064697,0.02381678018718958,13.046858556590731,2023-06-08 16:39:01.072395,2023-06-08 16:41:50.838002,0 days 00:02:49.765607,3.20425259951079e-05,unet++,121,xtanh,7.9874415464932e-11,COMPLETE
62,0.15585500746965408,0.03879344463348389,13.185835649561238,2023-06-08 16:39:35.977720,2023-06-08 16:42:31.917172,0 days 00:02:55.939452,2.047266464233125e-06,linknet,96,mae,1.2308631847712916e-08,COMPLETE
63,0.10123642906546593,0.020346287172287703,4.321899977617125,2023-06-08 16:41:50.880602,2023-06-08 16:45:42.835534,0 days 00:03:51.954932,1.3733655431071934e-06,deeplabv3+,77,huber,2.5214347794550276e-12,COMPLETE
64,0.04652421921491623,0.0031517326133325696,1.0515635616560104,2023-06-08 16:41:52.365156,2023-06-08 16:49:06.229349,0 days 00:07:13.864193,0.0004124882881377414,fpn,68,huber,7.093644524105084e-06,COMPLETE
65,0.03155165817588568,0.0021064033498987556,0.9938138907172769,2023-06-08 16:42:05.589460,2023-06-08 17:03:11.749986,0 days 00:21:06.160526,3.411634678530076e-05,unet,85,smooth,1.0618988934365154e-07,COMPLETE
66,0.10392040014266968,0.016870349645614624,1.6377018788970443,2023-06-08 16:42:31.960117,2023-06-08 16:46:27.746092,0 days 00:03:55.785975,3.0042050750725865e-05,fpn,81,smooth,6.059571366856606e-06,COMPLETE
67,0.031147960107773542,0.00253726402297616,1.0176253834962068,2023-06-08 16:42:58.261062,2023-06-08 17:05:04.205550,0 days 00:22:05.944488,0.0005287536954032255,fpn,91,smooth,4.266673377639058e-08,COMPLETE
68,0.021582717075943947,0.0008404204127145931,0.962410357451114,2023-06-08 16:45:42.876985,2023-06-08 16:52:57.967422,0 days 00:07:15.090437,0.001746751913818587,linknet,9,huber,4.7407508722501757e-07,COMPLETE
69,0.1128252986818552,0.023424028884619474,15.37260875416077,2023-06-08 16:46:27.789250,2023-06-08 16:49:23.386854,0 days 00:02:55.597604,8.183840056625046e-06,unet++,109,mse,7.854271079908103e-07,COMPLETE
70,0.023215389344841242,0.0014109869371168315,0.9669427226205989,2023-06-08 16:47:21.700402,2023-06-08 16:54:18.330594,0 days 00:06:56.630192,0.004247374485720304,linknet,60,logcosh,1.2806586941070211e-08,COMPLETE
71,0.04328856058418751,0.0035760795581154525,1.0405646655868974,2023-06-08 16:48:34.152880,2023-06-08 17:04:39.209697,0 days 00:16:05.056817,1.3582524960592005e-05,unet,39,mse,8.491756660774182e-07,COMPLETE
72,0.038426658138632774,0.003329033264890313,1.0624074827993044,2023-06-08 16:49:06.273773,2023-06-08 16:56:32.071610,0 days 00:07:25.797837,4.6957665138183766e-05,pspnet,11,mse,0.00010860765044285564,COMPLETE
73,0.14661353826522827,0.02697415230795741,1.5700305172244742,2023-06-08 16:49:23.432306,2023-06-08 17:06:39.224048,0 days 00:17:15.791742,2.433480456854594e-06,fpn,48,mse,0.0004553440663539425,COMPLETE
74,0.10006312467157841,0.01963852532207966,8.894741772109363,2023-06-08 16:50:11.752745,2023-06-08 16:54:22.742052,0 days 00:04:10.989307,3.4187355616309147e-06,deeplabv3+,126,mse,2.6687008631411714e-11,COMPLETE
75,0.020492298528552055,0.001084603602066636,0.9605492479772635,2023-06-08 16:52:58.011613,2023-06-08 17:09:25.714136,0 days 00:16:27.702523,0.004674684734985958,manet,28,smooth,2.7082821738787484e-09,COMPLETE
76,0.02586467145010829,0.001388912001857534,0.9742090995093132,2023-06-08 16:53:18.314295,2023-06-08 17:07:31.580686,0 days 00:14:13.266391,0.00029690203533769825,linknet,55,huber,3.975156819578084e-12,COMPLETE
77,0.0315121253952384,0.002190600032918155,1.0023241689911793,2023-06-08 16:54:18.375808,2023-06-08 17:09:35.855367,0 days 00:15:17.479559,0.00010303360216200571,linknet,34,smooth,8.980857861185829e-05,COMPLETE
78,0.02099639642983675,0.0010573904000921175,0.961517078603217,2023-06-08 16:54:22.785940,2023-06-08 17:12:44.892488,0 days 00:18:22.106548,0.0005581886618149573,unet,59,logcosh,2.9555224259851114e-08,COMPLETE
79,0.1556468941271305,0.03871632739901543,13.122640017630678,2023-06-08 16:56:32.117467,2023-06-08 16:59:30.268609,0 days 00:02:58.151142,2.2112519356720848e-06,linknet,98,logcosh,0.00025935143806886987,COMPLETE
80,0.10324407927691936,0.02055413741618395,28.962300314061636,2023-06-08 16:59:30.310676,2023-06-08 17:02:25.923534,0 days 00:02:55.612858,1.0108741970240848e-06,manet,95,xsigmoid,1.3681174055697668e-07,COMPLETE
81,0.06605521962046623,0.007012838497757912,1.2264448069922302,2023-06-08 17:02:25.965696,2023-06-08 17:18:24.213861,0 days 00:15:58.248165,6.074828783981395e-06,unet,50,huber,5.935130516653174e-06,COMPLETE
82,0.04771830141544342,0.00414440524764359,1.1168484689271252,2023-06-08 17:03:11.837622,2023-06-08 17:23:15.971100,0 days 00:20:04.133478,2.1188662024536117e-06,pspnet,79,xsigmoid,9.512306385158258e-12,COMPLETE
83,0.024324191268533468,0.0011447274591773748,0.9710904126115791,2023-06-08 17:04:39.254711,2023-06-08 17:17:34.901949,0 days 00:12:55.647238,9.397890798304064e-05,manet,43,huber,7.975206205283559e-06,COMPLETE
84,0.10102563165128231,0.01928850752301514,4.756075934208766,2023-06-08 17:05:04.272095,2023-06-08 17:09:10.208980,0 days 00:04:05.936885,5.391315311954256e-06,deeplabv3+,104,xsigmoid,6.026209731715327e-12,COMPLETE
85,0.041223629377782345,0.002739520976319909,1.0361958273499776,2023-06-08 17:06:39.270404,2023-06-08 17:19:43.155216,0 days 00:13:03.884812,2.7542790729671914e-05,unet,61,xsigmoid,1.0794791727325559e-12,COMPLETE
86,0.030550691299140453,0.0022926991805434227,1.0188359797754025,2023-06-08 17:07:31.625150,2023-06-08 17:20:16.576250,0 days 00:12:44.951100,0.00026197052640348963,deeplabv3+,126,xsigmoid,9.360647782742505e-09,COMPLETE
87,0.021600741893053055,0.0010492436704225838,0.9617352578543372,2023-06-08 17:08:11.974592,2023-06-08 17:16:52.870807,0 days 00:08:40.896215,0.0017275786259208226,manet,40,smooth,8.845851767090052e-10,COMPLETE
88,0.04765054490417242,0.004034871351905167,1.1208044461955473,2023-06-08 17:09:10.253689,2023-06-08 17:22:49.648772,0 days 00:13:39.395083,1.3477802291525817e-05,deeplabv3,120,mae,4.130439451167222e-07,COMPLETE
89,0.06925567984580994,0.012254000757820904,1.1232155662761434,2023-06-08 17:09:25.762063,2023-06-08 17:17:50.766465,0 days 00:08:25.004402,0.0001005774028901676,fpn,86,xtanh,8.755425643498074e-08,COMPLETE
90,0.10345525294542313,0.020266018575057387,2.903600309001302,2023-06-08 17:09:35.903430,2023-06-08 17:13:09.438560,0 days 00:03:33.535130,1.2587066259890458e-06,deeplabv3+,48,smooth,0.00018231043715594622,COMPLETE
91,0.15506752207875252,0.04114913195371628,1896907.6293601652,2023-06-08 17:12:44.937978,2023-06-08 17:15:33.563665,0 days 00:02:48.625687,5.224824660266366e-06,unet,105,xtanh,2.39993889021994e-12,COMPLETE
92,0.11577038280665874,0.023909499403089285,14.230875367795992,2023-06-08 17:13:09.483987,2023-06-08 17:16:00.319998,0 days 00:02:50.836011,2.0072140340390615e-05,unet++,122,mae,1.5094779239102253e-09,COMPLETE
93,0.10080087184906006,0.014861193718388677,1.68989856406151,2023-06-08 17:15:33.608679,2023-06-08 17:26:13.806476,0 days 00:10:40.197797,3.0351989412106995e-06,unet,23,huber,0.0003066428783089245,COMPLETE
94,0.03493504971265793,0.0023204832687042654,1.0051979734403997,2023-06-08 17:16:00.365858,2023-06-08 17:27:02.038638,0 days 00:11:01.672780,2.9836746018571547e-05,unet,39,mae,1.2114190364012455e-10,COMPLETE
95,0.0300706191919744,0.002195230859797448,1.016827336446201,2023-06-08 17:16:52.916998,2023-06-08 17:34:51.512095,0 days 00:17:58.595097,0.0010755161444345681,fpn,50,xsigmoid,9.48365876753998e-10,COMPLETE
96,0.042396945878863335,0.003908018057700247,1.0795061545521725,2023-06-08 17:17:34.950020,2023-06-08 17:31:35.542014,0 days 00:14:00.591994,6.734330833604794e-06,pspnet,31,xtanh,2.003078008332854e-06,COMPLETE
97,0.040971746668219566,0.0029197997064329684,1.0381164037797874,2023-06-08 17:17:50.813140,2023-06-08 17:30:22.865275,0 days 00:12:32.052135,0.0004689782964603728,fpn,123,logcosh,1.796667812608211e-05,COMPLETE
98,0.023501264862716198,0.0012140248290961608,0.9685075272790886,2023-06-08 17:18:24.261393,2023-06-08 17:26:56.058776,0 days 00:08:31.797383,0.009644336512193508,unet,100,logcosh,0.00047874444020611973,COMPLETE
99,0.05005146283656359,0.004546790034510195,1.0794692573422968,2023-06-08 17:19:43.202092,2023-06-08 17:38:43.938994,0 days 00:19:00.736902,7.900003508390131e-06,deeplabv3+,39,xtanh,4.6959753309751527e-07,COMPLETE
100,0.038086263462901115,0.00332701817387715,1.0602277931326878,2023-06-08 17:20:16.623383,2023-06-08 17:28:38.303173,0 days 00:08:21.679790,5.4521806236132864e-05,pspnet,12,logcosh,0.00013418531263156773,COMPLETE
101,0.036614625714719296,0.003029079409316182,1.0560726716496958,2023-06-08 17:22:49.695586,2023-06-08 17:32:56.670126,0 days 00:10:06.974540,0.0008771582954256545,deeplabv3,24,xtanh,1.6828423149722617e-07,COMPLETE
