number,values_0,values_1,values_2,datetime_start,datetime_complete,duration,params_learning_rate,params_model_name,params_train_batch_size,params_training_loss,params_weight_decay,state
308,0.023356424644589424,0.0012033774255542085,0.9673027572283052,2023-06-08 21:11:48.844689,2023-06-08 21:25:54.081621,0 days 00:14:05.236932,4.577631295290207e-05,manet,6,logcosh,2.317596857836101e-10,COMPLETE
309,0.04103467706590891,0.003555306524503976,1.0711195792333417,2023-06-08 21:15:09.708718,2023-06-08 21:29:21.214433,0 days 00:14:11.505715,1.1760664525681202e-05,pspnet,29,huber,3.1851928102437984e-07,COMPLETE
310,0.12531708367168903,0.06594580225646496,2.439199413565749,2023-06-08 21:15:30.775708,2023-06-08 21:32:22.535587,0 days 00:16:51.759879,1.5370863966825161e-06,manet,12,huber,0.0001174640898845091,COMPLETE
311,0.03747818432748318,0.002787454635836184,1.0327070301431582,2023-06-08 21:16:37.144249,2023-06-08 21:32:04.742506,0 days 00:15:27.598257,1.1251721300421014e-05,manet,29,huber,3.8429257039105866e-07,COMPLETE
312,0.10820133425295353,0.022440216038376093,65.5332947971137,2023-06-08 21:19:01.554630,2023-06-08 21:22:03.074637,0 days 00:03:01.520007,5.018594369379046e-05,manet,113,huber,1.7436369317832608e-12,COMPLETE
313,0.021474057342857122,0.0010790223022922873,0.9638450503466199,2023-06-08 21:20:06.450491,2023-06-08 21:29:21.488672,0 days 00:09:15.038181,0.00025129396695402654,manet,6,huber,3.383077797724699e-07,COMPLETE
314,0.04489547107368708,0.003851826360914856,1.0821638034848529,2023-06-08 21:20:37.400856,2023-06-08 21:50:58.094193,0 days 00:30:20.693337,3.685036439010604e-06,manet,6,huber,3.2832690640780926e-06,COMPLETE
315,0.020705129951238632,0.0009600366611266509,0.9616208783808214,2023-06-08 21:22:03.141060,2023-06-08 21:31:27.107565,0 days 00:09:23.966505,0.0019995076712169464,manet,6,huber,2.9976836867929694e-06,COMPLETE
316,0.029772219248116016,0.0021085896878503263,0.9897812521135706,2023-06-08 21:25:54.145905,2023-06-08 21:43:36.944843,0 days 00:17:42.798938,1.0585876158820901e-05,manet,4,huber,5.3515750376611275e-05,COMPLETE
317,0.020838658791035414,0.0009548733796691522,0.9602868458762257,2023-06-08 21:26:57.173689,2023-06-08 21:38:41.452115,0 days 00:11:44.278426,0.00040424346350261946,manet,4,huber,0.00013049121773602018,COMPLETE
318,0.2235821858048439,0.0764399841427803,78555.34882293992,2023-06-08 21:28:01.284877,2023-06-08 21:32:12.205900,0 days 00:04:10.921023,1.5222746795174384e-06,manet,4,huber,2.9255786652473083e-07,COMPLETE
319,0.07002923637628555,0.008734907256439328,1.3532409414051065,2023-06-08 21:29:21.279321,2023-06-08 21:44:08.840451,0 days 00:14:47.561130,3.474993693458913e-06,manet,6,huber,7.934649879032047e-11,COMPLETE
320,0.10310613363981247,0.03114112513139844,1.9219463876380003,2023-06-08 21:29:21.551725,2023-06-08 21:40:50.274064,0 days 00:11:28.722339,2.600928038241596e-06,manet,4,huber,1.5081494840200393e-06,COMPLETE
321,0.02372974855825305,0.001126934221247211,0.9678348388974712,2023-06-08 21:31:27.174532,2023-06-08 21:47:09.158707,0 days 00:15:41.984175,0.00022679955051036285,manet,107,huber,8.730158985404685e-06,COMPLETE
322,0.0220008990727365,0.0010590922902338207,0.963661094490625,2023-06-08 21:32:04.804931,2023-06-08 21:47:11.363405,0 days 00:15:06.558474,8.370345236569779e-05,manet,4,huber,3.6256624987948903e-12,COMPLETE
323,0.02143020322546363,0.0011019564408343285,0.963214235426828,2023-06-08 21:32:12.269745,2023-06-08 21:39:25.807402,0 days 00:07:13.537657,0.0004701871660584275,manet,11,huber,7.734551571448929e-11,COMPLETE
324,0.026203136891126633,0.0013079507916700095,0.9843161511331964,2023-06-08 21:32:22.600643,2023-06-08 21:41:30.017259,0 days 00:09:07.416616,6.38708331552537e-05,manet,7,huber,7.991405583194539e-10,COMPLETE
325,0.022462567314505577,0.0010648074676282704,0.965480926445277,2023-06-08 21:33:32.369993,2023-06-08 21:51:30.031172,0 days 00:17:57.661179,6.833895146853301e-05,manet,11,huber,7.379924935610492e-11,COMPLETE
326,0.12384594604372978,0.04092552466318011,2.070642023317789,2023-06-08 21:38:41.517802,2023-06-08 21:51:08.004130,0 days 00:12:26.486328,2.5413597200764904e-06,manet,11,huber,2.689642267696522e-11,COMPLETE
327,0.024095183704048395,0.001240220939507708,0.9661379124100484,2023-06-08 21:39:25.871420,2023-06-08 21:49:18.956157,0 days 00:09:53.084737,0.0006564656130699778,manet,107,huber,7.55494007030028e-10,COMPLETE
328,0.07027306780219078,0.008762719575315714,1.414136905379904,2023-06-08 21:40:50.340924,2023-06-08 21:57:18.120248,0 days 00:16:27.779324,2.9459699201672128e-06,manet,38,huber,1.7641604034916916e-10,COMPLETE
329,0.02651561750099063,0.0013627607258968055,0.9773529411386648,2023-06-08 21:41:30.080824,2023-06-08 21:55:09.176099,0 days 00:13:39.095275,2.1587250897529873e-05,manet,8,huber,4.738926414411928e-05,COMPLETE
330,0.02287484984844923,0.0010908064723480493,0.9648598023546517,2023-06-08 21:43:37.011532,2023-06-08 21:55:57.892687,0 days 00:12:20.881155,0.00020474539755984715,manet,38,huber,1.1412536140991581e-11,COMPLETE
331,0.10206945613026619,0.01996596623212099,34.05899368205128,2023-06-08 21:44:08.908365,2023-06-08 21:47:12.577243,0 days 00:03:03.668878,3.6645263365992356e-06,manet,89,huber,0.0008804333416068839,COMPLETE
332,0.02410171926021576,0.0011692752450471744,0.9694838831765296,2023-06-08 21:47:09.223953,2023-06-08 22:03:57.734393,0 days 00:16:48.510440,0.0002001519306022311,manet,118,huber,1.062583256925439e-09,COMPLETE
333,0.02120767580345273,0.00097898009698838,0.9624974686535165,2023-06-08 21:47:11.430148,2023-06-08 21:54:26.527362,0 days 00:07:15.097214,0.0007084050222286044,manet,11,logcosh,2.622640432019631e-05,COMPLETE
334,0.022311626002192497,0.0010234347137156874,0.9655957504684425,2023-06-08 21:47:12.733563,2023-06-08 22:03:49.878782,0 days 00:16:37.145219,0.00019012518879678184,manet,38,logcosh,3.257731531640035e-11,COMPLETE
335,0.09756611660122871,0.02267907839268446,1.7081849855890507,2023-06-08 21:49:19.020832,2023-06-08 22:06:07.606932,0 days 00:16:48.586100,2.7186386698590033e-06,manet,11,logcosh,1.0828940250930729e-05,COMPLETE
336,0.02543024718761444,0.001252125555765815,0.9724828507887736,2023-06-08 21:50:58.163461,2023-06-08 22:20:08.277677,0 days 00:29:10.114216,1.509062015244714e-05,manet,11,logcosh,0.0009576449154990955,COMPLETE
337,0.023810237646102905,0.0011653242399916053,0.9691509657664117,2023-06-08 21:51:08.069352,2023-06-08 22:00:20.388072,0 days 00:09:12.318720,0.00018954366420355075,manet,38,logcosh,0.0009321347569697293,COMPLETE
338,0.022658787202090025,0.0012075088015990332,0.964326323039846,2023-06-08 21:51:30.100713,2023-06-08 22:00:17.787356,0 days 00:08:47.686643,0.0015984049023276433,manet,118,logcosh,5.976471260639126e-05,COMPLETE
339,0.021919780410826206,0.0010349614749429747,0.963349587869711,2023-06-08 21:54:26.592673,2023-06-08 22:04:54.896757,0 days 00:10:28.304084,0.0001767013135907535,manet,8,xtanh,7.017152428189869e-05,COMPLETE
340,0.021495031658560038,0.001135745333158411,0.9612942592386311,2023-06-08 21:55:09.241939,2023-06-08 22:04:18.984269,0 days 00:09:09.742330,0.0016176797722953894,manet,40,xtanh,9.518180495937582e-12,COMPLETE
341,0.027622303925454617,0.0018621344352141023,0.9792869953641404,2023-06-08 21:55:57.959580,2023-06-08 22:16:42.576715,0 days 00:20:44.617135,1.4248327772107092e-05,manet,8,xtanh,0.0002354040236163183,COMPLETE
342,0.03463299199938774,0.0019914421427529305,1.0236017339250618,2023-06-08 21:57:18.188253,2023-06-08 22:22:38.033506,0 days 00:25:19.845253,7.8592735741149e-06,manet,25,xtanh,2.0745783986571313e-11,COMPLETE
343,0.021754202898591757,0.0010332639212720096,0.9622985477327697,2023-06-08 22:00:17.853460,2023-06-08 22:10:54.408059,0 days 00:10:36.554599,0.0001852520195865832,manet,9,xtanh,0.0009376468889807742,COMPLETE
344,0.024226312059909105,0.0013507712574210018,0.9712790011510046,2023-06-08 22:00:20.457861,2023-06-08 22:35:48.487959,0 days 00:35:28.030098,1.4610409431085895e-05,manet,8,xtanh,0.00024824922398208795,COMPLETE
345,0.02504306100308895,0.0014709701645188034,0.9736243762605004,2023-06-08 22:03:49.943073,2023-06-08 22:31:32.666824,0 days 00:27:42.723751,1.3498860896512373e-05,manet,8,huber,0.00022839177236222942,COMPLETE
346,0.02472351584583521,0.0018598161404952407,0.9752385047720631,2023-06-08 22:03:57.802945,2023-06-08 22:09:53.926793,0 days 00:05:56.123848,0.00012686863831642303,manet,10,xtanh,1.0784432267042585e-05,COMPLETE
347,0.04673687182366848,0.0040482192998752,1.0965146507716608,2023-06-08 22:04:19.048233,2023-06-08 22:18:02.227402,0 days 00:13:43.179169,5.525838538818395e-06,manet,8,huber,8.595162484333182e-07,COMPLETE
348,0.037587329745292664,0.0020256927236914635,1.0609166133058565,2023-06-08 22:04:54.963490,2023-06-08 22:19:22.894566,0 days 00:14:27.931076,1.4602731623100131e-05,manet,34,huber,9.669597705751646e-06,COMPLETE
349,0.02157001569867134,0.0011089998442912474,0.9619671864089366,2023-06-08 22:06:07.674259,2023-06-08 22:14:52.107768,0 days 00:08:44.433509,0.003949936374262058,manet,35,huber,9.777718300567398e-07,COMPLETE
350,0.04967022221535444,0.004776488873176277,1.114964688311225,2023-06-08 22:09:53.995571,2023-06-08 22:21:55.859893,0 days 00:12:01.864322,6.149277046107683e-06,manet,35,huber,0.00021327557457335387,COMPLETE
351,0.020549362991005182,0.0010084542445838451,0.9599709349109131,2023-06-08 22:10:54.472457,2023-06-08 22:23:38.350542,0 days 00:12:43.878085,0.003400273679731761,manet,34,huber,3.3051844721424795e-10,COMPLETE
352,0.03031784063205123,0.0019435774302110076,0.9902128460604183,2023-06-08 22:14:52.173336,2023-06-08 22:27:09.312001,0 days 00:12:17.138665,1.5725670440473764e-05,manet,7,huber,0.0002145318333835432,COMPLETE
353,0.021200687624514103,0.0009852747243712656,0.9624105776728448,2023-06-08 22:16:42.643943,2023-06-08 22:23:56.317092,0 days 00:07:13.673149,0.005428426940822478,manet,12,huber,1.0817384912057627e-07,COMPLETE
354,0.03387664817273617,0.0024866865715011954,1.0098934558137702,2023-06-08 22:18:02.295788,2023-06-08 22:37:33.609507,0 days 00:19:31.313719,8.181855140358593e-06,manet,13,huber,4.586314944412051e-09,COMPLETE
355,0.025562249589711428,0.0011971431085839868,0.9741611613999874,2023-06-08 22:19:22.961795,2023-06-08 22:24:32.622254,0 days 00:05:09.660459,0.00030497925607856524,manet,13,huber,1.5406206204137925e-11,COMPLETE
356,0.022700644098222256,0.001073400053428486,0.9655718450155214,2023-06-08 22:20:08.349232,2023-06-08 22:33:31.195336,0 days 00:13:22.846104,8.245597330734865e-05,manet,14,huber,4.788038088347821e-09,COMPLETE
357,0.02176271704956889,0.0011308629618724808,0.9614748266524588,2023-06-08 22:21:55.926906,2023-06-08 22:31:12.016259,0 days 00:09:16.089353,0.0003575398994254208,manet,14,huber,2.0414804383361997e-11,COMPLETE
358,0.021329218987375498,0.001004343037493527,0.9616094577292408,2023-06-08 22:22:38.101206,2023-06-08 22:31:46.291880,0 days 00:09:08.190674,0.005353882331396295,manet,13,huber,1.1439355390417099e-07,COMPLETE
359,0.020923114847391844,0.000996979244519025,0.9595375160294195,2023-06-08 22:23:38.417210,2023-06-08 22:32:53.712929,0 days 00:09:15.295719,0.0034711040923578527,manet,13,huber,2.8481176966471505e-10,COMPLETE
360,0.020921092480421066,0.0009614070440875366,0.9606896806625762,2023-06-08 22:23:56.385400,2023-06-08 22:30:04.615728,0 days 00:06:08.230328,0.003330349325555877,manet,6,huber,1.7911173501031252e-05,COMPLETE
361,0.022242665756493807,0.0010423177300253883,0.9639148237965572,2023-06-08 22:24:32.690071,2023-06-08 22:38:50.500822,0 days 00:14:17.810751,8.766971013489604e-05,manet,6,huber,3.168556205543653e-08,COMPLETE
362,0.03621039632707834,0.003289085638243705,1.052695536970044,2023-06-08 22:27:09.380459,2023-06-08 22:35:49.743763,0 days 00:08:40.363304,0.0032819476453398735,pspnet,6,huber,4.336835959271699e-09,COMPLETE
363,0.023935269564390182,0.0010191754845436662,0.9696680580776704,2023-06-08 22:30:04.681723,2023-06-08 22:41:02.425736,0 days 00:10:57.744013,8.849458790438497e-05,manet,9,huber,4.604847550280246e-09,COMPLETE
364,0.03664657659828663,0.0032990651670843363,1.0536938697700327,2023-06-08 22:31:12.085656,2023-06-08 22:37:51.079667,0 days 00:06:38.994011,0.0020050278695742216,pspnet,8,huber,3.64781335095987e-08,COMPLETE
365,0.036805495619773865,0.0031065100338310003,1.0571302487932681,2023-06-08 22:31:32.737451,2023-06-08 22:36:23.736092,0 days 00:04:50.998641,0.00047967777890520143,pspnet,4,huber,4.3711198469676606e-11,COMPLETE
366,0.0361939612776041,0.0031972629367373884,1.053933246899954,2023-06-08 22:31:46.370818,2023-06-08 22:36:55.433869,0 days 00:05:09.063051,0.001977649125108689,pspnet,6,huber,5.205189166368873e-09,COMPLETE
367,0.036960882134735584,0.0031992410076782107,1.055184427611629,2023-06-08 22:32:53.781678,2023-06-08 22:45:24.504009,0 days 00:12:30.722331,0.00011399393167611663,pspnet,4,huber,2.2997068884895113e-07,COMPLETE
368,0.02048884890973568,0.0009843876032391563,0.9611169396571835,2023-06-08 22:33:31.264826,2023-06-08 22:43:32.703235,0 days 00:10:01.438409,0.001980553893750031,manet,4,huber,0.0004177513842581193,COMPLETE
369,0.02111524110659957,0.0009869184723356739,0.9625792248187999,2023-06-08 22:35:48.562131,2023-06-08 22:45:55.665731,0 days 00:10:07.103600,0.002120708227969609,manet,4,huber,2.9798023893360128e-08,COMPLETE
370,0.02066451497375965,0.0009768517775228247,0.9611646289425494,2023-06-08 22:35:49.810014,2023-06-08 22:45:45.936609,0 days 00:09:56.126595,0.0019854483585754605,manet,4,huber,3.0277298575812656e-08,COMPLETE
371,0.020634110551327467,0.0009458515996811911,0.961174073899411,2023-06-08 22:36:23.805371,2023-06-08 22:46:24.834694,0 days 00:10:01.029323,0.0019384996284390781,manet,4,huber,4.019054676302596e-12,COMPLETE
372,0.020706293173134327,0.0009306597348768264,0.9617105067375977,2023-06-08 22:36:55.501554,2023-06-08 22:46:48.698912,0 days 00:09:53.197358,0.000934808082789636,manet,4,huber,2.8044782053179925e-08,COMPLETE
373,0.020661022514104843,0.0009630613494664431,0.9616155093236954,2023-06-08 22:37:33.678782,2023-06-08 22:47:36.061048,0 days 00:10:02.382266,0.001003078400761267,manet,4,huber,4.1751598024883035e-10,COMPLETE
374,0.02061340631917119,0.0009531060641165823,0.9613365827064159,2023-06-08 22:37:51.150616,2023-06-08 22:47:47.859815,0 days 00:09:56.709199,0.0009879672941287313,manet,4,huber,3.253170621685415e-05,COMPLETE
375,0.02631166111677885,0.0013281350547913462,0.978544653944868,2023-06-08 22:38:50.570879,2023-06-08 22:51:46.533363,0 days 00:12:55.962484,5.496176952294444e-05,manet,42,huber,4.2184409561995083e-10,COMPLETE
376,0.021446413826197386,0.0009932129614753649,0.9623419291012272,2023-06-08 22:41:02.496007,2023-06-08 22:56:30.357550,0 days 00:15:27.861543,0.00011686600847413101,manet,4,huber,2.092324846181547e-07,COMPLETE
377,0.027809149120002985,0.0015439850103575736,0.9822909308502267,2023-06-08 22:43:32.770426,2023-06-08 22:56:44.779677,0 days 00:13:12.009251,3.169089041880289e-05,manet,30,huber,2.3325418603544832e-07,COMPLETE
378,0.02151976991444826,0.0009321933466708288,0.9618384651595663,2023-06-08 22:45:24.574833,2023-06-08 22:52:26.193674,0 days 00:07:01.618841,0.0009976606604588992,manet,9,huber,4.068048584148732e-12,COMPLETE
379,0.026499375700950623,0.0013640279648825526,0.975929855669222,2023-06-08 22:45:46.022813,2023-06-08 22:57:08.107221,0 days 00:11:22.084408,3.490802479248988e-05,manet,11,huber,3.661592394120173e-12,COMPLETE
380,0.022522409912198782,0.0011138813861180097,0.9646402708082773,2023-06-08 22:45:55.739244,2023-06-08 22:55:17.437986,0 days 00:09:21.698742,0.0002419953768888163,manet,30,huber,1.535528725653618e-10,COMPLETE
381,0.021060536615550518,0.0009654947643866763,0.9606469484250112,2023-06-08 22:46:24.903273,2023-06-08 22:56:11.469258,0 days 00:09:46.565985,0.0009869818080805275,manet,26,huber,1.3798356398943018e-11,COMPLETE
382,0.022597757633775473,0.0010592759645078331,0.9653391201440846,2023-06-08 22:46:48.770599,2023-06-08 23:09:48.275850,0 days 00:22:59.505251,6.714521531891094e-05,manet,30,huber,1.3316539384791522e-11,COMPLETE
383,0.028585423715412617,0.0016984591202344745,0.9828810886675867,2023-06-08 22:47:36.128837,2023-06-08 22:58:45.734038,0 days 00:11:09.605201,3.2115526205113506e-05,manet,31,huber,1.761697190536656e-06,COMPLETE
384,0.024617336224764585,0.0012227091938257217,0.9717216882676735,2023-06-08 22:47:47.929177,2023-06-08 23:00:57.110937,0 days 00:13:09.181760,5.7191946262312554e-05,manet,26,huber,2.14552860785898e-06,COMPLETE
385,0.031485503539443016,0.002087082830257714,1.0059085274433337,2023-06-08 22:51:46.604924,2023-06-08 23:08:00.072490,0 days 00:16:13.467566,1.0844036057214204e-05,unet,10,huber,3.6064165957175017e-12,COMPLETE
386,0.021673827432096004,0.0010818797600222751,0.960986319747005,2023-06-08 22:52:26.263004,2023-06-08 23:02:00.630198,0 days 00:09:34.367194,0.0013386083099038116,unet,30,huber,0.0003922134656998976,COMPLETE
387,0.05185939744114876,0.0059996627969667315,1.0589482978038038,2023-06-08 22:55:17.507929,2023-06-08 23:08:58.985235,0 days 00:13:41.477306,3.4632252590887256e-05,fpn,26,huber,2.266909980172947e-06,COMPLETE
388,0.03700606618076563,0.0033830726169981062,1.0560035747271048,2023-06-08 22:56:11.537964,2023-06-08 23:00:36.721752,0 days 00:04:25.183788,0.0004014875460233878,deeplabv3,10,huber,1.4138026324717449e-09,COMPLETE
389,0.06029991712421179,0.0060050435131415725,1.1188760582561672,2023-06-08 22:56:30.435813,2023-06-08 23:14:09.091919,0 days 00:17:38.656106,3.15569254939727e-06,deeplabv3,11,huber,7.122170418869596e-12,COMPLETE
390,0.08036695048213005,0.010106011759489775,1.2043239883810617,2023-06-08 22:56:44.851625,2023-06-08 23:11:35.620601,0 days 00:14:50.768976,1.083207895225388e-05,fpn,9,huber,1.4512675703996962e-09,COMPLETE
391,0.029610369820147753,0.002352197072468698,1.0146372215400064,2023-06-08 22:57:08.177235,2023-06-08 23:11:50.189079,0 days 00:14:42.011844,0.000742185360060826,fpn,10,huber,1.9374828822102747e-06,COMPLETE
392,0.033618269488215446,0.002584730042144656,1.0105280531358305,2023-06-08 22:58:45.805130,2023-06-08 23:07:24.969647,0 days 00:08:39.164517,2.2011680208819785e-05,unet,11,huber,2.2758268562515488e-06,COMPLETE
393,0.17820565402507782,0.051943713799118996,2.1553027941584664,2023-06-08 23:00:36.790114,2023-06-08 23:07:20.005676,0 days 00:06:43.215562,1.9650394368042177e-06,fpn,11,huber,0.0004197651991431798,COMPLETE
394,0.03048717323690653,0.0024051328073255718,1.0183988068354606,2023-06-08 23:00:57.181120,2023-06-08 23:14:13.446834,0 days 00:13:16.265714,0.0007171264555832313,fpn,11,huber,7.543293094251576e-12,COMPLETE
395,0.06404246110469103,0.005176805192604661,1.105292062684265,2023-06-08 23:02:00.700564,2023-06-08 23:14:40.186222,0 days 00:12:39.485658,2.1841534070581423e-05,fpn,11,huber,1.6559162455906393e-08,COMPLETE
396,0.02183070918545127,0.0010323833412257954,0.9629471265749239,2023-06-08 23:07:20.075047,2023-06-08 23:13:20.081279,0 days 00:06:00.006232,0.004190819784672308,manet,34,huber,1.1560401031176619e-08,COMPLETE
397,0.023062616121023893,0.0010501767246751115,0.9659648071013622,2023-06-08 23:07:25.039731,2023-06-08 23:17:55.039693,0 days 00:10:29.999962,7.298758671907697e-05,manet,9,huber,1.3220232868003638e-08,COMPLETE
398,0.021371733862906694,0.0009706242854008451,0.9619360090392517,2023-06-08 23:08:00.148523,2023-06-08 23:14:36.927329,0 days 00:06:36.778806,0.004212773716508282,manet,7,huber,1.2913190529313111e-08,COMPLETE
399,0.0214852225035429,0.0009578103927196935,0.9619657681328169,2023-06-08 23:08:59.059419,2023-06-08 23:18:44.079342,0 days 00:09:45.019923,0.0008168330792686958,manet,35,huber,2.7518793954188313e-05,COMPLETE
400,0.0209616981446743,0.0010175578790949658,0.960793723808192,2023-06-08 23:09:48.350247,2023-06-08 23:16:00.844756,0 days 00:06:12.494509,0.004331385103312165,manet,6,huber,1.4528039214138621e-12,COMPLETE
401,0.1116686649620533,0.03139737620949745,2.5864479592482246,2023-06-08 23:11:35.690683,2023-06-08 23:27:06.816440,0 days 00:15:31.125757,1.4444976019613455e-06,manet,35,huber,1.2179893570485109e-08,COMPLETE
402,0.02088804403319955,0.0009685405238997191,0.9606003890132269,2023-06-08 23:11:50.271488,2023-06-08 23:18:02.322455,0 days 00:06:12.050967,0.004255407632070352,manet,6,huber,1.3712225766252647e-12,COMPLETE
403,0.020707792602479458,0.0009927434875862673,0.9616937804696941,2023-06-08 23:13:20.156832,2023-06-08 23:22:46.367226,0 days 00:09:26.210394,0.0024291077725245975,manet,6,huber,1.481696947570452e-12,COMPLETE
404,0.021606458351016045,0.0010732906230259687,0.9635870707477594,2023-06-08 23:14:09.162799,2023-06-08 23:29:37.623298,0 days 00:15:28.460499,0.0005391095922850655,manet,70,huber,1.1239295713226232e-10,COMPLETE
405,0.021147024352103472,0.0009434417297597975,0.9628885173644678,2023-06-08 23:14:13.521332,2023-06-08 23:23:43.945152,0 days 00:09:30.423820,0.00030388955924361263,manet,6,huber,1.8629640617836383e-08,COMPLETE
406,0.11387384124100208,0.02395331161096692,48.24108070618449,2023-06-08 23:14:36.997753,2023-06-08 23:17:38.739345,0 days 00:03:01.741592,0.0005078628839074884,manet,112,huber,7.490382017056754e-09,COMPLETE
407,0.10656006075441837,0.02224572654813528,403.07881131891133,2023-06-08 23:14:40.258553,2023-06-08 23:17:43.153320,0 days 00:03:02.894767,5.01857104044461e-06,manet,70,huber,1.3291977372131928e-07,COMPLETE
408,0.039004623889923096,0.003498217847663909,1.039729150863681,2023-06-08 23:16:00.916021,2023-06-08 23:33:26.419377,0 days 00:17:25.503356,6.085439904668201e-06,manet,6,huber,1.436939444415393e-07,COMPLETE
409,0.021018467377871275,0.0009965502977138385,0.9612907536672269,2023-06-08 23:17:38.809754,2023-06-08 23:31:47.005406,0 days 00:14:08.195652,0.0003246043836138477,manet,6,huber,2.289114158425569e-10,COMPLETE
410,0.020999531727284193,0.0009457170817768201,0.9610006399594139,2023-06-08 23:17:43.223973,2023-06-08 23:24:22.663119,0 days 00:06:39.439146,0.0025116311605272753,manet,7,huber,1.815933788782372e-05,COMPLETE
