number,values_0,values_1,values_2,datetime_start,datetime_complete,duration,params_learning_rate,params_model_name,params_train_batch_size,params_training_loss,params_weight_decay,state
205,0.02040529390797019,0.0010497571638552472,0.9592078241609111,2023-06-08 19:09:33.808119,2023-06-08 19:28:15.424683,0 days 00:18:41.616564,0.0052529729963021994,manet,36,huber,2.3181601568126005e-05,COMPLETE
206,0.027435066178441048,0.0019092732691206038,0.982574890191405,2023-06-08 19:10:15.408228,2023-06-08 19:36:58.570846,0 days 00:26:43.162618,1.2547287569234784e-05,manet,14,huber,1.1442568091609756e-09,COMPLETE
207,0.02083447715267539,0.0010588207514956594,0.9593839654856229,2023-06-08 19:11:46.843504,2023-06-08 19:20:50.755360,0 days 00:09:03.911856,0.004553351545933158,manet,15,huber,2.0122801165472386e-08,COMPLETE
208,0.02074327925220132,0.0009661516960477456,0.9601077680958094,2023-06-08 19:12:14.818031,2023-06-08 19:22:15.829682,0 days 00:10:01.011651,0.0053939491430205835,manet,18,huber,3.2873843556961397e-06,COMPLETE
209,0.06052774377167225,0.006033432437106967,1.2632378942541878,2023-06-08 19:13:49.002440,2023-06-08 19:37:10.402627,0 days 00:23:21.400187,2.9396463512474652e-06,manet,14,huber,1.2111057272793445e-05,COMPLETE
210,0.02085289917886257,0.0010909998381976038,0.9601864417981136,2023-06-08 19:15:14.938560,2023-06-08 19:24:39.884592,0 days 00:09:24.946032,0.004929231473735243,manet,17,huber,1.7375301206544526e-08,COMPLETE
211,0.02076146425679326,0.0010301959118805826,0.959153245033568,2023-06-08 19:15:18.358906,2023-06-08 19:24:27.903689,0 days 00:09:09.544783,0.0053992040301472565,manet,14,huber,2.0132989472855305e-08,COMPLETE
212,0.021014099940657616,0.0010250998311676085,0.9604073351245744,2023-06-08 19:17:34.030878,2023-06-08 19:26:31.046350,0 days 00:08:57.015472,0.009621485382501422,manet,18,huber,3.583170991476837e-08,COMPLETE
213,0.023677274119108915,0.0011275133583694696,0.9681868550477457,2023-06-08 19:18:41.385007,2023-06-08 19:31:01.342619,0 days 00:12:19.957612,0.00011032388136594871,manet,44,huber,1.858578818486356e-08,COMPLETE
214,0.028232879005372524,0.0016892115527298301,0.9849670078947754,2023-06-08 19:19:10.077378,2023-06-08 19:30:11.625350,0 days 00:11:01.547972,3.8736011035147015e-05,manet,17,huber,0.0008075931818781467,COMPLETE
215,0.022746887523680925,0.0011903190606972203,0.967196986023805,2023-06-08 19:20:50.825006,2023-06-08 19:29:27.913930,0 days 00:08:37.088924,0.00017931959300532222,manet,14,huber,1.2372289733943247e-09,COMPLETE
216,0.030120220966637135,0.0021759897645097226,0.9939330164772502,2023-06-08 19:22:15.884422,2023-06-08 19:40:13.126669,0 days 00:17:57.242247,1.2295426931917846e-05,manet,4,huber,0.0009949406913903971,COMPLETE
217,0.02087851846590638,0.0009459623834118247,0.9608640461164993,2023-06-08 19:24:27.957057,2023-06-08 19:38:57.005157,0 days 00:14:29.048100,0.00018951769554072877,manet,5,huber,0.0009969718544696855,COMPLETE
218,0.02036453690379858,0.0008887000440154225,0.9596375105731189,2023-06-08 19:24:39.940487,2023-06-08 19:50:33.208583,0 days 00:25:53.268096,0.00019197752531400803,manet,5,huber,4.240540292413744e-08,COMPLETE
219,0.02099380036816001,0.0010621728142723441,0.9613125183995307,2023-06-08 19:26:31.100847,2023-06-08 19:32:56.895958,0 days 00:06:25.795111,0.0035222665638179286,manet,4,huber,0.00020556191382345407,COMPLETE
220,0.02133920742198825,0.0010925935639534146,0.9617409006761988,2023-06-08 19:28:15.482967,2023-06-08 19:37:18.806360,0 days 00:09:03.323393,0.006672398191526947,manet,48,huber,1.1226710437831645e-05,COMPLETE
221,0.02157972427085042,0.0011409056751290336,0.9600544291525601,2023-06-08 19:29:27.968348,2023-06-08 19:40:26.120406,0 days 00:10:58.152058,0.006927768481987893,manet,45,huber,0.00017740235870625497,COMPLETE
222,0.021389780566096306,0.0010372573015047237,0.9619507947340924,2023-06-08 19:30:11.681849,2023-06-08 19:41:32.883330,0 days 00:11:21.201481,0.0034500968025287775,manet,44,huber,0.00016645859578411323,COMPLETE
223,0.0217417161911726,0.0011812147567979991,0.9614762262746435,2023-06-08 19:31:01.399321,2023-06-08 19:40:00.195706,0 days 00:08:58.796385,0.006134305569696674,manet,47,huber,1.231536474625494e-05,COMPLETE
224,0.021149616222828627,0.0011100692936452106,0.9605728466679232,2023-06-08 19:32:56.953818,2023-06-08 19:42:04.605130,0 days 00:09:07.651312,0.006340523062269397,manet,27,huber,0.0005890415129729809,COMPLETE
225,0.1073418352752924,0.02242571534588933,188.16201470650577,2023-06-08 19:36:58.630536,2023-06-08 19:40:02.687284,0 days 00:03:04.056748,6.081651394099209e-06,manet,73,huber,0.00021405691163948288,COMPLETE
226,0.021171615924686193,0.0010948239068966359,0.9623549908937592,2023-06-08 19:37:10.462469,2023-06-08 19:49:28.957054,0 days 00:12:18.494585,0.006732109227392437,manet,72,huber,0.00017268201186510082,COMPLETE
227,0.022079838439822197,0.0009252944291802123,0.9638030801276458,2023-06-08 19:37:18.862145,2023-06-08 19:46:42.971972,0 days 00:09:24.109827,0.007693381601771678,manet,74,huber,0.00014225721887747156,COMPLETE
228,0.021211944054812193,0.0009968522936105728,0.9606399606090422,2023-06-08 19:38:57.073926,2023-06-08 19:47:36.529299,0 days 00:08:39.455373,0.006762983098842192,manet,35,huber,3.0521183311218386e-06,COMPLETE
229,0.02086021564900875,0.0009733325641718693,0.961523868096525,2023-06-08 19:40:00.251931,2023-06-08 19:47:16.532721,0 days 00:07:16.280790,0.007170450985267468,manet,9,huber,3.730888229909511e-06,COMPLETE
230,0.020401697605848312,0.0010719449492171407,0.9602722685275193,2023-06-08 19:40:02.745625,2023-06-08 19:56:29.472466,0 days 00:16:26.726841,0.007477693571017492,manet,28,huber,0.0002661700004188424,COMPLETE
231,0.022900936659425497,0.0011471081816125661,0.9678912606054456,2023-06-08 19:40:13.185102,2023-06-08 19:46:09.720520,0 days 00:05:56.535418,0.007789306612666166,manet,26,huber,0.0001571609432325298,COMPLETE
232,0.0212754406966269,0.000978850104729645,0.9606889922829884,2023-06-08 19:40:26.176284,2023-06-08 19:49:09.140997,0 days 00:08:42.964713,0.0036781582643290994,manet,29,huber,2.281443383019345e-06,COMPLETE
233,0.021127015817910433,0.0008895096107153222,0.960997632801181,2023-06-08 19:41:32.943242,2023-06-08 19:48:27.224495,0 days 00:06:54.281253,0.004951967887609682,manet,9,huber,3.007488228792895e-06,COMPLETE
234,0.03201480722054839,0.0019654353382065892,0.998936699418786,2023-06-08 19:42:04.667748,2023-06-08 19:52:39.135014,0 days 00:10:34.467266,2.2026399483331386e-05,manet,30,huber,3.687344613379582e-05,COMPLETE
235,0.020313972607254982,0.0009667889244155958,0.9592968628377097,2023-06-08 19:46:09.782097,2023-06-08 20:03:07.307658,0 days 00:16:57.525561,0.003613170920693334,manet,33,huber,0.00030441382159980654,COMPLETE
236,0.02127347607165575,0.000959289594902657,0.9636365686679463,2023-06-08 19:46:43.034108,2023-06-08 19:55:01.583959,0 days 00:08:18.549851,0.004716174388101555,manet,36,huber,0.00029012750122315965,COMPLETE
237,0.15430057421326637,0.041357869282364845,70330.41985068932,2023-06-08 19:47:16.587936,2023-06-08 19:50:18.317590,0 days 00:03:01.729654,2.8457017723008667e-06,manet,57,huber,9.844207446700212e-05,COMPLETE
238,0.02114666299894452,0.000987212115433067,0.9598700622284995,2023-06-08 19:47:36.597303,2023-06-08 19:55:21.781768,0 days 00:07:45.184465,0.0004814269340909416,manet,10,huber,3.742656394949792e-05,COMPLETE
239,0.021931546740233898,0.0009918911091517657,0.9628083695283891,2023-06-08 19:48:27.281371,2023-06-08 19:57:41.598017,0 days 00:09:14.316646,0.004674875100207522,manet,64,huber,1.4941869796743021e-05,COMPLETE
240,0.020662214141339064,0.0009743473201524466,0.9584674359508121,2023-06-08 19:49:09.197711,2023-06-08 19:56:51.317695,0 days 00:07:42.119984,0.00494998639041136,manet,10,huber,1.7975858826900843e-07,COMPLETE
241,0.022378915920853615,0.0013722821895498782,0.9625588989632019,2023-06-08 19:49:29.016996,2023-06-08 19:57:21.037502,0 days 00:07:52.020506,0.009998905964370574,manet,63,huber,7.557382976495687e-05,COMPLETE
242,0.022197906393557787,0.0011223052424611524,0.9634548566038598,2023-06-08 19:50:18.375352,2023-06-08 19:59:25.037128,0 days 00:09:06.661776,0.00046412310298035237,manet,37,huber,7.325197050923311e-05,COMPLETE
243,0.0394841069355607,0.0033385002170689404,1.0616688352589807,2023-06-08 19:50:33.268484,2023-06-08 19:55:25.427519,0 days 00:04:52.159035,0.00013185767766807843,deeplabv3,8,huber,3.226397798203326e-08,COMPLETE
244,0.022667699959129095,0.001064273397787474,0.9637459908831072,2023-06-08 19:52:39.194620,2023-06-08 20:02:14.550081,0 days 00:09:35.355461,0.00013179002944928894,unet,9,xtanh,3.8711560860474376e-08,COMPLETE
245,0.03786851279437542,0.003077700443100184,1.0550885066427076,2023-06-08 19:55:01.642915,2023-06-08 20:01:55.918892,0 days 00:06:54.275977,0.0003563889401019032,deeplabv3,8,mae,3.0703338793129473e-08,COMPLETE
246,0.04126731026917696,0.003604702476877719,1.0599869090355205,2023-06-08 19:55:21.840467,2023-06-08 20:00:45.910126,0 days 00:05:24.069659,0.0001345779090531944,deeplabv3,7,xtanh,7.86163349788236e-08,COMPLETE
247,0.023214091081172228,0.001098889420973137,0.9660369782121366,2023-06-08 19:55:25.491612,2023-06-08 20:04:20.904632,0 days 00:08:55.413020,0.00015948950490682565,unet,6,mae,6.606160394566162e-08,COMPLETE
248,0.03893654327839613,0.003621062613092363,1.0608641441831783,2023-06-08 19:56:29.548948,2023-06-08 20:01:59.187572,0 days 00:05:29.638624,0.0001570208575535773,deeplabv3,6,mae,7.262293922727088e-08,COMPLETE
249,0.02128471154719591,0.0010229734907625243,0.9624202629948189,2023-06-08 19:56:51.374373,2023-06-08 20:09:35.360775,0 days 00:12:43.986402,0.00043492971677649674,unet,7,mae,5.4995354485747327e-08,COMPLETE
250,0.037145333364605904,0.0032001350773498416,1.0575373896676816,2023-06-08 19:57:21.096451,2023-06-08 20:04:11.826105,0 days 00:06:50.729654,0.00014886959882264678,deeplabv3,4,xtanh,7.096314782580391e-08,COMPLETE
251,0.03998568281531334,0.00376408634474501,1.064681440444213,2023-06-08 19:57:41.657563,2023-06-08 20:03:11.953502,0 days 00:05:30.295939,6.333401371831689e-05,deeplabv3,6,mae,8.07036950421028e-08,COMPLETE
252,0.021457618102431297,0.0011027462896890938,0.9613711840984289,2023-06-08 19:59:25.101613,2023-06-08 20:20:07.822506,0 days 00:20:42.720893,0.00015730504149955485,unet,6,mae,1.0349808337413048e-07,COMPLETE
253,0.021917419973760843,0.0009949297091225162,0.9633073500826457,2023-06-08 20:00:45.967851,2023-06-08 20:15:48.259220,0 days 00:15:02.291369,8.67810425895889e-05,manet,4,mae,4.375765483857367e-08,COMPLETE
254,0.022916697431355715,0.0011484359274618328,0.965664389303374,2023-06-08 20:01:55.976342,2023-06-08 20:09:41.353470,0 days 00:07:45.377128,0.0001601700399693998,unet,6,huber,4.6910276591270664e-08,COMPLETE
255,0.020902943331748247,0.0009891344961943105,0.96193660712352,2023-06-08 20:01:59.246215,2023-06-08 20:11:57.039978,0 days 00:09:57.793763,0.0002756475903431234,manet,4,huber,6.192455135044094e-08,COMPLETE
256,0.02305676694959402,0.0011024900013580918,0.9665369710957913,2023-06-08 20:02:14.610482,2023-06-08 20:17:08.893644,0 days 00:14:54.283162,6.182855567347146e-05,manet,4,huber,1.1335044655401979e-07,COMPLETE
257,0.024180438369512558,0.0012574961874634027,0.9697197731997187,2023-06-08 20:03:07.367569,2023-06-08 20:19:42.821198,0 days 00:16:35.453629,6.10444086699391e-05,manet,32,huber,5.772748282375755e-08,COMPLETE
258,0.02220054203644395,0.0009987578814616427,0.963451726021698,2023-06-08 20:03:12.022681,2023-06-08 20:18:40.240913,0 days 00:15:28.218232,0.00017425119286798623,manet,37,huber,0.0003141508266402712,COMPLETE
259,0.02417447231709957,0.0011882632388733327,0.9708415924280481,2023-06-08 20:04:11.884761,2023-06-08 20:09:44.453493,0 days 00:05:32.568732,0.00025082493637105185,manet,29,huber,0.00033198940427979484,COMPLETE
260,0.025414036121219397,0.0013538592029362917,0.9738067174172967,2023-06-08 20:04:20.964277,2023-06-08 20:20:57.176031,0 days 00:16:36.211754,4.3023693370305085e-05,manet,32,huber,0.0003138472101711191,COMPLETE
261,0.024880349170416594,0.0012675184989348054,0.9729996103070064,2023-06-08 20:09:35.421507,2023-06-08 20:15:05.825219,0 days 00:05:30.403712,0.0002756280976221434,manet,33,huber,0.00029511724305940205,COMPLETE
262,0.02534093474969268,0.0013570203154813498,0.9750497802409155,2023-06-08 20:09:41.411750,2023-06-08 20:17:57.019348,0 days 00:08:15.607598,9.478283785894474e-05,manet,33,huber,1.65356875451869e-07,COMPLETE
263,0.022437510080635548,0.0010597198706818745,0.9641115252713802,2023-06-08 20:09:44.514342,2023-06-08 20:19:23.174312,0 days 00:09:38.659970,0.0002784268234475895,manet,32,huber,1.888450935061889e-07,COMPLETE
264,0.024349110666662455,0.0012176984455436468,0.9685911487330852,2023-06-08 20:11:57.099165,2023-06-08 20:22:49.477044,0 days 00:10:52.377879,9.562564942870745e-05,manet,33,huber,1.8852116437896308e-07,COMPLETE
265,0.037271847017109394,0.002305279078427702,1.0353305734458726,2023-06-08 20:15:05.883877,2023-06-08 20:25:07.800206,0 days 00:10:01.916329,1.6042923960394245e-05,manet,32,huber,2.1665092592116204e-12,COMPLETE
266,0.026791284326463938,0.001483315194491297,0.9761872644127343,2023-06-08 20:15:48.321660,2023-06-08 20:33:36.735267,0 days 00:17:48.413607,3.5589059557402624e-05,manet,30,huber,1.4072843063980855e-07,COMPLETE
267,0.04582523833960295,0.004201854579150677,1.1033560038986228,2023-06-08 20:17:08.953764,2023-06-08 20:32:08.093662,0 days 00:14:59.139898,6.9601939934364545e-06,manet,33,huber,1.871626476249031e-10,COMPLETE
268,0.02479478856548667,0.0011624523322097957,0.9715125863439296,2023-06-08 20:17:57.079760,2023-06-08 20:24:12.113723,0 days 00:06:15.033963,0.00020488018033488158,manet,31,huber,8.273076689748484e-11,COMPLETE
269,0.027007057797163725,0.0015226441319100559,0.9797226003023269,2023-06-08 20:18:40.300202,2023-06-08 20:34:57.938493,0 days 00:16:17.638291,3.65766654826526e-05,manet,32,huber,0.0005694964842135983,COMPLETE
270,0.045950211584568024,0.004003302368801087,1.1001335928721907,2023-06-08 20:19:23.235662,2023-06-08 20:34:41.082881,0 days 00:15:17.847219,7.0239153711716594e-06,manet,33,huber,0.0005989478699535356,COMPLETE
271,0.025300566107034683,0.001300578616792336,0.9738996161369317,2023-06-08 20:19:42.894517,2023-06-08 20:36:35.298919,0 days 00:16:52.404402,4.659623798112093e-05,manet,34,huber,0.0006190144341823603,COMPLETE
272,0.026836940553039312,0.00135252348263748,0.9792848590420151,2023-06-08 20:20:07.883711,2023-06-08 20:36:46.812225,0 days 00:16:38.928514,3.527197045389394e-05,manet,37,huber,1.6256064982503427e-10,COMPLETE
273,0.04555824305862188,0.005893730325624347,1.0821177244460323,2023-06-08 20:20:57.235760,2023-06-08 20:36:57.730009,0 days 00:16:00.494249,6.7045362154782896e-06,manet,36,huber,4.222078642263625e-09,COMPLETE
274,0.03143011126667261,0.0017416321206837893,1.0147782584865752,2023-06-08 20:22:49.537138,2023-06-08 20:35:58.365824,0 days 00:13:08.828686,2.506176142877385e-05,manet,37,huber,0.0005589576409999777,COMPLETE
275,0.02351677417755127,0.0012020907597616315,0.9678923026201989,2023-06-08 20:24:12.173867,2023-06-08 20:54:12.621392,0 days 00:30:00.447525,2.5546948294073348e-05,manet,10,huber,0.0005580045455686831,COMPLETE
276,0.02158338064327836,0.0011088521569035947,0.9619337966411383,2023-06-08 20:25:07.862205,2023-06-08 20:34:23.357697,0 days 00:09:15.495492,0.0008235887521415993,manet,36,huber,4.28572815406164e-09,COMPLETE
277,0.02483539469540119,0.001306468853726983,0.9736950936018609,2023-06-08 20:32:08.155820,2023-06-08 21:03:21.349744,0 days 00:31:13.193924,2.512560752613976e-05,manet,36,huber,6.189834864623898e-12,COMPLETE
278,0.02280870359390974,0.0011847624846268445,0.9663449412348827,2023-06-08 20:33:36.795270,2023-06-08 21:01:00.929648,0 days 00:27:24.134378,2.857862265992878e-05,manet,10,huber,7.702458388267354e-10,COMPLETE
279,0.022415632382035255,0.0011104164295829833,0.9656743066321414,2023-06-08 20:34:23.432778,2023-06-08 21:01:38.477637,0 days 00:27:15.044859,3.2716030904955586e-05,manet,9,huber,0.000642347936375332,COMPLETE
280,0.02188187465071678,0.0010820043098647147,0.963013187212114,2023-06-08 20:34:41.144935,2023-06-08 20:41:08.884303,0 days 00:06:27.739368,0.0003998578644707747,manet,10,huber,3.187565721661718e-07,COMPLETE
281,0.025114483200013638,0.0015537809231318533,0.9728328761648324,2023-06-08 20:34:58.001338,2023-06-08 20:51:15.222441,0 days 00:16:17.221103,2.835387127438797e-05,manet,10,huber,8.603658744541084e-09,COMPLETE
282,0.021422885823994875,0.0010031438432633877,0.9627783325298321,2023-06-08 20:35:58.425483,2023-06-08 20:43:13.779637,0 days 00:07:15.354154,0.0006254442900900909,manet,11,huber,1.6661341710366263e-06,COMPLETE
283,0.02192142838612199,0.0009398889378644526,0.9631717995198125,2023-06-08 20:36:35.361510,2023-06-08 20:43:29.350339,0 days 00:06:53.988829,0.0003276172061585657,manet,10,huber,8.44874451623507e-09,COMPLETE
284,0.02171273296698928,0.0010426416993141174,0.9637366976930444,2023-06-08 20:36:46.881725,2023-06-08 20:44:05.157316,0 days 00:07:18.275591,0.0005401000040996448,manet,10,huber,8.369772767802332e-09,COMPLETE
285,0.021256796084344387,0.00098641641670838,0.9622842440886838,2023-06-08 20:36:57.791251,2023-06-08 20:44:17.044578,0 days 00:07:19.253327,0.0006060142208044935,manet,10,huber,7.458438031648248e-09,COMPLETE
286,0.0215140487998724,0.0010138573707081378,0.9618922747549842,2023-06-08 20:41:08.946377,2023-06-08 20:48:08.376182,0 days 00:06:59.429805,0.0003525541381164319,manet,9,huber,4.876838032685281e-12,COMPLETE
287,0.021468475461006165,0.0010505872196517885,0.9608628553874853,2023-06-08 20:43:13.841314,2023-06-08 20:51:07.157602,0 days 00:07:53.316288,0.0005480374334285983,manet,10,huber,3.705174009549604e-12,COMPLETE
288,0.03126660827547312,0.0019925502128899097,0.9956502973612427,2023-06-08 20:43:29.414188,2023-06-08 21:02:46.796795,0 days 00:19:17.382607,1.8538432016325492e-05,manet,41,huber,5.131912477082438e-12,COMPLETE
289,0.03058720100671053,0.0018303286924492568,0.9916322860608242,2023-06-08 20:44:05.217183,2023-06-08 21:03:47.146972,0 days 00:19:41.929789,1.0290287235192779e-05,manet,9,huber,1.2768077322385996e-08,COMPLETE
290,0.021666559856384993,0.0010644120920915157,0.9613880054459917,2023-06-08 20:44:17.105787,2023-06-08 21:07:30.046960,0 days 00:23:12.941173,0.000105990925470963,manet,9,huber,2.4216693833931094e-08,COMPLETE
291,0.021275834646075964,0.0010230295156361535,0.9624920823968464,2023-06-08 20:48:08.437375,2023-06-08 20:55:40.320957,0 days 00:07:31.883582,0.0007733989245982469,manet,9,huber,2.5278041476707227e-08,COMPLETE
292,0.02815094217658043,0.00169676702353172,0.9833296007297407,2023-06-08 20:51:07.218817,2023-06-08 21:05:16.478367,0 days 00:14:09.259550,1.6802402379256453e-05,manet,9,huber,7.501298451047868e-12,COMPLETE
293,0.022157725878059864,0.0010594602063065395,0.9638456298147418,2023-06-08 20:51:15.290154,2023-06-08 21:04:41.425920,0 days 00:13:26.135766,0.0001098404040954099,manet,12,huber,3.464228750936963e-10,COMPLETE
294,0.02166379289701581,0.0009554642310831696,0.9624463699202757,2023-06-08 20:54:12.686269,2023-06-08 21:11:48.781437,0 days 00:17:36.095168,0.00010975757269346649,manet,12,huber,1.4001698431115646e-08,COMPLETE
295,0.023162533063441515,0.001292440021643415,0.9643340768996921,2023-06-08 20:55:40.385151,2023-06-08 21:03:37.909559,0 days 00:07:57.524408,0.00021252359302576998,manet,28,huber,4.260286084989449e-10,COMPLETE
296,0.021193576510995626,0.0009795310179470107,0.9594178977284209,2023-06-08 21:01:00.999945,2023-06-08 21:08:39.264396,0 days 00:07:38.264451,0.0009500155279492087,manet,13,huber,3.1027473140804014e-09,COMPLETE
297,0.02383444644510746,0.0013047269312664866,0.969892599611431,2023-06-08 21:01:38.554340,2023-06-08 21:28:01.220030,0 days 00:26:22.665690,2.0255109885688878e-05,manet,13,huber,3.1543070679264654e-09,COMPLETE
298,0.02379458863288164,0.0021445705206133425,0.9701135870293547,2023-06-08 21:02:46.860599,2023-06-08 21:20:37.334863,0 days 00:17:50.474264,4.784489324181616e-05,manet,12,huber,1.9282543151074834e-12,COMPLETE
299,0.025289508514106274,0.0013245149748399854,0.9737315255419076,2023-06-08 21:03:21.414398,2023-06-08 21:20:06.385824,0 days 00:16:44.971426,4.433296923395075e-05,manet,28,huber,1.5006836726617576e-05,COMPLETE
300,0.025943761691451073,0.0013214234204497188,0.9748783454012304,2023-06-08 21:03:37.971959,2023-06-08 21:26:57.104472,0 days 00:23:19.132513,1.6723850580287294e-05,manet,13,huber,2.857968426645136e-09,COMPLETE
301,0.02602924220263958,0.0014990245108492672,0.9773200166631552,2023-06-08 21:03:47.207803,2023-06-08 21:10:28.840440,0 days 00:06:41.632637,7.695486810037324e-05,manet,13,huber,2.3654786859669514e-12,COMPLETE
302,0.02139626443386078,0.0009762606641743332,0.9617146303868033,2023-06-08 21:04:41.489279,2023-06-08 21:11:15.594840,0 days 00:06:34.105561,0.0009673742011262714,manet,7,huber,3.1310560437794927e-09,COMPLETE
303,0.021923246793448925,0.0010809536324813962,0.9639585667873386,2023-06-08 21:05:16.541542,2023-06-08 21:33:32.302483,0 days 00:28:15.760941,4.1440124007384205e-05,manet,7,huber,3.4311312586533887e-06,COMPLETE
304,0.020825857762247324,0.0009650795109337196,0.959082488820737,2023-06-08 21:07:30.111657,2023-06-08 21:16:37.082672,0 days 00:09:06.971015,0.0009094435230558817,manet,13,logcosh,9.687216377801389e-06,COMPLETE
305,0.02098121540620923,0.0009647677943576127,0.9607847728293902,2023-06-08 21:08:39.326103,2023-06-08 21:15:09.645198,0 days 00:06:30.319095,0.0014382558547966931,manet,7,logcosh,1.0556678741758998e-06,COMPLETE
306,0.03659837320446968,0.003362974908668548,1.0565684728024909,2023-06-08 21:10:28.900173,2023-06-08 21:15:30.713994,0 days 00:05:01.813821,0.0003173945312120777,pspnet,7,huber,1.9010313394827057e-05,COMPLETE
307,0.03899876866489649,0.003466075344476849,1.0665043985470715,2023-06-08 21:11:15.672480,2023-06-08 21:19:01.493682,0 days 00:07:45.821202,4.520017675183294e-05,pspnet,29,huber,1.0469459228936956e-06,COMPLETE
