[32m[I 2023-05-15 16:59:37,805][0m Trial 11 finished with values: [14.390658438160925, 18.136977171538135, 5.296075636738638] and parameters: {'learning_rate': 4.233640369528075e-06, 'norm': 'minmax', 'weight_decay': 1.3593864166890444e-08, 'train_batch_size': 100, 'training_loss': 'xtanh', 'model_name': 'linknet'}. [0m
INFO:echo.src.base_objective:Attempting to automatically update the model configuration using optuna's suggested parameters
INFO:echo.src.base_objective:	data:norm : zscore
INFO:echo.src.base_objective:	model:name : deeplabv3
INFO:echo.src.base_objective:	optimizer:learning_rate : 3.105070451051848e-05
INFO:echo.src.base_objective:	trainer:train_batch_size : 15
INFO:echo.src.base_objective:	trainer:weight_decay : 7.745572074213735e-11
INFO:echo.src.base_objective:	trainer:training_loss : smooth
INFO:echo.src.base_objective:Beginning trial 13
INFO:root:Loading model deeplabv3 with settings {'in_channels': 4, 'classes': 1, 'activation': 'sigmoid'}
INFO:root:Loading loss smooth
INFO:root:Loading loss smooth
INFO:echo.src.base_objective:Saving trial 13 results to local file /glade/work/kdagon/s2sml/results_week3_SH_515/trial_results/trial_results_29809.gusched01.csv
INFO:echo.src.base_objective:Merging trial results and saving to /glade/work/kdagon/s2sml/results_week3_SH_515/trial_results.csv
[32m[I 2023-05-15 17:06:39,310][0m Trial 13 finished with values: [1.1583895964021194, 3.999411478251624, 2.227089189106744] and parameters: {'learning_rate': 3.105070451051848e-05, 'norm': 'zscore', 'weight_decay': 7.745572074213735e-11, 'train_batch_size': 15, 'training_loss': 'smooth', 'model_name': 'deeplabv3'}. [0m
INFO:echo.src.base_objective:Attempting to automatically update the model configuration using optuna's suggested parameters
INFO:echo.src.base_objective:	data:norm : minmax
INFO:echo.src.base_objective:	model:name : unet++
INFO:echo.src.base_objective:	optimizer:learning_rate : 1.5677007053129574e-05
INFO:echo.src.base_objective:	trainer:train_batch_size : 27
INFO:echo.src.base_objective:	trainer:weight_decay : 0.00024498892374286504
INFO:echo.src.base_objective:	trainer:training_loss : logcosh
INFO:echo.src.base_objective:Beginning trial 14
INFO:root:Loading model unet++ with settings {'in_channels': 4, 'classes': 1, 'activation': 'sigmoid'}
INFO:root:Loading loss smooth
INFO:root:Loading loss smooth
INFO:echo.src.base_objective:Saving trial 12 results to local file /glade/work/kdagon/s2sml/results_week3_SH_515/trial_results/trial_results_29810.gusched01.csv
INFO:echo.src.base_objective:Merging trial results and saving to /glade/work/kdagon/s2sml/results_week3_SH_515/trial_results.csv
[32m[I 2023-05-15 17:06:56,736][0m Trial 12 finished with values: [1.0491966878920613, 2.381939369027058, 1.791526048582354] and parameters: {'learning_rate': 0.00015242558663242106, 'norm': 'negone', 'weight_decay': 2.8803159499718976e-08, 'train_batch_size': 112, 'training_loss': 'huber', 'model_name': 'deeplabv3+'}. [0m
INFO:echo.src.base_objective:Attempting to automatically update the model configuration using optuna's suggested parameters
INFO:echo.src.base_objective:	data:norm : minmax
INFO:echo.src.base_objective:	model:name : linknet
INFO:echo.src.base_objective:	optimizer:learning_rate : 0.0013140189275691824
INFO:echo.src.base_objective:	trainer:train_batch_size : 32
INFO:echo.src.base_objective:	trainer:weight_decay : 6.66404587610107e-12
INFO:echo.src.base_objective:	trainer:training_loss : logcosh
INFO:echo.src.base_objective:Beginning trial 15
INFO:root:Loading model linknet with settings {'in_channels': 4, 'classes': 1, 'activation': 'sigmoid'}
INFO:root:Loading loss smooth
INFO:root:Loading loss smooth
INFO:echo.src.base_objective:Saving trial 15 results to local file /glade/work/kdagon/s2sml/results_week3_SH_515/trial_results/trial_results_29810.gusched01.csv
INFO:echo.src.base_objective:Merging trial results and saving to /glade/work/kdagon/s2sml/results_week3_SH_515/trial_results.csv
[32m[I 2023-05-15 17:12:36,926][0m Trial 15 finished with values: [0.9644200541049518, 0.4241069203515197, 0.7061618418334905] and parameters: {'learning_rate': 0.0013140189275691824, 'norm': 'minmax', 'weight_decay': 6.66404587610107e-12, 'train_batch_size': 32, 'training_loss': 'logcosh', 'model_name': 'linknet'}. [0m
INFO:echo.src.base_objective:Attempting to automatically update the model configuration using optuna's suggested parameters
INFO:echo.src.base_objective:	data:norm : zscore
INFO:echo.src.base_objective:	model:name : manet
INFO:echo.src.base_objective:	optimizer:learning_rate : 5.908628791025559e-06
INFO:echo.src.base_objective:	trainer:train_batch_size : 88
INFO:echo.src.base_objective:	trainer:weight_decay : 9.429939419508451e-12
INFO:echo.src.base_objective:	trainer:training_loss : xsigmoid
INFO:echo.src.base_objective:Beginning trial 16
INFO:root:Loading model manet with settings {'in_channels': 4, 'classes': 1, 'activation': 'sigmoid'}
INFO:root:Loading loss smooth
INFO:root:Loading loss smooth
INFO:echo.src.base_objective:Saving trial 14 results to local file /glade/work/kdagon/s2sml/results_week3_SH_515/trial_results/trial_results_29809.gusched01.csv
INFO:echo.src.base_objective:Merging trial results and saving to /glade/work/kdagon/s2sml/results_week3_SH_515/trial_results.csv
[32m[I 2023-05-15 17:29:07,106][0m Trial 14 finished with values: [0.966821141329495, 0.45299039346565506, 0.7489975928436254] and parameters: {'learning_rate': 1.5677007053129574e-05, 'norm': 'minmax', 'weight_decay': 0.00024498892374286504, 'train_batch_size': 27, 'training_loss': 'logcosh', 'model_name': 'unet++'}. [0m
INFO:echo.src.base_objective:Attempting to automatically update the model configuration using optuna's suggested parameters
INFO:echo.src.base_objective:	data:norm : negone
INFO:echo.src.base_objective:	model:name : linknet
INFO:echo.src.base_objective:	optimizer:learning_rate : 0.0003457321042763964
INFO:echo.src.base_objective:	trainer:train_batch_size : 41
INFO:echo.src.base_objective:	trainer:weight_decay : 5.4199806176227616e-05
INFO:echo.src.base_objective:	trainer:training_loss : mse
INFO:echo.src.base_objective:Beginning trial 17
INFO:root:Loading model linknet with settings {'in_channels': 4, 'classes': 1, 'activation': 'sigmoid'}
INFO:root:Loading loss smooth
INFO:root:Loading loss smooth
INFO:echo.src.base_objective:Saving trial 17 results to local file /glade/work/kdagon/s2sml/results_week3_SH_515/trial_results/trial_results_29809.gusched01.csv
INFO:echo.src.base_objective:Merging trial results and saving to /glade/work/kdagon/s2sml/results_week3_SH_515/trial_results.csv
[32m[I 2023-05-15 17:37:14,874][0m Trial 17 finished with values: [1.0016592574326926, 1.2224549317322821, 1.1360436393160467] and parameters: {'learning_rate': 0.0003457321042763964, 'norm': 'negone', 'weight_decay': 5.4199806176227616e-05, 'train_batch_size': 41, 'training_loss': 'mse', 'model_name': 'linknet'}. [0m
INFO:echo.src.base_objective:Attempting to automatically update the model configuration using optuna's suggested parameters
INFO:echo.src.base_objective:	data:norm : negone
INFO:echo.src.base_objective:	model:name : deeplabv3+
INFO:echo.src.base_objective:	optimizer:learning_rate : 0.004284001315474613
INFO:echo.src.base_objective:	trainer:train_batch_size : 118
INFO:echo.src.base_objective:	trainer:weight_decay : 1.3785591259245883e-10
INFO:echo.src.base_objective:	trainer:training_loss : xsigmoid
INFO:echo.src.base_objective:Beginning trial 18
INFO:root:Loading model deeplabv3+ with settings {'in_channels': 4, 'classes': 1, 'activation': 'sigmoid'}
INFO:root:Loading loss smooth
INFO:root:Loading loss smooth
INFO:echo.src.base_objective:Saving trial 18 results to local file /glade/work/kdagon/s2sml/results_week3_SH_515/trial_results/trial_results_29809.gusched01.csv
INFO:echo.src.base_objective:Merging trial results and saving to /glade/work/kdagon/s2sml/results_week3_SH_515/trial_results.csv
[32m[I 2023-05-15 17:44:14,990][0m Trial 18 finished with values: [1.0559549473184116, 1.3888936634130051, 1.185237740831705] and parameters: {'learning_rate': 0.004284001315474613, 'norm': 'negone', 'weight_decay': 1.3785591259245883e-10, 'train_batch_size': 118, 'training_loss': 'xsigmoid', 'model_name': 'deeplabv3+'}. [0m
INFO:echo.src.base_objective:Attempting to automatically update the model configuration using optuna's suggested parameters
INFO:echo.src.base_objective:	data:norm : None
INFO:echo.src.base_objective:	model:name : unet++
INFO:echo.src.base_objective:	optimizer:learning_rate : 3.392367579244501e-05
INFO:echo.src.base_objective:	trainer:train_batch_size : 101
INFO:echo.src.base_objective:	trainer:weight_decay : 1.999908269528814e-10
INFO:echo.src.base_objective:	trainer:training_loss : huber
INFO:echo.src.base_objective:Beginning trial 19
INFO:root:Loading model unet++ with settings {'in_channels': 4, 'classes': 1, 'activation': 'sigmoid'}
INFO:root:Loading loss smooth
INFO:root:Loading loss smooth
INFO:echo.src.base_objective:Saving trial 19 results to local file /glade/work/kdagon/s2sml/results_week3_SH_515/trial_results/trial_results_29809.gusched01.csv
INFO:echo.src.base_objective:Merging trial results and saving to /glade/work/kdagon/s2sml/results_week3_SH_515/trial_results.csv
[32m[I 2023-05-15 17:46:36,277][0m Trial 19 finished with values: [3.5020575766738267, 12103.943695057105, 162.65497410229793] and parameters: {'learning_rate': 3.392367579244501e-05, 'norm': 'None', 'weight_decay': 1.999908269528814e-10, 'train_batch_size': 101, 'training_loss': 'huber', 'model_name': 'unet++'}. [0m
INFO:echo.src.base_objective:Attempting to automatically update the model configuration using optuna's suggested parameters
INFO:echo.src.base_objective:	data:norm : zscore
INFO:echo.src.base_objective:	model:name : deeplabv3+
INFO:echo.src.base_objective:	optimizer:learning_rate : 0.00025523748005522323
INFO:echo.src.base_objective:	trainer:train_batch_size : 46
INFO:echo.src.base_objective:	trainer:weight_decay : 2.6863777644937942e-05
INFO:echo.src.base_objective:	trainer:training_loss : xtanh
INFO:echo.src.base_objective:Beginning trial 20
INFO:root:Loading model deeplabv3+ with settings {'in_channels': 4, 'classes': 1, 'activation': 'sigmoid'}
INFO:root:Loading loss smooth
INFO:root:Loading loss smooth
INFO:echo.src.base_objective:Saving trial 16 results to local file /glade/work/kdagon/s2sml/results_week3_SH_515/trial_results/trial_results_29810.gusched01.csv
INFO:echo.src.base_objective:Merging trial results and saving to /glade/work/kdagon/s2sml/results_week3_SH_515/trial_results.csv
[32m[I 2023-05-15 17:47:06,454][0m Trial 16 finished with values: [1.0636249460570713, 4.416827653305993, 2.419446688496439] and parameters: {'learning_rate': 5.908628791025559e-06, 'norm': 'zscore', 'weight_decay': 9.429939419508451e-12, 'train_batch_size': 88, 'training_loss': 'xsigmoid', 'model_name': 'manet'}. [0m
INFO:echo.src.base_objective:Attempting to automatically update the model configuration using optuna's suggested parameters
INFO:echo.src.base_objective:	data:norm : minmax
INFO:echo.src.base_objective:	model:name : unet
INFO:echo.src.base_objective:	optimizer:learning_rate : 9.210206335525336e-05
INFO:echo.src.base_objective:	trainer:train_batch_size : 103
INFO:echo.src.base_objective:	trainer:weight_decay : 3.1217644070305195e-11
INFO:echo.src.base_objective:	trainer:training_loss : mse
INFO:echo.src.base_objective:Beginning trial 21
INFO:root:Loading model unet with settings {'in_channels': 4, 'classes': 1, 'activation': 'sigmoid'}
INFO:root:Loading loss smooth
INFO:root:Loading loss smooth
INFO:echo.src.base_objective:Saving trial 20 results to local file /glade/work/kdagon/s2sml/results_week3_SH_515/trial_results/trial_results_29809.gusched01.csv
INFO:echo.src.base_objective:Merging trial results and saving to /glade/work/kdagon/s2sml/results_week3_SH_515/trial_results.csv
[32m[I 2023-05-15 17:49:37,015][0m Trial 20 finished with values: [1.1353104340927322, 6.518215470210093, 3.0460322891284775] and parameters: {'learning_rate': 0.00025523748005522323, 'norm': 'zscore', 'weight_decay': 2.6863777644937942e-05, 'train_batch_size': 46, 'training_loss': 'xtanh', 'model_name': 'deeplabv3+'}. [0m
INFO:echo.src.base_objective:Attempting to automatically update the model configuration using optuna's suggested parameters
INFO:echo.src.base_objective:	data:norm : None
INFO:echo.src.base_objective:	model:name : unet
INFO:echo.src.base_objective:	optimizer:learning_rate : 0.0015964501161258074
INFO:echo.src.base_objective:	trainer:train_batch_size : 6
INFO:echo.src.base_objective:	trainer:weight_decay : 4.937423452518926e-08
INFO:echo.src.base_objective:	trainer:training_loss : logcosh
INFO:echo.src.base_objective:Beginning trial 22
INFO:root:Loading model unet with settings {'in_channels': 4, 'classes': 1, 'activation': 'sigmoid'}
INFO:root:Loading loss smooth
INFO:root:Loading loss smooth
INFO:echo.src.base_objective:Saving trial 22 results to local file /glade/work/kdagon/s2sml/results_week3_SH_515/trial_results/trial_results_29809.gusched01.csv
INFO:echo.src.base_objective:Merging trial results and saving to /glade/work/kdagon/s2sml/results_week3_SH_515/trial_results.csv
[32m[I 2023-05-15 17:55:25,239][0m Trial 22 finished with values: [12.01724119360739, 12056.510211818875, 162.33531882326153] and parameters: {'learning_rate': 0.0015964501161258074, 'norm': 'None', 'weight_decay': 4.937423452518926e-08, 'train_batch_size': 6, 'training_loss': 'logcosh', 'model_name': 'unet'}. [0m
INFO:echo.src.base_objective:Attempting to automatically update the model configuration using optuna's suggested parameters
INFO:echo.src.base_objective:	data:norm : negone
INFO:echo.src.base_objective:	model:name : deeplabv3
INFO:echo.src.base_objective:	optimizer:learning_rate : 0.00578869735910796
INFO:echo.src.base_objective:	trainer:train_batch_size : 111
INFO:echo.src.base_objective:	trainer:weight_decay : 2.2976488905072662e-07
INFO:echo.src.base_objective:	trainer:training_loss : logcosh
INFO:echo.src.base_objective:Beginning trial 23
INFO:root:Loading model deeplabv3 with settings {'in_channels': 4, 'classes': 1, 'activation': 'sigmoid'}
INFO:root:Loading loss smooth
INFO:root:Loading loss smooth
INFO:echo.src.base_objective:Saving trial 21 results to local file /glade/work/kdagon/s2sml/results_week3_SH_515/trial_results/trial_results_29810.gusched01.csv
INFO:echo.src.base_objective:Merging trial results and saving to /glade/work/kdagon/s2sml/results_week3_SH_515/trial_results.csv
[32m[I 2023-05-15 18:03:01,421][0m Trial 21 finished with values: [0.9701595478363628, 0.4896956038058062, 0.7789776945674339] and parameters: {'learning_rate': 9.210206335525336e-05, 'norm': 'minmax', 'weight_decay': 3.1217644070305195e-11, 'train_batch_size': 103, 'training_loss': 'mse', 'model_name': 'unet'}. [0m
INFO:echo.src.base_objective:Attempting to automatically update the model configuration using optuna's suggested parameters
INFO:echo.src.base_objective:	data:norm : minmax
INFO:echo.src.base_objective:	model:name : pspnet
INFO:echo.src.base_objective:	optimizer:learning_rate : 0.004867103624458612
INFO:echo.src.base_objective:	trainer:train_batch_size : 30
INFO:echo.src.base_objective:	trainer:weight_decay : 5.54236892149174e-06
INFO:echo.src.base_objective:	trainer:training_loss : xsigmoid
INFO:echo.src.base_objective:Beginning trial 24
INFO:root:Loading model pspnet with settings {'in_channels': 4, 'classes': 1, 'activation': 'sigmoid'}
INFO:root:Loading loss smooth
INFO:root:Loading loss smooth
INFO:echo.src.base_objective:Saving trial 24 results to local file /glade/work/kdagon/s2sml/results_week3_SH_515/trial_results/trial_results_29810.gusched01.csv
INFO:echo.src.base_objective:Merging trial results and saving to /glade/work/kdagon/s2sml/results_week3_SH_515/trial_results.csv
[32m[I 2023-05-15 18:07:20,517][0m Trial 24 finished with values: [1.0970145333188128, 1.7183931778642545, 1.347425704940948] and parameters: {'learning_rate': 0.004867103624458612, 'norm': 'minmax', 'weight_decay': 5.54236892149174e-06, 'train_batch_size': 30, 'training_loss': 'xsigmoid', 'model_name': 'pspnet'}. [0m
INFO:echo.src.base_objective:Attempting to automatically update the model configuration using optuna's suggested parameters
INFO:echo.src.base_objective:	data:norm : zscore
INFO:echo.src.base_objective:	model:name : linknet
INFO:echo.src.base_objective:	optimizer:learning_rate : 6.604706818648971e-05
INFO:echo.src.base_objective:	trainer:train_batch_size : 26
INFO:echo.src.base_objective:	trainer:weight_decay : 1.639615821021539e-08
INFO:echo.src.base_objective:	trainer:training_loss : huber
INFO:echo.src.base_objective:Beginning trial 25
INFO:root:Loading model linknet with settings {'in_channels': 4, 'classes': 1, 'activation': 'sigmoid'}
INFO:root:Loading loss smooth
INFO:root:Loading loss smooth
INFO:echo.src.base_objective:Saving trial 23 results to local file /glade/work/kdagon/s2sml/results_week3_SH_515/trial_results/trial_results_29809.gusched01.csv
INFO:echo.src.base_objective:Merging trial results and saving to /glade/work/kdagon/s2sml/results_week3_SH_515/trial_results.csv
[32m[I 2023-05-15 18:08:25,402][0m Trial 23 finished with values: [1.0913961217942096, 1.6959128749517887, 1.3317896081147487] and parameters: {'learning_rate': 0.00578869735910796, 'norm': 'negone', 'weight_decay': 2.2976488905072662e-07, 'train_batch_size': 111, 'training_loss': 'logcosh', 'model_name': 'deeplabv3'}. [0m
INFO:echo.src.base_objective:Attempting to automatically update the model configuration using optuna's suggested parameters
INFO:echo.src.base_objective:	data:norm : minmax
INFO:echo.src.base_objective:	model:name : linknet
INFO:echo.src.base_objective:	optimizer:learning_rate : 4.169644425002291e-05
INFO:echo.src.base_objective:	trainer:train_batch_size : 9
INFO:echo.src.base_objective:	trainer:weight_decay : 1.6597317758110658e-11
INFO:echo.src.base_objective:	trainer:training_loss : logcosh
INFO:echo.src.base_objective:Beginning trial 26
INFO:root:Loading model linknet with settings {'in_channels': 4, 'classes': 1, 'activation': 'sigmoid'}
INFO:root:Loading loss smooth
INFO:root:Loading loss smooth
INFO:echo.src.base_objective:Saving trial 25 results to local file /glade/work/kdagon/s2sml/results_week3_SH_515/trial_results/trial_results_29810.gusched01.csv
INFO:echo.src.base_objective:Merging trial results and saving to /glade/work/kdagon/s2sml/results_week3_SH_515/trial_results.csv
[32m[I 2023-05-15 18:18:54,984][0m Trial 25 finished with values: [1.0858250447798898, 3.9774059179062062, 2.2296949270146498] and parameters: {'learning_rate': 6.604706818648971e-05, 'norm': 'zscore', 'weight_decay': 1.639615821021539e-08, 'train_batch_size': 26, 'training_loss': 'huber', 'model_name': 'linknet'}. [0m
WARNING:root:Stopping early since the longest observed run-time in the study exceeds the time remaining on this node.
INFO:root:Saving trial details to /glade/work/kdagon/s2sml/results_week3_SH_515/
INFO:root:Running on PBS/SLURM batch id: 29811.gusched01
INFO:root:Importing custom objective from /glade/work/kdagon/s2sml/applications/train.py
INFO:echo.src.reporting:Using device 0
INFO:root:Direction of optimization: ['minimize', 'minimize', 'minimize']
INFO:root:Using metric ['valid_custom', 'valid_custom_second', 'valid_custom_third']
[32m[I 2023-05-15 18:19:55,807][0m Using an existing study with name 'vanilla' instead of creating a new one.[0m
INFO:root:Loaded study vanilla located at sqlite:////glade/work/kdagon/s2sml/results_week3_SH_515/s2s.db
INFO:echo.src.base_objective:Worker 29811.gusched01 is summoned.
INFO:echo.src.base_objective:	initializing an objective to be optimized with metric ['valid_custom', 'valid_custom_second', 'valid_custom_third']
INFO:echo.src.base_objective:	using device(s) cuda:0
INFO:echo.src.base_objective:	saving study/trial results to local file /glade/work/kdagon/s2sml/results_week3_SH_515/trial_results/trial_results_29811.gusched01.csv
INFO:root:Running optimization for 1000 trials
INFO:root:Running trials for a maximum PBS wall-time 2:00:00
WARNING:root:Attempting to run trials and stop before hitting the wall-time
WARNING:root:Some trials may not complete if the wall-time is reached. Optuna will start over.
INFO:echo.src.base_objective:Attempting to automatically update the model configuration using optuna's suggested parameters
INFO:echo.src.base_objective:	data:norm : minmax
INFO:echo.src.base_objective:	model:name : deeplabv3+
INFO:echo.src.base_objective:	optimizer:learning_rate : 0.0004601660050268863
INFO:echo.src.base_objective:	trainer:train_batch_size : 122
INFO:echo.src.base_objective:	trainer:weight_decay : 3.5532406106124137e-12
INFO:echo.src.base_objective:	trainer:training_loss : huber
INFO:echo.src.base_objective:Beginning trial 27
INFO:root:Loading model deeplabv3+ with settings {'in_channels': 4, 'classes': 1, 'activation': 'sigmoid'}
INFO:root:Loading loss smooth
INFO:root:Loading loss smooth
INFO:echo.src.base_objective:Saving trial 26 results to local file /glade/work/kdagon/s2sml/results_week3_SH_515/trial_results/trial_results_29809.gusched01.csv
INFO:echo.src.base_objective:Merging trial results and saving to /glade/work/kdagon/s2sml/results_week3_SH_515/trial_results.csv
