INFO:root:Saving trial details to /glade/work/kdagon/s2sml/results_week3_SH_515/
INFO:root:Saving trial details to /glade/work/kdagon/s2sml/results_week3_SH_515/
INFO:root:Running on PBS/SLURM batch id: 29807.gusched01
INFO:root:Running on PBS/SLURM batch id: 29808.gusched01
INFO:root:Importing custom objective from /glade/work/kdagon/s2sml/applications/train.py
INFO:root:Importing custom objective from /glade/work/kdagon/s2sml/applications/train.py
INFO:echo.src.reporting:Using device 0
INFO:echo.src.reporting:Using device 0
INFO:root:Direction of optimization: ['minimize', 'minimize', 'minimize']
INFO:root:Direction of optimization: ['minimize', 'minimize', 'minimize']
INFO:root:Using metric ['valid_custom', 'valid_custom_second', 'valid_custom_third']
INFO:root:Using metric ['valid_custom', 'valid_custom_second', 'valid_custom_third']
[32m[I 2023-05-15 15:28:25,938][0m Using an existing study with name 'vanilla' instead of creating a new one.[0m
[32m[I 2023-05-15 15:28:25,939][0m Using an existing study with name 'vanilla' instead of creating a new one.[0m
INFO:root:Loaded study vanilla located at sqlite:////glade/work/kdagon/s2sml/results_week3_SH_515/s2s.db
INFO:echo.src.base_objective:Worker 29807.gusched01 is summoned.
INFO:echo.src.base_objective:	initializing an objective to be optimized with metric ['valid_custom', 'valid_custom_second', 'valid_custom_third']
INFO:echo.src.base_objective:	using device(s) cuda:0
INFO:echo.src.base_objective:	saving study/trial results to local file /glade/work/kdagon/s2sml/results_week3_SH_515/trial_results/trial_results_29807.gusched01.csv
INFO:root:Running optimization for 1000 trials
INFO:root:Running trials for a maximum PBS wall-time 2:00:00
WARNING:root:Attempting to run trials and stop before hitting the wall-time
WARNING:root:Some trials may not complete if the wall-time is reached. Optuna will start over.
INFO:root:Loaded study vanilla located at sqlite:////glade/work/kdagon/s2sml/results_week3_SH_515/s2s.db
INFO:echo.src.base_objective:Worker 29808.gusched01 is summoned.
INFO:echo.src.base_objective:	initializing an objective to be optimized with metric ['valid_custom', 'valid_custom_second', 'valid_custom_third']
INFO:echo.src.base_objective:	using device(s) cuda:0
INFO:echo.src.base_objective:	saving study/trial results to local file /glade/work/kdagon/s2sml/results_week3_SH_515/trial_results/trial_results_29808.gusched01.csv
INFO:root:Running optimization for 1000 trials
INFO:root:Running trials for a maximum PBS wall-time 2:00:00
WARNING:root:Attempting to run trials and stop before hitting the wall-time
WARNING:root:Some trials may not complete if the wall-time is reached. Optuna will start over.
INFO:echo.src.base_objective:Attempting to automatically update the model configuration using optuna's suggested parameters
INFO:echo.src.base_objective:Attempting to automatically update the model configuration using optuna's suggested parameters
INFO:echo.src.base_objective:	data:norm : minmax
INFO:echo.src.base_objective:	model:name : deeplabv3+
INFO:echo.src.base_objective:	optimizer:learning_rate : 0.0007244169897842657
INFO:echo.src.base_objective:	trainer:train_batch_size : 72
INFO:echo.src.base_objective:	trainer:weight_decay : 0.0003563372592711742
INFO:echo.src.base_objective:	trainer:training_loss : logcosh
INFO:echo.src.base_objective:Beginning trial 0
INFO:echo.src.base_objective:	data:norm : minmax
INFO:echo.src.base_objective:	model:name : fpn
INFO:echo.src.base_objective:	optimizer:learning_rate : 0.0007291131278606368
INFO:echo.src.base_objective:	trainer:train_batch_size : 69
INFO:echo.src.base_objective:	trainer:weight_decay : 8.820187429005921e-10
INFO:echo.src.base_objective:	trainer:training_loss : xtanh
INFO:echo.src.base_objective:Beginning trial 1
INFO:root:Loading model deeplabv3+ with settings {'in_channels': 4, 'classes': 1, 'activation': 'sigmoid'}
INFO:root:Loading model fpn with settings {'in_channels': 4, 'classes': 1, 'activation': 'sigmoid'}
INFO:root:Loading loss smooth
INFO:root:Loading loss smooth
INFO:root:Loading loss smooth
INFO:root:Loading loss smooth
INFO:echo.src.base_objective:Saving trial 1 results to local file /glade/work/kdagon/s2sml/results_week3_SH_515/trial_results/trial_results_29808.gusched01.csv
[32m[I 2023-05-15 15:41:50,770][0m Trial 1 finished with values: [1.0314923904258184, 1.2914674051426158, 1.1683407352880195] and parameters: {'learning_rate': 0.0007291131278606368, 'norm': 'minmax', 'weight_decay': 8.820187429005921e-10, 'train_batch_size': 69, 'training_loss': 'xtanh', 'model_name': 'fpn'}. [0m
INFO:echo.src.base_objective:Attempting to automatically update the model configuration using optuna's suggested parameters
INFO:echo.src.base_objective:	data:norm : None
INFO:echo.src.base_objective:	model:name : deeplabv3
INFO:echo.src.base_objective:	optimizer:learning_rate : 0.0044041396570147434
INFO:echo.src.base_objective:	trainer:train_batch_size : 93
INFO:echo.src.base_objective:	trainer:weight_decay : 9.686252228913244e-07
INFO:echo.src.base_objective:	trainer:training_loss : mse
INFO:echo.src.base_objective:Beginning trial 2
INFO:root:Loading model deeplabv3 with settings {'in_channels': 4, 'classes': 1, 'activation': 'sigmoid'}
INFO:root:Loading loss smooth
INFO:root:Loading loss smooth
INFO:echo.src.base_objective:Saving trial 0 results to local file /glade/work/kdagon/s2sml/results_week3_SH_515/trial_results/trial_results_29807.gusched01.csv
INFO:echo.src.base_objective:Merging trial results and saving to /glade/work/kdagon/s2sml/results_week3_SH_515/trial_results.csv
[32m[I 2023-05-15 15:44:26,984][0m Trial 0 finished with values: [1.0142489313781007, 0.946606017250634, 0.9202209150545435] and parameters: {'learning_rate': 0.0007244169897842657, 'norm': 'minmax', 'weight_decay': 0.0003563372592711742, 'train_batch_size': 72, 'training_loss': 'logcosh', 'model_name': 'deeplabv3+'}. [0m
INFO:echo.src.base_objective:Attempting to automatically update the model configuration using optuna's suggested parameters
INFO:echo.src.base_objective:	data:norm : zscore
INFO:echo.src.base_objective:	model:name : fpn
INFO:echo.src.base_objective:	optimizer:learning_rate : 0.00020106272399616354
INFO:echo.src.base_objective:	trainer:train_batch_size : 17
INFO:echo.src.base_objective:	trainer:weight_decay : 0.0003457871263194445
INFO:echo.src.base_objective:	trainer:training_loss : mse
INFO:echo.src.base_objective:Beginning trial 3
INFO:root:Loading model fpn with settings {'in_channels': 4, 'classes': 1, 'activation': 'sigmoid'}
INFO:root:Loading loss smooth
INFO:root:Loading loss smooth
INFO:echo.src.base_objective:Saving trial 2 results to local file /glade/work/kdagon/s2sml/results_week3_SH_515/trial_results/trial_results_29808.gusched01.csv
INFO:echo.src.base_objective:Merging trial results and saving to /glade/work/kdagon/s2sml/results_week3_SH_515/trial_results.csv
[32m[I 2023-05-15 15:49:25,808][0m Trial 2 finished with values: [26.94447975158926, 12056.517145356027, 162.33537089427594] and parameters: {'learning_rate': 0.0044041396570147434, 'norm': 'None', 'weight_decay': 9.686252228913244e-07, 'train_batch_size': 93, 'training_loss': 'mse', 'model_name': 'deeplabv3'}. [0m
INFO:echo.src.base_objective:Attempting to automatically update the model configuration using optuna's suggested parameters
INFO:echo.src.base_objective:	data:norm : negone
INFO:echo.src.base_objective:	model:name : deeplabv3
INFO:echo.src.base_objective:	optimizer:learning_rate : 1.6571567941573003e-06
INFO:echo.src.base_objective:	trainer:train_batch_size : 28
INFO:echo.src.base_objective:	trainer:weight_decay : 0.0004886767616092857
INFO:echo.src.base_objective:	trainer:training_loss : xsigmoid
INFO:echo.src.base_objective:Beginning trial 4
INFO:root:Loading model deeplabv3 with settings {'in_channels': 4, 'classes': 1, 'activation': 'sigmoid'}
INFO:root:Loading loss smooth
INFO:root:Loading loss smooth
INFO:echo.src.base_objective:Saving trial 3 results to local file /glade/work/kdagon/s2sml/results_week3_SH_515/trial_results/trial_results_29807.gusched01.csv
INFO:echo.src.base_objective:Merging trial results and saving to /glade/work/kdagon/s2sml/results_week3_SH_515/trial_results.csv
[32m[I 2023-05-15 15:55:39,555][0m Trial 3 finished with values: [1.1542321395464599, 3.6844893932101352, 2.0902240874765625] and parameters: {'learning_rate': 0.00020106272399616354, 'norm': 'zscore', 'weight_decay': 0.0003457871263194445, 'train_batch_size': 17, 'training_loss': 'mse', 'model_name': 'fpn'}. [0m
INFO:echo.src.base_objective:Attempting to automatically update the model configuration using optuna's suggested parameters
INFO:echo.src.base_objective:	data:norm : minmax
INFO:echo.src.base_objective:	model:name : linknet
INFO:echo.src.base_objective:	optimizer:learning_rate : 7.291871985889319e-06
INFO:echo.src.base_objective:	trainer:train_batch_size : 39
INFO:echo.src.base_objective:	trainer:weight_decay : 2.348787222644882e-05
INFO:echo.src.base_objective:	trainer:training_loss : smooth
INFO:echo.src.base_objective:Beginning trial 5
INFO:root:Loading model linknet with settings {'in_channels': 4, 'classes': 1, 'activation': 'sigmoid'}
INFO:root:Loading loss smooth
INFO:root:Loading loss smooth
INFO:echo.src.base_objective:Saving trial 5 results to local file /glade/work/kdagon/s2sml/results_week3_SH_515/trial_results/trial_results_29807.gusched01.csv
INFO:echo.src.base_objective:Merging trial results and saving to /glade/work/kdagon/s2sml/results_week3_SH_515/trial_results.csv
[32m[I 2023-05-15 16:17:17,380][0m Trial 5 finished with values: [1.2772670539117577, 3.369817107280385, 2.097706164805902] and parameters: {'learning_rate': 7.291871985889319e-06, 'norm': 'minmax', 'weight_decay': 2.348787222644882e-05, 'train_batch_size': 39, 'training_loss': 'smooth', 'model_name': 'linknet'}. [0m
INFO:echo.src.base_objective:Attempting to automatically update the model configuration using optuna's suggested parameters
INFO:echo.src.base_objective:	data:norm : negone
INFO:echo.src.base_objective:	model:name : unet++
INFO:echo.src.base_objective:	optimizer:learning_rate : 3.6934624978451226e-06
INFO:echo.src.base_objective:	trainer:train_batch_size : 63
INFO:echo.src.base_objective:	trainer:weight_decay : 6.747085463275048e-05
INFO:echo.src.base_objective:	trainer:training_loss : xtanh
INFO:echo.src.base_objective:Beginning trial 6
INFO:root:Loading model unet++ with settings {'in_channels': 4, 'classes': 1, 'activation': 'sigmoid'}
INFO:root:Loading loss smooth
INFO:root:Loading loss smooth
INFO:echo.src.base_objective:Saving trial 4 results to local file /glade/work/kdagon/s2sml/results_week3_SH_515/trial_results/trial_results_29808.gusched01.csv
INFO:echo.src.base_objective:Merging trial results and saving to /glade/work/kdagon/s2sml/results_week3_SH_515/trial_results.csv
[32m[I 2023-05-15 16:27:58,955][0m Trial 4 finished with values: [1.2103848534787056, 6.647368119725359, 3.1940592323128962] and parameters: {'learning_rate': 1.6571567941573003e-06, 'norm': 'negone', 'weight_decay': 0.0004886767616092857, 'train_batch_size': 28, 'training_loss': 'xsigmoid', 'model_name': 'deeplabv3'}. [0m
INFO:echo.src.base_objective:Attempting to automatically update the model configuration using optuna's suggested parameters
INFO:echo.src.base_objective:	data:norm : minmax
INFO:echo.src.base_objective:	model:name : deeplabv3+
INFO:echo.src.base_objective:	optimizer:learning_rate : 2.6492323919800125e-05
INFO:echo.src.base_objective:	trainer:train_batch_size : 97
INFO:echo.src.base_objective:	trainer:weight_decay : 8.966346907110688e-05
INFO:echo.src.base_objective:	trainer:training_loss : xsigmoid
INFO:echo.src.base_objective:Beginning trial 7
INFO:root:Loading model deeplabv3+ with settings {'in_channels': 4, 'classes': 1, 'activation': 'sigmoid'}
INFO:root:Loading loss smooth
INFO:root:Loading loss smooth
INFO:echo.src.base_objective:Saving trial 7 results to local file /glade/work/kdagon/s2sml/results_week3_SH_515/trial_results/trial_results_29808.gusched01.csv
INFO:echo.src.base_objective:Merging trial results and saving to /glade/work/kdagon/s2sml/results_week3_SH_515/trial_results.csv
[32m[I 2023-05-15 16:38:41,314][0m Trial 7 finished with values: [1.0497132461942011, 1.7070653024225448, 1.4682536309915508] and parameters: {'learning_rate': 2.6492323919800125e-05, 'norm': 'minmax', 'weight_decay': 8.966346907110688e-05, 'train_batch_size': 97, 'training_loss': 'xsigmoid', 'model_name': 'deeplabv3+'}. [0m
INFO:echo.src.base_objective:Attempting to automatically update the model configuration using optuna's suggested parameters
INFO:echo.src.base_objective:	data:norm : zscore
INFO:echo.src.base_objective:	model:name : deeplabv3
INFO:echo.src.base_objective:	optimizer:learning_rate : 0.0009394207697552794
INFO:echo.src.base_objective:	trainer:train_batch_size : 107
INFO:echo.src.base_objective:	trainer:weight_decay : 7.873162840378467e-06
INFO:echo.src.base_objective:	trainer:training_loss : logcosh
INFO:echo.src.base_objective:Beginning trial 8
INFO:root:Loading model deeplabv3 with settings {'in_channels': 4, 'classes': 1, 'activation': 'sigmoid'}
INFO:root:Loading loss smooth
INFO:root:Loading loss smooth
INFO:echo.src.base_objective:Saving trial 8 results to local file /glade/work/kdagon/s2sml/results_week3_SH_515/trial_results/trial_results_29808.gusched01.csv
INFO:echo.src.base_objective:Merging trial results and saving to /glade/work/kdagon/s2sml/results_week3_SH_515/trial_results.csv
[32m[I 2023-05-15 16:46:12,682][0m Trial 8 finished with values: [1.1786385984096865, 3.867447687068986, 2.19354609434715] and parameters: {'learning_rate': 0.0009394207697552794, 'norm': 'zscore', 'weight_decay': 7.873162840378467e-06, 'train_batch_size': 107, 'training_loss': 'logcosh', 'model_name': 'deeplabv3'}. [0m
INFO:echo.src.base_objective:Attempting to automatically update the model configuration using optuna's suggested parameters
INFO:echo.src.base_objective:	data:norm : negone
INFO:echo.src.base_objective:	model:name : pspnet
INFO:echo.src.base_objective:	optimizer:learning_rate : 0.0031061109991745313
INFO:echo.src.base_objective:	trainer:train_batch_size : 53
INFO:echo.src.base_objective:	trainer:weight_decay : 3.107198497742131e-07
INFO:echo.src.base_objective:	trainer:training_loss : smooth
INFO:echo.src.base_objective:Beginning trial 9
INFO:root:Loading model pspnet with settings {'in_channels': 4, 'classes': 1, 'activation': 'sigmoid'}
INFO:root:Loading loss smooth
INFO:root:Loading loss smooth
INFO:echo.src.base_objective:Saving trial 6 results to local file /glade/work/kdagon/s2sml/results_week3_SH_515/trial_results/trial_results_29807.gusched01.csv
INFO:echo.src.base_objective:Merging trial results and saving to /glade/work/kdagon/s2sml/results_week3_SH_515/trial_results.csv
[32m[I 2023-05-15 16:55:21,341][0m Trial 6 finished with values: [1.082582921808754, 6.347660204103818, 3.2670502675480195] and parameters: {'learning_rate': 3.6934624978451226e-06, 'norm': 'negone', 'weight_decay': 6.747085463275048e-05, 'train_batch_size': 63, 'training_loss': 'xtanh', 'model_name': 'unet++'}. [0m
WARNING:root:Stopping early since the longest observed run-time in the study exceeds the time remaining on this node.
INFO:echo.src.base_objective:Saving trial 9 results to local file /glade/work/kdagon/s2sml/results_week3_SH_515/trial_results/trial_results_29808.gusched01.csv
INFO:echo.src.base_objective:Merging trial results and saving to /glade/work/kdagon/s2sml/results_week3_SH_515/trial_results.csv
[32m[I 2023-05-15 16:55:52,177][0m Trial 9 finished with values: [1.0800314216157187, 1.604065890229391, 1.2660403670448446] and parameters: {'learning_rate': 0.0031061109991745313, 'norm': 'negone', 'weight_decay': 3.107198497742131e-07, 'train_batch_size': 53, 'training_loss': 'smooth', 'model_name': 'pspnet'}. [0m
WARNING:root:Stopping early since the longest observed run-time in the study exceeds the time remaining on this node.
INFO:root:Saving trial details to /glade/work/kdagon/s2sml/results_week3_SH_515/
INFO:root:Running on PBS/SLURM batch id: 29809.gusched01
INFO:root:Importing custom objective from /glade/work/kdagon/s2sml/applications/train.py
INFO:root:Saving trial details to /glade/work/kdagon/s2sml/results_week3_SH_515/
INFO:root:Running on PBS/SLURM batch id: 29810.gusched01
INFO:root:Importing custom objective from /glade/work/kdagon/s2sml/applications/train.py
INFO:echo.src.reporting:Using device 0
INFO:root:Direction of optimization: ['minimize', 'minimize', 'minimize']
INFO:root:Using metric ['valid_custom', 'valid_custom_second', 'valid_custom_third']
INFO:echo.src.reporting:Using device 0
INFO:root:Direction of optimization: ['minimize', 'minimize', 'minimize']
INFO:root:Using metric ['valid_custom', 'valid_custom_second', 'valid_custom_third']
[32m[I 2023-05-15 16:56:38,594][0m Using an existing study with name 'vanilla' instead of creating a new one.[0m
[32m[I 2023-05-15 16:56:38,596][0m Using an existing study with name 'vanilla' instead of creating a new one.[0m
INFO:root:Loaded study vanilla located at sqlite:////glade/work/kdagon/s2sml/results_week3_SH_515/s2s.db
INFO:root:Loaded study vanilla located at sqlite:////glade/work/kdagon/s2sml/results_week3_SH_515/s2s.db
INFO:echo.src.base_objective:Worker 29810.gusched01 is summoned.
INFO:echo.src.base_objective:Worker 29809.gusched01 is summoned.
INFO:echo.src.base_objective:	initializing an objective to be optimized with metric ['valid_custom', 'valid_custom_second', 'valid_custom_third']
INFO:echo.src.base_objective:	initializing an objective to be optimized with metric ['valid_custom', 'valid_custom_second', 'valid_custom_third']
INFO:echo.src.base_objective:	using device(s) cuda:0
INFO:echo.src.base_objective:	using device(s) cuda:0
INFO:echo.src.base_objective:	saving study/trial results to local file /glade/work/kdagon/s2sml/results_week3_SH_515/trial_results/trial_results_29810.gusched01.csv
INFO:echo.src.base_objective:	saving study/trial results to local file /glade/work/kdagon/s2sml/results_week3_SH_515/trial_results/trial_results_29809.gusched01.csv
INFO:root:Running optimization for 1000 trials
INFO:root:Running optimization for 1000 trials
INFO:root:Running trials for a maximum PBS wall-time 2:00:00
INFO:root:Running trials for a maximum PBS wall-time 2:00:00
WARNING:root:Attempting to run trials and stop before hitting the wall-time
WARNING:root:Attempting to run trials and stop before hitting the wall-time
WARNING:root:Some trials may not complete if the wall-time is reached. Optuna will start over.
WARNING:root:Some trials may not complete if the wall-time is reached. Optuna will start over.
INFO:echo.src.base_objective:Attempting to automatically update the model configuration using optuna's suggested parameters
INFO:echo.src.base_objective:Attempting to automatically update the model configuration using optuna's suggested parameters
INFO:echo.src.base_objective:	data:norm : None
INFO:echo.src.base_objective:	model:name : manet
INFO:echo.src.base_objective:	optimizer:learning_rate : 0.0002458180262234768
INFO:echo.src.base_objective:	trainer:train_batch_size : 69
INFO:echo.src.base_objective:	trainer:weight_decay : 0.0006277624732018657
INFO:echo.src.base_objective:	trainer:training_loss : logcosh
INFO:echo.src.base_objective:Beginning trial 10
INFO:echo.src.base_objective:	data:norm : minmax
INFO:root:Loading model manet with settings {'in_channels': 4, 'classes': 1, 'activation': 'sigmoid'}
INFO:echo.src.base_objective:	model:name : linknet
INFO:echo.src.base_objective:	optimizer:learning_rate : 4.233640369528075e-06
INFO:echo.src.base_objective:	trainer:train_batch_size : 100
INFO:echo.src.base_objective:	trainer:weight_decay : 1.3593864166890444e-08
INFO:echo.src.base_objective:	trainer:training_loss : xtanh
INFO:echo.src.base_objective:Beginning trial 11
INFO:root:Loading loss smooth
INFO:root:Loading loss smooth
INFO:root:Loading model linknet with settings {'in_channels': 4, 'classes': 1, 'activation': 'sigmoid'}
INFO:root:Loading loss smooth
INFO:root:Loading loss smooth
INFO:echo.src.base_objective:Saving trial 10 results to local file /glade/work/kdagon/s2sml/results_week3_SH_515/trial_results/trial_results_29810.gusched01.csv
INFO:echo.src.base_objective:Merging trial results and saving to /glade/work/kdagon/s2sml/results_week3_SH_515/trial_results.csv
[32m[I 2023-05-15 16:59:15,321][0m Trial 10 finished with values: [25.14106216422959, 12093.724527988952, 162.58580209888902] and parameters: {'learning_rate': 0.0002458180262234768, 'norm': 'None', 'weight_decay': 0.0006277624732018657, 'train_batch_size': 69, 'training_loss': 'logcosh', 'model_name': 'manet'}. [0m
INFO:echo.src.base_objective:Attempting to automatically update the model configuration using optuna's suggested parameters
INFO:echo.src.base_objective:	data:norm : negone
INFO:echo.src.base_objective:	model:name : deeplabv3+
INFO:echo.src.base_objective:	optimizer:learning_rate : 0.00015242558663242106
INFO:echo.src.base_objective:	trainer:train_batch_size : 112
INFO:echo.src.base_objective:	trainer:weight_decay : 2.8803159499718976e-08
INFO:echo.src.base_objective:	trainer:training_loss : huber
INFO:echo.src.base_objective:Beginning trial 12
INFO:root:Loading model deeplabv3+ with settings {'in_channels': 4, 'classes': 1, 'activation': 'sigmoid'}
INFO:root:Loading loss smooth
INFO:root:Loading loss smooth
INFO:echo.src.base_objective:Saving trial 11 results to local file /glade/work/kdagon/s2sml/results_week3_SH_515/trial_results/trial_results_29809.gusched01.csv
INFO:echo.src.base_objective:Merging trial results and saving to /glade/work/kdagon/s2sml/results_week3_SH_515/trial_results.csv
