[32m[I 2023-05-16 05:57:34,371][0m Trial 154 finished with values: [0.9612300164682271, 0.39249286625041147, 0.6803339767277669] and parameters: {'learning_rate': 0.00011999781943133503, 'norm': 'minmax', 'weight_decay': 3.6481066231893165e-11, 'train_batch_size': 6, 'training_loss': 'mae', 'model_name': 'manet'}. [0m
INFO:echo.src.base_objective:Attempting to automatically update the model configuration using optuna's suggested parameters
INFO:echo.src.base_objective:	data:norm : minmax
INFO:echo.src.base_objective:	model:name : manet
INFO:echo.src.base_objective:	optimizer:learning_rate : 5.437761841137449e-06
INFO:echo.src.base_objective:	trainer:train_batch_size : 12
INFO:echo.src.base_objective:	trainer:weight_decay : 5.347170157830856e-11
INFO:echo.src.base_objective:	trainer:training_loss : mae
INFO:echo.src.base_objective:Beginning trial 156
INFO:root:Loading model manet with settings {'in_channels': 4, 'classes': 1, 'activation': 'sigmoid'}
INFO:root:Loading loss smooth
INFO:root:Loading loss smooth
INFO:echo.src.base_objective:Saving trial 156 results to local file /glade/work/kdagon/s2sml/results_week3_SH_515/trial_results/trial_results_29825.gusched01.csv
INFO:echo.src.base_objective:Merging trial results and saving to /glade/work/kdagon/s2sml/results_week3_SH_515/trial_results.csv
[32m[I 2023-05-16 06:10:17,518][0m Trial 156 finished with values: [1.0534671032546112, 1.4149997881290304, 1.2536072487567018] and parameters: {'learning_rate': 5.437761841137449e-06, 'norm': 'minmax', 'weight_decay': 5.347170157830856e-11, 'train_batch_size': 12, 'training_loss': 'mae', 'model_name': 'manet'}. [0m
INFO:echo.src.base_objective:Attempting to automatically update the model configuration using optuna's suggested parameters
INFO:echo.src.base_objective:	data:norm : minmax
INFO:echo.src.base_objective:	model:name : manet
INFO:echo.src.base_objective:	optimizer:learning_rate : 0.0013774286042435471
INFO:echo.src.base_objective:	trainer:train_batch_size : 7
INFO:echo.src.base_objective:	trainer:weight_decay : 0.0009566905794611744
INFO:echo.src.base_objective:	trainer:training_loss : mae
INFO:echo.src.base_objective:Beginning trial 157
INFO:root:Loading model manet with settings {'in_channels': 4, 'classes': 1, 'activation': 'sigmoid'}
INFO:root:Loading loss smooth
INFO:root:Loading loss smooth
INFO:echo.src.base_objective:Saving trial 155 results to local file /glade/work/kdagon/s2sml/results_week3_SH_515/trial_results/trial_results_29826.gusched01.csv
INFO:echo.src.base_objective:Merging trial results and saving to /glade/work/kdagon/s2sml/results_week3_SH_515/trial_results.csv
[32m[I 2023-05-16 06:10:58,847][0m Trial 155 finished with values: [0.9580513477214126, 0.3704309576232375, 0.6657515155388422] and parameters: {'learning_rate': 0.0004635169609527252, 'norm': 'minmax', 'weight_decay': 0.00016210784998736867, 'train_batch_size': 6, 'training_loss': 'mae', 'model_name': 'manet'}. [0m
INFO:echo.src.base_objective:Attempting to automatically update the model configuration using optuna's suggested parameters
INFO:echo.src.base_objective:	data:norm : minmax
INFO:echo.src.base_objective:	model:name : manet
INFO:echo.src.base_objective:	optimizer:learning_rate : 0.0013470924890094987
INFO:echo.src.base_objective:	trainer:train_batch_size : 14
INFO:echo.src.base_objective:	trainer:weight_decay : 2.0453404748990053e-08
INFO:echo.src.base_objective:	trainer:training_loss : mae
INFO:echo.src.base_objective:Beginning trial 158
INFO:root:Loading model manet with settings {'in_channels': 4, 'classes': 1, 'activation': 'sigmoid'}
INFO:root:Loading loss smooth
INFO:root:Loading loss smooth
INFO:echo.src.base_objective:Saving trial 157 results to local file /glade/work/kdagon/s2sml/results_week3_SH_515/trial_results/trial_results_29825.gusched01.csv
INFO:echo.src.base_objective:Merging trial results and saving to /glade/work/kdagon/s2sml/results_week3_SH_515/trial_results.csv
[32m[I 2023-05-16 06:21:05,682][0m Trial 157 finished with values: [0.9573435617538048, 0.3471301968373243, 0.6348320611682127] and parameters: {'learning_rate': 0.0013774286042435471, 'norm': 'minmax', 'weight_decay': 0.0009566905794611744, 'train_batch_size': 7, 'training_loss': 'mae', 'model_name': 'manet'}. [0m
WARNING:root:Stopping early since the longest observed run-time in the study exceeds the time remaining on this node.
INFO:echo.src.base_objective:Saving trial 158 results to local file /glade/work/kdagon/s2sml/results_week3_SH_515/trial_results/trial_results_29826.gusched01.csv
INFO:echo.src.base_objective:Merging trial results and saving to /glade/work/kdagon/s2sml/results_week3_SH_515/trial_results.csv
[32m[I 2023-05-16 06:25:10,123][0m Trial 158 finished with values: [0.9583569733354906, 0.3554077619277145, 0.6401375472991997] and parameters: {'learning_rate': 0.0013470924890094987, 'norm': 'minmax', 'weight_decay': 2.0453404748990053e-08, 'train_batch_size': 14, 'training_loss': 'mae', 'model_name': 'manet'}. [0m
INFO:echo.src.base_objective:Attempting to automatically update the model configuration using optuna's suggested parameters
INFO:echo.src.base_objective:	data:norm : minmax
INFO:echo.src.base_objective:	model:name : unet
INFO:echo.src.base_objective:	optimizer:learning_rate : 0.0007278481004589142
INFO:echo.src.base_objective:	trainer:train_batch_size : 14
INFO:echo.src.base_objective:	trainer:weight_decay : 4.441927037131999e-11
INFO:echo.src.base_objective:	trainer:training_loss : mae
INFO:echo.src.base_objective:Beginning trial 159
INFO:root:Loading model unet with settings {'in_channels': 4, 'classes': 1, 'activation': 'sigmoid'}
INFO:root:Loading loss smooth
INFO:root:Loading loss smooth
INFO:echo.src.base_objective:Saving trial 159 results to local file /glade/work/kdagon/s2sml/results_week3_SH_515/trial_results/trial_results_29826.gusched01.csv
INFO:echo.src.base_objective:Merging trial results and saving to /glade/work/kdagon/s2sml/results_week3_SH_515/trial_results.csv
[32m[I 2023-05-16 06:35:48,047][0m Trial 159 finished with values: [0.9581698724103741, 0.35943972473027436, 0.6499746708243072] and parameters: {'learning_rate': 0.0007278481004589142, 'norm': 'minmax', 'weight_decay': 4.441927037131999e-11, 'train_batch_size': 14, 'training_loss': 'mae', 'model_name': 'unet'}. [0m
WARNING:root:Stopping early since the longest observed run-time in the study exceeds the time remaining on this node.
