[32m[I 2023-05-15 21:59:30,383][0m Trial 69 finished with values: [1.0421229387927633, 1.272362903657182, 1.1045847698353881] and parameters: {'learning_rate': 0.0017728644242675962, 'norm': 'negone', 'weight_decay': 1.954842764313202e-12, 'train_batch_size': 15, 'training_loss': 'smooth', 'model_name': 'fpn'}. [0m
INFO:echo.src.base_objective:Attempting to automatically update the model configuration using optuna's suggested parameters
INFO:echo.src.base_objective:	data:norm : minmax
INFO:echo.src.base_objective:	model:name : linknet
INFO:echo.src.base_objective:	optimizer:learning_rate : 0.0005243032610041411
INFO:echo.src.base_objective:	trainer:train_batch_size : 36
INFO:echo.src.base_objective:	trainer:weight_decay : 1.3569791254567176e-09
INFO:echo.src.base_objective:	trainer:training_loss : smooth
INFO:echo.src.base_objective:Beginning trial 71
INFO:root:Loading model linknet with settings {'in_channels': 4, 'classes': 1, 'activation': 'sigmoid'}
INFO:root:Loading loss smooth
INFO:root:Loading loss smooth
INFO:echo.src.base_objective:Saving trial 70 results to local file /glade/work/kdagon/s2sml/results_week3_SH_515/trial_results/trial_results_29816.gusched01.csv
INFO:echo.src.base_objective:Merging trial results and saving to /glade/work/kdagon/s2sml/results_week3_SH_515/trial_results.csv
[32m[I 2023-05-15 22:08:42,723][0m Trial 70 finished with values: [1.127817645207545, 4.371476690691389, 2.416927698776109] and parameters: {'learning_rate': 1.4737855820929227e-05, 'norm': 'minmax', 'weight_decay': 1.418174317161037e-08, 'train_batch_size': 98, 'training_loss': 'mse', 'model_name': 'fpn'}. [0m
INFO:echo.src.base_objective:Attempting to automatically update the model configuration using optuna's suggested parameters
INFO:echo.src.base_objective:	data:norm : minmax
INFO:echo.src.base_objective:	model:name : deeplabv3
INFO:echo.src.base_objective:	optimizer:learning_rate : 5.5512193621753565e-05
INFO:echo.src.base_objective:	trainer:train_batch_size : 45
INFO:echo.src.base_objective:	trainer:weight_decay : 5.790376962241808e-09
INFO:echo.src.base_objective:	trainer:training_loss : smooth
INFO:echo.src.base_objective:Beginning trial 72
INFO:root:Loading model deeplabv3 with settings {'in_channels': 4, 'classes': 1, 'activation': 'sigmoid'}
INFO:root:Loading loss smooth
INFO:root:Loading loss smooth
INFO:echo.src.base_objective:Saving trial 71 results to local file /glade/work/kdagon/s2sml/results_week3_SH_515/trial_results/trial_results_29815.gusched01.csv
INFO:echo.src.base_objective:Merging trial results and saving to /glade/work/kdagon/s2sml/results_week3_SH_515/trial_results.csv
[32m[I 2023-05-15 22:11:57,995][0m Trial 71 finished with values: [0.9623702935971195, 0.4028605921442006, 0.6932825707354546] and parameters: {'learning_rate': 0.0005243032610041411, 'norm': 'minmax', 'weight_decay': 1.3569791254567176e-09, 'train_batch_size': 36, 'training_loss': 'smooth', 'model_name': 'linknet'}. [0m
INFO:echo.src.base_objective:Attempting to automatically update the model configuration using optuna's suggested parameters
INFO:echo.src.base_objective:	data:norm : None
INFO:echo.src.base_objective:	model:name : fpn
INFO:echo.src.base_objective:	optimizer:learning_rate : 1.1691567973779505e-05
INFO:echo.src.base_objective:	trainer:train_batch_size : 100
INFO:echo.src.base_objective:	trainer:weight_decay : 6.895677297444062e-05
INFO:echo.src.base_objective:	trainer:training_loss : mse
INFO:echo.src.base_objective:Beginning trial 73
INFO:root:Loading model fpn with settings {'in_channels': 4, 'classes': 1, 'activation': 'sigmoid'}
INFO:root:Loading loss smooth
INFO:root:Loading loss smooth
INFO:echo.src.base_objective:Saving trial 73 results to local file /glade/work/kdagon/s2sml/results_week3_SH_515/trial_results/trial_results_29815.gusched01.csv
INFO:echo.src.base_objective:Merging trial results and saving to /glade/work/kdagon/s2sml/results_week3_SH_515/trial_results.csv
[32m[I 2023-05-15 22:15:01,861][0m Trial 73 finished with values: [4.71167324727965, 12070.941791603529, 162.43276538750175] and parameters: {'learning_rate': 1.1691567973779505e-05, 'norm': 'None', 'weight_decay': 6.895677297444062e-05, 'train_batch_size': 100, 'training_loss': 'mse', 'model_name': 'fpn'}. [0m
INFO:echo.src.base_objective:Attempting to automatically update the model configuration using optuna's suggested parameters
INFO:echo.src.base_objective:	data:norm : negone
INFO:echo.src.base_objective:	model:name : linknet
INFO:echo.src.base_objective:	optimizer:learning_rate : 1.260857603935773e-06
INFO:echo.src.base_objective:	trainer:train_batch_size : 58
INFO:echo.src.base_objective:	trainer:weight_decay : 4.506159670631628e-08
INFO:echo.src.base_objective:	trainer:training_loss : xsigmoid
INFO:echo.src.base_objective:Beginning trial 74
INFO:root:Loading model linknet with settings {'in_channels': 4, 'classes': 1, 'activation': 'sigmoid'}
INFO:root:Loading loss smooth
INFO:root:Loading loss smooth
INFO:echo.src.base_objective:Saving trial 72 results to local file /glade/work/kdagon/s2sml/results_week3_SH_515/trial_results/trial_results_29816.gusched01.csv
INFO:echo.src.base_objective:Merging trial results and saving to /glade/work/kdagon/s2sml/results_week3_SH_515/trial_results.csv
[32m[I 2023-05-15 22:16:03,643][0m Trial 72 finished with values: [1.0714470181714142, 1.5329553117315335, 1.2479300895998606] and parameters: {'learning_rate': 5.5512193621753565e-05, 'norm': 'minmax', 'weight_decay': 5.790376962241808e-09, 'train_batch_size': 45, 'training_loss': 'smooth', 'model_name': 'deeplabv3'}. [0m
INFO:echo.src.base_objective:Attempting to automatically update the model configuration using optuna's suggested parameters
INFO:echo.src.base_objective:	data:norm : None
INFO:echo.src.base_objective:	model:name : fpn
INFO:echo.src.base_objective:	optimizer:learning_rate : 0.0009782784324788385
INFO:echo.src.base_objective:	trainer:train_batch_size : 53
INFO:echo.src.base_objective:	trainer:weight_decay : 4.821275764196279e-12
INFO:echo.src.base_objective:	trainer:training_loss : xtanh
INFO:echo.src.base_objective:Beginning trial 75
INFO:root:Loading model fpn with settings {'in_channels': 4, 'classes': 1, 'activation': 'sigmoid'}
INFO:root:Loading loss smooth
INFO:root:Loading loss smooth
INFO:echo.src.base_objective:Saving trial 74 results to local file /glade/work/kdagon/s2sml/results_week3_SH_515/trial_results/trial_results_29815.gusched01.csv
INFO:echo.src.base_objective:Merging trial results and saving to /glade/work/kdagon/s2sml/results_week3_SH_515/trial_results.csv
[32m[I 2023-05-15 22:18:13,248][0m Trial 74 finished with values: [9.139885572113887, 13.14415146364382, 4.488502816606152] and parameters: {'learning_rate': 1.260857603935773e-06, 'norm': 'negone', 'weight_decay': 4.506159670631628e-08, 'train_batch_size': 58, 'training_loss': 'xsigmoid', 'model_name': 'linknet'}. [0m
INFO:echo.src.base_objective:Attempting to automatically update the model configuration using optuna's suggested parameters
INFO:echo.src.base_objective:	data:norm : negone
INFO:echo.src.base_objective:	model:name : deeplabv3
INFO:echo.src.base_objective:	optimizer:learning_rate : 0.00019383811480329274
INFO:echo.src.base_objective:	trainer:train_batch_size : 72
INFO:echo.src.base_objective:	trainer:weight_decay : 2.7741099632828576e-10
INFO:echo.src.base_objective:	trainer:training_loss : logcosh
INFO:echo.src.base_objective:Beginning trial 76
INFO:root:Loading model deeplabv3 with settings {'in_channels': 4, 'classes': 1, 'activation': 'sigmoid'}
INFO:root:Loading loss smooth
INFO:root:Loading loss smooth
INFO:echo.src.base_objective:Saving trial 75 results to local file /glade/work/kdagon/s2sml/results_week3_SH_515/trial_results/trial_results_29816.gusched01.csv
INFO:echo.src.base_objective:Merging trial results and saving to /glade/work/kdagon/s2sml/results_week3_SH_515/trial_results.csv
[32m[I 2023-05-15 22:18:54,906][0m Trial 75 finished with values: [26.896062931867547, 12056.507611742445, 162.33530580550791] and parameters: {'learning_rate': 0.0009782784324788385, 'norm': 'None', 'weight_decay': 4.821275764196279e-12, 'train_batch_size': 53, 'training_loss': 'xtanh', 'model_name': 'fpn'}. [0m
INFO:echo.src.base_objective:Attempting to automatically update the model configuration using optuna's suggested parameters
INFO:echo.src.base_objective:	data:norm : minmax
INFO:echo.src.base_objective:	model:name : unet
INFO:echo.src.base_objective:	optimizer:learning_rate : 0.001543829646653862
INFO:echo.src.base_objective:	trainer:train_batch_size : 113
INFO:echo.src.base_objective:	trainer:weight_decay : 3.225840810069256e-06
INFO:echo.src.base_objective:	trainer:training_loss : logcosh
INFO:echo.src.base_objective:Beginning trial 77
INFO:root:Loading model unet with settings {'in_channels': 4, 'classes': 1, 'activation': 'sigmoid'}
INFO:root:Loading loss smooth
INFO:root:Loading loss smooth
INFO:echo.src.base_objective:Saving trial 76 results to local file /glade/work/kdagon/s2sml/results_week3_SH_515/trial_results/trial_results_29815.gusched01.csv
INFO:echo.src.base_objective:Merging trial results and saving to /glade/work/kdagon/s2sml/results_week3_SH_515/trial_results.csv
[32m[I 2023-05-15 22:26:50,772][0m Trial 76 finished with values: [1.0852163207730339, 1.8288438232762836, 1.392896936341758] and parameters: {'learning_rate': 0.00019383811480329274, 'norm': 'negone', 'weight_decay': 2.7741099632828576e-10, 'train_batch_size': 72, 'training_loss': 'logcosh', 'model_name': 'deeplabv3'}. [0m
INFO:echo.src.base_objective:Attempting to automatically update the model configuration using optuna's suggested parameters
INFO:echo.src.base_objective:	data:norm : None
INFO:echo.src.base_objective:	model:name : deeplabv3+
INFO:echo.src.base_objective:	optimizer:learning_rate : 0.0002117026263908324
INFO:echo.src.base_objective:	trainer:train_batch_size : 90
INFO:echo.src.base_objective:	trainer:weight_decay : 6.752415201465598e-10
INFO:echo.src.base_objective:	trainer:training_loss : xsigmoid
INFO:echo.src.base_objective:Beginning trial 78
INFO:root:Loading model deeplabv3+ with settings {'in_channels': 4, 'classes': 1, 'activation': 'sigmoid'}
INFO:root:Loading loss smooth
INFO:root:Loading loss smooth
INFO:echo.src.base_objective:Saving trial 78 results to local file /glade/work/kdagon/s2sml/results_week3_SH_515/trial_results/trial_results_29815.gusched01.csv
INFO:echo.src.base_objective:Merging trial results and saving to /glade/work/kdagon/s2sml/results_week3_SH_515/trial_results.csv
[32m[I 2023-05-15 22:29:16,209][0m Trial 78 finished with values: [2.4036497535323638, 12101.238459978764, 162.63636305389312] and parameters: {'learning_rate': 0.0002117026263908324, 'norm': 'None', 'weight_decay': 6.752415201465598e-10, 'train_batch_size': 90, 'training_loss': 'xsigmoid', 'model_name': 'deeplabv3+'}. [0m
INFO:echo.src.base_objective:Attempting to automatically update the model configuration using optuna's suggested parameters
INFO:echo.src.base_objective:	data:norm : zscore
INFO:echo.src.base_objective:	model:name : pspnet
INFO:echo.src.base_objective:	optimizer:learning_rate : 0.009370265556753596
INFO:echo.src.base_objective:	trainer:train_batch_size : 115
INFO:echo.src.base_objective:	trainer:weight_decay : 6.130607547006741e-06
INFO:echo.src.base_objective:	trainer:training_loss : huber
INFO:echo.src.base_objective:Beginning trial 79
INFO:root:Loading model pspnet with settings {'in_channels': 4, 'classes': 1, 'activation': 'sigmoid'}
INFO:root:Loading loss smooth
INFO:root:Loading loss smooth
INFO:echo.src.base_objective:Saving trial 79 results to local file /glade/work/kdagon/s2sml/results_week3_SH_515/trial_results/trial_results_29815.gusched01.csv
INFO:echo.src.base_objective:Merging trial results and saving to /glade/work/kdagon/s2sml/results_week3_SH_515/trial_results.csv
[32m[I 2023-05-15 22:37:56,334][0m Trial 79 finished with values: [1.2011408570689115, 3.834856891839889, 2.191821163739874] and parameters: {'learning_rate': 0.009370265556753596, 'norm': 'zscore', 'weight_decay': 6.130607547006741e-06, 'train_batch_size': 115, 'training_loss': 'huber', 'model_name': 'pspnet'}. [0m
INFO:echo.src.base_objective:Attempting to automatically update the model configuration using optuna's suggested parameters
INFO:echo.src.base_objective:	data:norm : zscore
INFO:echo.src.base_objective:	model:name : pspnet
INFO:echo.src.base_objective:	optimizer:learning_rate : 0.003715363789441839
INFO:echo.src.base_objective:	trainer:train_batch_size : 48
INFO:echo.src.base_objective:	trainer:weight_decay : 5.025754217386805e-09
INFO:echo.src.base_objective:	trainer:training_loss : xtanh
INFO:echo.src.base_objective:Beginning trial 80
INFO:root:Loading model pspnet with settings {'in_channels': 4, 'classes': 1, 'activation': 'sigmoid'}
INFO:root:Loading loss smooth
INFO:root:Loading loss smooth
INFO:echo.src.base_objective:Saving trial 80 results to local file /glade/work/kdagon/s2sml/results_week3_SH_515/trial_results/trial_results_29815.gusched01.csv
INFO:echo.src.base_objective:Merging trial results and saving to /glade/work/kdagon/s2sml/results_week3_SH_515/trial_results.csv
[32m[I 2023-05-15 22:44:06,249][0m Trial 80 finished with values: [1.1954199271243358, 3.8093753299369464, 2.1816529309993924] and parameters: {'learning_rate': 0.003715363789441839, 'norm': 'zscore', 'weight_decay': 5.025754217386805e-09, 'train_batch_size': 48, 'training_loss': 'xtanh', 'model_name': 'pspnet'}. [0m
INFO:echo.src.base_objective:Attempting to automatically update the model configuration using optuna's suggested parameters
INFO:echo.src.base_objective:	data:norm : minmax
INFO:echo.src.base_objective:	model:name : deeplabv3
INFO:echo.src.base_objective:	optimizer:learning_rate : 6.671854689730093e-06
INFO:echo.src.base_objective:	trainer:train_batch_size : 82
INFO:echo.src.base_objective:	trainer:weight_decay : 1.2819747667737204e-11
INFO:echo.src.base_objective:	trainer:training_loss : logcosh
INFO:echo.src.base_objective:Beginning trial 81
INFO:root:Loading model deeplabv3 with settings {'in_channels': 4, 'classes': 1, 'activation': 'sigmoid'}
INFO:root:Loading loss smooth
INFO:root:Loading loss smooth
INFO:echo.src.base_objective:Saving trial 77 results to local file /glade/work/kdagon/s2sml/results_week3_SH_515/trial_results/trial_results_29816.gusched01.csv
INFO:echo.src.base_objective:Merging trial results and saving to /glade/work/kdagon/s2sml/results_week3_SH_515/trial_results.csv
[32m[I 2023-05-15 22:50:55,691][0m Trial 77 finished with values: [0.9629209390642203, 0.4103080146331468, 0.6905006562840991] and parameters: {'learning_rate': 0.001543829646653862, 'norm': 'minmax', 'weight_decay': 3.225840810069256e-06, 'train_batch_size': 113, 'training_loss': 'logcosh', 'model_name': 'unet'}. [0m
INFO:echo.src.base_objective:Attempting to automatically update the model configuration using optuna's suggested parameters
INFO:echo.src.base_objective:	data:norm : negone
INFO:echo.src.base_objective:	model:name : fpn
INFO:echo.src.base_objective:	optimizer:learning_rate : 3.278099906653877e-06
INFO:echo.src.base_objective:	trainer:train_batch_size : 62
INFO:echo.src.base_objective:	trainer:weight_decay : 1.0760786862749657e-06
INFO:echo.src.base_objective:	trainer:training_loss : xtanh
INFO:echo.src.base_objective:Beginning trial 82
INFO:root:Loading model fpn with settings {'in_channels': 4, 'classes': 1, 'activation': 'sigmoid'}
INFO:root:Loading loss smooth
INFO:root:Loading loss smooth
INFO:echo.src.base_objective:Saving trial 81 results to local file /glade/work/kdagon/s2sml/results_week3_SH_515/trial_results/trial_results_29815.gusched01.csv
INFO:echo.src.base_objective:Merging trial results and saving to /glade/work/kdagon/s2sml/results_week3_SH_515/trial_results.csv
[32m[I 2023-05-15 22:53:03,180][0m Trial 81 finished with values: [1.1898569264361054, 4.243614869358704, 2.097893475791711] and parameters: {'learning_rate': 6.671854689730093e-06, 'norm': 'minmax', 'weight_decay': 1.2819747667737204e-11, 'train_batch_size': 82, 'training_loss': 'logcosh', 'model_name': 'deeplabv3'}. [0m
INFO:echo.src.base_objective:Attempting to automatically update the model configuration using optuna's suggested parameters
INFO:echo.src.base_objective:	data:norm : negone
INFO:echo.src.base_objective:	model:name : deeplabv3
INFO:echo.src.base_objective:	optimizer:learning_rate : 0.0010208522623232218
INFO:echo.src.base_objective:	trainer:train_batch_size : 13
INFO:echo.src.base_objective:	trainer:weight_decay : 0.000279636987561752
INFO:echo.src.base_objective:	trainer:training_loss : mae
INFO:echo.src.base_objective:Beginning trial 83
INFO:root:Loading model deeplabv3 with settings {'in_channels': 4, 'classes': 1, 'activation': 'sigmoid'}
INFO:root:Loading loss smooth
INFO:root:Loading loss smooth
INFO:echo.src.base_objective:Saving trial 83 results to local file /glade/work/kdagon/s2sml/results_week3_SH_515/trial_results/trial_results_29815.gusched01.csv
INFO:echo.src.base_objective:Merging trial results and saving to /glade/work/kdagon/s2sml/results_week3_SH_515/trial_results.csv
[32m[I 2023-05-15 23:01:54,550][0m Trial 83 finished with values: [1.0798266168067743, 1.6036690690266076, 1.2716455114338492] and parameters: {'learning_rate': 0.0010208522623232218, 'norm': 'negone', 'weight_decay': 0.000279636987561752, 'train_batch_size': 13, 'training_loss': 'mae', 'model_name': 'deeplabv3'}. [0m
WARNING:root:Stopping early since the longest observed run-time in the study exceeds the time remaining on this node.
INFO:root:Saving trial details to /glade/work/kdagon/s2sml/results_week3_SH_515/
INFO:root:Running on PBS/SLURM batch id: 29817.gusched01
INFO:root:Importing custom objective from /glade/work/kdagon/s2sml/applications/train.py
INFO:echo.src.reporting:Using device 0
INFO:root:Direction of optimization: ['minimize', 'minimize', 'minimize']
INFO:root:Using metric ['valid_custom', 'valid_custom_second', 'valid_custom_third']
[32m[I 2023-05-15 23:02:53,348][0m Using an existing study with name 'vanilla' instead of creating a new one.[0m
INFO:root:Loaded study vanilla located at sqlite:////glade/work/kdagon/s2sml/results_week3_SH_515/s2s.db
INFO:echo.src.base_objective:Worker 29817.gusched01 is summoned.
INFO:echo.src.base_objective:	initializing an objective to be optimized with metric ['valid_custom', 'valid_custom_second', 'valid_custom_third']
INFO:echo.src.base_objective:	using device(s) cuda:0
INFO:echo.src.base_objective:	saving study/trial results to local file /glade/work/kdagon/s2sml/results_week3_SH_515/trial_results/trial_results_29817.gusched01.csv
INFO:root:Running optimization for 1000 trials
INFO:root:Running trials for a maximum PBS wall-time 2:00:00
WARNING:root:Attempting to run trials and stop before hitting the wall-time
WARNING:root:Some trials may not complete if the wall-time is reached. Optuna will start over.
INFO:echo.src.base_objective:Attempting to automatically update the model configuration using optuna's suggested parameters
INFO:echo.src.base_objective:	data:norm : zscore
INFO:echo.src.base_objective:	model:name : pspnet
INFO:echo.src.base_objective:	optimizer:learning_rate : 0.002448449289114721
INFO:echo.src.base_objective:	trainer:train_batch_size : 49
INFO:echo.src.base_objective:	trainer:weight_decay : 9.944007125656899e-05
INFO:echo.src.base_objective:	trainer:training_loss : logcosh
INFO:echo.src.base_objective:Beginning trial 84
INFO:root:Loading model pspnet with settings {'in_channels': 4, 'classes': 1, 'activation': 'sigmoid'}
INFO:root:Loading loss smooth
INFO:root:Loading loss smooth
INFO:echo.src.base_objective:Saving trial 82 results to local file /glade/work/kdagon/s2sml/results_week3_SH_515/trial_results/trial_results_29816.gusched01.csv
INFO:echo.src.base_objective:Merging trial results and saving to /glade/work/kdagon/s2sml/results_week3_SH_515/trial_results.csv
