[32m[I 2023-05-15 20:38:16,785][0m Trial 55 finished with values: [14.237814947043931, 18.110673113439198, 5.291405474507604] and parameters: {'learning_rate': 4.735029692918727e-06, 'norm': 'minmax', 'weight_decay': 7.61959816710682e-06, 'train_batch_size': 100, 'training_loss': 'xtanh', 'model_name': 'linknet'}. [0m
INFO:echo.src.base_objective:Attempting to automatically update the model configuration using optuna's suggested parameters
INFO:echo.src.base_objective:	data:norm : minmax
INFO:echo.src.base_objective:	model:name : unet++
INFO:echo.src.base_objective:	optimizer:learning_rate : 3.341895100364569e-05
INFO:echo.src.base_objective:	trainer:train_batch_size : 57
INFO:echo.src.base_objective:	trainer:weight_decay : 1.4249034335311785e-11
INFO:echo.src.base_objective:	trainer:training_loss : logcosh
INFO:echo.src.base_objective:Beginning trial 57
INFO:root:Loading model unet++ with settings {'in_channels': 4, 'classes': 1, 'activation': 'sigmoid'}
INFO:root:Loading loss smooth
INFO:root:Loading loss smooth
INFO:echo.src.base_objective:Saving trial 56 results to local file /glade/work/kdagon/s2sml/results_week3_SH_515/trial_results/trial_results_29814.gusched01.csv
INFO:echo.src.base_objective:Merging trial results and saving to /glade/work/kdagon/s2sml/results_week3_SH_515/trial_results.csv
[32m[I 2023-05-15 20:45:07,752][0m Trial 56 finished with values: [1.0620855065882069, 1.4216948546289343, 1.2338801324019182] and parameters: {'learning_rate': 0.0001844841742509137, 'norm': 'minmax', 'weight_decay': 4.549818706312426e-07, 'train_batch_size': 60, 'training_loss': 'smooth', 'model_name': 'deeplabv3'}. [0m
INFO:echo.src.base_objective:Attempting to automatically update the model configuration using optuna's suggested parameters
INFO:echo.src.base_objective:	data:norm : negone
INFO:echo.src.base_objective:	model:name : manet
INFO:echo.src.base_objective:	optimizer:learning_rate : 0.004650173103552172
INFO:echo.src.base_objective:	trainer:train_batch_size : 85
INFO:echo.src.base_objective:	trainer:weight_decay : 1.3736603528052226e-07
INFO:echo.src.base_objective:	trainer:training_loss : mse
INFO:echo.src.base_objective:Beginning trial 58
INFO:root:Loading model manet with settings {'in_channels': 4, 'classes': 1, 'activation': 'sigmoid'}
INFO:root:Loading loss smooth
INFO:root:Loading loss smooth
INFO:echo.src.base_objective:Saving trial 57 results to local file /glade/work/kdagon/s2sml/results_week3_SH_515/trial_results/trial_results_29813.gusched01.csv
INFO:echo.src.base_objective:Merging trial results and saving to /glade/work/kdagon/s2sml/results_week3_SH_515/trial_results.csv
[32m[I 2023-05-15 20:53:02,619][0m Trial 57 finished with values: [0.971446613017617, 0.5066323684130042, 0.7854787589251356] and parameters: {'learning_rate': 3.341895100364569e-05, 'norm': 'minmax', 'weight_decay': 1.4249034335311785e-11, 'train_batch_size': 57, 'training_loss': 'logcosh', 'model_name': 'unet++'}. [0m
INFO:echo.src.base_objective:Attempting to automatically update the model configuration using optuna's suggested parameters
INFO:echo.src.base_objective:	data:norm : negone
INFO:echo.src.base_objective:	model:name : unet++
INFO:echo.src.base_objective:	optimizer:learning_rate : 7.509659978052965e-05
INFO:echo.src.base_objective:	trainer:train_batch_size : 120
INFO:echo.src.base_objective:	trainer:weight_decay : 9.338368093497487e-11
INFO:echo.src.base_objective:	trainer:training_loss : mse
INFO:echo.src.base_objective:Beginning trial 59
INFO:root:Loading model unet++ with settings {'in_channels': 4, 'classes': 1, 'activation': 'sigmoid'}
INFO:root:Loading loss smooth
INFO:root:Loading loss smooth
INFO:echo.src.base_objective:Saving trial 58 results to local file /glade/work/kdagon/s2sml/results_week3_SH_515/trial_results/trial_results_29814.gusched01.csv
INFO:echo.src.base_objective:Merging trial results and saving to /glade/work/kdagon/s2sml/results_week3_SH_515/trial_results.csv
[32m[I 2023-05-15 21:00:46,158][0m Trial 58 finished with values: [0.9992654357272517, 0.9333332168358807, 0.9321860129657432] and parameters: {'learning_rate': 0.004650173103552172, 'norm': 'negone', 'weight_decay': 1.3736603528052226e-07, 'train_batch_size': 85, 'training_loss': 'mse', 'model_name': 'manet'}. [0m
INFO:echo.src.base_objective:Attempting to automatically update the model configuration using optuna's suggested parameters
INFO:echo.src.base_objective:	data:norm : negone
INFO:echo.src.base_objective:	model:name : unet++
INFO:echo.src.base_objective:	optimizer:learning_rate : 0.0021872276593804503
INFO:echo.src.base_objective:	trainer:train_batch_size : 40
INFO:echo.src.base_objective:	trainer:weight_decay : 0.00019632547770132675
INFO:echo.src.base_objective:	trainer:training_loss : logcosh
INFO:echo.src.base_objective:Beginning trial 60
INFO:root:Loading model unet++ with settings {'in_channels': 4, 'classes': 1, 'activation': 'sigmoid'}
INFO:root:Loading loss smooth
INFO:root:Loading loss smooth
INFO:echo.src.base_objective:Saving trial 59 results to local file /glade/work/kdagon/s2sml/results_week3_SH_515/trial_results/trial_results_29813.gusched01.csv
INFO:echo.src.base_objective:Merging trial results and saving to /glade/work/kdagon/s2sml/results_week3_SH_515/trial_results.csv
[32m[I 2023-05-15 21:09:03,921][0m Trial 59 finished with values: [0.9995704148461297, 2.586160751073394, 1.922922966005491] and parameters: {'learning_rate': 7.509659978052965e-05, 'norm': 'negone', 'weight_decay': 9.338368093497487e-11, 'train_batch_size': 120, 'training_loss': 'mse', 'model_name': 'unet++'}. [0m
INFO:echo.src.base_objective:Attempting to automatically update the model configuration using optuna's suggested parameters
INFO:echo.src.base_objective:	data:norm : None
INFO:echo.src.base_objective:	model:name : deeplabv3+
INFO:echo.src.base_objective:	optimizer:learning_rate : 2.961938364893448e-06
INFO:echo.src.base_objective:	trainer:train_batch_size : 30
INFO:echo.src.base_objective:	trainer:weight_decay : 2.451316329097341e-05
INFO:echo.src.base_objective:	trainer:training_loss : huber
INFO:echo.src.base_objective:Beginning trial 61
INFO:root:Loading model deeplabv3+ with settings {'in_channels': 4, 'classes': 1, 'activation': 'sigmoid'}
INFO:root:Loading loss smooth
INFO:root:Loading loss smooth
INFO:echo.src.base_objective:Saving trial 60 results to local file /glade/work/kdagon/s2sml/results_week3_SH_515/trial_results/trial_results_29814.gusched01.csv
INFO:echo.src.base_objective:Merging trial results and saving to /glade/work/kdagon/s2sml/results_week3_SH_515/trial_results.csv
[32m[I 2023-05-15 21:10:13,562][0m Trial 60 finished with values: [0.9934460669953492, 0.8849830965705073, 0.8963906658093451] and parameters: {'learning_rate': 0.0021872276593804503, 'norm': 'negone', 'weight_decay': 0.00019632547770132675, 'train_batch_size': 40, 'training_loss': 'logcosh', 'model_name': 'unet++'}. [0m
INFO:echo.src.base_objective:Attempting to automatically update the model configuration using optuna's suggested parameters
INFO:echo.src.base_objective:	data:norm : minmax
INFO:echo.src.base_objective:	model:name : manet
INFO:echo.src.base_objective:	optimizer:learning_rate : 2.499727708676736e-06
INFO:echo.src.base_objective:	trainer:train_batch_size : 65
INFO:echo.src.base_objective:	trainer:weight_decay : 1.084592485543726e-06
INFO:echo.src.base_objective:	trainer:training_loss : xtanh
INFO:echo.src.base_objective:Beginning trial 62
INFO:root:Loading model manet with settings {'in_channels': 4, 'classes': 1, 'activation': 'sigmoid'}
INFO:root:Loading loss smooth
INFO:root:Loading loss smooth
INFO:echo.src.base_objective:Saving trial 61 results to local file /glade/work/kdagon/s2sml/results_week3_SH_515/trial_results/trial_results_29813.gusched01.csv
INFO:echo.src.base_objective:Merging trial results and saving to /glade/work/kdagon/s2sml/results_week3_SH_515/trial_results.csv
[32m[I 2023-05-15 21:12:07,046][0m Trial 61 finished with values: [18.35194571507617, 12100.127938445108, 162.62888218482112] and parameters: {'learning_rate': 2.961938364893448e-06, 'norm': 'None', 'weight_decay': 2.451316329097341e-05, 'train_batch_size': 30, 'training_loss': 'huber', 'model_name': 'deeplabv3+'}. [0m
INFO:echo.src.base_objective:Attempting to automatically update the model configuration using optuna's suggested parameters
INFO:echo.src.base_objective:	data:norm : None
INFO:echo.src.base_objective:	model:name : unet
INFO:echo.src.base_objective:	optimizer:learning_rate : 2.1289987851043295e-05
INFO:echo.src.base_objective:	trainer:train_batch_size : 15
INFO:echo.src.base_objective:	trainer:weight_decay : 2.9923409986845876e-05
INFO:echo.src.base_objective:	trainer:training_loss : xsigmoid
INFO:echo.src.base_objective:Beginning trial 63
INFO:root:Loading model unet with settings {'in_channels': 4, 'classes': 1, 'activation': 'sigmoid'}
INFO:root:Loading loss smooth
INFO:root:Loading loss smooth
INFO:echo.src.base_objective:Saving trial 63 results to local file /glade/work/kdagon/s2sml/results_week3_SH_515/trial_results/trial_results_29813.gusched01.csv
INFO:echo.src.base_objective:Merging trial results and saving to /glade/work/kdagon/s2sml/results_week3_SH_515/trial_results.csv
[32m[I 2023-05-15 21:15:57,400][0m Trial 63 finished with values: [61.27643371451215, 12085.128675306234, 162.52786875609297] and parameters: {'learning_rate': 2.1289987851043295e-05, 'norm': 'None', 'weight_decay': 2.9923409986845876e-05, 'train_batch_size': 15, 'training_loss': 'xsigmoid', 'model_name': 'unet'}. [0m
INFO:echo.src.base_objective:Attempting to automatically update the model configuration using optuna's suggested parameters
INFO:echo.src.base_objective:	data:norm : None
INFO:echo.src.base_objective:	model:name : pspnet
INFO:echo.src.base_objective:	optimizer:learning_rate : 8.531765456229314e-06
INFO:echo.src.base_objective:	trainer:train_batch_size : 53
INFO:echo.src.base_objective:	trainer:weight_decay : 0.00038124278555552276
INFO:echo.src.base_objective:	trainer:training_loss : xsigmoid
INFO:echo.src.base_objective:Beginning trial 64
INFO:root:Loading model pspnet with settings {'in_channels': 4, 'classes': 1, 'activation': 'sigmoid'}
INFO:root:Loading loss smooth
INFO:root:Loading loss smooth
INFO:echo.src.base_objective:Saving trial 64 results to local file /glade/work/kdagon/s2sml/results_week3_SH_515/trial_results/trial_results_29813.gusched01.csv
INFO:echo.src.base_objective:Merging trial results and saving to /glade/work/kdagon/s2sml/results_week3_SH_515/trial_results.csv
[32m[I 2023-05-15 21:18:24,142][0m Trial 64 finished with values: [3.898538629251683, 12094.352013101101, 162.59026284912454] and parameters: {'learning_rate': 8.531765456229314e-06, 'norm': 'None', 'weight_decay': 0.00038124278555552276, 'train_batch_size': 53, 'training_loss': 'xsigmoid', 'model_name': 'pspnet'}. [0m
INFO:echo.src.base_objective:Attempting to automatically update the model configuration using optuna's suggested parameters
INFO:echo.src.base_objective:	data:norm : negone
INFO:echo.src.base_objective:	model:name : deeplabv3
INFO:echo.src.base_objective:	optimizer:learning_rate : 0.0014390542200185777
INFO:echo.src.base_objective:	trainer:train_batch_size : 115
INFO:echo.src.base_objective:	trainer:weight_decay : 5.079650090380997e-07
INFO:echo.src.base_objective:	trainer:training_loss : mae
INFO:echo.src.base_objective:Beginning trial 65
INFO:root:Loading model deeplabv3 with settings {'in_channels': 4, 'classes': 1, 'activation': 'sigmoid'}
INFO:root:Loading loss smooth
INFO:root:Loading loss smooth
INFO:echo.src.base_objective:Saving trial 65 results to local file /glade/work/kdagon/s2sml/results_week3_SH_515/trial_results/trial_results_29813.gusched01.csv
INFO:echo.src.base_objective:Merging trial results and saving to /glade/work/kdagon/s2sml/results_week3_SH_515/trial_results.csv
[32m[I 2023-05-15 21:34:15,729][0m Trial 65 finished with values: [1.0805271287527263, 1.6230496133316203, 1.271136931710552] and parameters: {'learning_rate': 0.0014390542200185777, 'norm': 'negone', 'weight_decay': 5.079650090380997e-07, 'train_batch_size': 115, 'training_loss': 'mae', 'model_name': 'deeplabv3'}. [0m
WARNING:root:Stopping early since the longest observed run-time in the study exceeds the time remaining on this node.
INFO:root:Saving trial details to /glade/work/kdagon/s2sml/results_week3_SH_515/
INFO:root:Running on PBS/SLURM batch id: 29815.gusched01
INFO:root:Importing custom objective from /glade/work/kdagon/s2sml/applications/train.py
INFO:echo.src.reporting:Using device 0
INFO:root:Direction of optimization: ['minimize', 'minimize', 'minimize']
INFO:root:Using metric ['valid_custom', 'valid_custom_second', 'valid_custom_third']
[32m[I 2023-05-15 21:34:39,139][0m Using an existing study with name 'vanilla' instead of creating a new one.[0m
INFO:root:Loaded study vanilla located at sqlite:////glade/work/kdagon/s2sml/results_week3_SH_515/s2s.db
INFO:echo.src.base_objective:Worker 29815.gusched01 is summoned.
INFO:echo.src.base_objective:	initializing an objective to be optimized with metric ['valid_custom', 'valid_custom_second', 'valid_custom_third']
INFO:echo.src.base_objective:	using device(s) cuda:0
INFO:echo.src.base_objective:	saving study/trial results to local file /glade/work/kdagon/s2sml/results_week3_SH_515/trial_results/trial_results_29815.gusched01.csv
INFO:root:Running optimization for 1000 trials
INFO:root:Running trials for a maximum PBS wall-time 2:00:00
WARNING:root:Attempting to run trials and stop before hitting the wall-time
WARNING:root:Some trials may not complete if the wall-time is reached. Optuna will start over.
INFO:echo.src.base_objective:Attempting to automatically update the model configuration using optuna's suggested parameters
INFO:echo.src.base_objective:	data:norm : None
INFO:echo.src.base_objective:	model:name : linknet
INFO:echo.src.base_objective:	optimizer:learning_rate : 0.004872609263480489
INFO:echo.src.base_objective:	trainer:train_batch_size : 52
INFO:echo.src.base_objective:	trainer:weight_decay : 2.904342019695146e-10
INFO:echo.src.base_objective:	trainer:training_loss : huber
INFO:echo.src.base_objective:Beginning trial 66
INFO:root:Loading model linknet with settings {'in_channels': 4, 'classes': 1, 'activation': 'sigmoid'}
INFO:root:Loading loss smooth
INFO:root:Loading loss smooth
INFO:echo.src.base_objective:Saving trial 66 results to local file /glade/work/kdagon/s2sml/results_week3_SH_515/trial_results/trial_results_29815.gusched01.csv
INFO:echo.src.base_objective:Merging trial results and saving to /glade/work/kdagon/s2sml/results_week3_SH_515/trial_results.csv
[32m[I 2023-05-15 21:38:40,927][0m Trial 66 finished with values: [226.95965384573736, 12061.516225641763, 162.36866596874782] and parameters: {'learning_rate': 0.004872609263480489, 'norm': 'None', 'weight_decay': 2.904342019695146e-10, 'train_batch_size': 52, 'training_loss': 'huber', 'model_name': 'linknet'}. [0m
INFO:echo.src.base_objective:Attempting to automatically update the model configuration using optuna's suggested parameters
INFO:echo.src.base_objective:	data:norm : minmax
INFO:echo.src.base_objective:	model:name : fpn
INFO:echo.src.base_objective:	optimizer:learning_rate : 0.0001325571211848526
INFO:echo.src.base_objective:	trainer:train_batch_size : 13
INFO:echo.src.base_objective:	trainer:weight_decay : 9.06479978525904e-10
INFO:echo.src.base_objective:	trainer:training_loss : mae
INFO:echo.src.base_objective:Beginning trial 67
INFO:root:Loading model fpn with settings {'in_channels': 4, 'classes': 1, 'activation': 'sigmoid'}
INFO:root:Loading loss smooth
INFO:root:Loading loss smooth
INFO:echo.src.base_objective:Saving trial 62 results to local file /glade/work/kdagon/s2sml/results_week3_SH_515/trial_results/trial_results_29814.gusched01.csv
INFO:echo.src.base_objective:Merging trial results and saving to /glade/work/kdagon/s2sml/results_week3_SH_515/trial_results.csv
[32m[I 2023-05-15 21:41:37,947][0m Trial 62 finished with values: [1.1707834599858302, 2.695742718491639, 1.7083741863140305] and parameters: {'learning_rate': 2.499727708676736e-06, 'norm': 'minmax', 'weight_decay': 1.084592485543726e-06, 'train_batch_size': 65, 'training_loss': 'xtanh', 'model_name': 'manet'}. [0m
WARNING:root:Stopping early since the longest observed run-time in the study exceeds the time remaining on this node.
INFO:root:Saving trial details to /glade/work/kdagon/s2sml/results_week3_SH_515/
INFO:root:Running on PBS/SLURM batch id: 29816.gusched01
INFO:root:Importing custom objective from /glade/work/kdagon/s2sml/applications/train.py
INFO:echo.src.reporting:Using device 0
INFO:root:Direction of optimization: ['minimize', 'minimize', 'minimize']
INFO:root:Using metric ['valid_custom', 'valid_custom_second', 'valid_custom_third']
[32m[I 2023-05-15 21:42:02,070][0m Using an existing study with name 'vanilla' instead of creating a new one.[0m
INFO:root:Loaded study vanilla located at sqlite:////glade/work/kdagon/s2sml/results_week3_SH_515/s2s.db
INFO:echo.src.base_objective:Worker 29816.gusched01 is summoned.
INFO:echo.src.base_objective:	initializing an objective to be optimized with metric ['valid_custom', 'valid_custom_second', 'valid_custom_third']
INFO:echo.src.base_objective:	using device(s) cuda:0
INFO:echo.src.base_objective:	saving study/trial results to local file /glade/work/kdagon/s2sml/results_week3_SH_515/trial_results/trial_results_29816.gusched01.csv
INFO:root:Running optimization for 1000 trials
INFO:root:Running trials for a maximum PBS wall-time 2:00:00
WARNING:root:Attempting to run trials and stop before hitting the wall-time
WARNING:root:Some trials may not complete if the wall-time is reached. Optuna will start over.
INFO:echo.src.base_objective:Attempting to automatically update the model configuration using optuna's suggested parameters
INFO:echo.src.base_objective:	data:norm : minmax
INFO:echo.src.base_objective:	model:name : deeplabv3
INFO:echo.src.base_objective:	optimizer:learning_rate : 1.0234651855809308e-05
INFO:echo.src.base_objective:	trainer:train_batch_size : 10
INFO:echo.src.base_objective:	trainer:weight_decay : 4.3321024794264956e-05
INFO:echo.src.base_objective:	trainer:training_loss : logcosh
INFO:echo.src.base_objective:Beginning trial 68
INFO:root:Loading model deeplabv3 with settings {'in_channels': 4, 'classes': 1, 'activation': 'sigmoid'}
INFO:root:Loading loss smooth
INFO:root:Loading loss smooth
INFO:echo.src.base_objective:Saving trial 67 results to local file /glade/work/kdagon/s2sml/results_week3_SH_515/trial_results/trial_results_29815.gusched01.csv
INFO:echo.src.base_objective:Merging trial results and saving to /glade/work/kdagon/s2sml/results_week3_SH_515/trial_results.csv
[32m[I 2023-05-15 21:49:36,379][0m Trial 67 finished with values: [1.026951111568164, 1.262493899147706, 1.179970288539674] and parameters: {'learning_rate': 0.0001325571211848526, 'norm': 'minmax', 'weight_decay': 9.06479978525904e-10, 'train_batch_size': 13, 'training_loss': 'mae', 'model_name': 'fpn'}. [0m
INFO:echo.src.base_objective:Attempting to automatically update the model configuration using optuna's suggested parameters
INFO:echo.src.base_objective:	data:norm : negone
INFO:echo.src.base_objective:	model:name : fpn
INFO:echo.src.base_objective:	optimizer:learning_rate : 0.0017728644242675962
INFO:echo.src.base_objective:	trainer:train_batch_size : 15
INFO:echo.src.base_objective:	trainer:weight_decay : 1.954842764313202e-12
INFO:echo.src.base_objective:	trainer:training_loss : smooth
INFO:echo.src.base_objective:Beginning trial 69
INFO:root:Loading model fpn with settings {'in_channels': 4, 'classes': 1, 'activation': 'sigmoid'}
INFO:root:Loading loss smooth
INFO:root:Loading loss smooth
INFO:echo.src.base_objective:Saving trial 68 results to local file /glade/work/kdagon/s2sml/results_week3_SH_515/trial_results/trial_results_29816.gusched01.csv
INFO:echo.src.base_objective:Merging trial results and saving to /glade/work/kdagon/s2sml/results_week3_SH_515/trial_results.csv
[32m[I 2023-05-15 21:52:23,416][0m Trial 68 finished with values: [1.0866644277555018, 1.902237330772186, 1.4628371283946486] and parameters: {'learning_rate': 1.0234651855809308e-05, 'norm': 'minmax', 'weight_decay': 4.3321024794264956e-05, 'train_batch_size': 10, 'training_loss': 'logcosh', 'model_name': 'deeplabv3'}. [0m
INFO:echo.src.base_objective:Attempting to automatically update the model configuration using optuna's suggested parameters
INFO:echo.src.base_objective:	data:norm : minmax
INFO:echo.src.base_objective:	model:name : fpn
INFO:echo.src.base_objective:	optimizer:learning_rate : 1.4737855820929227e-05
INFO:echo.src.base_objective:	trainer:train_batch_size : 98
INFO:echo.src.base_objective:	trainer:weight_decay : 1.418174317161037e-08
INFO:echo.src.base_objective:	trainer:training_loss : mse
INFO:echo.src.base_objective:Beginning trial 70
INFO:root:Loading model fpn with settings {'in_channels': 4, 'classes': 1, 'activation': 'sigmoid'}
INFO:root:Loading loss smooth
INFO:root:Loading loss smooth
INFO:echo.src.base_objective:Saving trial 69 results to local file /glade/work/kdagon/s2sml/results_week3_SH_515/trial_results/trial_results_29815.gusched01.csv
INFO:echo.src.base_objective:Merging trial results and saving to /glade/work/kdagon/s2sml/results_week3_SH_515/trial_results.csv
