[32m[I 2023-05-15 19:25:32,698][0m Trial 41 finished with values: [1.045171891883634, 1.8484210096671412, 1.4906826168236962] and parameters: {'learning_rate': 0.0006372821117275482, 'norm': 'minmax', 'weight_decay': 2.2147949347932095e-06, 'train_batch_size': 53, 'training_loss': 'smooth', 'model_name': 'fpn'}. [0m
INFO:echo.src.base_objective:Attempting to automatically update the model configuration using optuna's suggested parameters
INFO:echo.src.base_objective:	data:norm : zscore
INFO:echo.src.base_objective:	model:name : unet++
INFO:echo.src.base_objective:	optimizer:learning_rate : 0.0029056254675701733
INFO:echo.src.base_objective:	trainer:train_batch_size : 10
INFO:echo.src.base_objective:	trainer:weight_decay : 0.00033643869608264687
INFO:echo.src.base_objective:	trainer:training_loss : huber
INFO:echo.src.base_objective:Beginning trial 43
INFO:root:Loading model unet++ with settings {'in_channels': 4, 'classes': 1, 'activation': 'sigmoid'}
INFO:root:Loading loss smooth
INFO:root:Loading loss smooth
INFO:echo.src.base_objective:Saving trial 42 results to local file /glade/work/kdagon/s2sml/results_week3_SH_515/trial_results/trial_results_29812.gusched01.csv
INFO:echo.src.base_objective:Merging trial results and saving to /glade/work/kdagon/s2sml/results_week3_SH_515/trial_results.csv
[32m[I 2023-05-15 19:29:20,025][0m Trial 42 finished with values: [0.9590280200026785, 0.3704726159894607, 0.6598440966476293] and parameters: {'learning_rate': 0.006797499063019266, 'norm': 'minmax', 'weight_decay': 1.204106282390783e-07, 'train_batch_size': 10, 'training_loss': 'xsigmoid', 'model_name': 'manet'}. [0m
INFO:echo.src.base_objective:Attempting to automatically update the model configuration using optuna's suggested parameters
INFO:echo.src.base_objective:	data:norm : None
INFO:echo.src.base_objective:	model:name : manet
INFO:echo.src.base_objective:	optimizer:learning_rate : 0.0009757379726010104
INFO:echo.src.base_objective:	trainer:train_batch_size : 121
INFO:echo.src.base_objective:	trainer:weight_decay : 1.1099984714746179e-12
INFO:echo.src.base_objective:	trainer:training_loss : xtanh
INFO:echo.src.base_objective:Beginning trial 44
INFO:root:Loading model manet with settings {'in_channels': 4, 'classes': 1, 'activation': 'sigmoid'}
INFO:root:Loading loss smooth
INFO:root:Loading loss smooth
INFO:echo.src.base_objective:Saving trial 43 results to local file /glade/work/kdagon/s2sml/results_week3_SH_515/trial_results/trial_results_29811.gusched01.csv
INFO:echo.src.base_objective:Merging trial results and saving to /glade/work/kdagon/s2sml/results_week3_SH_515/trial_results.csv
[32m[I 2023-05-15 19:30:05,244][0m Trial 43 finished with values: [1.094857255722744, 3.5994022757021917, 2.053852159086515] and parameters: {'learning_rate': 0.0029056254675701733, 'norm': 'zscore', 'weight_decay': 0.00033643869608264687, 'train_batch_size': 10, 'training_loss': 'huber', 'model_name': 'unet++'}. [0m
INFO:echo.src.base_objective:Attempting to automatically update the model configuration using optuna's suggested parameters
INFO:echo.src.base_objective:	data:norm : minmax
INFO:echo.src.base_objective:	model:name : fpn
INFO:echo.src.base_objective:	optimizer:learning_rate : 0.0036893204518289105
INFO:echo.src.base_objective:	trainer:train_batch_size : 28
INFO:echo.src.base_objective:	trainer:weight_decay : 5.958163674363907e-12
INFO:echo.src.base_objective:	trainer:training_loss : huber
INFO:echo.src.base_objective:Beginning trial 45
INFO:root:Loading model fpn with settings {'in_channels': 4, 'classes': 1, 'activation': 'sigmoid'}
INFO:root:Loading loss smooth
INFO:root:Loading loss smooth
INFO:echo.src.base_objective:Saving trial 44 results to local file /glade/work/kdagon/s2sml/results_week3_SH_515/trial_results/trial_results_29812.gusched01.csv
INFO:echo.src.base_objective:Merging trial results and saving to /glade/work/kdagon/s2sml/results_week3_SH_515/trial_results.csv
[32m[I 2023-05-15 19:32:10,267][0m Trial 44 finished with values: [13.16503851893701, 12137.365944200452, 162.87918321189815] and parameters: {'learning_rate': 0.0009757379726010104, 'norm': 'None', 'weight_decay': 1.1099984714746179e-12, 'train_batch_size': 121, 'training_loss': 'xtanh', 'model_name': 'manet'}. [0m
INFO:echo.src.base_objective:Attempting to automatically update the model configuration using optuna's suggested parameters
INFO:echo.src.base_objective:	data:norm : zscore
INFO:echo.src.base_objective:	model:name : linknet
INFO:echo.src.base_objective:	optimizer:learning_rate : 0.00029748501296783525
INFO:echo.src.base_objective:	trainer:train_batch_size : 118
INFO:echo.src.base_objective:	trainer:weight_decay : 8.803754277025888e-11
INFO:echo.src.base_objective:	trainer:training_loss : logcosh
INFO:echo.src.base_objective:Beginning trial 46
INFO:root:Loading model linknet with settings {'in_channels': 4, 'classes': 1, 'activation': 'sigmoid'}
INFO:root:Loading loss smooth
INFO:root:Loading loss smooth
INFO:echo.src.base_objective:Saving trial 45 results to local file /glade/work/kdagon/s2sml/results_week3_SH_515/trial_results/trial_results_29811.gusched01.csv
INFO:echo.src.base_objective:Merging trial results and saving to /glade/work/kdagon/s2sml/results_week3_SH_515/trial_results.csv
[32m[I 2023-05-15 19:33:02,248][0m Trial 45 finished with values: [26.20750486136065, 84.24837430962802, 13.046016287314787] and parameters: {'learning_rate': 0.0036893204518289105, 'norm': 'minmax', 'weight_decay': 5.958163674363907e-12, 'train_batch_size': 28, 'training_loss': 'huber', 'model_name': 'fpn'}. [0m
INFO:echo.src.base_objective:Attempting to automatically update the model configuration using optuna's suggested parameters
INFO:echo.src.base_objective:	data:norm : negone
INFO:echo.src.base_objective:	model:name : manet
INFO:echo.src.base_objective:	optimizer:learning_rate : 6.6862248281764474e-06
INFO:echo.src.base_objective:	trainer:train_batch_size : 111
INFO:echo.src.base_objective:	trainer:weight_decay : 4.6560294443688446e-10
INFO:echo.src.base_objective:	trainer:training_loss : mae
INFO:echo.src.base_objective:Beginning trial 47
INFO:root:Loading model manet with settings {'in_channels': 4, 'classes': 1, 'activation': 'sigmoid'}
INFO:root:Loading loss smooth
INFO:root:Loading loss smooth
INFO:echo.src.base_objective:Saving trial 46 results to local file /glade/work/kdagon/s2sml/results_week3_SH_515/trial_results/trial_results_29812.gusched01.csv
INFO:echo.src.base_objective:Merging trial results and saving to /glade/work/kdagon/s2sml/results_week3_SH_515/trial_results.csv
[32m[I 2023-05-15 19:40:31,288][0m Trial 46 finished with values: [1.084250167892818, 4.037665008056669, 2.2554802517785797] and parameters: {'learning_rate': 0.00029748501296783525, 'norm': 'zscore', 'weight_decay': 8.803754277025888e-11, 'train_batch_size': 118, 'training_loss': 'logcosh', 'model_name': 'linknet'}. [0m
INFO:echo.src.base_objective:Attempting to automatically update the model configuration using optuna's suggested parameters
INFO:echo.src.base_objective:	data:norm : None
INFO:echo.src.base_objective:	model:name : unet++
INFO:echo.src.base_objective:	optimizer:learning_rate : 0.000326494975457569
INFO:echo.src.base_objective:	trainer:train_batch_size : 36
INFO:echo.src.base_objective:	trainer:weight_decay : 7.2441380178985605e-06
INFO:echo.src.base_objective:	trainer:training_loss : xsigmoid
INFO:echo.src.base_objective:Beginning trial 48
INFO:root:Loading model unet++ with settings {'in_channels': 4, 'classes': 1, 'activation': 'sigmoid'}
INFO:root:Loading loss smooth
INFO:root:Loading loss smooth
INFO:echo.src.base_objective:Saving trial 48 results to local file /glade/work/kdagon/s2sml/results_week3_SH_515/trial_results/trial_results_29812.gusched01.csv
INFO:echo.src.base_objective:Merging trial results and saving to /glade/work/kdagon/s2sml/results_week3_SH_515/trial_results.csv
[32m[I 2023-05-15 19:43:45,413][0m Trial 48 finished with values: [21.84833527470463, 12066.747001627287, 162.40430423886872] and parameters: {'learning_rate': 0.000326494975457569, 'norm': 'None', 'weight_decay': 7.2441380178985605e-06, 'train_batch_size': 36, 'training_loss': 'xsigmoid', 'model_name': 'unet++'}. [0m
INFO:echo.src.base_objective:Attempting to automatically update the model configuration using optuna's suggested parameters
INFO:echo.src.base_objective:	data:norm : minmax
INFO:echo.src.base_objective:	model:name : linknet
INFO:echo.src.base_objective:	optimizer:learning_rate : 0.009203576048928748
INFO:echo.src.base_objective:	trainer:train_batch_size : 128
INFO:echo.src.base_objective:	trainer:weight_decay : 2.1258186307930386e-05
INFO:echo.src.base_objective:	trainer:training_loss : mse
INFO:echo.src.base_objective:Beginning trial 49
INFO:root:Loading model linknet with settings {'in_channels': 4, 'classes': 1, 'activation': 'sigmoid'}
INFO:root:Loading loss smooth
INFO:root:Loading loss smooth
INFO:echo.src.base_objective:Saving trial 47 results to local file /glade/work/kdagon/s2sml/results_week3_SH_515/trial_results/trial_results_29811.gusched01.csv
INFO:echo.src.base_objective:Merging trial results and saving to /glade/work/kdagon/s2sml/results_week3_SH_515/trial_results.csv
[32m[I 2023-05-15 20:07:36,308][0m Trial 47 finished with values: [1.0973052775930974, 5.275174324051251, 2.873962814187109] and parameters: {'learning_rate': 6.6862248281764474e-06, 'norm': 'negone', 'weight_decay': 4.6560294443688446e-10, 'train_batch_size': 111, 'training_loss': 'mae', 'model_name': 'manet'}. [0m
WARNING:root:Stopping early since the longest observed run-time in the study exceeds the time remaining on this node.
INFO:root:Saving trial details to /glade/work/kdagon/s2sml/results_week3_SH_515/
INFO:root:Running on PBS/SLURM batch id: 29813.gusched01
INFO:root:Importing custom objective from /glade/work/kdagon/s2sml/applications/train.py
INFO:echo.src.reporting:Using device 0
INFO:root:Direction of optimization: ['minimize', 'minimize', 'minimize']
INFO:root:Using metric ['valid_custom', 'valid_custom_second', 'valid_custom_third']
[32m[I 2023-05-15 20:08:32,509][0m Using an existing study with name 'vanilla' instead of creating a new one.[0m
INFO:root:Loaded study vanilla located at sqlite:////glade/work/kdagon/s2sml/results_week3_SH_515/s2s.db
INFO:echo.src.base_objective:Worker 29813.gusched01 is summoned.
INFO:echo.src.base_objective:	initializing an objective to be optimized with metric ['valid_custom', 'valid_custom_second', 'valid_custom_third']
INFO:echo.src.base_objective:	using device(s) cuda:0
INFO:echo.src.base_objective:	saving study/trial results to local file /glade/work/kdagon/s2sml/results_week3_SH_515/trial_results/trial_results_29813.gusched01.csv
INFO:root:Running optimization for 1000 trials
INFO:root:Running trials for a maximum PBS wall-time 2:00:00
WARNING:root:Attempting to run trials and stop before hitting the wall-time
WARNING:root:Some trials may not complete if the wall-time is reached. Optuna will start over.
INFO:echo.src.base_objective:Attempting to automatically update the model configuration using optuna's suggested parameters
INFO:echo.src.base_objective:	data:norm : minmax
INFO:echo.src.base_objective:	model:name : unet
INFO:echo.src.base_objective:	optimizer:learning_rate : 7.541371480536176e-05
INFO:echo.src.base_objective:	trainer:train_batch_size : 42
INFO:echo.src.base_objective:	trainer:weight_decay : 9.52120071407864e-08
INFO:echo.src.base_objective:	trainer:training_loss : mse
INFO:echo.src.base_objective:Beginning trial 50
INFO:root:Loading model unet with settings {'in_channels': 4, 'classes': 1, 'activation': 'sigmoid'}
INFO:root:Loading loss smooth
INFO:root:Loading loss smooth
INFO:echo.src.base_objective:Saving trial 49 results to local file /glade/work/kdagon/s2sml/results_week3_SH_515/trial_results/trial_results_29812.gusched01.csv
INFO:echo.src.base_objective:Merging trial results and saving to /glade/work/kdagon/s2sml/results_week3_SH_515/trial_results.csv
[32m[I 2023-05-15 20:14:32,147][0m Trial 49 finished with values: [0.9634325526488088, 0.4165428600514837, 0.7005477145020049] and parameters: {'learning_rate': 0.009203576048928748, 'norm': 'minmax', 'weight_decay': 2.1258186307930386e-05, 'train_batch_size': 128, 'training_loss': 'mse', 'model_name': 'linknet'}. [0m
WARNING:root:Stopping early since the longest observed run-time in the study exceeds the time remaining on this node.
INFO:echo.src.base_objective:Saving trial 50 results to local file /glade/work/kdagon/s2sml/results_week3_SH_515/trial_results/trial_results_29813.gusched01.csv
INFO:echo.src.base_objective:Merging trial results and saving to /glade/work/kdagon/s2sml/results_week3_SH_515/trial_results.csv
[32m[I 2023-05-15 20:14:37,606][0m Trial 50 finished with values: [0.9982265818717877, 0.8244318542044766, 1.0109084225913685] and parameters: {'learning_rate': 7.541371480536176e-05, 'norm': 'minmax', 'weight_decay': 9.52120071407864e-08, 'train_batch_size': 42, 'training_loss': 'mse', 'model_name': 'unet'}. [0m
INFO:echo.src.base_objective:Attempting to automatically update the model configuration using optuna's suggested parameters
INFO:echo.src.base_objective:	data:norm : negone
INFO:echo.src.base_objective:	model:name : deeplabv3
INFO:echo.src.base_objective:	optimizer:learning_rate : 0.00014363624958655213
INFO:echo.src.base_objective:	trainer:train_batch_size : 27
INFO:echo.src.base_objective:	trainer:weight_decay : 7.945693383151309e-10
INFO:echo.src.base_objective:	trainer:training_loss : xsigmoid
INFO:echo.src.base_objective:Beginning trial 51
INFO:root:Loading model deeplabv3 with settings {'in_channels': 4, 'classes': 1, 'activation': 'sigmoid'}
INFO:root:Loading loss smooth
INFO:root:Loading loss smooth
INFO:root:Saving trial details to /glade/work/kdagon/s2sml/results_week3_SH_515/
INFO:root:Running on PBS/SLURM batch id: 29814.gusched01
INFO:root:Importing custom objective from /glade/work/kdagon/s2sml/applications/train.py
INFO:echo.src.reporting:Using device 0
INFO:root:Direction of optimization: ['minimize', 'minimize', 'minimize']
INFO:root:Using metric ['valid_custom', 'valid_custom_second', 'valid_custom_third']
[32m[I 2023-05-15 20:14:58,511][0m Using an existing study with name 'vanilla' instead of creating a new one.[0m
INFO:root:Loaded study vanilla located at sqlite:////glade/work/kdagon/s2sml/results_week3_SH_515/s2s.db
INFO:echo.src.base_objective:Worker 29814.gusched01 is summoned.
INFO:echo.src.base_objective:	initializing an objective to be optimized with metric ['valid_custom', 'valid_custom_second', 'valid_custom_third']
INFO:echo.src.base_objective:	using device(s) cuda:0
INFO:echo.src.base_objective:	saving study/trial results to local file /glade/work/kdagon/s2sml/results_week3_SH_515/trial_results/trial_results_29814.gusched01.csv
INFO:root:Running optimization for 1000 trials
INFO:root:Running trials for a maximum PBS wall-time 2:00:00
WARNING:root:Attempting to run trials and stop before hitting the wall-time
WARNING:root:Some trials may not complete if the wall-time is reached. Optuna will start over.
INFO:echo.src.base_objective:Attempting to automatically update the model configuration using optuna's suggested parameters
INFO:echo.src.base_objective:	data:norm : negone
INFO:echo.src.base_objective:	model:name : fpn
INFO:echo.src.base_objective:	optimizer:learning_rate : 1.8094704719381707e-05
INFO:echo.src.base_objective:	trainer:train_batch_size : 38
INFO:echo.src.base_objective:	trainer:weight_decay : 7.173997046798131e-08
INFO:echo.src.base_objective:	trainer:training_loss : xsigmoid
INFO:echo.src.base_objective:Beginning trial 52
INFO:root:Loading model fpn with settings {'in_channels': 4, 'classes': 1, 'activation': 'sigmoid'}
INFO:root:Loading loss smooth
INFO:root:Loading loss smooth
INFO:echo.src.base_objective:Saving trial 51 results to local file /glade/work/kdagon/s2sml/results_week3_SH_515/trial_results/trial_results_29813.gusched01.csv
INFO:echo.src.base_objective:Merging trial results and saving to /glade/work/kdagon/s2sml/results_week3_SH_515/trial_results.csv
[32m[I 2023-05-15 20:23:24,316][0m Trial 51 finished with values: [1.0824125995210478, 1.7161436822315546, 1.3273882687550003] and parameters: {'learning_rate': 0.00014363624958655213, 'norm': 'negone', 'weight_decay': 7.945693383151309e-10, 'train_batch_size': 27, 'training_loss': 'xsigmoid', 'model_name': 'deeplabv3'}. [0m
INFO:echo.src.base_objective:Attempting to automatically update the model configuration using optuna's suggested parameters
INFO:echo.src.base_objective:	data:norm : zscore
INFO:echo.src.base_objective:	model:name : deeplabv3
INFO:echo.src.base_objective:	optimizer:learning_rate : 6.836487571764075e-05
INFO:echo.src.base_objective:	trainer:train_batch_size : 94
INFO:echo.src.base_objective:	trainer:weight_decay : 6.191710698097796e-05
INFO:echo.src.base_objective:	trainer:training_loss : smooth
INFO:echo.src.base_objective:Beginning trial 53
INFO:root:Loading model deeplabv3 with settings {'in_channels': 4, 'classes': 1, 'activation': 'sigmoid'}
INFO:root:Loading loss smooth
INFO:root:Loading loss smooth
INFO:echo.src.base_objective:Saving trial 53 results to local file /glade/work/kdagon/s2sml/results_week3_SH_515/trial_results/trial_results_29813.gusched01.csv
INFO:echo.src.base_objective:Merging trial results and saving to /glade/work/kdagon/s2sml/results_week3_SH_515/trial_results.csv
[32m[I 2023-05-15 20:31:17,739][0m Trial 53 finished with values: [1.1727616791656996, 4.128925798351751, 2.27442205443955] and parameters: {'learning_rate': 6.836487571764075e-05, 'norm': 'zscore', 'weight_decay': 6.191710698097796e-05, 'train_batch_size': 94, 'training_loss': 'smooth', 'model_name': 'deeplabv3'}. [0m
INFO:echo.src.base_objective:Attempting to automatically update the model configuration using optuna's suggested parameters
INFO:echo.src.base_objective:	data:norm : zscore
INFO:echo.src.base_objective:	model:name : deeplabv3+
INFO:echo.src.base_objective:	optimizer:learning_rate : 4.129444767791241e-05
INFO:echo.src.base_objective:	trainer:train_batch_size : 74
INFO:echo.src.base_objective:	trainer:weight_decay : 7.089118767899794e-05
INFO:echo.src.base_objective:	trainer:training_loss : smooth
INFO:echo.src.base_objective:Beginning trial 54
INFO:root:Loading model deeplabv3+ with settings {'in_channels': 4, 'classes': 1, 'activation': 'sigmoid'}
INFO:root:Loading loss smooth
INFO:root:Loading loss smooth
INFO:echo.src.base_objective:Saving trial 54 results to local file /glade/work/kdagon/s2sml/results_week3_SH_515/trial_results/trial_results_29813.gusched01.csv
INFO:echo.src.base_objective:Merging trial results and saving to /glade/work/kdagon/s2sml/results_week3_SH_515/trial_results.csv
[32m[I 2023-05-15 20:35:29,098][0m Trial 54 finished with values: [1.1563280997737841, 5.5351208365990665, 2.7653113804234466] and parameters: {'learning_rate': 4.129444767791241e-05, 'norm': 'zscore', 'weight_decay': 7.089118767899794e-05, 'train_batch_size': 74, 'training_loss': 'smooth', 'model_name': 'deeplabv3+'}. [0m
INFO:echo.src.base_objective:Attempting to automatically update the model configuration using optuna's suggested parameters
INFO:echo.src.base_objective:	data:norm : minmax
INFO:echo.src.base_objective:	model:name : linknet
INFO:echo.src.base_objective:	optimizer:learning_rate : 4.735029692918727e-06
INFO:echo.src.base_objective:	trainer:train_batch_size : 100
INFO:echo.src.base_objective:	trainer:weight_decay : 7.61959816710682e-06
INFO:echo.src.base_objective:	trainer:training_loss : xtanh
INFO:echo.src.base_objective:Beginning trial 55
INFO:root:Loading model linknet with settings {'in_channels': 4, 'classes': 1, 'activation': 'sigmoid'}
INFO:root:Loading loss smooth
INFO:root:Loading loss smooth
INFO:echo.src.base_objective:Saving trial 52 results to local file /glade/work/kdagon/s2sml/results_week3_SH_515/trial_results/trial_results_29814.gusched01.csv
INFO:echo.src.base_objective:Merging trial results and saving to /glade/work/kdagon/s2sml/results_week3_SH_515/trial_results.csv
[32m[I 2023-05-15 20:36:20,713][0m Trial 52 finished with values: [1.0776803346595227, 1.5085231150526177, 1.2837859430742165] and parameters: {'learning_rate': 1.8094704719381707e-05, 'norm': 'negone', 'weight_decay': 7.173997046798131e-08, 'train_batch_size': 38, 'training_loss': 'xsigmoid', 'model_name': 'fpn'}. [0m
INFO:echo.src.base_objective:Attempting to automatically update the model configuration using optuna's suggested parameters
INFO:echo.src.base_objective:	data:norm : minmax
INFO:echo.src.base_objective:	model:name : deeplabv3
INFO:echo.src.base_objective:	optimizer:learning_rate : 0.0001844841742509137
INFO:echo.src.base_objective:	trainer:train_batch_size : 60
INFO:echo.src.base_objective:	trainer:weight_decay : 4.549818706312426e-07
INFO:echo.src.base_objective:	trainer:training_loss : smooth
INFO:echo.src.base_objective:Beginning trial 56
INFO:root:Loading model deeplabv3 with settings {'in_channels': 4, 'classes': 1, 'activation': 'sigmoid'}
INFO:root:Loading loss smooth
INFO:root:Loading loss smooth
INFO:echo.src.base_objective:Saving trial 55 results to local file /glade/work/kdagon/s2sml/results_week3_SH_515/trial_results/trial_results_29813.gusched01.csv
INFO:echo.src.base_objective:Merging trial results and saving to /glade/work/kdagon/s2sml/results_week3_SH_515/trial_results.csv
