[32m[I 2023-05-15 23:06:50,749][0m Trial 82 finished with values: [1.2950798694431258, 3.226795907537123, 2.1009752904658647] and parameters: {'learning_rate': 3.278099906653877e-06, 'norm': 'negone', 'weight_decay': 1.0760786862749657e-06, 'train_batch_size': 62, 'training_loss': 'xtanh', 'model_name': 'fpn'}. [0m
WARNING:root:Stopping early since the longest observed run-time in the study exceeds the time remaining on this node.
INFO:root:Saving trial details to /glade/work/kdagon/s2sml/results_week3_SH_515/
INFO:root:Running on PBS/SLURM batch id: 29818.gusched01
INFO:root:Importing custom objective from /glade/work/kdagon/s2sml/applications/train.py
INFO:echo.src.reporting:Using device 0
INFO:root:Direction of optimization: ['minimize', 'minimize', 'minimize']
INFO:root:Using metric ['valid_custom', 'valid_custom_second', 'valid_custom_third']
[32m[I 2023-05-15 23:07:45,093][0m Using an existing study with name 'vanilla' instead of creating a new one.[0m
INFO:root:Loaded study vanilla located at sqlite:////glade/work/kdagon/s2sml/results_week3_SH_515/s2s.db
INFO:echo.src.base_objective:Worker 29818.gusched01 is summoned.
INFO:echo.src.base_objective:	initializing an objective to be optimized with metric ['valid_custom', 'valid_custom_second', 'valid_custom_third']
INFO:echo.src.base_objective:	using device(s) cuda:0
INFO:echo.src.base_objective:	saving study/trial results to local file /glade/work/kdagon/s2sml/results_week3_SH_515/trial_results/trial_results_29818.gusched01.csv
INFO:root:Running optimization for 1000 trials
INFO:root:Running trials for a maximum PBS wall-time 2:00:00
WARNING:root:Attempting to run trials and stop before hitting the wall-time
WARNING:root:Some trials may not complete if the wall-time is reached. Optuna will start over.
INFO:echo.src.base_objective:Attempting to automatically update the model configuration using optuna's suggested parameters
INFO:echo.src.base_objective:	data:norm : None
INFO:echo.src.base_objective:	model:name : deeplabv3
INFO:echo.src.base_objective:	optimizer:learning_rate : 7.976449068198952e-05
INFO:echo.src.base_objective:	trainer:train_batch_size : 28
INFO:echo.src.base_objective:	trainer:weight_decay : 0.0009090012253586355
INFO:echo.src.base_objective:	trainer:training_loss : xsigmoid
INFO:echo.src.base_objective:Beginning trial 85
INFO:root:Loading model deeplabv3 with settings {'in_channels': 4, 'classes': 1, 'activation': 'sigmoid'}
INFO:root:Loading loss smooth
INFO:root:Loading loss smooth
INFO:echo.src.base_objective:Saving trial 84 results to local file /glade/work/kdagon/s2sml/results_week3_SH_515/trial_results/trial_results_29817.gusched01.csv
INFO:echo.src.base_objective:Merging trial results and saving to /glade/work/kdagon/s2sml/results_week3_SH_515/trial_results.csv
[32m[I 2023-05-15 23:10:47,565][0m Trial 84 finished with values: [1.2004482575417585, 3.805324193029856, 2.1856205621838853] and parameters: {'learning_rate': 0.002448449289114721, 'norm': 'zscore', 'weight_decay': 9.944007125656899e-05, 'train_batch_size': 49, 'training_loss': 'logcosh', 'model_name': 'pspnet'}. [0m
INFO:echo.src.base_objective:Attempting to automatically update the model configuration using optuna's suggested parameters
INFO:echo.src.base_objective:	data:norm : None
INFO:echo.src.base_objective:	model:name : deeplabv3
INFO:echo.src.base_objective:	optimizer:learning_rate : 4.4133958269760825e-06
INFO:echo.src.base_objective:	trainer:train_batch_size : 86
INFO:echo.src.base_objective:	trainer:weight_decay : 1.2487097863069158e-07
INFO:echo.src.base_objective:	trainer:training_loss : xsigmoid
INFO:echo.src.base_objective:Beginning trial 86
INFO:root:Loading model deeplabv3 with settings {'in_channels': 4, 'classes': 1, 'activation': 'sigmoid'}
INFO:root:Loading loss smooth
INFO:root:Loading loss smooth
INFO:echo.src.base_objective:Saving trial 85 results to local file /glade/work/kdagon/s2sml/results_week3_SH_515/trial_results/trial_results_29818.gusched01.csv
INFO:echo.src.base_objective:Merging trial results and saving to /glade/work/kdagon/s2sml/results_week3_SH_515/trial_results.csv
[32m[I 2023-05-15 23:10:48,712][0m Trial 85 finished with values: [3.363698754270117, 12082.510398339658, 162.51099774742013] and parameters: {'learning_rate': 7.976449068198952e-05, 'norm': 'None', 'weight_decay': 0.0009090012253586355, 'train_batch_size': 28, 'training_loss': 'xsigmoid', 'model_name': 'deeplabv3'}. [0m
INFO:echo.src.base_objective:Attempting to automatically update the model configuration using optuna's suggested parameters
INFO:echo.src.base_objective:	data:norm : negone
INFO:echo.src.base_objective:	model:name : linknet
INFO:echo.src.base_objective:	optimizer:learning_rate : 4.905720662390903e-06
INFO:echo.src.base_objective:	trainer:train_batch_size : 18
INFO:echo.src.base_objective:	trainer:weight_decay : 1.3106341895431222e-08
INFO:echo.src.base_objective:	trainer:training_loss : logcosh
INFO:echo.src.base_objective:Beginning trial 87
INFO:root:Loading model linknet with settings {'in_channels': 4, 'classes': 1, 'activation': 'sigmoid'}
INFO:root:Loading loss smooth
INFO:root:Loading loss smooth
INFO:echo.src.base_objective:Saving trial 86 results to local file /glade/work/kdagon/s2sml/results_week3_SH_515/trial_results/trial_results_29817.gusched01.csv
INFO:echo.src.base_objective:Merging trial results and saving to /glade/work/kdagon/s2sml/results_week3_SH_515/trial_results.csv
[32m[I 2023-05-15 23:20:35,523][0m Trial 86 finished with values: [3.3699036459929377, 12080.91972935831, 162.50048374175802] and parameters: {'learning_rate': 4.4133958269760825e-06, 'norm': 'None', 'weight_decay': 1.2487097863069158e-07, 'train_batch_size': 86, 'training_loss': 'xsigmoid', 'model_name': 'deeplabv3'}. [0m
INFO:echo.src.base_objective:Attempting to automatically update the model configuration using optuna's suggested parameters
INFO:echo.src.base_objective:	data:norm : zscore
INFO:echo.src.base_objective:	model:name : pspnet
INFO:echo.src.base_objective:	optimizer:learning_rate : 0.00929281161418972
INFO:echo.src.base_objective:	trainer:train_batch_size : 13
INFO:echo.src.base_objective:	trainer:weight_decay : 6.582839754379622e-10
INFO:echo.src.base_objective:	trainer:training_loss : huber
INFO:echo.src.base_objective:Beginning trial 88
INFO:root:Loading model pspnet with settings {'in_channels': 4, 'classes': 1, 'activation': 'sigmoid'}
INFO:root:Loading loss smooth
INFO:root:Loading loss smooth
INFO:echo.src.base_objective:Saving trial 88 results to local file /glade/work/kdagon/s2sml/results_week3_SH_515/trial_results/trial_results_29817.gusched01.csv
INFO:echo.src.base_objective:Merging trial results and saving to /glade/work/kdagon/s2sml/results_week3_SH_515/trial_results.csv
[32m[I 2023-05-15 23:24:01,523][0m Trial 88 finished with values: [32.72115702676542, 6.431494444368609, 3.0281208257801913] and parameters: {'learning_rate': 0.00929281161418972, 'norm': 'zscore', 'weight_decay': 6.582839754379622e-10, 'train_batch_size': 13, 'training_loss': 'huber', 'model_name': 'pspnet'}. [0m
INFO:echo.src.base_objective:Attempting to automatically update the model configuration using optuna's suggested parameters
INFO:echo.src.base_objective:	data:norm : None
INFO:echo.src.base_objective:	model:name : fpn
INFO:echo.src.base_objective:	optimizer:learning_rate : 0.0001580488864531804
INFO:echo.src.base_objective:	trainer:train_batch_size : 46
INFO:echo.src.base_objective:	trainer:weight_decay : 1.900307759627449e-05
INFO:echo.src.base_objective:	trainer:training_loss : smooth
INFO:echo.src.base_objective:Beginning trial 89
INFO:root:Loading model fpn with settings {'in_channels': 4, 'classes': 1, 'activation': 'sigmoid'}
INFO:root:Loading loss smooth
INFO:root:Loading loss smooth
INFO:echo.src.base_objective:Saving trial 89 results to local file /glade/work/kdagon/s2sml/results_week3_SH_515/trial_results/trial_results_29817.gusched01.csv
INFO:echo.src.base_objective:Merging trial results and saving to /glade/work/kdagon/s2sml/results_week3_SH_515/trial_results.csv
[32m[I 2023-05-15 23:26:57,073][0m Trial 89 finished with values: [147.57001188748575, 12056.507611742445, 162.33530580550791] and parameters: {'learning_rate': 0.0001580488864531804, 'norm': 'None', 'weight_decay': 1.900307759627449e-05, 'train_batch_size': 46, 'training_loss': 'smooth', 'model_name': 'fpn'}. [0m
INFO:echo.src.base_objective:Attempting to automatically update the model configuration using optuna's suggested parameters
INFO:echo.src.base_objective:	data:norm : None
INFO:echo.src.base_objective:	model:name : manet
INFO:echo.src.base_objective:	optimizer:learning_rate : 0.0001751592278721706
INFO:echo.src.base_objective:	trainer:train_batch_size : 70
INFO:echo.src.base_objective:	trainer:weight_decay : 2.834644543541862e-12
INFO:echo.src.base_objective:	trainer:training_loss : mse
INFO:echo.src.base_objective:Beginning trial 90
INFO:root:Loading model manet with settings {'in_channels': 4, 'classes': 1, 'activation': 'sigmoid'}
INFO:root:Loading loss smooth
INFO:root:Loading loss smooth
INFO:echo.src.base_objective:Saving trial 90 results to local file /glade/work/kdagon/s2sml/results_week3_SH_515/trial_results/trial_results_29817.gusched01.csv
INFO:echo.src.base_objective:Merging trial results and saving to /glade/work/kdagon/s2sml/results_week3_SH_515/trial_results.csv
[32m[I 2023-05-15 23:29:46,527][0m Trial 90 finished with values: [35.613485373891315, 12079.573756458907, 162.49058590976657] and parameters: {'learning_rate': 0.0001751592278721706, 'norm': 'None', 'weight_decay': 2.834644543541862e-12, 'train_batch_size': 70, 'training_loss': 'mse', 'model_name': 'manet'}. [0m
INFO:echo.src.base_objective:Attempting to automatically update the model configuration using optuna's suggested parameters
INFO:echo.src.base_objective:	data:norm : None
INFO:echo.src.base_objective:	model:name : deeplabv3
INFO:echo.src.base_objective:	optimizer:learning_rate : 0.004962861488763251
INFO:echo.src.base_objective:	trainer:train_batch_size : 52
INFO:echo.src.base_objective:	trainer:weight_decay : 2.691359874908621e-08
INFO:echo.src.base_objective:	trainer:training_loss : mse
INFO:echo.src.base_objective:Beginning trial 91
INFO:root:Loading model deeplabv3 with settings {'in_channels': 4, 'classes': 1, 'activation': 'sigmoid'}
INFO:root:Loading loss smooth
INFO:root:Loading loss smooth
INFO:echo.src.base_objective:Saving trial 91 results to local file /glade/work/kdagon/s2sml/results_week3_SH_515/trial_results/trial_results_29817.gusched01.csv
INFO:echo.src.base_objective:Merging trial results and saving to /glade/work/kdagon/s2sml/results_week3_SH_515/trial_results.csv
[32m[I 2023-05-15 23:32:21,124][0m Trial 91 finished with values: [9297.411825686968, 12056.507611742445, 162.33530580550791] and parameters: {'learning_rate': 0.004962861488763251, 'norm': 'None', 'weight_decay': 2.691359874908621e-08, 'train_batch_size': 52, 'training_loss': 'mse', 'model_name': 'deeplabv3'}. [0m
INFO:echo.src.base_objective:Attempting to automatically update the model configuration using optuna's suggested parameters
INFO:echo.src.base_objective:	data:norm : zscore
INFO:echo.src.base_objective:	model:name : deeplabv3
INFO:echo.src.base_objective:	optimizer:learning_rate : 2.977693129474864e-06
INFO:echo.src.base_objective:	trainer:train_batch_size : 97
INFO:echo.src.base_objective:	trainer:weight_decay : 8.450621633455464e-06
INFO:echo.src.base_objective:	trainer:training_loss : xtanh
INFO:echo.src.base_objective:Beginning trial 92
INFO:root:Loading model deeplabv3 with settings {'in_channels': 4, 'classes': 1, 'activation': 'sigmoid'}
INFO:root:Loading loss smooth
INFO:root:Loading loss smooth
INFO:echo.src.base_objective:Saving trial 87 results to local file /glade/work/kdagon/s2sml/results_week3_SH_515/trial_results/trial_results_29818.gusched01.csv
INFO:echo.src.base_objective:Merging trial results and saving to /glade/work/kdagon/s2sml/results_week3_SH_515/trial_results.csv
[32m[I 2023-05-15 23:42:48,882][0m Trial 87 finished with values: [1.1198504501011581, 4.6517686636252975, 2.5951392965533358] and parameters: {'learning_rate': 4.905720662390903e-06, 'norm': 'negone', 'weight_decay': 1.3106341895431222e-08, 'train_batch_size': 18, 'training_loss': 'logcosh', 'model_name': 'linknet'}. [0m
INFO:echo.src.base_objective:Attempting to automatically update the model configuration using optuna's suggested parameters
INFO:echo.src.base_objective:	data:norm : negone
INFO:echo.src.base_objective:	model:name : fpn
INFO:echo.src.base_objective:	optimizer:learning_rate : 5.147498376145928e-05
INFO:echo.src.base_objective:	trainer:train_batch_size : 104
INFO:echo.src.base_objective:	trainer:weight_decay : 3.597325254016482e-06
INFO:echo.src.base_objective:	trainer:training_loss : smooth
INFO:echo.src.base_objective:Beginning trial 93
INFO:root:Loading model fpn with settings {'in_channels': 4, 'classes': 1, 'activation': 'sigmoid'}
INFO:root:Loading loss smooth
INFO:root:Loading loss smooth
INFO:echo.src.base_objective:Saving trial 92 results to local file /glade/work/kdagon/s2sml/results_week3_SH_515/trial_results/trial_results_29817.gusched01.csv
INFO:echo.src.base_objective:Merging trial results and saving to /glade/work/kdagon/s2sml/results_week3_SH_515/trial_results.csv
[32m[I 2023-05-15 23:45:42,900][0m Trial 92 finished with values: [1.2294641488708884, 5.02242656018898, 2.5955528989484304] and parameters: {'learning_rate': 2.977693129474864e-06, 'norm': 'zscore', 'weight_decay': 8.450621633455464e-06, 'train_batch_size': 97, 'training_loss': 'xtanh', 'model_name': 'deeplabv3'}. [0m
INFO:echo.src.base_objective:Attempting to automatically update the model configuration using optuna's suggested parameters
INFO:echo.src.base_objective:	data:norm : None
INFO:echo.src.base_objective:	model:name : unet
INFO:echo.src.base_objective:	optimizer:learning_rate : 0.0002060117729654799
INFO:echo.src.base_objective:	trainer:train_batch_size : 90
INFO:echo.src.base_objective:	trainer:weight_decay : 0.0007136982976987652
INFO:echo.src.base_objective:	trainer:training_loss : mae
INFO:echo.src.base_objective:Beginning trial 94
INFO:root:Loading model unet with settings {'in_channels': 4, 'classes': 1, 'activation': 'sigmoid'}
INFO:root:Loading loss smooth
INFO:root:Loading loss smooth
INFO:echo.src.base_objective:Saving trial 94 results to local file /glade/work/kdagon/s2sml/results_week3_SH_515/trial_results/trial_results_29817.gusched01.csv
INFO:echo.src.base_objective:Merging trial results and saving to /glade/work/kdagon/s2sml/results_week3_SH_515/trial_results.csv
[32m[I 2023-05-15 23:48:04,645][0m Trial 94 finished with values: [25.019574540824557, 12121.434409212174, 162.77196465395133] and parameters: {'learning_rate': 0.0002060117729654799, 'norm': 'None', 'weight_decay': 0.0007136982976987652, 'train_batch_size': 90, 'training_loss': 'mae', 'model_name': 'unet'}. [0m
INFO:echo.src.base_objective:Attempting to automatically update the model configuration using optuna's suggested parameters
INFO:echo.src.base_objective:	data:norm : None
INFO:echo.src.base_objective:	model:name : unet++
INFO:echo.src.base_objective:	optimizer:learning_rate : 0.0054514443743185394
INFO:echo.src.base_objective:	trainer:train_batch_size : 99
INFO:echo.src.base_objective:	trainer:weight_decay : 2.33779976958586e-11
INFO:echo.src.base_objective:	trainer:training_loss : smooth
INFO:echo.src.base_objective:Beginning trial 95
INFO:root:Loading model unet++ with settings {'in_channels': 4, 'classes': 1, 'activation': 'sigmoid'}
INFO:root:Loading loss smooth
INFO:root:Loading loss smooth
INFO:echo.src.base_objective:Saving trial 95 results to local file /glade/work/kdagon/s2sml/results_week3_SH_515/trial_results/trial_results_29817.gusched01.csv
INFO:echo.src.base_objective:Merging trial results and saving to /glade/work/kdagon/s2sml/results_week3_SH_515/trial_results.csv
[32m[I 2023-05-15 23:52:17,644][0m Trial 95 finished with values: [14.520674544761993, 12056.642526819503, 162.3362127090091] and parameters: {'learning_rate': 0.0054514443743185394, 'norm': 'None', 'weight_decay': 2.33779976958586e-11, 'train_batch_size': 99, 'training_loss': 'smooth', 'model_name': 'unet++'}. [0m
INFO:echo.src.base_objective:Attempting to automatically update the model configuration using optuna's suggested parameters
INFO:echo.src.base_objective:	data:norm : zscore
INFO:echo.src.base_objective:	model:name : fpn
INFO:echo.src.base_objective:	optimizer:learning_rate : 1.6422996865997474e-05
INFO:echo.src.base_objective:	trainer:train_batch_size : 46
INFO:echo.src.base_objective:	trainer:weight_decay : 4.547659598285072e-09
INFO:echo.src.base_objective:	trainer:training_loss : smooth
INFO:echo.src.base_objective:Beginning trial 96
INFO:root:Loading model fpn with settings {'in_channels': 4, 'classes': 1, 'activation': 'sigmoid'}
INFO:root:Loading loss smooth
INFO:root:Loading loss smooth
INFO:echo.src.base_objective:Saving trial 93 results to local file /glade/work/kdagon/s2sml/results_week3_SH_515/trial_results/trial_results_29818.gusched01.csv
INFO:echo.src.base_objective:Merging trial results and saving to /glade/work/kdagon/s2sml/results_week3_SH_515/trial_results.csv
[32m[I 2023-05-15 23:58:04,096][0m Trial 93 finished with values: [1.0863801832868576, 1.610728225155834, 1.3585409922969605] and parameters: {'learning_rate': 5.147498376145928e-05, 'norm': 'negone', 'weight_decay': 3.597325254016482e-06, 'train_batch_size': 104, 'training_loss': 'smooth', 'model_name': 'fpn'}. [0m
INFO:echo.src.base_objective:Attempting to automatically update the model configuration using optuna's suggested parameters
INFO:echo.src.base_objective:	data:norm : minmax
INFO:echo.src.base_objective:	model:name : unet++
INFO:echo.src.base_objective:	optimizer:learning_rate : 3.1805174141372966e-06
INFO:echo.src.base_objective:	trainer:train_batch_size : 43
INFO:echo.src.base_objective:	trainer:weight_decay : 3.6903146541493926e-10
INFO:echo.src.base_objective:	trainer:training_loss : xsigmoid
INFO:echo.src.base_objective:Beginning trial 97
INFO:root:Loading model unet++ with settings {'in_channels': 4, 'classes': 1, 'activation': 'sigmoid'}
INFO:root:Loading loss smooth
INFO:root:Loading loss smooth
INFO:echo.src.base_objective:Saving trial 96 results to local file /glade/work/kdagon/s2sml/results_week3_SH_515/trial_results/trial_results_29817.gusched01.csv
INFO:echo.src.base_objective:Merging trial results and saving to /glade/work/kdagon/s2sml/results_week3_SH_515/trial_results.csv
[32m[I 2023-05-16 00:12:29,506][0m Trial 96 finished with values: [1.1932690567337354, 3.7687278898014376, 2.1498153623563563] and parameters: {'learning_rate': 1.6422996865997474e-05, 'norm': 'zscore', 'weight_decay': 4.547659598285072e-09, 'train_batch_size': 46, 'training_loss': 'smooth', 'model_name': 'fpn'}. [0m
INFO:echo.src.base_objective:Attempting to automatically update the model configuration using optuna's suggested parameters
INFO:echo.src.base_objective:	data:norm : None
INFO:echo.src.base_objective:	model:name : unet
INFO:echo.src.base_objective:	optimizer:learning_rate : 0.000390877528064621
INFO:echo.src.base_objective:	trainer:train_batch_size : 34
INFO:echo.src.base_objective:	trainer:weight_decay : 0.00028132642574449736
INFO:echo.src.base_objective:	trainer:training_loss : huber
INFO:echo.src.base_objective:Beginning trial 98
INFO:root:Loading model unet with settings {'in_channels': 4, 'classes': 1, 'activation': 'sigmoid'}
INFO:root:Loading loss smooth
INFO:root:Loading loss smooth
INFO:echo.src.base_objective:Saving trial 98 results to local file /glade/work/kdagon/s2sml/results_week3_SH_515/trial_results/trial_results_29817.gusched01.csv
INFO:echo.src.base_objective:Merging trial results and saving to /glade/work/kdagon/s2sml/results_week3_SH_515/trial_results.csv
[32m[I 2023-05-16 00:15:22,851][0m Trial 98 finished with values: [26747.16715303372, 12073.98243654154, 162.45275631778873] and parameters: {'learning_rate': 0.000390877528064621, 'norm': 'None', 'weight_decay': 0.00028132642574449736, 'train_batch_size': 34, 'training_loss': 'huber', 'model_name': 'unet'}. [0m
INFO:echo.src.base_objective:Attempting to automatically update the model configuration using optuna's suggested parameters
INFO:echo.src.base_objective:	data:norm : None
INFO:echo.src.base_objective:	model:name : manet
INFO:echo.src.base_objective:	optimizer:learning_rate : 0.0005024417053441236
INFO:echo.src.base_objective:	trainer:train_batch_size : 35
INFO:echo.src.base_objective:	trainer:weight_decay : 6.418056749538174e-10
INFO:echo.src.base_objective:	trainer:training_loss : smooth
INFO:echo.src.base_objective:Beginning trial 99
INFO:root:Loading model manet with settings {'in_channels': 4, 'classes': 1, 'activation': 'sigmoid'}
INFO:root:Loading loss smooth
INFO:root:Loading loss smooth
INFO:echo.src.base_objective:Saving trial 99 results to local file /glade/work/kdagon/s2sml/results_week3_SH_515/trial_results/trial_results_29817.gusched01.csv
INFO:echo.src.base_objective:Merging trial results and saving to /glade/work/kdagon/s2sml/results_week3_SH_515/trial_results.csv
