[32m[I 2023-05-15 18:25:48,656][0m Trial 26 finished with values: [0.9708142999122836, 0.5134933174604852, 0.7906584082473938] and parameters: {'learning_rate': 4.169644425002291e-05, 'norm': 'minmax', 'weight_decay': 1.6597317758110658e-11, 'train_batch_size': 9, 'training_loss': 'logcosh', 'model_name': 'linknet'}. [0m
WARNING:root:Stopping early since the longest observed run-time in the study exceeds the time remaining on this node.
INFO:root:Saving trial details to /glade/work/kdagon/s2sml/results_week3_SH_515/
INFO:root:Running on PBS/SLURM batch id: 29812.gusched01
INFO:root:Importing custom objective from /glade/work/kdagon/s2sml/applications/train.py
INFO:echo.src.reporting:Using device 0
INFO:root:Direction of optimization: ['minimize', 'minimize', 'minimize']
INFO:root:Using metric ['valid_custom', 'valid_custom_second', 'valid_custom_third']
[32m[I 2023-05-15 18:26:13,126][0m Using an existing study with name 'vanilla' instead of creating a new one.[0m
INFO:root:Loaded study vanilla located at sqlite:////glade/work/kdagon/s2sml/results_week3_SH_515/s2s.db
INFO:echo.src.base_objective:Worker 29812.gusched01 is summoned.
INFO:echo.src.base_objective:	initializing an objective to be optimized with metric ['valid_custom', 'valid_custom_second', 'valid_custom_third']
INFO:echo.src.base_objective:	using device(s) cuda:0
INFO:echo.src.base_objective:	saving study/trial results to local file /glade/work/kdagon/s2sml/results_week3_SH_515/trial_results/trial_results_29812.gusched01.csv
INFO:root:Running optimization for 1000 trials
INFO:root:Running trials for a maximum PBS wall-time 2:00:00
WARNING:root:Attempting to run trials and stop before hitting the wall-time
WARNING:root:Some trials may not complete if the wall-time is reached. Optuna will start over.
INFO:echo.src.base_objective:Attempting to automatically update the model configuration using optuna's suggested parameters
INFO:echo.src.base_objective:	data:norm : None
INFO:echo.src.base_objective:	model:name : fpn
INFO:echo.src.base_objective:	optimizer:learning_rate : 0.0001980673852387479
INFO:echo.src.base_objective:	trainer:train_batch_size : 38
INFO:echo.src.base_objective:	trainer:weight_decay : 8.271776892691221e-10
INFO:echo.src.base_objective:	trainer:training_loss : xsigmoid
INFO:echo.src.base_objective:Beginning trial 28
INFO:root:Loading model fpn with settings {'in_channels': 4, 'classes': 1, 'activation': 'sigmoid'}
INFO:root:Loading loss smooth
INFO:root:Loading loss smooth
INFO:echo.src.base_objective:Saving trial 28 results to local file /glade/work/kdagon/s2sml/results_week3_SH_515/trial_results/trial_results_29812.gusched01.csv
INFO:echo.src.base_objective:Merging trial results and saving to /glade/work/kdagon/s2sml/results_week3_SH_515/trial_results.csv
[32m[I 2023-05-15 18:28:51,977][0m Trial 28 finished with values: [33.68883600644086, 12056.507611742445, 162.33530580550791] and parameters: {'learning_rate': 0.0001980673852387479, 'norm': 'None', 'weight_decay': 8.271776892691221e-10, 'train_batch_size': 38, 'training_loss': 'xsigmoid', 'model_name': 'fpn'}. [0m
INFO:echo.src.base_objective:Attempting to automatically update the model configuration using optuna's suggested parameters
INFO:echo.src.base_objective:	data:norm : zscore
INFO:echo.src.base_objective:	model:name : linknet
INFO:echo.src.base_objective:	optimizer:learning_rate : 0.00010885637714639096
INFO:echo.src.base_objective:	trainer:train_batch_size : 109
INFO:echo.src.base_objective:	trainer:weight_decay : 4.234415590920676e-08
INFO:echo.src.base_objective:	trainer:training_loss : mae
INFO:echo.src.base_objective:Beginning trial 29
INFO:root:Loading model linknet with settings {'in_channels': 4, 'classes': 1, 'activation': 'sigmoid'}
INFO:root:Loading loss smooth
INFO:root:Loading loss smooth
INFO:echo.src.base_objective:Saving trial 27 results to local file /glade/work/kdagon/s2sml/results_week3_SH_515/trial_results/trial_results_29811.gusched01.csv
INFO:echo.src.base_objective:Merging trial results and saving to /glade/work/kdagon/s2sml/results_week3_SH_515/trial_results.csv
[32m[I 2023-05-15 18:30:26,742][0m Trial 27 finished with values: [1.0154668019106192, 0.9583762321167111, 0.940262192431384] and parameters: {'learning_rate': 0.0004601660050268863, 'norm': 'minmax', 'weight_decay': 3.5532406106124137e-12, 'train_batch_size': 122, 'training_loss': 'huber', 'model_name': 'deeplabv3+'}. [0m
INFO:echo.src.base_objective:Attempting to automatically update the model configuration using optuna's suggested parameters
INFO:echo.src.base_objective:	data:norm : zscore
INFO:echo.src.base_objective:	model:name : pspnet
INFO:echo.src.base_objective:	optimizer:learning_rate : 5.841636915321234e-05
INFO:echo.src.base_objective:	trainer:train_batch_size : 16
INFO:echo.src.base_objective:	trainer:weight_decay : 7.109954558247119e-05
INFO:echo.src.base_objective:	trainer:training_loss : mse
INFO:echo.src.base_objective:Beginning trial 30
INFO:root:Loading model pspnet with settings {'in_channels': 4, 'classes': 1, 'activation': 'sigmoid'}
INFO:root:Loading loss smooth
INFO:root:Loading loss smooth
INFO:echo.src.base_objective:Saving trial 30 results to local file /glade/work/kdagon/s2sml/results_week3_SH_515/trial_results/trial_results_29811.gusched01.csv
INFO:echo.src.base_objective:Merging trial results and saving to /glade/work/kdagon/s2sml/results_week3_SH_515/trial_results.csv
[32m[I 2023-05-15 18:33:23,759][0m Trial 30 finished with values: [1.1850488517895026, 3.9458305697896665, 2.2204222646455465] and parameters: {'learning_rate': 5.841636915321234e-05, 'norm': 'zscore', 'weight_decay': 7.109954558247119e-05, 'train_batch_size': 16, 'training_loss': 'mse', 'model_name': 'pspnet'}. [0m
INFO:echo.src.base_objective:Attempting to automatically update the model configuration using optuna's suggested parameters
INFO:echo.src.base_objective:	data:norm : zscore
INFO:echo.src.base_objective:	model:name : unet++
INFO:echo.src.base_objective:	optimizer:learning_rate : 0.004141868601807681
INFO:echo.src.base_objective:	trainer:train_batch_size : 68
INFO:echo.src.base_objective:	trainer:weight_decay : 9.273040925881323e-06
INFO:echo.src.base_objective:	trainer:training_loss : mse
INFO:echo.src.base_objective:Beginning trial 31
INFO:root:Loading model unet++ with settings {'in_channels': 4, 'classes': 1, 'activation': 'sigmoid'}
INFO:root:Loading loss smooth
INFO:root:Loading loss smooth
INFO:echo.src.base_objective:Saving trial 29 results to local file /glade/work/kdagon/s2sml/results_week3_SH_515/trial_results/trial_results_29812.gusched01.csv
INFO:echo.src.base_objective:Merging trial results and saving to /glade/work/kdagon/s2sml/results_week3_SH_515/trial_results.csv
[32m[I 2023-05-15 18:39:20,705][0m Trial 29 finished with values: [1.0917049239800423, 4.340174782706721, 2.382062455226724] and parameters: {'learning_rate': 0.00010885637714639096, 'norm': 'zscore', 'weight_decay': 4.234415590920676e-08, 'train_batch_size': 109, 'training_loss': 'mae', 'model_name': 'linknet'}. [0m
INFO:echo.src.base_objective:Attempting to automatically update the model configuration using optuna's suggested parameters
INFO:echo.src.base_objective:	data:norm : minmax
INFO:echo.src.base_objective:	model:name : linknet
INFO:echo.src.base_objective:	optimizer:learning_rate : 0.0010107836248553434
INFO:echo.src.base_objective:	trainer:train_batch_size : 87
INFO:echo.src.base_objective:	trainer:weight_decay : 6.52423113373015e-11
INFO:echo.src.base_objective:	trainer:training_loss : mse
INFO:echo.src.base_objective:Beginning trial 32
INFO:root:Loading model linknet with settings {'in_channels': 4, 'classes': 1, 'activation': 'sigmoid'}
INFO:root:Loading loss smooth
INFO:root:Loading loss smooth
INFO:echo.src.base_objective:Saving trial 31 results to local file /glade/work/kdagon/s2sml/results_week3_SH_515/trial_results/trial_results_29811.gusched01.csv
INFO:echo.src.base_objective:Merging trial results and saving to /glade/work/kdagon/s2sml/results_week3_SH_515/trial_results.csv
[32m[I 2023-05-15 18:40:53,256][0m Trial 31 finished with values: [1.0955526343412014, 3.610644979485104, 2.072711981968251] and parameters: {'learning_rate': 0.004141868601807681, 'norm': 'zscore', 'weight_decay': 9.273040925881323e-06, 'train_batch_size': 68, 'training_loss': 'mse', 'model_name': 'unet++'}. [0m
INFO:echo.src.base_objective:Attempting to automatically update the model configuration using optuna's suggested parameters
INFO:echo.src.base_objective:	data:norm : zscore
INFO:echo.src.base_objective:	model:name : deeplabv3
INFO:echo.src.base_objective:	optimizer:learning_rate : 4.165966073043685e-05
INFO:echo.src.base_objective:	trainer:train_batch_size : 64
INFO:echo.src.base_objective:	trainer:weight_decay : 5.793944696978069e-12
INFO:echo.src.base_objective:	trainer:training_loss : xtanh
INFO:echo.src.base_objective:Beginning trial 33
INFO:root:Loading model deeplabv3 with settings {'in_channels': 4, 'classes': 1, 'activation': 'sigmoid'}
INFO:root:Loading loss smooth
INFO:root:Loading loss smooth
INFO:echo.src.base_objective:Saving trial 33 results to local file /glade/work/kdagon/s2sml/results_week3_SH_515/trial_results/trial_results_29811.gusched01.csv
INFO:echo.src.base_objective:Merging trial results and saving to /glade/work/kdagon/s2sml/results_week3_SH_515/trial_results.csv
[32m[I 2023-05-15 18:53:03,789][0m Trial 33 finished with values: [1.1726235497624518, 4.092555528545524, 2.258885096811493] and parameters: {'learning_rate': 4.165966073043685e-05, 'norm': 'zscore', 'weight_decay': 5.793944696978069e-12, 'train_batch_size': 64, 'training_loss': 'xtanh', 'model_name': 'deeplabv3'}. [0m
INFO:echo.src.base_objective:Attempting to automatically update the model configuration using optuna's suggested parameters
INFO:echo.src.base_objective:	data:norm : minmax
INFO:echo.src.base_objective:	model:name : unet
INFO:echo.src.base_objective:	optimizer:learning_rate : 0.001623029468529714
INFO:echo.src.base_objective:	trainer:train_batch_size : 12
INFO:echo.src.base_objective:	trainer:weight_decay : 1.3958255955280437e-10
INFO:echo.src.base_objective:	trainer:training_loss : mse
INFO:echo.src.base_objective:Beginning trial 34
INFO:root:Loading model unet with settings {'in_channels': 4, 'classes': 1, 'activation': 'sigmoid'}
INFO:root:Loading loss smooth
INFO:root:Loading loss smooth
INFO:echo.src.base_objective:Saving trial 32 results to local file /glade/work/kdagon/s2sml/results_week3_SH_515/trial_results/trial_results_29812.gusched01.csv
INFO:echo.src.base_objective:Merging trial results and saving to /glade/work/kdagon/s2sml/results_week3_SH_515/trial_results.csv
[32m[I 2023-05-15 18:57:26,738][0m Trial 32 finished with values: [0.9606088290193577, 0.38180262487849703, 0.6735336775504139] and parameters: {'learning_rate': 0.0010107836248553434, 'norm': 'minmax', 'weight_decay': 6.52423113373015e-11, 'train_batch_size': 87, 'training_loss': 'mse', 'model_name': 'linknet'}. [0m
INFO:echo.src.base_objective:Attempting to automatically update the model configuration using optuna's suggested parameters
INFO:echo.src.base_objective:	data:norm : None
INFO:echo.src.base_objective:	model:name : linknet
INFO:echo.src.base_objective:	optimizer:learning_rate : 2.6967078201322287e-05
INFO:echo.src.base_objective:	trainer:train_batch_size : 25
INFO:echo.src.base_objective:	trainer:weight_decay : 4.0861200840565486e-05
INFO:echo.src.base_objective:	trainer:training_loss : huber
INFO:echo.src.base_objective:Beginning trial 35
INFO:root:Loading model linknet with settings {'in_channels': 4, 'classes': 1, 'activation': 'sigmoid'}
INFO:root:Loading loss smooth
INFO:root:Loading loss smooth
INFO:echo.src.base_objective:Saving trial 34 results to local file /glade/work/kdagon/s2sml/results_week3_SH_515/trial_results/trial_results_29811.gusched01.csv
INFO:echo.src.base_objective:Merging trial results and saving to /glade/work/kdagon/s2sml/results_week3_SH_515/trial_results.csv
[32m[I 2023-05-15 18:57:54,286][0m Trial 34 finished with values: [0.9671454460389807, 0.48924948172318483, 0.7671092464632991] and parameters: {'learning_rate': 0.001623029468529714, 'norm': 'minmax', 'weight_decay': 1.3958255955280437e-10, 'train_batch_size': 12, 'training_loss': 'mse', 'model_name': 'unet'}. [0m
INFO:echo.src.base_objective:Attempting to automatically update the model configuration using optuna's suggested parameters
INFO:echo.src.base_objective:	data:norm : zscore
INFO:echo.src.base_objective:	model:name : linknet
INFO:echo.src.base_objective:	optimizer:learning_rate : 1.9808385520904843e-05
INFO:echo.src.base_objective:	trainer:train_batch_size : 95
INFO:echo.src.base_objective:	trainer:weight_decay : 2.6148684131739444e-07
INFO:echo.src.base_objective:	trainer:training_loss : mae
INFO:echo.src.base_objective:Beginning trial 36
INFO:root:Loading model linknet with settings {'in_channels': 4, 'classes': 1, 'activation': 'sigmoid'}
INFO:root:Loading loss smooth
INFO:root:Loading loss smooth
INFO:echo.src.base_objective:Saving trial 36 results to local file /glade/work/kdagon/s2sml/results_week3_SH_515/trial_results/trial_results_29811.gusched01.csv
INFO:echo.src.base_objective:Merging trial results and saving to /glade/work/kdagon/s2sml/results_week3_SH_515/trial_results.csv
[32m[I 2023-05-15 19:00:46,511][0m Trial 36 finished with values: [3.556816930766072, 7.3880311344605945, 3.2726295995598145] and parameters: {'learning_rate': 1.9808385520904843e-05, 'norm': 'zscore', 'weight_decay': 2.6148684131739444e-07, 'train_batch_size': 95, 'training_loss': 'mae', 'model_name': 'linknet'}. [0m
INFO:echo.src.base_objective:Attempting to automatically update the model configuration using optuna's suggested parameters
INFO:echo.src.base_objective:	data:norm : zscore
INFO:echo.src.base_objective:	model:name : deeplabv3+
INFO:echo.src.base_objective:	optimizer:learning_rate : 2.408213133181997e-06
INFO:echo.src.base_objective:	trainer:train_batch_size : 5
INFO:echo.src.base_objective:	trainer:weight_decay : 2.788724141409319e-10
INFO:echo.src.base_objective:	trainer:training_loss : smooth
INFO:echo.src.base_objective:Beginning trial 37
INFO:root:Loading model deeplabv3+ with settings {'in_channels': 4, 'classes': 1, 'activation': 'sigmoid'}
INFO:root:Loading loss smooth
INFO:root:Loading loss smooth
INFO:echo.src.base_objective:Saving trial 35 results to local file /glade/work/kdagon/s2sml/results_week3_SH_515/trial_results/trial_results_29812.gusched01.csv
INFO:echo.src.base_objective:Merging trial results and saving to /glade/work/kdagon/s2sml/results_week3_SH_515/trial_results.csv
[32m[I 2023-05-15 19:03:09,111][0m Trial 35 finished with values: [46605.82749645724, 12082.395417181908, 162.50914054790573] and parameters: {'learning_rate': 2.6967078201322287e-05, 'norm': 'None', 'weight_decay': 4.0861200840565486e-05, 'train_batch_size': 25, 'training_loss': 'huber', 'model_name': 'linknet'}. [0m
INFO:echo.src.base_objective:Attempting to automatically update the model configuration using optuna's suggested parameters
INFO:echo.src.base_objective:	data:norm : None
INFO:echo.src.base_objective:	model:name : manet
INFO:echo.src.base_objective:	optimizer:learning_rate : 0.0005665905047332262
INFO:echo.src.base_objective:	trainer:train_batch_size : 78
INFO:echo.src.base_objective:	trainer:weight_decay : 4.877369984246433e-05
INFO:echo.src.base_objective:	trainer:training_loss : smooth
INFO:echo.src.base_objective:Beginning trial 38
INFO:root:Loading model manet with settings {'in_channels': 4, 'classes': 1, 'activation': 'sigmoid'}
INFO:root:Loading loss smooth
INFO:root:Loading loss smooth
INFO:echo.src.base_objective:Saving trial 38 results to local file /glade/work/kdagon/s2sml/results_week3_SH_515/trial_results/trial_results_29812.gusched01.csv
INFO:echo.src.base_objective:Merging trial results and saving to /glade/work/kdagon/s2sml/results_week3_SH_515/trial_results.csv
[32m[I 2023-05-15 19:05:58,889][0m Trial 38 finished with values: [18050.889038372017, 12104.251370768174, 162.65418869783036] and parameters: {'learning_rate': 0.0005665905047332262, 'norm': 'None', 'weight_decay': 4.877369984246433e-05, 'train_batch_size': 78, 'training_loss': 'smooth', 'model_name': 'manet'}. [0m
INFO:echo.src.base_objective:Attempting to automatically update the model configuration using optuna's suggested parameters
INFO:echo.src.base_objective:	data:norm : minmax
INFO:echo.src.base_objective:	model:name : fpn
INFO:echo.src.base_objective:	optimizer:learning_rate : 1.1731818124007618e-05
INFO:echo.src.base_objective:	trainer:train_batch_size : 31
INFO:echo.src.base_objective:	trainer:weight_decay : 5.702072442476775e-10
INFO:echo.src.base_objective:	trainer:training_loss : logcosh
INFO:echo.src.base_objective:Beginning trial 39
INFO:root:Loading model fpn with settings {'in_channels': 4, 'classes': 1, 'activation': 'sigmoid'}
INFO:root:Loading loss smooth
INFO:root:Loading loss smooth
INFO:echo.src.base_objective:Saving trial 37 results to local file /glade/work/kdagon/s2sml/results_week3_SH_515/trial_results/trial_results_29811.gusched01.csv
INFO:echo.src.base_objective:Merging trial results and saving to /glade/work/kdagon/s2sml/results_week3_SH_515/trial_results.csv
[32m[I 2023-05-15 19:14:06,370][0m Trial 37 finished with values: [1.1362828512012937, 4.249823835711366, 2.312549865556797] and parameters: {'learning_rate': 2.408213133181997e-06, 'norm': 'zscore', 'weight_decay': 2.788724141409319e-10, 'train_batch_size': 5, 'training_loss': 'smooth', 'model_name': 'deeplabv3+'}. [0m
INFO:echo.src.base_objective:Attempting to automatically update the model configuration using optuna's suggested parameters
INFO:echo.src.base_objective:	data:norm : minmax
INFO:echo.src.base_objective:	model:name : deeplabv3+
INFO:echo.src.base_objective:	optimizer:learning_rate : 1.7343344382636848e-06
INFO:echo.src.base_objective:	trainer:train_batch_size : 116
INFO:echo.src.base_objective:	trainer:weight_decay : 0.0007200673643747292
INFO:echo.src.base_objective:	trainer:training_loss : huber
INFO:echo.src.base_objective:Beginning trial 40
INFO:root:Loading model deeplabv3+ with settings {'in_channels': 4, 'classes': 1, 'activation': 'sigmoid'}
INFO:root:Loading loss smooth
INFO:root:Loading loss smooth
INFO:echo.src.base_objective:Saving trial 40 results to local file /glade/work/kdagon/s2sml/results_week3_SH_515/trial_results/trial_results_29811.gusched01.csv
INFO:echo.src.base_objective:Merging trial results and saving to /glade/work/kdagon/s2sml/results_week3_SH_515/trial_results.csv
[32m[I 2023-05-15 19:18:36,856][0m Trial 40 finished with values: [2.409571898758573, 7.655745030474821, 3.399959706814905] and parameters: {'learning_rate': 1.7343344382636848e-06, 'norm': 'minmax', 'weight_decay': 0.0007200673643747292, 'train_batch_size': 116, 'training_loss': 'huber', 'model_name': 'deeplabv3+'}. [0m
INFO:echo.src.base_objective:Attempting to automatically update the model configuration using optuna's suggested parameters
INFO:echo.src.base_objective:	data:norm : minmax
INFO:echo.src.base_objective:	model:name : fpn
INFO:echo.src.base_objective:	optimizer:learning_rate : 0.0006372821117275482
INFO:echo.src.base_objective:	trainer:train_batch_size : 53
INFO:echo.src.base_objective:	trainer:weight_decay : 2.2147949347932095e-06
INFO:echo.src.base_objective:	trainer:training_loss : smooth
INFO:echo.src.base_objective:Beginning trial 41
INFO:root:Loading model fpn with settings {'in_channels': 4, 'classes': 1, 'activation': 'sigmoid'}
INFO:root:Loading loss smooth
INFO:root:Loading loss smooth
INFO:echo.src.base_objective:Saving trial 39 results to local file /glade/work/kdagon/s2sml/results_week3_SH_515/trial_results/trial_results_29812.gusched01.csv
INFO:echo.src.base_objective:Merging trial results and saving to /glade/work/kdagon/s2sml/results_week3_SH_515/trial_results.csv
[32m[I 2023-05-15 19:18:54,459][0m Trial 39 finished with values: [1.1105387378833038, 3.4091678133595154, 2.078839565947849] and parameters: {'learning_rate': 1.1731818124007618e-05, 'norm': 'minmax', 'weight_decay': 5.702072442476775e-10, 'train_batch_size': 31, 'training_loss': 'logcosh', 'model_name': 'fpn'}. [0m
INFO:echo.src.base_objective:Attempting to automatically update the model configuration using optuna's suggested parameters
INFO:echo.src.base_objective:	data:norm : minmax
INFO:echo.src.base_objective:	model:name : manet
INFO:echo.src.base_objective:	optimizer:learning_rate : 0.006797499063019266
INFO:echo.src.base_objective:	trainer:train_batch_size : 10
INFO:echo.src.base_objective:	trainer:weight_decay : 1.204106282390783e-07
INFO:echo.src.base_objective:	trainer:training_loss : xsigmoid
INFO:echo.src.base_objective:Beginning trial 42
INFO:root:Loading model manet with settings {'in_channels': 4, 'classes': 1, 'activation': 'sigmoid'}
INFO:root:Loading loss smooth
INFO:root:Loading loss smooth
INFO:echo.src.base_objective:Saving trial 41 results to local file /glade/work/kdagon/s2sml/results_week3_SH_515/trial_results/trial_results_29811.gusched01.csv
INFO:echo.src.base_objective:Merging trial results and saving to /glade/work/kdagon/s2sml/results_week3_SH_515/trial_results.csv
