number,values_0,values_1,values_2,datetime_start,datetime_complete,duration,params_learning_rate,params_model_name,params_norm,params_train_batch_size,params_training_loss,params_weight_decay,state
0,1.0142489313781007,0.946606017250634,0.9202209150545435,2023-05-15 15:28:25.969522,2023-05-15 15:44:26.908798,0 days 00:16:00.939276,0.0007244169897842657,deeplabv3+,minmax,72,logcosh,0.0003563372592711742,COMPLETE
1,1.0314923904258184,1.2914674051426158,1.1683407352880195,2023-05-15 15:28:26.073629,2023-05-15 15:41:50.659509,0 days 00:13:24.585880,0.0007291131278606368,fpn,minmax,69,xtanh,8.820187429005921e-10,COMPLETE
2,26.94447975158926,12056.517145356027,162.33537089427594,2023-05-15 15:41:50.809684,2023-05-15 15:49:25.752140,0 days 00:07:34.942456,0.0044041396570147434,deeplabv3,None,93,mse,9.686252228913244e-07,COMPLETE
3,1.1542321395464599,3.6844893932101352,2.0902240874765625,2023-05-15 15:44:27.026468,2023-05-15 15:55:39.479356,0 days 00:11:12.452888,0.00020106272399616354,fpn,zscore,17,mse,0.0003457871263194445,COMPLETE
4,1.2103848534787056,6.647368119725359,3.1940592323128962,2023-05-15 15:49:25.847049,2023-05-15 16:27:58.827759,0 days 00:38:32.980710,1.6571567941573003e-06,deeplabv3,negone,28,xsigmoid,0.0004886767616092857,COMPLETE
5,1.2772670539117577,3.369817107280385,2.097706164805902,2023-05-15 15:55:39.594525,2023-05-15 16:17:17.331443,0 days 00:21:37.736918,7.291871985889319e-06,linknet,minmax,39,smooth,2.348787222644882e-05,COMPLETE
6,1.082582921808754,6.347660204103818,3.2670502675480195,2023-05-15 16:17:17.414571,2023-05-15 16:55:21.288572,0 days 00:38:03.874001,3.6934624978451226e-06,unet++,negone,63,xtanh,6.747085463275048e-05,COMPLETE
7,1.0497132461942011,1.7070653024225448,1.4682536309915508,2023-05-15 16:27:59.009170,2023-05-15 16:38:41.284149,0 days 00:10:42.274979,2.6492323919800125e-05,deeplabv3+,minmax,97,xsigmoid,8.966346907110688e-05,COMPLETE
8,1.1786385984096865,3.867447687068986,2.19354609434715,2023-05-15 16:38:41.474689,2023-05-15 16:46:12.622480,0 days 00:07:31.147791,0.0009394207697552794,deeplabv3,zscore,107,logcosh,7.873162840378467e-06,COMPLETE
9,1.0800314216157187,1.604065890229391,1.2660403670448446,2023-05-15 16:46:12.716713,2023-05-15 16:55:52.117268,0 days 00:09:39.400555,0.0031061109991745313,pspnet,negone,53,smooth,3.107198497742131e-07,COMPLETE
10,25.14106216422959,12093.724527988952,162.58580209888902,2023-05-15 16:56:38.704541,2023-05-15 16:59:15.233957,0 days 00:02:36.529416,0.0002458180262234768,manet,None,69,logcosh,0.0006277624732018657,COMPLETE
11,14.390658438160925,18.136977171538135,5.296075636738638,2023-05-15 16:56:38.704971,2023-05-15 16:59:37.747054,0 days 00:02:59.042083,4.233640369528075e-06,linknet,minmax,100,xtanh,1.3593864166890444e-08,COMPLETE
12,1.0491966878920613,2.381939369027058,1.791526048582354,2023-05-15 16:59:15.358888,2023-05-15 17:06:56.680104,0 days 00:07:41.321216,0.00015242558663242106,deeplabv3+,negone,112,huber,2.8803159499718976e-08,COMPLETE
13,1.1583895964021194,3.999411478251624,2.227089189106744,2023-05-15 16:59:37.848830,2023-05-15 17:06:39.261965,0 days 00:07:01.413135,3.105070451051848e-05,deeplabv3,zscore,15,smooth,7.745572074213735e-11,COMPLETE
14,0.966821141329495,0.45299039346565506,0.7489975928436254,2023-05-15 17:06:39.344065,2023-05-15 17:29:07.049657,0 days 00:22:27.705592,1.5677007053129574e-05,unet++,minmax,27,logcosh,0.00024498892374286504,COMPLETE
15,0.9644200541049518,0.4241069203515197,0.7061618418334905,2023-05-15 17:06:56.780632,2023-05-15 17:12:36.876489,0 days 00:05:40.095857,0.0013140189275691824,linknet,minmax,32,logcosh,6.66404587610107e-12,COMPLETE
16,1.0636249460570713,4.416827653305993,2.419446688496439,2023-05-15 17:12:36.960498,2023-05-15 17:47:06.346480,0 days 00:34:29.385982,5.908628791025559e-06,manet,zscore,88,xsigmoid,9.429939419508451e-12,COMPLETE
17,1.0016592574326926,1.2224549317322821,1.1360436393160467,2023-05-15 17:29:07.147194,2023-05-15 17:37:14.833410,0 days 00:08:07.686216,0.0003457321042763964,linknet,negone,41,mse,5.4199806176227616e-05,COMPLETE
18,1.0559549473184116,1.3888936634130051,1.185237740831705,2023-05-15 17:37:14.908116,2023-05-15 17:44:14.923830,0 days 00:07:00.015714,0.004284001315474613,deeplabv3+,negone,118,xsigmoid,1.3785591259245883e-10,COMPLETE
19,3.5020575766738267,12103.943695057105,162.65497410229793,2023-05-15 17:44:15.027051,2023-05-15 17:46:36.136640,0 days 00:02:21.109589,3.392367579244501e-05,unet++,None,101,huber,1.999908269528814e-10,COMPLETE
20,1.1353104340927322,6.518215470210093,3.0460322891284775,2023-05-15 17:46:36.311038,2023-05-15 17:49:36.879338,0 days 00:03:00.568300,0.00025523748005522323,deeplabv3+,zscore,46,xtanh,2.6863777644937942e-05,COMPLETE
21,0.9701595478363628,0.4896956038058062,0.7789776945674339,2023-05-15 17:47:06.496808,2023-05-15 18:03:01.280537,0 days 00:15:54.783729,9.210206335525336e-05,unet,minmax,103,mse,3.1217644070305195e-11,COMPLETE
22,12.01724119360739,12056.510211818875,162.33531882326153,2023-05-15 17:49:37.073784,2023-05-15 17:55:25.177649,0 days 00:05:48.103865,0.0015964501161258074,unet,None,6,logcosh,4.937423452518926e-08,COMPLETE
23,1.0913961217942096,1.6959128749517887,1.3317896081147487,2023-05-15 17:55:25.274364,2023-05-15 18:08:25.223274,0 days 00:12:59.948910,0.00578869735910796,deeplabv3,negone,111,logcosh,2.2976488905072662e-07,COMPLETE
24,1.0970145333188128,1.7183931778642545,1.347425704940948,2023-05-15 18:03:01.585508,2023-05-15 18:07:20.413060,0 days 00:04:18.827552,0.004867103624458612,pspnet,minmax,30,xsigmoid,5.54236892149174e-06,COMPLETE
25,1.0858250447798898,3.9774059179062062,2.2296949270146498,2023-05-15 18:07:20.553436,2023-05-15 18:18:54.866416,0 days 00:11:34.312980,6.604706818648971e-05,linknet,zscore,26,huber,1.639615821021539e-08,COMPLETE
26,0.9708142999122836,0.5134933174604852,0.7906584082473938,2023-05-15 18:08:25.664235,2023-05-15 18:25:48.532956,0 days 00:17:22.868721,4.169644425002291e-05,linknet,minmax,9,logcosh,1.6597317758110658e-11,COMPLETE
27,1.0154668019106192,0.9583762321167111,0.940262192431384,2023-05-15 18:19:55.841847,2023-05-15 18:30:26.588449,0 days 00:10:30.746602,0.0004601660050268863,deeplabv3+,minmax,122,huber,3.5532406106124137e-12,COMPLETE
28,33.68883600644086,12056.507611742445,162.33530580550791,2023-05-15 18:26:13.162932,2023-05-15 18:28:51.884384,0 days 00:02:38.721452,0.0001980673852387479,fpn,None,38,xsigmoid,8.271776892691221e-10,COMPLETE
29,1.0917049239800423,4.340174782706721,2.382062455226724,2023-05-15 18:28:52.014605,2023-05-15 18:39:20.602995,0 days 00:10:28.588390,0.00010885637714639096,linknet,zscore,109,mae,4.234415590920676e-08,COMPLETE
30,1.1850488517895026,3.9458305697896665,2.2204222646455465,2023-05-15 18:30:26.796889,2023-05-15 18:33:23.685958,0 days 00:02:56.889069,5.841636915321234e-05,pspnet,zscore,16,mse,7.109954558247119e-05,COMPLETE
31,1.0955526343412014,3.610644979485104,2.072711981968251,2023-05-15 18:33:23.792758,2023-05-15 18:40:53.171356,0 days 00:07:29.378598,0.004141868601807681,unet++,zscore,68,mse,9.273040925881323e-06,COMPLETE
32,0.9606088290193577,0.38180262487849703,0.6735336775504139,2023-05-15 18:39:20.757285,2023-05-15 18:57:26.651805,0 days 00:18:05.894520,0.0010107836248553434,linknet,minmax,87,mse,6.52423113373015e-11,COMPLETE
33,1.1726235497624518,4.092555528545524,2.258885096811493,2023-05-15 18:40:53.303111,2023-05-15 18:53:03.698381,0 days 00:12:10.395270,4.165966073043685e-05,deeplabv3,zscore,64,xtanh,5.793944696978069e-12,COMPLETE
34,0.9671454460389807,0.48924948172318483,0.7671092464632991,2023-05-15 18:53:03.827318,2023-05-15 18:57:54.223500,0 days 00:04:50.396182,0.001623029468529714,unet,minmax,12,mse,1.3958255955280437e-10,COMPLETE
35,46605.82749645724,12082.395417181908,162.50914054790573,2023-05-15 18:57:26.784929,2023-05-15 19:03:09.008264,0 days 00:05:42.223335,2.6967078201322287e-05,linknet,None,25,huber,4.0861200840565486e-05,COMPLETE
36,3.556816930766072,7.3880311344605945,3.2726295995598145,2023-05-15 18:57:54.336326,2023-05-15 19:00:46.439644,0 days 00:02:52.103318,1.9808385520904843e-05,linknet,zscore,95,mae,2.6148684131739444e-07,COMPLETE
37,1.1362828512012937,4.249823835711366,2.312549865556797,2023-05-15 19:00:46.545933,2023-05-15 19:14:06.259382,0 days 00:13:19.713449,2.408213133181997e-06,deeplabv3+,zscore,5,smooth,2.788724141409319e-10,COMPLETE
38,18050.889038372017,12104.251370768174,162.65418869783036,2023-05-15 19:03:09.159606,2023-05-15 19:05:58.836111,0 days 00:02:49.676505,0.0005665905047332262,manet,None,78,smooth,4.877369984246433e-05,COMPLETE
39,1.1105387378833038,3.4091678133595154,2.078839565947849,2023-05-15 19:05:58.923683,2023-05-15 19:18:54.433230,0 days 00:12:55.509547,1.1731818124007618e-05,fpn,minmax,31,logcosh,5.702072442476775e-10,COMPLETE
40,2.409571898758573,7.655745030474821,3.399959706814905,2023-05-15 19:14:06.414392,2023-05-15 19:18:36.800734,0 days 00:04:30.386342,1.7343344382636848e-06,deeplabv3+,minmax,116,huber,0.0007200673643747292,COMPLETE
41,1.045171891883634,1.8484210096671412,1.4906826168236962,2023-05-15 19:18:36.892548,2023-05-15 19:25:32.632937,0 days 00:06:55.740389,0.0006372821117275482,fpn,minmax,53,smooth,2.2147949347932095e-06,COMPLETE
42,0.9590280200026785,0.3704726159894607,0.6598440966476293,2023-05-15 19:18:54.503355,2023-05-15 19:29:19.958320,0 days 00:10:25.454965,0.006797499063019266,manet,minmax,10,xsigmoid,1.204106282390783e-07,COMPLETE
43,1.094857255722744,3.5994022757021917,2.053852159086515,2023-05-15 19:25:32.862684,2023-05-15 19:30:05.110759,0 days 00:04:32.248075,0.0029056254675701733,unet++,zscore,10,huber,0.00033643869608264687,COMPLETE
44,13.16503851893701,12137.365944200452,162.87918321189815,2023-05-15 19:29:20.069134,2023-05-15 19:32:10.172231,0 days 00:02:50.103097,0.0009757379726010104,manet,None,121,xtanh,1.1099984714746179e-12,COMPLETE
45,26.20750486136065,84.24837430962802,13.046016287314787,2023-05-15 19:30:05.288763,2023-05-15 19:33:02.128657,0 days 00:02:56.839894,0.0036893204518289105,fpn,minmax,28,huber,5.958163674363907e-12,COMPLETE
46,1.084250167892818,4.037665008056669,2.2554802517785797,2023-05-15 19:32:10.352690,2023-05-15 19:40:31.220910,0 days 00:08:20.868220,0.00029748501296783525,linknet,zscore,118,logcosh,8.803754277025888e-11,COMPLETE
47,1.0973052775930974,5.275174324051251,2.873962814187109,2023-05-15 19:33:02.292312,2023-05-15 20:07:36.171608,0 days 00:34:33.879296,6.6862248281764474e-06,manet,negone,111,mae,4.6560294443688446e-10,COMPLETE
48,21.84833527470463,12066.747001627287,162.40430423886872,2023-05-15 19:40:31.333122,2023-05-15 19:43:45.371730,0 days 00:03:14.038608,0.000326494975457569,unet++,None,36,xsigmoid,7.2441380178985605e-06,COMPLETE
49,0.9634325526488088,0.4165428600514837,0.7005477145020049,2023-05-15 19:43:45.448890,2023-05-15 20:14:32.066564,0 days 00:30:46.617674,0.009203576048928748,linknet,minmax,128,mse,2.1258186307930386e-05,COMPLETE
50,0.9982265818717877,0.8244318542044766,1.0109084225913685,2023-05-15 20:08:32.552372,2023-05-15 20:14:37.519264,0 days 00:06:04.966892,7.541371480536176e-05,unet,minmax,42,mse,9.52120071407864e-08,COMPLETE
51,1.0824125995210478,1.7161436822315546,1.3273882687550003,2023-05-15 20:14:37.637008,2023-05-15 20:23:24.258768,0 days 00:08:46.621760,0.00014363624958655213,deeplabv3,negone,27,xsigmoid,7.945693383151309e-10,COMPLETE
52,1.0776803346595227,1.5085231150526177,1.2837859430742165,2023-05-15 20:14:58.553829,2023-05-15 20:36:20.641916,0 days 00:21:22.088087,1.8094704719381707e-05,fpn,negone,38,xsigmoid,7.173997046798131e-08,COMPLETE
53,1.1727616791656996,4.128925798351751,2.27442205443955,2023-05-15 20:23:24.355205,2023-05-15 20:31:17.665105,0 days 00:07:53.309900,6.836487571764075e-05,deeplabv3,zscore,94,smooth,6.191710698097796e-05,COMPLETE
54,1.1563280997737841,5.5351208365990665,2.7653113804234466,2023-05-15 20:31:17.777749,2023-05-15 20:35:29.048857,0 days 00:04:11.271108,4.129444767791241e-05,deeplabv3+,zscore,74,smooth,7.089118767899794e-05,COMPLETE
55,14.237814947043931,18.110673113439198,5.291405474507604,2023-05-15 20:35:29.135498,2023-05-15 20:38:16.741564,0 days 00:02:47.606066,4.735029692918727e-06,linknet,minmax,100,xtanh,7.61959816710682e-06,COMPLETE
56,1.0620855065882069,1.4216948546289343,1.2338801324019182,2023-05-15 20:36:20.759861,2023-05-15 20:45:07.693548,0 days 00:08:46.933687,0.0001844841742509137,deeplabv3,minmax,60,smooth,4.549818706312426e-07,COMPLETE
57,0.971446613017617,0.5066323684130042,0.7854787589251356,2023-05-15 20:38:16.832133,2023-05-15 20:53:02.543561,0 days 00:14:45.711428,3.341895100364569e-05,unet++,minmax,57,logcosh,1.4249034335311785e-11,COMPLETE
58,0.9992654357272517,0.9333332168358807,0.9321860129657432,2023-05-15 20:45:07.797676,2023-05-15 21:00:46.091790,0 days 00:15:38.294114,0.004650173103552172,manet,negone,85,mse,1.3736603528052226e-07,COMPLETE
59,0.9995704148461297,2.586160751073394,1.922922966005491,2023-05-15 20:53:02.665562,2023-05-15 21:09:03.869233,0 days 00:16:01.203671,7.509659978052965e-05,unet++,negone,120,mse,9.338368093497487e-11,COMPLETE
60,0.9934460669953492,0.8849830965705073,0.8963906658093451,2023-05-15 21:00:46.203354,2023-05-15 21:10:13.511699,0 days 00:09:27.308345,0.0021872276593804503,unet++,negone,40,logcosh,0.00019632547770132675,COMPLETE
61,18.35194571507617,12100.127938445108,162.62888218482112,2023-05-15 21:09:03.967963,2023-05-15 21:12:06.996039,0 days 00:03:03.028076,2.961938364893448e-06,deeplabv3+,None,30,huber,2.451316329097341e-05,COMPLETE
62,1.1707834599858302,2.695742718491639,1.7083741863140305,2023-05-15 21:10:13.608326,2023-05-15 21:41:37.895647,0 days 00:31:24.287321,2.499727708676736e-06,manet,minmax,65,xtanh,1.084592485543726e-06,COMPLETE
63,61.27643371451215,12085.128675306234,162.52786875609297,2023-05-15 21:12:07.091722,2023-05-15 21:15:57.363248,0 days 00:03:50.271526,2.1289987851043295e-05,unet,None,15,xsigmoid,2.9923409986845876e-05,COMPLETE
64,3.898538629251683,12094.352013101101,162.59026284912454,2023-05-15 21:15:57.495223,2023-05-15 21:18:24.101192,0 days 00:02:26.605969,8.531765456229314e-06,pspnet,None,53,xsigmoid,0.00038124278555552276,COMPLETE
65,1.0805271287527263,1.6230496133316203,1.271136931710552,2023-05-15 21:18:24.180059,2023-05-15 21:34:15.672582,0 days 00:15:51.492523,0.0014390542200185777,deeplabv3,negone,115,mae,5.079650090380997e-07,COMPLETE
66,226.95965384573736,12061.516225641763,162.36866596874782,2023-05-15 21:34:39.184745,2023-05-15 21:38:40.861337,0 days 00:04:01.676592,0.004872609263480489,linknet,None,52,huber,2.904342019695146e-10,COMPLETE
67,1.026951111568164,1.262493899147706,1.179970288539674,2023-05-15 21:38:40.967771,2023-05-15 21:49:36.281747,0 days 00:10:55.313976,0.0001325571211848526,fpn,minmax,13,mae,9.06479978525904e-10,COMPLETE
68,1.0866644277555018,1.902237330772186,1.4628371283946486,2023-05-15 21:42:02.117667,2023-05-15 21:52:23.305898,0 days 00:10:21.188231,1.0234651855809308e-05,deeplabv3,minmax,10,logcosh,4.3321024794264956e-05,COMPLETE
69,1.0421229387927633,1.272362903657182,1.1045847698353881,2023-05-15 21:49:36.427510,2023-05-15 21:59:30.328940,0 days 00:09:53.901430,0.0017728644242675962,fpn,negone,15,smooth,1.954842764313202e-12,COMPLETE
70,1.127817645207545,4.371476690691389,2.416927698776109,2023-05-15 21:52:23.465287,2023-05-15 22:08:42.643595,0 days 00:16:19.178308,1.4737855820929227e-05,fpn,minmax,98,mse,1.418174317161037e-08,COMPLETE
71,0.9623702935971195,0.4028605921442006,0.6932825707354546,2023-05-15 21:59:30.428274,2023-05-15 22:11:57.854486,0 days 00:12:27.426212,0.0005243032610041411,linknet,minmax,36,smooth,1.3569791254567176e-09,COMPLETE
72,1.0714470181714142,1.5329553117315335,1.2479300895998606,2023-05-15 22:08:42.777850,2023-05-15 22:16:03.561507,0 days 00:07:20.783657,5.5512193621753565e-05,deeplabv3,minmax,45,smooth,5.790376962241808e-09,COMPLETE
73,4.71167324727965,12070.941791603529,162.43276538750175,2023-05-15 22:11:58.043607,2023-05-15 22:15:01.796945,0 days 00:03:03.753338,1.1691567973779505e-05,fpn,None,100,mse,6.895677297444062e-05,COMPLETE
74,9.139885572113887,13.14415146364382,4.488502816606152,2023-05-15 22:15:01.901035,2023-05-15 22:18:13.174356,0 days 00:03:11.273321,1.260857603935773e-06,linknet,negone,58,xsigmoid,4.506159670631628e-08,COMPLETE
75,26.896062931867547,12056.507611742445,162.33530580550791,2023-05-15 22:16:03.701662,2023-05-15 22:18:54.853644,0 days 00:02:51.151982,0.0009782784324788385,fpn,None,53,xtanh,4.821275764196279e-12,COMPLETE
76,1.0852163207730339,1.8288438232762836,1.392896936341758,2023-05-15 22:18:13.305742,2023-05-15 22:26:50.666538,0 days 00:08:37.360796,0.00019383811480329274,deeplabv3,negone,72,logcosh,2.7741099632828576e-10,COMPLETE
77,0.9629209390642203,0.4103080146331468,0.6905006562840991,2023-05-15 22:18:54.952763,2023-05-15 22:50:55.592469,0 days 00:32:00.639706,0.001543829646653862,unet,minmax,113,logcosh,3.225840810069256e-06,COMPLETE
78,2.4036497535323638,12101.238459978764,162.63636305389312,2023-05-15 22:26:50.822849,2023-05-15 22:29:16.134218,0 days 00:02:25.311369,0.0002117026263908324,deeplabv3+,None,90,xsigmoid,6.752415201465598e-10,COMPLETE
79,1.2011408570689115,3.834856891839889,2.191821163739874,2023-05-15 22:29:16.249283,2023-05-15 22:37:56.170314,0 days 00:08:39.921031,0.009370265556753596,pspnet,zscore,115,huber,6.130607547006741e-06,COMPLETE
80,1.1954199271243358,3.8093753299369464,2.1816529309993924,2023-05-15 22:37:56.381057,2023-05-15 22:44:06.161258,0 days 00:06:09.780201,0.003715363789441839,pspnet,zscore,48,xtanh,5.025754217386805e-09,COMPLETE
81,1.1898569264361054,4.243614869358704,2.097893475791711,2023-05-15 22:44:06.427137,2023-05-15 22:53:03.061610,0 days 00:08:56.634473,6.671854689730093e-06,deeplabv3,minmax,82,logcosh,1.2819747667737204e-11,COMPLETE
82,1.2950798694431258,3.226795907537123,2.1009752904658647,2023-05-15 22:50:55.767194,2023-05-15 23:06:50.600000,0 days 00:15:54.832806,3.278099906653877e-06,fpn,negone,62,xtanh,1.0760786862749657e-06,COMPLETE
83,1.0798266168067743,1.6036690690266076,1.2716455114338492,2023-05-15 22:53:03.235802,2023-05-15 23:01:54.491218,0 days 00:08:51.255416,0.0010208522623232218,deeplabv3,negone,13,mae,0.000279636987561752,COMPLETE
84,1.2004482575417585,3.805324193029856,2.1856205621838853,2023-05-15 23:02:53.400267,2023-05-15 23:10:47.435506,0 days 00:07:54.035239,0.002448449289114721,pspnet,zscore,49,logcosh,9.944007125656899e-05,COMPLETE
85,3.363698754270117,12082.510398339658,162.51099774742013,2023-05-15 23:07:45.147748,2023-05-15 23:10:48.684045,0 days 00:03:03.536297,7.976449068198952e-05,deeplabv3,None,28,xsigmoid,0.0009090012253586355,COMPLETE
86,3.3699036459929377,12080.91972935831,162.50048374175802,2023-05-15 23:10:47.637956,2023-05-15 23:20:35.396656,0 days 00:09:47.758700,4.4133958269760825e-06,deeplabv3,None,86,xsigmoid,1.2487097863069158e-07,COMPLETE
87,1.1198504501011581,4.6517686636252975,2.5951392965533358,2023-05-15 23:10:48.762613,2023-05-15 23:42:48.791823,0 days 00:32:00.029210,4.905720662390903e-06,linknet,negone,18,logcosh,1.3106341895431222e-08,COMPLETE
88,32.72115702676542,6.431494444368609,3.0281208257801913,2023-05-15 23:20:35.588665,2023-05-15 23:24:01.398402,0 days 00:03:25.809737,0.00929281161418972,pspnet,zscore,13,huber,6.582839754379622e-10,COMPLETE
89,147.57001188748575,12056.507611742445,162.33530580550791,2023-05-15 23:24:01.563225,2023-05-15 23:26:56.993174,0 days 00:02:55.429949,0.0001580488864531804,fpn,None,46,smooth,1.900307759627449e-05,COMPLETE
90,35.613485373891315,12079.573756458907,162.49058590976657,2023-05-15 23:26:57.113026,2023-05-15 23:29:46.452746,0 days 00:02:49.339720,0.0001751592278721706,manet,None,70,mse,2.834644543541862e-12,COMPLETE
91,9297.411825686968,12056.507611742445,162.33530580550791,2023-05-15 23:29:46.566179,2023-05-15 23:32:21.031108,0 days 00:02:34.464929,0.004962861488763251,deeplabv3,None,52,mse,2.691359874908621e-08,COMPLETE
92,1.2294641488708884,5.02242656018898,2.5955528989484304,2023-05-15 23:32:21.164207,2023-05-15 23:45:42.806130,0 days 00:13:21.641923,2.977693129474864e-06,deeplabv3,zscore,97,xtanh,8.450621633455464e-06,COMPLETE
93,1.0863801832868576,1.610728225155834,1.3585409922969605,2023-05-15 23:42:48.962913,2023-05-15 23:58:04.016739,0 days 00:15:15.053826,5.147498376145928e-05,fpn,negone,104,smooth,3.597325254016482e-06,COMPLETE
94,25.019574540824557,12121.434409212174,162.77196465395133,2023-05-15 23:45:42.958561,2023-05-15 23:48:04.577408,0 days 00:02:21.618847,0.0002060117729654799,unet,None,90,mae,0.0007136982976987652,COMPLETE
95,14.520674544761993,12056.642526819503,162.3362127090091,2023-05-15 23:48:04.685743,2023-05-15 23:52:17.577177,0 days 00:04:12.891434,0.0054514443743185394,unet++,None,99,smooth,2.33779976958586e-11,COMPLETE
96,1.1932690567337354,3.7687278898014376,2.1498153623563563,2023-05-15 23:52:17.685387,2023-05-16 00:12:29.355128,0 days 00:20:11.669741,1.6422996865997474e-05,fpn,zscore,46,smooth,4.547659598285072e-09,COMPLETE
97,0.992608650415982,0.7484277230083016,0.9878152736819777,2023-05-15 23:58:04.150394,2023-05-16 00:32:17.371833,0 days 00:34:13.221439,3.1805174141372966e-06,unet++,minmax,43,xsigmoid,3.6903146541493926e-10,COMPLETE
98,26747.16715303372,12073.98243654154,162.45275631778873,2023-05-16 00:12:29.669632,2023-05-16 00:15:22.766056,0 days 00:02:53.096424,0.000390877528064621,unet,None,34,huber,0.00028132642574449736,COMPLETE
99,14.77941067265319,12060.845983717183,162.36473460715894,2023-05-16 00:15:22.891890,2023-05-16 00:19:07.586762,0 days 00:03:44.694872,0.0005024417053441236,manet,None,35,smooth,6.418056749538174e-10,COMPLETE
100,3.5650165313879536,12069.879804829929,162.42603086963646,2023-05-16 00:19:07.729933,2023-05-16 00:23:38.563683,0 days 00:04:30.833750,1.3860744890608772e-05,deeplabv3,None,14,xsigmoid,2.6458786925298e-07,COMPLETE
